src/kernels/gfx900_64.cd.pdb.txt
480-14-14-1x1-64-14-14-256-0x0-1x1-1x1-0-NCHW-FP32-B=ConvAsm1x1U:1,32,1,32,2,1,2,2;ConvOclDirectFwd1x1:1,256,1,1,0,4,16,8,0
416-880-5-1x1-1472-880-5-12-0x0-1x1-1x1-0-NCHW-FP32-W=ConvAsmBwdWrW1x1:2,8,4,4,8,1,1,2,0,1
256-29-29-1x1-512-29-29-16-0x0-1x1-1x1-0-NCHW-FP32-F=ConvAsm1x1U:2,16,2,64,2,2,4,1;ConvOclDirectFwd1x1:1,64,1,1,1,0,16,2048,0
1000-309-39-1x1-464-309-39-1-0x0-1x1-1x1-0-NCHW-FP32-B=ConvOclDirectFwd1x1:1,256,1,1,0,1,16,4,0
112-14-14-3x3-224-14-14-4-1x1-1x1-1x1-0-NCHW-FP16-F=ConvOclDirectFwd:16,16,16,16,1,1,2,4,2;ConvOclDirectFwdFused:16,16,16,16,1,1,4,4,2
1000-384-121-1x1-816-384-121-8-0x0-1x1-1x1-0-NCHW-FP32-B=ConvOclDirectFwd1x1:1,128,1,1,0,2,16,8,0
448-258-520-1x1-8-258-520-6-0x0-1x1-1x1-0-NCHW-FP32-F=ConvOclDirectFwd1x1:1,256,1,1,0,4,16,4,0
512-7-7-3x3-512-7-7-32-1x1-1x1-1x1-0-NCHW-FP16-B=ConvOclDirectFwd:8,8,8,8,1,1,4,1,2
960-11-656-1x1-160-11-656-1-0x0-1x1-1x1-0-NCHW-FP32-F=ConvOclDirectFwd1x1:1,64,1,1,1,4,64,256,0
768-39-463-1x1-992-39-463-16-0x0-1x1-1x1-0-NCHW-FP32-B=ConvOclDirectFwd1x1:1,256,1,1,0,1,32,4,0
54-55-55-1x1-24-55-55-8-0x0-1x1-1x1-0-NCHW-FP32-B=ConvAsm1x1U:1,8,1,32,2,2,1,2;ConvOclDirectFwd1x1:1,256,1,1,0,1,8,4,0
58-9-69-1x1-1776-9-69-1-0x0-1x1-1x1-0-NCHW-FP32-W=ConvAsmBwdWrW1x1:2,8,2,8,2,1,1,2,0,1
224-62-522-1x1-8-62-522-4-0x0-1x1-1x1-0-NCHW-FP32-F=ConvOclDirectFwd1x1:1,256,1,1,0,4,16,8,0
128-7-7-1x1-640-7-7-64-0x0-1x1-1x1-0-NCHW-FP16-F=ConvAsm1x1U:1,8,2,32,1,4,1,8;ConvOclDirectFwd1x1:8,64,8,8,0,1,16,4,1
54-730-848-1x1-1-730-848-4-0x0-1x1-1x1-0-NCHW-FP32-B=ConvOclDirectFwd1x1:1,256,1,1,0,4,16,4,0
1024-7-7-3x3-1024-14-14-48-1x1-2x2-1x1-0-NCHW-FP32-W_g32=ConvOclBwdWrW2<2>:1,7,8,1,7;ConvOclBwdWrW2<8>:1,7,8,1,7;ConvAsmBwdWrW3x3:0,0,8,8,8,1;ConvOclBwdWrW2<1>:1,7,8,1,7;ConvOclBwdWrW2<16>:1,7,8,1,7;ConvOclBwdWrW2<4>:1,7,8,1,7
256-17-17-3x3-224-35-35-1-0x0-2x2-1x1-0-NCHW-FP32-B=ConvOclDirectFwd:8,16,32,32,4,2,4,4,1
512-7-7-1x1-128-7-7-32-0x0-1x1-1x1-0-NCHW-FP16-F=ConvAsm1x1U:1,8,2,32,1,4,4,4;ConvOclDirectFwd1x1:1,64,1,1,0,1,8,8,0
24-32-558-1x1-58-32-558-48-0x0-1x1-1x1-0-NCHW-FP32-W=ConvAsmBwdWrW1x1:4,4,2,2,2,1,4,4,0,1
96-14-14-1x1-576-14-14-32-0x0-1x1-1x1-0-NCHW-FP32-W=ConvAsmBwdWrW1x1:1,16,2,4,8,1,4,4,0,1
2-646-782-1x1-1056-646-782-1-0x0-1x1-1x1-0-NCHW-FP32-F=ConvOclDirectFwd1x1:1,256,1,1,0,4,16,4,0
120-14-14-3x3-120-14-14-4-1x1-1x1-1x1-0-NCHW-FP32-W=ConvAsmBwdWrW3x3:0,1,8,2,3,1
144-554-744-1x1-48-554-744-4-0x0-1x1-1x1-0-NCHW-FP32-B=ConvOclDirectFwd1x1:1,128,1,1,0,4,16,8,0
256-17-17-3x3-224-35-35-32-0x0-2x2-1x1-0-NCHW-FP32-B=ConvOclDirectFwd:16,16,16,16,1,1,4,1,2
160-114-972-1x1-160-114-972-6-0x0-1x1-1x1-0-NCHW-FP32-B=ConvOclDirectFwd1x1:1,64,1,1,0,2,32,4,0
128-14-14-1x1-576-14-14-128-0x0-1x1-1x1-0-NCHW-FP16-W=ConvAsmBwdWrW1x1:2,8,2,8,2,1,4,4,0,2
144-896-138-1x1-224-896-138-16-0x0-1x1-1x1-0-NCHW-FP32-F=ConvOclDirectFwd1x1:1,64,1,1,1,4,64,2048,0
704-7-7-1x1-128-7-7-16-0x0-1x1-1x1-0-NCHW-FP16-F=ConvAsm1x1U:1,8,2,32,1,4,4,2;ConvOclDirectFwd1x1:1,64,1,1,0,1,4,8,0
800-14-14-1x1-128-14-14-512-0x0-1x1-1x1-0-NCHW-FP32-B=ConvAsm1x1U:1,32,1,16,2,1,2,2;ConvOclDirectFwd1x1:1,128,1,1,0,1,32,4,0
512-14-14-1x1-64-14-14-8-0x0-1x1-1x1-0-NCHW-FP32-F=ConvAsm1x1U:2,8,2,64,1,4,4,2;ConvOclDirectFwd1x1:1,64,1,1,1,4,16,64,0;ConvActivAsm1x1U:1,16,2,64,1,4
256-28-28-1x1-512-28-28-4-0x0-1x1-1x1-0-NCHW-FP32-F=ConvAsm1x1U:4,8,4,32,1,4,1,4;ConvOclDirectFwd1x1:1,64,1,1,1,4,16,2048,0
512-14-14-1x1-32-14-14-128-0x0-1x1-1x1-0-NCHW-FP32-F=ConvAsm1x1U:2,16,2,64,1,2,2,1;ConvOclDirectFwd1x1:1,64,1,1,1,0,16,2048,0;ConvActivAsm1x1U:2,16,2,64,2,3
384-624-10-1x1-704-624-10-32-0x0-1x1-1x1-0-NCHW-FP32-F=ConvOclDirectFwd1x1:1,64,1,1,1,0,16,2048,0
224-221-337-1x1-128-221-337-12-0x0-1x1-1x1-0-NCHW-FP32-F=ConvOclDirectFwd1x1:1,64,1,1,1,0,32,2048,0
128-7-7-1x1-992-7-7-256-0x0-1x1-1x1-0-NCHW-FP16-F=ConvAsm1x1U:2,8,4,16,1,4,2,1;ConvOclDirectFwd1x1:1,128,1,1,0,1,16,4,0
928-7-7-1x1-128-7-7-32-0x0-1x1-1x1-0-NCHW-FP32-B=ConvAsm1x1U:1,16,1,64,1,2,4,4;ConvOclDirectFwd1x1:1,128,1,1,0,1,4,8,0
1104-68-709-1x1-1488-68-709-1-0x0-1x1-1x1-0-NCHW-FP32-B=ConvOclDirectFwd1x1:1,128,1,1,0,2,16,8,0
232-324-288-1x1-1120-324-288-2-0x0-1x1-1x1-0-NCHW-FP32-B=ConvOclDirectFwd1x1:1,256,1,1,0,1,32,4,0
80-359-129-1x1-16-359-129-8-0x0-1x1-1x1-0-NCHW-FP32-F=ConvAsm1x1U:1,16,3,64,2,2,1,1;ConvOclDirectFwd1x1:1,64,1,1,1,4,64,128,0
58-148-385-1x1-19-148-385-12-0x0-1x1-1x1-0-NCHW-FP32-F=ConvAsm1x1U:1,16,6,32,1,1,1,1;ConvOclDirectFwd1x1:1,256,1,1,0,2,16,4,0
160-28-28-1x1-128-28-28-64-0x0-1x1-1x1-0-NCHW-FP32-B=ConvAsm1x1U:2,16,2,32,1,2,2,2;ConvOclDirectFwd1x1:1,256,1,1,0,4,16,4,0
192-147-207-1x1-2-147-207-4-0x0-1x1-1x1-0-NCHW-FP32-W=ConvAsmBwdWrW1x1:4,4,4,2,2,1,4,4,0,1
192-8-8-1x1-1280-8-8-8-0x0-1x1-1x1-0-NCHW-FP32-B=ConvAsm1x1U:1,8,1,32,1,4,1,4;ConvOclDirectFwd1x1:1,128,1,1,0,2,8,8,0
144-479-875-1x1-19-479-875-2-0x0-1x1-1x1-0-NCHW-FP32-F=ConvOclDirectFwd1x1:1,256,1,1,0,1,16,4,0
256-56-56-1x1-128-56-56-64-0x0-1x1-1x1-0-NCHW-FP16-B=ConvAsm1x1U:1,16,2,64,1,2,1,4;ConvOclDirectFwd1x1:1,256,1,1,0,4,16,4,0
512-14-14-1x1-24-14-14-1-0x0-1x1-1x1-0-NCHW-FP16-F=ConvAsm1x1U:1,8,2,16,1,4,4,1;ConvOclDirectFwd1x1:1,64,1,1,0,4,4,8,0
192-27-27-1x1-48-27-27-512-0x0-1x1-1x1-0-NCHW-FP16-F=ConvAsm1x1U:3,8,6,64,1,4,1,2;ConvOclDirectFwd1x1:1,256,1,1,0,1,16,8,0
1024-7-7-1x1-464-7-7-1-0x0-1x1-1x1-0-NCHW-FP32-W=ConvAsmBwdWrW1x1:1,16,4,4,2,1,1,2,0,1
480-14-14-1x1-120-14-14-4-0x0-1x1-1x1-0-NCHW-FP16-F_g3=ConvOclDirectFwd:8,8,8,8,1,1,4,2,2
60-28-28-3x3-60-28-28-8-1x1-1x1-1x1-0-NCHW-FP32-W=ConvAsmBwdWrW3x3:0,0,16,2,2,2
1200-641-324-1x1-992-641-324-1-0x0-1x1-1x1-0-NCHW-FP32-F=ConvOclDirectFwd1x1:1,64,1,1,1,0,64,2048,0
672-72-415-1x1-2016-72-415-8-0x0-1x1-1x1-0-NCHW-FP32-B=ConvOclDirectFwd1x1:1,256,1,1,0,2,32,4,0
736-14-14-1x1-128-14-14-64-0x0-1x1-1x1-0-NCHW-FP16-W=ConvAsmBwdWrW1x1:1,16,2,8,2,1,4,4,0,1
128-28-28-3x3-128-28-28-1-1x1-1x1-1x1-0-NCHW-FP16-B=ConvOclDirectFwd:16,16,16,16,1,1,2,4,1
128-39-174-5x5-64-80-350-8-1x1-2x2-1x1-0-NCHW-FP32-W=ConvOclBwdWrW2<1>:3,6,8,1,5;ConvOclBwdWrW2<2>:3,8,3,3,5;ConvOclBwdWrW2<4>:8,7,1,3,5;ConvOclBwdWrW2<8>:3,6,3,3,5
160-28-28-1x1-128-28-28-64-0x0-1x1-1x1-0-NCHW-FP32-W=ConvAsmBwdWrW1x1:2,8,2,8,2,2,4,4,0,0
96-35-35-3x3-96-35-35-1-1x1-1x1-1x1-0-NCHW-FP16-F=ConvOclDirectFwd:16,16,16,16,1,1,4,4,1;ConvOclDirectFwdFused:16,16,16,16,1,1,4,4,1
96-28-28-3x3-128-28-28-512-1x1-1x1-1x1-0-NCHW-FP16-F=ConvOclDirectFwd:32,8,32,32,1,4,8,1,1;ConvOclDirectFwdFused:16,16,32,32,2,2,8,1,1
54-311-859-1x1-32-311-859-4-0x0-1x1-1x1-0-NCHW-FP32-W=ConvAsmBwdWrW1x1:4,4,2,4,2,1,4,4,0,1
48-299-157-1x1-1344-299-157-1-0x0-1x1-1x1-0-NCHW-FP32-B=ConvOclDirectFwd1x1:1,256,1,1,0,1,32,4,0
640-27-219-1x1-1104-27-219-64-0x0-1x1-1x1-0-NCHW-FP32-B=ConvOclDirectFwd1x1:1,256,1,1,0,1,16,8,0
60-14-14-1x1-240-14-14-4-0x0-1x1-1x1-0-NCHW-FP32-F_g3=ConvOclDirectFwd:8,8,8,8,1,1,8,4,2
1440-704-201-1x1-672-704-201-2-0x0-1x1-1x1-0-NCHW-FP32-F=ConvOclDirectFwd1x1:1,64,1,1,1,4,16,2048,0
576-310-308-1x1-928-310-308-1-0x0-1x1-1x1-0-NCHW-FP32-B=ConvOclDirectFwd1x1:1,256,1,1,0,1,32,4,0
16-482-956-1x1-232-482-956-2-0x0-1x1-1x1-0-NCHW-FP32-B=ConvOclDirectFwd1x1:1,64,1,1,0,2,16,8,0
528-695-185-1x1-256-695-185-1-0x0-1x1-1x1-0-NCHW-FP32-F=ConvOclDirectFwd1x1:1,64,1,1,1,1,32,2048,0
352-468-225-1x1-24-468-225-8-0x0-1x1-1x1-0-NCHW-FP32-B=ConvOclDirectFwd1x1:1,256,1,1,0,1,16,4,0
48-27-27-1x1-192-27-27-128-0x0-1x1-1x1-0-NCHW-FP32-B=ConvAsm1x1U:1,16,1,64,1,2,2,2;ConvOclDirectFwd1x1:1,256,1,1,0,1,32,4,0
96-28-28-1x1-192-28-28-8-0x0-1x1-1x1-0-NCHW-FP32-W=ConvAsmBwdWrW1x1:4,4,4,4,4,1,2,4,0,1
58-28-28-1x1-24-28-28-1-0x0-1x1-1x1-0-NCHW-FP16-B=ConvAsm1x1U:1,8,2,16,1,2,1,1;ConvOclDirectFwd1x1:1,64,1,1,0,2,16,4,0
416-159-544-1x1-288-159-544-1-0x0-1x1-1x1-0-NCHW-FP32-F=ConvOclDirectFwd1x1:1,64,1,1,1,4,64,2048,0
128-7-7-5x5-32-7-7-512-2x2-1x1-1x1-0-NCHW-FP32-B=ConvOclDirectFwd:8,8,8,8,1,1,8,2,1
128-14-14-1x1-864-14-14-16-0x0-1x1-1x1-0-NCHW-FP32-F=ConvAsm1x1U:2,16,2,16,2,2,2,2;ConvOclDirectFwd1x1:1,64,1,1,1,1,16,256,0
512-28-28-1x1-256-56-56-4-0x0-2x2-1x1-0-NCHW-FP32-B=ConvAsm1x1U:1,16,1,16,1,2,2,1;ConvOclDirectFwd1x1:1,256,1,1,0,1,32,4,0
416-14-14-1x1-128-14-14-32-0x0-1x1-1x1-0-NCHW-FP32-B=ConvAsm1x1U:2,16,2,64,1,2,2,1;ConvOclDirectFwd1x1:1,256,1,1,0,4,16,4,0
720-28-28-1x1-192-28-28-16-0x0-1x1-1x1-0-NCHW-FP32-F=ConvAsm1x1U:2,16,5,32,1,2,1,4;ConvOclDirectFwd1x1:1,64,1,1,1,1,16,2048,0;ConvActivAsm1x1U:3,16,5,32,2,1
352-28-28-1x1-128-28-28-256-0x0-1x1-1x1-0-NCHW-FP16-F=ConvAsm1x1U:1,8,2,16,2,4,1,8;ConvOclDirectFwd1x1:1,64,1,1,0,4,16,4,0
128-28-28-1x1-448-28-28-32-0x0-1x1-1x1-0-NCHW-FP32-F=ConvAsm1x1U:1,16,1,32,4,2,1,1;ConvOclDirectFwd1x1:1,64,1,1,1,4,16,256,0
480-170-188-1x1-16-170-188-16-0x0-1x1-1x1-0-NCHW-FP32-W=ConvAsmBwdWrW1x1:4,4,2,1,2,1,1,2,0,1
32-149-149-3x3-3-299-299-8-0x0-2x2-1x1-0-NCHW-FP32-B=ConvOclDirectFwd:16,16,32,32,2,2,8,2,1
576-7-7-1x1-128-7-7-512-0x0-1x1-1x1-0-NCHW-FP32-F=ConvAsm1x1U:2,16,2,32,2,2,2,2;ConvOclDirectFwd1x1:1,64,1,1,1,4,32,2048,0
64-35-35-1x1-288-35-35-128-0x0-1x1-1x1-0-NCHW-FP16-W=ConvAsmBwdWrW1x1:4,4,8,4,2,2,2,4,0,1
128-28-28-3x3-128-28-28-2-1x1-1x1-1x1-0-NCHW-FP16-F=ConvOclDirectFwd:16,16,16,32,1,2,4,4,2
128-14-14-1x1-864-14-14-512-0x0-1x1-1x1-0-NCHW-FP16-W=ConvAsmBwdWrW1x1:2,8,4,8,2,1,2,4,0,1
24-56-56-1x1-58-56-56-512-0x0-1x1-1x1-0-NCHW-FP32-F=ConvAsm1x1U:1,8,1,16,1,1,1,1;ConvOclDirectFwd1x1:1,128,1,1,0,1,16,4,0
448-730-448-1x1-624-730-448-1-0x0-1x1-1x1-0-NCHW-FP32-B=ConvOclDirectFwd1x1:1,256,1,1,0,1,16,8,0
1888-312-564-1x1-96-312-564-1-0x0-1x1-1x1-0-NCHW-FP32-F=ConvOclDirectFwd1x1:1,64,1,1,1,1,64,2048,0
1000-37-88-1x1-1104-37-88-6-0x0-1x1-1x1-0-NCHW-FP32-W=ConvAsmBwdWrW1x1:2,8,8,4,4,1,1,4,0,1
640-7-7-1x1-128-7-7-256-0x0-1x1-1x1-0-NCHW-FP16-F=ConvAsm1x1U:2,8,4,16,1,4,4,1;ConvOclDirectFwd1x1:1,64,1,1,0,1,16,4,0
992-2-524-1x1-232-2-524-32-0x0-1x1-1x1-0-NCHW-FP32-F=ConvAsm1x1U:2,16,6,64,2,2,1,1;ConvOclDirectFwd1x1:1,256,1,1,0,4,16,8,0
128-17-17-1x1-1024-17-17-64-0x0-1x1-1x1-0-NCHW-FP16-W=ConvAsmBwdWrW1x1:2,8,4,8,2,1,2,4,0,1
384-64-128-1x1-832-64-128-1-0x0-1x1-1x1-0-NCHW-FP32-W=ConvAsmBwdWrW1x1:2,8,2,8,4,1,2,4,0,2
128-17-17-1x1-1024-17-17-4-0x0-1x1-1x1-0-NCHW-FP32-B=ConvAsm1x1U:1,16,1,64,2,2,2,2;ConvOclDirectFwd1x1:1,256,1,1,0,1,8,4,0
256-109-175-3x3-256-109-175-64-1x1-1x1-1x1-0-NCHW-FP16-F=ConvOclDirectFwd:8,8,16,16,2,2,8,2,1
128-14-14-1x1-544-14-14-128-0x0-1x1-1x1-0-NCHW-FP16-W=ConvAsmBwdWrW1x1:2,8,2,8,2,1,4,4,0,1
128-17-17-1x1-1024-17-17-256-0x0-1x1-1x1-0-NCHW-FP16-F=ConvAsm1x1U:2,16,4,16,1,2,1,4;ConvOclDirectFwd1x1:1,128,1,1,0,1,16,4,0
512-28-28-1x1-128-28-28-64-0x0-1x1-1x1-0-NCHW-FP16-B=ConvAsm1x1U:1,8,2,32,1,4,1,4;ConvOclDirectFwd1x1:1,256,1,1,0,2,32,8,0
24-5-5-3x3-256-5-5-64-1x1-1x1-1x1-0-NCHW-FP32-W=ConvAsmBwdWrW3x3:0,0,8,2,5,3
24-55-55-1x1-54-55-55-1-0x0-1x1-1x1-0-NCHW-FP32-F=ConvAsm1x1U:1,8,1,64,1,2,1,1;ConvOclDirectFwd1x1:1,64,1,1,0,1,8,8,0
32-279-425-1x1-8-279-425-16-0x0-1x1-1x1-0-NCHW-FP32-B=ConvAsm1x1U:1,8,1,16,1,1,1,1;ConvOclDirectFwd1x1:1,256,1,1,0,1,16,8,0
128-14-14-1x1-960-14-14-256-0x0-1x1-1x1-0-NCHW-FP16-W=ConvAsmBwdWrW1x1:2,8,4,8,2,1,2,4,0,1
128-14-14-1x1-800-14-14-512-0x0-1x1-1x1-0-NCHW-FP16-W=ConvAsmBwdWrW1x1:2,8,4,8,2,1,2,2,0,2
256-56-56-3x3-128-56-56-2-1x1-1x1-1x1-0-NCHW-FP32-W=ConvAsmBwdWrW3x3:0,1,16,4,3,1
1632-195-480-1x1-288-195-480-1-0x0-1x1-1x1-0-NCHW-FP32-F=ConvOclDirectFwd1x1:1,64,1,1,1,4,64,2048,0
1888-417-12-1x1-768-417-12-8-0x0-1x1-1x1-0-NCHW-FP32-F=ConvOclDirectFwd1x1:1,64,1,1,1,1,16,2048,0
116-185-258-1x1-19-185-258-32-0x0-1x1-1x1-0-NCHW-FP32-F=ConvOclDirectFwd1x1:1,256,1,1,0,2,16,4,0
3-300-300-7x7-64-150-150-64-3x3-2x2-1x1-0-NCHW-FP32-F=ConvOclDirectFwd:32,8,32,32,1,4,8,1,2
128-7-7-1x1-960-7-7-64-0x0-1x1-1x1-0-NCHW-FP32-F=ConvAsm1x1U:1,8,1,64,4,4,1,4;ConvOclDirectFwd1x1:1,64,1,1,1,1,16,256,0
128-28-28-1x1-512-28-28-16-0x0-1x1-1x1-0-NCHW-FP32-W=ConvAsmBwdWrW1x1:4,4,4,4,4,1,1,4,0,1
512-28-28-1x1-256-28-28-48-0x0-1x1-1x1-0-NCHW-FP32-B=ConvAsm1x1U:2,16,2,64,1,2,1,4;ConvOclDirectFwd1x1:1,64,1,1,0,2,32,4,0
896-16-315-1x1-480-16-315-1-0x0-1x1-1x1-0-NCHW-FP32-W=ConvAsmBwdWrW1x1:1,16,4,4,8,1,1,4,0,1
160-1021-31-1x1-864-1021-31-4-0x0-1x1-1x1-0-NCHW-FP32-F=ConvOclDirectFwd1x1:1,64,1,1,1,4,64,256,0
256-28-28-1x1-32-28-28-64-0x0-1x1-1x1-0-NCHW-FP16-F=ConvAsm1x1U:1,8,2,16,1,4,2,2;ConvOclDirectFwd1x1:1,64,1,1,0,4,16,4,0
1280-2-552-1x1-144-2-552-256-0x0-1x1-1x1-0-NCHW-FP32-F=ConvAsm1x1U:2,16,5,32,2,1,1,1;ConvOclDirectFwd1x1:1,64,1,1,1,1,64,2048,0
256-29-29-3x3-256-29-29-2-1x1-1x1-1x1-0-NCHW-FP32-F_g32=ConvOclDirectFwd:16,16,16,16,1,1,8,2,2
992-7-7-1x1-128-7-7-32-0x0-1x1-1x1-0-NCHW-FP32-B=ConvAsm1x1U:1,16,1,64,1,2,4,1;ConvOclDirectFwd1x1:1,64,1,1,0,1,8,8,0
144-564-168-1x1-384-564-168-6-0x0-1x1-1x1-0-NCHW-FP32-F=ConvOclDirectFwd1x1:1,64,1,1,1,0,32,2048,0
384-47-409-1x1-336-47-409-8-0x0-1x1-1x1-0-NCHW-FP32-B=ConvOclDirectFwd1x1:1,128,1,1,0,1,16,4,0
128-7-7-3x3-32-7-7-32-1x1-1x1-1x1-0-NCHW-FP16-W=ConvAsmBwdWrW3x3:0,0,8,2,7,4
1408-233-183-1x1-544-233-183-4-0x0-1x1-1x1-0-NCHW-FP32-F=ConvOclDirectFwd1x1:1,64,1,1,1,4,64,2048,0
128-14-14-1x1-928-14-14-16-0x0-1x1-1x1-0-NCHW-FP32-F=ConvAsm1x1U:2,16,2,16,2,2,2,2;ConvOclDirectFwd1x1:1,64,1,1,1,1,16,2048,0
1024-7-7-3x3-1024-7-7-6-1x1-1x1-1x1-0-NCHW-FP32-B_g32=ConvOclDirectFwd:8,8,8,8,1,1,8,4,2
4-157-1019-1x1-64-157-1019-32-0x0-1x1-1x1-0-NCHW-FP32-F=ConvOclDirectFwd1x1:1,256,1,1,0,1,32,4,0
512-14-14-1x1-160-14-14-128-0x0-1x1-1x1-0-NCHW-FP16-F=ConvAsm1x1U:2,8,4,64,1,4,2,2;ConvOclDirectFwd1x1:1,256,1,1,0,4,16,4,0
2048-7-7-1x1-1024-14-14-128-0x0-2x2-1x1-0-NCHW-FP16-W=ConvAsmBwdWrW1x1:1,16,4,8,2,1,1,2,0,2
128-28-28-1x1-416-28-28-16-0x0-1x1-1x1-0-NCHW-FP32-F=ConvAsm1x1U:2,16,2,32,3,2,1,2;ConvOclDirectFwd1x1:1,64,1,1,1,0,16,256,0
608-36-291-1x1-416-36-291-6-0x0-1x1-1x1-0-NCHW-FP32-B=ConvOclDirectFwd1x1:1,64,1,1,0,2,32,4,0
960-818-5-1x1-2-818-5-4-0x0-1x1-1x1-0-NCHW-FP32-W=ConvAsmBwdWrW1x1:4,4,2,2,2,2,2,4,0,1
64-57-57-1x1-256-57-57-4-0x0-1x1-1x1-0-NCHW-FP32-F=ConvAsm1x1U:1,8,1,64,1,4,2,2;ConvOclDirectFwd1x1:1,64,1,1,1,1,32,64,0
8-441-380-1x1-4-441-380-1-0x0-1x1-1x1-0-NCHW-FP32-W=ConvAsmBwdWrW1x1:4,4,2,1,2,1,1,4,0,3
736-7-7-1x1-128-7-7-256-0x0-1x1-1x1-0-NCHW-FP16-B=ConvAsm1x1U:2,8,4,16,1,4,4,1;ConvOclDirectFwd1x1:1,64,1,1,0,1,16,4,0
256-29-29-1x1-512-29-29-48-0x0-1x1-1x1-0-NCHW-FP32-W=ConvAsmBwdWrW1x1:1,16,2,8,2,1,1,4,0,2
128-28-28-3x3-192-28-28-32-1x1-1x1-1x1-0-NCHW-FP16-F=ConvOclDirectFwd:16,16,32,32,2,2,8,1,1;ConvOclDirectFwdFused:16,16,32,32,2,2,8,1,2
32-28-28-1x1-256-28-28-256-0x0-1x1-1x1-0-NCHW-FP16-B=ConvAsm1x1U:1,16,2,16,1,2,1,4;ConvOclDirectFwd1x1:1,256,1,1,0,2,32,4,0
256-29-985-1x1-192-29-985-2-0x0-1x1-1x1-0-NCHW-FP32-B=ConvOclDirectFwd1x1:1,256,1,1,0,1,32,4,0
48-418-751-1x1-4-418-751-32-0x0-1x1-1x1-0-NCHW-FP32-F=ConvOclDirectFwd1x1:1,256,1,1,0,2,8,8,0
224-28-28-1x1-128-28-28-16-0x0-1x1-1x1-0-NCHW-FP32-F=ConvAsm1x1U:3,16,3,16,1,2,2,2;ConvOclDirectFwd1x1:1,64,1,1,1,0,32,2048,0
128-28-28-3x3-32-28-28-64-1x1-1x1-1x1-0-NCHW-FP32-W=ConvAsmBwdWrW3x3:0,0,8,4,6,4
16-248-344-1x1-608-248-344-6-0x0-1x1-1x1-0-NCHW-FP32-B=ConvOclDirectFwd1x1:1,256,1,1,0,2,32,4,0
864-555-22-1x1-144-555-22-2-0x0-1x1-1x1-0-NCHW-FP32-W=ConvAsmBwdWrW1x1:4,4,4,4,8,1,1,4,0,0
224-920-172-1x1-160-920-172-1-0x0-1x1-1x1-0-NCHW-FP32-B=ConvOclDirectFwd1x1:1,128,1,1,0,1,32,4,0
288-12-413-1x1-384-12-413-64-0x0-1x1-1x1-0-NCHW-FP32-B=ConvAsm1x1U:1,32,3,64,1,1,1,1;ConvOclDirectFwd1x1:1,256,1,1,0,2,32,4,0
448-13-660-1x1-704-13-660-6-0x0-1x1-1x1-0-NCHW-FP32-F=ConvOclDirectFwd1x1:1,64,1,1,1,1,16,2048,0
256-17-17-1x1-1024-17-17-64-0x0-1x1-1x1-0-NCHW-FP16-B=ConvAsm1x1U:1,16,2,32,1,2,1,2;ConvOclDirectFwd1x1:1,64,1,1,0,1,16,4,0
1664-924-81-1x1-96-924-81-2-0x0-1x1-1x1-0-NCHW-FP32-F=ConvOclDirectFwd1x1:1,64,1,1,1,4,64,2048,0
4-800-218-1x1-576-800-218-2-0x0-1x1-1x1-0-NCHW-FP32-B=ConvOclDirectFwd1x1:1,256,1,1,0,4,16,4,0
128-40-175-3x3-128-40-175-1-1x1-1x1-1x1-0-NCHW-FP16-F=ConvOclDirectFwd:8,32,16,32,2,1,8,4,1
832-7-7-1x1-384-7-7-4-0x0-1x1-1x1-0-NCHW-FP16-F=ConvAsm1x1U:1,8,2,16,1,4,4,1;ConvOclDirectFwd1x1:1,128,1,1,0,1,4,8,0
448-83-614-1x1-1152-83-614-8-0x0-1x1-1x1-0-NCHW-FP32-B=ConvOclDirectFwd1x1:1,256,1,1,0,1,32,4,0
512-28-28-1x1-128-28-28-2-0x0-1x1-1x1-0-NCHW-FP32-W=ConvAsmBwdWrW1x1:2,8,2,4,2,1,1,4,0,1
352-2-992-1x1-336-2-992-2-0x0-1x1-1x1-0-NCHW-FP32-B=ConvAsm1x1U:3,16,3,64,1,2,2,1;ConvOclDirectFwd1x1:1,256,1,1,0,4,8,4,0
5-10-10-3x3-3-10-10-64-1x1-1x1-1x1-0-NCHW-FP16-B=ConvOclDirectFwd:8,16,16,16,2,1,1,2,2
384-13-13-3x3-384-13-13-8-1x1-1x1-1x1-0-NCHW-FP16-B=ConvOclDirectFwd:16,8,16,16,1,2,4,2,2
1104-152-155-1x1-1280-152-155-1-0x0-1x1-1x1-0-NCHW-FP32-F=ConvOclDirectFwd1x1:1,64,1,1,1,0,16,2048,0
24-28-28-1x1-58-28-28-8-0x0-1x1-1x1-0-NCHW-FP16-F=ConvAsm1x1U:1,8,2,16,1,2,1,1;ConvOclDirectFwd1x1:1,256,1,1,0,2,16,4,0
32-725-33-1x1-4-725-33-12-0x0-1x1-1x1-0-NCHW-FP32-F=ConvAsm1x1U:3,4,4,4,1,1,1,1;ConvOclDirectFwd1x1:1,256,1,1,0,1,4,8,0
64-498-963-1x1-58-498-963-16-0x0-1x1-1x1-0-NCHW-FP32-F=ConvOclDirectFwd1x1:1,256,1,1,0,1,8,4,0
16-54-54-3x3-64-54-54-32-1x1-1x1-1x1-0-NCHW-FP16-B=ConvOclDirectFwd:16,16,32,32,2,2,8,1,2
116-28-28-1x1-116-28-28-64-0x0-1x1-1x1-0-NCHW-FP16-W=ConvAsmBwdWrW1x1:4,4,4,1,8,1,2,4,0,1
160-920-172-1x1-224-920-172-1-0x0-1x1-1x1-0-NCHW-FP32-F=ConvOclDirectFwd1x1:1,64,1,1,1,4,64,2048,0
480-28-28-1x1-128-28-28-64-0x0-1x1-1x1-0-NCHW-FP32-B=ConvAsm1x1U:2,16,2,32,1,2,2,2;ConvOclDirectFwd1x1:1,128,1,1,0,1,32,4,0
4-168-13-1x1-528-168-13-4-0x0-1x1-1x1-0-NCHW-FP32-B=ConvAsm1x1U:1,8,1,16,1,2,2,1;ConvOclDirectFwd1x1:1,256,1,1,0,1,4,4,0
3-224-224-3x3-64-224-224-1-1x1-1x1-1x1-0-NCHW-FP32-F=ConvOclDirectFwd:8,32,32,32,4,1,4,1,1;ConvOclDirectFwdFused:8,32,32,32,4,1,4,1,1
512-28-28-3x3-256-28-28-64-1x1-1x1-1x1-0-NCHW-FP32-W=ConvAsmBwdWrW3x3:0,1,8,4,2,1
512-995-170-1x1-320-995-170-2-0x0-1x1-1x1-0-NCHW-FP32-B=ConvOclDirectFwd1x1:1,128,1,1,0,1,32,4,0
64-14-14-1x1-576-14-14-64-0x0-1x1-1x1-0-NCHW-FP32-W=ConvAsmBwdWrW1x1:1,16,2,4,8,1,4,4,0,1
1280-419-252-1x1-448-419-252-2-0x0-1x1-1x1-0-NCHW-FP32-F=ConvOclDirectFwd1x1:1,64,1,1,1,4,32,2048,0
608-348-985-1x1-192-348-985-1-0x0-1x1-1x1-0-NCHW-FP32-B=ConvOclDirectFwd1x1:1,256,1,1,0,2,32,4,0
896-7-7-1x1-128-7-7-16-0x0-1x1-1x1-0-NCHW-FP16-W=ConvAsmBwdWrW1x1:2,8,2,8,2,2,2,4,0,0
192-28-28-1x1-128-28-28-32-0x0-1x1-1x1-0-NCHW-FP16-B=ConvAsm1x1U:1,8,2,32,1,4,2,2;ConvOclDirectFwd1x1:1,64,1,1,0,4,16,4,0
128-28-28-1x1-512-14-14-1-0x0-2x2-1x1-0-NCHW-FP32-F=ConvAsm1x1U:1,8,1,64,1,4,4,1;ConvOclDirectFwd1x1:1,64,1,1,1,4,16,64,0
544-207-180-1x1-16-207-180-2-0x0-1x1-1x1-0-NCHW-FP32-B=ConvOclDirectFwd1x1:1,256,1,1,0,2,16,4,0
64-56-56-3x3-64-56-56-1-1x1-1x1-1x1-0-NCHW-FP16-F=ConvOclDirectFwd:16,16,16,16,1,1,4,4,1;ConvOclDirectFwdFused:16,16,16,16,1,1,4,4,1
448-142-831-1x1-1600-142-831-2-0x0-1x1-1x1-0-NCHW-FP32-B=ConvOclDirectFwd1x1:1,128,1,1,0,2,32,4,0
128-7-7-1x1-736-7-7-128-0x0-1x1-1x1-0-NCHW-FP16-F=ConvAsm1x1U:2,8,4,16,1,4,1,4;ConvOclDirectFwd1x1:1,64,1,1,0,1,8,4,0
32-7-7-5x5-128-7-7-8-2x2-1x1-1x1-0-NCHW-FP16-F=ConvOclDirectFwd:8,8,8,8,1,1,2,4,2;ConvOclDirectFwdFused:8,8,8,8,1,1,2,4,2
160-7-7-1x1-1056-7-7-64-0x0-1x1-1x1-0-NCHW-FP32-B=ConvAsm1x1U:1,16,1,64,2,2,2,2;ConvOclDirectFwd1x1:1,64,1,1,0,1,16,4,0
144-797-102-1x1-384-797-102-8-0x0-1x1-1x1-0-NCHW-FP32-B=ConvOclDirectFwd1x1:1,128,1,1,0,2,32,4,0
32-27-27-3x3-128-27-27-16-1x1-1x1-1x1-0-NCHW-FP32-W=ConvAsmBwdWrW3x3:0,0,8,4,2,4
896-59-122-1x1-1440-59-122-12-0x0-1x1-1x1-0-NCHW-FP32-W=ConvAsmBwdWrW1x1:1,16,2,8,8,1,1,4,0,1
704-756-26-1x1-992-756-26-4-0x0-1x1-1x1-0-NCHW-FP32-F=ConvOclDirectFwd1x1:1,64,1,1,1,4,64,2048,0
60-28-28-1x1-240-28-28-2-0x0-1x1-1x1-0-NCHW-FP16-F_g3=ConvOclDirectFwd:16,16,16,16,1,1,8,1,2
1024-7-7-1x1-464-7-7-2-0x0-1x1-1x1-0-NCHW-FP16-B=ConvAsm1x1U:1,8,2,16,1,2,4,1;ConvOclDirectFwd1x1:1,128,1,1,0,1,8,8,0
256-14-14-3x3-128-14-14-8-1x1-1x1-1x1-0-NCHW-FP16-B=ConvOclDirectFwd:16,16,16,16,1,1,4,4,2
64-80-350-5x5-128-39-174-64-1x1-2x2-1x1-0-NCHW-FP32-F=ConvOclDirectFwd:8,16,16,16,2,1,8,1,2
224-6-10-1x1-3-6-10-64-0x0-1x1-1x1-0-NCHW-FP32-W=ConvAsmBwdWrW1x1:4,4,2,1,2,1,2,4,0,1
512-27-550-1x1-528-27-550-2-0x0-1x1-1x1-0-NCHW-FP32-F=ConvOclDirectFwd1x1:1,64,1,1,1,1,64,2048,0
54-474-301-1x1-1200-474-301-2-0x0-1x1-1x1-0-NCHW-FP32-B=ConvOclDirectFwd1x1:1,256,1,1,0,2,16,4,0
256-28-28-1x1-64-28-28-1-0x0-1x1-1x1-0-NCHW-FP32-F=ConvAsm1x1U:1,8,1,64,1,4,4,2;ConvOclDirectFwd1x1:1,64,1,1,1,0,16,64,0;ConvActivAsm1x1U:1,16,1,32,1,4
8-87-75-1x1-1968-87-75-12-0x0-1x1-1x1-0-NCHW-FP32-W=ConvAsmBwdWrW1x1:4,4,8,2,4,1,2,4,0,1
320-7-7-3x3-192-7-7-32-1x1-1x1-1x1-0-NCHW-FP32-W=ConvAsmBwdWrW3x3:0,1,8,2,6,1
128-56-56-3x3-32-56-56-256-1x1-1x1-1x1-0-NCHW-FP32-W=ConvAsmBwdWrW3x3:0,0,8,4,2,8
224-1010-228-1x1-352-1010-228-4-0x0-1x1-1x1-0-NCHW-FP32-F=ConvOclDirectFwd1x1:1,64,1,1,1,4,64,2048,0
80-590-527-1x1-48-590-527-12-0x0-1x1-1x1-0-NCHW-FP32-B=ConvOclDirectFwd1x1:1,256,1,1,0,2,16,8,0
160-874-470-1x1-112-874-470-8-0x0-1x1-1x1-0-NCHW-FP32-F=ConvOclDirectFwd1x1:1,64,1,1,1,4,32,256,0
232-250-178-1x1-864-250-178-2-0x0-1x1-1x1-0-NCHW-FP32-B=ConvOclDirectFwd1x1:1,256,1,1,0,4,16,8,0
24-56-56-1x1-58-56-56-4-0x0-1x1-1x1-0-NCHW-FP16-F=ConvAsm1x1U:1,8,2,16,1,2,1,1;ConvOclDirectFwd1x1:1,256,1,1,0,2,16,4,0
480-28-28-1x1-128-28-28-512-0x0-1x1-1x1-0-NCHW-FP16-B=ConvAsm1x1U:1,16,2,16,1,2,1,4;ConvOclDirectFwd1x1:1,256,1,1,0,4,16,4,0
384-184-357-1x1-1600-184-357-4-0x0-1x1-1x1-0-NCHW-FP32-B=ConvOclDirectFwd1x1:1,64,1,1,0,2,32,4,0
960-399-189-1x1-624-399-189-4-0x0-1x1-1x1-0-NCHW-FP32-B=ConvOclDirectFwd1x1:1,256,1,1,0,1,16,8,0
960-14-14-1x1-128-14-14-256-0x0-1x1-1x1-0-NCHW-FP16-F=ConvAsm1x1U:1,16,2,16,2,2,2,2;ConvOclDirectFwd1x1:1,64,1,1,0,2,16,4,0
128-54-54-1x1-32-54-54-512-0x0-1x1-1x1-0-NCHW-FP32-F=ConvAsm1x1U:3,8,3,64,4,2,1,2;ConvOclDirectFwd1x1:1,64,1,1,1,0,32,256,0
832-7-7-1x1-32-7-7-8-0x0-1x1-1x1-0-NCHW-FP32-F=ConvAsm1x1U:1,8,1,16,1,4,4,1;ConvOclDirectFwd1x1:1,64,1,1,1,1,16,64,0;ConvActivAsm1x1U:1,16,1,16,1,4
1120-764-93-1x1-896-764-93-6-0x0-1x1-1x1-0-NCHW-FP32-F=ConvOclDirectFwd1x1:1,64,1,1,1,0,16,2048,0
256-56-56-3x3-128-56-56-16-1x1-1x1-1x1-0-NCHW-FP16-F=ConvOclDirectFwd:32,8,32,32,1,4,8,1,2
2160-343-85-1x1-232-343-85-8-0x0-1x1-1x1-0-NCHW-FP32-F=ConvOclDirectFwd1x1:1,256,1,1,0,1,16,4,0
1024-129-84-1x1-768-129-84-1-0x0-1x1-1x1-0-NCHW-FP32-B=ConvOclDirectFwd1x1:1,64,1,1,0,2,32,4,0
288-332-117-1x1-992-332-117-6-0x0-1x1-1x1-0-NCHW-FP32-F=ConvOclDirectFwd1x1:1,64,1,1,1,4,64,2048,0
736-94-1-1x1-768-94-1-32-0x0-1x1-1x1-0-NCHW-FP32-W=ConvAsmBwdWrW1x1:2,8,4,8,4,1,1,4,0,1
576-669-400-1x1-80-669-400-1-0x0-1x1-1x1-0-NCHW-FP32-F=ConvOclDirectFwd1x1:1,64,1,1,1,0,64,2048,0
416-703-106-1x1-224-703-106-16-0x0-1x1-1x1-0-NCHW-FP32-B=ConvOclDirectFwd1x1:1,256,1,1,0,1,32,4,0
384-14-14-1x1-128-14-14-16-0x0-1x1-1x1-0-NCHW-FP16-W=ConvAsmBwdWrW1x1:4,4,4,4,2,1,2,2,0,2
640-1005-825-1x1-256-1005-825-1-0x0-1x1-1x1-0-NCHW-FP32-F=ConvOclDirectFwd1x1:1,64,1,1,1,4,32,2048,0
232-788-105-1x1-4-788-105-4-0x0-1x1-1x1-0-NCHW-FP32-F=ConvOclDirectFwd1x1:1,256,1,1,0,2,16,4,0
1024-8-8-3x3-1024-8-8-128-1x1-1x1-1x1-0-NCHW-FP32-F_g32=ConvOclDirectFwd:8,8,8,8,1,1,8,2,2
960-7-7-1x1-128-7-7-256-0x0-1x1-1x1-0-NCHW-FP16-B=ConvAsm1x1U:2,8,4,16,1,4,4,1;ConvOclDirectFwd1x1:1,64,1,1,0,1,16,4,0
320-28-28-1x1-128-28-28-64-0x0-1x1-1x1-0-NCHW-FP16-W=ConvAsmBwdWrW1x1:4,4,8,1,8,1,4,4,0,1
528-378-133-1x1-32-378-133-6-0x0-1x1-1x1-0-NCHW-FP32-F=ConvOclDirectFwd1x1:1,64,1,1,1,1,64,2048,0
64-27-27-5x5-192-27-27-16-2x2-1x1-1x1-0-NCHW-FP16-F=ConvOclDirectFwd:16,16,32,32,2,2,8,1,2
128-523-160-1x1-576-523-160-1-0x0-1x1-1x1-0-NCHW-FP32-B=ConvOclDirectFwd1x1:1,128,1,1,0,2,32,4,0
8-199-269-1x1-240-199-269-6-0x0-1x1-1x1-0-NCHW-FP32-B=ConvOclDirectFwd1x1:1,256,1,1,0,1,16,8,0
512-15-15-3x3-512-29-29-48-1x1-2x2-1x1-0-NCHW-FP32-W_g32=ConvOclBwdWrW2<2>:1,7,3,1,5;ConvOclBwdWrW2<8>:1,6,8,1,9;ConvAsmBwdWrW3x3:0,0,8,4,5,1;ConvOclBwdWrW2<1>:1,6,8,1,9;ConvOclBwdWrW2<16>:1,7,3,1,5;ConvOclBwdWrW2<4>:1,7,3,1,5
64-624-703-1x1-2-624-703-12-0x0-1x1-1x1-0-NCHW-FP32-F=ConvOclDirectFwd1x1:1,128,1,1,0,4,16,8,0
2048-8-8-1x1-1024-8-8-48-0x0-1x1-1x1-0-NCHW-FP32-F=ConvAsm1x1U:2,16,2,32,3,2,1,1;ConvOclDirectFwd1x1:1,64,1,1,1,1,64,2048,0
256-14-14-3x3-128-14-14-128-1x1-1x1-1x1-0-NCHW-FP16-B=ConvOclDirectFwd:8,8,16,16,2,2,8,2,1
256-8-8-1x1-1536-8-8-16-0x0-1x1-1x1-0-NCHW-FP32-B=ConvAsm1x1U:1,16,1,64,1,2,1,8;ConvOclDirectFwd1x1:1,64,1,1,0,4,8,8,0
512-14-14-3x3-512-14-14-16-1x1-1x1-1x1-0-NCHW-FP16-F=ConvOclDirectFwd:8,16,16,16,2,1,8,1,1;ConvOclDirectFwdFused:8,16,16,16,2,1,8,1,2
928-260-341-1x1-608-260-341-2-0x0-1x1-1x1-0-NCHW-FP32-B=ConvOclDirectFwd1x1:1,256,1,1,0,2,32,4,0
256-35-35-1x1-48-35-35-256-0x0-1x1-1x1-0-NCHW-FP16-B=ConvAsm1x1U:2,16,4,64,1,2,1,1;ConvOclDirectFwd1x1:1,64,1,1,0,1,16,4,0
384-35-35-1x1-64-35-35-128-0x0-1x1-1x1-0-NCHW-FP32-F=ConvAsm1x1U:4,16,4,64,1,2,1,4;ConvOclDirectFwd1x1:1,64,1,1,1,4,32,2048,0;ConvActivAsm1x1U:4,16,5,64,2,1
736-429-751-1x1-1-429-751-1-0x0-1x1-1x1-0-NCHW-FP32-F=ConvOclDirectFwd1x1:1,256,1,1,0,1,16,8,0
64-28-28-1x1-192-28-28-1-0x0-1x1-1x1-0-NCHW-FP32-B=ConvAsm1x1U:1,8,1,64,1,2,4,1;ConvOclDirectFwd1x1:1,128,1,1,0,1,4,8,0
704-364-56-1x1-736-364-56-16-0x0-1x1-1x1-0-NCHW-FP32-B=ConvOclDirectFwd1x1:1,64,1,1,0,2,32,4,0
1568-513-369-1x1-512-513-369-1-0x0-1x1-1x1-0-NCHW-FP32-F=ConvOclDirectFwd1x1:1,64,1,1,1,4,32,2048,0
704-344-241-1x1-608-344-241-2-0x0-1x1-1x1-0-NCHW-FP32-B=ConvOclDirectFwd1x1:1,64,1,1,0,2,32,4,0
2048-8-8-1x1-384-8-8-32-0x0-1x1-1x1-0-NCHW-FP16-F=ConvAsm1x1U:1,8,2,32,2,4,2,2;ConvOclDirectFwd1x1:1,256,1,1,0,2,8,4,0
32-79-341-5x20-1-161-700-4-0x0-2x2-1x1-0-NCHW-FP32-W=ConvOclBwdWrW2<1>:8,7,1,3,5;ConvOclBwdWrW2<2>:8,10,1,1,5;ConvOclBwdWrW2<4>:8,10,1,1,5
64-35-35-1x1-384-35-35-8-0x0-1x1-1x1-0-NCHW-FP16-W=ConvAsmBwdWrW1x1:4,4,4,4,2,1,1,2,0,1
128-28-28-1x1-192-28-28-16-0x0-1x1-1x1-0-NCHW-FP32-F=ConvAsm1x1U:2,16,2,32,2,2,1,1;ConvOclDirectFwd1x1:1,64,1,1,1,0,16,256,0
192-27-27-5x5-64-27-27-1024-2x2-1x1-1x1-0-NCHW-FP16-W=ConvOclBwdWrW2<1>:1,6,1,8,9;ConvOclBwdWrW2<2>:1,6,1,8,9;ConvOclBwdWrW2<4>:1,6,1,8,9;ConvOclBwdWrW2<8>:1,10,1,8,9;ConvOclBwdWrW2<16>:1,10,1,8,9
160-56-56-1x1-128-56-56-64-0x0-1x1-1x1-0-NCHW-FP32-B=ConvAsm1x1U:1,32,1,64,1,1,1,1;ConvOclDirectFwd1x1:1,128,1,1,0,1,32,4,0
128-28-28-3x3-128-28-28-2-1x1-1x1-1x1-0-NCHW-FP16-B=ConvOclDirectFwd:16,16,16,16,1,1,4,4,2
128-28-28-1x1-256-55-55-32-0x0-2x2-1x1-0-NCHW-FP16-W=ConvAsmBwdWrW1x1:4,4,4,1,8,2,1,4,0,1
432-882-210-1x1-448-882-210-2-0x0-1x1-1x1-0-NCHW-FP32-F=ConvOclDirectFwd1x1:1,64,1,1,1,4,32,2048,0
4-3-3-3x3-3-2-2-32-1x1-2x2-1x1-0-NCHW-FP32-F=ConvOclDirectFwd:8,8,8,8,1,1,1,4,2
256-14-14-1x1-256-14-14-1-0x0-1x1-1x1-0-NCHW-FP32-B=ConvAsm1x1U:1,8,1,64,1,4,4,1;ConvOclDirectFwd1x1:1,256,1,1,0,4,4,8,0
4-815-79-1x1-1888-815-79-1-0x0-1x1-1x1-0-NCHW-FP32-B=ConvOclDirectFwd1x1:1,256,1,1,0,1,4,4,0
128-7-7-1x1-800-7-7-32-0x0-1x1-1x1-0-NCHW-FP16-W=ConvAsmBwdWrW1x1:4,4,4,4,2,1,2,2,0,0
480-14-14-1x1-120-14-14-4-0x0-1x1-1x1-0-NCHW-FP16-B_g3=ConvOclDirectFwd:8,16,8,16,1,1,2,2,2
16-258-39-1x1-2-258-39-16-0x0-1x1-1x1-0-NCHW-FP32-B=ConvAsm1x1U:1,1,1,4,1,1,2,2;ConvOclDirectFwd1x1:1,256,1,1,0,1,4,4,0
128-112-112-3x3-128-112-112-256-1x1-1x1-1x1-0-NCHW-FP32-W=ConvAsmBwdWrW3x3:0,1,8,4,1,1
128-56-56-3x3-32-56-56-64-1x1-1x1-1x1-0-NCHW-FP32-W=ConvAsmBwdWrW3x3:0,0,8,2,3,2
256-29-29-1x1-512-29-29-2-0x0-1x1-1x1-0-NCHW-FP32-W=ConvAsmBwdWrW1x1:1,16,2,4,4,1,2,4,0,0
1280-8-8-1x1-320-8-8-256-0x0-1x1-1x1-0-NCHW-FP32-F=ConvAsm1x1U:2,16,2,32,3,2,4,1;ConvOclDirectFwd1x1:1,64,1,1,1,0,32,2048,0;ConvActivAsm1x1U:2,16,4,16,3,4
912-215-6-1x1-2048-215-6-8-0x0-1x1-1x1-0-NCHW-FP32-F=ConvAsm1x1U:3,16,3,64,4,2,1,1;ConvOclDirectFwd1x1:1,64,1,1,1,4,16,2048,0
232-14-14-1x1-232-14-14-64-0x0-1x1-1x1-0-NCHW-FP32-B=ConvAsm1x1U:4,8,4,64,1,4,1,4;ConvOclDirectFwd1x1:1,64,1,1,0,2,16,8,0
48-501-639-1x1-8-501-639-32-0x0-1x1-1x1-0-NCHW-FP32-B=ConvOclDirectFwd1x1:1,256,1,1,0,1,16,8,0
58-28-28-1x1-58-28-28-64-0x0-1x1-1x1-0-NCHW-FP32-F=ConvAsm1x1U:1,32,7,16,1,1,1,1;ConvOclDirectFwd1x1:1,128,1,1,0,4,16,4,0
96-64-128-3x3-208-64-128-1-1x1-1x1-1x1-0-NCHW-FP16-F=ConvOclDirectFwd:8,32,16,32,2,1,8,4,1
128-7-7-1x1-960-7-7-16-0x0-1x1-1x1-0-NCHW-FP16-W=ConvAsmBwdWrW1x1:2,8,4,8,2,1,2,4,0,1
128-7-7-1x1-832-7-7-512-0x0-1x1-1x1-0-NCHW-FP32-W=ConvAsmBwdWrW1x1:2,8,4,8,4,2,2,4,0,2
528-293-7-1x1-480-293-7-6-0x0-1x1-1x1-0-NCHW-FP32-B=ConvAsm1x1U:3,32,3,64,1,1,1,1;ConvOclDirectFwd1x1:1,256,1,1,0,1,32,4,0
232-14-14-1x1-232-14-14-1024-0x0-1x1-1x1-0-NCHW-FP16-W=ConvAsmBwdWrW1x1:1,16,4,4,4,1,4,4,0,1
232-845-160-1x1-64-845-160-16-0x0-1x1-1x1-0-NCHW-FP32-F=ConvOclDirectFwd1x1:1,64,1,1,0,1,32,4,0
1888-815-79-1x1-4-815-79-1-0x0-1x1-1x1-0-NCHW-FP32-F=ConvOclDirectFwd1x1:1,256,1,1,0,1,16,4,0
128-28-28-1x1-416-28-28-512-0x0-1x1-1x1-0-NCHW-FP16-B=ConvAsm1x1U:1,16,2,16,1,2,1,1;ConvOclDirectFwd1x1:1,256,1,1,0,4,16,4,0
80-904-27-1x1-116-904-27-4-0x0-1x1-1x1-0-NCHW-FP32-W=ConvAsmBwdWrW1x1:4,4,4,2,8,1,4,4,0,1
64-208-208-3x3-32-208-208-32-1x1-1x1-1x1-0-NCHW-FP32-W=ConvAsmBwdWrW3x3:0,0,16,4,2,8
48-7-7-1x1-832-7-7-4-0x0-1x1-1x1-0-NCHW-FP32-W=ConvAsmBwdWrW1x1:4,4,2,4,2,1,1,4,0,1
16-54-54-1x1-128-54-54-256-0x0-1x1-1x1-0-NCHW-FP32-F=ConvAsm1x1U:1,16,1,64,2,1,4,1;ConvOclDirectFwd1x1:1,64,1,1,1,1,16,256,0
1000-111-140-1x1-2016-111-140-2-0x0-1x1-1x1-0-NCHW-FP32-B=ConvOclDirectFwd1x1:1,64,1,1,0,2,32,4,0
8-814-965-1x1-58-814-965-1-0x0-1x1-1x1-0-NCHW-FP32-B=ConvOclDirectFwd1x1:1,256,1,1,0,2,16,4,0
448-384-411-1x1-32-384-411-1-0x0-1x1-1x1-0-NCHW-FP32-F=ConvOclDirectFwd1x1:1,64,1,1,1,4,64,2048,0
512-14-14-1x1-128-28-28-128-0x0-2x2-1x1-0-NCHW-FP32-W=ConvAsmBwdWrW1x1:4,4,4,4,8,1,2,4,0,1
576-4-4-1x1-128-4-4-32-0x0-1x1-1x1-0-NCHW-FP16-F=ConvAsm1x1U:2,4,4,4,1,4,4,1;ConvOclDirectFwd1x1:1,64,1,1,0,1,4,8,0
512-15-15-1x1-1024-15-15-48-0x0-1x1-1x1-0-NCHW-FP32-W=ConvAsmBwdWrW1x1:1,16,4,4,8,1,1,4,0,1
256-56-56-3x3-256-56-56-1-1x1-1x1-1x1-0-NCHW-FP16-F=ConvOclDirectFwd:8,32,16,32,2,1,8,4,1;ConvOclDirectFwdFused:8,32,16,32,2,1,8,4,1
64-80-349-5x5-1-161-700-8-1x1-2x2-1x1-0-NCHW-FP32-B=ConvOclDirectFwd:8,16,32,32,4,2,1,4,2
1376-1001-254-1x1-2048-1001-254-1-0x0-1x1-1x1-0-NCHW-FP32-F=ConvOclDirectFwd1x1:1,64,1,1,1,1,16,2048,0
352-7-7-1x1-1056-7-7-64-0x0-1x1-1x1-0-NCHW-FP32-W=ConvAsmBwdWrW1x1:1,16,2,4,8,1,2,4,0,3
1120-8-372-1x1-144-8-372-48-0x0-1x1-1x1-0-NCHW-FP32-F=ConvAsm1x1U:2,32,7,64,1,1,1,1;ConvOclDirectFwd1x1:1,64,1,1,1,0,32,2048,0
1024-14-14-1x1-2048-7-7-32-0x0-2x2-1x1-0-NCHW-FP16-F=ConvAsm1x1U:2,8,4,16,1,4,2,2;ConvOclDirectFwd1x1:1,64,1,1,0,1,16,4,0
128-14-14-1x1-640-14-14-512-0x0-1x1-1x1-0-NCHW-FP16-B=ConvAsm1x1U:1,16,2,16,1,2,1,4;ConvOclDirectFwd1x1:1,256,1,1,0,2,16,4,0
528-164-422-1x1-384-164-422-6-0x0-1x1-1x1-0-NCHW-FP32-F=ConvOclDirectFwd1x1:1,64,1,1,1,1,16,2048,0
24-112-112-3x3-3-224-224-256-1x1-2x2-1x1-0-NCHW-FP16-B=ConvOclDirectFwd:8,8,32,32,4,4,2,4,2
2-87-26-1x1-4-87-26-2-0x0-1x1-1x1-0-NCHW-FP32-F=ConvAsm1x1U:3,1,8,4,1,1,1,1;ConvOclDirectFwd1x1:1,128,1,1,0,2,16,4,0
256-27-27-1x1-48-27-27-16-0x0-1x1-1x1-0-NCHW-FP32-B=ConvAsm1x1U:3,16,3,64,1,2,4,1;ConvOclDirectFwd1x1:1,64,1,1,0,1,8,4,0
208-14-14-3x3-96-14-14-128-1x1-1x1-1x1-0-NCHW-FP16-W=ConvAsmBwdWrW3x3:0,0,8,2,3,4
544-7-7-1x1-128-7-7-128-0x0-1x1-1x1-0-NCHW-FP32-B=ConvAsm1x1U:1,16,1,64,1,2,2,2;ConvOclDirectFwd1x1:1,64,1,1,0,1,8,4,0
256-10-205-1x1-1216-10-205-4-0x0-1x1-1x1-0-NCHW-FP32-W=ConvAsmBwdWrW1x1:1,16,4,8,4,1,1,4,0,1
768-14-14-1x1-128-14-14-64-0x0-1x1-1x1-0-NCHW-FP16-W=ConvAsmBwdWrW1x1:2,8,2,8,2,1,2,4,0,1
128-112-112-3x3-64-112-112-128-1x1-1x1-1x1-0-NCHW-FP16-W=ConvAsmBwdWrW3x3:0,0,16,4,1,1
2048-8-8-1x1-192-8-8-1-0x0-1x1-1x1-0-NCHW-FP16-F=ConvAsm1x1U:1,8,2,16,1,4,4,1;ConvOclDirectFwd1x1:1,128,1,1,0,2,4,4,0
1280-966-219-1x1-116-966-219-1-0x0-1x1-1x1-0-NCHW-FP32-F=ConvOclDirectFwd1x1:1,256,1,1,0,1,16,4,0
64-56-56-1x1-128-56-56-16-0x0-1x1-1x1-0-NCHW-FP16-B=ConvAsm1x1U:1,8,2,16,1,4,1,4;ConvOclDirectFwd1x1:1,128,1,1,0,4,16,4,0
640-14-14-1x1-128-14-14-512-0x0-1x1-1x1-0-NCHW-FP16-B=ConvAsm1x1U:1,16,2,16,1,2,1,2;ConvOclDirectFwd1x1:1,64,1,1,0,2,32,8,0
1-562-573-1x1-64-562-573-16-0x0-1x1-1x1-0-NCHW-FP32-F=ConvOclDirectFwd1x1:1,256,1,1,0,2,32,4,0
1024-7-7-1x1-464-7-7-8-0x0-1x1-1x1-0-NCHW-FP32-B=ConvAsm1x1U:1,8,1,64,2,2,4,2;ConvOclDirectFwd1x1:1,128,1,1,0,1,4,8,0
3-568-130-1x1-32-568-130-2-0x0-1x1-1x1-0-NCHW-FP32-F=ConvAsm1x1U:1,16,5,64,2,1,1,2;ConvOclDirectFwd1x1:1,256,1,1,0,1,32,4,0
128-633-248-1x1-112-633-248-8-0x0-1x1-1x1-0-NCHW-FP32-F=ConvOclDirectFwd1x1:1,64,1,1,1,4,32,128,0
32-54-54-3x3-128-54-54-16-1x1-1x1-1x1-0-NCHW-FP32-W=ConvAsmBwdWrW3x3:0,0,8,4,2,4
704-20-11-1x1-352-20-11-48-0x0-1x1-1x1-0-NCHW-FP32-B=ConvAsm1x1U:2,16,2,64,1,2,4,1;ConvOclDirectFwd1x1:1,256,1,1,0,2,32,4,0
960-7-7-1x1-240-7-7-128-0x0-1x1-1x1-0-NCHW-FP16-B_g3=ConvOclDirectFwd:8,8,8,8,1,1,8,2,2
528-14-14-1x1-160-14-14-8-0x0-1x1-1x1-0-NCHW-FP32-F=ConvAsm1x1U:3,8,3,16,1,4,2,2;ConvOclDirectFwd1x1:1,64,1,1,1,4,16,128,0;ConvActivAsm1x1U:4,16,5,16,1,4
128-14-14-1x1-768-14-14-64-0x0-1x1-1x1-0-NCHW-FP32-F=ConvAsm1x1U:4,8,4,64,1,4,2,2;ConvOclDirectFwd1x1:1,64,1,1,1,0,32,2048,0
832-7-7-1x1-160-7-7-32-0x0-1x1-1x1-0-NCHW-FP32-F=ConvAsm1x1U:2,8,2,32,1,4,2,2;ConvOclDirectFwd1x1:1,64,1,1,1,4,16,256,0;ConvActivAsm1x1U:2,16,2,16,3,4
128-17-17-7x1-128-17-17-512-3x0-1x1-1x1-0-NCHW-FP16-W=ConvOclBwdWrW2<1>:1,6,8,3,7;ConvOclBwdWrW2<2>:1,9,8,3,9;ConvOclBwdWrW2<4>:1,9,8,3,9;ConvOclBwdWrW2<8>:1,6,8,3,7;ConvOclBwdWrW2<16>:1,6,8,3,7
640-853-243-1x1-1216-853-243-1-0x0-1x1-1x1-0-NCHW-FP32-B=ConvOclDirectFwd1x1:1,128,1,1,0,1,32,4,0
128-8-554-1x1-640-8-554-48-0x0-1x1-1x1-0-NCHW-FP32-W=ConvAsmBwdWrW1x1:2,8,4,4,4,1,1,4,0,1
160-882-266-1x1-32-882-266-6-0x0-1x1-1x1-0-NCHW-FP32-F=ConvOclDirectFwd1x1:1,64,1,1,1,1,64,2048,0
160-413-17-1x1-1280-413-17-6-0x0-1x1-1x1-0-NCHW-FP32-B=ConvOclDirectFwd1x1:1,128,1,1,0,1,32,4,0
384-35-35-1x1-96-35-35-128-0x0-1x1-1x1-0-NCHW-FP32-F=ConvAsm1x1U:4,16,5,64,1,2,1,2;ConvOclDirectFwd1x1:1,64,1,1,1,1,64,2048,0;ConvActivAsm1x1U:3,16,3,32,4,1
58-691-702-1x1-80-691-702-6-0x0-1x1-1x1-0-NCHW-FP32-B=ConvOclDirectFwd1x1:1,256,1,1,0,1,16,4,0
832-14-14-1x1-128-14-14-256-0x0-1x1-1x1-0-NCHW-FP16-W=ConvAsmBwdWrW1x1:2,8,4,8,2,1,2,4,0,1
512-14-14-3x3-512-14-14-4-1x1-1x1-1x1-0-NCHW-FP32-W=ConvAsmBwdWrW3x3:0,1,8,4,4,1
8-30-338-1x1-1920-30-338-1-0x0-1x1-1x1-0-NCHW-FP32-B=ConvOclDirectFwd1x1:1,256,1,1,0,1,4,8,0
1024-8-8-3x3-1024-15-15-256-1x1-2x2-1x1-0-NCHW-FP32-B_g32=ConvOclDirectFwd:16,8,16,16,1,2,4,1,2
128-64-128-1x1-528-64-128-1-0x0-1x1-1x1-0-NCHW-FP16-W=ConvAsmBwdWrW1x1:4,4,4,1,8,1,1,4,0,1
2016-5-997-1x1-896-5-997-6-0x0-1x1-1x1-0-NCHW-FP32-F=ConvOclDirectFwd1x1:1,64,1,1,1,1,16,2048,0
512-28-28-1x1-256-56-56-32-0x0-2x2-1x1-0-NCHW-FP32-B=ConvAsm1x1U:4,16,5,32,1,2,1,4;ConvOclDirectFwd1x1:1,128,1,1,0,2,32,4,0
48-49-462-1x1-416-49-462-2-0x0-1x1-1x1-0-NCHW-FP32-W=ConvAsmBwdWrW1x1:4,4,4,2,8,1,2,4,0,1
192-28-28-1x1-240-28-28-16-0x0-1x1-1x1-0-NCHW-FP16-B=ConvAsm1x1U:1,16,2,16,1,2,4,1;ConvOclDirectFwd1x1:1,64,1,1,0,4,16,4,0
320-178-21-1x1-1888-178-21-12-0x0-1x1-1x1-0-NCHW-FP32-B=ConvOclDirectFwd1x1:1,256,1,1,0,2,32,4,0
528-23-89-1x1-192-23-89-2-0x0-1x1-1x1-0-NCHW-FP32-B=ConvAsm1x1U:2,16,2,64,1,2,2,2;ConvOclDirectFwd1x1:1,64,1,1,0,1,8,4,0
320-8-8-3x3-192-17-17-4-0x0-2x2-1x1-0-NCHW-FP32-B=ConvOclDirectFwd:8,16,32,32,4,2,4,4,1
800-48-982-1x1-800-48-982-4-0x0-1x1-1x1-0-NCHW-FP32-F=ConvOclDirectFwd1x1:1,64,1,1,1,0,16,2048,0
1024-14-14-1x1-512-14-14-64-0x0-1x1-1x1-0-NCHW-FP32-B=ConvAsm1x1U:1,32,1,32,2,1,1,1;ConvOclDirectFwd1x1:1,256,1,1,0,1,32,4,0
288-643-7-1x1-1472-643-7-4-0x0-1x1-1x1-0-NCHW-FP32-W=ConvAsmBwdWrW1x1:2,8,4,8,4,1,1,4,0,1
1024-14-14-1x1-512-28-28-256-0x0-2x2-1x1-0-NCHW-FP16-W=ConvAsmBwdWrW1x1:1,16,8,8,2,1,1,2,0,1
448-8-8-1x1-2048-8-8-16-0x0-1x1-1x1-0-NCHW-FP16-W=ConvAsmBwdWrW1x1:2,8,4,2,4,1,1,4,0,0
544-120-784-1x1-48-120-784-1-0x0-1x1-1x1-0-NCHW-FP32-F=ConvOclDirectFwd1x1:1,64,1,1,1,4,32,2048,0
640-260-702-1x1-96-260-702-4-0x0-1x1-1x1-0-NCHW-FP32-B=ConvOclDirectFwd1x1:1,128,1,1,0,4,16,4,0
1104-682-87-1x1-416-682-87-8-0x0-1x1-1x1-0-NCHW-FP32-F=ConvOclDirectFwd1x1:1,64,1,1,1,4,64,2048,0
128-28-28-1x1-128-28-28-16-0x0-1x1-1x1-0-NCHW-FP32-W=ConvAsmBwdWrW1x1:2,8,2,8,2,1,4,4,0,1
512-8-8-3x3-512-15-15-64-1x1-2x2-1x1-0-NCHW-FP32-W=ConvAsmBwdWrW3x3:0,0,8,8,3,1
5-10-10-3x3-3-10-10-64-1x1-1x1-1x1-0-NCHW-FP32-F=ConvOclDirectFwd:8,16,16,16,2,1,1,4,2
576-7-7-1x1-128-7-7-512-0x0-1x1-1x1-0-NCHW-FP32-B=ConvAsm1x1U:2,16,2,32,1,2,2,2;ConvOclDirectFwd1x1:1,256,1,1,0,1,32,4,0
256-304-93-1x1-320-304-93-32-0x0-1x1-1x1-0-NCHW-FP32-B=ConvOclDirectFwd1x1:1,128,1,1,0,2,32,4,0
64-35-35-1x1-192-35-35-1-0x0-1x1-1x1-0-NCHW-FP16-B=ConvAsm1x1U:1,8,2,64,1,4,4,2;ConvOclDirectFwd1x1:1,256,1,1,0,1,4,4,0
64-9-619-1x1-960-9-619-12-0x0-1x1-1x1-0-NCHW-FP32-F=ConvOclDirectFwd1x1:8,16,16,32,1,0,32,128,1
192-14-14-1x1-768-14-14-16-0x0-1x1-1x1-0-NCHW-FP32-B=ConvAsm1x1U:1,16,1,32,2,2,2,2;ConvOclDirectFwd1x1:1,64,1,1,0,4,16,4,0
128-56-56-1x1-128-56-56-16-0x0-1x1-1x1-0-NCHW-FP16-W=ConvAsmBwdWrW1x1:4,4,4,1,8,1,2,4,0,1
3-32-32-1x1-3-32-32-16-0x0-1x1-1x1-0-NCHW-FP32-F=ConvAsm1x1U:2,1,4,4,1,1,1,1;ConvOclDirectFwd1x1:1,128,1,1,0,4,8,4,0
320-8-8-3x3-320-17-17-32-0x0-2x2-1x1-0-NCHW-FP16-B=ConvOclDirectFwd:16,8,32,32,2,4,4,2,2
1008-14-14-1x1-192-14-14-16-0x0-1x1-1x1-0-NCHW-FP32-F=ConvAsm1x1U:3,16,3,16,1,2,2,1;ConvOclDirectFwd1x1:1,64,1,1,1,0,16,256,0;ConvActivAsm1x1U:3,16,3,16,4,4
64-13-13-1x1-256-13-13-32-0x0-1x1-1x1-0-NCHW-FP32-F=ConvAsm1x1U:1,16,1,32,2,2,1,1;ConvOclDirectFwd1x1:1,64,1,1,1,4,16,128,0
256-56-56-1x1-64-56-56-4-0x0-1x1-1x1-0-NCHW-FP32-F=ConvAsm1x1U:2,16,2,64,2,2,2,1;ConvOclDirectFwd1x1:1,64,1,1,1,4,16,256,0;ConvActivAsm1x1U:3,16,3,64,1,3
224-14-14-1x1-576-14-14-64-0x0-1x1-1x1-0-NCHW-FP16-W=ConvAsmBwdWrW1x1:2,8,4,8,2,1,2,4,0,1
384-8-8-1x1-1280-8-8-8-0x0-1x1-1x1-0-NCHW-FP32-W=ConvAsmBwdWrW1x1:1,16,4,4,4,1,1,4,0,0
128-56-56-1x1-64-56-56-512-0x0-1x1-1x1-0-NCHW-FP16-F=ConvAsm1x1U:1,8,2,64,1,4,1,4;ConvOclDirectFwd1x1:1,64,1,1,0,4,16,4,0
2016-7-7-1x1-192-7-7-16-0x0-1x1-1x1-0-NCHW-FP16-F=ConvAsm1x1U:1,8,2,32,1,4,4,1;ConvOclDirectFwd1x1:1,64,1,1,0,1,4,8,0
160-73-73-1x1-64-73-73-8-0x0-1x1-1x1-0-NCHW-FP16-F=ConvAsm1x1U:3,8,6,64,1,4,2,2;ConvOclDirectFwd1x1:16,64,32,32,0,1,16,4,1
1248-97-225-1x1-1024-97-225-12-0x0-1x1-1x1-0-NCHW-FP32-F=ConvOclDirectFwd1x1:1,64,1,1,1,4,16,2048,0
2048-14-14-1x1-512-14-14-128-0x0-1x1-1x1-0-NCHW-FP32-B=ConvAsm1x1U:4,32,7,32,1,1,1,2;ConvOclDirectFwd1x1:1,128,1,1,0,4,16,4,0
384-13-13-3x3-192-13-13-1024-1x1-1x1-1x1-0-NCHW-FP16-W=ConvAsmBwdWrW3x3:0,1,8,4,5,1
1024-252-34-1x1-912-252-34-12-0x0-1x1-1x1-0-NCHW-FP32-W=ConvAsmBwdWrW1x1:1,16,2,8,8,1,2,4,0,1
1056-9-561-1x1-896-9-561-8-0x0-1x1-1x1-0-NCHW-FP32-F=ConvOclDirectFwd1x1:1,64,1,1,1,0,32,2048,0
80-253-492-1x1-288-253-492-2-0x0-1x1-1x1-0-NCHW-FP32-B=ConvOclDirectFwd1x1:1,256,1,1,0,2,32,4,0
320-8-8-1x1-2048-8-8-16-0x0-1x1-1x1-0-NCHW-FP16-B=ConvAsm1x1U:1,16,2,32,1,2,2,4;ConvOclDirectFwd1x1:1,64,1,1,0,4,16,4,0
58-952-57-1x1-1568-952-57-1-0x0-1x1-1x1-0-NCHW-FP32-B=ConvOclDirectFwd1x1:1,64,1,1,0,2,32,4,0
1024-7-7-1x1-2048-7-7-2-0x0-1x1-1x1-0-NCHW-FP32-W=ConvAsmBwdWrW1x1:1,16,4,2,8,1,1,4,0,0
116-285-460-1x1-416-285-460-6-0x0-1x1-1x1-0-NCHW-FP32-F=ConvOclDirectFwd1x1:1,64,1,1,0,1,32,4,0
128-14-14-1x1-704-14-14-128-0x0-1x1-1x1-0-NCHW-FP16-F=ConvAsm1x1U:1,8,2,16,2,4,1,8;ConvOclDirectFwd1x1:1,256,1,1,0,2,16,4,0
256-13-13-3x3-384-13-13-64-1x1-1x1-1x1-0-NCHW-FP32-W=ConvAsmBwdWrW3x3:0,0,16,4,10,1
544-2-162-1x1-672-2-162-16-0x0-1x1-1x1-0-NCHW-FP32-B=ConvAsm1x1U:2,16,2,64,1,2,2,2;ConvOclDirectFwd1x1:1,64,1,1,0,4,16,4,0
192-423-490-1x1-192-423-490-1-0x0-1x1-1x1-0-NCHW-FP32-F=ConvOclDirectFwd1x1:1,64,1,1,1,4,16,2048,0
60-28-28-1x1-240-28-28-8-0x0-1x1-1x1-0-NCHW-FP16-F_g3=ConvOclDirectFwd:16,16,16,16,1,1,8,2,1
160-517-450-1x1-544-517-450-4-0x0-1x1-1x1-0-NCHW-FP32-F=ConvOclDirectFwd1x1:1,64,1,1,1,4,64,2048,0
416-40-444-1x1-992-40-444-2-0x0-1x1-1x1-0-NCHW-FP32-B=ConvOclDirectFwd1x1:1,128,1,1,0,1,32,4,0
2-26-963-1x1-1-26-963-12-0x0-1x1-1x1-0-NCHW-FP32-B=ConvAsm1x1U:1,1,1,4,1,1,1,1;ConvOclDirectFwd1x1:1,256,1,1,0,2,4,4,0
320-297-544-1x1-736-297-544-1-0x0-1x1-1x1-0-NCHW-FP32-F=ConvOclDirectFwd1x1:1,64,1,1,1,4,64,2048,0
232-254-549-1x1-160-254-549-2-0x0-1x1-1x1-0-NCHW-FP32-B=ConvOclDirectFwd1x1:1,256,1,1,0,2,32,4,0
64-12-292-1x1-352-12-292-8-0x0-1x1-1x1-0-NCHW-FP32-B=ConvAsm1x1U:3,8,3,64,1,4,2,2;ConvOclDirectFwd1x1:1,128,1,1,0,4,16,4,0
544-14-14-1x1-128-14-14-512-0x0-1x1-1x1-0-NCHW-FP16-F=ConvAsm1x1U:2,8,4,64,1,4,1,2;ConvOclDirectFwd1x1:1,64,1,1,0,4,16,4,0
2048-92-196-1x1-24-92-196-4-0x0-1x1-1x1-0-NCHW-FP32-F=ConvOclDirectFwd1x1:1,128,1,1,0,4,16,4,0
128-14-14-1x1-384-14-14-32-0x0-1x1-1x1-0-NCHW-FP16-F=ConvAsm1x1U:1,8,2,16,1,4,1,4;ConvOclDirectFwd1x1:1,64,1,1,0,4,8,4,0
96-712-591-1x1-224-712-591-2-0x0-1x1-1x1-0-NCHW-FP32-B=ConvOclDirectFwd1x1:1,128,1,1,0,2,32,4,0
19-224-376-1x1-116-224-376-32-0x0-1x1-1x1-0-NCHW-FP32-B=ConvOclDirectFwd1x1:1,64,1,1,0,1,8,4,0
232-76-721-1x1-864-76-721-6-0x0-1x1-1x1-0-NCHW-FP32-F=ConvOclDirectFwd1x1:1,256,1,1,0,2,32,4,0
256-14-14-3x3-128-14-14-256-1x1-1x1-1x1-0-NCHW-FP16-W=ConvAsmBwdWrW3x3:0,0,8,2,6,4
2048-57-573-1x1-4-57-573-6-0x0-1x1-1x1-0-NCHW-FP32-B=ConvOclDirectFwd1x1:1,256,1,1,0,1,16,8,0
96-1003-910-1x1-320-1003-910-1-0x0-1x1-1x1-0-NCHW-FP32-B=ConvOclDirectFwd1x1:1,256,1,1,0,2,32,4,0
1312-299-109-1x1-224-299-109-4-0x0-1x1-1x1-0-NCHW-FP32-F=ConvOclDirectFwd1x1:1,64,1,1,1,1,64,2048,0
3-224-224-3x3-64-224-224-128-1x1-1x1-1x1-0-NCHW-FP16-F=ConvOclDirectFwd:8,16,16,32,2,2,8,1,1
8-363-44-1x1-4-363-44-2-0x0-1x1-1x1-0-NCHW-FP32-B=ConvAsm1x1U:1,4,2,4,1,1,1,1;ConvOclDirectFwd1x1:1,256,1,1,0,1,16,4,0
816-76-572-1x1-640-76-572-1-0x0-1x1-1x1-0-NCHW-FP32-F=ConvOclDirectFwd1x1:1,64,1,1,1,1,16,256,0
64-14-14-1x1-480-14-14-4-0x0-1x1-1x1-0-NCHW-FP32-W=ConvAsmBwdWrW1x1:2,8,2,4,4,1,4,4,0,0
3-8-868-1x1-1584-8-868-32-0x0-1x1-1x1-0-NCHW-FP32-B=ConvOclDirectFwd1x1:1,64,1,1,0,4,16,4,0
64-14-641-1x1-4-14-641-64-0x0-1x1-1x1-0-NCHW-FP32-F=ConvAsm1x1U:1,4,6,4,4,1,2,1;ConvOclDirectFwd1x1:1,256,1,1,0,1,16,4,0
16-54-54-1x1-96-54-54-32-0x0-1x1-1x1-0-NCHW-FP16-F=ConvAsm1x1U:1,8,2,64,1,4,1,4;ConvOclDirectFwd1x1:1,64,1,1,0,2,32,4,0
1024-7-7-1x1-464-7-7-8-0x0-1x1-1x1-0-NCHW-FP16-B=ConvAsm1x1U:1,8,2,32,1,4,4,4;ConvOclDirectFwd1x1:1,256,1,1,0,1,4,4,0
256-28-28-1x1-64-28-28-4-0x0-1x1-1x1-0-NCHW-FP16-F=ConvAsm1x1U:1,8,2,64,1,4,4,1;ConvOclDirectFwd1x1:1,256,1,1,0,2,4,4,0
336-298-535-1x1-416-298-535-8-0x0-1x1-1x1-0-NCHW-FP32-F=ConvOclDirectFwd1x1:1,64,1,1,1,1,64,2048,0
576-14-14-1x1-192-14-14-64-0x0-1x1-1x1-0-NCHW-FP32-F=ConvAsm1x1U:2,16,2,64,2,2,1,2;ConvOclDirectFwd1x1:1,64,1,1,1,1,16,2048,0;ConvActivAsm1x1U:3,16,3,16,4,1
96-14-14-1x1-480-14-14-256-0x0-1x1-1x1-0-NCHW-FP32-F=ConvAsm1x1U:2,16,2,64,3,2,1,1;ConvOclDirectFwd1x1:1,64,1,1,1,1,64,128,0
16-406-189-1x1-3-406-189-48-0x0-1x1-1x1-0-NCHW-FP32-B=ConvAsm1x1U:3,1,8,4,3,4,1,1;ConvOclDirectFwd1x1:1,256,1,1,0,1,8,8,0
128-7-7-1x1-800-7-7-64-0x0-1x1-1x1-0-NCHW-FP16-W=ConvAsmBwdWrW1x1:2,8,4,8,2,2,2,4,0,1
24-112-112-3x3-3-224-224-512-1x1-2x2-1x1-0-NCHW-FP16-B=ConvOclDirectFwd:8,16,32,32,4,2,2,4,1
384-27-27-1x1-48-27-27-32-0x0-1x1-1x1-0-NCHW-FP32-F=ConvAsm1x1U:3,16,5,32,1,2,2,1;ConvOclDirectFwd1x1:1,64,1,1,1,4,32,2048,0
992-396-471-1x1-352-396-471-1-0x0-1x1-1x1-0-NCHW-FP32-F=ConvOclDirectFwd1x1:1,64,1,1,1,1,64,2048,0
1-858-652-1x1-4-858-652-2-0x0-1x1-1x1-0-NCHW-FP32-W=ConvAsmBwdWrW1x1:4,4,2,1,2,1,2,4,0,3
160-7-7-1x1-832-7-7-8-0x0-1x1-1x1-0-NCHW-FP16-W=ConvAsmBwdWrW1x1:1,16,4,4,2,1,1,4,0,1
128-7-7-1x1-896-7-7-512-0x0-1x1-1x1-0-NCHW-FP16-B=ConvAsm1x1U:1,16,2,32,1,2,1,2;ConvOclDirectFwd1x1:1,256,1,1,0,1,32,4,0
48-14-14-5x5-512-14-14-1-2x2-1x1-1x1-0-NCHW-FP32-W=ConvOclBwdWrW2<1>:1,7,1,8,7
992-14-14-1x1-128-14-14-16-0x0-1x1-1x1-0-NCHW-FP16-F=ConvAsm1x1U:2,8,4,64,1,4,4,2;ConvOclDirectFwd1x1:1,64,1,1,0,4,4,4,0
544-127-196-1x1-576-127-196-16-0x0-1x1-1x1-0-NCHW-FP32-W=ConvAsmBwdWrW1x1:4,4,4,4,8,1,1,4,0,1
448-8-8-1x1-2048-8-8-1-0x0-1x1-1x1-0-NCHW-FP32-B=ConvAsm1x1U:1,8,1,64,1,4,4,1;ConvOclDirectFwd1x1:1,128,1,1,0,1,4,8,0
16-54-54-3x3-64-54-54-128-1x1-1x1-1x1-0-NCHW-FP16-B=ConvOclDirectFwd:16,16,32,32,2,2,8,1,1
1-216-395-1x1-80-216-395-12-0x0-1x1-1x1-0-NCHW-FP32-F=ConvOclDirectFwd1x1:1,64,1,1,0,4,4,4,0
224-80-166-1x1-256-80-166-8-0x0-1x1-1x1-0-NCHW-FP32-B=ConvAsm1x1U:1,32,7,64,1,1,1,2;ConvOclDirectFwd1x1:1,256,1,1,0,4,16,8,0
116-761-13-1x1-528-761-13-64-0x0-1x1-1x1-0-NCHW-FP32-B=ConvOclDirectFwd1x1:16,64,32,16,0,1,16,4,1
288-109-314-1x1-672-109-314-4-0x0-1x1-1x1-0-NCHW-FP32-F=ConvOclDirectFwd1x1:1,64,1,1,1,0,64,2048,0
60-28-28-1x1-240-28-28-32-0x0-1x1-1x1-0-NCHW-FP16-F_g3=ConvOclDirectFwd:16,16,16,16,1,1,8,4,1
60-14-14-1x1-240-14-14-128-0x0-1x1-1x1-0-NCHW-FP32-F_g3=ConvOclDirectFwd:16,16,16,16,1,1,8,4,1
16-111-680-1x1-352-111-680-1-0x0-1x1-1x1-0-NCHW-FP32-B=ConvOclDirectFwd1x1:1,256,1,1,0,2,32,4,0
448-28-28-1x1-128-28-28-512-0x0-1x1-1x1-0-NCHW-FP16-F=ConvAsm1x1U:1,16,2,32,2,2,1,4;ConvOclDirectFwd1x1:1,128,1,1,0,4,16,4,0
384-13-13-3x3-192-13-13-128-1x1-1x1-1x1-0-NCHW-FP16-W=ConvAsmBwdWrW3x3:0,1,8,4,1,1
928-12-345-1x1-832-12-345-16-0x0-1x1-1x1-0-NCHW-FP32-W=ConvAsmBwdWrW1x1:1,16,4,4,8,1,1,4,0,1
512-14-14-3x3-512-14-14-8-1x1-1x1-1x1-0-NCHW-FP16-W=ConvAsmBwdWrW3x3:0,0,8,4,2,1
128-112-112-3x3-64-112-112-128-1x1-1x1-1x1-0-NCHW-FP32-W=ConvAsmBwdWrW3x3:0,1,16,4,2,1
320-8-8-1x1-2048-8-8-4-0x0-1x1-1x1-0-NCHW-FP32-B=ConvAsm1x1U:2,16,2,32,1,2,2,2;ConvOclDirectFwd1x1:1,128,1,1,0,4,8,8,0
608-14-14-1x1-192-14-14-32-0x0-1x1-1x1-0-NCHW-FP32-F=ConvAsm1x1U:4,16,4,64,1,2,2,1;ConvOclDirectFwd1x1:1,64,1,1,1,1,16,2048,0;ConvActivAsm1x1U:3,16,3,16,4,2
64-35-35-1x1-384-35-35-1-0x0-1x1-1x1-0-NCHW-FP32-B=ConvAsm1x1U:1,8,1,64,1,4,1,2;ConvOclDirectFwd1x1:1,128,1,1,0,1,8,4,0
48-158-517-1x1-58-158-517-2-0x0-1x1-1x1-0-NCHW-FP32-W=ConvAsmBwdWrW1x1:4,4,2,4,2,1,4,4,0,2
256-56-56-3x3-256-56-56-4-1x1-1x1-1x1-0-NCHW-FP32-W=ConvAsmBwdWrW3x3:0,0,16,4,3,1
528-278-836-1x1-116-278-836-4-0x0-1x1-1x1-0-NCHW-FP32-B=ConvOclDirectFwd1x1:1,64,1,1,0,2,16,4,0
256-56-56-3x3-256-28-28-1-1x1-2x2-1x1-0-NCHW-FP32-F_g32=ConvOclDirectFwd:16,16,16,16,1,1,4,2,1
192-28-28-1x1-288-28-28-16-0x0-1x1-1x1-0-NCHW-FP32-B=ConvAsm1x1U:1,16,1,16,1,2,2,1;ConvOclDirectFwd1x1:16,64,32,32,0,2,16,4,1
512-28-28-1x1-1024-14-14-1-0x0-2x2-1x1-0-NCHW-FP32-F=ConvAsm1x1U:4,8,4,64,1,4,2,2;ConvOclDirectFwd1x1:1,64,1,1,1,4,16,128,0
896-13-248-1x1-4-13-248-6-0x0-1x1-1x1-0-NCHW-FP32-F=ConvAsm1x1U:2,4,5,4,1,2,2,1;ConvOclDirectFwd1x1:1,128,1,1,0,4,16,4,0
64-35-35-5x5-48-35-35-16-2x2-1x1-1x1-0-NCHW-FP16-B=ConvOclDirectFwd:8,8,16,16,2,2,8,2,2
864-913-521-1x1-96-913-521-1-0x0-1x1-1x1-0-NCHW-FP32-B=ConvOclDirectFwd1x1:1,256,1,1,0,1,32,4,0
192-71-71-3x3-80-73-73-4-0x0-1x1-1x1-0-NCHW-FP32-B=ConvOclDirectFwd:8,16,16,16,2,1,8,1,1
256-13-13-3x3-384-13-13-4-1x1-1x1-1x1-0-NCHW-FP32-W=ConvAsmBwdWrW3x3:0,1,8,4,2,1
672-612-595-1x1-144-612-595-1-0x0-1x1-1x1-0-NCHW-FP32-B=ConvOclDirectFwd1x1:1,256,1,1,0,2,16,4,0
128-28-28-1x1-160-28-28-16-0x0-1x1-1x1-0-NCHW-FP16-B=ConvAsm1x1U:1,16,2,16,1,2,2,2;ConvOclDirectFwd1x1:1,64,1,1,0,4,16,4,0
1920-184-63-1x1-80-184-63-2-0x0-1x1-1x1-0-NCHW-FP32-F=ConvOclDirectFwd1x1:1,64,1,1,1,4,64,256,0
116-246-1010-1x1-256-246-1010-2-0x0-1x1-1x1-0-NCHW-FP32-F=ConvOclDirectFwd1x1:1,128,1,1,0,4,16,4,0
6-16-16-1x1-512-16-16-4-0x0-1x1-1x1-0-NCHW-FP32-B=ConvAsm1x1U:1,8,1,64,2,1,1,4;ConvOclDirectFwd1x1:1,128,1,1,0,2,4,4,0
116-28-28-1x1-116-28-28-1024-0x0-1x1-1x1-0-NCHW-FP16-B=ConvAsm1x1U:4,4,8,4,1,2,2,2;ConvOclDirectFwd1x1:1,128,1,1,0,4,8,4,0
32-28-28-5x5-96-28-28-64-2x2-1x1-1x1-0-NCHW-FP32-F=ConvOclDirectFwd:16,16,32,32,2,2,8,1,2;ConvOclDirectFwdFused:16,16,32,32,2,2,8,1,2
58-518-152-1x1-58-518-152-48-0x0-1x1-1x1-0-NCHW-FP32-W=ConvAsmBwdWrW1x1:4,4,4,2,2,1,2,4,0,1
48-32-999-1x1-768-32-999-12-0x0-1x1-1x1-0-NCHW-FP32-B=ConvOclDirectFwd1x1:1,256,1,1,0,2,32,4,0
32-28-28-1x1-256-28-28-16-0x0-1x1-1x1-0-NCHW-FP32-B=ConvAsm1x1U:1,16,1,32,1,2,1,2;ConvOclDirectFwd1x1:1,256,1,1,0,2,16,4,0
8-694-121-1x1-528-694-121-2-0x0-1x1-1x1-0-NCHW-FP32-F=ConvOclDirectFwd1x1:1,256,1,1,0,2,16,8,0
160-64-809-1x1-192-64-809-8-0x0-1x1-1x1-0-NCHW-FP32-W=ConvAsmBwdWrW1x1:4,4,8,4,4,1,2,4,0,1
256-13-13-3x3-384-13-13-16-1x1-1x1-1x1-0-NCHW-FP16-B=ConvOclDirectFwd:8,8,16,16,2,2,8,4,2
512-28-28-3x3-512-28-28-4-1x1-1x1-1x1-0-NCHW-FP32-W=ConvAsmBwdWrW3x3:0,0,8,4,4,1
1024-7-7-1x1-256-14-14-2-0x0-2x2-1x1-0-NCHW-FP32-B=ConvAsm1x1U:1,8,1,16,1,4,4,1;ConvOclDirectFwd1x1:1,256,1,1,0,1,4,4,0
960-14-14-1x1-128-14-14-64-0x0-1x1-1x1-0-NCHW-FP32-B=ConvAsm1x1U:1,32,1,32,2,1,4,1;ConvOclDirectFwd1x1:1,64,1,1,0,4,16,4,0
64-177-344-1x1-80-177-344-8-0x0-1x1-1x1-0-NCHW-FP32-F=ConvOclDirectFwd1x1:1,64,1,1,1,4,64,128,0
112-700-23-1x1-2160-700-23-1-0x0-1x1-1x1-0-NCHW-FP32-B=ConvOclDirectFwd1x1:1,256,1,1,0,4,16,8,0
160-28-28-1x1-128-28-28-16-0x0-1x1-1x1-0-NCHW-FP32-F=ConvAsm1x1U:2,16,2,32,1,2,1,2;ConvOclDirectFwd1x1:1,64,1,1,1,4,32,2048,0
128-28-28-1x1-352-28-28-128-0x0-1x1-1x1-0-NCHW-FP16-B=ConvAsm1x1U:1,16,2,16,1,2,1,2;ConvOclDirectFwd1x1:1,256,1,1,0,4,16,4,0
1312-275-77-1x1-384-275-77-2-0x0-1x1-1x1-0-NCHW-FP32-F=ConvOclDirectFwd1x1:1,64,1,1,1,4,32,2048,0
512-28-28-1x1-128-28-28-16-0x0-1x1-1x1-0-NCHW-FP32-F=ConvAsm1x1U:4,16,4,64,1,2,1,1;ConvOclDirectFwd1x1:1,64,1,1,1,1,32,2048,0;ConvActivAsm1x1U:3,32,7,64,1,2
112-14-14-1x1-512-14-14-1-0x0-1x1-1x1-0-NCHW-FP16-W=ConvAsmBwdWrW1x1:2,8,2,2,2,1,1,4,0,0
704-462-85-1x1-608-462-85-1-0x0-1x1-1x1-0-NCHW-FP32-B=ConvOclDirectFwd1x1:1,256,1,1,0,2,32,4,0
384-13-13-3x3-384-13-13-128-1x1-1x1-1x1-0-NCHW-FP32-W=ConvAsmBwdWrW3x3:0,1,16,4,4,1
144-92-204-1x1-928-92-204-2-0x0-1x1-1x1-0-NCHW-FP32-F=ConvOclDirectFwd1x1:1,64,1,1,1,4,64,2048,0
16-737-326-1x1-912-737-326-1-0x0-1x1-1x1-0-NCHW-FP32-B=ConvOclDirectFwd1x1:1,256,1,1,0,2,16,8,0
256-35-35-1x1-48-35-35-16-0x0-1x1-1x1-0-NCHW-FP32-F=ConvAsm1x1U:2,16,2,64,2,2,2,1;ConvOclDirectFwd1x1:1,64,1,1,1,0,16,2048,0;ConvActivAsm1x1U:2,16,2,32,2,3
1440-424-391-1x1-928-424-391-1-0x0-1x1-1x1-0-NCHW-FP32-F=ConvOclDirectFwd1x1:1,64,1,1,1,1,32,2048,0
96-339-197-1x1-1680-339-197-2-0x0-1x1-1x1-0-NCHW-FP32-B=ConvOclDirectFwd1x1:1,256,1,1,0,1,16,4,0
608-437-129-1x1-960-437-129-8-0x0-1x1-1x1-0-NCHW-FP32-B=ConvOclDirectFwd1x1:1,128,1,1,0,1,32,4,0
80-323-28-1x1-1000-323-28-2-0x0-1x1-1x1-0-NCHW-FP32-B=ConvOclDirectFwd1x1:1,64,1,1,0,4,16,8,0
120-7-7-1x1-480-7-7-32-0x0-1x1-1x1-0-NCHW-FP32-F_g3=ConvOclDirectFwd:8,8,8,8,1,1,8,4,2
1104-305-250-1x1-608-305-250-1-0x0-1x1-1x1-0-NCHW-FP32-F=ConvOclDirectFwd1x1:1,64,1,1,1,0,64,2048,0
800-328-83-1x1-1152-328-83-2-0x0-1x1-1x1-0-NCHW-FP32-B=ConvOclDirectFwd1x1:1,256,1,1,0,2,32,4,0
384-17-17-1x1-1024-17-17-128-0x0-1x1-1x1-0-NCHW-FP32-B=ConvAsm1x1U:1,16,1,64,3,2,1,4;ConvOclDirectFwd1x1:1,256,1,1,0,1,32,4,0
192-14-14-1x1-1296-14-14-16-0x0-1x1-1x1-0-NCHW-FP32-B=ConvAsm1x1U:1,16,1,32,2,2,2,2;ConvOclDirectFwd1x1:1,64,1,1,0,4,16,4,0
128-54-54-1x1-16-54-54-32-0x0-1x1-1x1-0-NCHW-FP16-F=ConvAsm1x1U:1,8,2,64,1,4,1,1;ConvOclDirectFwd1x1:16,64,32,32,0,2,16,4,1
384-27-27-1x1-48-27-27-256-0x0-1x1-1x1-0-NCHW-FP32-B=ConvAsm1x1U:3,16,6,64,2,2,1,1;ConvOclDirectFwd1x1:1,256,1,1,0,1,16,4,0
16-54-54-3x3-64-54-54-32-1x1-1x1-1x1-0-NCHW-FP16-F=ConvOclDirectFwd:32,8,32,32,1,4,8,1,2
1088-922-15-1x1-144-922-15-2-0x0-1x1-1x1-0-NCHW-FP32-F=ConvOclDirectFwd1x1:1,64,1,1,1,1,64,2048,0
512-15-15-1x1-1024-15-15-256-0x0-1x1-1x1-0-NCHW-FP32-B=ConvAsm1x1U:2,16,4,64,1,2,2,1;ConvOclDirectFwd1x1:1,256,1,1,0,1,32,4,0
1632-114-179-1x1-448-114-179-12-0x0-1x1-1x1-0-NCHW-FP32-F=ConvOclDirectFwd1x1:1,64,1,1,1,4,32,2048,0
54-106-273-1x1-232-106-273-64-0x0-1x1-1x1-0-NCHW-FP32-B=ConvOclDirectFwd1x1:1,256,1,1,0,1,16,4,0
8-252-194-1x1-1280-252-194-2-0x0-1x1-1x1-0-NCHW-FP32-B=ConvOclDirectFwd1x1:1,256,1,1,0,4,16,8,0
256-56-56-1x1-128-28-28-256-0x0-2x2-1x1-0-NCHW-FP16-F=ConvAsm1x1U:1,8,2,32,2,4,1,8;ConvOclDirectFwd1x1:1,256,1,1,0,2,32,4,0
352-292-124-1x1-240-292-124-4-0x0-1x1-1x1-0-NCHW-FP32-W=ConvAsmBwdWrW1x1:2,8,4,4,4,1,1,4,0,1
116-20-925-1x1-8-20-925-6-0x0-1x1-1x1-0-NCHW-FP32-B=ConvAsm1x1U:3,8,6,64,2,1,1,1;ConvOclDirectFwd1x1:1,64,1,1,0,1,8,4,0
192-28-28-1x1-672-28-28-16-0x0-1x1-1x1-0-NCHW-FP16-W=ConvAsmBwdWrW1x1:2,8,4,8,2,1,2,4,0,1
128-250-128-1x1-144-250-128-4-0x0-1x1-1x1-0-NCHW-FP32-F=ConvOclDirectFwd1x1:16,16,32,32,1,0,32,128,1
4-557-308-1x1-624-557-308-4-0x0-1x1-1x1-0-NCHW-FP32-B=ConvOclDirectFwd1x1:1,64,1,1,0,4,16,4,0
128-28-28-1x1-320-28-28-128-0x0-1x1-1x1-0-NCHW-FP32-W=ConvAsmBwdWrW1x1:4,4,4,4,8,2,2,4,0,1
1024-15-15-1x1-1024-15-15-48-0x0-1x1-1x1-0-NCHW-FP32-F=ConvAsm1x1U:4,16,4,32,2,2,2,1;ConvOclDirectFwd1x1:1,64,1,1,1,1,32,2048,0
240-7-7-1x1-960-7-7-32-0x0-1x1-1x1-0-NCHW-FP16-B_g3=ConvOclDirectFwd:8,8,8,8,1,1,8,2,1
256-17-17-3x3-224-35-35-128-0x0-2x2-1x1-0-NCHW-FP16-B=ConvOclDirectFwd:16,16,16,16,1,1,4,4,1
80-1023-69-1x1-19-1023-69-64-0x0-1x1-1x1-0-NCHW-FP32-F=ConvOclDirectFwd1x1:1,256,1,1,0,1,16,8,0
232-7-7-1x1-232-7-7-1024-0x0-1x1-1x1-0-NCHW-FP32-F=ConvAsm1x1U:1,16,1,64,3,2,2,2;ConvOclDirectFwd1x1:1,256,1,1,0,1,16,8,0
192-297-47-1x1-8-297-47-4-0x0-1x1-1x1-0-NCHW-FP32-F=ConvAsm1x1U:2,8,2,64,1,2,1,1;ConvOclDirectFwd1x1:1,128,1,1,0,1,8,4,0
928-7-7-1x1-128-7-7-32-0x0-1x1-1x1-0-NCHW-FP16-W=ConvAsmBwdWrW1x1:2,8,2,8,2,1,2,2,0,1
816-899-94-1x1-704-899-94-1-0x0-1x1-1x1-0-NCHW-FP32-F=ConvOclDirectFwd1x1:1,64,1,1,1,4,16,2048,0
192-8-8-3x3-192-17-17-128-0x0-2x2-1x1-0-NCHW-FP16-B=ConvOclDirectFwd:32,16,32,32,1,2,4,2,2
464-112-711-1x1-232-112-711-6-0x0-1x1-1x1-0-NCHW-FP32-F=ConvOclDirectFwd1x1:1,256,1,1,0,1,16,8,0
64-56-56-1x1-64-56-56-512-0x0-1x1-1x1-0-NCHW-FP16-B=ConvAsm1x1U:1,16,2,64,1,2,1,2;ConvOclDirectFwd1x1:1,64,1,1,0,4,16,4,0
144-433-28-1x1-768-433-28-2-0x0-1x1-1x1-0-NCHW-FP32-F=ConvOclDirectFwd1x1:1,64,1,1,1,0,16,2048,0
16-54-54-1x1-96-54-54-64-0x0-1x1-1x1-0-NCHW-FP16-F=ConvAsm1x1U:1,8,2,64,1,4,1,2;ConvOclDirectFwd1x1:1,256,1,1,0,2,16,8,0
1584-14-14-1x1-192-14-14-16-0x0-1x1-1x1-0-NCHW-FP32-F=ConvAsm1x1U:4,8,7,32,1,2,2,2;ConvOclDirectFwd1x1:1,64,1,1,1,4,16,256,0;ConvActivAsm1x1U:3,16,3,16,4,4
192-161-30-1x1-720-161-30-16-0x0-1x1-1x1-0-NCHW-FP32-B=ConvAsm1x1U:3,16,6,64,1,2,1,4;ConvOclDirectFwd1x1:1,128,1,1,0,2,16,4,0
224-1007-53-1x1-192-1007-53-16-0x0-1x1-1x1-0-NCHW-FP32-B=ConvOclDirectFwd1x1:1,256,1,1,0,1,32,4,0
32-28-28-1x1-192-28-28-4-0x0-1x1-1x1-0-NCHW-FP16-W=ConvAsmBwdWrW1x1:4,4,2,1,4,1,2,4,0,1
1000-950-53-1x1-96-950-53-1-0x0-1x1-1x1-0-NCHW-FP32-B=ConvOclDirectFwd1x1:1,256,1,1,0,2,32,4,0
58-284-577-1x1-672-284-577-1-0x0-1x1-1x1-0-NCHW-FP32-F=ConvOclDirectFwd1x1:1,64,1,1,0,2,32,4,0
512-7-7-1x1-512-7-7-128-0x0-1x1-1x1-0-NCHW-FP32-F=ConvAsm1x1U:2,16,2,32,2,2,1,8;ConvOclDirectFwd1x1:1,64,1,1,1,1,32,2048,0
512-32-32-1x1-2048-32-32-4-0x0-1x1-1x1-0-NCHW-FP32-F=ConvAsm1x1U:4,8,8,64,2,2,1,4;ConvOclDirectFwd1x1:1,64,1,1,1,4,32,2048,0
800-14-14-1x1-128-14-14-512-0x0-1x1-1x1-0-NCHW-FP16-W=ConvAsmBwdWrW1x1:2,8,4,8,2,1,2,4,0,1
32-827-197-1x1-896-827-197-2-0x0-1x1-1x1-0-NCHW-FP32-B=ConvOclDirectFwd1x1:1,256,1,1,0,1,32,4,0
416-17-699-1x1-16-17-699-1-0x0-1x1-1x1-0-NCHW-FP32-B=ConvOclDirectFwd1x1:1,64,1,1,0,1,4,4,0
1056-155-92-1x1-3-155-92-8-0x0-1x1-1x1-0-NCHW-FP32-B=ConvOclDirectFwd1x1:1,256,1,1,0,4,16,4,0
512-28-28-3x3-256-28-28-256-1x1-1x1-1x1-0-NCHW-FP32-W=ConvAsmBwdWrW3x3:0,0,8,4,4,1
576-180-88-1x1-992-180-88-16-0x0-1x1-1x1-0-NCHW-FP32-F=ConvOclDirectFwd1x1:1,64,1,1,1,4,64,2048,0
256-14-14-1x1-128-14-14-16-0x0-1x1-1x1-0-NCHW-FP16-B=ConvAsm1x1U:1,8,2,64,1,2,4,1;ConvOclDirectFwd1x1:1,64,1,1,0,4,4,4,0
64-56-56-1x1-256-56-56-4-0x0-1x1-1x1-0-NCHW-FP16-F=ConvAsm1x1U:1,8,2,16,1,4,2,2;ConvOclDirectFwd1x1:1,64,1,1,0,4,16,4,0
112-14-14-1x1-512-14-14-64-0x0-1x1-1x1-0-NCHW-FP16-B=ConvAsm1x1U:1,16,2,64,1,2,1,4;ConvOclDirectFwd1x1:1,256,1,1,0,4,8,4,0
704-14-14-1x1-128-14-14-16-0x0-1x1-1x1-0-NCHW-FP32-B=ConvAsm1x1U:4,8,4,64,1,4,2,2;ConvOclDirectFwd1x1:1,64,1,1,0,1,8,4,0
128-27-27-1x1-32-27-27-256-0x0-1x1-1x1-0-NCHW-FP16-F=ConvAsm1x1U:1,8,2,64,1,4,1,4;ConvOclDirectFwd1x1:1,256,1,1,0,1,16,4,0
120-14-14-3x3-120-7-7-2-1x1-2x2-1x1-0-NCHW-FP32-F=ConvOclDirectFwd:8,8,8,8,1,1,1,4,2
768-107-697-1x1-336-107-697-2-0x0-1x1-1x1-0-NCHW-FP32-B=ConvOclDirectFwd1x1:1,128,1,1,0,1,16,8,0
416-28-28-1x1-128-28-28-32-0x0-1x1-1x1-0-NCHW-FP32-F=ConvAsm1x1U:4,16,5,32,1,2,2,2;ConvOclDirectFwd1x1:1,64,1,1,1,1,32,2048,0
5-10-10-3x3-3-10-10-16-1x1-1x1-1x1-0-NCHW-FP32-F=ConvOclDirectFwd:16,16,16,16,1,1,2,2,2
800-900-712-1x1-336-900-712-1-0x0-1x1-1x1-0-NCHW-FP32-B=ConvOclDirectFwd1x1:1,64,1,1,0,4,16,4,0
704-18-815-1x1-480-18-815-12-0x0-1x1-1x1-0-NCHW-FP32-F=ConvOclDirectFwd1x1:1,64,1,1,1,0,64,2048,0
112-64-128-3x3-224-64-128-1-1x1-1x1-1x1-0-NCHW-FP16-F=ConvOclDirectFwd:8,32,16,32,2,1,8,4,1
512-29-29-1x1-256-57-57-8-0x0-2x2-1x1-0-NCHW-FP32-B=ConvAsm1x1U:4,16,7,64,1,2,1,2;ConvOclDirectFwd1x1:1,256,1,1,0,1,32,4,0
64-35-35-1x1-384-35-35-256-0x0-1x1-1x1-0-NCHW-FP16-B=ConvAsm1x1U:1,16,2,64,1,2,1,2;ConvOclDirectFwd1x1:1,64,1,1,0,1,32,4,0
32-479-21-1x1-768-479-21-32-0x0-1x1-1x1-0-NCHW-FP32-F=ConvOclDirectFwd1x1:1,64,1,1,1,1,64,2048,0
608-4-4-1x1-128-4-4-32-0x0-1x1-1x1-0-NCHW-FP16-F=ConvAsm1x1U:1,4,2,4,1,4,4,2;ConvOclDirectFwd1x1:1,128,1,1,0,1,4,8,0
512-8-8-3x3-512-15-15-64-1x1-2x2-1x1-0-NCHW-FP32-B=ConvOclDirectFwd:8,16,16,16,2,1,4,1,2
832-7-7-1x1-256-7-7-2-0x0-1x1-1x1-0-NCHW-FP16-F=ConvAsm1x1U:1,8,2,16,1,4,4,1;ConvOclDirectFwd1x1:1,64,1,1,0,1,4,8,0
64-28-28-1x1-256-28-28-16-0x0-1x1-1x1-0-NCHW-FP16-B=ConvAsm1x1U:1,16,2,16,1,2,2,2;ConvOclDirectFwd1x1:1,64,1,1,0,4,16,4,0
608-108-258-1x1-1824-108-258-4-0x0-1x1-1x1-0-NCHW-FP32-B=ConvOclDirectFwd1x1:1,256,1,1,0,1,32,4,0
192-246-173-1x1-64-246-173-4-0x0-1x1-1x1-0-NCHW-FP32-B=ConvOclDirectFwd1x1:1,256,1,1,0,2,32,4,0
120-14-14-1x1-480-14-14-128-0x0-1x1-1x1-0-NCHW-FP32-F_g3=ConvOclDirectFwd:16,16,16,16,1,1,8,4,1
64-56-56-3x3-64-56-56-16-1x1-1x1-1x1-0-NCHW-FP16-B=ConvOclDirectFwd:8,16,32,32,4,2,8,1,1
1024-450-183-1x1-1104-450-183-1-0x0-1x1-1x1-0-NCHW-FP32-F=ConvOclDirectFwd1x1:1,64,1,1,1,0,32,2048,0
192-35-35-1x1-48-35-35-256-0x0-1x1-1x1-0-NCHW-FP32-F=ConvAsm1x1U:2,16,3,32,4,2,1,1;ConvOclDirectFwd1x1:1,64,1,1,1,4,32,256,0;ConvActivAsm1x1U:2,16,3,32,4,1
448-312-840-1x1-704-312-840-1-0x0-1x1-1x1-0-NCHW-FP32-F=ConvOclDirectFwd1x1:1,64,1,1,1,0,32,2048,0
128-14-14-1x1-768-14-14-256-0x0-1x1-1x1-0-NCHW-FP16-F=ConvAsm1x1U:1,8,2,16,2,4,1,8;ConvOclDirectFwd1x1:1,256,1,1,0,4,16,4,0
160-14-14-1x1-512-14-14-128-0x0-1x1-1x1-0-NCHW-FP32-B=ConvAsm1x1U:1,32,1,32,2,1,2,1;ConvOclDirectFwd1x1:1,256,1,1,0,1,32,4,0
48-601-13-1x1-116-601-13-8-0x0-1x1-1x1-0-NCHW-FP32-W=ConvAsmBwdWrW1x1:4,4,2,4,4,1,4,4,0,2
1776-142-69-1x1-96-142-69-12-0x0-1x1-1x1-0-NCHW-FP32-F=ConvOclDirectFwd1x1:1,64,1,1,1,0,64,2048,0
608-56-505-1x1-480-56-505-2-0x0-1x1-1x1-0-NCHW-FP32-B=ConvOclDirectFwd1x1:1,256,1,1,0,2,32,4,0
912-999-63-1x1-608-999-63-4-0x0-1x1-1x1-0-NCHW-FP32-F=ConvOclDirectFwd1x1:1,64,1,1,1,4,64,2048,0
256-14-14-1x1-256-14-14-1-0x0-1x1-1x1-0-NCHW-FP16-F=ConvAsm1x1U:1,8,2,32,1,4,4,2;ConvOclDirectFwd1x1:1,128,1,1,0,4,4,8,0
64-12-120-3x3-32-12-120-1-1x1-1x1-1x1-0-NCHW-FP16-B=ConvOclDirectFwd:8,16,8,16,1,1,1,4,1
128-14-14-1x1-544-14-14-32-0x0-1x1-1x1-0-NCHW-FP32-F=ConvAsm1x1U:2,16,2,64,3,2,1,2;ConvOclDirectFwd1x1:1,64,1,1,1,0,64,128,0
512-8-8-3x3-512-15-15-8-1x1-2x2-1x1-0-NCHW-FP32-W=ConvAsmBwdWrW3x3:0,0,8,8,5,1
672-14-14-1x1-128-14-14-512-0x0-1x1-1x1-0-NCHW-FP32-W=ConvAsmBwdWrW1x1:2,8,4,8,4,2,2,4,0,1
1024-14-14-1x1-1024-14-14-4-0x0-1x1-1x1-0-NCHW-FP32-F=ConvAsm1x1U:3,16,7,16,1,2,4,1;ConvOclDirectFwd1x1:1,64,1,1,1,1,16,2048,0
112-151-778-1x1-3-151-778-4-0x0-1x1-1x1-0-NCHW-FP32-B=ConvOclDirectFwd1x1:1,64,1,1,0,2,8,8,0
1024-14-14-1x1-512-14-14-32-0x0-1x1-1x1-0-NCHW-FP32-F=ConvAsm1x1U:3,16,4,64,1,2,1,8;ConvOclDirectFwd1x1:1,64,1,1,1,1,32,2048,0
128-28-28-1x1-192-28-28-32-0x0-1x1-1x1-0-NCHW-FP32-F=ConvAsm1x1U:2,16,2,32,2,2,1,4;ConvOclDirectFwd1x1:1,64,1,1,1,1,16,2048,0
768-7-7-1x1-128-7-7-128-0x0-1x1-1x1-0-NCHW-FP32-B=ConvAsm1x1U:1,16,1,64,2,2,4,1;ConvOclDirectFwd1x1:1,128,1,1,0,1,8,4,0
240-7-7-1x1-960-7-7-8-0x0-1x1-1x1-0-NCHW-FP32-B_g3=ConvOclDirectFwd:8,8,8,8,1,1,8,4,2
160-56-56-1x1-128-56-56-256-0x0-1x1-1x1-0-NCHW-FP16-B=ConvAsm1x1U:1,16,2,32,1,2,1,4;ConvOclDirectFwd1x1:1,64,1,1,0,4,16,4,0
48-27-27-1x1-256-27-27-64-0x0-1x1-1x1-0-NCHW-FP32-W=ConvAsmBwdWrW1x1:4,4,4,2,8,1,2,4,0,1
1536-8-8-1x1-384-8-8-1-0x0-1x1-1x1-0-NCHW-FP16-F=ConvAsm1x1U:1,8,2,16,1,4,4,2;ConvOclDirectFwd1x1:1,128,1,1,0,1,4,8,0
144-811-121-1x1-8-811-121-16-0x0-1x1-1x1-0-NCHW-FP32-W=ConvAsmBwdWrW1x1:4,4,2,1,2,1,1,4,0,1
80-73-73-1x1-64-73-73-256-0x0-1x1-1x1-0-NCHW-FP32-W=ConvAsmBwdWrW1x1:4,4,4,4,2,1,2,4,0,2
256-56-56-1x1-64-56-56-8-0x0-1x1-1x1-0-NCHW-FP32-B=ConvAsm1x1U:1,16,1,64,1,2,2,1;ConvOclDirectFwd1x1:1,128,1,1,0,4,16,4,0
1-48-480-3x3-16-48-480-256-1x1-1x1-1x1-0-NCHW-FP32-F=ConvOclDirectFwd:8,8,16,16,2,2,8,1,2
224-89-380-1x1-54-89-380-4-0x0-1x1-1x1-0-NCHW-FP32-F=ConvOclDirectFwd1x1:1,256,1,1,0,4,16,4,0
64-75-75-3x3-64-75-75-64-1x1-1x1-1x1-0-NCHW-FP32-W=ConvAsmBwdWrW3x3:0,1,16,4,2,4
1024-15-15-1x1-512-29-29-2-0x0-2x2-1x1-0-NCHW-FP32-W=ConvAsmBwdWrW1x1:1,16,4,2,8,1,1,4,0,0
1584-973-45-1x1-128-973-45-1-0x0-1x1-1x1-0-NCHW-FP32-F=ConvOclDirectFwd1x1:1,64,1,1,1,1,16,256,0
64-73-73-1x1-80-73-73-128-0x0-1x1-1x1-0-NCHW-FP16-F=ConvAsm1x1U:2,16,4,64,1,2,1,1;ConvOclDirectFwd1x1:1,256,1,1,0,1,16,8,0
320-353-647-1x1-320-353-647-1-0x0-1x1-1x1-0-NCHW-FP32-F=ConvOclDirectFwd1x1:1,64,1,1,1,4,32,2048,0
1488-91-968-1x1-4-91-968-1-0x0-1x1-1x1-0-NCHW-FP32-F=ConvOclDirectFwd1x1:1,256,1,1,0,4,16,4,0
32-28-28-3x3-128-28-28-64-1x1-1x1-1x1-0-NCHW-FP16-F=ConvOclDirectFwd:16,16,32,32,2,2,8,1,2
112-19-869-1x1-1-19-869-64-0x0-1x1-1x1-0-NCHW-FP32-B=ConvAsm1x1U:2,1,8,4,4,2,4,1;ConvOclDirectFwd1x1:1,256,1,1,0,1,16,4,0
160-17-17-1x1-768-17-17-256-0x0-1x1-1x1-0-NCHW-FP16-F=ConvAsm1x1U:2,16,4,16,1,2,1,4;ConvOclDirectFwd1x1:1,64,1,1,0,1,32,4,0
16-14-14-1x1-480-14-14-256-0x0-1x1-1x1-0-NCHW-FP16-F=ConvAsm1x1U:1,8,2,64,1,4,1,4;ConvOclDirectFwd1x1:1,128,1,1,0,4,8,4,0
128-14-14-1x1-320-14-14-512-0x0-1x1-1x1-0-NCHW-FP32-F=ConvAsm1x1U:2,16,2,64,3,2,1,4;ConvOclDirectFwd1x1:1,64,1,1,1,1,16,256,0
32-14-14-1x1-528-14-14-4-0x0-1x1-1x1-0-NCHW-FP16-B=ConvAsm1x1U:1,8,2,64,1,4,2,1;ConvOclDirectFwd1x1:1,64,1,1,0,4,4,4,0
448-28-28-1x1-128-28-28-64-0x0-1x1-1x1-0-NCHW-FP16-W=ConvAsmBwdWrW1x1:2,8,8,1,8,1,2,4,0,1
24-128-128-1x1-512-128-128-1-0x0-1x1-1x1-0-NCHW-FP32-W=ConvAsmBwdWrW1x1:4,4,8,4,2,1,1,4,0,3
128-7-7-1x1-800-7-7-512-0x0-1x1-1x1-0-NCHW-FP16-B=ConvAsm1x1U:1,16,2,16,1,2,1,2;ConvOclDirectFwd1x1:1,64,1,1,0,1,32,4,0
3-6-6-3x3-4-2-2-32-0x0-2x2-1x1-0-NCHW-FP32-F=ConvOclDirectFwd:8,8,8,8,1,1,1,2,2
1024-14-14-1x1-256-14-14-64-0x0-1x1-1x1-0-NCHW-FP16-W=ConvAsmBwdWrW1x1:1,16,4,8,2,1,2,4,0,1
1216-28-735-1x1-992-28-735-4-0x0-1x1-1x1-0-NCHW-FP32-F=ConvOclDirectFwd1x1:1,64,1,1,1,4,64,2048,0
1280-8-657-1x1-1792-8-657-12-0x0-1x1-1x1-0-NCHW-FP32-B=ConvOclDirectFwd1x1:1,128,1,1,0,2,32,4,0
256-56-56-1x1-128-56-56-32-0x0-1x1-1x1-0-NCHW-FP32-B=ConvAsm1x1U:1,32,1,64,1,1,2,4;ConvOclDirectFwd1x1:1,128,1,1,0,1,32,4,0
116-959-330-1x1-24-959-330-2-0x0-1x1-1x1-0-NCHW-FP32-F=ConvOclDirectFwd1x1:1,256,1,1,0,2,16,4,0
1792-793-78-1x1-58-793-78-4-0x0-1x1-1x1-0-NCHW-FP32-F=ConvOclDirectFwd1x1:1,256,1,1,0,2,8,4,0
192-8-8-1x1-1280-8-8-32-0x0-1x1-1x1-0-NCHW-FP32-W=ConvAsmBwdWrW1x1:1,16,4,8,2,1,2,4,0,0
24-56-56-1x1-58-56-56-512-0x0-1x1-1x1-0-NCHW-FP16-F=ConvAsm1x1U:1,8,2,16,1,2,1,1;ConvOclDirectFwd1x1:1,128,1,1,0,2,16,4,0
448-917-10-1x1-1760-917-10-4-0x0-1x1-1x1-0-NCHW-FP32-W=ConvAsmBwdWrW1x1:2,8,4,8,4,1,1,4,0,1
16-559-878-1x1-19-559-878-1-0x0-1x1-1x1-0-NCHW-FP32-F=ConvOclDirectFwd1x1:1,256,1,1,0,2,16,8,0
960-510-337-1x1-640-510-337-1-0x0-1x1-1x1-0-NCHW-FP32-B=ConvOclDirectFwd1x1:1,256,1,1,0,2,32,4,0
128-14-14-1x1-528-14-14-512-0x0-1x1-1x1-0-NCHW-FP32-W=ConvAsmBwdWrW1x1:2,8,4,8,4,2,2,4,0,1
768-17-17-1x1-192-17-17-4-0x0-1x1-1x1-0-NCHW-FP32-F=ConvAsm1x1U:2,8,2,32,2,4,2,2;ConvOclDirectFwd1x1:1,64,1,1,1,0,16,256,0;ConvActivAsm1x1U:4,16,4,16,1,4
192-27-27-5x5-64-27-27-32-2x2-1x1-1x1-0-NCHW-FP32-B=ConvOclDirectFwd:16,16,32,32,2,2,4,1,2
480-14-14-1x1-64-14-14-1-0x0-1x1-1x1-0-NCHW-FP16-F=ConvAsm1x1U:1,8,2,16,1,4,4,1;ConvOclDirectFwd1x1:1,64,1,1,0,4,4,8,0
8-746-32-1x1-224-746-32-8-0x0-1x1-1x1-0-NCHW-FP32-B=ConvOclDirectFwd1x1:1,128,1,1,0,1,32,4,0
128-7-7-1x1-992-7-7-32-0x0-1x1-1x1-0-NCHW-FP16-F=ConvAsm1x1U:2,8,4,16,1,4,1,8;ConvOclDirectFwd1x1:1,128,1,1,0,1,8,4,0
544-14-14-1x1-128-14-14-512-0x0-1x1-1x1-0-NCHW-FP32-B=ConvAsm1x1U:1,32,1,16,2,1,1,2;ConvOclDirectFwd1x1:1,128,1,1,0,1,32,4,0
224-960-7-1x1-1008-960-7-2-0x0-1x1-1x1-0-NCHW-FP32-B=ConvOclDirectFwd1x1:1,128,1,1,0,4,16,8,0
80-899-918-1x1-48-899-918-2-0x0-1x1-1x1-0-NCHW-FP32-B=ConvOclDirectFwd1x1:1,128,1,1,0,1,16,8,0
1536-145-27-1x1-224-145-27-64-0x0-1x1-1x1-0-NCHW-FP32-F=ConvOclDirectFwd1x1:1,64,1,1,1,1,64,2048,0
3-312-914-1x1-3-312-914-128-0x0-1x1-1x1-0-NCHW-FP32-F=ConvAsm1x1U:1,1,2,4,1,1,1,1;ConvOclDirectFwd1x1:1,128,1,1,0,1,16,4,0
64-73-73-3x3-96-71-71-8-0x0-1x1-1x1-0-NCHW-FP32-F=ConvOclDirectFwd:16,8,16,16,1,2,8,4,1
128-7-7-1x1-896-7-7-128-0x0-1x1-1x1-0-NCHW-FP16-B=ConvAsm1x1U:2,8,4,16,1,4,1,4;ConvOclDirectFwd1x1:1,64,1,1,0,1,8,4,0
320-585-196-1x1-16-585-196-1-0x0-1x1-1x1-0-NCHW-FP32-F=ConvOclDirectFwd1x1:1,64,1,1,1,4,64,2048,0
16-472-562-1x1-48-472-562-12-0x0-1x1-1x1-0-NCHW-FP32-W=ConvAsmBwdWrW1x1:4,4,2,1,2,1,2,4,0,1
128-14-14-1x1-800-14-14-64-0x0-1x1-1x1-0-NCHW-FP32-F=ConvAsm1x1U:1,16,1,32,4,2,2,2;ConvOclDirectFwd1x1:1,64,1,1,1,0,32,2048,0
48-268-203-1x1-96-268-203-1-0x0-1x1-1x1-0-NCHW-FP32-F=ConvOclDirectFwd1x1:1,64,1,1,1,1,16,64,0
256-14-14-1x1-512-28-28-128-0x0-2x2-1x1-0-NCHW-FP32-W=ConvAsmBwdWrW1x1:2,8,4,8,4,1,2,4,0,1
48-27-27-1x1-384-27-27-128-0x0-1x1-1x1-0-NCHW-FP32-F=ConvAsm1x1U:2,16,2,64,3,2,1,2;ConvOclDirectFwd1x1:1,64,1,1,1,0,16,2048,0
608-617-366-1x1-832-617-366-2-0x0-1x1-1x1-0-NCHW-FP32-F=ConvOclDirectFwd1x1:1,64,1,1,1,4,16,2048,0
1024-8-8-3x3-1024-8-8-16-1x1-1x1-1x1-0-NCHW-FP32-B_g32=ConvOclDirectFwd:8,8,8,8,1,1,4,1,1
128-28-28-3x3-64-56-56-12-1x1-2x2-1x1-0-NCHW-FP32-B=ConvOclDirectFwd:8,32,32,32,4,1,8,2,2
608-679-26-1x1-1792-679-26-8-0x0-1x1-1x1-0-NCHW-FP32-B=ConvOclDirectFwd1x1:1,64,1,1,0,2,32,4,0
64-35-35-1x1-288-35-35-32-0x0-1x1-1x1-0-NCHW-FP32-W=ConvAsmBwdWrW1x1:2,8,4,8,2,1,4,4,0,2
58-188-665-1x1-1-188-665-48-0x0-1x1-1x1-0-NCHW-FP32-B=ConvOclDirectFwd1x1:1,256,1,1,0,4,16,4,0
224-35-35-3x3-192-35-35-1-1x1-1x1-1x1-0-NCHW-FP16-B=ConvOclDirectFwd:16,8,16,16,1,2,4,2,1
992-537-36-1x1-4-537-36-6-0x0-1x1-1x1-0-NCHW-FP32-F=ConvOclDirectFwd1x1:1,256,1,1,0,4,16,4,0
128-14-14-1x1-256-14-14-256-0x0-1x1-1x1-0-NCHW-FP32-W=ConvAsmBwdWrW1x1:2,8,4,8,2,1,4,4,0,2
64-411-41-1x1-464-411-41-1-0x0-1x1-1x1-0-NCHW-FP32-B=ConvOclDirectFwd1x1:1,256,1,1,0,1,16,8,0
128-10-10-1x1-512-10-10-64-0x0-1x1-1x1-0-NCHW-FP32-B=ConvAsm1x1U:1,16,1,64,2,2,1,4;ConvOclDirectFwd1x1:1,256,1,1,0,4,16,4,0
112-307-130-1x1-624-307-130-12-0x0-1x1-1x1-0-NCHW-FP32-B=ConvOclDirectFwd1x1:1,64,1,1,0,2,16,4,0
1408-36-37-1x1-528-36-37-32-0x0-1x1-1x1-0-NCHW-FP32-F=ConvAsm1x1U:2,16,6,64,2,1,1,1;ConvOclDirectFwd1x1:1,64,1,1,1,4,32,2048,0
256-56-56-1x1-128-56-56-32-0x0-1x1-1x1-0-NCHW-FP16-B=ConvAsm1x1U:1,16,2,32,1,2,1,4;ConvOclDirectFwd1x1:1,64,1,1,0,4,16,4,0
768-322-980-1x1-80-322-980-2-0x0-1x1-1x1-0-NCHW-FP32-B=ConvOclDirectFwd1x1:1,256,1,1,0,4,16,8,0
8-424-799-1x1-116-424-799-4-0x0-1x1-1x1-0-NCHW-FP32-B=ConvOclDirectFwd1x1:1,256,1,1,0,4,16,8,0
544-14-14-1x1-128-14-14-64-0x0-1x1-1x1-0-NCHW-FP16-F=ConvAsm1x1U:2,8,4,64,1,4,2,4;ConvOclDirectFwd1x1:1,64,1,1,0,4,16,4,0
1280-150-38-1x1-2048-150-38-4-0x0-1x1-1x1-0-NCHW-FP32-W=ConvAsmBwdWrW1x1:1,16,2,8,8,1,1,4,0,0
2-986-274-1x1-232-986-274-2-0x0-1x1-1x1-0-NCHW-FP32-B=ConvOclDirectFwd1x1:1,64,1,1,0,4,16,4,0
1024-17-17-1x1-192-17-17-128-0x0-1x1-1x1-0-NCHW-FP32-F=ConvAsm1x1U:4,16,5,64,2,2,1,1;ConvOclDirectFwd1x1:1,64,1,1,1,4,32,2048,0;ConvActivAsm1x1U:4,16,5,64,2,1
58-789-6-1x1-1664-789-6-4-0x0-1x1-1x1-0-NCHW-FP32-B=ConvOclDirectFwd1x1:1,256,1,1,0,1,64,4,0
384-14-14-1x1-128-14-14-16-0x0-1x1-1x1-0-NCHW-FP32-W=ConvAsmBwdWrW1x1:2,8,2,8,2,1,2,2,0,1
128-7-7-1x1-992-7-7-64-0x0-1x1-1x1-0-NCHW-FP32-B=ConvAsm1x1U:1,16,1,64,2,2,2,2;ConvOclDirectFwd1x1:1,256,1,1,0,1,8,4,0
256-32-32-3x3-256-32-32-4-1x1-1x1-1x1-0-NCHW-FP32-W=ConvAsmBwdWrW3x3:0,1,16,4,4,1
128-28-28-1x1-384-28-28-128-0x0-1x1-1x1-0-NCHW-FP32-B=ConvAsm1x1U:1,32,1,64,2,1,2,1;ConvOclDirectFwd1x1:1,256,1,1,0,1,32,4,0
128-28-28-1x1-256-56-56-2-0x0-2x2-1x1-0-NCHW-FP32-B=ConvAsm1x1U:1,16,1,32,1,2,2,2;ConvOclDirectFwd1x1:1,64,1,1,0,1,8,4,0
256-35-35-1x1-48-35-35-1-0x0-1x1-1x1-0-NCHW-FP16-F=ConvAsm1x1U:1,8,2,32,1,4,4,1;ConvOclDirectFwd1x1:1,128,1,1,0,1,4,8,0
32-149-149-3x3-3-299-299-4-0x0-2x2-1x1-0-NCHW-FP32-B=ConvOclDirectFwd:16,16,32,32,2,2,8,2,1
3-135-347-1x1-96-135-347-8-0x0-1x1-1x1-0-NCHW-FP32-W=ConvAsmBwdWrW1x1:4,4,2,1,2,1,4,4,0,3
608-603-107-1x1-160-603-107-12-0x0-1x1-1x1-0-NCHW-FP32-B=ConvOclDirectFwd1x1:1,128,1,1,0,1,32,4,0
24-14-14-5x5-64-14-14-64-2x2-1x1-1x1-0-NCHW-FP16-F=ConvOclDirectFwd:8,8,16,16,2,2,4,4,2;ConvOclDirectFwdFused:8,8,16,16,2,2,4,2,2
48-7-7-1x1-832-7-7-4-0x0-1x1-1x1-0-NCHW-FP32-B=ConvAsm1x1U:1,8,1,32,1,2,4,1;ConvOclDirectFwd1x1:1,256,1,1,0,1,4,4,0
4-397-232-1x1-432-397-232-4-0x0-1x1-1x1-0-NCHW-FP32-B=ConvOclDirectFwd1x1:1,64,1,1,0,2,16,4,0
192-172-380-1x1-768-172-380-8-0x0-1x1-1x1-0-NCHW-FP32-B=ConvOclDirectFwd1x1:1,128,1,1,0,1,32,4,0
64-14-14-1x1-512-14-14-256-0x0-1x1-1x1-0-NCHW-FP32-B=ConvAsm1x1U:1,16,1,64,2,2,1,2;ConvOclDirectFwd1x1:1,64,1,1,0,2,32,4,0
128-14-14-1x1-320-14-14-256-0x0-1x1-1x1-0-NCHW-FP16-W=ConvAsmBwdWrW1x1:2,8,2,8,2,1,4,4,0,3
128-28-28-3x3-128-28-28-8-1x1-1x1-1x1-0-NCHW-FP16-F=ConvOclDirectFwd:16,16,32,32,2,2,4,4,2;ConvOclDirectFwdFused:8,32,32,32,4,1,4,4,2
704-488-260-1x1-160-488-260-4-0x0-1x1-1x1-0-NCHW-FP32-B=ConvOclDirectFwd1x1:1,64,1,1,0,1,32,4,0
32-54-54-1x1-128-54-54-128-0x0-1x1-1x1-0-NCHW-FP32-W=ConvAsmBwdWrW1x1:4,4,2,2,4,1,2,4,0,3
192-28-28-1x1-96-28-28-512-0x0-1x1-1x1-0-NCHW-FP16-F=ConvAsm1x1U:1,8,2,32,2,4,1,4;ConvOclDirectFwd1x1:1,128,1,1,0,4,16,4,0
224-197-343-1x1-96-197-343-16-0x0-1x1-1x1-0-NCHW-FP32-F=ConvOclDirectFwd1x1:1,64,1,1,1,0,64,256,0
4-244-357-1x1-112-244-357-32-0x0-1x1-1x1-0-NCHW-FP32-F=ConvOclDirectFwd1x1:1,256,1,1,0,4,16,4,0
2048-8-8-1x1-1024-15-15-8-0x0-2x2-1x1-0-NCHW-FP32-B=ConvAsm1x1U:2,16,2,32,1,2,4,2;ConvOclDirectFwd1x1:1,64,1,1,0,1,8,8,0
736-575-400-1x1-416-575-400-2-0x0-1x1-1x1-0-NCHW-FP32-F=ConvOclDirectFwd1x1:1,64,1,1,1,0,64,2048,0
1120-537-394-1x1-1280-537-394-1-0x0-1x1-1x1-0-NCHW-FP32-F=ConvOclDirectFwd1x1:1,64,1,1,1,4,16,2048,0
160-29-212-1x1-64-29-212-64-0x0-1x1-1x1-0-NCHW-FP32-B=ConvAsm1x1U:1,16,1,64,1,2,1,4;ConvOclDirectFwd1x1:1,256,1,1,0,1,32,4,0
1024-371-21-1x1-1760-371-21-32-0x0-1x1-1x1-0-NCHW-FP32-B=ConvOclDirectFwd1x1:1,64,1,1,0,1,32,4,0
256-57-57-1x1-128-57-57-32-0x0-1x1-1x1-0-NCHW-FP32-B=ConvAsm1x1U:3,32,7,64,1,1,1,2;ConvOclDirectFwd1x1:1,256,1,1,0,1,32,4,0
54-844-56-1x1-800-844-56-12-0x0-1x1-1x1-0-NCHW-FP32-B=ConvOclDirectFwd1x1:1,256,1,1,0,2,32,4,0
1-2-2-3x3-2-5-5-64-0x0-2x2-1x1-0-NCHW-FP32-B=ConvOclDirectFwd:8,8,8,8,1,1,1,1,2
4-41-458-1x1-448-41-458-1-0x0-1x1-1x1-0-NCHW-FP32-F=ConvOclDirectFwd1x1:1,256,1,1,0,1,4,4,0
3-230-230-7x7-64-112-112-4-0x0-2x2-1x1-0-NCHW-FP32-F=ConvOclDirectFwd:16,16,16,32,1,2,8,1,2;ConvOclDirectFwdFused:16,16,16,32,1,2,8,1,2
128-28-28-1x1-512-28-28-16-0x0-1x1-1x1-0-NCHW-FP16-F=ConvAsm1x1U:1,8,2,32,2,4,1,4;ConvOclDirectFwd1x1:1,64,1,1,0,4,16,4,0
576-114-17-1x1-480-114-17-64-0x0-1x1-1x1-0-NCHW-FP32-B=ConvAsm1x1U:2,16,4,64,1,1,1,4;ConvOclDirectFwd1x1:1,64,1,1,0,2,32,4,0
512-19-19-1x1-256-19-19-32-0x0-1x1-1x1-0-NCHW-FP32-F=ConvAsm1x1U:3,16,3,64,2,2,1,8;ConvOclDirectFwd1x1:1,64,1,1,1,1,32,2048,0
736-153-211-1x1-58-153-211-12-0x0-1x1-1x1-0-NCHW-FP32-F=ConvOclDirectFwd1x1:1,128,1,1,0,1,8,4,0
128-28-28-1x1-416-28-28-32-0x0-1x1-1x1-0-NCHW-FP16-W=ConvAsmBwdWrW1x1:4,4,4,4,4,1,2,2,0,1
256-29-985-1x1-192-29-985-2-0x0-1x1-1x1-0-NCHW-FP32-W=ConvAsmBwdWrW1x1:4,4,8,2,8,1,2,4,0,0
3-241-607-1x1-4-241-607-6-0x0-1x1-1x1-0-NCHW-FP32-W=ConvAsmBwdWrW1x1:4,4,2,1,2,1,4,4,0,3
24-55-55-1x1-54-55-55-64-0x0-1x1-1x1-0-NCHW-FP32-F=ConvAsm1x1U:1,8,1,32,1,2,4,2;ConvOclDirectFwd1x1:1,256,1,1,0,1,8,8,0
128-39-174-5x5-64-80-350-2-1x1-2x2-1x1-0-NCHW-FP32-B=ConvOclDirectFwd:16,8,16,32,1,4,4,1,2
128-14-14-1x1-416-14-14-32-0x0-1x1-1x1-0-NCHW-FP32-B=ConvAsm1x1U:1,16,1,64,2,2,2,2;ConvOclDirectFwd1x1:1,64,1,1,0,4,16,4,0
16-603-4-1x1-24-603-4-256-0x0-1x1-1x1-0-NCHW-FP32-F=ConvAsm1x1U:2,8,2,64,1,2,1,1;ConvOclDirectFwd1x1:1,256,1,1,0,4,16,4,0
720-166-34-1x1-704-166-34-64-0x0-1x1-1x1-0-NCHW-FP32-F=ConvAsm1x1U:2,16,6,64,2,2,1,4;ConvOclDirectFwd1x1:1,64,1,1,1,4,16,2048,0
24-781-187-1x1-24-781-187-1-0x0-1x1-1x1-0-NCHW-FP32-F=ConvAsm1x1U:3,16,3,64,1,1,1,1;ConvOclDirectFwd1x1:1,256,1,1,0,1,8,4,0
1024-14-14-1x1-256-14-14-256-0x0-1x1-1x1-0-NCHW-FP16-F=ConvAsm1x1U:2,8,4,64,1,4,1,4;ConvOclDirectFwd1x1:1,128,1,1,0,2,16,4,0
192-7-7-1x1-1584-7-7-16-0x0-1x1-1x1-0-NCHW-FP16-W=ConvAsmBwdWrW1x1:1,16,2,8,2,1,2,4,0,1
608-14-14-1x1-128-14-14-256-0x0-1x1-1x1-0-NCHW-FP16-F=ConvAsm1x1U:2,8,4,64,1,4,2,2;ConvOclDirectFwd1x1:1,64,1,1,0,4,16,4,0
24-28-28-1x1-58-28-28-2-0x0-1x1-1x1-0-NCHW-FP16-F=ConvAsm1x1U:1,8,2,16,1,2,1,1;ConvOclDirectFwd1x1:1,128,1,1,0,2,16,4,0
1296-2-794-1x1-32-2-794-8-0x0-1x1-1x1-0-NCHW-FP32-F=ConvAsm1x1U:1,8,1,64,4,4,1,1;ConvOclDirectFwd1x1:8,16,8,32,1,0,32,128,1
1280-562-36-1x1-1376-562-36-6-0x0-1x1-1x1-0-NCHW-FP32-B=ConvOclDirectFwd1x1:1,128,1,1,0,2,32,4,0
60-28-28-1x1-240-28-28-8-0x0-1x1-1x1-0-NCHW-FP32-F_g3=ConvOclDirectFwd:16,16,16,16,1,1,8,4,1
640-796-99-1x1-32-796-99-8-0x0-1x1-1x1-0-NCHW-FP32-F=ConvOclDirectFwd1x1:1,64,1,1,1,4,64,2048,0
128-57-57-1x1-64-57-57-64-0x0-1x1-1x1-0-NCHW-FP32-W=ConvAsmBwdWrW1x1:4,4,4,2,4,1,4,4,0,2
128-14-14-3x3-128-28-28-512-1x1-2x2-1x1-0-NCHW-FP16-B=ConvOclDirectFwd:32,8,32,32,1,4,4,2,2
1408-814-111-1x1-1000-814-111-2-0x0-1x1-1x1-0-NCHW-FP32-F=ConvOclDirectFwd1x1:1,256,1,1,0,2,16,4,0
128-56-56-3x3-128-56-56-8-1x1-1x1-1x1-0-NCHW-FP32-B_g32=ConvOclDirectFwd:16,16,16,32,1,2,4,1,1
1-683-174-1x1-1312-683-174-1-0x0-1x1-1x1-0-NCHW-FP32-B=ConvOclDirectFwd1x1:1,256,1,1,0,1,4,4,0
48-7-592-1x1-1568-7-592-6-0x0-1x1-1x1-0-NCHW-FP32-W=ConvAsmBwdWrW1x1:4,4,8,2,8,1,1,4,0,0
64-35-35-1x1-192-35-35-8-0x0-1x1-1x1-0-NCHW-FP16-B=ConvAsm1x1U:1,16,2,64,1,2,1,4;ConvOclDirectFwd1x1:1,256,1,1,0,1,8,4,0
80-474-20-1x1-928-474-20-4-0x0-1x1-1x1-0-NCHW-FP32-B=ConvOclDirectFwd1x1:1,128,1,1,0,1,32,4,0
1024-7-7-3x3-1024-7-7-8-1x1-1x1-1x1-0-NCHW-FP32-F_g32=ConvOclDirectFwd:8,8,8,8,1,1,8,2,2
320-14-14-3x3-160-14-14-16-1x1-1x1-1x1-0-NCHW-FP16-B=ConvOclDirectFwd:8,16,16,16,2,1,8,1,2
192-128-256-1x1-16-128-256-1-0x0-1x1-1x1-0-NCHW-FP16-F=ConvOclDirectFwd1x1:1,256,1,1,0,2,8,4,0
256-57-57-3x3-256-29-29-4-1x1-2x2-1x1-0-NCHW-FP32-F_g32=ConvOclDirectFwd:16,16,32,32,2,2,8,1,1
48-976-941-1x1-128-976-941-2-0x0-1x1-1x1-0-NCHW-FP32-B=ConvOclDirectFwd1x1:1,256,1,1,0,2,32,4,0
992-410-482-1x1-768-410-482-1-0x0-1x1-1x1-0-NCHW-FP32-B=ConvOclDirectFwd1x1:1,64,1,1,0,2,32,4,0
288-654-742-1x1-96-654-742-1-0x0-1x1-1x1-0-NCHW-FP32-F=ConvOclDirectFwd1x1:1,64,1,1,1,4,64,2048,0
384-7-7-3x3-192-7-7-1-1x1-1x1-1x1-0-NCHW-FP16-B=ConvOclDirectFwd:8,8,8,8,1,1,1,4,1
240-14-14-1x1-60-14-14-256-0x0-1x1-1x1-0-NCHW-FP32-B_g3=ConvOclDirectFwd:16,8,16,8,1,1,8,2,1
512-14-14-3x3-512-7-7-4-1x1-2x2-1x1-0-NCHW-FP32-F=ConvOclDirectFwd:8,8,8,8,1,1,4,1,2
1104-14-14-1x1-192-14-14-16-0x0-1x1-1x1-0-NCHW-FP32-F=ConvAsm1x1U:3,16,3,16,1,2,2,1;ConvOclDirectFwd1x1:1,64,1,1,1,0,16,256,0;ConvActivAsm1x1U:3,16,3,16,4,4
64-14-14-1x1-480-14-14-512-0x0-1x1-1x1-0-NCHW-FP32-W=ConvAsmBwdWrW1x1:2,8,2,4,8,1,4,4,0,2
256-56-56-1x1-512-28-28-1-0x0-2x2-1x1-0-NCHW-FP16-F=ConvAsm1x1U:1,8,2,64,1,4,2,2;ConvOclDirectFwd1x1:1,64,1,1,0,2,16,8,0
1088-64-524-1x1-576-64-524-8-0x0-1x1-1x1-0-NCHW-FP32-F=ConvOclDirectFwd1x1:1,64,1,1,1,1,16,2048,0
960-333-64-1x1-1664-333-64-4-0x0-1x1-1x1-0-NCHW-FP32-B=ConvOclDirectFwd1x1:1,64,1,1,0,2,32,4,0
58-28-28-1x1-58-28-28-512-0x0-1x1-1x1-0-NCHW-FP16-B=ConvOclDirectFwd1x1:1,64,1,1,0,4,16,4,0
64-80-350-3x3-64-80-350-8-1x1-1x1-1x1-0-NCHW-FP32-W=ConvAsmBwdWrW3x3:0,1,16,2,2,1
32-64-128-1x1-528-64-128-1-0x0-1x1-1x1-0-NCHW-FP32-W=ConvAsmBwdWrW1x1:4,4,8,4,2,1,1,4,0,2
192-56-56-1x1-128-56-56-256-0x0-1x1-1x1-0-NCHW-FP16-B=ConvAsm1x1U:1,16,2,32,1,2,1,4;ConvOclDirectFwd1x1:1,128,1,1,0,4,16,4,0
336-888-14-1x1-19-888-14-6-0x0-1x1-1x1-0-NCHW-FP32-F=ConvAsm1x1U:3,8,4,64,2,1,1,1;ConvOclDirectFwd1x1:1,256,1,1,0,4,16,8,0
352-466-254-1x1-1120-466-254-4-0x0-1x1-1x1-0-NCHW-FP32-B=ConvOclDirectFwd1x1:1,64,1,1,0,2,32,4,0
928-7-7-1x1-128-7-7-64-0x0-1x1-1x1-0-NCHW-FP32-F=ConvAsm1x1U:4,8,4,16,1,4,2,2;ConvOclDirectFwd1x1:1,64,1,1,1,1,16,128,0
1024-8-8-1x1-2048-8-8-128-0x0-1x1-1x1-0-NCHW-FP32-B=ConvAsm1x1U:1,16,1,64,4,2,1,2;ConvOclDirectFwd1x1:1,256,1,1,0,4,16,4,0
80-547-6-1x1-128-547-6-4-0x0-1x1-1x1-0-NCHW-FP32-W=ConvAsmBwdWrW1x1:2,8,2,4,4,1,4,4,0,1
512-835-11-1x1-720-835-11-12-0x0-1x1-1x1-0-NCHW-FP32-B=ConvOclDirectFwd1x1:1,64,1,1,0,1,16,4,0
528-59-776-1x1-1-59-776-6-0x0-1x1-1x1-0-NCHW-FP32-B=ConvOclDirectFwd1x1:1,128,1,1,0,4,16,4,0
32-209-450-1x1-19-209-450-6-0x0-1x1-1x1-0-NCHW-FP32-F=ConvAsm1x1U:2,16,4,64,1,1,1,1;ConvOclDirectFwd1x1:1,256,1,1,0,2,16,4,0
1824-87-436-1x1-2-87-436-2-0x0-1x1-1x1-0-NCHW-FP32-F=ConvOclDirectFwd1x1:1,64,1,1,0,4,16,8,0
80-641-600-1x1-528-641-600-1-0x0-1x1-1x1-0-NCHW-FP32-B=ConvOclDirectFwd1x1:1,64,1,1,0,4,16,4,0
704-14-14-1x1-128-14-14-64-0x0-1x1-1x1-0-NCHW-FP32-F=ConvAsm1x1U:4,8,7,32,2,2,1,4;ConvOclDirectFwd1x1:1,64,1,1,1,1,16,2048,0
232-112-711-1x1-464-112-711-6-0x0-1x1-1x1-0-NCHW-FP32-B=ConvOclDirectFwd1x1:1,256,1,1,0,4,16,4,0
384-8-8-3x3-448-8-8-64-1x1-1x1-1x1-0-NCHW-FP32-W=ConvAsmBwdWrW3x3:0,1,8,4,4,1
128-14-14-1x1-576-14-14-512-0x0-1x1-1x1-0-NCHW-FP16-W=ConvAsmBwdWrW1x1:2,8,2,8,2,1,4,4,0,1
128-28-28-1x1-224-28-28-256-0x0-1x1-1x1-0-NCHW-FP32-W=ConvAsmBwdWrW1x1:2,8,4,8,2,1,4,4,0,2
58-28-28-1x1-24-28-28-256-0x0-1x1-1x1-0-NCHW-FP32-W=ConvAsmBwdWrW1x1:4,4,2,1,4,1,4,4,0,3
1-28-42-1x1-1696-28-42-128-0x0-1x1-1x1-0-NCHW-FP32-W=ConvAsmBwdWrW1x1:4,4,2,1,2,1,1,2,0,1
256-56-56-3x3-256-56-56-256-1x1-1x1-1x1-0-NCHW-FP16-F=ConvOclDirectFwd:8,8,16,16,2,2,8,2,1;ConvOclDirectFwdFused:16,16,32,32,2,2,8,2,1
256-14-14-1x1-1024-14-14-512-0x0-1x1-1x1-0-NCHW-FP32-F=ConvAsm1x1U:4,16,4,64,1,2,1,4;ConvOclDirectFwd1x1:1,64,1,1,1,0,32,2048,0
128-28-28-1x1-320-28-28-16-0x0-1x1-1x1-0-NCHW-FP32-W=ConvAsmBwdWrW1x1:4,4,4,4,4,2,2,2,0,2
352-28-28-1x1-128-28-28-16-0x0-1x1-1x1-0-NCHW-FP16-B=ConvAsm1x1U:1,16,2,16,1,2,4,1;ConvOclDirectFwd1x1:1,64,1,1,0,4,16,4,0
224-5-647-1x1-128-5-647-12-0x0-1x1-1x1-0-NCHW-FP32-B=ConvAsm1x1U:4,16,5,32,1,2,1,8;ConvOclDirectFwd1x1:1,256,1,1,0,1,32,4,0
2048-7-7-1x1-1024-14-14-4-0x0-2x2-1x1-0-NCHW-FP16-W=ConvAsmBwdWrW1x1:1,16,4,4,4,1,1,4,0,0
96-14-14-1x1-608-14-14-32-0x0-1x1-1x1-0-NCHW-FP16-W=ConvAsmBwdWrW1x1:1,16,2,8,2,1,4,4,0,1
128-17-17-1x1-768-17-17-4-0x0-1x1-1x1-0-NCHW-FP16-B=ConvAsm1x1U:1,16,2,16,1,2,2,2;ConvOclDirectFwd1x1:1,256,1,1,0,1,4,4,0
192-495-226-1x1-1-495-226-4-0x0-1x1-1x1-0-NCHW-FP32-F=ConvOclDirectFwd1x1:1,256,1,1,0,2,16,8,0
480-70-494-1x1-128-70-494-32-0x0-1x1-1x1-0-NCHW-FP32-F=ConvOclDirectFwd1x1:1,64,1,1,1,0,16,2048,0
160-127-805-1x1-1728-127-805-2-0x0-1x1-1x1-0-NCHW-FP32-B=ConvOclDirectFwd1x1:1,256,1,1,0,1,32,4,0
128-7-7-1x1-832-7-7-16-0x0-1x1-1x1-0-NCHW-FP32-F=ConvAsm1x1U:1,8,1,64,2,4,1,8;ConvOclDirectFwd1x1:1,64,1,1,1,4,16,256,0
1056-645-206-1x1-768-645-206-2-0x0-1x1-1x1-0-NCHW-FP32-B=ConvOclDirectFwd1x1:1,256,1,1,0,2,32,4,0
192-7-7-1x1-1728-7-7-16-0x0-1x1-1x1-0-NCHW-FP16-B=ConvAsm1x1U:1,8,2,32,1,2,2,4;ConvOclDirectFwd1x1:1,64,1,1,0,1,8,4,0
704-108-138-1x1-336-108-138-8-0x0-1x1-1x1-0-NCHW-FP32-B=ConvOclDirectFwd1x1:1,128,1,1,0,4,16,4,0
16-64-128-5x5-48-64-128-1-2x2-1x1-1x1-0-NCHW-FP16-F=ConvOclDirectFwd:8,32,16,32,2,1,4,2,1
128-14-14-1x1-288-14-14-32-0x0-1x1-1x1-0-NCHW-FP16-W=ConvAsmBwdWrW1x1:4,4,4,4,2,1,2,4,0,0
992-594-164-1x1-816-594-164-2-0x0-1x1-1x1-0-NCHW-FP32-B=ConvOclDirectFwd1x1:1,256,1,1,0,2,16,8,0
1280-146-579-1x1-1000-146-579-4-0x0-1x1-1x1-0-NCHW-FP32-B=ConvOclDirectFwd1x1:1,256,1,1,0,2,8,4,0
116-49-631-1x1-24-49-631-2-0x0-1x1-1x1-0-NCHW-FP32-W=ConvAsmBwdWrW1x1:4,4,2,4,2,1,2,4,0,3
256-29-29-3x3-256-29-29-256-1x1-1x1-1x1-0-NCHW-FP32-B_g32=ConvOclDirectFwd:16,16,32,32,2,2,8,2,1
608-103-150-1x1-1056-103-150-16-0x0-1x1-1x1-0-NCHW-FP32-F=ConvOclDirectFwd1x1:1,64,1,1,1,4,64,2048,0
64-73-73-1x1-160-73-73-64-0x0-1x1-1x1-0-NCHW-FP16-W=ConvAsmBwdWrW1x1:4,4,8,4,2,2,4,4,0,1
1872-354-241-1x1-54-354-241-1-0x0-1x1-1x1-0-NCHW-FP32-F=ConvOclDirectFwd1x1:1,256,1,1,0,2,16,4,0
224-59-340-1x1-288-59-340-4-0x0-1x1-1x1-0-NCHW-FP32-B=ConvOclDirectFwd1x1:1,128,1,1,0,1,32,4,0
1024-7-7-3x3-1024-7-7-4-1x1-1x1-1x1-0-NCHW-FP32-F_g32=ConvOclDirectFwd:8,8,8,8,1,1,4,1,2
64-163-113-1x1-1888-163-113-4-0x0-1x1-1x1-0-NCHW-FP32-B=ConvOclDirectFwd1x1:1,256,1,1,0,1,32,4,0
512-7-7-3x3-512-14-14-16-1x1-2x2-1x1-0-NCHW-FP32-W=ConvAsmBwdWrW3x3:0,0,8,8,10,1
128-56-56-1x1-192-56-56-64-0x0-1x1-1x1-0-NCHW-FP32-F=ConvAsm1x1U:1,8,1,64,2,4,1,8;ConvOclDirectFwd1x1:1,64,1,1,1,0,16,256,0
928-188-59-1x1-1600-188-59-8-0x0-1x1-1x1-0-NCHW-FP32-B=ConvOclDirectFwd1x1:1,128,1,1,0,2,32,4,0
480-14-14-1x1-64-14-14-512-0x0-1x1-1x1-0-NCHW-FP32-F=ConvAsm1x1U:2,16,2,64,2,2,1,1;ConvOclDirectFwd1x1:1,64,1,1,1,0,32,2048,0;ConvActivAsm1x1U:4,16,4,64,1,1
64-54-54-3x3-16-54-54-32-1x1-1x1-1x1-0-NCHW-FP16-W=ConvAsmBwdWrW3x3:0,0,8,1,2,8
464-274-388-1x1-128-274-388-4-0x0-1x1-1x1-0-NCHW-FP32-F=ConvOclDirectFwd1x1:1,64,1,1,1,0,16,2048,0
288-159-162-1x1-32-159-162-12-0x0-1x1-1x1-0-NCHW-FP32-F=ConvOclDirectFwd1x1:1,64,1,1,1,4,64,2048,0
54-50-400-1x1-768-50-400-12-0x0-1x1-1x1-0-NCHW-FP32-B=ConvOclDirectFwd1x1:1,64,1,1,0,1,64,4,0
320-14-14-1x1-128-14-14-32-0x0-1x1-1x1-0-NCHW-FP16-F=ConvAsm1x1U:1,8,2,64,1,4,2,4;ConvOclDirectFwd1x1:1,64,1,1,0,2,8,4,0
2048-80-8-1x1-512-80-8-1-0x0-1x1-1x1-0-NCHW-FP32-B=ConvAsm1x1U:1,8,1,64,1,4,2,2;ConvOclDirectFwd1x1:1,64,1,1,0,2,4,4,0
112-14-14-1x1-512-14-14-512-0x0-1x1-1x1-0-NCHW-FP16-W=ConvAsmBwdWrW1x1:4,4,8,1,8,2,1,4,0,1
480-22-1-1x1-224-22-1-12-0x0-1x1-1x1-0-NCHW-FP32-B=ConvAsm1x1U:2,8,2,16,1,4,4,1;ConvOclDirectFwd1x1:1,128,1,1,0,2,4,8,0
1280-8-8-1x1-448-8-8-256-0x0-1x1-1x1-0-NCHW-FP16-F=ConvAsm1x1U:1,8,2,32,2,4,1,8;ConvOclDirectFwd1x1:1,128,1,1,0,4,8,4,0
2048-7-7-1x1-512-7-7-8-0x0-1x1-1x1-0-NCHW-FP32-W=ConvAsmBwdWrW1x1:1,16,4,4,8,1,1,2,0,1
128-7-7-1x1-704-7-7-512-0x0-1x1-1x1-0-NCHW-FP16-B=ConvAsm1x1U:1,16,2,32,1,2,2,2;ConvOclDirectFwd1x1:1,64,1,1,0,1,32,4,0
128-8-554-1x1-640-8-554-48-0x0-1x1-1x1-0-NCHW-FP32-B=ConvAsm1x1U:1,16,1,64,1,2,1,1;ConvOclDirectFwd1x1:1,128,1,1,0,4,16,8,0
384-35-35-1x1-96-35-35-32-0x0-1x1-1x1-0-NCHW-FP16-F=ConvAsm1x1U:2,8,4,64,1,4,2,2;ConvOclDirectFwd1x1:1,64,1,1,0,1,16,4,0
128-14-14-1x1-256-14-14-128-0x0-1x1-1x1-0-NCHW-FP16-W=ConvAsmBwdWrW1x1:4,4,4,1,8,2,1,4,0,1
800-115-231-1x1-116-115-231-12-0x0-1x1-1x1-0-NCHW-FP32-F=ConvOclDirectFwd1x1:1,256,1,1,0,1,16,4,0
384-7-7-1x1-832-7-7-1-0x0-1x1-1x1-0-NCHW-FP32-B=ConvAsm1x1U:2,8,2,32,1,4,4,1;ConvOclDirectFwd1x1:1,128,1,1,0,1,4,8,0
512-28-28-1x1-256-56-56-64-0x0-2x2-1x1-0-NCHW-FP16-B=ConvAsm1x1U:1,16,2,32,1,2,4,1;ConvOclDirectFwd1x1:1,256,1,1,0,2,32,8,0
64-256-256-1x1-64-256-256-4-0x0-1x1-1x1-0-NCHW-FP32-F=ConvOclDirectFwd1x1:1,64,1,1,1,4,16,2048,0
128-14-14-1x1-640-14-14-256-0x0-1x1-1x1-0-NCHW-FP32-F=ConvAsm1x1U:2,16,2,64,3,2,2,1;ConvOclDirectFwd1x1:1,64,1,1,1,0,32,128,0
128-38-38-3x3-64-75-75-32-1x1-2x2-1x1-0-NCHW-FP32-W=ConvAsmBwdWrW3x3:0,0,8,4,3,1
112-23-455-1x1-768-23-455-4-0x0-1x1-1x1-0-NCHW-FP32-W=ConvAsmBwdWrW1x1:4,4,8,4,4,1,1,4,0,0
704-730-108-1x1-1408-730-108-1-0x0-1x1-1x1-0-NCHW-FP32-B=ConvOclDirectFwd1x1:1,64,1,1,0,2,32,4,0
288-498-38-1x1-8-498-38-32-0x0-1x1-1x1-0-NCHW-FP32-B=ConvOclDirectFwd1x1:1,64,1,1,0,4,16,8,0
1200-260-107-1x1-448-260-107-12-0x0-1x1-1x1-0-NCHW-FP32-F=ConvOclDirectFwd1x1:1,64,1,1,1,4,16,2048,0
288-14-14-1x1-128-14-14-64-0x0-1x1-1x1-0-NCHW-FP16-F=ConvAsm1x1U:1,8,2,16,1,4,1,4;ConvOclDirectFwd1x1:1,64,1,1,0,4,8,4,0
704-849-162-1x1-96-849-162-2-0x0-1x1-1x1-0-NCHW-FP32-F=ConvOclDirectFwd1x1:1,64,1,1,1,0,64,2048,0
232-14-14-1x1-232-14-14-64-0x0-1x1-1x1-0-NCHW-FP16-W=ConvAsmBwdWrW1x1:4,4,8,1,8,2,1,4,0,1
128-17-17-1x1-1024-17-17-64-0x0-1x1-1x1-0-NCHW-FP32-B=ConvAsm1x1U:1,32,1,64,2,1,1,2;ConvOclDirectFwd1x1:1,256,1,1,0,1,32,4,0
240-14-14-1x1-60-14-14-2-0x0-1x1-1x1-0-NCHW-FP16-B_g3=ConvOclDirectFwd:8,8,8,8,1,1,1,2,2
256-13-13-3x3-256-13-13-32-1x1-1x1-1x1-0-NCHW-FP16-B=ConvOclDirectFwd:8,8,16,16,2,2,8,4,2
16-54-54-1x1-96-54-54-16-0x0-1x1-1x1-0-NCHW-FP32-B=ConvAsm1x1U:1,8,1,64,1,2,2,4;ConvOclDirectFwd1x1:1,256,1,1,0,2,16,4,0
1024-15-15-1x1-2048-8-8-64-0x0-2x2-1x1-0-NCHW-FP32-F=ConvAsm1x1U:2,16,2,32,3,2,2,1;ConvOclDirectFwd1x1:1,64,1,1,1,1,16,128,0
128-56-56-1x1-160-56-56-32-0x0-1x1-1x1-0-NCHW-FP32-W=ConvAsmBwdWrW1x1:2,8,4,4,4,1,4,4,0,2
4-2-2-3x3-3-1-1-256-0x0-2x2-1x1-0-NCHW-FP32-F=ConvOclDirectFwd:8,8,8,8,1,1,1,4,2
192-27-27-1x1-48-27-27-256-0x0-1x1-1x1-0-NCHW-FP32-B=ConvAsm1x1U:3,16,3,64,4,2,1,1;ConvOclDirectFwd1x1:1,256,1,1,0,1,16,4,0
576-14-14-1x1-128-14-14-32-0x0-1x1-1x1-0-NCHW-FP16-W=ConvAsmBwdWrW1x1:2,8,2,8,2,1,4,4,0,1
24-131-419-1x1-672-131-419-1-0x0-1x1-1x1-0-NCHW-FP32-F=ConvOclDirectFwd1x1:1,256,1,1,0,1,32,4,0
864-931-470-1x1-528-931-470-1-0x0-1x1-1x1-0-NCHW-FP32-F=ConvOclDirectFwd1x1:1,64,1,1,1,4,64,2048,0
480-324-144-1x1-2048-324-144-1-0x0-1x1-1x1-0-NCHW-FP32-F=ConvOclDirectFwd1x1:16,16,32,32,1,0,32,128,1
608-348-54-1x1-864-348-54-1-0x0-1x1-1x1-0-NCHW-FP32-B=ConvOclDirectFwd1x1:1,256,1,1,0,4,16,8,0
128-28-28-1x1-128-28-28-512-0x0-1x1-1x1-0-NCHW-FP16-F=ConvAsm1x1U:1,8,2,16,2,4,1,4;ConvOclDirectFwd1x1:1,64,1,1,0,4,16,4,0
352-14-14-1x1-128-14-14-32-0x0-1x1-1x1-0-NCHW-FP16-F=ConvAsm1x1U:1,8,2,64,2,4,2,4;ConvOclDirectFwd1x1:1,64,1,1,0,4,8,4,0
1000-607-334-1x1-1200-607-334-1-0x0-1x1-1x1-0-NCHW-FP32-B=ConvOclDirectFwd1x1:1,256,1,1,0,2,16,8,0
512-14-14-1x1-1024-14-14-64-0x0-1x1-1x1-0-NCHW-FP16-F=ConvAsm1x1U:2,8,4,64,1,4,1,8;ConvOclDirectFwd1x1:1,128,1,1,0,2,16,4,0
232-7-7-1x1-232-7-7-128-0x0-1x1-1x1-0-NCHW-FP32-F=ConvAsm1x1U:1,8,1,64,4,4,1,8;ConvOclDirectFwd1x1:1,64,1,1,0,1,16,8,0
1000-843-86-1x1-336-843-86-4-0x0-1x1-1x1-0-NCHW-FP32-B=ConvOclDirectFwd1x1:1,64,1,1,0,2,16,4,0
128-14-14-1x1-864-14-14-256-0x0-1x1-1x1-0-NCHW-FP16-F=ConvAsm1x1U:1,8,2,16,2,4,1,4;ConvOclDirectFwd1x1:1,128,1,1,0,4,16,4,0
128-931-233-1x1-116-931-233-1-0x0-1x1-1x1-0-NCHW-FP32-B=ConvOclDirectFwd1x1:1,256,1,1,0,1,16,8,0
128-56-56-1x1-64-56-56-64-0x0-1x1-1x1-0-NCHW-FP32-W=ConvAsmBwdWrW1x1:4,4,4,2,4,1,4,4,0,1
528-14-14-1x1-160-14-14-128-0x0-1x1-1x1-0-NCHW-FP32-F=ConvAsm1x1U:3,16,3,16,2,2,2,2;ConvOclDirectFwd1x1:1,64,1,1,1,1,32,2048,0;ConvActivAsm1x1U:4,16,7,32,1,2
192-14-14-1x1-480-14-14-32-0x0-1x1-1x1-0-NCHW-FP16-W=ConvAsmBwdWrW1x1:2,8,2,8,2,1,2,4,0,1
48-327-466-1x1-48-327-466-1-0x0-1x1-1x1-0-NCHW-FP32-B=ConvOclDirectFwd1x1:1,256,1,1,0,2,16,4,0
816-456-211-1x1-8-456-211-6-0x0-1x1-1x1-0-NCHW-FP32-F=ConvOclDirectFwd1x1:1,256,1,1,0,4,16,4,0
8-595-36-1x1-64-595-36-256-0x0-1x1-1x1-0-NCHW-FP32-F=ConvAsm1x1U:1,8,1,16,1,1,1,1;ConvOclDirectFwd1x1:1,256,1,1,0,2,32,4,0
1280-128-171-1x1-608-128-171-6-0x0-1x1-1x1-0-NCHW-FP32-B=ConvOclDirectFwd1x1:1,256,1,1,0,2,32,4,0
512-7-7-3x3-512-7-7-512-1x1-1x1-1x1-0-NCHW-FP16-W=ConvAsmBwdWrW3x3:0,1,8,2,6,8
384-159-3-1x1-1584-159-3-128-0x0-1x1-1x1-0-NCHW-FP32-B=ConvAsm1x1U:2,16,2,64,1,1,1,1;ConvOclDirectFwd1x1:1,128,1,1,0,1,16,4,0
192-14-14-1x1-512-14-14-128-0x0-1x1-1x1-0-NCHW-FP32-W=ConvAsmBwdWrW1x1:2,8,4,4,8,1,2,4,0,1
512-28-28-1x1-256-14-14-2-0x0-2x2-1x1-0-NCHW-FP32-F=ConvAsm1x1U:1,8,1,64,1,4,2,1;ConvOclDirectFwd1x1:1,64,1,1,1,4,16,64,0
54-28-28-1x1-216-28-28-2-0x0-1x1-1x1-0-NCHW-FP16-F_g3=ConvOclDirectFwd:16,16,16,16,1,1,8,1,2
512-14-14-1x1-160-14-14-64-0x0-1x1-1x1-0-NCHW-FP32-F=ConvAsm1x1U:4,16,5,16,2,2,1,1;ConvOclDirectFwd1x1:1,64,1,1,1,1,64,2048,0;ConvActivAsm1x1U:4,16,5,16,2,1
128-28-28-1x1-512-28-28-64-0x0-1x1-1x1-0-NCHW-FP32-W=ConvAsmBwdWrW1x1:4,4,4,4,4,1,1,4,0,1
192-17-17-7x1-160-17-17-256-3x0-1x1-1x1-0-NCHW-FP32-W=ConvOclBwdWrW2<1>:1,6,8,3,7;ConvOclBwdWrW2<2>:1,6,8,3,7;ConvOclBwdWrW2<4>:1,9,8,3,9;ConvOclBwdWrW2<8>:1,6,8,3,7;ConvOclBwdWrW2<16>:1,9,8,3,9
384-35-35-1x1-192-35-35-128-0x0-1x1-1x1-0-NCHW-FP16-F=ConvAsm1x1U:2,8,4,32,1,4,1,4;ConvOclDirectFwd1x1:1,256,1,1,0,1,16,4,0
32-54-54-1x1-128-54-54-64-0x0-1x1-1x1-0-NCHW-FP32-W=ConvAsmBwdWrW1x1:4,4,2,4,2,1,2,4,0,3
992-14-14-1x1-128-14-14-16-0x0-1x1-1x1-0-NCHW-FP32-W=ConvAsmBwdWrW1x1:2,8,4,8,2,1,2,4,0,0
116-28-28-1x1-116-28-28-32-0x0-1x1-1x1-0-NCHW-FP16-W=ConvAsmBwdWrW1x1:4,4,4,1,8,1,2,4,0,1
32-147-147-3x3-32-149-149-1-0x0-1x1-1x1-0-NCHW-FP16-B=ConvOclDirectFwd:16,16,16,32,1,2,8,4,1
54-999-76-1x1-1584-999-76-2-0x0-1x1-1x1-0-NCHW-FP32-B=ConvOclDirectFwd1x1:1,256,1,1,0,1,16,4,0
288-390-386-1x1-160-390-386-6-0x0-1x1-1x1-0-NCHW-FP32-B=ConvOclDirectFwd1x1:1,256,1,1,0,4,16,4,0
64-14-14-1x1-480-14-14-4-0x0-1x1-1x1-0-NCHW-FP32-B=ConvAsm1x1U:1,16,1,32,1,2,1,1;ConvOclDirectFwd1x1:1,256,1,1,0,4,8,8,0
16-54-54-3x3-64-54-54-64-1x1-1x1-1x1-0-NCHW-FP32-F=ConvOclDirectFwd:16,16,32,32,2,2,8,4,2;ConvAsm3x3U:8,8,3
528-14-14-1x1-160-14-14-1-0x0-1x1-1x1-0-NCHW-FP16-F=ConvAsm1x1U:1,8,2,32,1,4,4,1;ConvOclDirectFwd1x1:1,64,1,1,0,4,4,8,0
128-17-17-1x1-768-17-17-16-0x0-1x1-1x1-0-NCHW-FP16-W=ConvAsmBwdWrW1x1:2,8,2,4,4,1,2,4,0,0
64-106-86-1x1-64-106-86-32-0x0-1x1-1x1-0-NCHW-FP32-F=ConvAsm1x1U:2,8,2,64,1,1,2,1;ConvOclDirectFwd1x1:16,16,32,32,1,0,32,128,1
1024-15-15-3x3-1024-8-8-2-1x1-2x2-1x1-0-NCHW-FP32-F_g32=ConvOclDirectFwd:8,8,8,8,1,1,4,1,2
64-224-224-3x3-64-224-224-64-1x1-1x1-1x1-0-NCHW-FP16-F=ConvOclDirectFwd:32,8,32,32,1,4,8,2,1;ConvOclDirectFwdFused:16,16,32,32,2,2,8,2,1
512-7-7-1x1-512-7-7-2-0x0-1x1-1x1-0-NCHW-FP16-W=ConvAsmBwdWrW1x1:1,16,2,4,2,1,1,2,0,1
4-57-573-1x1-2048-57-573-6-0x0-1x1-1x1-0-NCHW-FP32-F=ConvOclDirectFwd1x1:1,256,1,1,0,1,32,4,0
128-221-337-1x1-224-221-337-12-0x0-1x1-1x1-0-NCHW-FP32-B=ConvOclDirectFwd1x1:1,256,1,1,0,1,32,4,0
608-14-14-1x1-128-14-14-128-0x0-1x1-1x1-0-NCHW-FP16-B=ConvAsm1x1U:1,16,2,16,1,2,2,4;ConvOclDirectFwd1x1:1,128,1,1,0,2,16,4,0
832-334-925-1x1-64-334-925-2-0x0-1x1-1x1-0-NCHW-FP32-F=ConvOclDirectFwd1x1:16,16,32,32,1,0,32,128,1
19-941-573-1x1-128-941-573-6-0x0-1x1-1x1-0-NCHW-FP32-B=ConvOclDirectFwd1x1:1,256,1,1,0,1,64,4,0
192-14-14-1x1-1248-14-14-16-0x0-1x1-1x1-0-NCHW-FP16-W=ConvAsmBwdWrW1x1:2,8,4,8,2,1,1,4,0,1
1888-42-219-1x1-58-42-219-1-0x0-1x1-1x1-0-NCHW-FP32-F=ConvOclDirectFwd1x1:1,256,1,1,0,2,8,4,0
2048-215-6-1x1-912-215-6-8-0x0-1x1-1x1-0-NCHW-FP32-B=ConvAsm1x1U:2,16,6,32,1,2,1,4;ConvOclDirectFwd1x1:1,256,1,1,0,2,16,4,0
512-14-14-1x1-64-14-14-1-0x0-1x1-1x1-0-NCHW-FP32-F=ConvAsm1x1U:1,8,1,64,1,4,4,1;ConvOclDirectFwd1x1:1,64,1,1,1,4,16,64,0;ConvActivAsm1x1U:1,16,1,16,1,3
128-28-28-1x1-288-28-28-128-0x0-1x1-1x1-0-NCHW-FP16-W=ConvAsmBwdWrW1x1:4,4,8,1,8,1,4,4,0,1
54-110-712-1x1-24-110-712-8-0x0-1x1-1x1-0-NCHW-FP32-W=ConvAsmBwdWrW1x1:4,4,2,1,4,1,4,4,0,3
64-73-73-1x1-160-73-73-1-0x0-1x1-1x1-0-NCHW-FP32-W=ConvAsmBwdWrW1x1:4,4,2,4,2,1,1,4,0,2
624-28-28-1x1-192-28-28-16-0x0-1x1-1x1-0-NCHW-FP32-F=ConvAsm1x1U:4,16,5,32,1,2,1,1;ConvOclDirectFwd1x1:1,64,1,1,1,4,16,2048,0;ConvActivAsm1x1U:4,16,5,32,1,1
4-534-855-1x1-3-534-855-16-0x0-1x1-1x1-0-NCHW-FP32-W=ConvAsmBwdWrW1x1:4,4,2,1,2,1,4,4,0,1
624-32-966-1x1-32-32-966-2-0x0-1x1-1x1-0-NCHW-FP32-F=ConvOclDirectFwd1x1:1,64,1,1,1,4,64,2048,0
384-17-17-3x3-288-35-35-256-0x0-2x2-1x1-0-NCHW-FP16-B=ConvOclDirectFwd:8,16,16,16,2,1,8,4,2
192-138-30-1x1-704-138-30-32-0x0-1x1-1x1-0-NCHW-FP32-F=ConvAsm1x1U:2,16,6,64,1,2,1,2;ConvOclDirectFwd1x1:1,64,1,1,1,4,32,2048,0
1024-8-8-3x3-1024-15-15-2-1x1-2x2-1x1-0-NCHW-FP32-W_g32=ConvOclBwdWrW2<1>:1,8,8,1,9;ConvOclBwdWrW2<2>:1,6,8,1,9;ConvAsmBwdWrW3x3:0,0,16,2,5,1
1024-14-14-1x1-256-14-14-32-0x0-1x1-1x1-0-NCHW-FP16-W=ConvAsmBwdWrW1x1:1,16,4,8,2,1,2,4,0,1
1-148-231-1x1-480-148-231-2-0x0-1x1-1x1-0-NCHW-FP32-F=ConvOclDirectFwd1x1:1,128,1,1,0,1,4,4,0
128-28-28-1x1-512-28-28-64-0x0-1x1-1x1-0-NCHW-FP16-W=ConvAsmBwdWrW1x1:4,4,8,4,4,2,2,2,0,1
640-389-85-1x1-736-389-85-1-0x0-1x1-1x1-0-NCHW-FP32-B=ConvOclDirectFwd1x1:1,64,1,1,0,1,32,4,0
1632-1005-321-1x1-1000-1005-321-1-0x0-1x1-1x1-0-NCHW-FP32-F=ConvOclDirectFwd1x1:1,256,1,1,0,1,16,8,0
256-13-13-3x3-256-13-13-2048-1x1-1x1-1x1-0-NCHW-FP16-F=ConvOclDirectFwd:8,8,16,16,2,2,8,2,1
4-647-556-1x1-832-647-556-1-0x0-1x1-1x1-0-NCHW-FP32-B=ConvOclDirectFwd1x1:1,256,1,1,0,2,32,4,0
128-57-57-1x1-64-57-57-2-0x0-1x1-1x1-0-NCHW-FP32-W=ConvAsmBwdWrW1x1:4,4,2,4,2,1,2,4,0,1
1-437-83-1x1-128-437-83-32-0x0-1x1-1x1-0-NCHW-FP32-F=ConvOclDirectFwd1x1:1,256,1,1,0,1,64,4,0
2048-7-7-1x1-512-7-7-8-0x0-1x1-1x1-0-NCHW-FP32-F=ConvAsm1x1U:2,8,2,32,1,4,2,1;ConvOclDirectFwd1x1:1,64,1,1,1,0,32,256,0;ConvActivAsm1x1U:2,16,2,32,2,4
256-1-798-1x1-864-1-798-48-0x0-1x1-1x1-0-NCHW-FP32-B=ConvAsm1x1U:1,16,1,32,1,2,2,2;ConvOclDirectFwd1x1:1,64,1,1,0,2,32,4,0
96-630-88-1x1-544-630-88-8-0x0-1x1-1x1-0-NCHW-FP32-B=ConvOclDirectFwd1x1:1,64,1,1,0,2,32,4,0
58-649-173-1x1-160-649-173-12-0x0-1x1-1x1-0-NCHW-FP32-B=ConvOclDirectFwd1x1:1,64,1,1,0,1,32,4,0
1248-84-620-1x1-2048-84-620-2-0x0-1x1-1x1-0-NCHW-FP32-F=ConvOclDirectFwd1x1:1,64,1,1,1,1,16,2048,0
256-29-29-3x3-256-57-57-256-1x1-2x2-1x1-0-NCHW-FP32-W_g32=ConvOclBwdWrW2<2>:1,7,1,1,3;ConvOclBwdWrW2<8>:1,6,8,1,5;ConvAsmBwdWrW3x3:0,0,8,2,6,1;ConvOclBwdWrW2<1>:1,7,1,1,3;ConvOclBwdWrW2<16>:1,6,3,1,3;ConvOclBwdWrW2<4>:1,8,8,1,5
416-14-14-1x1-128-14-14-64-0x0-1x1-1x1-0-NCHW-FP16-B=ConvAsm1x1U:1,16,2,16,1,2,4,2;ConvOclDirectFwd1x1:1,64,1,1,0,4,8,4,0
256-52-52-3x3-128-105-105-32-0x0-2x2-1x1-0-NCHW-FP32-B=ConvOclDirectFwd:16,32,16,32,1,1,4,1,1
192-894-38-1x1-336-894-38-4-0x0-1x1-1x1-0-NCHW-FP32-B=ConvOclDirectFwd1x1:1,64,1,1,0,4,16,8,0
480-64-128-1x1-64-64-128-1-0x0-1x1-1x1-0-NCHW-FP32-F=ConvAsm1x1U:2,16,4,64,1,2,2,2;ConvOclDirectFwd1x1:1,64,1,1,1,1,16,256,0;ConvActivAsm1x1U:3,16,4,64,1,4
128-14-14-1x1-288-14-14-16-0x0-1x1-1x1-0-NCHW-FP16-F=ConvAsm1x1U:1,8,2,16,1,4,1,4;ConvOclDirectFwd1x1:1,64,1,1,0,4,8,4,0
16-111-100-1x1-384-111-100-16-0x0-1x1-1x1-0-NCHW-FP32-W=ConvAsmBwdWrW1x1:4,4,2,2,8,1,4,4,0,1
2048-8-8-1x1-1024-8-8-128-0x0-1x1-1x1-0-NCHW-FP32-F=ConvAsm1x1U:2,16,4,16,2,1,1,1;ConvOclDirectFwd1x1:1,64,1,1,1,1,64,2048,0
224-680-43-1x1-1-680-43-1-0x0-1x1-1x1-0-NCHW-FP32-F=ConvOclDirectFwd1x1:1,256,1,1,0,4,4,4,0
672-28-28-1x1-192-28-28-16-0x0-1x1-1x1-0-NCHW-FP16-F=ConvAsm1x1U:1,8,2,32,2,4,2,4;ConvOclDirectFwd1x1:1,256,1,1,0,2,16,4,0
96-14-14-1x1-480-14-14-256-0x0-1x1-1x1-0-NCHW-FP32-W=ConvAsmBwdWrW1x1:1,16,2,4,8,1,4,4,0,1
1680-297-107-1x1-58-297-107-2-0x0-1x1-1x1-0-NCHW-FP32-F=ConvOclDirectFwd1x1:1,128,1,1,0,1,16,4,0
2-975-673-1x1-352-975-673-2-0x0-1x1-1x1-0-NCHW-FP32-F=ConvOclDirectFwd1x1:1,256,1,1,0,1,32,4,0
160-7-7-1x1-832-7-7-32-0x0-1x1-1x1-0-NCHW-FP32-W=ConvAsmBwdWrW1x1:1,16,2,8,4,1,2,4,0,1
1024-7-7-1x1-2048-7-7-4-0x0-1x1-1x1-0-NCHW-FP32-B=ConvAsm1x1U:1,8,1,64,2,4,2,2;ConvOclDirectFwd1x1:1,128,1,1,0,1,8,4,0
240-143-33-1x1-704-143-33-12-0x0-1x1-1x1-0-NCHW-FP32-F=ConvAsm1x1U:1,32,7,64,1,1,1,1;ConvOclDirectFwd1x1:1,64,1,1,1,0,32,2048,0
58-625-165-1x1-232-625-165-2-0x0-1x1-1x1-0-NCHW-FP32-B=ConvOclDirectFwd1x1:1,256,1,1,0,1,16,4,0
32-15-694-1x1-3-15-694-1-0x0-1x1-1x1-0-NCHW-FP32-B=ConvAsm1x1U:4,1,4,4,1,1,1,1;ConvOclDirectFwd1x1:1,256,1,1,0,1,16,8,0
3-64-538-1x1-1584-64-538-4-0x0-1x1-1x1-0-NCHW-FP32-B=ConvOclDirectFwd1x1:1,64,1,1,0,4,16,4,0
16-54-54-1x1-64-54-54-256-0x0-1x1-1x1-0-NCHW-FP32-W=ConvAsmBwdWrW1x1:4,4,2,2,2,1,4,4,0,3
160-17-17-1x1-768-17-17-16-0x0-1x1-1x1-0-NCHW-FP32-W=ConvAsmBwdWrW1x1:2,8,4,8,4,1,2,4,0,1
288-14-14-1x1-128-14-14-32-0x0-1x1-1x1-0-NCHW-FP16-F=ConvAsm1x1U:2,8,4,32,1,4,2,4;ConvOclDirectFwd1x1:1,64,1,1,0,2,8,4,0
48-27-27-1x1-256-27-27-16-0x0-1x1-1x1-0-NCHW-FP16-F=ConvAsm1x1U:1,8,2,16,1,4,1,4;ConvOclDirectFwd1x1:1,64,1,1,0,1,32,4,0
32-14-14-1x1-528-14-14-128-0x0-1x1-1x1-0-NCHW-FP16-B=ConvAsm1x1U:1,16,2,16,1,2,1,4;ConvOclDirectFwd1x1:1,64,1,1,0,4,8,4,0
64-224-224-3x3-3-224-224-32-1x1-1x1-1x1-0-NCHW-FP32-W=ConvAsmBwdWrW3x3:0,1,16,1,4,1
608-14-14-1x1-128-14-14-32-0x0-1x1-1x1-0-NCHW-FP32-F=ConvAsm1x1U:2,16,4,64,1,2,2,1;ConvOclDirectFwd1x1:1,64,1,1,1,0,16,2048,0;ConvActivAsm1x1U:4,16,4,64,1,3
160-28-28-1x1-128-28-28-16-0x0-1x1-1x1-0-NCHW-FP32-B=ConvAsm1x1U:1,16,1,32,1,2,2,2;ConvOclDirectFwd1x1:16,64,32,32,0,2,16,4,1
208-14-14-3x3-96-14-14-256-1x1-1x1-1x1-0-NCHW-FP32-W=ConvAsmBwdWrW3x3:0,0,8,4,13,4
128-14-14-1x1-288-14-14-128-0x0-1x1-1x1-0-NCHW-FP16-W=ConvAsmBwdWrW1x1:2,8,2,4,2,1,4,4,0,3
64-595-36-1x1-8-595-36-256-0x0-1x1-1x1-0-NCHW-FP32-W=ConvAsmBwdWrW1x1:4,4,2,1,2,1,2,4,0,1
24-818-451-1x1-64-818-451-16-0x0-1x1-1x1-0-NCHW-FP32-B=ConvOclDirectFwd1x1:1,256,1,1,0,2,32,4,0
384-13-13-3x3-384-13-13-1024-1x1-1x1-1x1-0-NCHW-FP16-B=ConvOclDirectFwd:8,8,16,16,2,2,8,2,2
1024-15-15-1x1-1024-15-15-64-0x0-1x1-1x1-0-NCHW-FP32-F=ConvAsm1x1U:2,16,8,16,1,2,2,1;ConvOclDirectFwd1x1:8,8,16,16,1,0,32,128,1
288-869-360-1x1-928-869-360-1-0x0-1x1-1x1-0-NCHW-FP32-F=ConvOclDirectFwd1x1:1,64,1,1,1,0,64,2048,0
64-56-56-3x3-192-56-56-64-1x1-1x1-1x1-0-NCHW-FP16-F=ConvOclDirectFwd:32,8,32,32,1,4,8,1,2;ConvOclDirectFwdFused:32,8,32,32,1,4,8,1,2
48-14-14-5x5-512-14-14-2-2x2-1x1-1x1-0-NCHW-FP32-B=ConvOclDirectFwd:8,16,16,16,2,1,2,2,2
128-56-56-1x1-64-56-56-8-0x0-1x1-1x1-0-NCHW-FP32-W=ConvAsmBwdWrW1x1:4,4,4,4,2,1,4,4,0,1
2064-243-28-1x1-3-243-28-32-0x0-1x1-1x1-0-NCHW-FP32-F=ConvOclDirectFwd1x1:1,128,1,1,0,4,16,4,0
480-14-14-1x1-96-14-14-64-0x0-1x1-1x1-0-NCHW-FP32-F=ConvAsm1x1U:2,16,2,64,2,2,2,1;ConvOclDirectFwd1x1:1,64,1,1,1,1,16,2048,0;ConvActivAsm1x1U:3,16,3,16,2,2
256-14-14-3x3-256-14-14-32-1x1-1x1-1x1-0-NCHW-FP32-W=ConvAsmBwdWrW3x3:0,1,8,4,3,1
720-153-244-1x1-192-153-244-2-0x0-1x1-1x1-0-NCHW-FP32-F=ConvOclDirectFwd1x1:1,64,1,1,1,0,16,256,0
3-225-225-7x7-64-112-112-8-2x2-2x2-1x1-0-NCHW-FP32-F=ConvOclDirectFwd:16,8,16,16,1,2,8,1,2;ConvOclDirectFwdFused:16,16,16,32,1,2,8,1,2
224-213-943-1x1-800-213-943-1-0x0-1x1-1x1-0-NCHW-FP32-B=ConvOclDirectFwd1x1:1,256,1,1,0,1,32,4,0
512-14-14-1x1-160-14-14-1-0x0-1x1-1x1-0-NCHW-FP32-F=ConvAsm1x1U:1,8,1,64,1,4,4,1;ConvOclDirectFwd1x1:1,64,1,1,1,0,16,64,0;ConvActivAsm1x1U:1,16,1,64,1,4
128-14-14-1x1-832-14-14-256-0x0-1x1-1x1-0-NCHW-FP16-B=ConvAsm1x1U:1,16,2,16,1,2,1,4;ConvOclDirectFwd1x1:1,256,1,1,0,2,32,4,0
144-14-14-1x1-512-14-14-64-0x0-1x1-1x1-0-NCHW-FP32-W=ConvAsmBwdWrW1x1:1,16,2,8,4,1,2,4,0,2
288-35-35-1x1-64-35-35-1-0x0-1x1-1x1-0-NCHW-FP16-F=ConvAsm1x1U:1,8,2,64,1,4,4,1;ConvOclDirectFwd1x1:1,128,1,1,0,1,4,8,0
116-490-286-1x1-3-490-286-4-0x0-1x1-1x1-0-NCHW-FP32-W=ConvAsmBwdWrW1x1:4,4,2,1,2,1,2,4,0,1
58-111-779-1x1-96-111-779-64-0x0-1x1-1x1-0-NCHW-FP32-F=ConvOclDirectFwd1x1:1,128,1,1,0,1,32,4,0
16-54-54-1x1-64-54-54-32-0x0-1x1-1x1-0-NCHW-FP16-F=ConvAsm1x1U:1,8,2,64,1,4,1,2;ConvOclDirectFwd1x1:1,64,1,1,0,2,32,4,0
320-14-14-3x3-160-14-14-64-1x1-1x1-1x1-0-NCHW-FP32-W=ConvAsmBwdWrW3x3:0,0,8,4,8,2
512-14-14-1x1-1024-14-14-512-0x0-1x1-1x1-0-NCHW-FP32-B=ConvAsm1x1U:1,32,1,16,2,1,1,4;ConvOclDirectFwd1x1:1,64,1,1,0,2,32,4,0
416-364-680-1x1-1-364-680-2-0x0-1x1-1x1-0-NCHW-FP32-F=ConvOclDirectFwd1x1:1,256,1,1,0,4,16,4,0
1824-40-250-1x1-3-40-250-12-0x0-1x1-1x1-0-NCHW-FP32-F=ConvOclDirectFwd1x1:1,64,1,1,0,4,16,8,0
192-56-56-1x1-128-56-56-16-0x0-1x1-1x1-0-NCHW-FP32-F=ConvAsm1x1U:2,16,2,64,3,2,1,1;ConvOclDirectFwd1x1:1,64,1,1,1,0,16,2048,0
288-524-688-1x1-1-524-688-4-0x0-1x1-1x1-0-NCHW-FP32-F=ConvOclDirectFwd1x1:1,64,1,1,0,1,16,4,0
320-8-8-3x3-320-17-17-16-0x0-2x2-1x1-0-NCHW-FP16-B=ConvOclDirectFwd:16,16,32,32,2,2,4,2,2
1008-39-881-1x1-58-39-881-2-0x0-1x1-1x1-0-NCHW-FP32-F=ConvOclDirectFwd1x1:1,256,1,1,0,1,16,4,0
512-14-14-1x1-24-14-14-256-0x0-1x1-1x1-0-NCHW-FP32-F=ConvAsm1x1U:4,8,4,64,1,2,1,1;ConvOclDirectFwd1x1:1,256,1,1,0,2,16,4,0;ConvActivAsm1x1U:3,16,4,64,1,4
864-228-924-1x1-640-228-924-1-0x0-1x1-1x1-0-NCHW-FP32-F=ConvOclDirectFwd1x1:1,64,1,1,1,0,16,2048,0
120-7-7-1x1-480-7-7-512-0x0-1x1-1x1-0-NCHW-FP32-F_g3=ConvOclDirectFwd:8,8,8,8,1,1,8,4,2
624-492-673-1x1-1-492-673-1-0x0-1x1-1x1-0-NCHW-FP32-F=ConvOclDirectFwd1x1:1,256,1,1,0,2,16,4,0
144-212-12-1x1-864-212-12-12-0x0-1x1-1x1-0-NCHW-FP32-F=ConvAsm1x1U:4,8,4,64,1,4,2,2;ConvOclDirectFwd1x1:1,64,1,1,1,4,64,2048,0
116-818-444-1x1-1120-818-444-1-0x0-1x1-1x1-0-NCHW-FP32-B=ConvOclDirectFwd1x1:1,256,1,1,0,1,32,4,0
384-686-166-1x1-1792-686-166-2-0x0-1x1-1x1-0-NCHW-FP32-B=ConvOclDirectFwd1x1:1,64,1,1,0,2,32,4,0
384-13-13-3x3-192-13-13-64-1x1-1x1-1x1-0-NCHW-FP16-W=ConvAsmBwdWrW3x3:0,0,8,4,4,1
4-3-3-3x3-3-6-6-256-1x1-2x2-1x1-0-NCHW-FP32-B=ConvOclDirectFwd:8,8,8,8,1,1,1,4,2
320-4-790-1x1-1184-4-790-1-0x0-1x1-1x1-0-NCHW-FP32-B=ConvAsm1x1U:4,16,5,64,1,2,1,4;ConvOclDirectFwd1x1:1,64,1,1,0,4,16,4,0
464-7-7-1x1-1024-7-7-64-0x0-1x1-1x1-0-NCHW-FP32-F=ConvAsm1x1U:2,16,2,32,2,2,1,1;ConvOclDirectFwd1x1:1,64,1,1,1,0,16,2048,0
128-28-28-1x1-320-28-28-64-0x0-1x1-1x1-0-NCHW-FP16-B=ConvAsm1x1U:1,16,2,16,1,2,1,4;ConvOclDirectFwd1x1:1,64,1,1,0,4,16,4,0
1440-41-258-1x1-1024-41-258-16-0x0-1x1-1x1-0-NCHW-FP32-F=ConvOclDirectFwd1x1:1,64,1,1,1,0,16,2048,0
512-28-28-3x3-256-28-28-256-1x1-1x1-1x1-0-NCHW-FP16-B=ConvOclDirectFwd:32,8,32,32,1,4,8,2,1
2048-7-7-1x1-512-7-7-2-0x0-1x1-1x1-0-NCHW-FP32-W=ConvAsmBwdWrW1x1:1,16,4,4,4,1,1,4,0,0
864-825-8-1x1-2-825-8-32-0x0-1x1-1x1-0-NCHW-FP32-B=ConvOclDirectFwd1x1:1,64,1,1,0,4,16,4,0
128-7-7-1x1-640-7-7-128-0x0-1x1-1x1-0-NCHW-FP16-F=ConvAsm1x1U:1,8,2,32,1,4,1,4;ConvOclDirectFwd1x1:8,64,8,8,0,1,16,4,1
8-75-154-1x1-1344-75-154-12-0x0-1x1-1x1-0-NCHW-FP32-B=ConvOclDirectFwd1x1:1,128,1,1,0,2,32,4,0
128-28-28-3x3-128-56-56-4-1x1-2x2-1x1-0-NCHW-FP32-W=ConvAsmBwdWrW3x3:0,0,8,4,3,1
32-145-680-1x1-864-145-680-4-0x0-1x1-1x1-0-NCHW-FP32-F=ConvOclDirectFwd1x1:1,64,1,1,1,1,64,256,0
384-616-500-1x1-384-616-500-2-0x0-1x1-1x1-0-NCHW-FP32-B=ConvOclDirectFwd1x1:1,64,1,1,0,2,32,4,0
19-14-781-1x1-1024-14-781-2-0x0-1x1-1x1-0-NCHW-FP32-W=ConvAsmBwdWrW1x1:2,8,2,2,2,2,1,4,0,1
64-208-208-3x3-32-417-417-64-0x0-2x2-1x1-0-NCHW-FP32-B=ConvOclDirectFwd:32,32,32,32,1,1,8,2,1
512-63-218-1x1-16-63-218-2-0x0-1x1-1x1-0-NCHW-FP32-B=ConvOclDirectFwd1x1:1,128,1,1,0,2,4,8,0
512-996-245-1x1-4-996-245-4-0x0-1x1-1x1-0-NCHW-FP32-B=ConvOclDirectFwd1x1:1,256,1,1,0,4,16,4,0
1568-533-113-1x1-672-533-113-4-0x0-1x1-1x1-0-NCHW-FP32-F=ConvOclDirectFwd1x1:1,64,1,1,1,0,16,2048,0
16-28-28-1x1-192-28-28-512-0x0-1x1-1x1-0-NCHW-FP32-W=ConvAsmBwdWrW1x1:4,4,2,4,2,1,4,4,0,3
1024-14-14-1x1-512-14-14-8-0x0-1x1-1x1-0-NCHW-FP32-B=ConvAsm1x1U:4,16,4,64,1,2,4,1;ConvOclDirectFwd1x1:1,256,1,1,0,4,16,4,0
128-57-57-3x3-128-57-57-128-1x1-1x1-1x1-0-NCHW-FP32-F_g32=ConvOclDirectFwd:16,8,16,16,1,2,8,4,2
256-64-128-1x1-528-64-128-1-0x0-1x1-1x1-0-NCHW-FP16-B=ConvOclDirectFwd1x1:1,64,1,1,0,4,16,4,0
2048-7-7-1x1-512-7-7-512-0x0-1x1-1x1-0-NCHW-FP32-F=ConvAsm1x1U:3,16,4,16,1,2,1,8;ConvOclDirectFwd1x1:1,64,1,1,1,1,64,2048,0
1024-7-7-1x1-2048-7-7-48-0x0-1x1-1x1-0-NCHW-FP32-F=ConvAsm1x1U:2,16,2,32,3,2,4,1;ConvOclDirectFwd1x1:1,64,1,1,1,1,64,2048,0
352-13-109-1x1-464-13-109-12-0x0-1x1-1x1-0-NCHW-FP32-B=ConvAsm1x1U:3,16,3,64,1,2,1,4;ConvOclDirectFwd1x1:1,128,1,1,0,1,16,4,0
768-17-17-1x1-160-17-17-1-0x0-1x1-1x1-0-NCHW-FP32-F=ConvAsm1x1U:1,8,1,64,1,4,4,1;ConvOclDirectFwd1x1:1,64,1,1,1,4,16,64,0;ConvActivAsm1x1U:1,16,1,64,1,4
512-29-29-3x3-512-15-15-128-1x1-2x2-1x1-0-NCHW-FP32-F_g32=ConvOclDirectFwd:8,8,8,16,1,2,8,1,2
352-347-54-1x1-576-347-54-2-0x0-1x1-1x1-0-NCHW-FP32-F=ConvOclDirectFwd1x1:1,64,1,1,1,1,16,2048,0
48-855-92-1x1-160-855-92-6-0x0-1x1-1x1-0-NCHW-FP32-W=ConvAsmBwdWrW1x1:4,4,8,4,2,1,2,4,0,1
608-14-14-1x1-96-14-14-64-0x0-1x1-1x1-0-NCHW-FP32-F=ConvAsm1x1U:2,16,4,64,1,2,2,1;ConvOclDirectFwd1x1:1,64,1,1,1,1,16,2048,0;ConvActivAsm1x1U:3,16,3,16,4,2
448-8-8-1x1-2048-8-8-8-0x0-1x1-1x1-0-NCHW-FP16-W=ConvAsmBwdWrW1x1:1,16,2,8,2,1,1,4,0,0
480-14-14-1x1-96-14-14-32-0x0-1x1-1x1-0-NCHW-FP32-F=ConvAsm1x1U:3,16,3,16,1,2,2,1;ConvOclDirectFwd1x1:1,64,1,1,1,4,16,256,0;ConvActivAsm1x1U:3,16,3,16,1,2
24-485-390-1x1-1-485-390-2-0x0-1x1-1x1-0-NCHW-FP32-F=ConvOclDirectFwd1x1:1,256,1,1,0,2,16,4,0
192-720-24-1x1-288-720-24-32-0x0-1x1-1x1-0-NCHW-FP32-B=ConvOclDirectFwd1x1:1,128,1,1,0,1,32,4,0
640-725-21-1x1-288-725-21-12-0x0-1x1-1x1-0-NCHW-FP32-F=ConvOclDirectFwd1x1:1,64,1,1,1,0,64,2048,0
208-14-14-3x3-96-14-14-1-1x1-1x1-1x1-0-NCHW-FP32-W=ConvAsmBwdWrW3x3:0,0,8,2,4,1
16-96-99-1x1-992-96-99-2-0x0-1x1-1x1-0-NCHW-FP32-F=ConvOclDirectFwd1x1:1,64,1,1,1,1,64,2048,0
256-13-13-3x3-384-13-13-32-1x1-1x1-1x1-0-NCHW-FP16-W=ConvAsmBwdWrW3x3:0,0,8,4,3,1
64-56-56-3x3-64-56-56-2-1x1-1x1-1x1-0-NCHW-FP32-W=ConvAsmBwdWrW3x3:0,0,16,2,2,2
256-109-175-3x3-256-109-175-64-1x1-1x1-1x1-0-NCHW-FP16-B=ConvOclDirectFwd:16,8,16,32,1,4,8,1,1
16-54-54-1x1-128-54-54-128-0x0-1x1-1x1-0-NCHW-FP32-F=ConvAsm1x1U:1,16,1,64,2,1,4,1;ConvOclDirectFwd1x1:1,64,1,1,1,1,16,128,0
19-793-251-1x1-1-793-251-16-0x0-1x1-1x1-0-NCHW-FP32-W=ConvAsmBwdWrW1x1:4,4,2,1,2,1,4,4,0,1
480-36-678-1x1-2064-36-678-1-0x0-1x1-1x1-0-NCHW-FP32-B=ConvOclDirectFwd1x1:1,256,1,1,0,4,16,8,0
128-14-14-1x1-512-14-14-128-0x0-1x1-1x1-0-NCHW-FP32-W=ConvAsmBwdWrW1x1:1,16,2,4,8,1,4,4,0,2
58-862-241-1x1-8-862-241-1-0x0-1x1-1x1-0-NCHW-FP32-B=ConvOclDirectFwd1x1:1,64,1,1,0,1,8,4,0
736-899-452-1x1-640-899-452-1-0x0-1x1-1x1-0-NCHW-FP32-F=ConvOclDirectFwd1x1:1,64,1,1,1,1,16,2048,0
1024-4-4-1x1-2048-7-7-128-0x0-2x2-1x1-0-NCHW-FP32-W=ConvAsmBwdWrW1x1:1,16,2,8,4,1,1,4,0,1
1056-7-7-1x1-128-7-7-32-0x0-1x1-1x1-0-NCHW-FP16-F=ConvAsm1x1U:1,8,2,32,1,4,4,4;ConvOclDirectFwd1x1:1,64,1,1,0,1,8,8,0
192-17-17-1x1-768-17-17-64-0x0-1x1-1x1-0-NCHW-FP32-B=ConvAsm1x1U:1,32,1,64,2,1,2,2;ConvOclDirectFwd1x1:1,256,1,1,0,1,32,4,0
256-56-56-3x3-128-56-56-128-1x1-1x1-1x1-0-NCHW-FP16-B=ConvOclDirectFwd:32,8,32,32,1,4,8,1,1
3-401-554-1x1-19-401-554-1-0x0-1x1-1x1-0-NCHW-FP32-F=ConvOclDirectFwd1x1:1,128,1,1,0,1,8,4,0
512-14-14-1x1-144-14-14-512-0x0-1x1-1x1-0-NCHW-FP16-F=ConvAsm1x1U:2,8,4,64,1,4,1,2;ConvOclDirectFwd1x1:1,64,1,1,0,2,16,4,0
32-149-149-3x3-32-147-147-128-0x0-1x1-1x1-0-NCHW-FP16-F=ConvOclDirectFwd:16,16,32,32,2,2,8,4,1;ConvOclDirectFwdFused:16,16,32,32,2,2,8,4,1
480-14-14-1x1-64-14-14-256-0x0-1x1-1x1-0-NCHW-FP32-W=ConvAsmBwdWrW1x1:2,8,4,8,2,1,4,4,0,2
3-943-924-1x1-4-943-924-4-0x0-1x1-1x1-0-NCHW-FP32-B=ConvAsm1x1U:4,4,5,4,1,1,2,1;ConvOclDirectFwd1x1:1,256,1,1,0,4,4,4,0
528-36-886-1x1-96-36-886-6-0x0-1x1-1x1-0-NCHW-FP32-F=ConvOclDirectFwd1x1:1,64,1,1,1,4,64,2048,0
192-17-17-1x1-768-17-17-1-0x0-1x1-1x1-0-NCHW-FP32-W=ConvAsmBwdWrW1x1:1,16,2,4,2,1,1,4,0,0
128-7-7-5x5-832-7-7-256-2x2-1x1-1x1-0-NCHW-FP32-W=ConvOclBwdWrW2<1>:1,6,1,3,7;ConvOclBwdWrW2<2>:1,7,1,8,7;ConvOclBwdWrW2<4>:1,7,1,8,7;ConvOclBwdWrW2<8>:1,7,1,8,7;ConvOclBwdWrW2<16>:1,7,1,8,7
192-28-28-1x1-96-28-28-1-0x0-1x1-1x1-0-NCHW-FP16-F=ConvAsm1x1U:1,8,2,64,1,4,4,1;ConvOclDirectFwd1x1:1,64,1,1,0,1,4,4,0
1312-118-200-1x1-232-118-200-1-0x0-1x1-1x1-0-NCHW-FP32-F=ConvOclDirectFwd1x1:1,64,1,1,0,4,16,8,0
32-14-14-3x3-128-14-14-128-1x1-1x1-1x1-0-NCHW-FP16-B=ConvOclDirectFwd:8,16,16,16,2,1,8,1,1
352-202-952-1x1-288-202-952-6-0x0-1x1-1x1-0-NCHW-FP32-F=ConvOclDirectFwd1x1:1,64,1,1,1,4,64,2048,0
384-13-13-3x3-384-13-13-1024-1x1-1x1-1x1-0-NCHW-FP32-W=ConvAsmBwdWrW3x3:0,0,8,8,7,1
128-188-1009-1x1-8-188-1009-1-0x0-1x1-1x1-0-NCHW-FP32-B=ConvOclDirectFwd1x1:1,128,1,1,0,1,16,4,0
1-159-803-1x1-1-159-803-128-0x0-1x1-1x1-0-NCHW-FP32-W=ConvAsmBwdWrW1x1:4,4,2,1,2,1,4,4,0,1
288-618-747-1x1-336-618-747-1-0x0-1x1-1x1-0-NCHW-FP32-B=ConvOclDirectFwd1x1:1,64,1,1,0,2,16,4,0
224-56-56-1x1-128-56-56-16-0x0-1x1-1x1-0-NCHW-FP16-B=ConvAsm1x1U:1,16,2,32,1,2,2,2;ConvOclDirectFwd1x1:1,64,1,1,0,4,16,4,0
64-208-208-3x3-32-208-208-64-1x1-1x1-1x1-0-NCHW-FP32-W=ConvAsmBwdWrW3x3:0,0,16,4,2,8
512-7-7-3x3-512-7-7-64-1x1-1x1-1x1-0-NCHW-FP16-W=ConvAsmBwdWrW3x3:0,1,8,4,6,1
240-7-7-1x1-960-7-7-8-0x0-1x1-1x1-0-NCHW-FP32-F_g3=ConvOclDirectFwd:8,8,8,8,1,1,8,4,2
704-14-14-1x1-128-14-14-256-0x0-1x1-1x1-0-NCHW-FP32-W=ConvAsmBwdWrW1x1:2,8,2,8,4,1,4,4,0,2
96-71-71-3x3-64-73-73-16-0x0-1x1-1x1-0-NCHW-FP32-B=ConvOclDirectFwd:8,16,16,16,2,1,8,1,2
64-56-56-1x1-64-56-56-32-0x0-1x1-1x1-0-NCHW-FP32-B=ConvAsm1x1U:1,16,1,64,1,2,2,1;ConvOclDirectFwd1x1:1,64,1,1,0,1,32,4,0
256-55-55-1x1-64-55-55-32-0x0-1x1-1x1-0-NCHW-FP16-W=ConvAsmBwdWrW1x1:4,4,4,4,4,2,4,4,0,1
192-793-373-1x1-58-793-373-4-0x0-1x1-1x1-0-NCHW-FP32-B=ConvOclDirectFwd1x1:1,256,1,1,0,1,16,4,0
232-14-14-1x1-232-14-14-16-0x0-1x1-1x1-0-NCHW-FP32-F=ConvAsm1x1U:4,8,4,64,1,4,1,8;ConvOclDirectFwd1x1:1,64,1,1,0,4,8,4,0
4-741-360-1x1-232-741-360-8-0x0-1x1-1x1-0-NCHW-FP32-F=ConvOclDirectFwd1x1:1,256,1,1,0,2,16,4,0
1760-167-738-1x1-4-167-738-1-0x0-1x1-1x1-0-NCHW-FP32-F=ConvOclDirectFwd1x1:1,64,1,1,0,2,16,8,0
128-57-57-1x1-64-57-57-2-0x0-1x1-1x1-0-NCHW-FP32-B=ConvAsm1x1U:1,8,1,64,1,4,2,2;ConvOclDirectFwd1x1:1,64,1,1,0,1,8,4,0
544-79-73-1x1-4-79-73-48-0x0-1x1-1x1-0-NCHW-FP32-B=ConvAsm1x1U:4,4,7,4,3,1,4,1;ConvOclDirectFwd1x1:1,256,1,1,0,1,16,4,0
54-28-28-1x1-216-28-28-1-0x0-1x1-1x1-0-NCHW-FP32-F_g3=ConvOclDirectFwd:16,16,16,16,1,1,8,4,1
768-15-139-1x1-528-15-139-8-0x0-1x1-1x1-0-NCHW-FP32-W=ConvAsmBwdWrW1x1:2,8,4,8,4,1,1,4,0,1
19-508-683-1x1-48-508-683-1-0x0-1x1-1x1-0-NCHW-FP32-W=ConvAsmBwdWrW1x1:4,4,2,1,2,1,1,4,0,3
128-128-256-3x3-192-128-256-1-1x1-1x1-1x1-0-NCHW-FP16-F=ConvOclDirectFwd:16,16,32,32,2,2,8,1,1
128-28-28-1x1-128-28-28-128-0x0-1x1-1x1-0-NCHW-FP32-F=ConvAsm1x1U:2,16,2,32,3,2,1,1;ConvOclDirectFwd1x1:1,64,1,1,1,4,32,2048,0
128-57-57-3x3-128-29-29-48-1x1-2x2-1x1-0-NCHW-FP32-F=ConvOclDirectFwd:16,16,16,32,1,2,8,2,2
576-20-528-1x1-1472-20-528-32-0x0-1x1-1x1-0-NCHW-FP32-B=ConvOclDirectFwd1x1:1,256,1,1,0,1,32,4,0
128-3-3-1x1-256-3-3-32-0x0-1x1-1x1-0-NCHW-FP32-B=ConvAsm1x1U:1,8,1,16,1,2,4,1;ConvOclDirectFwd1x1:1,128,1,1,0,1,4,4,0
24-55-55-1x1-54-55-55-128-0x0-1x1-1x1-0-NCHW-FP16-F=ConvAsm1x1U:1,16,2,32,1,2,2,2;ConvOclDirectFwd1x1:1,256,1,1,0,1,16,4,0
2-675-22-1x1-464-675-22-8-0x0-1x1-1x1-0-NCHW-FP32-W=ConvAsmBwdWrW1x1:4,4,2,1,2,1,1,2,0,1
1760-18-1005-1x1-320-18-1005-8-0x0-1x1-1x1-0-NCHW-FP32-F=ConvOclDirectFwd1x1:16,16,32,32,1,0,32,128,1
192-17-17-1x1-1024-17-17-128-0x0-1x1-1x1-0-NCHW-FP16-W=ConvAsmBwdWrW1x1:4,4,8,4,4,2,2,2,0,1
832-7-7-1x1-48-7-7-16-0x0-1x1-1x1-0-NCHW-FP32-F=ConvAsm1x1U:1,8,1,64,1,4,4,1;ConvOclDirectFwd1x1:8,8,8,8,1,0,32,128,1;ConvActivAsm1x1U:1,16,1,16,1,4
128-14-14-1x1-480-14-14-256-0x0-1x1-1x1-0-NCHW-FP16-B=ConvAsm1x1U:1,16,2,16,1,2,2,2;ConvOclDirectFwd1x1:1,256,1,1,0,2,32,4,0
232-14-14-1x1-232-14-14-8-0x0-1x1-1x1-0-NCHW-FP32-W=ConvAsmBwdWrW1x1:2,8,4,4,2,1,2,4,0,0
128-241-21-1x1-128-241-21-64-0x0-1x1-1x1-0-NCHW-FP32-W=ConvAsmBwdWrW1x1:4,4,4,4,4,1,2,4,0,1
64-54-54-1x1-16-54-54-512-0x0-1x1-1x1-0-NCHW-FP32-F=ConvAsm1x1U:1,16,2,64,4,1,1,1;ConvOclDirectFwd1x1:1,64,1,1,1,1,64,64,0
112-14-14-1x1-512-14-14-64-0x0-1x1-1x1-0-NCHW-FP32-B=ConvAsm1x1U:1,16,1,64,2,2,1,2;ConvOclDirectFwd1x1:1,128,1,1,0,4,16,4,0
192-14-14-1x1-1920-14-14-16-0x0-1x1-1x1-0-NCHW-FP32-B=ConvAsm1x1U:1,32,1,16,2,1,2,1;ConvOclDirectFwd1x1:8,64,16,16,0,2,16,4,1
96-56-56-1x1-128-56-56-256-0x0-1x1-1x1-0-NCHW-FP16-W=ConvAsmBwdWrW1x1:4,4,8,1,8,2,4,4,0,1
24-213-32-1x1-1824-213-32-12-0x0-1x1-1x1-0-NCHW-FP32-W=ConvAsmBwdWrW1x1:2,8,2,4,2,1,1,2,0,1
704-14-14-1x1-128-14-14-256-0x0-1x1-1x1-0-NCHW-FP16-F=ConvAsm1x1U:1,16,2,16,2,2,1,4;ConvOclDirectFwd1x1:1,64,1,1,0,4,16,4,0
64-27-27-5x5-192-27-27-1024-2x2-1x1-1x1-0-NCHW-FP16-F=ConvOclDirectFwd:16,16,32,32,2,2,8,1,2;ConvOclDirectFwdFused:8,16,32,32,4,2,8,1,1
128-70-494-1x1-480-70-494-32-0x0-1x1-1x1-0-NCHW-FP32-B=ConvOclDirectFwd1x1:1,128,1,1,0,1,32,4,0
64-14-14-5x5-24-14-14-256-2x2-1x1-1x1-0-NCHW-FP32-B=ConvOclDirectFwd:8,8,16,16,2,2,4,1,2
1968-171-289-1x1-832-171-289-4-0x0-1x1-1x1-0-NCHW-FP32-F=ConvOclDirectFwd1x1:1,64,1,1,1,1,16,2048,0
832-14-14-1x1-128-14-14-32-0x0-1x1-1x1-0-NCHW-FP32-W=ConvAsmBwdWrW1x1:2,8,4,4,4,1,2,4,0,0
1000-570-120-1x1-1280-570-120-4-0x0-1x1-1x1-0-NCHW-FP32-F=ConvOclDirectFwd1x1:1,256,1,1,0,2,32,4,0
768-17-17-1x1-128-17-17-1-0x0-1x1-1x1-0-NCHW-FP16-F=ConvAsm1x1U:1,8,2,32,1,4,4,1;ConvOclDirectFwd1x1:1,64,1,1,0,1,4,8,0
1408-436-571-1x1-232-436-571-1-0x0-1x1-1x1-0-NCHW-FP32-F=ConvOclDirectFwd1x1:1,256,1,1,0,2,16,4,0
128-7-7-1x1-800-7-7-128-0x0-1x1-1x1-0-NCHW-FP32-F=ConvAsm1x1U:1,8,1,64,4,4,1,4;ConvOclDirectFwd1x1:1,64,1,1,1,4,16,256,0
512-64-64-1x1-6-64-64-4-0x0-1x1-1x1-0-NCHW-FP32-F=ConvAsm1x1U:4,4,8,4,1,2,2,1;ConvOclDirectFwd1x1:1,128,1,1,0,1,16,8,0
1-161-700-5x5-64-80-349-128-1x1-2x2-1x1-0-NCHW-FP32-F=ConvOclDirectFwd:16,16,32,32,2,2,8,2,1
116-632-439-1x1-3-632-439-6-0x0-1x1-1x1-0-NCHW-FP32-F=ConvOclDirectFwd1x1:1,256,1,1,0,4,16,4,0
640-7-7-1x1-128-7-7-64-0x0-1x1-1x1-0-NCHW-FP32-B=ConvAsm1x1U:1,16,1,64,1,1,4,4;ConvOclDirectFwd1x1:1,128,1,1,0,1,8,4,0
256-14-14-3x3-256-14-14-1-1x1-1x1-1x1-0-NCHW-FP16-F=ConvOclDirectFwd:16,16,16,16,1,1,2,4,1;ConvOclDirectFwdFused:16,16,16,16,1,1,1,4,1
144-213-7-1x1-768-213-7-48-0x0-1x1-1x1-0-NCHW-FP32-B=ConvAsm1x1U:3,16,3,64,1,2,1,4;ConvOclDirectFwd1x1:1,256,1,1,0,1,32,4,0
1872-276-45-1x1-992-276-45-1-0x0-1x1-1x1-0-NCHW-FP32-F=ConvOclDirectFwd1x1:1,64,1,1,1,0,64,2048,0
480-590-244-1x1-448-590-244-6-0x0-1x1-1x1-0-NCHW-FP32-F=ConvOclDirectFwd1x1:1,64,1,1,1,4,16,2048,0
128-28-28-1x1-416-28-28-64-0x0-1x1-1x1-0-NCHW-FP16-W=ConvAsmBwdWrW1x1:4,4,8,1,8,2,1,4,0,1
512-7-7-1x1-2048-7-7-32-0x0-1x1-1x1-0-NCHW-FP32-W=ConvAsmBwdWrW1x1:1,16,4,4,8,1,1,4,0,1
192-14-14-1x1-608-14-14-64-0x0-1x1-1x1-0-NCHW-FP32-B=ConvAsm1x1U:1,32,1,16,2,1,2,1;ConvOclDirectFwd1x1:1,64,1,1,0,2,16,4,0
512-29-29-1x1-256-29-29-128-0x0-1x1-1x1-0-NCHW-FP32-F=ConvAsm1x1U:3,16,5,64,2,1,1,1;ConvOclDirectFwd1x1:1,64,1,1,1,1,16,2048,0
768-17-17-1x1-128-17-17-128-0x0-1x1-1x1-0-NCHW-FP32-F=ConvAsm1x1U:4,16,5,64,1,2,1,2;ConvOclDirectFwd1x1:1,64,1,1,1,0,16,2048,0;ConvActivAsm1x1U:4,16,5,32,2,1
1088-666-5-1x1-960-666-5-48-0x0-1x1-1x1-0-NCHW-FP32-F=ConvAsm1x1U:3,16,5,64,2,2,1,2;ConvOclDirectFwd1x1:1,64,1,1,1,4,16,2048,0
512-14-14-3x3-512-14-14-8-1x1-1x1-1x1-0-NCHW-FP32-W=ConvAsmBwdWrW3x3:0,1,8,4,4,1
16-48-480-3x3-1-48-480-16-1x1-1x1-1x1-0-NCHW-FP32-W=ConvAsmBwdWrW3x3:0,1,16,1,1,4
64-14-14-5x5-24-14-14-4-2x2-1x1-1x1-0-NCHW-FP16-B=ConvOclDirectFwd:16,16,16,16,1,1,1,4,2
320-8-8-1x1-2048-8-8-256-0x0-1x1-1x1-0-NCHW-FP32-W=ConvAsmBwdWrW1x1:2,8,4,4,8,1,2,4,0,1
54-971-137-1x1-448-971-137-6-0x0-1x1-1x1-0-NCHW-FP32-B=ConvOclDirectFwd1x1:1,128,1,1,0,1,64,4,0
8-62-522-1x1-224-62-522-4-0x0-1x1-1x1-0-NCHW-FP32-W=ConvAsmBwdWrW1x1:4,4,2,2,2,1,2,4,0,2
2048-8-8-1x1-384-8-8-1-0x0-1x1-1x1-0-NCHW-FP32-F=ConvAsm1x1U:1,8,2,32,1,4,4,1;ConvOclDirectFwd1x1:1,64,1,1,1,1,16,128,0;ConvActivAsm1x1U:1,16,1,32,1,3
192-604-537-1x1-448-604-537-2-0x0-1x1-1x1-0-NCHW-FP32-B=ConvOclDirectFwd1x1:1,128,1,1,0,2,32,4,0
928-94-677-1x1-4-94-677-6-0x0-1x1-1x1-0-NCHW-FP32-F=ConvOclDirectFwd1x1:1,256,1,1,0,1,16,8,0
1824-22-606-1x1-1280-22-606-1-0x0-1x1-1x1-0-NCHW-FP32-F=ConvOclDirectFwd1x1:1,64,1,1,1,1,16,2048,0
256-56-56-3x3-128-56-56-256-1x1-1x1-1x1-0-NCHW-FP16-F=ConvOclDirectFwd:16,16,32,32,2,2,8,4,1
128-14-14-1x1-992-14-14-64-0x0-1x1-1x1-0-NCHW-FP16-F=ConvAsm1x1U:2,8,4,64,1,4,1,1;ConvOclDirectFwd1x1:1,128,1,1,0,4,8,4,0
384-88-1006-1x1-192-88-1006-8-0x0-1x1-1x1-0-NCHW-FP32-B=ConvOclDirectFwd1x1:1,256,1,1,0,4,16,8,0
64-56-56-1x1-256-56-56-64-0x0-1x1-1x1-0-NCHW-FP32-W=ConvAsmBwdWrW1x1:4,4,2,2,4,1,1,4,0,1
672-656-20-1x1-896-656-20-4-0x0-1x1-1x1-0-NCHW-FP32-W=ConvAsmBwdWrW1x1:4,4,8,4,4,1,1,4,0,0
1-906-22-1x1-320-906-22-8-0x0-1x1-1x1-0-NCHW-FP32-B=ConvOclDirectFwd1x1:1,256,1,1,0,1,64,4,0
256-20-84-3x3-256-20-84-16-1x1-1x1-1x1-0-NCHW-FP16-F=ConvOclDirectFwd:16,16,32,32,2,2,8,4,1
672-12-45-1x1-480-12-45-1024-0x0-1x1-1x1-0-NCHW-FP32-W=ConvAsmBwdWrW1x1:1,16,4,8,4,2,1,4,0,1
128-14-14-1x1-256-14-14-128-0x0-1x1-1x1-0-NCHW-FP32-W=ConvAsmBwdWrW1x1:2,8,4,8,2,1,4,4,0,1
192-28-28-3x3-128-28-28-128-1x1-1x1-1x1-0-NCHW-FP32-W=ConvAsmBwdWrW3x3:0,1,8,4,9,4
256-73-201-1x1-1392-73-201-8-0x0-1x1-1x1-0-NCHW-FP32-B=ConvOclDirectFwd1x1:1,256,1,1,0,1,16,4,0
896-73-511-1x1-864-73-511-16-0x0-1x1-1x1-0-NCHW-FP32-B=ConvOclDirectFwd1x1:1,64,1,1,0,1,32,4,0
448-8-8-3x3-384-8-8-4-1x1-1x1-1x1-0-NCHW-FP16-F=ConvOclDirectFwd:8,8,8,8,1,1,2,2,2;ConvOclDirectFwdFused:8,8,8,8,1,1,2,2,2
512-7-7-1x1-2048-7-7-32-0x0-1x1-1x1-0-NCHW-FP16-B=ConvAsm1x1U:1,16,2,16,1,2,2,2;ConvOclDirectFwd1x1:1,64,1,1,0,1,8,4,0
96-835-274-1x1-80-835-274-16-0x0-1x1-1x1-0-NCHW-FP32-B=ConvOclDirectFwd1x1:1,256,1,1,0,2,16,4,0
32-177-205-1x1-2048-177-205-1-0x0-1x1-1x1-0-NCHW-FP32-B=ConvOclDirectFwd1x1:1,256,1,1,0,1,32,4,0
48-27-27-1x1-192-27-27-16-0x0-1x1-1x1-0-NCHW-FP16-F=ConvAsm1x1U:2,8,4,64,1,2,1,2;ConvOclDirectFwd1x1:1,128,1,1,0,1,16,8,0
60-14-14-3x3-60-28-28-8-1x1-2x2-1x1-0-NCHW-FP32-W=ConvAsmBwdWrW3x3:0,0,16,4,3,2
336-704-803-1x1-512-704-803-1-0x0-1x1-1x1-0-NCHW-FP32-F=ConvOclDirectFwd1x1:1,64,1,1,1,4,32,2048,0
528-14-14-1x1-256-14-14-4-0x0-1x1-1x1-0-NCHW-FP32-F=ConvAsm1x1U:4,8,4,64,1,4,2,2;ConvOclDirectFwd1x1:1,64,1,1,1,0,16,128,0;ConvActivAsm1x1U:2,16,4,64,1,4
512-14-14-3x3-512-14-14-128-1x1-1x1-1x1-0-NCHW-FP16-W=ConvAsmBwdWrW3x3:0,0,8,2,10,1
48-721-443-1x1-144-721-443-4-0x0-1x1-1x1-0-NCHW-FP32-F=ConvOclDirectFwd1x1:1,64,1,1,1,4,32,256,0
192-7-7-1x1-1104-7-7-16-0x0-1x1-1x1-0-NCHW-FP16-W=ConvAsmBwdWrW1x1:1,16,2,8,2,1,2,4,0,0
112-14-14-1x1-512-14-14-128-0x0-1x1-1x1-0-NCHW-FP32-B=ConvAsm1x1U:1,16,1,32,2,2,1,4;ConvOclDirectFwd1x1:1,256,1,1,0,2,32,4,0
1-265-868-1x1-512-265-868-2-0x0-1x1-1x1-0-NCHW-FP32-F=ConvOclDirectFwd1x1:1,256,1,1,0,2,32,4,0
128-14-14-1x1-416-14-14-256-0x0-1x1-1x1-0-NCHW-FP32-F=ConvAsm1x1U:3,16,3,16,2,2,2,2;ConvOclDirectFwd1x1:1,64,1,1,1,4,64,128,0
128-7-7-3x3-32-7-7-64-1x1-1x1-1x1-0-NCHW-FP16-B=ConvOclDirectFwd:8,8,8,8,1,1,2,2,2
64-112-112-7x7-3-225-225-64-2x2-2x2-1x1-0-NCHW-FP32-B=ConvOclDirectFwd:16,16,32,32,2,2,8,2,1
1920-765-17-1x1-4-765-17-6-0x0-1x1-1x1-0-NCHW-FP32-F=ConvOclDirectFwd1x1:1,256,1,1,0,1,16,8,0
128-29-29-3x3-128-57-57-1-1x1-2x2-1x1-0-NCHW-FP32-B=ConvOclDirectFwd:8,8,32,32,4,4,4,4,1
60-28-28-3x3-60-28-28-16-1x1-1x1-1x1-0-NCHW-FP32-W=ConvAsmBwdWrW3x3:0,1,16,2,5,2
48-35-35-1x1-288-35-35-16-0x0-1x1-1x1-0-NCHW-FP16-W=ConvAsmBwdWrW1x1:4,4,4,4,2,1,4,4,0,0
2048-8-8-1x1-192-8-8-256-0x0-1x1-1x1-0-NCHW-FP16-F=ConvAsm1x1U:1,8,2,32,2,4,2,2;ConvOclDirectFwd1x1:1,128,1,1,0,4,16,8,0
288-14-14-3x3-144-14-14-64-1x1-1x1-1x1-0-NCHW-FP32-W=ConvAsmBwdWrW3x3:0,0,8,4,8,2
1024-17-17-1x1-384-17-17-128-0x0-1x1-1x1-0-NCHW-FP16-F=ConvAsm1x1U:2,16,4,16,1,2,2,2;ConvOclDirectFwd1x1:1,128,1,1,0,1,16,4,0
96-35-35-3x3-96-35-35-64-1x1-1x1-1x1-0-NCHW-FP16-B=ConvOclDirectFwd:8,8,16,16,2,2,8,2,2
64-35-35-1x1-192-35-35-16-0x0-1x1-1x1-0-NCHW-FP16-W=ConvAsmBwdWrW1x1:4,4,4,4,2,1,4,4,0,0
128-27-27-1x1-32-27-27-256-0x0-1x1-1x1-0-NCHW-FP32-F=ConvAsm1x1U:2,16,2,64,4,2,1,2;ConvOclDirectFwd1x1:1,64,1,1,1,0,16,256,0
640-652-18-1x1-704-652-18-32-0x0-1x1-1x1-0-NCHW-FP32-B=ConvOclDirectFwd1x1:1,256,1,1,0,1,32,4,0
896-3-566-1x1-672-3-566-1-0x0-1x1-1x1-0-NCHW-FP32-W=ConvAsmBwdWrW1x1:2,8,4,8,4,1,1,4,0,1
352-14-14-1x1-128-14-14-16-0x0-1x1-1x1-0-NCHW-FP16-W=ConvAsmBwdWrW1x1:4,4,4,4,2,1,2,2,0,1
1024-14-14-1x1-512-28-28-16-0x0-2x2-1x1-0-NCHW-FP32-W=ConvAsmBwdWrW1x1:1,16,4,8,4,1,1,4,0,1
512-28-28-3x3-256-28-28-32-1x1-1x1-1x1-0-NCHW-FP16-W=ConvAsmBwdWrW3x3:0,1,8,4,2,2
8-627-619-1x1-3-627-619-8-0x0-1x1-1x1-0-NCHW-FP32-F=ConvAsm1x1U:1,1,2,4,1,1,1,2;ConvOclDirectFwd1x1:1,256,1,1,0,1,4,4,0
832-712-283-1x1-832-712-283-1-0x0-1x1-1x1-0-NCHW-FP32-B=ConvOclDirectFwd1x1:1,256,1,1,0,2,32,4,0
32-149-149-3x3-32-147-147-64-0x0-1x1-1x1-0-NCHW-FP16-F=ConvOclDirectFwd:16,16,32,32,2,2,8,4,2;ConvOclDirectFwdFused:16,16,32,32,2,2,8,4,2
16-124-130-1x1-448-124-130-4-0x0-1x1-1x1-0-NCHW-FP32-W=ConvAsmBwdWrW1x1:4,4,4,4,2,1,4,4,0,0
64-75-75-3x3-64-75-75-32-1x1-1x1-1x1-0-NCHW-FP32-W=ConvAsmBwdWrW3x3:0,0,16,4,2,2
32-147-147-3x3-32-149-149-64-0x0-1x1-1x1-0-NCHW-FP16-B=ConvOclDirectFwd:16,16,32,32,2,2,8,2,2
64-27-27-3x3-256-27-27-16-1x1-1x1-1x1-0-NCHW-FP16-B=ConvOclDirectFwd:8,16,32,32,4,2,8,1,1
192-35-35-1x1-384-35-35-64-0x0-1x1-1x1-0-NCHW-FP32-W=ConvAsmBwdWrW1x1:1,16,2,8,4,1,2,4,0,2
192-28-28-1x1-128-28-28-64-0x0-1x1-1x1-0-NCHW-FP16-W=ConvAsmBwdWrW1x1:4,4,4,4,2,1,4,4,0,1
128-28-28-1x1-160-28-28-256-0x0-1x1-1x1-0-NCHW-FP32-B=ConvAsm1x1U:1,16,1,32,2,1,2,2;ConvOclDirectFwd1x1:1,256,1,1,0,1,32,4,0
192-28-28-1x1-576-28-28-16-0x0-1x1-1x1-0-NCHW-FP32-W=ConvAsmBwdWrW1x1:1,16,2,8,4,1,2,4,0,2
480-479-435-1x1-32-479-435-4-0x0-1x1-1x1-0-NCHW-FP32-F=ConvOclDirectFwd1x1:1,64,1,1,1,4,64,2048,0
512-173-100-1x1-1568-173-100-4-0x0-1x1-1x1-0-NCHW-FP32-B=ConvOclDirectFwd1x1:1,256,1,1,0,2,32,4,0
512-29-29-1x1-512-29-29-256-0x0-1x1-1x1-0-NCHW-FP32-W=ConvAsmBwdWrW1x1:2,8,4,8,4,1,1,4,0,2
48-27-27-1x1-384-27-27-128-0x0-1x1-1x1-0-NCHW-FP16-F=ConvAsm1x1U:3,8,6,64,1,4,1,4;ConvOclDirectFwd1x1:1,64,1,1,0,1,32,4,0
64-152-578-1x1-19-152-578-16-0x0-1x1-1x1-0-NCHW-FP32-F=ConvOclDirectFwd1x1:1,128,1,1,0,4,8,8,0
192-17-17-1x1-768-17-17-256-0x0-1x1-1x1-0-NCHW-FP16-F=ConvAsm1x1U:2,16,4,16,1,2,1,4;ConvOclDirectFwd1x1:1,256,1,1,0,1,16,4,0
256-56-56-1x1-512-28-28-16-0x0-2x2-1x1-0-NCHW-FP16-F=ConvAsm1x1U:1,8,2,32,2,4,1,4;ConvOclDirectFwd1x1:1,128,1,1,0,2,16,4,0
1000-62-994-1x1-2048-62-994-2-0x0-1x1-1x1-0-NCHW-FP32-B=ConvOclDirectFwd1x1:1,256,1,1,0,2,32,4,0
64-35-35-1x1-256-35-35-512-0x0-1x1-1x1-0-NCHW-FP16-B=ConvAsm1x1U:2,16,4,32,1,2,1,1;ConvOclDirectFwd1x1:1,128,1,1,0,1,64,4,0
320-14-14-1x1-128-14-14-256-0x0-1x1-1x1-0-NCHW-FP32-F=ConvAsm1x1U:4,16,4,64,1,2,2,2;ConvOclDirectFwd1x1:1,64,1,1,1,4,16,2048,0
48-677-466-1x1-232-677-466-1-0x0-1x1-1x1-0-NCHW-FP32-B=ConvOclDirectFwd1x1:1,256,1,1,0,2,16,8,0
80-73-73-1x1-64-73-73-128-0x0-1x1-1x1-0-NCHW-FP16-B=ConvAsm1x1U:2,16,4,64,1,2,1,1;ConvOclDirectFwd1x1:1,256,1,1,0,1,32,4,0
128-14-14-5x5-32-14-14-4-2x2-1x1-1x1-0-NCHW-FP32-B=ConvOclDirectFwd:16,16,16,16,1,1,1,4,2
60-28-28-1x1-240-28-28-256-0x0-1x1-1x1-0-NCHW-FP32-B_g3=ConvOclDirectFwd:16,16,32,32,2,2,8,2,1
256-28-28-1x1-128-28-28-32-0x0-1x1-1x1-0-NCHW-FP16-F=ConvAsm1x1U:1,8,2,32,1,4,1,4;ConvOclDirectFwd1x1:1,128,1,1,0,4,16,4,0
1024-8-8-3x3-1024-8-8-32-1x1-1x1-1x1-0-NCHW-FP32-W_g32=ConvOclBwdWrW2<2>:1,8,8,1,9;ConvOclBwdWrW2<8>:1,6,8,1,9;ConvAsmBwdWrW3x3:0,0,16,2,7,1;ConvOclBwdWrW2<1>:1,6,8,1,9;ConvOclBwdWrW2<16>:1,8,8,1,9;ConvOclBwdWrW2<4>:1,8,8,1,9
64-27-27-5x5-192-27-27-1024-2x2-1x1-1x1-0-NCHW-FP32-F=ConvOclDirectFwd:16,16,32,32,2,2,8,1,1;ConvOclDirectFwdFused:16,16,32,32,2,2,8,1,1
64-150-150-7x7-3-300-300-32-3x3-2x2-1x1-0-NCHW-FP32-B=ConvOclDirectFwd:16,16,32,32,2,2,8,2,1
528-405-122-1x1-224-405-122-2-0x0-1x1-1x1-0-NCHW-FP32-B=ConvOclDirectFwd1x1:1,256,1,1,0,2,32,4,0
232-948-19-1x1-8-948-19-4-0x0-1x1-1x1-0-NCHW-FP32-B=ConvAsm1x1U:1,8,6,64,1,4,1,1;ConvOclDirectFwd1x1:1,128,1,1,0,4,16,8,0
384-168-922-1x1-1280-168-922-2-0x0-1x1-1x1-0-NCHW-FP32-F=ConvOclDirectFwd1x1:1,64,1,1,1,4,16,2048,0
128-112-112-3x3-128-112-112-64-1x1-1x1-1x1-0-NCHW-FP32-W=ConvAsmBwdWrW3x3:0,0,16,4,2,1
128-27-27-3x3-32-27-27-32-1x1-1x1-1x1-0-NCHW-FP16-B=ConvOclDirectFwd:16,16,32,32,2,2,4,4,2
864-8-961-1x1-928-8-961-64-0x0-1x1-1x1-0-NCHW-FP32-W=ConvAsmBwdWrW1x1:1,16,2,8,8,1,1,4,0,0
64-35-35-5x5-48-35-35-32-2x2-1x1-1x1-0-NCHW-FP16-B=ConvOclDirectFwd:8,8,16,16,2,2,8,2,2
512-28-28-1x1-256-28-28-128-0x0-1x1-1x1-0-NCHW-FP16-F=ConvAsm1x1U:1,8,2,32,2,4,1,8;ConvOclDirectFwd1x1:1,128,1,1,0,4,16,4,0
48-14-14-5x5-16-14-14-128-2x2-1x1-1x1-0-NCHW-FP16-B=ConvOclDirectFwd:16,8,16,16,1,2,4,1,2
448-211-146-1x1-240-211-146-2-0x0-1x1-1x1-0-NCHW-FP32-W=ConvAsmBwdWrW1x1:4,4,8,4,4,1,1,2,0,1
1000-657-620-1x1-192-657-620-1-0x0-1x1-1x1-0-NCHW-FP32-B=ConvOclDirectFwd1x1:1,128,1,1,0,1,32,4,0
320-64-128-3x3-160-64-128-1-1x1-1x1-1x1-0-NCHW-FP32-W=ConvAsmBwdWrW3x3:0,0,16,4,2,1
352-1-408-1x1-1024-1-408-1-0x0-1x1-1x1-0-NCHW-FP32-B=ConvAsm1x1U:2,16,2,64,1,2,4,2;ConvOclDirectFwd1x1:1,64,1,1,0,2,4,4,0
1392-577-131-1x1-48-577-131-1-0x0-1x1-1x1-0-NCHW-FP32-F=ConvOclDirectFwd1x1:1,64,1,1,1,4,32,2048,0
240-845-201-1x1-48-845-201-4-0x0-1x1-1x1-0-NCHW-FP32-F=ConvOclDirectFwd1x1:1,64,1,1,1,4,32,2048,0
64-64-128-5x5-32-64-128-1-2x2-1x1-1x1-0-NCHW-FP16-B=ConvOclDirectFwd:8,32,16,32,2,1,2,4,1
288-10-292-1x1-576-10-292-256-0x0-1x1-1x1-0-NCHW-FP32-F=ConvAsm1x1U:2,16,6,64,1,2,2,2;ConvOclDirectFwd1x1:1,64,1,1,1,4,32,2048,0
32-10-890-1x1-736-10-890-32-0x0-1x1-1x1-0-NCHW-FP32-B=ConvOclDirectFwd1x1:1,256,1,1,0,4,16,8,0
1-336-133-1x1-256-336-133-4-0x0-1x1-1x1-0-NCHW-FP32-B=ConvOclDirectFwd1x1:1,256,1,1,0,1,64,4,0
1296-297-333-1x1-8-297-333-2-0x0-1x1-1x1-0-NCHW-FP32-F=ConvOclDirectFwd1x1:1,128,1,1,0,1,16,8,0
256-56-56-3x3-128-56-56-32-1x1-1x1-1x1-0-NCHW-FP16-W=ConvAsmBwdWrW3x3:0,1,8,4,1,4
288-14-14-1x1-128-14-14-256-0x0-1x1-1x1-0-NCHW-FP32-B=ConvAsm1x1U:1,32,1,16,2,1,2,2;ConvOclDirectFwd1x1:1,64,1,1,0,1,32,4,0
1024-17-17-1x1-128-17-17-16-0x0-1x1-1x1-0-NCHW-FP32-F=ConvAsm1x1U:3,16,5,64,1,2,4,1;ConvOclDirectFwd1x1:1,64,1,1,1,4,16,256,0;ConvActivAsm1x1U:3,16,5,64,2,4
1056-154-905-1x1-64-154-905-1-0x0-1x1-1x1-0-NCHW-FP32-F=ConvOclDirectFwd1x1:1,64,1,1,1,4,16,256,0
640-59-3-1x1-1632-59-3-4-0x0-1x1-1x1-0-NCHW-FP32-W=ConvAsmBwdWrW1x1:1,16,2,8,8,1,1,4,0,1
224-569-754-1x1-96-569-754-4-0x0-1x1-1x1-0-NCHW-FP32-F=ConvOclDirectFwd1x1:1,64,1,1,1,4,64,2048,0
352-396-471-1x1-992-396-471-1-0x0-1x1-1x1-0-NCHW-FP32-B=ConvOclDirectFwd1x1:1,256,1,1,0,2,32,4,0
64-54-54-3x3-64-54-54-256-1x1-1x1-1x1-0-NCHW-FP32-W=ConvAsmBwdWrW3x3:0,1,8,4,2,8
32-658-146-1x1-992-658-146-2-0x0-1x1-1x1-0-NCHW-FP32-B=ConvOclDirectFwd1x1:1,256,1,1,0,4,16,8,0
512-7-7-3x3-256-7-7-2-1x1-1x1-1x1-0-NCHW-FP32-W=ConvAsmBwdWrW3x3:0,0,8,4,7,1
128-14-14-1x1-896-14-14-32-0x0-1x1-1x1-0-NCHW-FP16-B=ConvAsm1x1U:1,16,2,16,1,2,2,2;ConvOclDirectFwd1x1:1,256,1,1,0,4,8,4,0
128-28-28-3x3-128-56-56-1-1x1-2x2-1x1-0-NCHW-FP32-W=ConvAsmBwdWrW3x3:0,0,16,4,2,1
320-304-93-1x1-256-304-93-32-0x0-1x1-1x1-0-NCHW-FP32-F=ConvOclDirectFwd1x1:1,64,1,1,1,0,16,2048,0
640-7-7-1x1-128-7-7-256-0x0-1x1-1x1-0-NCHW-FP32-B=ConvAsm1x1U:2,16,2,32,1,2,2,2;ConvOclDirectFwd1x1:1,128,1,1,0,1,16,4,0
128-28-28-1x1-480-28-28-512-0x0-1x1-1x1-0-NCHW-FP16-B=ConvAsm1x1U:1,16,2,16,1,2,1,1;ConvOclDirectFwd1x1:1,64,1,1,0,4,16,4,0
800-27-247-1x1-2160-27-247-4-0x0-1x1-1x1-0-NCHW-FP32-W=ConvAsmBwdWrW1x1:2,8,2,8,8,1,1,4,0,0
128-56-56-3x3-128-56-56-16-1x1-1x1-1x1-0-NCHW-FP32-B_g32=ConvOclDirectFwd:16,16,16,32,1,2,4,1,1
1024-17-17-1x1-128-17-17-256-0x0-1x1-1x1-0-NCHW-FP16-B=ConvAsm1x1U:1,16,2,32,1,2,2,2;ConvOclDirectFwd1x1:1,64,1,1,0,1,32,4,0
240-7-7-1x1-960-7-7-256-0x0-1x1-1x1-0-NCHW-FP32-B_g3=ConvOclDirectFwd:8,8,8,8,1,1,8,4,1
1280-159-906-1x1-1440-159-906-2-0x0-1x1-1x1-0-NCHW-FP32-B=ConvOclDirectFwd1x1:1,256,1,1,0,2,32,4,0
128-7-7-1x1-832-7-7-128-0x0-1x1-1x1-0-NCHW-FP32-F=ConvAsm1x1U:1,8,1,64,4,4,1,4;ConvOclDirectFwd1x1:1,64,1,1,1,0,32,128,0
832-64-128-1x1-128-64-128-1-0x0-1x1-1x1-0-NCHW-FP16-F=ConvOclDirectFwd1x1:1,128,1,1,0,2,8,4,0
128-14-14-1x1-576-14-14-512-0x0-1x1-1x1-0-NCHW-FP32-F=ConvAsm1x1U:1,16,1,32,4,2,1,4;ConvOclDirectFwd1x1:1,64,1,1,1,4,32,2048,0
512-14-14-1x1-64-14-14-128-0x0-1x1-1x1-0-NCHW-FP32-F=ConvAsm1x1U:4,16,4,64,1,2,4,1;ConvOclDirectFwd1x1:1,64,1,1,1,4,32,2048,0;ConvActivAsm1x1U:4,32,7,32,1,2
288-126-378-1x1-640-126-378-8-0x0-1x1-1x1-0-NCHW-FP32-F=ConvOclDirectFwd1x1:1,64,1,1,1,4,16,2048,0
416-28-28-1x1-128-28-28-64-0x0-1x1-1x1-0-NCHW-FP32-B=ConvAsm1x1U:2,32,2,32,1,1,2,2;ConvOclDirectFwd1x1:1,128,1,1,0,1,32,4,0
32-28-28-3x3-128-28-28-32-1x1-1x1-1x1-0-NCHW-FP16-F=ConvOclDirectFwd:16,16,32,32,2,2,8,1,2
2048-7-7-1x1-1024-14-14-32-0x0-2x2-1x1-0-NCHW-FP16-W=ConvAsmBwdWrW1x1:1,16,4,8,2,1,1,2,0,2
448-269-57-1x1-232-269-57-6-0x0-1x1-1x1-0-NCHW-FP32-F=ConvOclDirectFwd1x1:1,256,1,1,0,1,16,4,0
192-71-71-3x3-80-73-73-512-0x0-1x1-1x1-0-NCHW-FP16-B=ConvOclDirectFwd:8,16,16,32,2,2,8,4,2
512-9-41-5x5-256-20-84-2-1x1-2x2-1x1-0-NCHW-FP32-W=ConvOclBwdWrW2<1>:1,12,3,3,5;ConvOclBwdWrW2<2>:1,12,3,3,5
288-35-35-1x1-64-35-35-256-0x0-1x1-1x1-0-NCHW-FP16-F=ConvAsm1x1U:2,8,4,64,1,4,1,4;ConvOclDirectFwd1x1:1,256,1,1,0,1,16,8,0
1376-512-14-1x1-8-512-14-4-0x0-1x1-1x1-0-NCHW-FP32-F=ConvOclDirectFwd1x1:1,128,1,1,0,4,16,8,0
3-642-357-1x1-24-642-357-2-0x0-1x1-1x1-0-NCHW-FP32-F=ConvOclDirectFwd1x1:1,256,1,1,0,1,8,4,0
2048-12-319-1x1-1280-12-319-48-0x0-1x1-1x1-0-NCHW-FP32-B=ConvOclDirectFwd1x1:1,64,1,1,0,2,32,4,0
896-21-268-1x1-1200-21-268-4-0x0-1x1-1x1-0-NCHW-FP32-W=ConvAsmBwdWrW1x1:2,8,4,8,4,1,1,4,0,2
128-7-7-1x1-608-7-7-128-0x0-1x1-1x1-0-NCHW-FP16-W=ConvAsmBwdWrW1x1:4,4,4,4,2,1,2,2,0,2
384-7-7-3x3-192-7-7-4-1x1-1x1-1x1-0-NCHW-FP32-W=ConvAsmBwdWrW3x3:0,1,8,4,5,1
800-45-394-1x1-480-45-394-32-0x0-1x1-1x1-0-NCHW-FP32-F=ConvOclDirectFwd1x1:1,64,1,1,1,4,64,2048,0
768-186-151-1x1-4-186-151-16-0x0-1x1-1x1-0-NCHW-FP32-F=ConvOclDirectFwd1x1:1,256,1,1,0,2,16,8,0
128-7-7-1x1-896-7-7-64-0x0-1x1-1x1-0-NCHW-FP16-B=ConvAsm1x1U:1,16,2,32,1,2,2,2;ConvOclDirectFwd1x1:1,128,1,1,0,1,8,4,0
256-17-17-1x1-1024-17-17-16-0x0-1x1-1x1-0-NCHW-FP32-W=ConvAsmBwdWrW1x1:1,16,2,4,8,1,1,4,0,1
192-8-8-1x1-1280-8-8-128-0x0-1x1-1x1-0-NCHW-FP32-W=ConvAsmBwdWrW1x1:1,16,4,4,8,1,2,4,0,1
256-57-57-1x1-128-57-57-16-0x0-1x1-1x1-0-NCHW-FP32-F=ConvAsm1x1U:4,32,7,64,1,1,1,1;ConvOclDirectFwd1x1:1,64,1,1,1,4,32,2048,0
352-867-486-1x1-672-867-486-1-0x0-1x1-1x1-0-NCHW-FP32-F=ConvOclDirectFwd1x1:1,64,1,1,1,0,64,2048,0
96-71-71-3x3-64-73-73-32-0x0-1x1-1x1-0-NCHW-FP16-B=ConvOclDirectFwd:16,8,16,16,1,2,8,1,2
240-7-7-3x3-240-7-7-8-1x1-1x1-1x1-0-NCHW-FP32-W=ConvAsmBwdWrW3x3:0,1,8,2,7,1
448-14-14-1x1-128-14-14-16-0x0-1x1-1x1-0-NCHW-FP16-W=ConvAsmBwdWrW1x1:4,4,8,1,4,2,1,4,0,0
1024-15-15-1x1-512-29-29-8-0x0-2x2-1x1-0-NCHW-FP32-B=ConvAsm1x1U:4,16,4,64,1,2,4,1;ConvOclDirectFwd1x1:1,256,1,1,0,1,16,4,0
116-441-982-1x1-640-441-982-1-0x0-1x1-1x1-0-NCHW-FP32-B=ConvOclDirectFwd1x1:1,256,1,1,0,2,32,4,0
2-343-404-1x1-8-343-404-8-0x0-1x1-1x1-0-NCHW-FP32-W=ConvAsmBwdWrW1x1:4,4,2,1,2,1,4,4,0,2
640-67-361-1x1-320-67-361-6-0x0-1x1-1x1-0-NCHW-FP32-W=ConvAsmBwdWrW1x1:4,4,8,4,4,1,1,4,0,1
256-29-29-1x1-512-29-29-8-0x0-1x1-1x1-0-NCHW-FP32-B=ConvAsm1x1U:2,16,2,64,1,2,2,2;ConvOclDirectFwd1x1:1,256,1,1,0,1,32,4,0
96-651-15-1x1-2160-651-15-4-0x0-1x1-1x1-0-NCHW-FP32-B=ConvOclDirectFwd1x1:1,256,1,1,0,1,16,4,0
160-14-14-1x1-512-14-14-256-0x0-1x1-1x1-0-NCHW-FP16-B=ConvAsm1x1U:1,16,2,16,1,2,1,8;ConvOclDirectFwd1x1:1,256,1,1,0,2,16,4,0
256-28-28-3x3-512-28-28-512-1x1-1x1-1x1-0-NCHW-FP32-W=ConvAsmBwdWrW3x3:0,1,8,4,6,4
1280-8-8-1x1-320-8-8-16-0x0-1x1-1x1-0-NCHW-FP32-F=ConvAsm1x1U:1,8,1,64,3,4,2,2;ConvOclDirectFwd1x1:1,64,1,1,1,4,32,256,0;ConvActivAsm1x1U:1,16,2,32,3,4
160-14-14-1x1-512-14-14-16-0x0-1x1-1x1-0-NCHW-FP32-W=ConvAsmBwdWrW1x1:1,16,2,8,2,1,2,4,0,1
60-14-14-3x3-60-28-28-32-1x1-2x2-1x1-0-NCHW-FP32-W=ConvAsmBwdWrW3x3:0,0,16,4,7,2
864-53-336-1x1-992-53-336-6-0x0-1x1-1x1-0-NCHW-FP32-F=ConvOclDirectFwd1x1:1,64,1,1,1,0,64,2048,0
448-40-745-1x1-1680-40-745-6-0x0-1x1-1x1-0-NCHW-FP32-B=ConvOclDirectFwd1x1:1,64,1,1,0,2,16,4,0
512-28-28-1x1-128-28-28-512-0x0-1x1-1x1-0-NCHW-FP32-B=ConvAsm1x1U:2,16,2,32,1,2,1,4;ConvOclDirectFwd1x1:1,64,1,1,0,2,32,4,0
60-14-14-1x1-240-14-14-512-0x0-1x1-1x1-0-NCHW-FP16-F_g3=ConvOclDirectFwd:16,16,16,16,1,1,8,4,1
128-28-28-1x1-384-28-28-32-0x0-1x1-1x1-0-NCHW-FP16-W=ConvAsmBwdWrW1x1:2,8,2,8,2,1,4,4,0,1
128-28-28-1x1-224-28-28-128-0x0-1x1-1x1-0-NCHW-FP32-F=ConvAsm1x1U:1,16,1,64,4,2,2,2;ConvOclDirectFwd1x1:1,64,1,1,1,0,16,2048,0
128-141-680-1x1-64-141-680-1-0x0-1x1-1x1-0-NCHW-FP32-B=ConvOclDirectFwd1x1:1,128,1,1,0,2,32,4,0
232-14-14-1x1-232-14-14-1024-0x0-1x1-1x1-0-NCHW-FP16-B=ConvAsm1x1U:1,8,2,64,1,2,2,1;ConvOclDirectFwd1x1:1,256,1,1,0,4,16,4,0
1-344-51-1x1-48-344-51-12-0x0-1x1-1x1-0-NCHW-FP32-B=ConvAsm1x1U:1,8,1,64,1,1,1,1;ConvOclDirectFwd1x1:1,256,1,1,0,1,16,4,0
144-794-707-1x1-640-794-707-1-0x0-1x1-1x1-0-NCHW-FP32-B=ConvOclDirectFwd1x1:1,128,1,1,0,2,32,4,0
912-799-152-1x1-1-799-152-1-0x0-1x1-1x1-0-NCHW-FP32-F=ConvOclDirectFwd1x1:1,256,1,1,0,4,16,4,0
384-8-8-1x1-1280-8-8-4-0x0-1x1-1x1-0-NCHW-FP32-W=ConvAsmBwdWrW1x1:1,16,4,4,4,1,1,4,0,0
64-14-14-1x1-480-14-14-16-0x0-1x1-1x1-0-NCHW-FP32-B=ConvAsm1x1U:1,16,1,64,2,2,2,2;ConvOclDirectFwd1x1:1,64,1,1,0,4,16,4,0
1-776-573-1x1-192-776-573-1-0x0-1x1-1x1-0-NCHW-FP32-F=ConvOclDirectFwd1x1:1,64,1,1,0,4,8,4,0
64-329-320-1x1-192-329-320-16-0x0-1x1-1x1-0-NCHW-FP32-B=ConvOclDirectFwd1x1:1,64,1,1,0,2,32,4,0
32-28-28-5x5-16-28-28-8-2x2-1x1-1x1-0-NCHW-FP32-B=ConvOclDirectFwd:8,32,32,32,4,1,1,4,2
1536-8-8-1x1-384-8-8-128-0x0-1x1-1x1-0-NCHW-FP32-F=ConvAsm1x1U:4,8,4,16,2,4,1,4;ConvOclDirectFwd1x1:1,64,1,1,1,4,32,2048,0;ConvActivAsm1x1U:2,16,2,32,4,2
256-37-340-1x1-608-37-340-6-0x0-1x1-1x1-0-NCHW-FP32-B=ConvOclDirectFwd1x1:1,256,1,1,0,1,32,4,0
2112-941-102-1x1-232-941-102-1-0x0-1x1-1x1-0-NCHW-FP32-F=ConvOclDirectFwd1x1:1,256,1,1,0,2,16,8,0
116-257-84-1x1-336-257-84-1-0x0-1x1-1x1-0-NCHW-FP32-B=ConvOclDirectFwd1x1:1,64,1,1,0,4,16,4,0
24-56-56-1x1-58-56-56-8-0x0-1x1-1x1-0-NCHW-FP16-F=ConvAsm1x1U:1,8,2,64,1,4,1,4;ConvOclDirectFwd1x1:1,64,1,1,0,2,16,4,0
1856-266-248-1x1-640-266-248-1-0x0-1x1-1x1-0-NCHW-FP32-F=ConvOclDirectFwd1x1:1,64,1,1,1,1,16,2048,0
256-29-29-3x3-256-57-57-4-1x1-2x2-1x1-0-NCHW-FP32-W_g32=ConvOclBwdWrW2<1>:1,6,3,1,3;ConvOclBwdWrW2<2>:1,7,1,1,3;ConvOclBwdWrW2<4>:1,6,3,1,7;ConvAsmBwdWrW3x3:0,0,16,2,3,1
160-17-17-1x1-768-17-17-512-0x0-1x1-1x1-0-NCHW-FP16-B=ConvAsm1x1U:1,16,2,16,1,2,1,1;ConvOclDirectFwd1x1:1,256,1,1,0,1,32,4,0
128-56-56-3x3-128-28-28-32-1x1-2x2-1x1-0-NCHW-FP32-F=ConvOclDirectFwd:32,8,32,32,1,4,8,1,1
448-347-130-1x1-24-347-130-1-0x0-1x1-1x1-0-NCHW-FP32-F=ConvOclDirectFwd1x1:1,128,1,1,0,2,16,4,0
512-28-28-1x1-256-28-28-128-0x0-1x1-1x1-0-NCHW-FP16-W=ConvAsmBwdWrW1x1:2,8,4,8,2,1,2,2,0,1
512-14-14-1x1-1024-14-14-256-0x0-1x1-1x1-0-NCHW-FP32-B=ConvAsm1x1U:1,32,1,32,2,1,1,4;ConvOclDirectFwd1x1:1,128,1,1,0,2,32,4,0
128-29-29-3x3-128-57-57-256-1x1-2x2-1x1-0-NCHW-FP32-B=ConvOclDirectFwd:16,16,16,32,1,2,8,1,2
192-13-13-3x3-384-13-13-64-1x1-1x1-1x1-0-NCHW-FP16-W=ConvAsmBwdWrW3x3:0,0,8,4,5,1
128-28-28-1x1-192-28-28-128-0x0-1x1-1x1-0-NCHW-FP32-B=ConvAsm1x1U:1,32,1,32,1,1,1,1;ConvOclDirectFwd1x1:1,128,1,1,0,1,32,4,0
576-216-193-1x1-1696-216-193-4-0x0-1x1-1x1-0-NCHW-FP32-B=ConvOclDirectFwd1x1:1,128,1,1,0,2,32,4,0
128-27-27-3x3-32-27-27-64-1x1-1x1-1x1-0-NCHW-FP32-W=ConvAsmBwdWrW3x3:0,0,8,4,2,4
64-106-86-1x1-64-106-86-32-0x0-1x1-1x1-0-NCHW-FP32-W=ConvAsmBwdWrW1x1:4,4,2,4,2,1,2,4,0,2
19-172-355-1x1-1344-172-355-6-0x0-1x1-1x1-0-NCHW-FP32-B=ConvOclDirectFwd1x1:1,128,1,1,0,2,32,4,0
2-16-834-1x1-512-16-834-2-0x0-1x1-1x1-0-NCHW-FP32-F=ConvOclDirectFwd1x1:1,256,1,1,0,2,4,4,0
256-14-14-1x1-512-28-28-16-0x0-2x2-1x1-0-NCHW-FP32-B=ConvAsm1x1U:1,16,1,32,1,2,1,4;ConvOclDirectFwd1x1:1,256,1,1,0,1,32,4,0
512-7-7-1x1-256-14-14-256-0x0-2x2-1x1-0-NCHW-FP16-B=ConvAsm1x1U:1,16,2,32,1,2,2,2;ConvOclDirectFwd1x1:1,64,1,1,0,1,32,4,0
1024-8-8-3x3-1024-15-15-1-1x1-2x2-1x1-0-NCHW-FP32-W_g32=ConvOclBwdWrW2<1>:1,6,8,1,9;ConvAsmBwdWrW3x3:0,0,16,2,6,1
128-93-140-1x1-1088-93-140-16-0x0-1x1-1x1-0-NCHW-FP32-B=ConvOclDirectFwd1x1:1,128,1,1,0,2,32,4,0
120-7-7-1x1-480-7-7-2-0x0-1x1-1x1-0-NCHW-FP32-F_g3=ConvOclDirectFwd:8,8,8,8,1,1,4,4,2
320-14-14-1x1-128-14-14-32-0x0-1x1-1x1-0-NCHW-FP32-B=ConvAsm1x1U:1,16,1,32,1,2,2,2;ConvOclDirectFwd1x1:1,256,1,1,0,4,16,4,0
120-14-14-1x1-480-14-14-2-0x0-1x1-1x1-0-NCHW-FP16-B_g3=ConvOclDirectFwd:16,8,16,8,1,1,4,4,2
3-233-1011-1x1-3-233-1011-128-0x0-1x1-1x1-0-NCHW-FP32-B=ConvAsm1x1U:1,1,1,4,1,1,1,1;ConvOclDirectFwd1x1:1,256,1,1,0,1,16,4,0
8-625-152-1x1-2-625-152-64-0x0-1x1-1x1-0-NCHW-FP32-W=ConvAsmBwdWrW1x1:4,4,2,1,2,1,4,4,0,1
256-8-8-1x1-1536-8-8-128-0x0-1x1-1x1-0-NCHW-FP32-W=ConvAsmBwdWrW1x1:2,8,4,4,8,1,2,4,0,1
512-10-42-3x3-512-10-42-2-1x1-1x1-1x1-0-NCHW-FP32-W=ConvAsmBwdWrW3x3:0,1,8,4,2,1
416-133-30-1x1-864-133-30-12-0x0-1x1-1x1-0-NCHW-FP32-W=ConvAsmBwdWrW1x1:2,8,4,8,4,1,1,4,0,1
58-28-28-1x1-24-28-28-256-0x0-1x1-1x1-0-NCHW-FP16-B=ConvAsm1x1U:1,8,2,32,2,2,1,1;ConvOclDirectFwd1x1:1,64,1,1,0,4,8,4,0
576-302-141-1x1-432-302-141-16-0x0-1x1-1x1-0-NCHW-FP32-B=ConvOclDirectFwd1x1:1,256,1,1,0,2,16,8,0
2-963-387-1x1-24-963-387-12-0x0-1x1-1x1-0-NCHW-FP32-F=ConvOclDirectFwd1x1:1,64,1,1,0,1,16,4,0
320-28-28-1x1-128-28-28-256-0x0-1x1-1x1-0-NCHW-FP16-F=ConvAsm1x1U:1,8,2,16,2,4,1,8;ConvOclDirectFwd1x1:1,128,1,1,0,4,16,4,0
256-438-397-1x1-704-438-397-2-0x0-1x1-1x1-0-NCHW-FP32-B=ConvOclDirectFwd1x1:1,256,1,1,0,2,32,4,0
116-1-790-1x1-1920-1-790-12-0x0-1x1-1x1-0-NCHW-FP32-B=ConvAsm1x1U:3,16,3,32,1,2,2,2;ConvOclDirectFwd1x1:1,128,1,1,0,2,32,4,0
128-7-7-1x1-512-7-7-16-0x0-1x1-1x1-0-NCHW-FP16-B=ConvAsm1x1U:1,8,2,32,1,2,4,1;ConvOclDirectFwd1x1:1,128,1,1,0,1,8,4,0
112-14-14-1x1-512-14-14-256-0x0-1x1-1x1-0-NCHW-FP16-B=ConvAsm1x1U:1,16,2,16,1,2,1,4;ConvOclDirectFwd1x1:1,256,1,1,0,2,16,4,0
448-769-195-1x1-256-769-195-4-0x0-1x1-1x1-0-NCHW-FP32-B=ConvOclDirectFwd1x1:1,256,1,1,0,1,32,4,0
1280-8-8-1x1-320-8-8-128-0x0-1x1-1x1-0-NCHW-FP32-F=ConvAsm1x1U:2,16,2,32,3,2,4,1;ConvOclDirectFwd1x1:1,64,1,1,1,1,16,2048,0;ConvActivAsm1x1U:2,16,2,32,4,4
192-8-8-1x1-2048-8-8-128-0x0-1x1-1x1-0-NCHW-FP32-B=ConvAsm1x1U:1,16,1,64,4,2,1,4;ConvOclDirectFwd1x1:1,128,1,1,0,4,16,4,0
448-28-28-1x1-128-28-28-256-0x0-1x1-1x1-0-NCHW-FP16-W=ConvAsmBwdWrW1x1:4,4,4,4,4,1,2,2,0,1
80-875-179-1x1-128-875-179-1-0x0-1x1-1x1-0-NCHW-FP32-F=ConvOclDirectFwd1x1:1,64,1,1,1,1,16,128,0
816-384-121-1x1-1000-384-121-8-0x0-1x1-1x1-0-NCHW-FP32-F=ConvOclDirectFwd1x1:1,128,1,1,0,2,8,4,0
128-14-14-1x1-416-14-14-32-0x0-1x1-1x1-0-NCHW-FP16-B=ConvAsm1x1U:1,16,2,16,1,2,2,2;ConvOclDirectFwd1x1:1,64,1,1,0,4,8,4,0
160-643-1014-1x1-416-643-1014-1-0x0-1x1-1x1-0-NCHW-FP32-B=ConvOclDirectFwd1x1:1,64,1,1,0,1,32,4,0
256-7-7-3x3-256-14-14-128-1x1-2x2-1x1-0-NCHW-FP32-B=ConvOclDirectFwd:8,8,16,8,2,1,2,2,2
24-14-14-5x5-64-14-14-4-2x2-1x1-1x1-0-NCHW-FP32-F=ConvOclDirectFwd:16,16,16,16,1,1,2,2,2;ConvOclDirectFwdFused:16,16,16,16,1,1,2,4,2
64-14-14-1x1-480-14-14-32-0x0-1x1-1x1-0-NCHW-FP16-W=ConvAsmBwdWrW1x1:2,8,2,8,2,1,4,2,0,1
160-523-150-1x1-128-523-150-12-0x0-1x1-1x1-0-NCHW-FP32-F=ConvOclDirectFwd1x1:1,64,1,1,1,0,32,2048,0
64-56-56-1x1-256-56-56-2-0x0-1x1-1x1-0-NCHW-FP32-W=ConvAsmBwdWrW1x1:4,4,2,4,2,1,1,4,0,1
58-28-28-1x1-58-28-28-64-0x0-1x1-1x1-0-NCHW-FP16-W=ConvAsmBwdWrW1x1:4,4,4,2,2,1,4,4,0,1
64-56-56-1x1-256-28-28-128-0x0-2x2-1x1-0-NCHW-FP32-F=ConvAsm1x1U:1,8,1,16,1,2,1,1;ConvOclDirectFwd1x1:1,64,1,1,1,1,16,2048,0
240-7-7-1x1-960-7-7-2-0x0-1x1-1x1-0-NCHW-FP32-B_g3=ConvOclDirectFwd:8,8,8,8,1,1,4,4,2
128-4-4-1x1-608-4-4-64-0x0-1x1-1x1-0-NCHW-FP16-W=ConvAsmBwdWrW1x1:2,8,2,4,2,2,2,2,0,1
704-946-81-1x1-1568-946-81-4-0x0-1x1-1x1-0-NCHW-FP32-B=ConvOclDirectFwd1x1:1,256,1,1,0,2,32,4,0
160-564-367-1x1-128-564-367-6-0x0-1x1-1x1-0-NCHW-FP32-B=ConvOclDirectFwd1x1:1,256,1,1,0,2,32,4,0
192-7-7-1x1-832-7-7-1-0x0-1x1-1x1-0-NCHW-FP32-W=ConvAsmBwdWrW1x1:1,16,2,4,2,1,1,4,0,1
768-17-17-1x1-160-17-17-8-0x0-1x1-1x1-0-NCHW-FP32-F=ConvAsm1x1U:4,8,4,32,2,4,2,2;ConvOclDirectFwd1x1:1,64,1,1,1,0,16,256,0;ConvActivAsm1x1U:4,16,7,16,1,4
64-56-56-3x3-64-56-56-128-1x1-1x1-1x1-0-NCHW-FP16-F=ConvOclDirectFwd:32,8,32,32,1,4,8,1,1;ConvOclDirectFwdFused:32,8,32,32,1,4,8,1,2
320-8-594-1x1-928-8-594-12-0x0-1x1-1x1-0-NCHW-FP32-B=ConvOclDirectFwd1x1:1,256,1,1,0,4,16,8,0
128-28-28-1x1-352-28-28-64-0x0-1x1-1x1-0-NCHW-FP16-B=ConvAsm1x1U:1,16,2,16,1,2,2,2;ConvOclDirectFwd1x1:1,128,1,1,0,4,16,4,0
896-9-754-1x1-1440-9-754-4-0x0-1x1-1x1-0-NCHW-FP32-W=ConvAsmBwdWrW1x1:2,8,4,4,8,1,1,4,0,0
528-64-128-1x1-160-64-128-1-0x0-1x1-1x1-0-NCHW-FP16-F=ConvOclDirectFwd1x1:1,64,1,1,0,2,8,4,0
128-14-14-1x1-384-14-14-64-0x0-1x1-1x1-0-NCHW-FP16-F=ConvAsm1x1U:1,8,2,32,2,4,1,8;ConvOclDirectFwd1x1:1,64,1,1,0,4,8,4,0
48-7-7-5x5-128-7-7-1-2x2-1x1-1x1-0-NCHW-FP16-F=ConvOclDirectFwd:8,8,8,8,1,1,1,4,1;ConvOclDirectFwdFused:8,8,8,8,1,1,1,4,1
32-7-7-1x1-832-7-7-4-0x0-1x1-1x1-0-NCHW-FP16-W=ConvAsmBwdWrW1x1:4,4,4,2,2,2,1,4,0,1
1856-22-945-1x1-144-22-945-12-0x0-1x1-1x1-0-NCHW-FP32-F=ConvOclDirectFwd1x1:1,64,1,1,1,0,32,256,0
128-40-175-3x3-128-40-175-16-1x1-1x1-1x1-0-NCHW-FP32-W=ConvAsmBwdWrW3x3:0,0,16,4,2,1
512-15-15-1x1-1024-15-15-32-0x0-1x1-1x1-0-NCHW-FP32-F=ConvAsm1x1U:4,16,5,16,2,2,2,1;ConvOclDirectFwd1x1:1,64,1,1,1,0,16,2048,0
2048-8-8-1x1-192-8-8-8-0x0-1x1-1x1-0-NCHW-FP16-F=ConvAsm1x1U:2,8,4,16,1,4,4,2;ConvOclDirectFwd1x1:1,64,1,1,0,1,4,4,0
16-28-28-1x1-192-28-28-256-0x0-1x1-1x1-0-NCHW-FP32-W=ConvAsmBwdWrW1x1:4,4,2,4,2,1,4,4,0,1
54-55-55-1x1-24-55-55-1024-0x0-1x1-1x1-0-NCHW-FP32-W=ConvAsmBwdWrW1x1:4,4,2,1,2,1,2,4,0,1
60-28-28-1x1-240-28-28-512-0x0-1x1-1x1-0-NCHW-FP32-F_g3=ConvOclDirectFwd:16,16,32,32,2,2,8,2,1
512-64-64-3x3-256-64-64-4-1x1-1x1-1x1-0-NCHW-FP32-W=ConvAsmBwdWrW3x3:0,0,8,4,1,1
832-38-689-1x1-1008-38-689-2-0x0-1x1-1x1-0-NCHW-FP32-B=ConvOclDirectFwd1x1:1,256,1,1,0,2,16,8,0
80-113-35-1x1-80-113-35-2-0x0-1x1-1x1-0-NCHW-FP32-B=ConvAsm1x1U:1,8,1,64,1,4,1,1;ConvOclDirectFwd1x1:1,128,1,1,0,1,8,4,0
352-304-267-1x1-288-304-267-2-0x0-1x1-1x1-0-NCHW-FP32-B=ConvOclDirectFwd1x1:1,128,1,1,0,2,32,4,0
256-468-117-1x1-192-468-117-6-0x0-1x1-1x1-0-NCHW-FP32-B=ConvOclDirectFwd1x1:1,64,1,1,0,2,32,4,0
704-14-14-1x1-128-14-14-64-0x0-1x1-1x1-0-NCHW-FP32-B=ConvAsm1x1U:2,32,2,16,1,1,4,1;ConvOclDirectFwd1x1:1,64,1,1,0,4,16,4,0
144-56-56-1x1-192-56-56-16-0x0-1x1-1x1-0-NCHW-FP32-F=ConvAsm1x1U:2,16,2,64,2,2,1,2;ConvOclDirectFwd1x1:1,64,1,1,1,4,16,2048,0;ConvActivAsm1x1U:2,16,3,64,2,1
208-14-14-3x3-96-14-14-128-1x1-1x1-1x1-0-NCHW-FP32-W=ConvAsmBwdWrW3x3:0,1,8,4,13,4
512-907-271-1x1-1024-907-271-2-0x0-1x1-1x1-0-NCHW-FP32-B=ConvOclDirectFwd1x1:1,256,1,1,0,1,32,4,0
832-7-7-1x1-192-7-7-128-0x0-1x1-1x1-0-NCHW-FP16-F=ConvAsm1x1U:2,8,4,16,1,4,2,4;ConvOclDirectFwd1x1:8,64,8,8,0,1,16,4,1
832-7-7-1x1-256-7-7-32-0x0-1x1-1x1-0-NCHW-FP32-F=ConvAsm1x1U:4,8,4,16,1,4,2,4;ConvOclDirectFwd1x1:1,64,1,1,1,4,16,256,0;ConvActivAsm1x1U:4,16,4,16,2,4
544-548-151-1x1-1-548-151-8-0x0-1x1-1x1-0-NCHW-FP32-F=ConvOclDirectFwd1x1:1,256,1,1,0,4,16,4,0
48-16-667-1x1-1856-16-667-1-0x0-1x1-1x1-0-NCHW-FP32-B=ConvOclDirectFwd1x1:1,256,1,1,0,2,32,4,0
320-158-729-1x1-912-158-729-2-0x0-1x1-1x1-0-NCHW-FP32-B=ConvOclDirectFwd1x1:1,256,1,1,0,2,16,8,0
1024-7-7-1x1-464-7-7-128-0x0-1x1-1x1-0-NCHW-FP16-W=ConvAsmBwdWrW1x1:1,16,4,8,2,1,1,2,0,2
224-671-885-1x1-240-671-885-1-0x0-1x1-1x1-0-NCHW-FP32-B=ConvOclDirectFwd1x1:1,128,1,1,0,1,16,4,0
128-14-14-1x1-288-14-14-256-0x0-1x1-1x1-0-NCHW-FP32-W=ConvAsmBwdWrW1x1:4,4,4,4,4,1,2,4,0,0
128-104-104-3x3-64-209-209-32-0x0-2x2-1x1-0-NCHW-FP32-B=ConvOclDirectFwd:32,32,32,32,1,1,8,2,1
208-14-14-3x3-96-14-14-8-1x1-1x1-1x1-0-NCHW-FP16-W=ConvAsmBwdWrW3x3:0,0,8,2,3,1
32-2-794-1x1-1296-2-794-8-0x0-1x1-1x1-0-NCHW-FP32-B=ConvAsm1x1U:1,8,1,16,1,2,4,2;ConvOclDirectFwd1x1:1,256,1,1,0,2,4,8,0
32-7-7-1x1-832-7-7-32-0x0-1x1-1x1-0-NCHW-FP32-B=ConvAsm1x1U:1,16,1,64,1,2,2,1;ConvOclDirectFwd1x1:1,256,1,1,0,1,8,4,0
448-8-8-1x1-2048-8-8-64-0x0-1x1-1x1-0-NCHW-FP16-B=ConvAsm1x1U:1,16,2,32,1,2,2,4;ConvOclDirectFwd1x1:1,64,1,1,0,4,16,4,0
64-112-112-1x1-64-112-112-16-0x0-1x1-1x1-0-NCHW-FP16-W=ConvAsmBwdWrW1x1:4,4,2,4,2,1,4,4,0,2
464-271-378-1x1-896-271-378-2-0x0-1x1-1x1-0-NCHW-FP32-F=ConvOclDirectFwd1x1:1,64,1,1,1,4,32,2048,0
320-8-8-3x3-320-17-17-128-0x0-2x2-1x1-0-NCHW-FP32-B=ConvOclDirectFwd:32,16,32,32,1,2,4,4,2
240-14-14-1x1-60-14-14-1024-0x0-1x1-1x1-0-NCHW-FP32-B_g3=ConvOclDirectFwd:16,8,16,8,1,1,8,4,2
352-395-595-1x1-608-395-595-1-0x0-1x1-1x1-0-NCHW-FP32-B=ConvOclDirectFwd1x1:1,128,1,1,0,1,32,4,0
736-322-17-1x1-1000-322-17-16-0x0-1x1-1x1-0-NCHW-FP32-W=ConvAsmBwdWrW1x1:1,16,4,8,4,1,1,4,0,1
48-14-14-3x3-192-14-14-16-1x1-1x1-1x1-0-NCHW-FP32-W=ConvAsmBwdWrW3x3:0,0,8,2,8,4
116-28-28-1x1-116-28-28-32-0x0-1x1-1x1-0-NCHW-FP16-F=ConvAsm1x1U:1,8,2,16,1,4,1,4;ConvOclDirectFwd1x1:1,64,1,1,0,2,8,4,0
768-14-14-1x1-128-14-14-256-0x0-1x1-1x1-0-NCHW-FP16-F=ConvAsm1x1U:2,8,4,64,1,4,1,4;ConvOclDirectFwd1x1:8,64,16,16,0,2,16,4,1
256-14-14-3x3-256-28-28-2-1x1-2x2-1x1-0-NCHW-FP32-B=ConvOclDirectFwd:8,8,32,32,4,4,4,4,1
320-13-173-1x1-528-13-173-12-0x0-1x1-1x1-0-NCHW-FP32-W=ConvAsmBwdWrW1x1:1,16,4,8,4,1,2,4,0,1
384-35-35-1x1-96-35-35-8-0x0-1x1-1x1-0-NCHW-FP16-F=ConvAsm1x1U:2,8,4,32,1,4,2,4;ConvOclDirectFwd1x1:1,128,1,1,0,1,8,8,0
116-291-745-1x1-2-291-745-8-0x0-1x1-1x1-0-NCHW-FP32-B=ConvOclDirectFwd1x1:1,256,1,1,0,1,8,4,0
480-14-14-1x1-16-14-14-64-0x0-1x1-1x1-0-NCHW-FP16-F=ConvAsm1x1U:1,8,2,64,1,4,4,2;ConvOclDirectFwd1x1:1,256,1,1,0,4,4,4,0
128-57-57-3x3-128-57-57-128-1x1-1x1-1x1-0-NCHW-FP32-B_g32=ConvOclDirectFwd:16,16,16,32,1,2,8,4,2
128-27-27-1x1-32-27-27-16-0x0-1x1-1x1-0-NCHW-FP16-F=ConvAsm1x1U:1,8,2,64,1,4,4,1;ConvOclDirectFwd1x1:1,128,1,1,0,1,16,8,0
96-54-54-1x1-16-54-54-128-0x0-1x1-1x1-0-NCHW-FP16-B=ConvAsm1x1U:2,8,6,64,2,2,1,1;ConvOclDirectFwd1x1:1,256,1,1,0,2,16,4,0
512-14-14-3x3-512-14-14-2-1x1-1x1-1x1-0-NCHW-FP32-W_g32=ConvOclBwdWrW2<1>:1,6,3,1,7;ConvOclBwdWrW2<2>:1,6,3,1,7;ConvAsmBwdWrW3x3:0,0,16,2,2,1
160-73-73-1x1-64-73-73-16-0x0-1x1-1x1-0-NCHW-FP32-F=ConvAsm1x1U:4,16,4,64,1,2,1,4;ConvOclDirectFwd1x1:1,64,1,1,1,1,32,2048,0;ConvActivAsm1x1U:1,32,3,64,1,1
116-11-478-1x1-288-11-478-1-0x0-1x1-1x1-0-NCHW-FP32-F=ConvAsm1x1U:4,8,4,64,1,4,1,4;ConvOclDirectFwd1x1:1,256,1,1,0,1,16,4,0
80-946-199-1x1-288-946-199-6-0x0-1x1-1x1-0-NCHW-FP32-B=ConvOclDirectFwd1x1:1,128,1,1,0,2,32,4,0
32-7-7-1x1-832-7-7-4-0x0-1x1-1x1-0-NCHW-FP16-B=ConvAsm1x1U:1,8,2,16,1,2,2,1;ConvOclDirectFwd1x1:1,64,1,1,0,1,4,4,0
800-7-7-1x1-128-7-7-256-0x0-1x1-1x1-0-NCHW-FP16-F=ConvAsm1x1U:2,8,4,16,1,4,2,2;ConvOclDirectFwd1x1:1,64,1,1,0,1,16,4,0
128-28-28-1x1-320-28-28-32-0x0-1x1-1x1-0-NCHW-FP32-W=ConvAsmBwdWrW1x1:1,16,2,8,4,1,4,4,0,1
64-73-73-1x1-160-73-73-64-0x0-1x1-1x1-0-NCHW-FP16-B=ConvAsm1x1U:1,16,2,64,1,2,1,2;ConvOclDirectFwd1x1:1,256,1,1,0,1,32,4,0
128-14-14-1x1-928-14-14-256-0x0-1x1-1x1-0-NCHW-FP16-F=ConvAsm1x1U:2,8,4,64,1,4,1,4;ConvOclDirectFwd1x1:1,256,1,1,0,4,16,4,0
96-143-992-1x1-232-143-992-2-0x0-1x1-1x1-0-NCHW-FP32-B=ConvOclDirectFwd1x1:1,256,1,1,0,4,16,4,0
128-28-28-1x1-128-28-28-64-0x0-1x1-1x1-0-NCHW-FP32-F=ConvAsm1x1U:2,16,2,32,2,2,2,1;ConvOclDirectFwd1x1:1,64,1,1,1,4,32,256,0
464-68-212-1x1-96-68-212-1-0x0-1x1-1x1-0-NCHW-FP32-F=ConvOclDirectFwd1x1:1,64,1,1,1,0,16,2048,0
1728-202-476-1x1-160-202-476-1-0x0-1x1-1x1-0-NCHW-FP32-F=ConvOclDirectFwd1x1:1,64,1,1,1,0,64,2048,0
64-54-54-3x3-16-54-54-128-1x1-1x1-1x1-0-NCHW-FP16-F=ConvOclDirectFwd:32,8,32,32,1,4,8,1,1
64-112-112-7x7-3-230-230-128-0x0-2x2-1x1-0-NCHW-FP16-B=ConvOclDirectFwd:16,16,16,16,1,1,1,1,1
320-608-897-1x1-48-608-897-1-0x0-1x1-1x1-0-NCHW-FP32-F=ConvOclDirectFwd1x1:1,64,1,1,1,4,32,2048,0
384-35-35-1x1-64-35-35-256-0x0-1x1-1x1-0-NCHW-FP32-B=ConvAsm1x1U:2,32,3,32,1,1,1,1;ConvOclDirectFwd1x1:1,256,1,1,0,1,32,4,0
64-54-54-3x3-16-54-54-32-1x1-1x1-1x1-0-NCHW-FP16-B=ConvOclDirectFwd:16,16,32,32,2,2,8,4,1
128-28-28-3x3-128-28-28-16-1x1-1x1-1x1-0-NCHW-FP16-W=ConvAsmBwdWrW3x3:0,0,8,2,2,4
512-15-15-3x3-512-15-15-128-1x1-1x1-1x1-0-NCHW-FP32-F_g32=ConvOclDirectFwd:16,16,16,16,1,1,4,4,2
216-28-28-1x1-54-28-28-8-0x0-1x1-1x1-0-NCHW-FP32-B_g3=ConvOclDirectFwd:16,16,16,16,1,1,8,4,1
448-14-14-1x1-128-14-14-64-0x0-1x1-1x1-0-NCHW-FP32-W=ConvAsmBwdWrW1x1:2,8,2,8,4,1,2,4,0,2
64-56-56-3x3-64-56-56-128-1x1-1x1-1x1-0-NCHW-FP16-B=ConvOclDirectFwd:16,16,32,32,2,2,8,1,1
256-28-28-1x1-128-28-28-128-0x0-1x1-1x1-0-NCHW-FP16-B=ConvAsm1x1U:1,16,2,16,1,2,2,2;ConvOclDirectFwd1x1:1,64,1,1,0,4,16,4,0
256-14-14-3x3-256-14-14-128-1x1-1x1-1x1-0-NCHW-FP16-F=ConvOclDirectFwd:8,8,16,16,2,2,8,1,2;ConvOclDirectFwdFused:8,8,16,16,2,2,8,1,1
928-54-259-1x1-832-54-259-8-0x0-1x1-1x1-0-NCHW-FP32-B=ConvOclDirectFwd1x1:1,256,1,1,0,2,32,4,0
320-7-7-3x3-160-7-7-8-1x1-1x1-1x1-0-NCHW-FP32-W=ConvAsmBwdWrW3x3:0,0,8,4,5,1
416-218-239-1x1-640-218-239-16-0x0-1x1-1x1-0-NCHW-FP32-B=ConvOclDirectFwd1x1:1,256,1,1,0,2,32,4,0
416-142-3-1x1-832-142-3-256-0x0-1x1-1x1-0-NCHW-FP32-F=ConvAsm1x1U:1,32,7,16,1,1,1,1;ConvOclDirectFwd1x1:1,64,1,1,1,0,16,2048,0
32-275-738-1x1-1008-275-738-2-0x0-1x1-1x1-0-NCHW-FP32-B=ConvOclDirectFwd1x1:1,256,1,1,0,2,16,4,0
24-961-218-1x1-128-961-218-4-0x0-1x1-1x1-0-NCHW-FP32-B=ConvOclDirectFwd1x1:1,128,1,1,0,2,32,4,0
512-7-7-3x3-512-16-16-256-0x0-2x2-1x1-0-NCHW-FP16-B=ConvOclDirectFwd:16,16,16,16,1,1,4,1,2
256-13-13-3x3-256-13-13-4096-1x1-1x1-1x1-0-NCHW-FP32-W=ConvAsmBwdWrW3x3:0,0,8,8,6,1
768-79-85-1x1-1280-79-85-4-0x0-1x1-1x1-0-NCHW-FP32-B=ConvOclDirectFwd1x1:1,256,1,1,0,1,32,4,0
1024-7-7-1x1-464-7-7-1-0x0-1x1-1x1-0-NCHW-FP32-B=ConvAsm1x1U:1,8,1,64,1,4,4,1;ConvOclDirectFwd1x1:1,64,1,1,0,1,4,8,0
384-97-653-1x1-232-97-653-1-0x0-1x1-1x1-0-NCHW-FP32-F=ConvOclDirectFwd1x1:1,64,1,1,0,1,16,8,0
1472-192-483-1x1-1104-192-483-2-0x0-1x1-1x1-0-NCHW-FP32-F=ConvOclDirectFwd1x1:1,64,1,1,1,4,64,2048,0
64-64-128-1x1-512-64-128-1-0x0-1x1-1x1-0-NCHW-FP32-B=ConvOclDirectFwd1x1:1,256,1,1,0,2,16,4,0
128-28-28-3x3-32-28-28-16-1x1-1x1-1x1-0-NCHW-FP32-W=ConvAsmBwdWrW3x3:0,0,8,4,2,4
2048-7-7-1x1-512-7-7-64-0x0-1x1-1x1-0-NCHW-FP32-B=ConvAsm1x1U:4,16,4,16,1,2,2,2;ConvOclDirectFwd1x1:1,64,1,1,0,1,16,4,0
120-14-14-1x1-480-14-14-1-0x0-1x1-1x1-0-NCHW-FP32-B_g3=ConvOclDirectFwd:8,16,8,16,1,1,2,4,1
1152-192-237-1x1-160-192-237-6-0x0-1x1-1x1-0-NCHW-FP32-F=ConvOclDirectFwd1x1:1,64,1,1,1,1,64,2048,0
832-7-7-1x1-256-7-7-2-0x0-1x1-1x1-0-NCHW-FP32-F=ConvAsm1x1U:1,8,1,32,1,4,4,1;ConvOclDirectFwd1x1:1,64,1,1,1,1,16,64,0
192-400-582-1x1-1392-400-582-1-0x0-1x1-1x1-0-NCHW-FP32-B=ConvOclDirectFwd1x1:1,128,1,1,0,4,16,8,0
800-147-62-1x1-320-147-62-12-0x0-1x1-1x1-0-NCHW-FP32-B=ConvOclDirectFwd1x1:1,256,1,1,0,1,32,4,0
512-28-28-1x1-1024-14-14-4-0x0-2x2-1x1-0-NCHW-FP32-F=ConvAsm1x1U:4,16,4,64,1,2,2,1;ConvOclDirectFwd1x1:1,64,1,1,1,0,16,2048,0
672-301-760-1x1-384-301-760-1-0x0-1x1-1x1-0-NCHW-FP32-F=ConvOclDirectFwd1x1:1,64,1,1,1,4,32,2048,0
32-193-189-1x1-3-193-189-2-0x0-1x1-1x1-0-NCHW-FP32-W=ConvAsmBwdWrW1x1:4,4,2,1,2,1,2,4,0,3
1312-235-781-1x1-832-235-781-1-0x0-1x1-1x1-0-NCHW-FP32-F=ConvOclDirectFwd1x1:1,64,1,1,1,1,16,2048,0
160-14-14-3x3-160-14-14-32-1x1-1x1-1x1-0-NCHW-FP16-B=ConvOclDirectFwd:8,16,16,16,2,1,8,1,2
96-32-420-1x1-1104-32-420-1-0x0-1x1-1x1-0-NCHW-FP32-B=ConvOclDirectFwd1x1:1,256,1,1,0,4,16,4,0
192-118-313-1x1-256-118-313-1-0x0-1x1-1x1-0-NCHW-FP32-F=ConvOclDirectFwd1x1:1,64,1,1,1,0,16,256,0
512-161-8-1x1-16-161-8-2-0x0-1x1-1x1-0-NCHW-FP32-W=ConvAsmBwdWrW1x1:4,4,2,1,2,1,1,4,0,1
192-258-109-1x1-832-258-109-2-0x0-1x1-1x1-0-NCHW-FP32-F=ConvOclDirectFwd1x1:1,64,1,1,1,0,16,2048,0
192-17-17-1x1-1024-17-17-64-0x0-1x1-1x1-0-NCHW-FP16-W=ConvAsmBwdWrW1x1:4,4,4,4,4,1,1,2,0,1
1216-50-771-1x1-528-50-771-1-0x0-1x1-1x1-0-NCHW-FP32-F=ConvOclDirectFwd1x1:1,64,1,1,1,1,64,2048,0
768-270-184-1x1-1008-270-184-6-0x0-1x1-1x1-0-NCHW-FP32-B=ConvOclDirectFwd1x1:1,256,1,1,0,4,16,8,0
928-126-115-1x1-432-126-115-6-0x0-1x1-1x1-0-NCHW-FP32-W=ConvAsmBwdWrW1x1:2,8,8,4,4,1,1,4,0,1
528-167-660-1x1-864-167-660-4-0x0-1x1-1x1-0-NCHW-FP32-B=ConvOclDirectFwd1x1:1,256,1,1,0,1,32,4,0
608-344-325-1x1-1760-344-325-1-0x0-1x1-1x1-0-NCHW-FP32-B=ConvOclDirectFwd1x1:1,128,1,1,0,2,32,4,0
448-699-13-1x1-256-699-13-16-0x0-1x1-1x1-0-NCHW-FP32-W=ConvAsmBwdWrW1x1:2,8,4,4,4,1,1,4,0,1
3-224-224-7x7-64-112-112-32-3x3-2x2-1x1-0-NCHW-FP32-F=ConvOclDirectFwd:16,8,16,16,1,2,8,1,2
736-7-7-1x1-128-7-7-256-0x0-1x1-1x1-0-NCHW-FP32-B=ConvAsm1x1U:1,16,1,64,2,2,2,2;ConvOclDirectFwd1x1:1,256,1,1,0,1,16,8,0
256-27-27-1x1-32-27-27-64-0x0-1x1-1x1-0-NCHW-FP16-F=ConvAsm1x1U:1,8,2,64,1,4,2,2;ConvOclDirectFwd1x1:1,64,1,1,0,1,16,8,0
832-86-293-1x1-32-86-293-2-0x0-1x1-1x1-0-NCHW-FP32-B=ConvOclDirectFwd1x1:1,128,1,1,0,2,32,4,0
128-14-14-1x1-864-14-14-64-0x0-1x1-1x1-0-NCHW-FP32-F=ConvAsm1x1U:1,8,1,32,3,4,1,8;ConvOclDirectFwd1x1:1,64,1,1,1,1,32,2048,0
1088-528-28-1x1-992-528-28-1-0x0-1x1-1x1-0-NCHW-FP32-F=ConvOclDirectFwd1x1:1,64,1,1,1,0,64,2048,0
96-186-38-1x1-48-186-38-1-0x0-1x1-1x1-0-NCHW-FP32-B=ConvAsm1x1U:1,8,1,64,1,2,2,2;ConvOclDirectFwd1x1:1,64,1,1,0,4,8,8,0
232-14-14-1x1-232-14-14-4-0x0-1x1-1x1-0-NCHW-FP32-W=ConvAsmBwdWrW1x1:1,16,2,4,2,1,2,4,0,1
54-28-28-1x1-216-28-28-256-0x0-1x1-1x1-0-NCHW-FP32-F_g3=ConvOclDirectFwd:16,16,32,32,2,2,8,2,1
1024-14-14-1x1-512-14-14-128-0x0-1x1-1x1-0-NCHW-FP32-B=ConvAsm1x1U:1,32,1,16,2,1,2,2;ConvOclDirectFwd1x1:1,128,1,1,0,2,32,4,0
16-14-14-1x1-480-14-14-64-0x0-1x1-1x1-0-NCHW-FP16-W=ConvAsmBwdWrW1x1:4,4,4,4,2,1,4,2,0,1
54-354-241-1x1-1872-354-241-1-0x0-1x1-1x1-0-NCHW-FP32-B=ConvOclDirectFwd1x1:1,64,1,1,0,2,16,4,0
528-17-467-1x1-992-17-467-64-0x0-1x1-1x1-0-NCHW-FP32-B=ConvOclDirectFwd1x1:1,256,1,1,0,1,32,4,0
512-28-28-1x1-256-14-14-64-0x0-2x2-1x1-0-NCHW-FP32-F=ConvAsm1x1U:4,16,4,64,1,2,1,2;ConvOclDirectFwd1x1:1,64,1,1,1,1,16,2048,0
192-71-71-3x3-80-73-73-16-0x0-1x1-1x1-0-NCHW-FP16-B=ConvOclDirectFwd:16,8,16,16,1,2,8,1,1
48-353-40-1x1-544-353-40-2-0x0-1x1-1x1-0-NCHW-FP32-F=ConvOclDirectFwd1x1:1,64,1,1,1,4,64,2048,0
54-55-55-1x1-24-55-55-32-0x0-1x1-1x1-0-NCHW-FP32-B=ConvAsm1x1U:4,8,4,64,2,1,1,1;ConvOclDirectFwd1x1:1,128,1,1,0,1,16,4,0
192-128-256-1x1-64-128-256-1-0x0-1x1-1x1-0-NCHW-FP32-F=ConvOclDirectFwd1x1:1,64,1,1,1,1,32,2048,0;ConvOclDirectFwdFused:1,64,1,1,1,1,32,2048,0
960-209-138-1x1-2112-209-138-4-0x0-1x1-1x1-0-NCHW-FP32-B=ConvOclDirectFwd1x1:1,128,1,1,0,2,32,4,0
384-35-35-1x1-192-35-35-8-0x0-1x1-1x1-0-NCHW-FP32-F=ConvAsm1x1U:2,16,2,64,2,2,1,1;ConvOclDirectFwd1x1:1,64,1,1,1,0,32,2048,0;ConvActivAsm1x1U:2,16,2,32,4,1
512-7-7-1x1-2048-7-7-2-0x0-1x1-1x1-0-NCHW-FP16-B=ConvAsm1x1U:1,8,2,32,1,4,4,1;ConvOclDirectFwd1x1:1,256,1,1,0,1,4,4,0
128-28-28-1x1-512-28-28-4-0x0-1x1-1x1-0-NCHW-FP32-B=ConvAsm1x1U:1,8,1,16,1,4,1,4;ConvOclDirectFwd1x1:16,64,32,32,0,2,16,4,1
64-28-28-1x1-256-28-28-4-0x0-1x1-1x1-0-NCHW-FP32-B=ConvAsm1x1U:1,16,1,32,1,2,2,1;ConvOclDirectFwd1x1:1,128,1,1,0,1,8,4,0
2048-8-8-1x1-1024-8-8-48-0x0-1x1-1x1-0-NCHW-FP32-W=ConvAsmBwdWrW1x1:1,16,2,8,8,1,1,4,0,1
54-55-55-1x1-24-55-55-64-0x0-1x1-1x1-0-NCHW-FP32-B=ConvAsm1x1U:3,8,6,64,4,1,1,2;ConvOclDirectFwd1x1:1,256,1,1,0,1,16,4,0
232-162-624-1x1-32-162-624-16-0x0-1x1-1x1-0-NCHW-FP32-B=ConvOclDirectFwd1x1:1,128,1,1,0,1,32,4,0
256-20-866-1x1-144-20-866-48-0x0-1x1-1x1-0-NCHW-FP32-B=ConvOclDirectFwd1x1:1,128,1,1,0,4,16,4,0
80-39-403-1x1-1776-39-403-8-0x0-1x1-1x1-0-NCHW-FP32-B=ConvOclDirectFwd1x1:1,256,1,1,0,1,16,4,0
1-7-7-3x3-1-5-5-32-0x0-1x1-1x1-0-NCHW-FP32-F=ConvOclDirectFwd:8,8,8,8,1,1,1,1,2
1-708-1015-1x1-1-708-1015-64-0x0-1x1-1x1-0-NCHW-FP32-F=ConvAsm1x1U:1,1,1,4,1,1,1,1;ConvOclDirectFwd1x1:1,128,1,1,0,4,8,4,0
160-64-128-1x1-832-64-128-1-0x0-1x1-1x1-0-NCHW-FP16-W=ConvAsmBwdWrW1x1:4,4,2,4,4,1,1,4,0,2
2-204-10-1x1-58-204-10-48-0x0-1x1-1x1-0-NCHW-FP32-B=ConvAsm1x1U:2,1,2,4,1,1,2,1;ConvOclDirectFwd1x1:1,128,1,1,0,2,4,4,0
3-113-419-1x1-3-113-419-2-0x0-1x1-1x1-0-NCHW-FP32-W=ConvAsmBwdWrW1x1:4,4,2,1,2,1,2,4,0,3
1664-557-7-1x1-544-557-7-4-0x0-1x1-1x1-0-NCHW-FP32-F=ConvOclDirectFwd1x1:1,64,1,1,1,4,64,2048,0
128-56-56-1x1-128-56-56-128-0x0-1x1-1x1-0-NCHW-FP16-W=ConvAsmBwdWrW1x1:4,4,8,1,8,1,4,4,0,1
256-15-15-3x3-256-29-29-32-1x1-2x2-1x1-0-NCHW-FP32-B=ConvOclDirectFwd:32,16,32,32,1,2,4,4,2
256-56-56-3x3-128-56-56-64-1x1-1x1-1x1-0-NCHW-FP16-W=ConvAsmBwdWrW3x3:0,0,8,4,1,4
768-791-112-1x1-1888-791-112-2-0x0-1x1-1x1-0-NCHW-FP32-B=ConvOclDirectFwd1x1:1,128,1,1,0,1,32,4,0
128-28-28-3x3-128-56-56-64-1x1-2x2-1x1-0-NCHW-FP32-B=ConvOclDirectFwd:32,16,32,32,1,2,8,2,2
64-14-14-1x1-480-14-14-32-0x0-1x1-1x1-0-NCHW-FP32-B=ConvAsm1x1U:1,16,1,64,2,2,1,2;ConvOclDirectFwd1x1:1,64,1,1,0,4,16,4,0
192-8-8-1x1-2048-8-8-64-0x0-1x1-1x1-0-NCHW-FP32-B=ConvAsm1x1U:1,16,1,64,2,2,1,4;ConvOclDirectFwd1x1:1,128,1,1,0,2,16,4,0
48-35-35-1x1-288-35-35-32-0x0-1x1-1x1-0-NCHW-FP16-B=ConvAsm1x1U:1,16,2,64,1,2,1,2;ConvOclDirectFwd1x1:1,256,1,1,0,1,32,4,0
160-14-14-1x1-512-14-14-128-0x0-1x1-1x1-0-NCHW-FP16-B=ConvAsm1x1U:1,16,2,16,1,2,1,4;ConvOclDirectFwd1x1:1,256,1,1,0,4,16,4,0
160-73-73-1x1-64-73-73-1-0x0-1x1-1x1-0-NCHW-FP16-F=ConvAsm1x1U:1,8,2,64,1,4,4,2;ConvOclDirectFwd1x1:1,64,1,1,0,1,8,4,0
192-35-35-1x1-384-35-35-4-0x0-1x1-1x1-0-NCHW-FP32-W=ConvAsmBwdWrW1x1:1,16,2,8,2,1,1,4,0,2
80-701-370-1x1-96-701-370-6-0x0-1x1-1x1-0-NCHW-FP32-F=ConvOclDirectFwd1x1:16,16,32,32,1,0,32,128,1
384-665-796-1x1-416-665-796-1-0x0-1x1-1x1-0-NCHW-FP32-F=ConvOclDirectFwd1x1:1,64,1,1,1,4,64,2048,0
256-56-56-1x1-64-56-56-64-0x0-1x1-1x1-0-NCHW-FP32-W=ConvAsmBwdWrW1x1:4,4,4,2,2,1,1,4,0,1
192-14-14-1x1-672-14-14-16-0x0-1x1-1x1-0-NCHW-FP32-B=ConvAsm1x1U:1,16,1,32,3,2,2,2;ConvOclDirectFwd1x1:1,128,1,1,0,2,16,4,0
192-7-7-1x1-1392-7-7-16-0x0-1x1-1x1-0-NCHW-FP32-B=ConvAsm1x1U:1,16,1,64,2,1,4,1;ConvOclDirectFwd1x1:1,256,1,1,0,1,8,4,0
896-7-7-1x1-128-7-7-128-0x0-1x1-1x1-0-NCHW-FP32-W=ConvAsmBwdWrW1x1:2,8,4,8,2,1,2,4,0,1
32-147-147-3x3-64-147-147-8-1x1-1x1-1x1-0-NCHW-FP16-F=ConvOclDirectFwd:16,16,32,32,2,2,8,4,2;ConvOclDirectFwdFused:16,16,32,32,2,2,8,4,2
288-40-645-1x1-8-40-645-4-0x0-1x1-1x1-0-NCHW-FP32-F=ConvOclDirectFwd1x1:1,256,1,1,0,4,16,4,0
8-686-64-1x1-64-686-64-16-0x0-1x1-1x1-0-NCHW-FP32-F=ConvAsm1x1U:1,32,1,16,1,1,1,1;ConvOclDirectFwd1x1:1,64,1,1,0,1,32,4,0
928-14-14-1x1-128-14-14-256-0x0-1x1-1x1-0-NCHW-FP32-B=ConvAsm1x1U:1,32,1,16,2,1,2,2;ConvOclDirectFwd1x1:1,256,1,1,0,1,32,4,0
512-7-7-1x1-512-7-7-1-0x0-1x1-1x1-0-NCHW-FP16-F=ConvAsm1x1U:1,8,2,16,1,4,4,1;ConvOclDirectFwd1x1:1,128,1,1,0,1,4,8,0
8-97-162-1x1-704-97-162-2-0x0-1x1-1x1-0-NCHW-FP32-B=ConvOclDirectFwd1x1:1,256,1,1,0,1,4,8,0
32-28-28-3x3-128-28-28-256-1x1-1x1-1x1-0-NCHW-FP16-B=ConvOclDirectFwd:16,16,32,32,2,2,8,1,2
64-35-35-5x5-48-35-35-512-2x2-1x1-1x1-0-NCHW-FP16-W=ConvOclBwdWrW2<1>:1,6,1,8,5;ConvOclBwdWrW2<2>:1,6,1,8,5;ConvOclBwdWrW2<4>:1,9,1,8,7;ConvOclBwdWrW2<8>:1,6,1,8,5;ConvOclBwdWrW2<16>:1,9,1,8,7
8-552-338-1x1-8-552-338-128-0x0-1x1-1x1-0-NCHW-FP32-F=ConvAsm1x1U:1,8,1,16,1,1,1,1;ConvOclDirectFwd1x1:1,256,1,1,0,4,16,8,0
32-38-166-5x10-32-79-341-1-0x0-2x2-1x1-0-NCHW-FP32-B=ConvOclDirectFwd:8,8,16,32,2,4,4,4,1
16-296-913-1x1-160-296-913-4-0x0-1x1-1x1-0-NCHW-FP32-F=ConvOclDirectFwd1x1:1,64,1,1,1,4,64,256,0
224-344-796-1x1-2-344-796-2-0x0-1x1-1x1-0-NCHW-FP32-F=ConvOclDirectFwd1x1:1,256,1,1,0,4,16,4,0
192-7-7-1x1-1680-7-7-16-0x0-1x1-1x1-0-NCHW-FP16-B=ConvAsm1x1U:1,16,2,32,1,2,2,2;ConvOclDirectFwd1x1:1,128,1,1,0,1,8,4,0
112-14-14-3x3-224-14-14-128-1x1-1x1-1x1-0-NCHW-FP16-F=ConvOclDirectFwd:8,8,16,16,2,2,8,1,2;ConvOclDirectFwdFused:8,8,16,16,2,2,8,1,2
96-19-778-1x1-352-19-778-64-0x0-1x1-1x1-0-NCHW-FP32-W=ConvAsmBwdWrW1x1:2,8,2,8,2,1,1,4,0,1
128-56-56-1x1-192-56-56-256-0x0-1x1-1x1-0-NCHW-FP16-B=ConvAsm1x1U:1,16,2,32,1,2,1,4;ConvOclDirectFwd1x1:1,128,1,1,0,4,16,4,0
256-14-14-1x1-128-28-28-128-0x0-2x2-1x1-0-NCHW-FP32-B=ConvAsm1x1U:1,32,1,32,2,1,2,2;ConvOclDirectFwd1x1:1,64,1,1,0,1,32,4,0
2048-7-7-1x1-1024-7-7-128-0x0-1x1-1x1-0-NCHW-FP32-B=ConvAsm1x1U:1,16,1,64,4,2,2,2;ConvOclDirectFwd1x1:1,256,1,1,0,1,32,4,0
192-71-71-3x3-80-73-73-256-0x0-1x1-1x1-0-NCHW-FP32-B=ConvOclDirectFwd:8,8,16,16,2,2,8,1,1
704-14-14-1x1-128-14-14-32-0x0-1x1-1x1-0-NCHW-FP16-B=ConvAsm1x1U:1,16,2,64,1,2,4,2;ConvOclDirectFwd1x1:1,64,1,1,0,2,32,8,0
4-715-41-1x1-1000-715-41-8-0x0-1x1-1x1-0-NCHW-FP32-F=ConvOclDirectFwd1x1:1,256,1,1,0,1,16,4,0
1024-695-29-1x1-512-695-29-16-0x0-1x1-1x1-0-NCHW-FP32-F=ConvOclDirectFwd1x1:1,64,1,1,1,4,32,2048,0
672-40-514-1x1-48-40-514-4-0x0-1x1-1x1-0-NCHW-FP32-W=ConvAsmBwdWrW1x1:4,4,4,2,4,1,1,4,0,1
576-422-586-1x1-232-422-586-1-0x0-1x1-1x1-0-NCHW-FP32-F=ConvOclDirectFwd1x1:1,256,1,1,0,2,16,4,0
1024-7-7-1x1-464-7-7-1024-0x0-1x1-1x1-0-NCHW-FP16-B=ConvAsm1x1U:1,16,2,32,1,2,1,1;ConvOclDirectFwd1x1:1,256,1,1,0,1,16,4,0
1600-395-397-1x1-16-395-397-2-0x0-1x1-1x1-0-NCHW-FP32-F=ConvOclDirectFwd1x1:1,64,1,1,1,1,32,2048,0
320-14-14-1x1-128-14-14-64-0x0-1x1-1x1-0-NCHW-FP32-F=ConvAsm1x1U:1,16,1,64,2,2,1,1;ConvOclDirectFwd1x1:1,64,1,1,1,4,32,2048,0
192-28-28-3x3-128-28-28-256-1x1-1x1-1x1-0-NCHW-FP16-B=ConvOclDirectFwd:32,8,32,32,1,4,8,2,1
192-537-5-1x1-224-537-5-2-0x0-1x1-1x1-0-NCHW-FP32-W=ConvAsmBwdWrW1x1:4,4,4,4,4,1,2,4,0,0
128-14-14-1x1-448-14-14-16-0x0-1x1-1x1-0-NCHW-FP16-W=ConvAsmBwdWrW1x1:4,4,4,4,4,1,2,2,0,1
1024-14-14-1x1-1024-14-14-256-0x0-1x1-1x1-0-NCHW-FP32-W=ConvAsmBwdWrW1x1:1,16,4,8,4,1,1,4,0,1
1600-44-543-1x1-640-44-543-2-0x0-1x1-1x1-0-NCHW-FP32-F=ConvOclDirectFwd1x1:1,64,1,1,1,0,16,2048,0
24-55-55-1x1-54-55-55-32-0x0-1x1-1x1-0-NCHW-FP16-F=ConvAsm1x1U:1,8,2,64,1,4,1,1;ConvOclDirectFwd1x1:1,256,1,1,0,1,8,8,0
864-7-7-1x1-128-7-7-128-0x0-1x1-1x1-0-NCHW-FP16-B=ConvAsm1x1U:1,16,2,32,1,2,4,1;ConvOclDirectFwd1x1:1,64,1,1,0,1,8,4,0
1376-31-176-1x1-24-31-176-1-0x0-1x1-1x1-0-NCHW-FP32-F=ConvOclDirectFwd1x1:1,256,1,1,0,1,4,4,0
912-584-339-1x1-448-584-339-2-0x0-1x1-1x1-0-NCHW-FP32-F=ConvOclDirectFwd1x1:1,64,1,1,1,4,32,2048,0
4-712-405-1x1-8-712-405-1-0x0-1x1-1x1-0-NCHW-FP32-B=ConvAsm1x1U:1,8,3,64,1,2,1,1;ConvOclDirectFwd1x1:1,256,1,1,0,1,8,4,0
512-14-14-1x1-144-14-14-512-0x0-1x1-1x1-0-NCHW-FP32-F=ConvAsm1x1U:4,8,7,32,2,2,1,2;ConvOclDirectFwd1x1:1,64,1,1,1,1,16,2048,0;ConvActivAsm1x1U:3,16,7,32,1,1
128-14-14-1x1-352-14-14-128-0x0-1x1-1x1-0-NCHW-FP16-W=ConvAsmBwdWrW1x1:2,8,2,8,2,1,4,4,0,2
544-246-230-1x1-448-246-230-4-0x0-1x1-1x1-0-NCHW-FP32-F=ConvOclDirectFwd1x1:1,64,1,1,1,0,32,2048,0
64-56-56-1x1-256-56-56-48-0x0-1x1-1x1-0-NCHW-FP32-F=ConvAsm1x1U:1,8,1,64,1,4,1,4;ConvOclDirectFwd1x1:16,16,32,32,1,0,32,128,1
1280-6-643-1x1-1968-6-643-6-0x0-1x1-1x1-0-NCHW-FP32-W=ConvAsmBwdWrW1x1:2,8,4,8,4,1,1,4,0,0
192-27-27-1x1-48-27-27-256-0x0-1x1-1x1-0-NCHW-FP16-B=ConvAsm1x1U:1,16,2,32,1,2,1,1;ConvOclDirectFwd1x1:1,64,1,1,0,1,16,4,0
128-14-14-1x1-384-14-14-32-0x0-1x1-1x1-0-NCHW-FP32-F=ConvAsm1x1U:2,16,2,64,2,2,2,2;ConvOclDirectFwd1x1:1,64,1,1,1,4,16,256,0
1664-1-452-1x1-352-1-452-128-0x0-1x1-1x1-0-NCHW-FP32-F=ConvAsm1x1U:3,16,6,16,2,1,1,1;ConvOclDirectFwd1x1:1,64,1,1,1,1,64,2048,0
544-557-7-1x1-1664-557-7-4-0x0-1x1-1x1-0-NCHW-FP32-B=ConvOclDirectFwd1x1:1,256,1,1,0,1,32,4,0
32-54-54-3x3-128-54-54-512-1x1-1x1-1x1-0-NCHW-FP16-B=ConvOclDirectFwd:8,16,16,32,2,2,8,1,1
480-28-28-1x1-192-28-28-16-0x0-1x1-1x1-0-NCHW-FP32-F=ConvAsm1x1U:4,16,5,32,1,2,1,1;ConvOclDirectFwd1x1:1,64,1,1,1,1,16,2048,0;ConvActivAsm1x1U:4,16,5,32,1,1
736-534-15-1x1-736-534-15-4-0x0-1x1-1x1-0-NCHW-FP32-F=ConvOclDirectFwd1x1:1,64,1,1,1,4,64,2048,0
448-8-8-1x1-1280-8-8-512-0x0-1x1-1x1-0-NCHW-FP16-W=ConvAsmBwdWrW1x1:1,16,2,8,2,1,1,4,0,1
128-14-14-1x1-448-14-14-256-0x0-1x1-1x1-0-NCHW-FP16-B=ConvAsm1x1U:1,16,2,16,1,2,1,2;ConvOclDirectFwd1x1:1,256,1,1,0,2,32,4,0
1792-13-755-1x1-2-13-755-1-0x0-1x1-1x1-0-NCHW-FP32-F=ConvOclDirectFwd1x1:1,256,1,1,0,1,8,8,0
64-839-317-1x1-384-839-317-2-0x0-1x1-1x1-0-NCHW-FP32-F=ConvOclDirectFwd1x1:16,16,32,32,1,0,32,128,1
1008-639-196-1x1-144-639-196-1-0x0-1x1-1x1-0-NCHW-FP32-F=ConvOclDirectFwd1x1:1,64,1,1,1,1,32,2048,0
128-28-28-1x1-288-28-28-128-0x0-1x1-1x1-0-NCHW-FP32-F=ConvAsm1x1U:1,16,1,64,4,2,2,2;ConvOclDirectFwd1x1:1,64,1,1,1,1,64,128,0
640-219-744-1x1-800-219-744-4-0x0-1x1-1x1-0-NCHW-FP32-F=ConvOclDirectFwd1x1:1,64,1,1,1,0,64,2048,0
704-60-629-1x1-80-60-629-6-0x0-1x1-1x1-0-NCHW-FP32-F=ConvOclDirectFwd1x1:1,64,1,1,1,1,32,2048,0
448-28-28-1x1-128-28-28-16-0x0-1x1-1x1-0-NCHW-FP32-F=ConvAsm1x1U:2,16,2,16,2,2,1,1;ConvOclDirectFwd1x1:1,64,1,1,1,0,16,2048,0
80-474-20-1x1-928-474-20-4-0x0-1x1-1x1-0-NCHW-FP32-W=ConvAsmBwdWrW1x1:4,4,8,4,4,1,1,4,0,1
512-210-59-1x1-1312-210-59-12-0x0-1x1-1x1-0-NCHW-FP32-W=ConvAsmBwdWrW1x1:1,16,4,8,4,1,1,4,0,1
24-16-122-1x1-116-16-122-2-0x0-1x1-1x1-0-NCHW-FP32-W=ConvAsmBwdWrW1x1:4,4,2,1,2,1,2,4,0,1
512-29-29-1x1-512-29-29-64-0x0-1x1-1x1-0-NCHW-FP32-W=ConvAsmBwdWrW1x1:2,8,4,8,4,1,1,4,0,2
256-14-14-3x3-256-7-7-256-1x1-2x2-1x1-0-NCHW-FP32-F=ConvOclDirectFwd:8,8,8,8,1,1,8,2,2
512-14-14-3x3-512-28-28-16-1x1-2x2-1x1-0-NCHW-FP32-B_g32=ConvOclDirectFwd:8,8,32,32,4,4,4,4,1
1056-496-87-1x1-464-496-87-8-0x0-1x1-1x1-0-NCHW-FP32-B=ConvOclDirectFwd1x1:1,256,1,1,0,2,16,4,0
288-441-136-1x1-2-441-136-6-0x0-1x1-1x1-0-NCHW-FP32-F=ConvOclDirectFwd1x1:1,256,1,1,0,4,16,4,0
24-896-53-1x1-608-896-53-4-0x0-1x1-1x1-0-NCHW-FP32-B=ConvOclDirectFwd1x1:1,256,1,1,0,2,32,4,0
1000-45-19-1x1-2048-45-19-256-0x0-1x1-1x1-0-NCHW-FP32-B=ConvAsm1x1U:3,32,3,16,1,1,1,4;ConvOclDirectFwd1x1:1,256,1,1,0,1,32,4,0
912-27-242-1x1-960-27-242-32-0x0-1x1-1x1-0-NCHW-FP32-F=ConvOclDirectFwd1x1:1,64,1,1,1,0,16,2048,0
54-261-860-1x1-384-261-860-6-0x0-1x1-1x1-0-NCHW-FP32-B=ConvOclDirectFwd1x1:1,64,1,1,0,2,32,4,0
96-54-54-1x1-16-54-54-64-0x0-1x1-1x1-0-NCHW-FP32-B=ConvAsm1x1U:1,16,3,64,4,1,1,1;ConvOclDirectFwd1x1:1,128,1,1,0,2,16,4,0
1000-337-132-1x1-768-337-132-1-0x0-1x1-1x1-0-NCHW-FP32-F=ConvOclDirectFwd1x1:1,64,1,1,0,2,32,4,0
384-916-157-1x1-24-916-157-4-0x0-1x1-1x1-0-NCHW-FP32-B=ConvOclDirectFwd1x1:1,256,1,1,0,4,16,4,0
3-890-275-1x1-800-890-275-1-0x0-1x1-1x1-0-NCHW-FP32-F=ConvOclDirectFwd1x1:1,256,1,1,0,2,16,4,0
512-28-28-3x3-512-28-28-4-1x1-1x1-1x1-0-NCHW-FP16-B=ConvOclDirectFwd:16,16,32,32,2,2,8,2,1
3-664-94-1x1-576-664-94-6-0x0-1x1-1x1-0-NCHW-FP32-B=ConvOclDirectFwd1x1:1,256,1,1,0,4,16,4,0
96-71-71-3x3-64-73-73-8-0x0-1x1-1x1-0-NCHW-FP16-B=ConvOclDirectFwd:16,8,16,16,1,2,8,1,2
256-28-28-3x3-256-56-56-256-1x1-2x2-1x1-0-NCHW-FP32-W_g32=ConvOclBwdWrW2<2>:1,7,1,1,3;ConvOclBwdWrW2<8>:1,7,8,1,3;ConvAsmBwdWrW3x3:0,0,8,1,1,1;ConvOclBwdWrW2<1>:1,7,1,1,3;ConvOclBwdWrW2<16>:1,7,3,1,5;ConvOclBwdWrW2<4>:1,7,3,1,5
640-7-7-1x1-128-7-7-16-0x0-1x1-1x1-0-NCHW-FP16-W=ConvAsmBwdWrW1x1:2,8,4,4,2,2,2,4,0,0
1000-59-858-1x1-1872-59-858-1-0x0-1x1-1x1-0-NCHW-FP32-B=ConvOclDirectFwd1x1:16,64,32,32,0,2,16,4,1
96-11-508-1x1-896-11-508-2-0x0-1x1-1x1-0-NCHW-FP32-W=ConvAsmBwdWrW1x1:4,4,8,4,4,1,1,4,0,1
1408-374-36-1x1-1104-374-36-6-0x0-1x1-1x1-0-NCHW-FP32-F=ConvOclDirectFwd1x1:1,64,1,1,1,0,32,2048,0
112-161-156-1x1-96-161-156-2-0x0-1x1-1x1-0-NCHW-FP32-W=ConvAsmBwdWrW1x1:4,4,4,4,4,1,2,4,0,2
32-54-54-1x1-128-54-54-512-0x0-1x1-1x1-0-NCHW-FP32-F=ConvAsm1x1U:1,8,1,64,2,4,2,4;ConvOclDirectFwd1x1:1,64,1,1,1,4,64,2048,0
1584-80-288-1x1-672-80-288-2-0x0-1x1-1x1-0-NCHW-FP32-F=ConvOclDirectFwd1x1:1,64,1,1,1,4,64,2048,0
64-54-54-3x3-16-54-54-256-1x1-1x1-1x1-0-NCHW-FP32-W=ConvAsmBwdWrW3x3:0,0,16,4,3,8
48-35-35-1x1-256-35-35-8-0x0-1x1-1x1-0-NCHW-FP32-W=ConvAsmBwdWrW1x1:4,4,2,4,2,1,1,4,0,2
1000-99-742-1x1-96-99-742-4-0x0-1x1-1x1-0-NCHW-FP32-B=ConvOclDirectFwd1x1:1,128,1,1,0,1,32,4,0
864-592-48-1x1-1824-592-48-4-0x0-1x1-1x1-0-NCHW-FP32-B=ConvOclDirectFwd1x1:1,128,1,1,0,2,32,4,0
128-14-14-1x1-320-14-14-512-0x0-1x1-1x1-0-NCHW-FP16-W=ConvAsmBwdWrW1x1:2,8,2,8,2,1,4,4,0,1
768-17-17-1x1-160-17-17-512-0x0-1x1-1x1-0-NCHW-FP16-F=ConvAsm1x1U:2,16,4,16,1,2,2,1;ConvOclDirectFwd1x1:16,64,32,32,0,1,16,4,1
512-14-14-1x1-160-14-14-512-0x0-1x1-1x1-0-NCHW-FP32-F=ConvAsm1x1U:4,8,4,64,2,2,1,4;ConvOclDirectFwd1x1:1,64,1,1,1,1,32,2048,0;ConvActivAsm1x1U:2,16,4,32,3,2
116-14-14-1x1-116-14-14-2-0x0-1x1-1x1-0-NCHW-FP16-F=ConvAsm1x1U:1,8,2,16,1,2,2,1;ConvOclDirectFwd1x1:1,256,1,1,0,4,16,4,0
256-29-29-3x3-256-57-57-1-1x1-2x2-1x1-0-NCHW-FP32-B_g32=ConvOclDirectFwd:32,32,32,32,1,1,4,2,1
1024-7-7-1x1-192-7-7-64-0x0-1x1-1x1-0-NCHW-FP16-F=ConvAsm1x1U:2,8,4,16,1,4,4,2;ConvOclDirectFwd1x1:1,128,1,1,0,1,8,8,0
80-349-676-1x1-448-349-676-4-0x0-1x1-1x1-0-NCHW-FP32-F=ConvOclDirectFwd1x1:16,16,32,32,1,0,32,128,1
512-649-494-1x1-704-649-494-2-0x0-1x1-1x1-0-NCHW-FP32-B=ConvOclDirectFwd1x1:1,256,1,1,0,1,32,4,0
512-28-28-1x1-512-28-28-128-0x0-1x1-1x1-0-NCHW-FP32-B=ConvAsm1x1U:1,32,3,16,1,1,1,1;ConvOclDirectFwd1x1:1,128,1,1,0,2,32,4,0
64-112-112-7x7-3-230-230-32-0x0-2x2-1x1-0-NCHW-FP32-B=ConvOclDirectFwd:16,16,32,32,2,2,8,2,1
512-14-14-1x1-2048-14-14-64-0x0-1x1-1x1-0-NCHW-FP32-W=ConvAsmBwdWrW1x1:1,16,2,8,8,1,1,4,0,1
1824-194-56-1x1-528-194-56-6-0x0-1x1-1x1-0-NCHW-FP32-F=ConvOclDirectFwd1x1:1,64,1,1,1,1,64,2048,0
64-54-54-1x1-16-54-54-32-0x0-1x1-1x1-0-NCHW-FP32-F=ConvAsm1x1U:2,8,2,64,3,1,1,1;ConvOclDirectFwd1x1:1,64,1,1,1,4,32,256,0
1888-577-28-1x1-384-577-28-12-0x0-1x1-1x1-0-NCHW-FP32-F=ConvOclDirectFwd1x1:1,64,1,1,1,4,16,256,0
4-930-812-1x1-4-930-812-2-0x0-1x1-1x1-0-NCHW-FP32-F=ConvAsm1x1U:1,4,2,4,1,1,1,1;ConvOclDirectFwd1x1:1,256,1,1,0,1,4,4,0
384-616-500-1x1-384-616-500-2-0x0-1x1-1x1-0-NCHW-FP32-F=ConvOclDirectFwd1x1:1,64,1,1,1,1,32,2048,0
1824-7-7-1x1-192-7-7-16-0x0-1x1-1x1-0-NCHW-FP32-F=ConvAsm1x1U:4,8,4,16,1,4,4,2;ConvOclDirectFwd1x1:1,64,1,1,1,4,16,256,0;ConvActivAsm1x1U:4,16,4,16,1,4
256-14-14-1x1-512-28-28-16-0x0-2x2-1x1-0-NCHW-FP32-W=ConvAsmBwdWrW1x1:1,16,2,8,2,1,1,4,0,2
448-17-72-1x1-1104-17-72-8-0x0-1x1-1x1-0-NCHW-FP32-B=ConvAsm1x1U:4,16,4,64,1,2,2,1;ConvOclDirectFwd1x1:1,256,1,1,0,4,16,4,0
384-215-185-1x1-416-215-185-4-0x0-1x1-1x1-0-NCHW-FP32-W=ConvAsmBwdWrW1x1:4,4,8,4,4,1,1,4,0,1
256-14-14-1x1-1024-14-14-16-0x0-1x1-1x1-0-NCHW-FP32-B=ConvAsm1x1U:1,32,1,16,2,1,2,2;ConvOclDirectFwd1x1:1,128,1,1,0,4,16,4,0
64-14-14-1x1-512-14-14-512-0x0-1x1-1x1-0-NCHW-FP16-B=ConvAsm1x1U:1,16,2,16,1,2,1,4;ConvOclDirectFwd1x1:1,256,1,1,0,2,32,4,0
80-202-48-1x1-896-202-48-16-0x0-1x1-1x1-0-NCHW-FP32-W=ConvAsmBwdWrW1x1:2,8,4,4,4,1,1,4,0,1
64-330-1-1x1-768-330-1-6-0x0-1x1-1x1-0-NCHW-FP32-F=ConvAsm1x1U:1,8,1,64,2,4,2,2;ConvOclDirectFwd1x1:1,64,1,1,1,1,16,2048,0
512-29-29-1x1-256-57-57-32-0x0-2x2-1x1-0-NCHW-FP32-B=ConvAsm1x1U:4,32,7,64,1,1,1,4;ConvOclDirectFwd1x1:1,128,1,1,0,1,32,4,0
128-14-14-1x1-544-14-14-256-0x0-1x1-1x1-0-NCHW-FP16-F=ConvAsm1x1U:1,16,2,16,2,2,1,2;ConvOclDirectFwd1x1:1,256,1,1,0,2,16,4,0
4-129-711-1x1-1024-129-711-1-0x0-1x1-1x1-0-NCHW-FP32-B=ConvOclDirectFwd1x1:1,256,1,1,0,1,4,4,0
512-7-7-1x1-2048-7-7-1-0x0-1x1-1x1-0-NCHW-FP32-F=ConvAsm1x1U:1,8,1,64,1,4,4,1;ConvOclDirectFwd1x1:1,64,1,1,1,4,16,64,0;ConvActivAsm1x1U:1,16,1,64,1,2
448-590-244-1x1-480-590-244-6-0x0-1x1-1x1-0-NCHW-FP32-B=ConvOclDirectFwd1x1:1,128,1,1,0,1,32,4,0
96-362-61-1x1-48-362-61-2-0x0-1x1-1x1-0-NCHW-FP32-B=ConvAsm1x1U:3,16,3,64,1,2,1,1;ConvOclDirectFwd1x1:1,64,1,1,0,1,16,4,0
32-149-149-3x3-3-299-299-1-0x0-2x2-1x1-0-NCHW-FP16-B=ConvOclDirectFwd:16,16,32,32,2,2,2,4,1
4-655-736-1x1-24-655-736-16-0x0-1x1-1x1-0-NCHW-FP32-B=ConvOclDirectFwd1x1:1,256,1,1,0,4,16,4,0
1024-4-4-1x1-2048-7-7-16-0x0-2x2-1x1-0-NCHW-FP32-B=ConvAsm1x1U:1,8,1,16,1,4,1,8;ConvOclDirectFwd1x1:1,128,1,1,0,1,16,4,0
64-56-56-1x1-256-56-56-32-0x0-1x1-1x1-0-NCHW-FP16-W=ConvAsmBwdWrW1x1:4,4,8,1,8,1,4,4,0,1
512-981-165-1x1-112-981-165-1-0x0-1x1-1x1-0-NCHW-FP32-F=ConvOclDirectFwd1x1:1,64,1,1,1,4,32,2048,0
256-27-27-1x1-32-27-27-256-0x0-1x1-1x1-0-NCHW-FP16-B=ConvAsm1x1U:1,16,2,64,1,2,2,2;ConvOclDirectFwd1x1:1,64,1,1,0,1,32,4,0
232-760-322-1x1-116-760-322-2-0x0-1x1-1x1-0-NCHW-FP32-B=ConvOclDirectFwd1x1:1,256,1,1,0,2,16,4,0
192-56-56-3x3-64-56-56-1-1x1-1x1-1x1-0-NCHW-FP16-B=ConvOclDirectFwd:16,16,16,16,1,1,4,4,1
256-7-7-1x1-832-7-7-1-0x0-1x1-1x1-0-NCHW-FP32-W=ConvAsmBwdWrW1x1:1,16,2,4,2,1,1,4,0,1
512-28-28-1x1-128-28-28-512-0x0-1x1-1x1-0-NCHW-FP16-B=ConvAsm1x1U:1,16,2,16,1,2,1,4;ConvOclDirectFwd1x1:1,128,1,1,0,4,16,4,0
16-656-891-1x1-480-656-891-1-0x0-1x1-1x1-0-NCHW-FP32-B=ConvOclDirectFwd1x1:1,256,1,1,0,2,32,4,0
864-81-867-1x1-336-81-867-2-0x0-1x1-1x1-0-NCHW-FP32-B=ConvOclDirectFwd1x1:1,256,1,1,0,1,16,4,0
512-10-42-3x3-512-10-42-2-1x1-1x1-1x1-0-NCHW-FP16-B=ConvOclDirectFwd:16,16,16,32,1,2,8,2,1
672-20-658-1x1-704-20-658-8-0x0-1x1-1x1-0-NCHW-FP32-B=ConvOclDirectFwd1x1:1,256,1,1,0,4,16,8,0
128-27-27-3x3-32-27-27-128-1x1-1x1-1x1-0-NCHW-FP16-F=ConvOclDirectFwd:16,16,32,32,2,2,8,1,2
704-238-682-1x1-320-238-682-4-0x0-1x1-1x1-0-NCHW-FP32-F=ConvOclDirectFwd1x1:1,64,1,1,1,0,32,2048,0
576-14-14-1x1-160-14-14-32-0x0-1x1-1x1-0-NCHW-FP32-F=ConvAsm1x1U:4,16,5,16,1,2,2,1;ConvOclDirectFwd1x1:1,64,1,1,1,4,16,2048,0;ConvActivAsm1x1U:3,16,5,16,1,2
256-13-228-1x1-160-13-228-1-0x0-1x1-1x1-0-NCHW-FP32-W=ConvAsmBwdWrW1x1:2,8,2,8,2,1,1,2,0,3
832-7-7-5x5-128-7-7-2-2x2-1x1-1x1-0-NCHW-FP32-F=ConvOclDirectFwd:8,8,8,8,1,1,1,4,2
256-14-14-1x1-256-14-14-16-0x0-1x1-1x1-0-NCHW-FP32-B=ConvAsm1x1U:1,16,1,32,1,1,2,2;ConvOclDirectFwd1x1:1,128,1,1,0,2,16,4,0
1488-571-65-1x1-928-571-65-1-0x0-1x1-1x1-0-NCHW-FP32-F=ConvOclDirectFwd1x1:1,64,1,1,1,1,64,2048,0
352-28-28-1x1-128-28-28-64-0x0-1x1-1x1-0-NCHW-FP32-B=ConvAsm1x1U:1,32,1,32,1,1,1,2;ConvOclDirectFwd1x1:1,256,1,1,0,4,16,4,0
288-14-14-3x3-144-14-14-4-1x1-1x1-1x1-0-NCHW-FP16-W=ConvAsmBwdWrW3x3:0,0,8,2,3,1
1296-315-504-1x1-352-315-504-1-0x0-1x1-1x1-0-NCHW-FP32-F=ConvOclDirectFwd1x1:1,64,1,1,1,4,64,2048,0
512-9-41-5x5-256-20-84-4-1x1-2x2-1x1-0-NCHW-FP32-B=ConvOclDirectFwd:8,32,32,32,4,1,4,2,2
232-677-466-1x1-48-677-466-1-0x0-1x1-1x1-0-NCHW-FP32-F=ConvOclDirectFwd1x1:1,256,1,1,0,1,16,4,0
1024-509-718-1x1-240-509-718-1-0x0-1x1-1x1-0-NCHW-FP32-B=ConvOclDirectFwd1x1:1,64,1,1,0,2,16,4,0
232-700-58-1x1-116-700-58-48-0x0-1x1-1x1-0-NCHW-FP32-F=ConvOclDirectFwd1x1:1,128,1,1,0,1,16,4,0
58-56-56-1x1-24-56-56-2-0x0-1x1-1x1-0-NCHW-FP32-B=ConvAsm1x1U:1,8,1,16,1,1,1,1;ConvOclDirectFwd1x1:1,128,1,1,0,1,16,4,0
64-147-147-3x3-32-147-147-32-1x1-1x1-1x1-0-NCHW-FP16-W=ConvAsmBwdWrW3x3:0,0,16,4,2,4
192-35-35-1x1-384-35-35-256-0x0-1x1-1x1-0-NCHW-FP32-B=ConvAsm1x1U:1,16,1,64,2,2,1,4;ConvOclDirectFwd1x1:1,256,1,1,0,1,32,4,0
160-369-832-1x1-736-369-832-2-0x0-1x1-1x1-0-NCHW-FP32-B=ConvOclDirectFwd1x1:1,128,1,1,0,2,32,4,0
64-56-56-1x1-256-56-56-4-0x0-1x1-1x1-0-NCHW-FP32-F=ConvAsm1x1U:1,16,1,64,2,2,1,4;ConvOclDirectFwd1x1:1,64,1,1,1,0,16,256,0;ConvActivAsm1x1U:1,16,1,64,4,2
128-7-7-1x1-896-7-7-16-0x0-1x1-1x1-0-NCHW-FP16-F=ConvAsm1x1U:1,8,2,32,1,4,2,1;ConvOclDirectFwd1x1:1,64,1,1,0,1,16,4,0
64-208-208-3x3-32-208-208-128-1x1-1x1-1x1-0-NCHW-FP32-W=ConvAsmBwdWrW3x3:0,1,16,4,2,4
640-50-655-1x1-1152-50-655-6-0x0-1x1-1x1-0-NCHW-FP32-B=ConvOclDirectFwd1x1:1,128,1,1,0,2,32,4,0
128-54-54-1x1-16-54-54-256-0x0-1x1-1x1-0-NCHW-FP16-F=ConvAsm1x1U:2,8,6,64,2,2,1,1;ConvOclDirectFwd1x1:1,256,1,1,0,2,16,4,0
3-6-6-3x3-4-2-2-128-0x0-2x2-1x1-0-NCHW-FP32-F=ConvOclDirectFwd:8,8,8,8,1,1,2,2,2
992-14-14-1x1-128-14-14-64-0x0-1x1-1x1-0-NCHW-FP16-F=ConvAsm1x1U:2,8,4,64,1,4,2,4;ConvOclDirectFwd1x1:1,64,1,1,0,4,16,4,0
128-7-7-1x1-832-7-7-256-0x0-1x1-1x1-0-NCHW-FP16-F=ConvAsm1x1U:2,8,4,16,1,4,1,8;ConvOclDirectFwd1x1:8,64,8,8,0,1,16,4,1
544-823-179-1x1-352-823-179-2-0x0-1x1-1x1-0-NCHW-FP32-F=ConvOclDirectFwd1x1:1,64,1,1,1,4,64,2048,0
128-28-28-1x1-320-28-28-16-0x0-1x1-1x1-0-NCHW-FP16-W=ConvAsmBwdWrW1x1:4,4,4,4,2,1,4,4,0,1
64-401-96-1x1-1920-401-96-1-0x0-1x1-1x1-0-NCHW-FP32-B=ConvOclDirectFwd1x1:1,128,1,1,0,2,32,4,0
288-35-35-1x1-64-35-35-4-0x0-1x1-1x1-0-NCHW-FP16-F=ConvAsm1x1U:1,8,2,64,1,4,4,1;ConvOclDirectFwd1x1:1,128,1,1,0,1,8,8,0
64-83-580-1x1-1152-83-580-8-0x0-1x1-1x1-0-NCHW-FP32-B=ConvOclDirectFwd1x1:1,128,1,1,0,2,32,4,0
256-28-28-1x1-32-28-28-256-0x0-1x1-1x1-0-NCHW-FP32-W=ConvAsmBwdWrW1x1:4,4,4,4,4,1,4,4,0,1
704-4-359-1x1-1504-4-359-48-0x0-1x1-1x1-0-NCHW-FP32-B=ConvAsm1x1U:3,16,3,64,1,2,1,4;ConvOclDirectFwd1x1:1,256,1,1,0,2,32,4,0
64-56-56-1x1-256-28-28-4-0x0-2x2-1x1-0-NCHW-FP32-F=ConvAsm1x1U:1,8,1,16,1,4,2,2;ConvOclDirectFwd1x1:1,64,1,1,1,4,16,64,0
232-14-14-1x1-232-14-14-1024-0x0-1x1-1x1-0-NCHW-FP16-F=ConvAsm1x1U:2,8,4,64,1,4,2,1;ConvOclDirectFwd1x1:1,128,1,1,0,2,16,4,0
48-35-35-5x5-64-35-35-4-2x2-1x1-1x1-0-NCHW-FP32-F=ConvOclDirectFwd:16,16,16,32,1,2,8,1,2;ConvOclDirectFwdFused:16,16,16,32,1,2,8,1,2
58-745-13-1x1-192-745-13-256-0x0-1x1-1x1-0-NCHW-FP32-F=ConvAsm1x1U:1,32,2,64,1,1,1,1;ConvOclDirectFwd1x1:1,64,1,1,0,1,64,4,0
512-7-7-1x1-1024-14-14-32-0x0-2x2-1x1-0-NCHW-FP16-W=ConvAsmBwdWrW1x1:1,16,4,8,2,1,1,2,0,2
1392-58-181-1x1-608-58-181-12-0x0-1x1-1x1-0-NCHW-FP32-F=ConvOclDirectFwd1x1:1,64,1,1,1,4,64,2048,0
128-56-56-1x1-192-56-56-512-0x0-1x1-1x1-0-NCHW-FP32-B=ConvAsm1x1U:2,16,2,64,1,2,1,4;ConvOclDirectFwd1x1:1,128,1,1,0,1,32,4,0
128-28-28-1x1-480-28-28-128-0x0-1x1-1x1-0-NCHW-FP32-W=ConvAsmBwdWrW1x1:2,8,4,8,2,2,2,4,0,2
19-94-17-1x1-1152-94-17-2-0x0-1x1-1x1-0-NCHW-FP32-W=ConvAsmBwdWrW1x1:4,4,8,1,4,1,1,4,0,0
832-883-238-1x1-608-883-238-1-0x0-1x1-1x1-0-NCHW-FP32-F=ConvOclDirectFwd1x1:1,64,1,1,1,0,64,2048,0
512-28-28-1x1-128-28-28-8-0x0-1x1-1x1-0-NCHW-FP32-W=ConvAsmBwdWrW1x1:4,4,4,4,4,1,2,4,0,0
32-64-128-1x1-832-64-128-1-0x0-1x1-1x1-0-NCHW-FP16-W=ConvAsmBwdWrW1x1:4,4,2,4,4,1,1,2,0,3
32-24-240-3x3-16-24-240-1-1x1-1x1-1x1-0-NCHW-FP32-W=ConvAsmBwdWrW3x3:0,0,16,1,1,1
128-28-28-1x1-256-28-28-8-0x0-1x1-1x1-0-NCHW-FP32-B=ConvAsm1x1U:1,16,1,32,1,2,1,1;ConvOclDirectFwd1x1:16,64,32,32,0,2,16,4,1
48-18-689-1x1-24-18-689-4-0x0-1x1-1x1-0-NCHW-FP32-W=ConvAsmBwdWrW1x1:4,4,2,1,4,1,2,4,0,3
192-7-7-1x1-1392-7-7-16-0x0-1x1-1x1-0-NCHW-FP16-W=ConvAsmBwdWrW1x1:1,16,2,8,2,1,2,4,0,1
528-6-301-1x1-912-6-301-32-0x0-1x1-1x1-0-NCHW-FP32-W=ConvAsmBwdWrW1x1:1,16,4,8,4,1,1,4,0,1
128-54-54-1x1-32-54-54-128-0x0-1x1-1x1-0-NCHW-FP16-F=ConvAsm1x1U:1,8,2,64,1,4,2,2;ConvOclDirectFwd1x1:1,256,1,1,0,2,16,4,0
128-28-28-1x1-352-28-28-512-0x0-1x1-1x1-0-NCHW-FP16-B=ConvAsm1x1U:1,16,2,16,1,2,1,2;ConvOclDirectFwd1x1:1,256,1,1,0,4,16,4,0
128-28-28-1x1-256-28-28-1-0x0-1x1-1x1-0-NCHW-FP16-W=ConvAsmBwdWrW1x1:4,4,2,4,2,1,1,2,0,1
128-7-7-1x1-800-7-7-64-0x0-1x1-1x1-0-NCHW-FP32-W=ConvAsmBwdWrW1x1:1,16,2,4,8,1,2,4,0,2
512-7-7-3x3-512-7-7-256-1x1-1x1-1x1-0-NCHW-FP16-F=ConvOclDirectFwd:8,8,8,8,1,1,8,4,1
60-28-28-1x1-240-28-28-1-0x0-1x1-1x1-0-NCHW-FP32-F_g3=ConvOclDirectFwd:16,16,16,16,1,1,4,4,1
672-7-7-1x1-128-7-7-128-0x0-1x1-1x1-0-NCHW-FP16-W=ConvAsmBwdWrW1x1:2,8,2,8,2,2,2,4,0,1
160-14-14-1x1-528-14-14-512-0x0-1x1-1x1-0-NCHW-FP32-B=ConvAsm1x1U:1,16,1,32,2,1,2,2;ConvOclDirectFwd1x1:1,256,1,1,0,2,16,4,0
704-46-301-1x1-116-46-301-1-0x0-1x1-1x1-0-NCHW-FP32-F=ConvOclDirectFwd1x1:1,128,1,1,0,2,16,8,0
384-13-13-3x3-192-13-13-2-1x1-1x1-1x1-0-NCHW-FP16-W=ConvAsmBwdWrW3x3:0,0,8,4,1,1
32-311-565-1x1-96-311-565-6-0x0-1x1-1x1-0-NCHW-FP32-B=ConvOclDirectFwd1x1:1,256,1,1,0,1,32,4,0
64-27-27-1x1-384-27-27-128-0x0-1x1-1x1-0-NCHW-FP16-B=ConvAsm1x1U:3,8,6,64,1,4,1,4;ConvOclDirectFwd1x1:1,256,1,1,0,1,64,4,0
704-5-193-1x1-16-5-193-1-0x0-1x1-1x1-0-NCHW-FP32-W=ConvAsmBwdWrW1x1:4,4,2,1,2,1,1,2,0,1
1392-14-510-1x1-672-14-510-4-0x0-1x1-1x1-0-NCHW-FP32-F=ConvOclDirectFwd1x1:1,64,1,1,1,4,64,2048,0
48-35-35-1x1-192-35-35-4-0x0-1x1-1x1-0-NCHW-FP32-W=ConvAsmBwdWrW1x1:4,4,4,1,8,1,2,4,0,1
2048-7-7-1x1-1024-7-7-48-0x0-1x1-1x1-0-NCHW-FP32-F=ConvAsm1x1U:2,16,4,16,3,1,1,2;ConvOclDirectFwd1x1:8,8,8,8,1,0,32,128,1
1000-880-137-1x1-192-880-137-2-0x0-1x1-1x1-0-NCHW-FP32-B=ConvOclDirectFwd1x1:1,128,1,1,0,2,32,4,0
256-56-56-1x1-128-56-56-32-0x0-1x1-1x1-0-NCHW-FP32-W=ConvAsmBwdWrW1x1:2,8,2,4,8,1,4,4,0,1
384-27-27-1x1-48-27-27-64-0x0-1x1-1x1-0-NCHW-FP16-F=ConvAsm1x1U:3,8,6,64,1,4,2,2;ConvOclDirectFwd1x1:16,64,32,32,0,1,16,4,1
960-135-265-1x1-1248-135-265-1-0x0-1x1-1x1-0-NCHW-FP32-B=ConvOclDirectFwd1x1:1,64,1,1,0,1,32,4,0
336-638-74-1x1-736-638-74-6-0x0-1x1-1x1-0-NCHW-FP32-F=ConvOclDirectFwd1x1:1,64,1,1,1,0,64,2048,0
48-35-35-1x1-256-35-35-128-0x0-1x1-1x1-0-NCHW-FP16-B=ConvAsm1x1U:1,16,2,16,1,2,1,2;ConvOclDirectFwd1x1:1,64,1,1,0,1,32,4,0
512-14-14-1x1-2048-14-14-128-0x0-1x1-1x1-0-NCHW-FP16-B=ConvAsm1x1U:2,8,4,64,1,4,4,1;ConvOclDirectFwd1x1:1,64,1,1,0,2,16,4,0
1024-14-14-1x1-512-28-28-32-0x0-2x2-1x1-0-NCHW-FP32-B=ConvAsm1x1U:2,16,2,64,2,2,2,2;ConvOclDirectFwd1x1:1,256,1,1,0,1,32,4,0
240-7-7-3x3-240-7-7-256-1x1-1x1-1x1-0-NCHW-FP32-W=ConvAsmBwdWrW3x3:0,0,8,4,7,1
480-14-14-1x1-64-14-14-512-0x0-1x1-1x1-0-NCHW-FP16-F=ConvAsm1x1U:1,16,2,16,2,2,2,2;ConvOclDirectFwd1x1:8,64,16,16,0,2,16,4,1
384-14-14-1x1-128-14-14-16-0x0-1x1-1x1-0-NCHW-FP16-B=ConvAsm1x1U:2,8,4,64,1,4,4,1;ConvOclDirectFwd1x1:1,64,1,1,0,4,4,4,0
144-109-337-1x1-116-109-337-32-0x0-1x1-1x1-0-NCHW-FP32-F=ConvOclDirectFwd1x1:1,256,1,1,0,1,16,4,0
528-14-14-1x1-160-14-14-256-0x0-1x1-1x1-0-NCHW-FP16-F=ConvAsm1x1U:1,16,2,16,2,2,2,2;ConvOclDirectFwd1x1:1,64,1,1,0,4,16,4,0
576-14-14-1x1-128-14-14-64-0x0-1x1-1x1-0-NCHW-FP32-B=ConvAsm1x1U:1,16,1,64,2,2,2,2;ConvOclDirectFwd1x1:1,64,1,1,0,2,16,4,0
1056-7-7-1x1-160-7-7-32-0x0-1x1-1x1-0-NCHW-FP32-F=ConvAsm1x1U:1,8,1,64,3,4,2,4;ConvOclDirectFwd1x1:1,64,1,1,1,1,16,256,0;ConvActivAsm1x1U:2,16,2,32,3,4
16-522-8-1x1-576-522-8-1-0x0-1x1-1x1-0-NCHW-FP32-F=ConvAsm1x1U:1,8,1,64,1,2,1,2;ConvOclDirectFwd1x1:1,64,1,1,1,1,16,64,0
58-28-28-1x1-58-28-28-2-0x0-1x1-1x1-0-NCHW-FP32-W=ConvAsmBwdWrW1x1:4,4,2,1,2,1,2,4,0,1
24-326-575-1x1-16-326-575-4-0x0-1x1-1x1-0-NCHW-FP32-F=ConvOclDirectFwd1x1:1,256,1,1,0,1,16,4,0
144-481-390-1x1-80-481-390-6-0x0-1x1-1x1-0-NCHW-FP32-F=ConvOclDirectFwd1x1:1,64,1,1,1,4,32,2048,0
544-899-396-1x1-864-899-396-1-0x0-1x1-1x1-0-NCHW-FP32-F=ConvOclDirectFwd1x1:1,64,1,1,1,4,64,2048,0
192-14-14-1x1-1872-14-14-16-0x0-1x1-1x1-0-NCHW-FP16-B=ConvAsm1x1U:1,16,2,16,1,2,2,2;ConvOclDirectFwd1x1:1,128,1,1,0,4,16,4,0
416-686-68-1x1-32-686-68-8-0x0-1x1-1x1-0-NCHW-FP32-F=ConvOclDirectFwd1x1:1,64,1,1,1,1,64,2048,0
320-67-906-1x1-896-67-906-2-0x0-1x1-1x1-0-NCHW-FP32-F=ConvOclDirectFwd1x1:1,64,1,1,1,1,16,2048,0
672-25-475-1x1-576-25-475-6-0x0-1x1-1x1-0-NCHW-FP32-B=ConvOclDirectFwd1x1:1,128,1,1,0,1,32,4,0
512-178-63-1x1-1408-178-63-12-0x0-1x1-1x1-0-NCHW-FP32-B=ConvOclDirectFwd1x1:1,128,1,1,0,2,32,4,0
256-14-14-1x1-512-28-28-512-0x0-2x2-1x1-0-NCHW-FP16-B=ConvAsm1x1U:1,16,2,16,1,2,1,8;ConvOclDirectFwd1x1:1,256,1,1,0,2,32,8,0
58-367-237-1x1-320-367-237-6-0x0-1x1-1x1-0-NCHW-FP32-B=ConvOclDirectFwd1x1:1,128,1,1,0,1,64,4,0
80-93-487-1x1-48-93-487-4-0x0-1x1-1x1-0-NCHW-FP32-F=ConvAsm1x1U:1,16,8,64,1,1,1,1;ConvOclDirectFwd1x1:1,64,1,1,1,4,32,256,0
128-7-7-1x1-768-7-7-32-0x0-1x1-1x1-0-NCHW-FP16-F=ConvAsm1x1U:1,8,2,32,1,4,1,4;ConvOclDirectFwd1x1:1,128,1,1,0,1,16,4,0
64-112-112-1x1-64-112-112-2-0x0-1x1-1x1-0-NCHW-FP16-B=ConvAsm1x1U:1,8,2,64,1,4,2,2
64-538-91-1x1-24-538-91-32-0x0-1x1-1x1-0-NCHW-FP32-B=ConvAsm1x1U:1,8,1,16,1,1,1,1;ConvOclDirectFwd1x1:1,256,1,1,0,2,16,4,0
256-20-84-5x5-512-9-41-8-1x1-2x2-1x1-0-NCHW-FP32-F=ConvOclDirectFwd:16,8,16,16,1,2,8,1,2
288-14-14-3x3-144-14-14-512-1x1-1x1-1x1-0-NCHW-FP16-B=ConvOclDirectFwd:8,8,16,16,2,2,8,2,2
288-28-28-1x1-128-28-28-16-0x0-1x1-1x1-0-NCHW-FP16-B=ConvAsm1x1U:1,8,2,32,1,4,2,2;ConvOclDirectFwd1x1:1,64,1,1,0,4,16,4,0
896-91-721-1x1-1888-91-721-1-0x0-1x1-1x1-0-NCHW-FP32-B=ConvOclDirectFwd1x1:1,256,1,1,0,1,32,4,0
192-79-301-1x1-4-79-301-32-0x0-1x1-1x1-0-NCHW-FP32-F=ConvOclDirectFwd1x1:1,128,1,1,0,1,16,4,0
128-14-14-1x1-384-14-14-16-0x0-1x1-1x1-0-NCHW-FP16-W=ConvAsmBwdWrW1x1:4,4,4,4,2,1,2,4,0,0
336-56-56-1x1-192-56-56-16-0x0-1x1-1x1-0-NCHW-FP16-F=ConvAsm1x1U:1,8,2,64,2,4,1,4;ConvOclDirectFwd1x1:1,64,1,1,0,4,16,4,0
992-293-615-1x1-1504-293-615-1-0x0-1x1-1x1-0-NCHW-FP32-B=ConvOclDirectFwd1x1:1,128,1,1,0,1,32,4,0
2048-211-361-1x1-912-211-361-1-0x0-1x1-1x1-0-NCHW-FP32-B=ConvOclDirectFwd1x1:1,256,1,1,0,1,16,8,0
2112-974-51-1x1-112-974-51-4-0x0-1x1-1x1-0-NCHW-FP32-F=ConvOclDirectFwd1x1:1,64,1,1,1,0,32,256,0
64-224-224-3x3-3-224-224-64-1x1-1x1-1x1-0-NCHW-FP32-F=ConvOclDirectFwd:16,16,32,32,2,2,8,2,1;ConvAsm3x3U:4,2,8
256-7-7-3x3-256-14-14-512-1x1-2x2-1x1-0-NCHW-FP16-W=ConvAsmBwdWrW3x3:0,0,8,4,1,1
64-56-56-1x1-64-56-56-256-0x0-1x1-1x1-0-NCHW-FP16-F=ConvAsm1x1U:1,8,2,32,1,4,1,2;ConvOclDirectFwd1x1:1,64,1,1,0,4,16,4,0
512-14-14-1x1-24-14-14-128-0x0-1x1-1x1-0-NCHW-FP16-F=ConvAsm1x1U:2,8,4,64,1,4,4,1;ConvOclDirectFwd1x1:1,128,1,1,0,4,8,4,0
864-7-7-1x1-128-7-7-128-0x0-1x1-1x1-0-NCHW-FP32-B=ConvAsm1x1U:4,8,4,16,1,4,1,8;ConvOclDirectFwd1x1:1,64,1,1,0,1,8,4,0
128-17-17-1x1-768-17-17-16-0x0-1x1-1x1-0-NCHW-FP32-B=ConvAsm1x1U:1,16,1,64,4,2,2,2;ConvOclDirectFwd1x1:1,256,1,1,0,1,16,4,0
192-35-35-1x1-32-35-35-32-0x0-1x1-1x1-0-NCHW-FP16-F=ConvAsm1x1U:1,8,2,64,1,4,2,2;ConvOclDirectFwd1x1:1,64,1,1,0,1,16,8,0
160-335-533-1x1-720-335-533-2-0x0-1x1-1x1-0-NCHW-FP32-B=ConvOclDirectFwd1x1:1,64,1,1,0,1,16,4,0
54-117-167-1x1-672-117-167-12-0x0-1x1-1x1-0-NCHW-FP32-W=ConvAsmBwdWrW1x1:4,4,4,4,4,1,1,4,0,1
24-1-227-1x1-1680-1-227-1-0x0-1x1-1x1-0-NCHW-FP32-B=ConvAsm1x1U:1,16,1,64,1,2,2,1;ConvOclDirectFwd1x1:1,128,1,1,0,1,8,4,0
2-339-186-1x1-24-339-186-1-0x0-1x1-1x1-0-NCHW-FP32-F=ConvAsm1x1U:1,8,1,64,1,1,2,1;ConvOclDirectFwd1x1:16,64,32,32,0,2,16,4,1
192-17-17-1x1-768-17-17-512-0x0-1x1-1x1-0-NCHW-FP16-W=ConvAsmBwdWrW1x1:4,4,8,4,2,1,1,4,0,1
128-14-14-1x1-256-14-14-16-0x0-1x1-1x1-0-NCHW-FP32-B=ConvAsm1x1U:1,16,1,32,1,2,2,2;ConvOclDirectFwd1x1:1,128,1,1,0,4,8,4,0
128-7-7-1x1-640-7-7-16-0x0-1x1-1x1-0-NCHW-FP16-F=ConvAsm1x1U:1,8,2,16,1,4,2,2;ConvOclDirectFwd1x1:1,64,1,1,0,1,8,4,0
480-316-162-1x1-480-316-162-1-0x0-1x1-1x1-0-NCHW-FP32-F=ConvOclDirectFwd1x1:1,64,1,1,1,4,64,2048,0
232-488-156-1x1-232-488-156-16-0x0-1x1-1x1-0-NCHW-FP32-F=ConvOclDirectFwd1x1:1,64,1,1,0,2,16,8,0
192-6-236-1x1-800-6-236-256-0x0-1x1-1x1-0-NCHW-FP32-F=ConvAsm1x1U:2,16,5,32,1,2,1,1;ConvOclDirectFwd1x1:1,64,1,1,1,0,64,2048,0
512-7-7-3x3-512-4-4-32-1x1-2x2-1x1-0-NCHW-FP32-F=ConvOclDirectFwd:8,8,8,8,1,1,8,2,2
1600-574-228-1x1-320-574-228-1-0x0-1x1-1x1-0-NCHW-FP32-F=ConvOclDirectFwd1x1:16,16,32,32,1,0,32,128,1
960-14-14-1x1-128-14-14-512-0x0-1x1-1x1-0-NCHW-FP16-B=ConvAsm1x1U:1,16,2,16,1,2,1,2;ConvOclDirectFwd1x1:1,64,1,1,0,2,32,8,0
128-28-28-1x1-512-28-28-4-0x0-1x1-1x1-0-NCHW-FP32-W=ConvAsmBwdWrW1x1:4,4,4,2,4,1,1,4,0,0
58-9-221-1x1-2-9-221-2048-0x0-1x1-1x1-0-NCHW-FP32-W=ConvAsmBwdWrW1x1:4,4,2,1,2,1,2,4,0,1
232-7-7-1x1-232-7-7-1024-0x0-1x1-1x1-0-NCHW-FP16-F=ConvAsm1x1U:1,8,2,32,1,4,2,2;ConvOclDirectFwd1x1:1,128,1,1,0,1,16,8,0
512-14-14-3x3-512-14-14-1-1x1-1x1-1x1-0-NCHW-FP16-B=ConvOclDirectFwd:16,16,16,16,1,1,2,4,1
512-28-28-3x3-256-28-28-16-1x1-1x1-1x1-0-NCHW-FP32-W=ConvAsmBwdWrW3x3:0,0,8,4,2,1
128-353-872-1x1-288-353-872-1-0x0-1x1-1x1-0-NCHW-FP32-F=ConvOclDirectFwd1x1:1,64,1,1,1,4,64,256,0
464-29-247-1x1-704-29-247-48-0x0-1x1-1x1-0-NCHW-FP32-F=ConvOclDirectFwd1x1:1,64,1,1,1,4,32,2048,0
512-9-41-5x5-256-20-84-64-1x1-2x2-1x1-0-NCHW-FP32-W=ConvOclBwdWrW2<1>:1,12,3,3,5;ConvOclBwdWrW2<2>:1,12,3,3,5;ConvOclBwdWrW2<4>:1,12,3,3,5;ConvOclBwdWrW2<8>:1,12,3,3,9;ConvOclBwdWrW2<16>:1,12,3,3,5
928-848-605-1x1-1-848-605-1-0x0-1x1-1x1-0-NCHW-FP32-B=ConvOclDirectFwd1x1:1,256,1,1,0,4,16,8,0
1024-7-7-1x1-464-7-7-64-0x0-1x1-1x1-0-NCHW-FP32-W=ConvAsmBwdWrW1x1:1,16,4,8,4,1,1,4,0,2
128-846-352-1x1-672-846-352-2-0x0-1x1-1x1-0-NCHW-FP32-B=ConvOclDirectFwd1x1:1,128,1,1,0,1,32,4,0
128-56-56-3x3-256-56-56-256-1x1-1x1-1x1-0-NCHW-FP16-F=ConvOclDirectFwd:16,16,32,32,2,2,8,2,1;ConvOclDirectFwdFused:32,8,32,32,1,4,8,1,2
512-14-14-1x1-1024-14-14-256-0x0-1x1-1x1-0-NCHW-FP32-W=ConvAsmBwdWrW1x1:1,16,4,8,4,1,1,4,0,0
128-57-57-3x3-128-57-57-4-1x1-1x1-1x1-0-NCHW-FP32-F_g32=ConvOclDirectFwd:16,16,32,32,2,2,4,1,1
256-57-57-1x1-512-29-29-128-0x0-2x2-1x1-0-NCHW-FP32-F=ConvAsm1x1U:4,16,5,32,1,2,1,1;ConvOclDirectFwd1x1:1,64,1,1,1,4,32,2048,0
2048-95-114-1x1-24-95-114-6-0x0-1x1-1x1-0-NCHW-FP32-B=ConvOclDirectFwd1x1:1,64,1,1,0,2,16,8,0
640-65-164-1x1-1216-65-164-12-0x0-1x1-1x1-0-NCHW-FP32-B=ConvOclDirectFwd1x1:1,128,1,1,0,2,32,4,0
256-353-418-1x1-640-353-418-1-0x0-1x1-1x1-0-NCHW-FP32-B=ConvOclDirectFwd1x1:1,256,1,1,0,1,32,4,0
256-8-8-1x1-1536-8-8-32-0x0-1x1-1x1-0-NCHW-FP32-W=ConvAsmBwdWrW1x1:2,8,2,4,8,1,1,4,0,3
1680-59-553-1x1-992-59-553-4-0x0-1x1-1x1-0-NCHW-FP32-F=ConvOclDirectFwd1x1:1,64,1,1,1,0,16,2048,0
128-14-14-1x1-256-14-14-64-0x0-1x1-1x1-0-NCHW-FP16-W=ConvAsmBwdWrW1x1:2,8,2,8,2,1,4,4,0,1
512-14-14-3x3-512-14-14-128-1x1-1x1-1x1-0-NCHW-FP32-B_g32=ConvOclDirectFwd:16,16,16,16,1,1,8,2,2
80-181-20-1x1-1728-181-20-64-0x0-1x1-1x1-0-NCHW-FP32-W=ConvAsmBwdWrW1x1:1,16,4,4,4,1,1,4,0,1
3-224-224-7x7-64-112-112-64-3x3-2x2-1x1-0-NCHW-FP32-F=ConvOclDirectFwd:16,8,16,16,1,2,8,1,1
16-28-28-1x1-192-28-28-512-0x0-1x1-1x1-0-NCHW-FP16-W=ConvAsmBwdWrW1x1:4,4,2,1,8,1,4,4,0,1
256-28-28-1x1-32-28-28-16-0x0-1x1-1x1-0-NCHW-FP32-F=ConvAsm1x1U:2,16,2,64,1,2,4,1;ConvOclDirectFwd1x1:1,64,1,1,1,4,16,128,0;ConvActivAsm1x1U:2,16,2,32,1,4
192-28-28-1x1-16-28-28-64-0x0-1x1-1x1-0-NCHW-FP32-F=ConvAsm1x1U:2,8,2,64,2,2,1,1;ConvOclDirectFwd1x1:1,64,1,1,1,0,32,2048,0;ConvActivAsm1x1U:1,16,2,64,1,1
24-943-96-1x1-736-943-96-2-0x0-1x1-1x1-0-NCHW-FP32-F=ConvOclDirectFwd1x1:1,128,1,1,0,2,32,4,0
128-64-128-1x1-512-64-128-1-0x0-1x1-1x1-0-NCHW-FP16-W=ConvAsmBwdWrW1x1:4,4,8,4,2,1,1,4,0,1
256-14-14-1x1-256-14-14-8-0x0-1x1-1x1-0-NCHW-FP32-B=ConvAsm1x1U:1,16,1,16,1,2,2,2;ConvOclDirectFwd1x1:1,256,1,1,0,4,8,8,0
1056-136-241-1x1-640-136-241-2-0x0-1x1-1x1-0-NCHW-FP32-B=ConvOclDirectFwd1x1:1,128,1,1,0,2,32,4,0
1-121-1000-1x1-4-121-1000-2-0x0-1x1-1x1-0-NCHW-FP32-B=ConvAsm1x1U:4,4,4,4,1,1,1,1;ConvOclDirectFwd1x1:1,256,1,1,0,4,16,4,0
576-14-14-1x1-128-14-14-256-0x0-1x1-1x1-0-NCHW-FP16-B=ConvAsm1x1U:1,16,2,16,1,2,2,4;ConvOclDirectFwd1x1:1,128,1,1,0,2,32,8,0
1-996-79-1x1-3-996-79-64-0x0-1x1-1x1-0-NCHW-FP32-W=ConvAsmBwdWrW1x1:4,4,2,1,2,1,4,4,0,1
384-8-8-3x1-384-8-8-512-1x0-1x1-1x1-0-NCHW-FP16-W=ConvOclBwdWrW2<1>:1,8,8,8,9;ConvOclBwdWrW2<2>:1,6,3,8,3;ConvOclBwdWrW2<4>:1,6,3,8,3;ConvOclBwdWrW2<8>:1,6,3,8,3;ConvOclBwdWrW2<16>:1,7,8,8,3
768-17-17-1x1-128-17-17-16-0x0-1x1-1x1-0-NCHW-FP32-F=ConvAsm1x1U:4,16,5,64,1,2,4,1;ConvOclDirectFwd1x1:1,64,1,1,1,4,32,256,0;ConvActivAsm1x1U:2,16,5,64,1,4
896-7-7-1x1-128-7-7-16-0x0-1x1-1x1-0-NCHW-FP32-B=ConvAsm1x1U:1,8,1,64,1,4,4,4;ConvOclDirectFwd1x1:1,256,1,1,0,1,4,8,0
960-13-954-1x1-256-13-954-8-0x0-1x1-1x1-0-NCHW-FP32-B=ConvOclDirectFwd1x1:1,256,1,1,0,1,32,4,0
64-28-28-1x1-192-28-28-128-0x0-1x1-1x1-0-NCHW-FP32-B=ConvAsm1x1U:1,16,1,32,3,2,2,2;ConvOclDirectFwd1x1:1,64,1,1,0,1,32,4,0
1024-230-231-1x1-832-230-231-2-0x0-1x1-1x1-0-NCHW-FP32-B=ConvOclDirectFwd1x1:1,256,1,1,0,2,32,4,0
160-73-73-1x1-64-73-73-32-0x0-1x1-1x1-0-NCHW-FP32-F=ConvAsm1x1U:3,16,3,64,2,2,1,2;ConvOclDirectFwd1x1:1,64,1,1,1,4,16,2048,0;ConvActivAsm1x1U:3,32,3,64,1,1
1376-11-231-1x1-672-11-231-6-0x0-1x1-1x1-0-NCHW-FP32-F=ConvAsm1x1U:3,16,5,64,2,2,1,1;ConvOclDirectFwd1x1:1,64,1,1,1,4,64,2048,0
864-392-35-1x1-1-392-35-1-0x0-1x1-1x1-0-NCHW-FP32-F=ConvOclDirectFwd1x1:1,256,1,1,0,4,16,8,0
224-14-14-3x3-112-14-14-4-1x1-1x1-1x1-0-NCHW-FP16-B=ConvOclDirectFwd:16,16,16,16,1,1,2,4,2
192-13-13-3x3-384-13-13-8-1x1-1x1-1x1-0-NCHW-FP16-F=ConvOclDirectFwd:8,8,16,16,2,2,4,1,2;ConvOclDirectFwdFused:8,8,16,16,2,2,4,1,2
128-54-54-1x1-16-54-54-512-0x0-1x1-1x1-0-NCHW-FP16-W=ConvAsmBwdWrW1x1:4,4,2,2,2,1,4,4,0,1
128-14-14-1x1-320-14-14-32-0x0-1x1-1x1-0-NCHW-FP16-B=ConvAsm1x1U:1,16,2,16,1,2,2,2;ConvOclDirectFwd1x1:1,64,1,1,0,4,8,4,0
384-6-501-1x1-672-6-501-128-0x0-1x1-1x1-0-NCHW-FP32-F=ConvAsm1x1U:3,16,8,64,1,2,1,1;ConvOclDirectFwd1x1:1,64,1,1,1,0,64,2048,0
608-348-251-1x1-1056-348-251-1-0x0-1x1-1x1-0-NCHW-FP32-B=ConvOclDirectFwd1x1:1,256,1,1,0,2,32,4,0
64-112-112-7x7-3-225-225-256-2x2-2x2-1x1-0-NCHW-FP16-B=ConvOclDirectFwd:16,16,32,32,2,2,8,2,1
2048-7-7-1x1-512-7-7-2-0x0-1x1-1x1-0-NCHW-FP16-F=ConvAsm1x1U:1,8,2,32,1,4,4,1;ConvOclDirectFwd1x1:1,64,1,1,0,1,4,4,0
512-29-29-1x1-256-57-57-48-0x0-2x2-1x1-0-NCHW-FP32-B=ConvAsm1x1U:2,16,2,64,1,2,2,2;ConvOclDirectFwd1x1:1,256,1,1,0,1,32,4,0
256-14-14-1x1-512-28-28-128-0x0-2x2-1x1-0-NCHW-FP16-W=ConvAsmBwdWrW1x1:2,8,4,8,2,1,2,4,0,1
64-931-134-1x1-128-931-134-8-0x0-1x1-1x1-0-NCHW-FP32-F=ConvOclDirectFwd1x1:16,16,32,32,1,0,32,128,1
1440-181-961-1x1-448-181-961-1-0x0-1x1-1x1-0-NCHW-FP32-F=ConvOclDirectFwd1x1:1,64,1,1,1,4,32,2048,0
128-28-28-3x3-64-56-56-12-1x1-2x2-1x1-0-NCHW-FP32-W=ConvAsmBwdWrW3x3:0,0,16,4,5,1
58-203-296-1x1-48-203-296-32-0x0-1x1-1x1-0-NCHW-FP32-B=ConvAsm1x1U:3,16,5,64,1,1,1,2;ConvOclDirectFwd1x1:1,256,1,1,0,4,16,4,0
64-224-224-3x3-3-224-224-256-1x1-1x1-1x1-0-NCHW-FP16-F=ConvOclDirectFwd:16,16,32,32,2,2,8,2,1
48-216-628-1x1-832-216-628-4-0x0-1x1-1x1-0-NCHW-FP32-F=ConvOclDirectFwd1x1:1,64,1,1,1,4,16,2048,0
736-638-74-1x1-336-638-74-6-0x0-1x1-1x1-0-NCHW-FP32-B=ConvOclDirectFwd1x1:1,256,1,1,0,4,16,8,0
384-28-28-1x1-128-28-28-256-0x0-1x1-1x1-0-NCHW-FP16-B=ConvAsm1x1U:1,16,2,16,1,2,1,4;ConvOclDirectFwd1x1:1,256,1,1,0,4,16,4,0
54-110-712-1x1-24-110-712-8-0x0-1x1-1x1-0-NCHW-FP32-B=ConvOclDirectFwd1x1:1,256,1,1,0,4,16,4,0
58-816-20-1x1-192-816-20-6-0x0-1x1-1x1-0-NCHW-FP32-B=ConvAsm1x1U:2,32,6,64,1,1,1,2;ConvOclDirectFwd1x1:1,64,1,1,0,1,64,4,0
2-180-115-1x1-464-180-115-2-0x0-1x1-1x1-0-NCHW-FP32-B=ConvOclDirectFwd1x1:1,256,1,1,0,4,4,4,0
32-173-355-1x1-320-173-355-16-0x0-1x1-1x1-0-NCHW-FP32-F=ConvOclDirectFwd1x1:1,64,1,1,1,1,32,2048,0
19-453-59-1x1-1568-453-59-1-0x0-1x1-1x1-0-NCHW-FP32-B=ConvOclDirectFwd1x1:1,256,1,1,0,1,4,4,0
112-76-261-1x1-1392-76-261-12-0x0-1x1-1x1-0-NCHW-FP32-B=ConvOclDirectFwd1x1:1,256,1,1,0,2,16,4,0
128-28-28-1x1-448-28-28-16-0x0-1x1-1x1-0-NCHW-FP16-F=ConvAsm1x1U:1,8,2,16,1,4,1,8;ConvOclDirectFwd1x1:1,64,1,1,0,4,16,4,0
448-465-37-1x1-336-465-37-48-0x0-1x1-1x1-0-NCHW-FP32-B=ConvOclDirectFwd1x1:1,256,1,1,0,1,16,8,0
992-7-7-1x1-128-7-7-64-0x0-1x1-1x1-0-NCHW-FP16-B=ConvAsm1x1U:1,16,2,32,1,2,4,4;ConvOclDirectFwd1x1:1,64,1,1,0,1,4,4,0
512-7-7-1x1-512-7-7-1-0x0-1x1-1x1-0-NCHW-FP32-W=ConvAsmBwdWrW1x1:1,16,2,4,2,1,1,4,0,1
116-353-214-1x1-144-353-214-16-0x0-1x1-1x1-0-NCHW-FP32-W=ConvAsmBwdWrW1x1:4,4,2,4,2,1,1,4,0,1
112-14-14-3x3-224-14-14-256-1x1-1x1-1x1-0-NCHW-FP16-F=ConvOclDirectFwd:8,8,16,16,2,2,8,1,2;ConvOclDirectFwdFused:8,8,16,16,2,2,8,1,2
128-7-7-1x1-672-7-7-128-0x0-1x1-1x1-0-NCHW-FP32-F=ConvAsm1x1U:1,8,1,64,4,4,1,4;ConvOclDirectFwd1x1:1,64,1,1,1,1,16,128,0
128-28-28-1x1-256-56-56-256-0x0-2x2-1x1-0-NCHW-FP16-B=ConvAsm1x1U:1,16,2,16,1,2,1,8;ConvOclDirectFwd1x1:1,64,1,1,0,2,32,8,0
80-886-30-1x1-736-886-30-16-0x0-1x1-1x1-0-NCHW-FP32-B=ConvOclDirectFwd1x1:1,256,1,1,0,4,16,4,0
8-280-983-1x1-32-280-983-4-0x0-1x1-1x1-0-NCHW-FP32-F=ConvOclDirectFwd1x1:1,64,1,1,0,2,32,4,0
1024-17-17-1x1-192-17-17-8-0x0-1x1-1x1-0-NCHW-FP32-F=ConvAsm1x1U:4,8,5,64,2,2,2,2;ConvOclDirectFwd1x1:1,64,1,1,1,4,32,256,0;ConvActivAsm1x1U:4,16,4,16,2,3
232-75-354-1x1-58-75-354-2-0x0-1x1-1x1-0-NCHW-FP32-B=ConvOclDirectFwd1x1:1,128,1,1,0,2,16,4,0
1728-124-445-1x1-832-124-445-1-0x0-1x1-1x1-0-NCHW-FP32-F=ConvOclDirectFwd1x1:1,64,1,1,1,0,16,2048,0
1776-45-529-1x1-704-45-529-4-0x0-1x1-1x1-0-NCHW-FP32-F=ConvOclDirectFwd1x1:1,64,1,1,1,4,16,2048,0
128-14-14-3x3-128-28-28-64-1x1-2x2-1x1-0-NCHW-FP16-W=ConvAsmBwdWrW3x3:0,0,8,4,2,1
192-7-7-1x1-2112-7-7-16-0x0-1x1-1x1-0-NCHW-FP16-W=ConvAsmBwdWrW1x1:1,16,2,8,2,1,2,4,0,0
1680-306-995-1x1-4-306-995-1-0x0-1x1-1x1-0-NCHW-FP32-F=ConvOclDirectFwd1x1:1,256,1,1,0,2,8,4,0
64-56-56-1x1-64-56-56-4-0x0-1x1-1x1-0-NCHW-FP32-F=ConvAsm1x1U:1,8,1,64,1,4,2,2;ConvOclDirectFwd1x1:1,64,1,1,1,4,16,128,0;ConvActivAsm1x1U:1,16,1,64,2,3
256-35-35-1x1-48-35-35-128-0x0-1x1-1x1-0-NCHW-FP16-F=ConvAsm1x1U:2,8,4,64,1,4,1,2;ConvOclDirectFwd1x1:1,256,1,1,0,1,16,8,0
736-90-360-1x1-2-90-360-8-0x0-1x1-1x1-0-NCHW-FP32-F=ConvOclDirectFwd1x1:1,64,1,1,0,2,16,4,0
1568-15-814-1x1-224-15-814-8-0x0-1x1-1x1-0-NCHW-FP32-F=ConvOclDirectFwd1x1:1,64,1,1,1,0,64,2048,0
112-590-53-1x1-288-590-53-32-0x0-1x1-1x1-0-NCHW-FP32-B=ConvOclDirectFwd1x1:1,64,1,1,0,2,32,4,0
54-55-55-1x1-24-55-55-1024-0x0-1x1-1x1-0-NCHW-FP16-B=ConvAsm1x1U:1,8,2,16,1,2,1,1;ConvOclDirectFwd1x1:1,128,1,1,0,1,16,4,0
64-73-73-3x3-96-71-71-256-0x0-1x1-1x1-0-NCHW-FP16-F=ConvOclDirectFwd:8,8,16,16,2,2,8,2,1;ConvOclDirectFwdFused:8,8,16,16,2,2,8,2,1
320-28-28-1x1-128-28-28-512-0x0-1x1-1x1-0-NCHW-FP16-B=ConvAsm1x1U:1,16,2,16,1,2,1,4;ConvOclDirectFwd1x1:1,128,1,1,0,4,16,4,0
544-233-183-1x1-1408-233-183-4-0x0-1x1-1x1-0-NCHW-FP32-B=ConvOclDirectFwd1x1:1,128,1,1,0,1,32,4,0
512-28-28-1x1-256-28-28-4-0x0-1x1-1x1-0-NCHW-FP32-W=ConvAsmBwdWrW1x1:2,8,4,4,4,2,1,4,0,1
1000-3-110-1x1-672-3-110-32-0x0-1x1-1x1-0-NCHW-FP32-B=ConvAsm1x1U:4,32,7,16,1,1,1,1;ConvOclDirectFwd1x1:1,256,1,1,0,2,32,4,0
448-68-365-1x1-464-68-365-12-0x0-1x1-1x1-0-NCHW-FP32-B=ConvOclDirectFwd1x1:1,256,1,1,0,4,16,4,0
192-35-35-1x1-384-35-35-64-0x0-1x1-1x1-0-NCHW-FP16-B=ConvAsm1x1U:1,16,2,64,1,2,1,2;ConvOclDirectFwd1x1:1,256,1,1,0,1,32,4,0
32-27-27-1x1-128-27-27-16-0x0-1x1-1x1-0-NCHW-FP32-W=ConvAsmBwdWrW1x1:4,4,2,4,2,1,4,4,0,1
160-238-622-1x1-232-238-622-8-0x0-1x1-1x1-0-NCHW-FP32-B=ConvOclDirectFwd1x1:1,256,1,1,0,4,16,4,0
64-73-73-1x1-160-73-73-256-0x0-1x1-1x1-0-NCHW-FP32-B=ConvAsm1x1U:1,32,1,64,1,1,1,1;ConvOclDirectFwd1x1:1,256,1,1,0,1,32,4,0
864-253-445-1x1-116-253-445-4-0x0-1x1-1x1-0-NCHW-FP32-B=ConvOclDirectFwd1x1:1,256,1,1,0,1,16,8,0
3-177-639-1x1-1-177-639-128-0x0-1x1-1x1-0-NCHW-FP32-F=ConvAsm1x1U:1,1,1,4,1,1,1,1;ConvOclDirectFwd1x1:1,64,1,1,0,1,8,4,0
240-764-11-1x1-16-764-11-256-0x0-1x1-1x1-0-NCHW-FP32-F=ConvAsm1x1U:1,16,1,64,1,2,4,1;ConvOclDirectFwd1x1:1,64,1,1,1,1,32,256,0
128-17-17-1x1-1024-17-17-32-0x0-1x1-1x1-0-NCHW-FP16-W=ConvAsmBwdWrW1x1:2,8,4,8,2,1,2,2,0,1
3-62-123-1x1-160-62-123-128-0x0-1x1-1x1-0-NCHW-FP32-W=ConvAsmBwdWrW1x1:4,4,2,1,2,1,1,4,0,1
64-35-35-1x1-384-35-35-16-0x0-1x1-1x1-0-NCHW-FP16-W=ConvAsmBwdWrW1x1:4,4,4,4,2,1,4,4,0,1
512-7-7-1x1-512-7-7-8-0x0-1x1-1x1-0-NCHW-FP32-F=ConvAsm1x1U:2,8,2,32,1,4,2,2;ConvOclDirectFwd1x1:1,64,1,1,1,1,16,128,0;ConvActivAsm1x1U:2,16,4,16,1,4
112-3-224-1x1-1680-3-224-16-0x0-1x1-1x1-0-NCHW-FP32-W=ConvAsmBwdWrW1x1:1,16,2,8,4,1,1,4,0,2
120-7-7-1x1-480-7-7-64-0x0-1x1-1x1-0-NCHW-FP16-F_g3=ConvOclDirectFwd:8,8,8,8,1,1,8,2,2
768-7-7-1x1-128-7-7-512-0x0-1x1-1x1-0-NCHW-FP32-B=ConvAsm1x1U:1,16,1,64,4,2,2,2;ConvOclDirectFwd1x1:1,128,1,1,0,1,32,4,0
160-7-7-1x1-832-7-7-512-0x0-1x1-1x1-0-NCHW-FP16-B=ConvAsm1x1U:1,16,2,32,1,2,1,2;ConvOclDirectFwd1x1:1,64,1,1,0,1,32,4,0
1024-17-17-1x1-128-17-17-128-0x0-1x1-1x1-0-NCHW-FP32-F=ConvAsm1x1U:4,16,5,64,1,2,1,1;ConvOclDirectFwd1x1:1,64,1,1,1,0,32,2048,0;ConvActivAsm1x1U:3,16,5,64,2,1
768-921-447-1x1-1104-921-447-1-0x0-1x1-1x1-0-NCHW-FP32-F=ConvOclDirectFwd1x1:1,64,1,1,1,0,32,2048,0
1536-214-22-1x1-800-214-22-64-0x0-1x1-1x1-0-NCHW-FP32-F=ConvOclDirectFwd1x1:1,64,1,1,1,1,16,2048,0
512-14-14-1x1-64-14-14-4-0x0-1x1-1x1-0-NCHW-FP16-F=ConvAsm1x1U:1,8,2,64,1,4,4,1;ConvOclDirectFwd1x1:1,64,1,1,0,4,4,8,0
1280-129-78-1x1-3-129-78-12-0x0-1x1-1x1-0-NCHW-FP32-W=ConvAsmBwdWrW1x1:4,4,2,1,2,1,1,2,0,1
64-162-571-1x1-2-162-571-6-0x0-1x1-1x1-0-NCHW-FP32-B=ConvOclDirectFwd1x1:1,256,1,1,0,2,8,8,0
1152-875-55-1x1-640-875-55-8-0x0-1x1-1x1-0-NCHW-FP32-F=ConvOclDirectFwd1x1:1,64,1,1,1,0,16,2048,0
128-57-57-3x3-128-29-29-64-1x1-2x2-1x1-0-NCHW-FP32-F=ConvOclDirectFwd:8,16,16,16,2,1,8,1,2
112-14-14-1x1-512-14-14-128-0x0-1x1-1x1-0-NCHW-FP16-B=ConvAsm1x1U:1,16,2,16,1,2,1,8;ConvOclDirectFwd1x1:1,256,1,1,0,4,16,4,0
160-109-72-1x1-64-109-72-1-0x0-1x1-1x1-0-NCHW-FP32-W=ConvAsmBwdWrW1x1:4,4,2,4,2,1,1,4,0,2
224-703-106-1x1-416-703-106-16-0x0-1x1-1x1-0-NCHW-FP32-F=ConvOclDirectFwd1x1:1,64,1,1,1,0,64,256,0
64-80-349-5x5-1-161-700-16-1x1-2x2-1x1-0-NCHW-FP32-W=ConvOclBwdWrW2<1>:8,10,8,1,5;ConvOclBwdWrW2<2>:8,10,8,1,5;ConvOclBwdWrW2<4>:8,9,1,3,5;ConvOclBwdWrW2<8>:8,7,1,3,5;ConvOclBwdWrW2<16>:8,11,1,1,7
288-785-629-1x1-288-785-629-2-0x0-1x1-1x1-0-NCHW-FP32-F=ConvOclDirectFwd1x1:1,64,1,1,1,4,64,2048,0
288-273-95-1x1-232-273-95-6-0x0-1x1-1x1-0-NCHW-FP32-F=ConvOclDirectFwd1x1:1,128,1,1,0,1,16,8,0
64-54-54-1x1-16-54-54-512-0x0-1x1-1x1-0-NCHW-FP16-F=ConvAsm1x1U:1,8,2,64,1,4,4,1;ConvOclDirectFwd1x1:1,256,1,1,0,2,16,8,0
960-7-7-1x1-240-7-7-512-0x0-1x1-1x1-0-NCHW-FP32-B_g3=ConvOclDirectFwd:8,8,8,8,1,1,8,4,2
192-35-35-1x1-32-35-35-16-0x0-1x1-1x1-0-NCHW-FP32-F=ConvAsm1x1U:2,16,2,32,1,2,2,1;ConvOclDirectFwd1x1:1,64,1,1,1,1,16,2048,0;ConvActivAsm1x1U:1,16,1,64,2,3
960-7-7-1x1-128-7-7-16-0x0-1x1-1x1-0-NCHW-FP16-W=ConvAsmBwdWrW1x1:2,8,2,8,2,1,2,2,0,1
3-227-227-7x7-64-114-114-256-3x3-2x2-1x1-0-NCHW-FP32-F=ConvOclDirectFwd:16,16,16,32,1,2,8,1,2
704-360-458-1x1-896-360-458-1-0x0-1x1-1x1-0-NCHW-FP32-F=ConvOclDirectFwd1x1:1,64,1,1,1,1,16,2048,0
128-14-14-1x1-992-14-14-32-0x0-1x1-1x1-0-NCHW-FP32-F=ConvAsm1x1U:2,16,2,64,3,2,2,1;ConvOclDirectFwd1x1:1,64,1,1,1,0,64,2048,0
320-8-8-1x1-1280-8-8-64-0x0-1x1-1x1-0-NCHW-FP32-W=ConvAsmBwdWrW1x1:1,16,2,8,4,1,1,4,0,1
736-23-396-1x1-1584-23-396-8-0x0-1x1-1x1-0-NCHW-FP32-B=ConvOclDirectFwd1x1:1,256,1,1,0,4,16,8,0
1056-39-535-1x1-19-39-535-8-0x0-1x1-1x1-0-NCHW-FP32-F=ConvOclDirectFwd1x1:1,256,1,1,0,1,16,4,0
160-7-7-1x1-832-7-7-1-0x0-1x1-1x1-0-NCHW-FP32-W=ConvAsmBwdWrW1x1:1,16,2,2,4,1,1,4,0,2
48-35-35-1x1-192-35-35-64-0x0-1x1-1x1-0-NCHW-FP16-B=ConvAsm1x1U:1,16,2,64,1,2,1,2;ConvOclDirectFwd1x1:1,64,1,1,0,1,32,4,0
192-28-28-3x3-128-28-28-128-1x1-1x1-1x1-0-NCHW-FP16-W=ConvAsmBwdWrW3x3:0,0,8,2,2,1
352-457-85-1x1-1440-457-85-2-0x0-1x1-1x1-0-NCHW-FP32-B=ConvOclDirectFwd1x1:1,256,1,1,0,1,32,4,0
800-518-169-1x1-992-518-169-6-0x0-1x1-1x1-0-NCHW-FP32-B=ConvOclDirectFwd1x1:1,256,1,1,0,2,32,4,0
768-7-7-1x1-128-7-7-128-0x0-1x1-1x1-0-NCHW-FP16-W=ConvAsmBwdWrW1x1:2,8,2,8,2,1,2,4,0,1
256-14-14-1x1-512-28-28-64-0x0-2x2-1x1-0-NCHW-FP32-B=ConvAsm1x1U:1,32,1,32,2,1,2,2;ConvOclDirectFwd1x1:1,256,1,1,0,2,32,4,0
416-14-14-1x1-128-14-14-64-0x0-1x1-1x1-0-NCHW-FP32-F=ConvAsm1x1U:4,16,4,64,1,2,1,1;ConvOclDirectFwd1x1:1,64,1,1,1,1,16,2048,0
192-28-28-1x1-192-28-28-16-0x0-1x1-1x1-0-NCHW-FP32-W=ConvAsmBwdWrW1x1:2,8,4,4,4,2,2,4,0,1
1024-15-15-1x1-512-15-15-256-0x0-1x1-1x1-0-NCHW-FP32-B=ConvAsm1x1U:1,32,2,16,1,1,1,1;ConvOclDirectFwd1x1:1,256,1,1,0,1,32,4,0
1024-15-15-1x1-1024-15-15-32-0x0-1x1-1x1-0-NCHW-FP32-W=ConvAsmBwdWrW1x1:1,16,4,8,4,1,1,4,0,2
58-70-911-1x1-116-70-911-32-0x0-1x1-1x1-0-NCHW-FP32-W=ConvAsmBwdWrW1x1:4,4,4,4,2,1,2,4,0,1
32-14-14-1x1-528-14-14-256-0x0-1x1-1x1-0-NCHW-FP32-B=ConvAsm1x1U:1,16,1,64,1,2,2,1;ConvOclDirectFwd1x1:1,256,1,1,0,4,16,8,0
544-7-7-1x1-128-7-7-256-0x0-1x1-1x1-0-NCHW-FP16-B=ConvAsm1x1U:1,16,2,32,1,2,2,2;ConvOclDirectFwd1x1:8,64,8,8,0,1,16,4,1
2160-166-252-1x1-8-166-252-1-0x0-1x1-1x1-0-NCHW-FP32-F=ConvOclDirectFwd1x1:1,256,1,1,0,4,16,4,0
128-14-14-1x1-896-14-14-64-0x0-1x1-1x1-0-NCHW-FP16-B=ConvAsm1x1U:1,16,2,16,1,2,1,4;ConvOclDirectFwd1x1:1,256,1,1,0,4,16,4,0
256-17-17-3x3-224-35-35-128-0x0-2x2-1x1-0-NCHW-FP32-B=ConvOclDirectFwd:16,16,16,16,1,1,4,1,1
1000-672-19-1x1-58-672-19-32-0x0-1x1-1x1-0-NCHW-FP32-B=ConvOclDirectFwd1x1:1,256,1,1,0,4,16,4,0
256-29-29-3x3-256-29-29-1-1x1-1x1-1x1-0-NCHW-FP32-B_g32=ConvOclDirectFwd:16,16,16,16,1,1,4,2,1
384-604-153-1x1-448-604-153-4-0x0-1x1-1x1-0-NCHW-FP32-F=ConvOclDirectFwd1x1:1,64,1,1,1,0,32,2048,0
192-56-56-1x1-384-56-56-16-0x0-1x1-1x1-0-NCHW-FP32-W=ConvAsmBwdWrW1x1:2,8,2,8,8,1,2,4,0,1
448-9-176-1x1-144-9-176-128-0x0-1x1-1x1-0-NCHW-FP32-F=ConvAsm1x1U:3,32,6,16,1,1,1,1;ConvOclDirectFwd1x1:1,64,1,1,1,1,32,2048,0
992-14-14-1x1-128-14-14-64-0x0-1x1-1x1-0-NCHW-FP32-B=ConvAsm1x1U:4,32,7,32,1,1,2,1;ConvOclDirectFwd1x1:1,64,1,1,0,4,16,4,0
2048-7-7-1x1-1024-7-7-8-0x0-1x1-1x1-0-NCHW-FP32-F=ConvAsm1x1U:2,8,2,32,4,2,4,2;ConvOclDirectFwd1x1:1,64,1,1,1,0,16,2048,0
48-287-32-1x1-336-287-32-1-0x0-1x1-1x1-0-NCHW-FP32-W=ConvAsmBwdWrW1x1:4,4,4,2,4,1,1,4,0,2
19-132-728-1x1-144-132-728-1-0x0-1x1-1x1-0-NCHW-FP32-W=ConvAsmBwdWrW1x1:4,4,2,4,2,1,1,4,0,3
128-7-7-1x1-576-7-7-32-0x0-1x1-1x1-0-NCHW-FP16-B=ConvAsm1x1U:1,16,2,32,1,2,2,2;ConvOclDirectFwd1x1:1,64,1,1,0,1,8,4,0
1024-15-15-1x1-512-15-15-2-0x0-1x1-1x1-0-NCHW-FP32-B=ConvAsm1x1U:1,8,1,32,1,4,2,8;ConvOclDirectFwd1x1:1,128,1,1,0,1,4,4,0
512-14-14-1x1-128-14-14-64-0x0-1x1-1x1-0-NCHW-FP16-F=ConvAsm1x1U:2,8,4,64,1,4,2,2;ConvOclDirectFwd1x1:1,128,1,1,0,4,8,4,0
544-310-139-1x1-96-310-139-16-0x0-1x1-1x1-0-NCHW-FP32-B=ConvOclDirectFwd1x1:1,256,1,1,0,2,32,4,0
48-91-564-1x1-960-91-564-6-0x0-1x1-1x1-0-NCHW-FP32-B=ConvOclDirectFwd1x1:1,128,1,1,0,2,32,4,0
232-7-7-1x1-232-7-7-16-0x0-1x1-1x1-0-NCHW-FP32-B=ConvAsm1x1U:1,8,1,64,1,4,2,4;ConvOclDirectFwd1x1:1,256,1,1,0,1,16,4,0
240-7-7-3x3-240-7-7-2-1x1-1x1-1x1-0-NCHW-FP16-B=ConvOclDirectFwd:8,8,8,8,1,1,1,4,2
128-14-14-1x1-320-14-14-256-0x0-1x1-1x1-0-NCHW-FP32-B=ConvAsm1x1U:1,32,1,32,2,1,2,2;ConvOclDirectFwd1x1:1,256,1,1,0,1,32,4,0
512-14-14-3x3-512-28-28-6-1x1-2x2-1x1-0-NCHW-FP32-W_g32=ConvOclBwdWrW2<1>:1,7,8,1,7;ConvOclBwdWrW2<2>:1,7,8,1,7;ConvOclBwdWrW2<4>:1,7,8,1,7;ConvAsmBwdWrW3x3:0,0,16,4,5,1
128-54-54-1x1-16-54-54-512-0x0-1x1-1x1-0-NCHW-FP16-B=ConvAsm1x1U:3,8,6,64,1,2,2,2;ConvOclDirectFwd1x1:1,256,1,1,0,2,16,4,0
192-28-28-1x1-128-28-28-256-0x0-1x1-1x1-0-NCHW-FP16-B=ConvAsm1x1U:1,16,2,16,1,2,1,4;ConvOclDirectFwd1x1:1,256,1,1,0,4,16,4,0
58-392-29-1x1-736-392-29-6-0x0-1x1-1x1-0-NCHW-FP32-F=ConvOclDirectFwd1x1:1,256,1,1,0,2,16,4,0
64-56-56-3x3-64-56-56-1-1x1-1x1-1x1-0-NCHW-FP16-B=ConvOclDirectFwd:16,16,16,16,1,1,4,4,1
32-14-14-1x1-528-14-14-128-0x0-1x1-1x1-0-NCHW-FP32-B=ConvAsm1x1U:1,16,1,32,2,2,2,2;ConvOclDirectFwd1x1:1,256,1,1,0,2,16,4,0
336-267-87-1x1-4-267-87-4-0x0-1x1-1x1-0-NCHW-FP32-F=ConvOclDirectFwd1x1:1,256,1,1,0,1,16,8,0
288-35-35-1x1-64-35-35-128-0x0-1x1-1x1-0-NCHW-FP16-F=ConvAsm1x1U:2,8,4,64,1,4,1,4;ConvOclDirectFwd1x1:1,64,1,1,0,1,16,8,0
128-14-14-1x1-800-14-14-64-0x0-1x1-1x1-0-NCHW-FP16-F=ConvAsm1x1U:1,8,2,64,2,4,1,2;ConvOclDirectFwd1x1:1,128,1,1,0,4,8,4,0
480-14-14-1x1-64-14-14-64-0x0-1x1-1x1-0-NCHW-FP16-F=ConvAsm1x1U:1,8,2,16,2,4,1,8;ConvOclDirectFwd1x1:1,64,1,1,0,4,8,4,0
928-267-201-1x1-2-267-201-1-0x0-1x1-1x1-0-NCHW-FP32-F=ConvOclDirectFwd1x1:1,256,1,1,0,1,16,8,0
80-298-492-1x1-1776-298-492-2-0x0-1x1-1x1-0-NCHW-FP32-B=ConvOclDirectFwd1x1:1,128,1,1,0,4,16,8,0
64-55-55-11x11-3-224-224-16-2x2-4x4-1x1-0-NCHW-FP32-W=ConvOclBwdWrW2<1>:3,11,3,3,11;ConvOclBwdWrW2<2>:3,11,3,3,11;ConvOclBwdWrW2<4>:3,11,3,3,11;ConvOclBwdWrW2<8>:3,7,3,3,11;ConvOclBwdWrW2<16>:8,8,1,3,11
1696-549-26-1x1-192-549-26-2-0x0-1x1-1x1-0-NCHW-FP32-F=ConvOclDirectFwd1x1:1,64,1,1,1,0,32,2048,0
116-111-20-1x1-384-111-20-64-0x0-1x1-1x1-0-NCHW-FP32-W=ConvAsmBwdWrW1x1:4,4,8,4,4,1,2,4,0,0
192-847-53-1x1-16-847-53-16-0x0-1x1-1x1-0-NCHW-FP32-F=ConvOclDirectFwd1x1:1,64,1,1,1,1,64,256,0
704-275-89-1x1-576-275-89-1-0x0-1x1-1x1-0-NCHW-FP32-B=ConvOclDirectFwd1x1:1,128,1,1,0,1,32,4,0
48-35-35-5x5-64-35-35-1-2x2-1x1-1x1-0-NCHW-FP32-F=ConvOclDirectFwd:16,16,16,32,1,2,2,4,1;ConvOclDirectFwdFused:8,32,16,32,2,1,2,4,1
480-7-7-1x1-120-7-7-32-0x0-1x1-1x1-0-NCHW-FP16-B_g3=ConvOclDirectFwd:8,8,8,8,1,1,4,4,2
32-147-147-3x3-64-147-147-128-1x1-1x1-1x1-0-NCHW-FP16-F=ConvOclDirectFwd:16,16,32,32,2,2,8,2,1;ConvOclDirectFwdFused:16,16,32,32,2,2,8,4,1
864-124-490-1x1-928-124-490-8-0x0-1x1-1x1-0-NCHW-FP32-F=ConvOclDirectFwd1x1:1,64,1,1,1,1,64,2048,0
128-28-28-1x1-192-28-28-64-0x0-1x1-1x1-0-NCHW-FP32-F=ConvAsm1x1U:1,16,1,32,3,2,2,4;ConvOclDirectFwd1x1:1,64,1,1,1,4,16,2048,0
256-15-15-3x3-256-29-29-48-1x1-2x2-1x1-0-NCHW-FP32-W=ConvAsmBwdWrW3x3:0,0,8,8,4,1
60-28-28-3x3-60-14-14-8-1x1-2x2-1x1-0-NCHW-FP32-F=ConvOclDirectFwd:16,16,16,16,1,1,4,4,2
512-7-7-1x1-2048-7-7-8-0x0-1x1-1x1-0-NCHW-FP32-F=ConvAsm1x1U:4,8,4,16,2,4,2,2;ConvOclDirectFwd1x1:1,64,1,1,1,1,16,2048,0;ConvActivAsm1x1U:2,16,2,32,4,2
256-13-13-3x3-256-13-13-4-1x1-1x1-1x1-0-NCHW-FP16-B=ConvOclDirectFwd:16,16,16,16,1,1,4,4,2
96-54-54-1x1-16-54-54-128-0x0-1x1-1x1-0-NCHW-FP16-W=ConvAsmBwdWrW1x1:4,4,2,1,4,1,4,4,0,3
544-100-224-1x1-1-100-224-12-0x0-1x1-1x1-0-NCHW-FP32-B=ConvOclDirectFwd1x1:1,256,1,1,0,1,16,4,0
2048-7-7-1x1-512-7-7-8-0x0-1x1-1x1-0-NCHW-FP16-B=ConvAsm1x1U:1,8,4,16,1,4,4,2;ConvOclDirectFwd1x1:1,128,1,1,0,1,8,8,0
320-17-17-3x3-320-8-8-16-0x0-2x2-1x1-0-NCHW-FP32-F=ConvOclDirectFwd:8,8,8,8,1,1,4,1,1
1104-192-483-1x1-1472-192-483-2-0x0-1x1-1x1-0-NCHW-FP32-B=ConvOclDirectFwd1x1:1,64,1,1,0,2,32,4,0
32-64-128-5x5-64-64-128-1-2x2-1x1-1x1-0-NCHW-FP32-F=ConvOclDirectFwd:8,32,16,32,2,1,4,4,1;ConvOclDirectFwdFused:8,32,16,32,2,1,4,4,1
384-28-28-1x1-128-28-28-512-0x0-1x1-1x1-0-NCHW-FP32-B=ConvAsm1x1U:1,32,1,16,2,1,1,4;ConvOclDirectFwd1x1:1,256,1,1,0,1,32,4,0
640-7-7-1x1-128-7-7-32-0x0-1x1-1x1-0-NCHW-FP16-B=ConvAsm1x1U:1,8,2,32,1,4,4,2;ConvOclDirectFwd1x1:1,64,1,1,0,1,4,4,0
64-54-54-3x3-3-108-108-64-1x1-2x2-1x1-0-NCHW-FP32-B=ConvOclDirectFwd:8,8,32,32,4,4,2,2,2
1872-14-14-1x1-192-14-14-16-0x0-1x1-1x1-0-NCHW-FP16-F=ConvAsm1x1U:2,8,4,64,1,4,4,2;ConvOclDirectFwd1x1:1,64,1,1,0,2,8,4,0
128-57-57-1x1-64-57-57-256-0x0-1x1-1x1-0-NCHW-FP32-B=ConvAsm1x1U:1,16,1,64,1,2,1,4;ConvOclDirectFwd1x1:1,128,1,1,0,1,32,4,0
160-11-656-1x1-960-11-656-1-0x0-1x1-1x1-0-NCHW-FP32-W=ConvAsmBwdWrW1x1:2,8,8,4,4,1,1,4,0,1
256-57-57-1x1-128-57-57-32-0x0-1x1-1x1-0-NCHW-FP32-W=ConvAsmBwdWrW1x1:4,4,4,4,8,1,2,4,0,1
128-56-56-1x1-160-56-56-256-0x0-1x1-1x1-0-NCHW-FP32-W=ConvAsmBwdWrW1x1:2,8,4,8,2,1,4,4,0,1
352-4-158-1x1-672-4-158-4-0x0-1x1-1x1-0-NCHW-FP32-F=ConvAsm1x1U:4,8,7,32,1,2,1,4;ConvOclDirectFwd1x1:1,64,1,1,1,0,16,2048,0
128-56-56-1x1-128-56-56-256-0x0-1x1-1x1-0-NCHW-FP32-B=ConvAsm1x1U:1,32,1,64,1,1,1,2;ConvOclDirectFwd1x1:1,128,1,1,0,2,32,4,0
512-7-7-1x1-128-7-7-16-0x0-1x1-1x1-0-NCHW-FP16-W=ConvAsmBwdWrW1x1:4,4,4,4,2,2,1,4,0,0
116-501-56-1x1-3-501-56-2-0x0-1x1-1x1-0-NCHW-FP32-B=ConvAsm1x1U:4,1,4,4,1,1,4,2;ConvOclDirectFwd1x1:1,256,1,1,0,4,4,4,0
128-14-14-1x1-512-14-14-512-0x0-1x1-1x1-0-NCHW-FP16-B=ConvAsm1x1U:1,16,2,16,1,2,1,4;ConvOclDirectFwd1x1:1,256,1,1,0,2,32,4,0
240-7-7-3x3-240-7-7-2-1x1-1x1-1x1-0-NCHW-FP16-W=ConvAsmBwdWrW3x3:0,0,8,2,1,1
48-14-14-5x5-512-14-14-32-2x2-1x1-1x1-0-NCHW-FP32-W=ConvOclBwdWrW2<1>:1,7,1,8,7;ConvOclBwdWrW2<2>:1,7,1,8,7;ConvOclBwdWrW2<4>:1,9,1,8,7;ConvOclBwdWrW2<8>:1,7,1,8,7;ConvOclBwdWrW2<16>:1,7,1,8,7
1920-312-346-1x1-3-312-346-1-0x0-1x1-1x1-0-NCHW-FP32-F=ConvOclDirectFwd1x1:1,128,1,1,0,2,16,8,0
288-617-38-1x1-64-617-38-64-0x0-1x1-1x1-0-NCHW-FP32-B=ConvOclDirectFwd1x1:1,128,1,1,0,1,32,4,0
704-854-191-1x1-288-854-191-1-0x0-1x1-1x1-0-NCHW-FP32-F=ConvOclDirectFwd1x1:1,64,1,1,1,0,64,2048,0
704-364-56-1x1-736-364-56-16-0x0-1x1-1x1-0-NCHW-FP32-W=ConvAsmBwdWrW1x1:2,8,4,8,4,1,2,4,0,0
96-54-54-1x1-16-54-54-512-0x0-1x1-1x1-0-NCHW-FP32-F=ConvAsm1x1U:2,8,4,64,4,1,1,2;ConvOclDirectFwd1x1:1,64,1,1,1,1,32,2048,0
24-28-28-1x1-58-28-28-32-0x0-1x1-1x1-0-NCHW-FP32-F=ConvAsm1x1U:1,8,1,32,4,1,1,2;ConvOclDirectFwd1x1:1,256,1,1,0,1,8,8,0
96-71-71-3x3-64-73-73-4-0x0-1x1-1x1-0-NCHW-FP16-B=ConvOclDirectFwd:8,16,16,32,2,2,8,4,2
192-35-35-1x1-48-35-35-256-0x0-1x1-1x1-0-NCHW-FP16-F=ConvAsm1x1U:2,16,4,64,1,2,1,1;ConvOclDirectFwd1x1:1,256,1,1,0,1,16,8,0
352-28-28-1x1-128-28-28-16-0x0-1x1-1x1-0-NCHW-FP16-F=ConvAsm1x1U:1,8,2,32,2,4,2,2;ConvOclDirectFwd1x1:1,64,1,1,0,4,16,4,0
1184-789-6-1x1-224-789-6-16-0x0-1x1-1x1-0-NCHW-FP32-F=ConvOclDirectFwd1x1:1,64,1,1,1,4,64,2048,0
16-207-180-1x1-544-207-180-2-0x0-1x1-1x1-0-NCHW-FP32-F=ConvOclDirectFwd1x1:1,64,1,1,1,1,64,2048,0
58-204-654-1x1-1088-204-654-1-0x0-1x1-1x1-0-NCHW-FP32-B=ConvOclDirectFwd1x1:1,256,1,1,0,4,16,4,0
80-217-428-1x1-896-217-428-6-0x0-1x1-1x1-0-NCHW-FP32-F=ConvOclDirectFwd1x1:16,16,32,32,1,0,32,128,1
256-14-14-1x1-1024-14-14-32-0x0-1x1-1x1-0-NCHW-FP32-F=ConvAsm1x1U:4,8,4,64,1,4,1,4;ConvOclDirectFwd1x1:1,64,1,1,1,1,32,2048,0;ConvActivAsm1x1U:2,16,2,64,3,4
24-56-56-1x1-58-56-56-1024-0x0-1x1-1x1-0-NCHW-FP32-F=ConvAsm1x1U:1,8,1,16,1,1,1,1;ConvOclDirectFwd1x1:1,64,1,1,0,1,16,4,0
16-200-438-1x1-480-200-438-4-0x0-1x1-1x1-0-NCHW-FP32-B=ConvOclDirectFwd1x1:1,128,1,1,0,4,16,8,0
128-28-28-1x1-512-28-28-256-0x0-1x1-1x1-0-NCHW-FP32-B=ConvAsm1x1U:1,16,1,32,2,2,1,4;ConvOclDirectFwd1x1:1,64,1,1,0,2,32,4,0
512-8-8-3x3-512-15-15-4-1x1-2x2-1x1-0-NCHW-FP32-W=ConvAsmBwdWrW3x3:0,0,8,8,8,1
3-642-344-1x1-58-642-344-32-0x0-1x1-1x1-0-NCHW-FP32-W=ConvAsmBwdWrW1x1:4,4,2,1,2,1,4,4,0,2
480-14-14-1x1-120-14-14-32-0x0-1x1-1x1-0-NCHW-FP16-B_g3=ConvOclDirectFwd:16,16,16,16,1,1,8,2,1
256-28-28-3x3-512-28-28-64-1x1-1x1-1x1-0-NCHW-FP16-W=ConvAsmBwdWrW3x3:0,1,8,4,2,1
256-56-56-1x1-64-56-56-1-0x0-1x1-1x1-0-NCHW-FP32-B=ConvAsm1x1U:1,8,1,64,1,4,2,2;ConvOclDirectFwd1x1:1,64,1,1,0,1,4,8,0
384-64-128-1x1-832-64-128-1-0x0-1x1-1x1-0-NCHW-FP32-B=ConvOclDirectFwd1x1:1,256,1,1,0,2,16,4,0
192-14-14-1x1-512-14-14-16-0x0-1x1-1x1-0-NCHW-FP32-B=ConvAsm1x1U:1,16,1,32,1,2,1,4;ConvOclDirectFwd1x1:1,256,1,1,0,4,16,4,0
116-28-28-1x1-116-28-28-8-0x0-1x1-1x1-0-NCHW-FP32-W=ConvAsmBwdWrW1x1:4,4,2,4,4,1,4,4,0,0
160-28-28-1x1-128-28-28-16-0x0-1x1-1x1-0-NCHW-FP16-B=ConvAsm1x1U:1,8,2,16,1,4,2,2;ConvOclDirectFwd1x1:1,64,1,1,0,4,16,4,0
192-28-28-1x1-96-28-28-512-0x0-1x1-1x1-0-NCHW-FP32-F=ConvAsm1x1U:3,16,5,32,1,2,1,1;ConvOclDirectFwd1x1:1,64,1,1,1,4,16,2048,0;ConvActivAsm1x1U:1,32,3,16,2,1
144-930-14-1x1-32-930-14-4-0x0-1x1-1x1-0-NCHW-FP32-B=ConvAsm1x1U:1,16,2,64,1,1,1,1;ConvOclDirectFwd1x1:1,64,1,1,0,2,16,4,0
232-348-263-1x1-288-348-263-16-0x0-1x1-1x1-0-NCHW-FP32-F=ConvOclDirectFwd1x1:1,128,1,1,0,2,32,4,0
480-198-543-1x1-1024-198-543-1-0x0-1x1-1x1-0-NCHW-FP32-B=ConvOclDirectFwd1x1:1,256,1,1,0,2,32,4,0
96-14-14-3x3-208-14-14-16-1x1-1x1-1x1-0-NCHW-FP16-F=ConvOclDirectFwd:8,16,16,16,2,1,8,4,2;ConvOclDirectFwdFused:8,16,16,16,2,1,8,4,2
352-54-392-1x1-336-54-392-6-0x0-1x1-1x1-0-NCHW-FP32-B=ConvOclDirectFwd1x1:1,64,1,1,0,4,16,4,0
224-14-14-3x3-112-14-14-32-1x1-1x1-1x1-0-NCHW-FP16-W=ConvAsmBwdWrW3x3:0,0,8,2,3,4
192-56-56-1x1-288-56-56-16-0x0-1x1-1x1-0-NCHW-FP16-B=ConvAsm1x1U:1,16,2,64,1,2,2,2;ConvOclDirectFwd1x1:1,256,1,1,0,4,16,4,0
64-114-114-7x7-3-227-227-256-3x3-2x2-1x1-0-NCHW-FP32-B=ConvOclDirectFwd:16,8,16,16,1,2,1,1,1
64-27-27-5x5-192-27-27-32-2x2-1x1-1x1-0-NCHW-FP16-F=ConvOclDirectFwd:16,16,32,32,2,2,8,1,2;ConvOclDirectFwdFused:16,16,32,32,2,2,8,1,2
1024-15-15-1x1-512-15-15-48-0x0-1x1-1x1-0-NCHW-FP32-W=ConvAsmBwdWrW1x1:1,16,4,8,4,1,1,4,0,1
896-75-614-1x1-4-75-614-1-0x0-1x1-1x1-0-NCHW-FP32-B=ConvOclDirectFwd1x1:1,64,1,1,0,2,16,8,0
128-14-14-1x1-800-14-14-64-0x0-1x1-1x1-0-NCHW-FP16-W=ConvAsmBwdWrW1x1:2,8,4,8,2,1,2,2,0,1
256-29-29-3x3-256-29-29-48-1x1-1x1-1x1-0-NCHW-FP32-B_g32=ConvOclDirectFwd:16,16,16,32,1,2,8,1,1
3-224-224-3x3-24-112-112-1024-1x1-2x2-1x1-0-NCHW-FP32-F=ConvOclDirectFwd:16,16,16,16,1,1,8,1,2
1872-584-76-1x1-1104-584-76-6-0x0-1x1-1x1-0-NCHW-FP32-F=ConvOclDirectFwd1x1:1,64,1,1,1,1,64,2048,0
1104-7-7-1x1-192-7-7-16-0x0-1x1-1x1-0-NCHW-FP16-F=ConvAsm1x1U:1,8,2,32,1,4,4,1;ConvOclDirectFwd1x1:1,64,1,1,0,1,4,8,0
1296-811-59-1x1-928-811-59-1-0x0-1x1-1x1-0-NCHW-FP32-F=ConvOclDirectFwd1x1:1,64,1,1,1,4,64,2048,0
64-56-56-3x3-64-56-56-32-1x1-1x1-1x1-0-NCHW-FP32-W=ConvAsmBwdWrW3x3:0,0,16,4,3,2
240-451-548-1x1-58-451-548-8-0x0-1x1-1x1-0-NCHW-FP32-F=ConvOclDirectFwd1x1:1,256,1,1,0,4,16,4,0
128-504-148-1x1-32-504-148-48-0x0-1x1-1x1-0-NCHW-FP32-W=ConvAsmBwdWrW1x1:4,4,4,2,2,1,2,4,0,1
1024-25-815-1x1-1344-25-815-1-0x0-1x1-1x1-0-NCHW-FP32-B=ConvOclDirectFwd1x1:1,256,1,1,0,1,32,4,0
320-7-7-3x3-160-7-7-256-1x1-1x1-1x1-0-NCHW-FP16-W=ConvAsmBwdWrW3x3:0,0,8,2,7,4
58-28-28-1x1-24-28-28-32-0x0-1x1-1x1-0-NCHW-FP16-W=ConvAsmBwdWrW1x1:4,4,2,1,2,1,4,4,0,1
128-17-17-1x1-1024-17-17-128-0x0-1x1-1x1-0-NCHW-FP16-W=ConvAsmBwdWrW1x1:2,8,8,8,2,2,2,4,0,1
544-147-557-1x1-58-147-557-8-0x0-1x1-1x1-0-NCHW-FP32-B=ConvOclDirectFwd1x1:1,256,1,1,0,1,16,4,0
384-13-13-3x3-256-13-13-16-1x1-1x1-1x1-0-NCHW-FP16-B=ConvOclDirectFwd:8,16,16,16,2,1,8,1,2
16-2-104-1x1-192-2-104-48-0x0-1x1-1x1-0-NCHW-FP32-F=ConvAsm1x1U:1,16,1,16,2,2,1,2;ConvOclDirectFwd1x1:1,64,1,1,1,4,16,64,0
240-151-304-1x1-80-151-304-1-0x0-1x1-1x1-0-NCHW-FP32-F=ConvOclDirectFwd1x1:1,64,1,1,1,4,64,2048,0
1248-14-14-1x1-192-14-14-16-0x0-1x1-1x1-0-NCHW-FP16-F=ConvAsm1x1U:2,8,4,64,1,4,4,2;ConvOclDirectFwd1x1:1,64,1,1,0,4,8,4,0
160-14-14-1x1-528-14-14-512-0x0-1x1-1x1-0-NCHW-FP16-B=ConvAsm1x1U:1,16,2,16,1,2,1,2;ConvOclDirectFwd1x1:8,64,16,16,0,2,16,4,1
224-56-56-1x1-128-56-56-32-0x0-1x1-1x1-0-NCHW-FP32-F=ConvAsm1x1U:1,16,1,64,2,2,1,4;ConvOclDirectFwd1x1:1,64,1,1,1,0,16,2048,0
832-7-7-1x1-48-7-7-128-0x0-1x1-1x1-0-NCHW-FP16-F=ConvAsm1x1U:1,8,2,32,1,4,4,1;ConvOclDirectFwd1x1:1,128,1,1,0,1,8,4,0
704-7-7-1x1-128-7-7-128-0x0-1x1-1x1-0-NCHW-FP16-F=ConvAsm1x1U:2,8,4,16,1,4,4,1;ConvOclDirectFwd1x1:1,64,1,1,0,1,8,4,0
128-56-56-1x1-64-56-56-2-0x0-1x1-1x1-0-NCHW-FP32-W=ConvAsmBwdWrW1x1:4,4,2,2,2,1,2,4,0,1
1776-29-887-1x1-416-29-887-4-0x0-1x1-1x1-0-NCHW-FP32-F=ConvOclDirectFwd1x1:1,64,1,1,1,0,64,2048,0
3-1021-274-1x1-112-1021-274-8-0x0-1x1-1x1-0-NCHW-FP32-F=ConvOclDirectFwd1x1:1,256,1,1,0,1,16,4,0
288-14-14-3x3-144-14-14-32-1x1-1x1-1x1-0-NCHW-FP16-W=ConvAsmBwdWrW3x3:0,1,8,2,2,4
736-14-14-1x1-128-14-14-512-0x0-1x1-1x1-0-NCHW-FP16-F=ConvAsm1x1U:1,16,2,16,2,2,1,4;ConvOclDirectFwd1x1:1,64,1,1,0,2,16,4,0
144-777-681-1x1-64-777-681-1-0x0-1x1-1x1-0-NCHW-FP32-F=ConvOclDirectFwd1x1:1,64,1,1,1,4,64,2048,0
128-64-128-5x5-32-64-128-1-2x2-1x1-1x1-0-NCHW-FP32-B=ConvOclDirectFwd:8,32,16,32,2,1,2,4,1
1776-184-291-1x1-384-184-291-4-0x0-1x1-1x1-0-NCHW-FP32-F=ConvOclDirectFwd1x1:1,64,1,1,1,1,32,2048,0
864-73-511-1x1-896-73-511-16-0x0-1x1-1x1-0-NCHW-FP32-F=ConvOclDirectFwd1x1:1,64,1,1,1,1,16,2048,0
896-7-7-1x1-128-7-7-64-0x0-1x1-1x1-0-NCHW-FP32-B=ConvAsm1x1U:2,16,2,32,1,2,4,1;ConvOclDirectFwd1x1:1,128,1,1,0,1,8,4,0
480-14-14-1x1-120-14-14-2-0x0-1x1-1x1-0-NCHW-FP32-B_g3=ConvOclDirectFwd:8,8,8,8,1,1,2,4,2
256-445-467-1x1-704-445-467-1-0x0-1x1-1x1-0-NCHW-FP32-F=ConvOclDirectFwd1x1:1,64,1,1,1,1,32,2048,0
1408-74-575-1x1-48-74-575-1-0x0-1x1-1x1-0-NCHW-FP32-F=ConvOclDirectFwd1x1:1,64,1,1,1,4,32,256,0
1376-688-75-1x1-960-688-75-2-0x0-1x1-1x1-0-NCHW-FP32-F=ConvOclDirectFwd1x1:1,64,1,1,1,1,16,2048,0
704-14-14-1x1-128-14-14-256-0x0-1x1-1x1-0-NCHW-FP16-B=ConvAsm1x1U:1,16,2,16,1,2,2,2;ConvOclDirectFwd1x1:1,128,1,1,0,2,32,8,0
192-28-28-1x1-64-28-28-2-0x0-1x1-1x1-0-NCHW-FP32-F=ConvAsm1x1U:1,8,1,32,1,4,2,2;ConvOclDirectFwd1x1:1,64,1,1,1,0,16,2048,0;ConvActivAsm1x1U:1,16,1,32,1,4
1536-8-8-1x1-256-8-8-128-0x0-1x1-1x1-0-NCHW-FP16-F=ConvAsm1x1U:1,8,2,32,2,4,2,4;ConvOclDirectFwd1x1:1,64,1,1,0,2,8,4,0
2048-14-14-1x1-512-14-14-256-0x0-1x1-1x1-0-NCHW-FP32-W=ConvAsmBwdWrW1x1:1,16,4,8,4,1,1,4,0,1
32-35-35-1x1-192-35-35-1-0x0-1x1-1x1-0-NCHW-FP32-W=ConvAsmBwdWrW1x1:4,4,2,1,2,1,1,4,0,1
352-847-728-1x1-80-847-728-2-0x0-1x1-1x1-0-NCHW-FP32-B=ConvOclDirectFwd1x1:1,256,1,1,0,4,16,4,0
448-8-8-1x1-1280-8-8-8-0x0-1x1-1x1-0-NCHW-FP32-B=ConvAsm1x1U:1,16,1,64,2,2,2,2;ConvOclDirectFwd1x1:1,128,1,1,0,2,8,8,0
832-7-7-1x1-256-7-7-1-0x0-1x1-1x1-0-NCHW-FP16-F=ConvAsm1x1U:1,8,2,16,1,4,4,1;ConvOclDirectFwd1x1:1,64,1,1,0,1,4,8,0
60-28-28-3x3-60-14-14-256-1x1-2x2-1x1-0-NCHW-FP32-F=ConvOclDirectFwd:16,8,16,16,1,2,8,1,2
96-28-28-1x1-192-28-28-16-0x0-1x1-1x1-0-NCHW-FP32-B=ConvAsm1x1U:1,16,1,16,1,2,2,2;ConvOclDirectFwd1x1:1,64,1,1,0,2,16,4,0
256-335-256-1x1-608-335-256-4-0x0-1x1-1x1-0-NCHW-FP32-F=ConvOclDirectFwd1x1:1,64,1,1,1,4,64,256,0
256-13-13-3x3-256-13-13-2-1x1-1x1-1x1-0-NCHW-FP16-F=ConvOclDirectFwd:16,16,16,16,1,1,2,4,2
256-8-8-1x1-1536-8-8-16-0x0-1x1-1x1-0-NCHW-FP16-B=ConvAsm1x1U:1,16,2,32,1,2,2,4;ConvOclDirectFwd1x1:1,256,1,1,0,2,16,4,0
1024-7-7-1x1-464-7-7-64-0x0-1x1-1x1-0-NCHW-FP32-B=ConvAsm1x1U:1,16,1,64,2,2,4,1;ConvOclDirectFwd1x1:1,64,1,1,0,1,16,4,0
720-358-31-1x1-48-358-31-6-0x0-1x1-1x1-0-NCHW-FP32-F=ConvOclDirectFwd1x1:1,64,1,1,1,4,32,2048,0
464-692-99-1x1-352-692-99-16-0x0-1x1-1x1-0-NCHW-FP32-F=ConvOclDirectFwd1x1:1,64,1,1,1,0,64,2048,0
32-147-147-3x3-32-149-149-64-0x0-1x1-1x1-0-NCHW-FP32-B=ConvOclDirectFwd:16,16,16,32,1,2,8,4,2
320-884-147-1x1-912-884-147-4-0x0-1x1-1x1-0-NCHW-FP32-B=ConvOclDirectFwd1x1:1,256,1,1,0,2,16,4,0
512-14-14-3x3-512-14-14-16-1x1-1x1-1x1-0-NCHW-FP16-W=ConvAsmBwdWrW3x3:0,1,8,4,3,1
128-14-14-1x1-448-14-14-256-0x0-1x1-1x1-0-NCHW-FP16-W=ConvAsmBwdWrW1x1:4,4,8,4,4,2,2,2,0,1
736-482-238-1x1-896-482-238-1-0x0-1x1-1x1-0-NCHW-FP32-B=ConvOclDirectFwd1x1:1,64,1,1,0,2,32,4,0
960-147-261-1x1-832-147-261-2-0x0-1x1-1x1-0-NCHW-FP32-B=ConvOclDirectFwd1x1:1,128,1,1,0,1,32,4,0
512-442-531-1x1-320-442-531-4-0x0-1x1-1x1-0-NCHW-FP32-F=ConvOclDirectFwd1x1:1,64,1,1,1,4,32,2048,0
160-7-7-1x1-832-7-7-512-0x0-1x1-1x1-0-NCHW-FP16-W=ConvAsmBwdWrW1x1:1,16,2,8,2,1,4,2,0,2
1696-597-14-1x1-320-597-14-32-0x0-1x1-1x1-0-NCHW-FP32-F=ConvOclDirectFwd1x1:1,64,1,1,1,4,16,256,0
320-444-358-1x1-672-444-358-4-0x0-1x1-1x1-0-NCHW-FP32-F=ConvOclDirectFwd1x1:1,64,1,1,1,0,64,2048,0
416-376-327-1x1-912-376-327-1-0x0-1x1-1x1-0-NCHW-FP32-B=ConvOclDirectFwd1x1:1,256,1,1,0,4,16,4,0
256-35-35-1x1-64-35-35-64-0x0-1x1-1x1-0-NCHW-FP16-F=ConvAsm1x1U:2,8,4,64,1,4,1,4;ConvOclDirectFwd1x1:1,128,1,1,0,1,16,8,0
352-60-284-1x1-704-60-284-4-0x0-1x1-1x1-0-NCHW-FP32-B=ConvOclDirectFwd1x1:1,256,1,1,0,1,32,4,0
384-35-35-3x3-384-17-17-64-0x0-2x2-1x1-0-NCHW-FP32-F=ConvOclDirectFwd:32,8,32,32,1,4,8,1,2
320-273-479-1x1-704-273-479-1-0x0-1x1-1x1-0-NCHW-FP32-F=ConvOclDirectFwd1x1:1,64,1,1,1,4,32,2048,0
144-339-173-1x1-96-339-173-4-0x0-1x1-1x1-0-NCHW-FP32-W=ConvAsmBwdWrW1x1:4,4,4,4,4,1,2,4,0,1
640-125-18-1x1-544-125-18-8-0x0-1x1-1x1-0-NCHW-FP32-B=ConvAsm1x1U:4,16,6,64,1,2,1,2;ConvOclDirectFwd1x1:1,128,1,1,0,2,32,4,0
800-14-14-1x1-128-14-14-64-0x0-1x1-1x1-0-NCHW-FP16-F=ConvAsm1x1U:2,8,4,64,1,4,2,4;ConvOclDirectFwd1x1:1,64,1,1,0,2,16,4,0
512-14-14-1x1-144-14-14-128-0x0-1x1-1x1-0-NCHW-FP16-F=ConvAsm1x1U:2,8,4,64,1,4,1,2;ConvOclDirectFwd1x1:1,256,1,1,0,4,16,4,0
128-28-28-1x1-192-28-28-128-0x0-1x1-1x1-0-NCHW-FP16-W=ConvAsmBwdWrW1x1:4,4,8,1,8,2,2,4,0,1
64-27-27-1x1-256-27-27-16-0x0-1x1-1x1-0-NCHW-FP16-W=ConvAsmBwdWrW1x1:4,4,4,4,2,1,4,4,0,0
96-28-28-1x1-192-28-28-128-0x0-1x1-1x1-0-NCHW-FP16-W=ConvAsmBwdWrW1x1:4,4,4,1,8,1,4,4,0,2
232-486-556-1x1-8-486-556-1-0x0-1x1-1x1-0-NCHW-FP32-F=ConvOclDirectFwd1x1:1,128,1,1,0,4,16,8,0
80-528-119-1x1-736-528-119-2-0x0-1x1-1x1-0-NCHW-FP32-F=ConvOclDirectFwd1x1:16,16,32,32,1,0,32,128,1
32-27-27-3x3-128-27-27-512-1x1-1x1-1x1-0-NCHW-FP32-W=ConvAsmBwdWrW3x3:0,1,8,4,5,4
232-344-718-1x1-448-344-718-1-0x0-1x1-1x1-0-NCHW-FP32-B=ConvOclDirectFwd1x1:1,256,1,1,0,4,16,8,0
1312-128-236-1x1-448-128-236-12-0x0-1x1-1x1-0-NCHW-FP32-F=ConvOclDirectFwd1x1:1,64,1,1,1,0,32,2048,0
416-521-310-1x1-672-521-310-1-0x0-1x1-1x1-0-NCHW-FP32-F=ConvOclDirectFwd1x1:1,64,1,1,1,4,64,2048,0
54-268-454-1x1-240-268-454-2-0x0-1x1-1x1-0-NCHW-FP32-B=ConvOclDirectFwd1x1:1,256,1,1,0,4,16,4,0
640-312-374-1x1-32-312-374-2-0x0-1x1-1x1-0-NCHW-FP32-F=ConvOclDirectFwd1x1:1,64,1,1,1,1,64,2048,0
512-14-14-3x3-512-14-14-48-1x1-1x1-1x1-0-NCHW-FP32-F_g32=ConvOclDirectFwd:16,8,16,16,1,2,8,1,2
64-35-35-3x3-96-35-35-16-1x1-1x1-1x1-0-NCHW-FP16-F=ConvOclDirectFwd:16,8,16,16,1,2,8,1,1;ConvOclDirectFwdFused:16,8,16,16,1,2,8,2,2
128-28-28-1x1-512-28-28-64-0x0-1x1-1x1-0-NCHW-FP16-B=ConvAsm1x1U:1,16,2,32,1,2,1,4;ConvOclDirectFwd1x1:1,128,1,1,0,4,16,4,0
19-546-974-1x1-64-546-974-6-0x0-1x1-1x1-0-NCHW-FP32-B=ConvOclDirectFwd1x1:1,256,1,1,0,4,16,4,0
128-729-936-1x1-32-729-936-1-0x0-1x1-1x1-0-NCHW-FP32-B=ConvOclDirectFwd1x1:1,64,1,1,0,2,32,4,0
480-14-14-1x1-192-14-14-32-0x0-1x1-1x1-0-NCHW-FP16-F=ConvAsm1x1U:1,8,2,64,2,4,2,4;ConvOclDirectFwd1x1:1,128,1,1,0,4,8,4,0
48-35-35-1x1-256-35-35-256-0x0-1x1-1x1-0-NCHW-FP32-W=ConvAsmBwdWrW1x1:4,4,2,4,2,1,1,4,0,1
800-14-14-1x1-128-14-14-256-0x0-1x1-1x1-0-NCHW-FP16-B=ConvAsm1x1U:1,16,2,16,1,2,2,4;ConvOclDirectFwd1x1:1,256,1,1,0,4,16,4,0
1008-159-212-1x1-4-159-212-6-0x0-1x1-1x1-0-NCHW-FP32-F=ConvOclDirectFwd1x1:1,64,1,1,0,4,16,4,0
512-7-7-1x1-128-7-7-16-0x0-1x1-1x1-0-NCHW-FP16-F=ConvAsm1x1U:1,8,2,32,1,4,4,1;ConvOclDirectFwd1x1:1,64,1,1,0,1,4,4,0
64-112-112-7x7-3-224-224-32-3x3-2x2-1x1-0-NCHW-FP32-B=ConvOclDirectFwd:16,16,32,32,2,2,8,2,1
128-56-56-1x1-160-56-56-128-0x0-1x1-1x1-0-NCHW-FP32-W=ConvAsmBwdWrW1x1:2,8,2,8,4,1,4,4,0,3
256-13-13-3x3-256-13-13-8-1x1-1x1-1x1-0-NCHW-FP32-W=ConvAsmBwdWrW3x3:0,1,16,4,6,1
256-14-14-1x1-128-14-14-32-0x0-1x1-1x1-0-NCHW-FP32-F=ConvAsm1x1U:4,8,4,64,1,4,1,2;ConvOclDirectFwd1x1:1,64,1,1,1,0,16,2048,0
256-28-28-3x3-512-28-28-128-1x1-1x1-1x1-0-NCHW-FP32-W=ConvAsmBwdWrW3x3:0,1,8,4,6,1
1024-14-14-1x1-512-28-28-1-0x0-2x2-1x1-0-NCHW-FP16-B=ConvAsm1x1U:1,8,2,64,1,4,4,2;ConvOclDirectFwd1x1:1,256,1,1,0,1,4,8,0
2048-32-76-1x1-1088-32-76-32-0x0-1x1-1x1-0-NCHW-FP32-B=ConvOclDirectFwd1x1:1,128,1,1,0,2,32,4,0
64-224-224-3x3-3-224-224-64-1x1-1x1-1x1-0-NCHW-FP32-W=ConvAsmBwdWrW3x3:0,1,16,1,2,1
416-457-352-1x1-160-457-352-6-0x0-1x1-1x1-0-NCHW-FP32-F=ConvOclDirectFwd1x1:1,64,1,1,1,4,64,2048,0
128-14-14-1x1-768-14-14-512-0x0-1x1-1x1-0-NCHW-FP16-W=ConvAsmBwdWrW1x1:1,16,2,8,2,1,4,4,0,2
384-8-8-1x1-1536-8-8-16-0x0-1x1-1x1-0-NCHW-FP16-B=ConvAsm1x1U:1,16,2,32,1,2,2,4;ConvOclDirectFwd1x1:1,128,1,1,0,4,16,4,0
128-14-14-3x3-32-14-14-16-1x1-1x1-1x1-0-NCHW-FP16-B=ConvOclDirectFwd:16,16,16,16,1,1,2,4,2
64-35-35-1x1-384-35-35-32-0x0-1x1-1x1-0-NCHW-FP32-W=ConvAsmBwdWrW1x1:2,8,4,8,2,1,4,4,0,1
24-32-87-1x1-16-32-87-16-0x0-1x1-1x1-0-NCHW-FP32-B=ConvAsm1x1U:2,8,2,16,3,2,1,1;ConvOclDirectFwd1x1:1,128,1,1,0,1,8,4,0
1024-14-14-1x1-512-14-14-512-0x0-1x1-1x1-0-NCHW-FP16-F=ConvAsm1x1U:1,8,2,64,3,4,2,2;ConvOclDirectFwd1x1:1,128,1,1,0,4,16,4,0
3-224-224-3x3-24-112-112-16-1x1-2x2-1x1-0-NCHW-FP32-F=ConvOclDirectFwd:16,16,16,16,1,1,8,1,1
480-14-14-1x1-120-14-14-64-0x0-1x1-1x1-0-NCHW-FP32-F_g3=ConvOclDirectFwd:8,8,8,8,1,1,8,4,1
3-241-607-1x1-4-241-607-6-0x0-1x1-1x1-0-NCHW-FP32-B=ConvAsm1x1U:1,4,1,4,1,1,1,1;ConvOclDirectFwd1x1:1,256,1,1,0,1,4,4,0
24-92-196-1x1-2048-92-196-4-0x0-1x1-1x1-0-NCHW-FP32-B=ConvOclDirectFwd1x1:1,256,1,1,0,2,32,4,0
800-66-50-1x1-288-66-50-16-0x0-1x1-1x1-0-NCHW-FP32-B=ConvAsm1x1U:2,32,5,16,1,1,1,1;ConvOclDirectFwd1x1:1,256,1,1,0,4,16,8,0
80-73-73-1x1-64-73-73-32-0x0-1x1-1x1-0-NCHW-FP16-W=ConvAsmBwdWrW1x1:4,4,4,4,2,2,4,4,0,1
192-27-27-5x5-64-27-27-512-2x2-1x1-1x1-0-NCHW-FP32-W=ConvOclBwdWrW2<1>:1,11,3,3,7;ConvOclBwdWrW2<2>:1,10,1,3,7;ConvOclBwdWrW2<4>:1,11,3,3,7;ConvOclBwdWrW2<8>:1,11,3,3,7;ConvOclBwdWrW2<16>:1,10,3,3,5
116-428-1004-1x1-608-428-1004-2-0x0-1x1-1x1-0-NCHW-FP32-B=ConvOclDirectFwd1x1:1,256,1,1,0,1,32,4,0
64-35-35-1x1-384-35-35-256-0x0-1x1-1x1-0-NCHW-FP32-F=ConvAsm1x1U:1,16,1,64,4,2,1,8;ConvOclDirectFwd1x1:1,64,1,1,1,4,32,128,0
8-286-570-1x1-832-286-570-2-0x0-1x1-1x1-0-NCHW-FP32-B=ConvOclDirectFwd1x1:1,256,1,1,0,4,16,8,0
512-15-15-3x3-512-15-15-32-1x1-1x1-1x1-0-NCHW-FP32-F_g32=ConvOclDirectFwd:16,16,16,16,1,1,4,4,2
58-117-703-1x1-160-117-703-8-0x0-1x1-1x1-0-NCHW-FP32-F=ConvOclDirectFwd1x1:1,256,1,1,0,1,32,4,0
192-7-7-1x1-1968-7-7-16-0x0-1x1-1x1-0-NCHW-FP16-B=ConvAsm1x1U:1,16,2,16,1,2,2,2;ConvOclDirectFwd1x1:1,64,1,1,0,1,8,4,0
528-192-149-1x1-96-192-149-1-0x0-1x1-1x1-0-NCHW-FP32-B=ConvOclDirectFwd1x1:1,256,1,1,0,2,32,4,0
2048-7-7-1x1-512-7-7-32-0x0-1x1-1x1-0-NCHW-FP16-F=ConvAsm1x1U:2,8,4,16,1,4,4,1;ConvOclDirectFwd1x1:1,256,1,1,0,1,8,4,0
512-7-7-1x1-2048-7-7-32-0x0-1x1-1x1-0-NCHW-FP16-W=ConvAsmBwdWrW1x1:1,16,4,4,4,1,1,2,0,2
32-387-149-1x1-4-387-149-32-0x0-1x1-1x1-0-NCHW-FP32-F=ConvAsm1x1U:1,4,2,4,1,4,1,1;ConvOclDirectFwd1x1:1,256,1,1,0,1,16,4,0
800-7-7-1x1-128-7-7-512-0x0-1x1-1x1-0-NCHW-FP32-W=ConvAsmBwdWrW1x1:2,8,4,8,4,2,2,4,0,2
192-35-35-1x1-384-35-35-16-0x0-1x1-1x1-0-NCHW-FP32-B=ConvAsm1x1U:2,32,2,64,1,1,2,2;ConvOclDirectFwd1x1:1,256,1,1,0,1,32,4,0
32-14-14-5x5-64-14-14-256-2x2-1x1-1x1-0-NCHW-FP32-F=ConvOclDirectFwd:8,8,16,16,2,2,4,1,2;ConvOclDirectFwdFused:8,8,16,16,2,2,4,1,2
1088-332-471-1x1-384-332-471-1-0x0-1x1-1x1-0-NCHW-FP32-F=ConvOclDirectFwd1x1:1,64,1,1,1,0,32,2048,0
320-28-28-1x1-128-28-28-64-0x0-1x1-1x1-0-NCHW-FP16-B=ConvAsm1x1U:1,16,2,16,1,2,2,2;ConvOclDirectFwd1x1:1,128,1,1,0,4,16,4,0
116-28-28-1x1-116-28-28-4-0x0-1x1-1x1-0-NCHW-FP16-B=ConvAsm1x1U:2,4,4,4,1,2,1,1;ConvOclDirectFwd1x1:1,128,1,1,0,2,16,4,0
512-14-14-3x3-512-14-14-32-1x1-1x1-1x1-0-NCHW-FP32-W=ConvAsmBwdWrW3x3:0,1,8,8,11,1
128-14-14-1x1-384-14-14-512-0x0-1x1-1x1-0-NCHW-FP32-B=ConvAsm1x1U:1,32,1,32,2,1,1,1;ConvOclDirectFwd1x1:1,256,1,1,0,1,32,4,0
3-113-419-1x1-3-113-419-2-0x0-1x1-1x1-0-NCHW-FP32-F=ConvAsm1x1U:3,1,5,4,1,1,1,1;ConvOclDirectFwd1x1:1,256,1,1,0,1,16,4,0
608-667-902-1x1-384-667-902-1-0x0-1x1-1x1-0-NCHW-FP32-F=ConvOclDirectFwd1x1:1,64,1,1,1,4,32,2048,0
256-14-14-1x1-128-14-14-256-0x0-1x1-1x1-0-NCHW-FP16-W=ConvAsmBwdWrW1x1:2,8,4,8,2,2,4,4,0,1
256-28-28-3x3-512-28-28-4-1x1-1x1-1x1-0-NCHW-FP16-F=ConvOclDirectFwd:8,32,32,32,4,1,8,2,2;ConvOclDirectFwdFused:16,16,32,32,2,2,8,2,1
256-13-13-3x3-256-13-13-2048-1x1-1x1-1x1-0-NCHW-FP16-W=ConvAsmBwdWrW3x3:0,0,8,4,3,1
208-14-14-3x3-96-14-14-512-1x1-1x1-1x1-0-NCHW-FP16-B=ConvOclDirectFwd:8,8,16,16,2,2,8,2,2
32-7-7-1x1-832-7-7-1-0x0-1x1-1x1-0-NCHW-FP32-W=ConvAsmBwdWrW1x1:4,4,2,1,2,1,1,4,0,1
512-274-16-1x1-464-274-16-12-0x0-1x1-1x1-0-NCHW-FP32-W=ConvAsmBwdWrW1x1:2,8,8,8,2,1,1,4,0,1
96-54-54-1x1-16-54-54-16-0x0-1x1-1x1-0-NCHW-FP16-F=ConvAsm1x1U:1,8,2,64,1,4,2,1;ConvOclDirectFwd1x1:1,256,1,1,0,2,8,4,0
3-381-342-1x1-320-381-342-8-0x0-1x1-1x1-0-NCHW-FP32-F=ConvOclDirectFwd1x1:1,256,1,1,0,1,64,4,0
16-48-480-3x3-1-48-480-8-1x1-1x1-1x1-0-NCHW-FP32-W=ConvAsmBwdWrW3x3:0,1,16,1,1,4
112-627-423-1x1-832-627-423-1-0x0-1x1-1x1-0-NCHW-FP32-B=ConvOclDirectFwd1x1:1,256,1,1,0,1,32,4,0
64-147-147-3x3-32-147-147-64-1x1-1x1-1x1-0-NCHW-FP16-W=ConvAsmBwdWrW3x3:0,0,16,4,2,4
64-28-28-3x3-64-28-28-32-1x1-1x1-1x1-0-NCHW-FP16-B=ConvOclDirectFwd:16,16,32,32,2,2,8,2,1
1008-410-915-1x1-320-410-915-1-0x0-1x1-1x1-0-NCHW-FP32-F=ConvOclDirectFwd1x1:1,64,1,1,1,0,32,2048,0
2064-765-88-1x1-4-765-88-1-0x0-1x1-1x1-0-NCHW-FP32-F=ConvOclDirectFwd1x1:1,128,1,1,0,2,16,8,0
480-65-817-1x1-1248-65-817-4-0x0-1x1-1x1-0-NCHW-FP32-B=ConvOclDirectFwd1x1:1,128,1,1,0,1,32,4,0
232-14-14-1x1-232-14-14-32-0x0-1x1-1x1-0-NCHW-FP32-W=ConvAsmBwdWrW1x1:1,16,2,8,4,1,4,4,0,1
320-610-2-1x1-608-610-2-4-0x0-1x1-1x1-0-NCHW-FP32-F=ConvAsm1x1U:3,16,3,32,2,2,1,1;ConvOclDirectFwd1x1:1,64,1,1,1,0,16,2048,0
1392-300-142-1x1-640-300-142-4-0x0-1x1-1x1-0-NCHW-FP32-F=ConvOclDirectFwd1x1:1,64,1,1,1,1,16,2048,0
704-20-265-1x1-1152-20-265-1-0x0-1x1-1x1-0-NCHW-FP32-B=ConvOclDirectFwd1x1:1,256,1,1,0,2,32,4,0
128-141-112-1x1-624-141-112-2-0x0-1x1-1x1-0-NCHW-FP32-W=ConvAsmBwdWrW1x1:4,4,8,4,4,1,1,4,0,1
1280-8-8-1x1-448-8-8-32-0x0-1x1-1x1-0-NCHW-FP32-W=ConvAsmBwdWrW1x1:1,16,2,8,4,1,2,4,0,1
240-318-729-1x1-32-318-729-2-0x0-1x1-1x1-0-NCHW-FP32-F=ConvOclDirectFwd1x1:1,64,1,1,1,4,64,2048,0
256-14-14-1x1-512-28-28-4-0x0-2x2-1x1-0-NCHW-FP32-W=ConvAsmBwdWrW1x1:1,16,2,4,4,1,1,4,0,1
704-273-479-1x1-320-273-479-1-0x0-1x1-1x1-0-NCHW-FP32-B=ConvOclDirectFwd1x1:1,256,1,1,0,1,32,4,0
1-542-86-1x1-2112-542-86-4-0x0-1x1-1x1-0-NCHW-FP32-B=ConvOclDirectFwd1x1:1,256,1,1,0,4,4,4,0
512-29-29-1x1-256-29-29-2-0x0-1x1-1x1-0-NCHW-FP32-B=ConvAsm1x1U:1,16,1,64,1,2,4,1;ConvOclDirectFwd1x1:1,64,1,1,0,1,8,4,0
480-14-14-1x1-128-14-14-32-0x0-1x1-1x1-0-NCHW-FP16-F=ConvAsm1x1U:2,8,4,64,1,4,2,4;ConvOclDirectFwd1x1:1,64,1,1,0,4,8,4,0
960-925-429-1x1-1280-925-429-1-0x0-1x1-1x1-0-NCHW-FP32-F=ConvOclDirectFwd1x1:1,64,1,1,1,4,16,2048,0
384-28-28-1x1-128-28-28-256-0x0-1x1-1x1-0-NCHW-FP16-F=ConvAsm1x1U:1,8,2,32,2,4,1,4;ConvOclDirectFwd1x1:1,64,1,1,0,4,16,4,0
1664-360-213-1x1-8-360-213-2-0x0-1x1-1x1-0-NCHW-FP32-F=ConvOclDirectFwd1x1:1,256,1,1,0,4,16,4,0
896-726-283-1x1-224-726-283-2-0x0-1x1-1x1-0-NCHW-FP32-B=ConvOclDirectFwd1x1:1,64,1,1,0,2,32,4,0
256-14-14-1x1-1024-14-14-128-0x0-1x1-1x1-0-NCHW-FP16-W=ConvAsmBwdWrW1x1:1,16,8,8,2,1,2,2,0,1
48-7-7-5x5-128-7-7-8-2x2-1x1-1x1-0-NCHW-FP32-F=ConvOclDirectFwd:8,8,8,8,1,1,2,2,2;ConvOclDirectFwdFused:8,8,8,8,1,1,2,4,2
832-134-233-1x1-54-134-233-4-0x0-1x1-1x1-0-NCHW-FP32-F=ConvOclDirectFwd1x1:1,256,1,1,0,1,8,4,0
448-8-8-1x1-2048-8-8-8-0x0-1x1-1x1-0-NCHW-FP32-W=ConvAsmBwdWrW1x1:1,16,2,4,8,1,1,4,0,0
544-607-754-1x1-24-607-754-1-0x0-1x1-1x1-0-NCHW-FP32-B=ConvOclDirectFwd1x1:1,256,1,1,0,2,16,8,0
32-35-35-1x1-192-35-35-128-0x0-1x1-1x1-0-NCHW-FP32-B=ConvAsm1x1U:1,16,1,64,1,2,2,1;ConvOclDirectFwd1x1:1,256,1,1,0,1,32,4,0
1056-7-7-1x1-352-7-7-64-0x0-1x1-1x1-0-NCHW-FP32-F=ConvAsm1x1U:4,8,4,16,1,4,1,4;ConvOclDirectFwd1x1:1,64,1,1,1,1,16,2048,0;ConvActivAsm1x1U:2,16,2,32,3,2
128-28-28-1x1-224-28-28-32-0x0-1x1-1x1-0-NCHW-FP16-F=ConvAsm1x1U:1,8,2,16,2,4,1,4;ConvOclDirectFwd1x1:1,64,1,1,0,4,16,4,0
960-7-7-1x1-240-7-7-64-0x0-1x1-1x1-0-NCHW-FP16-F_g3=ConvOclDirectFwd:8,8,8,8,1,1,8,4,1
16-14-14-5x5-48-14-14-4-2x2-1x1-1x1-0-NCHW-FP32-F=ConvOclDirectFwd:16,16,16,16,1,1,2,4,2;ConvOclDirectFwdFused:8,16,16,16,2,1,1,4,2
480-202-4-1x1-1888-202-4-64-0x0-1x1-1x1-0-NCHW-FP32-B=ConvAsm1x1U:2,16,2,64,1,2,2,2;ConvOclDirectFwd1x1:1,256,1,1,0,1,32,4,0
768-17-17-1x1-128-17-17-256-0x0-1x1-1x1-0-NCHW-FP16-B=ConvAsm1x1U:1,16,2,16,1,2,2,2;ConvOclDirectFwd1x1:1,64,1,1,0,1,32,4,0
256-29-29-3x3-256-29-29-32-1x1-1x1-1x1-0-NCHW-FP32-F_g32=ConvOclDirectFwd:32,8,32,32,1,4,8,2,1
256-57-57-1x1-128-57-57-4-0x0-1x1-1x1-0-NCHW-FP32-W=ConvAsmBwdWrW1x1:4,4,4,4,2,1,1,4,0,1
672-8-142-1x1-116-8-142-2-0x0-1x1-1x1-0-NCHW-FP32-F=ConvAsm1x1U:3,8,3,32,1,4,2,2;ConvOclDirectFwd1x1:1,64,1,1,0,1,8,8,0
1008-58-468-1x1-64-58-468-4-0x0-1x1-1x1-0-NCHW-FP32-F=ConvOclDirectFwd1x1:16,16,32,32,1,0,32,128,1
128-7-7-1x1-640-7-7-512-0x0-1x1-1x1-0-NCHW-FP32-F=ConvAsm1x1U:1,8,1,64,4,4,1,4;ConvOclDirectFwd1x1:1,64,1,1,1,0,32,256,0
1024-4-4-1x1-2048-7-7-32-0x0-2x2-1x1-0-NCHW-FP32-W=ConvAsmBwdWrW1x1:1,16,2,4,8,1,1,4,0,0
464-670-19-1x1-54-670-19-16-0x0-1x1-1x1-0-NCHW-FP32-F=ConvOclDirectFwd1x1:1,256,1,1,0,2,16,8,0
64-56-56-3x3-64-56-56-8-1x1-1x1-1x1-0-NCHW-FP16-B=ConvOclDirectFwd:16,16,32,32,2,2,8,2,1
192-7-7-1x1-2160-7-7-16-0x0-1x1-1x1-0-NCHW-FP16-B=ConvAsm1x1U:1,16,2,16,1,2,2,2;ConvOclDirectFwd1x1:1,64,1,1,0,1,8,4,0
512-7-7-3x3-512-7-7-8-1x1-1x1-1x1-0-NCHW-FP16-B=ConvOclDirectFwd:8,8,8,8,1,1,4,1,1
64-731-9-1x1-768-731-9-64-0x0-1x1-1x1-0-NCHW-FP32-F=ConvOclDirectFwd1x1:16,8,32,16,1,0,32,128,1
128-14-14-1x1-448-14-14-64-0x0-1x1-1x1-0-NCHW-FP16-F=ConvAsm1x1U:2,8,4,64,1,4,1,8;ConvOclDirectFwd1x1:1,128,1,1,0,4,8,4,0
1312-367-96-1x1-640-367-96-2-0x0-1x1-1x1-0-NCHW-FP32-F=ConvOclDirectFwd1x1:1,64,1,1,1,0,16,2048,0
640-638-68-1x1-1312-638-68-8-0x0-1x1-1x1-0-NCHW-FP32-B=ConvOclDirectFwd1x1:1,256,1,1,0,1,32,4,0
24-19-19-3x3-512-19-19-32-1x1-1x1-1x1-0-NCHW-FP32-W=ConvAsmBwdWrW3x3:0,1,8,4,3,2
816-340-4-1x1-928-340-4-12-0x0-1x1-1x1-0-NCHW-FP32-F=ConvAsm1x1U:4,16,4,32,3,1,1,1;ConvOclDirectFwd1x1:1,64,1,1,1,0,64,2048,0
512-14-14-3x3-512-28-28-128-1x1-2x2-1x1-0-NCHW-FP32-B_g32=ConvOclDirectFwd:16,32,32,32,2,1,8,4,1
1000-13-13-1x1-512-13-13-128-0x0-1x1-1x1-0-NCHW-FP16-W=ConvAsmBwdWrW1x1:1,16,4,8,2,1,1,4,0,1
2048-8-8-1x1-1024-8-8-16-0x0-1x1-1x1-0-NCHW-FP32-B=ConvAsm1x1U:1,16,1,64,2,2,2,4;ConvOclDirectFwd1x1:1,128,1,1,0,4,8,8,0
224-56-56-1x1-128-56-56-64-0x0-1x1-1x1-0-NCHW-FP32-B=ConvAsm1x1U:1,32,2,64,1,1,1,2;ConvOclDirectFwd1x1:1,256,1,1,0,1,32,4,0
128-29-29-3x3-128-57-57-64-1x1-2x2-1x1-0-NCHW-FP32-W=ConvAsmBwdWrW3x3:0,0,8,8,3,1
144-86-625-1x1-1008-86-625-8-0x0-1x1-1x1-0-NCHW-FP32-B=ConvOclDirectFwd1x1:1,256,1,1,0,2,16,4,0
256-56-56-1x1-128-28-28-32-0x0-2x2-1x1-0-NCHW-FP16-F=ConvAsm1x1U:1,8,2,32,2,4,2,2;ConvOclDirectFwd1x1:1,128,1,1,0,2,16,4,0
1280-8-8-1x1-320-8-8-32-0x0-1x1-1x1-0-NCHW-FP32-F=ConvAsm1x1U:2,16,2,32,3,2,4,2;ConvOclDirectFwd1x1:1,64,1,1,1,1,16,2048,0;ConvActivAsm1x1U:4,16,4,16,3,4
128-14-14-1x1-288-14-14-512-0x0-1x1-1x1-0-NCHW-FP16-W=ConvAsmBwdWrW1x1:2,8,2,8,2,1,4,4,0,1
224-14-14-3x3-112-14-14-8-1x1-1x1-1x1-0-NCHW-FP32-W=ConvAsmBwdWrW3x3:0,0,8,4,5,2
512-788-63-1x1-2-788-63-6-0x0-1x1-1x1-0-NCHW-FP32-B=ConvOclDirectFwd1x1:1,256,1,1,0,2,16,8,0
192-28-28-1x1-336-28-28-16-0x0-1x1-1x1-0-NCHW-FP32-W=ConvAsmBwdWrW1x1:2,8,2,4,8,2,2,4,0,1
2-422-76-1x1-1408-422-76-1-0x0-1x1-1x1-0-NCHW-FP32-B=ConvOclDirectFwd1x1:1,256,1,1,0,2,4,4,0
19-55-161-1x1-1888-55-161-1-0x0-1x1-1x1-0-NCHW-FP32-W=ConvAsmBwdWrW1x1:4,4,8,2,4,1,2,4,0,0
160-56-56-1x1-128-56-56-256-0x0-1x1-1x1-0-NCHW-FP16-W=ConvAsmBwdWrW1x1:4,4,4,1,8,2,2,4,0,0
128-14-14-1x1-992-14-14-512-0x0-1x1-1x1-0-NCHW-FP32-F=ConvAsm1x1U:1,16,1,32,4,2,2,2;ConvOclDirectFwd1x1:1,64,1,1,1,4,32,256,0
128-57-57-1x1-256-57-57-16-0x0-1x1-1x1-0-NCHW-FP32-W=ConvAsmBwdWrW1x1:4,4,8,4,4,1,2,4,0,1
720-583-99-1x1-576-583-99-2-0x0-1x1-1x1-0-NCHW-FP32-F=ConvOclDirectFwd1x1:1,64,1,1,1,4,16,2048,0
2048-8-8-1x1-384-8-8-128-0x0-1x1-1x1-0-NCHW-FP32-F=ConvAsm1x1U:4,8,4,16,2,4,1,4;ConvOclDirectFwd1x1:1,64,1,1,1,0,32,2048,0;ConvActivAsm1x1U:4,16,4,16,2,2
32-278-693-1x1-384-278-693-4-0x0-1x1-1x1-0-NCHW-FP32-F=ConvOclDirectFwd1x1:1,64,1,1,1,1,32,2048,0
336-618-747-1x1-288-618-747-1-0x0-1x1-1x1-0-NCHW-FP32-F=ConvOclDirectFwd1x1:1,64,1,1,1,4,64,2048,0
58-86-799-1x1-3-86-799-12-0x0-1x1-1x1-0-NCHW-FP32-W=ConvAsmBwdWrW1x1:4,4,2,1,2,1,4,4,0,1
832-111-38-1x1-1000-111-38-32-0x0-1x1-1x1-0-NCHW-FP32-F=ConvOclDirectFwd1x1:1,128,1,1,0,2,16,4,0
1104-307-140-1x1-288-307-140-8-0x0-1x1-1x1-0-NCHW-FP32-B=ConvOclDirectFwd1x1:1,64,1,1,0,1,32,4,0
864-939-9-1x1-24-939-9-4-0x0-1x1-1x1-0-NCHW-FP32-F=ConvOclDirectFwd1x1:1,256,1,1,0,1,8,4,0
64-27-27-5x5-192-27-27-256-2x2-1x1-1x1-0-NCHW-FP32-F=ConvOclDirectFwd:16,16,32,32,2,2,8,1,2;ConvOclDirectFwdFused:16,16,32,32,2,2,8,1,1
736-753-299-1x1-128-753-299-2-0x0-1x1-1x1-0-NCHW-FP32-F=ConvOclDirectFwd1x1:1,64,1,1,1,4,16,2048,0
384-27-27-1x1-48-27-27-512-0x0-1x1-1x1-0-NCHW-FP32-B=ConvAsm1x1U:4,16,4,64,2,2,1,1;ConvOclDirectFwd1x1:1,256,1,1,0,1,16,4,0
1216-365-82-1x1-2-365-82-1-0x0-1x1-1x1-0-NCHW-FP32-F=ConvOclDirectFwd1x1:1,256,1,1,0,2,16,4,0
448-604-153-1x1-384-604-153-4-0x0-1x1-1x1-0-NCHW-FP32-B=ConvOclDirectFwd1x1:1,64,1,1,0,2,32,4,0
464-663-496-1x1-320-663-496-2-0x0-1x1-1x1-0-NCHW-FP32-F=ConvOclDirectFwd1x1:1,64,1,1,1,4,16,2048,0
832-374-1-1x1-704-374-1-48-0x0-1x1-1x1-0-NCHW-FP32-B=ConvAsm1x1U:3,16,3,64,1,2,2,2;ConvOclDirectFwd1x1:1,256,1,1,0,2,32,4,0
54-713-196-1x1-720-713-196-1-0x0-1x1-1x1-0-NCHW-FP32-B=ConvOclDirectFwd1x1:1,128,1,1,0,4,16,4,0
3-5-908-1x1-1568-5-908-64-0x0-1x1-1x1-0-NCHW-FP32-W=ConvAsmBwdWrW1x1:4,4,2,1,2,1,1,2,0,1
512-28-28-1x1-512-28-28-16-0x0-1x1-1x1-0-NCHW-FP32-W=ConvAsmBwdWrW1x1:1,16,8,4,4,1,2,4,0,1
1344-93-825-1x1-576-93-825-2-0x0-1x1-1x1-0-NCHW-FP32-F=ConvOclDirectFwd1x1:1,64,1,1,1,1,16,2048,0
928-478-4-1x1-960-478-4-16-0x0-1x1-1x1-0-NCHW-FP32-F=ConvAsm1x1U:2,16,6,16,2,1,1,1;ConvOclDirectFwd1x1:1,64,1,1,1,0,16,256,0
256-14-14-3x3-256-28-28-8-1x1-2x2-1x1-0-NCHW-FP32-B=ConvOclDirectFwd:16,16,32,32,2,2,4,4,2
352-106-990-1x1-336-106-990-12-0x0-1x1-1x1-0-NCHW-FP32-B=ConvOclDirectFwd1x1:1,256,1,1,0,4,16,4,0
192-14-14-1x1-512-14-14-256-0x0-1x1-1x1-0-NCHW-FP32-W=ConvAsmBwdWrW1x1:2,8,4,8,4,1,2,4,0,2
256-563-341-1x1-928-563-341-2-0x0-1x1-1x1-0-NCHW-FP32-F=ConvOclDirectFwd1x1:1,64,1,1,1,0,32,2048,0
448-335-386-1x1-768-335-386-4-0x0-1x1-1x1-0-NCHW-FP32-B=ConvOclDirectFwd1x1:1,128,1,1,0,2,32,4,0
256-28-28-3x3-256-14-14-16-1x1-2x2-1x1-0-NCHW-FP32-F=ConvOclDirectFwd:16,16,16,16,1,1,8,2,1
192-17-17-1x1-1024-17-17-32-0x0-1x1-1x1-0-NCHW-FP16-B=ConvAsm1x1U:1,16,2,32,1,2,2,2;ConvOclDirectFwd1x1:1,256,1,1,0,1,8,4,0
224-28-28-1x1-128-28-28-32-0x0-1x1-1x1-0-NCHW-FP32-B=ConvAsm1x1U:1,16,1,32,1,2,1,1;ConvOclDirectFwd1x1:1,64,1,1,0,4,16,4,0
256-222-1017-1x1-160-222-1017-8-0x0-1x1-1x1-0-NCHW-FP32-B=ConvOclDirectFwd1x1:1,128,1,1,0,2,32,4,0
256-29-29-1x1-512-29-29-256-0x0-1x1-1x1-0-NCHW-FP32-W=ConvAsmBwdWrW1x1:1,16,2,8,2,1,1,4,0,1
24-14-14-1x1-512-14-14-64-0x0-1x1-1x1-0-NCHW-FP32-W=ConvAsmBwdWrW1x1:4,4,2,2,2,1,1,4,0,3
16-54-54-1x1-96-54-54-256-0x0-1x1-1x1-0-NCHW-FP16-F=ConvAsm1x1U:1,8,2,64,1,2,1,4;ConvOclDirectFwd1x1:1,64,1,1,0,2,32,4,0
24-95-114-1x1-2048-95-114-6-0x0-1x1-1x1-0-NCHW-FP32-F=ConvOclDirectFwd1x1:1,128,1,1,0,2,32,4,0
64-112-112-7x7-3-224-224-64-3x3-2x2-1x1-0-NCHW-FP16-B=ConvOclDirectFwd:8,32,32,32,4,1,1,4,1
32-79-341-5x10-32-38-166-64-0x0-2x2-1x1-0-NCHW-FP32-F=ConvOclDirectFwd:8,32,16,32,2,1,8,1,2
192-7-7-1x1-1248-7-7-16-0x0-1x1-1x1-0-NCHW-FP16-B=ConvAsm1x1U:1,16,2,16,1,2,2,2;ConvOclDirectFwd1x1:8,64,8,8,0,1,16,4,1
160-8-950-1x1-896-8-950-1-0x0-1x1-1x1-0-NCHW-FP32-B=ConvOclDirectFwd1x1:1,256,1,1,0,4,16,8,0
32-7-7-3x3-128-7-7-512-1x1-1x1-1x1-0-NCHW-FP16-F=ConvOclDirectFwd:8,8,8,8,1,1,8,2,2
32-282-841-1x1-54-282-841-4-0x0-1x1-1x1-0-NCHW-FP32-F=ConvOclDirectFwd1x1:1,256,1,1,0,2,8,8,0
416-914-262-1x1-448-914-262-1-0x0-1x1-1x1-0-NCHW-FP32-B=ConvOclDirectFwd1x1:1,256,1,1,0,4,16,8,0
800-287-76-1x1-1008-287-76-6-0x0-1x1-1x1-0-NCHW-FP32-B=ConvOclDirectFwd1x1:1,256,1,1,0,4,16,8,0
512-14-14-1x1-128-14-14-16-0x0-1x1-1x1-0-NCHW-FP16-W=ConvAsmBwdWrW1x1:2,8,2,4,2,1,1,4,0,1
1-218-130-1x1-16-218-130-64-0x0-1x1-1x1-0-NCHW-FP32-F=ConvAsm1x1U:4,8,6,64,3,1,1,2;ConvOclDirectFwd1x1:1,256,1,1,0,2,16,4,0
608-462-85-1x1-704-462-85-1-0x0-1x1-1x1-0-NCHW-FP32-F=ConvOclDirectFwd1x1:1,64,1,1,1,1,16,2048,0
512-14-14-1x1-112-14-14-128-0x0-1x1-1x1-0-NCHW-FP16-F=ConvAsm1x1U:2,8,4,64,1,4,4,1;ConvOclDirectFwd1x1:1,256,1,1,0,4,16,4,0
232-615-833-1x1-2-615-833-2-0x0-1x1-1x1-0-NCHW-FP32-F=ConvOclDirectFwd1x1:1,256,1,1,0,1,16,8,0
816-116-693-1x1-80-116-693-8-0x0-1x1-1x1-0-NCHW-FP32-F=ConvOclDirectFwd1x1:1,64,1,1,1,0,64,2048,0
128-28-28-3x3-192-28-28-8-1x1-1x1-1x1-0-NCHW-FP16-F=ConvOclDirectFwd:16,16,32,32,2,2,8,2,1;ConvOclDirectFwdFused:16,16,32,32,2,2,8,2,1
128-28-28-1x1-256-28-28-16-0x0-1x1-1x1-0-NCHW-FP32-F=ConvAsm1x1U:1,16,1,64,4,2,2,2;ConvOclDirectFwd1x1:1,64,1,1,1,1,16,256,0
96-35-35-3x3-96-35-35-1-1x1-1x1-1x1-0-NCHW-FP16-B=ConvOclDirectFwd:16,16,16,16,1,1,4,4,1
1024-15-15-3x3-1024-8-8-64-1x1-2x2-1x1-0-NCHW-FP32-F_g32=ConvOclDirectFwd:8,8,8,8,1,1,8,2,2
128-7-7-1x1-640-7-7-32-0x0-1x1-1x1-0-NCHW-FP32-F=ConvAsm1x1U:1,8,1,64,2,4,1,4;ConvOclDirectFwd1x1:1,64,1,1,1,0,16,256,0
19-190-268-1x1-416-190-268-8-0x0-1x1-1x1-0-NCHW-FP32-B=ConvOclDirectFwd1x1:1,128,1,1,0,2,32,4,0
352-752-325-1x1-992-752-325-2-0x0-1x1-1x1-0-NCHW-FP32-F=ConvOclDirectFwd1x1:1,64,1,1,1,0,64,2048,0
128-14-14-1x1-384-14-14-128-0x0-1x1-1x1-0-NCHW-FP32-B=ConvAsm1x1U:2,16,2,64,1,2,1,4;ConvOclDirectFwd1x1:1,128,1,1,0,2,32,4,0
64-128-256-1x1-256-128-256-1-0x0-1x1-1x1-0-NCHW-FP16-B=ConvOclDirectFwd1x1:1,256,1,1,0,4,16,4,0
144-466-43-1x1-1632-466-43-4-0x0-1x1-1x1-0-NCHW-FP32-B=ConvOclDirectFwd1x1:1,256,1,1,0,2,32,4,0
464-7-7-1x1-1024-7-7-256-0x0-1x1-1x1-0-NCHW-FP16-F=ConvAsm1x1U:2,8,4,16,1,4,1,8;ConvOclDirectFwd1x1:1,128,1,1,0,1,16,4,0
768-7-7-1x1-128-7-7-512-0x0-1x1-1x1-0-NCHW-FP16-B=ConvAsm1x1U:1,16,2,16,1,2,2,2;ConvOclDirectFwd1x1:1,128,1,1,0,1,32,4,0
384-1-310-1x1-128-1-310-2048-0x0-1x1-1x1-0-NCHW-FP32-W=ConvAsmBwdWrW1x1:1,16,2,8,4,1,4,4,0,1
576-217-165-1x1-448-217-165-16-0x0-1x1-1x1-0-NCHW-FP32-B=ConvOclDirectFwd1x1:1,64,1,1,0,1,32,4,0
512-81-456-1x1-2048-81-456-4-0x0-1x1-1x1-0-NCHW-FP32-F=ConvOclDirectFwd1x1:1,64,1,1,1,1,16,2048,0
192-223-522-1x1-416-223-522-8-0x0-1x1-1x1-0-NCHW-FP32-F=ConvOclDirectFwd1x1:1,64,1,1,1,4,64,2048,0
256-56-56-1x1-128-56-56-256-0x0-1x1-1x1-0-NCHW-FP16-B=ConvAsm1x1U:1,16,2,32,1,2,1,8;ConvOclDirectFwd1x1:1,256,1,1,0,4,16,4,0
960-197-227-1x1-336-197-227-4-0x0-1x1-1x1-0-NCHW-FP32-B=ConvOclDirectFwd1x1:1,256,1,1,0,1,16,8,0
256-57-57-1x1-64-57-57-4-0x0-1x1-1x1-0-NCHW-FP32-W=ConvAsmBwdWrW1x1:4,4,4,1,8,1,1,4,0,2
80-73-73-3x3-192-71-71-8-0x0-1x1-1x1-0-NCHW-FP32-F=ConvOclDirectFwd:16,8,16,16,1,2,8,4,2
48-145-15-1x1-232-145-15-12-0x0-1x1-1x1-0-NCHW-FP32-F=ConvAsm1x1U:1,8,1,64,2,2,2,1;ConvOclDirectFwd1x1:1,256,1,1,0,1,8,4,0
192-28-28-1x1-96-28-28-128-0x0-1x1-1x1-0-NCHW-FP32-F=ConvAsm1x1U:2,16,2,32,3,2,1,1;ConvOclDirectFwd1x1:1,64,1,1,1,1,16,2048,0;ConvActivAsm1x1U:2,16,2,32,3,1
448-8-8-1x1-2048-8-8-16-0x0-1x1-1x1-0-NCHW-FP32-B=ConvAsm1x1U:1,16,1,64,2,2,2,4;ConvOclDirectFwd1x1:1,64,1,1,0,2,16,4,0
256-13-13-3x3-384-13-13-64-1x1-1x1-1x1-0-NCHW-FP16-F=ConvOclDirectFwd:8,8,16,16,2,2,8,1,2
1376-275-824-1x1-928-275-824-1-0x0-1x1-1x1-0-NCHW-FP32-F=ConvOclDirectFwd1x1:1,64,1,1,1,0,64,2048,0
192-566-195-1x1-1088-566-195-2-0x0-1x1-1x1-0-NCHW-FP32-B=ConvOclDirectFwd1x1:1,64,1,1,0,2,32,4,0
992-96-99-1x1-16-96-99-2-0x0-1x1-1x1-0-NCHW-FP32-B=ConvOclDirectFwd1x1:1,128,1,1,0,1,8,4,0
256-71-334-1x1-232-71-334-16-0x0-1x1-1x1-0-NCHW-FP32-F=ConvOclDirectFwd1x1:1,256,1,1,0,2,16,4,0
672-512-934-1x1-112-512-934-1-0x0-1x1-1x1-0-NCHW-FP32-F=ConvOclDirectFwd1x1:1,64,1,1,1,0,32,2048,0
192-27-27-5x5-64-27-27-2-2x2-1x1-1x1-0-NCHW-FP16-B=ConvOclDirectFwd:16,16,32,32,2,2,1,4,2
1024-17-17-1x1-256-17-17-16-0x0-1x1-1x1-0-NCHW-FP16-F=ConvAsm1x1U:3,8,6,32,1,4,4,1;ConvOclDirectFwd1x1:1,64,1,1,0,1,8,8,0
1-1017-655-1x1-8-1017-655-4-0x0-1x1-1x1-0-NCHW-FP32-W=ConvAsmBwdWrW1x1:4,4,2,1,2,1,4,4,0,1
224-35-35-3x3-192-35-35-8-1x1-1x1-1x1-0-NCHW-FP32-W=ConvAsmBwdWrW3x3:0,0,8,4,3,2
160-640-823-1x1-1-640-823-1-0x0-1x1-1x1-0-NCHW-FP32-B=ConvOclDirectFwd1x1:1,64,1,1,0,1,16,8,0
192-14-14-1x1-576-14-14-64-0x0-1x1-1x1-0-NCHW-FP16-W=ConvAsmBwdWrW1x1:2,8,4,8,2,1,2,4,0,1
32-27-27-3x3-128-27-27-64-1x1-1x1-1x1-0-NCHW-FP32-W=ConvAsmBwdWrW3x3:0,0,8,4,4,4
640-321-208-1x1-704-321-208-2-0x0-1x1-1x1-0-NCHW-FP32-B=ConvOclDirectFwd1x1:1,256,1,1,0,1,32,4,0
1024-15-15-1x1-1024-15-15-48-0x0-1x1-1x1-0-NCHW-FP32-B=ConvAsm1x1U:4,16,4,64,1,2,1,1;ConvOclDirectFwd1x1:1,256,1,1,0,1,32,4,0
128-28-28-3x3-128-56-56-256-1x1-2x2-1x1-0-NCHW-FP32-B=ConvOclDirectFwd:32,32,32,32,1,1,8,2,2
512-14-14-1x1-192-14-14-64-0x0-1x1-1x1-0-NCHW-FP32-F=ConvAsm1x1U:4,16,4,64,1,2,1,1;ConvOclDirectFwd1x1:1,64,1,1,1,0,16,2048,0
480-314-4-1x1-320-314-4-2-0x0-1x1-1x1-0-NCHW-FP32-B=ConvAsm1x1U:1,16,1,32,1,2,2,1;ConvOclDirectFwd1x1:1,128,1,1,0,4,8,4,0
320-225-88-1x1-1344-225-88-4-0x0-1x1-1x1-0-NCHW-FP32-B=ConvOclDirectFwd1x1:1,256,1,1,0,1,32,4,0
480-28-28-1x1-128-28-28-32-0x0-1x1-1x1-0-NCHW-FP32-F=ConvAsm1x1U:3,16,3,64,2,2,2,2;ConvOclDirectFwd1x1:1,64,1,1,1,1,32,2048,0
128-14-14-1x1-256-14-14-256-0x0-1x1-1x1-0-NCHW-FP16-B=ConvAsm1x1U:1,16,2,16,1,2,1,8;ConvOclDirectFwd1x1:1,128,1,1,0,2,32,8,0
256-14-14-1x1-528-14-14-4-0x0-1x1-1x1-0-NCHW-FP32-W=ConvAsmBwdWrW1x1:1,16,2,8,4,1,2,4,0,1
1504-391-326-1x1-640-391-326-2-0x0-1x1-1x1-0-NCHW-FP32-F=ConvOclDirectFwd1x1:1,64,1,1,1,4,32,2048,0
384-8-8-1x1-2048-8-8-64-0x0-1x1-1x1-0-NCHW-FP32-W=ConvAsmBwdWrW1x1:2,8,4,4,8,1,1,4,0,1
16-51-405-1x1-4-51-405-1024-0x0-1x1-1x1-0-NCHW-FP32-F=ConvAsm1x1U:1,4,1,4,1,1,1,1;ConvOclDirectFwd1x1:1,64,1,1,0,1,16,8,0
224-28-28-1x1-128-28-28-32-0x0-1x1-1x1-0-NCHW-FP32-F=ConvAsm1x1U:3,16,3,16,1,2,1,2;ConvOclDirectFwd1x1:1,64,1,1,1,1,32,2048,0
128-7-7-1x1-704-7-7-128-0x0-1x1-1x1-0-NCHW-FP16-F=ConvAsm1x1U:2,8,4,16,1,4,1,2;ConvOclDirectFwd1x1:8,64,8,8,0,1,16,4,1
96-54-54-1x1-16-54-54-64-0x0-1x1-1x1-0-NCHW-FP16-F=ConvAsm1x1U:2,8,6,64,1,2,1,1;ConvOclDirectFwd1x1:16,64,32,32,0,2,16,4,1
4-159-212-1x1-1008-159-212-6-0x0-1x1-1x1-0-NCHW-FP32-B=ConvOclDirectFwd1x1:1,256,1,1,0,2,16,4,0
128-56-56-1x1-96-56-56-64-0x0-1x1-1x1-0-NCHW-FP32-B=ConvAsm1x1U:1,8,1,64,1,4,1,2;ConvOclDirectFwd1x1:1,128,1,1,0,1,32,4,0
448-114-619-1x1-416-114-619-4-0x0-1x1-1x1-0-NCHW-FP32-F=ConvOclDirectFwd1x1:1,64,1,1,1,4,64,2048,0
528-14-14-1x1-32-14-14-32-0x0-1x1-1x1-0-NCHW-FP16-F=ConvAsm1x1U:1,8,2,32,1,4,4,4;ConvOclDirectFwd1x1:1,256,1,1,0,4,4,4,0
64-56-56-1x1-64-56-56-8-0x0-1x1-1x1-0-NCHW-FP16-W=ConvAsmBwdWrW1x1:4,4,2,1,8,1,4,4,0,1
384-83-155-1x1-1440-83-155-16-0x0-1x1-1x1-0-NCHW-FP32-B=ConvOclDirectFwd1x1:1,256,1,1,0,1,32,4,0
3-224-224-3x3-64-224-224-64-1x1-1x1-1x1-0-NCHW-FP32-F=ConvOclDirectFwd:8,32,32,32,4,1,4,1,2
208-64-128-3x3-96-64-128-1-1x1-1x1-1x1-0-NCHW-FP16-B=ConvOclDirectFwd:16,16,16,32,1,2,8,4,1
16-14-14-1x1-480-14-14-32-0x0-1x1-1x1-0-NCHW-FP32-W=ConvAsmBwdWrW1x1:2,8,2,4,2,1,4,4,0,1
1888-787-13-1x1-288-787-13-4-0x0-1x1-1x1-0-NCHW-FP32-F=ConvOclDirectFwd1x1:1,64,1,1,1,4,64,2048,0
32-24-240-3x3-16-24-240-4-1x1-1x1-1x1-0-NCHW-FP32-W=ConvAsmBwdWrW3x3:0,0,16,2,1,4
544-561-369-1x1-832-561-369-2-0x0-1x1-1x1-0-NCHW-FP32-F=ConvOclDirectFwd1x1:1,64,1,1,1,1,16,2048,0
48-242-231-1x1-1008-242-231-2-0x0-1x1-1x1-0-NCHW-FP32-B=ConvOclDirectFwd1x1:1,64,1,1,0,2,16,8,0
192-20-82-1x1-192-20-82-1-0x0-1x1-1x1-0-NCHW-FP32-F=ConvAsm1x1U:1,8,1,64,1,4,2,2;ConvOclDirectFwd1x1:1,64,1,1,1,0,16,2048,0
1280-8-8-1x1-384-8-8-4-0x0-1x1-1x1-0-NCHW-FP32-F=ConvAsm1x1U:2,8,2,32,1,4,4,2;ConvOclDirectFwd1x1:8,8,8,8,1,0,32,128,1;ConvActivAsm1x1U:1,16,1,64,2,4
116-264-888-1x1-1088-264-888-2-0x0-1x1-1x1-0-NCHW-FP32-B=ConvOclDirectFwd1x1:1,128,1,1,0,1,32,4,0
512-14-14-3x3-512-14-14-256-1x1-1x1-1x1-0-NCHW-FP16-W=ConvAsmBwdWrW3x3:0,1,8,4,5,1
8-368-9-1x1-816-368-9-12-0x0-1x1-1x1-0-NCHW-FP32-B=ConvAsm1x1U:1,8,2,16,1,1,4,2;ConvOclDirectFwd1x1:1,128,1,1,0,4,16,8,0
128-7-7-1x1-576-7-7-32-0x0-1x1-1x1-0-NCHW-FP16-W=ConvAsmBwdWrW1x1:4,4,4,4,2,1,2,2,0,1
160-793-273-1x1-19-793-273-8-0x0-1x1-1x1-0-NCHW-FP32-F=ConvOclDirectFwd1x1:1,256,1,1,0,1,8,8,0
116-314-980-1x1-32-314-980-4-0x0-1x1-1x1-0-NCHW-FP32-F=ConvOclDirectFwd1x1:1,128,1,1,0,1,32,4,0
832-14-14-1x1-128-14-14-16-0x0-1x1-1x1-0-NCHW-FP32-F=ConvAsm1x1U:4,16,4,64,1,2,4,1;ConvOclDirectFwd1x1:1,64,1,1,1,4,16,256,0
128-7-7-1x1-896-7-7-512-0x0-1x1-1x1-0-NCHW-FP32-F=ConvAsm1x1U:1,8,1,64,3,4,1,8;ConvOclDirectFwd1x1:1,64,1,1,1,1,32,2048,0
128-56-56-1x1-192-56-56-256-0x0-1x1-1x1-0-NCHW-FP32-B=ConvAsm1x1U:1,32,1,64,1,1,1,1;ConvOclDirectFwd1x1:1,256,1,1,0,1,32,4,0
80-18-192-1x1-416-18-192-2-0x0-1x1-1x1-0-NCHW-FP32-W=ConvAsmBwdWrW1x1:4,4,8,4,2,1,1,4,0,1
96-32-420-1x1-1104-32-420-1-0x0-1x1-1x1-0-NCHW-FP32-W=ConvAsmBwdWrW1x1:4,4,8,4,4,1,1,4,0,0
1584-84-538-1x1-4-84-538-6-0x0-1x1-1x1-0-NCHW-FP32-F=ConvOclDirectFwd1x1:1,256,1,1,0,4,16,4,0
128-56-56-1x1-192-56-56-32-0x0-1x1-1x1-0-NCHW-FP16-W=ConvAsmBwdWrW1x1:4,4,4,4,2,1,4,2,0,2
80-218-127-1x1-416-218-127-4-0x0-1x1-1x1-0-NCHW-FP32-W=ConvAsmBwdWrW1x1:4,4,4,4,4,1,1,4,0,1
128-28-28-1x1-256-28-28-64-0x0-1x1-1x1-0-NCHW-FP32-W=ConvAsmBwdWrW1x1:2,8,4,8,2,1,4,4,0,1
960-25-448-1x1-128-25-448-4-0x0-1x1-1x1-0-NCHW-FP32-B=ConvOclDirectFwd1x1:1,64,1,1,0,2,32,4,0
672-846-352-1x1-128-846-352-2-0x0-1x1-1x1-0-NCHW-FP32-F=ConvOclDirectFwd1x1:1,64,1,1,1,0,16,2048,0
512-128-128-1x1-256-128-128-4-0x0-1x1-1x1-0-NCHW-FP32-F=ConvOclDirectFwd1x1:1,64,1,1,1,0,32,2048,0
128-28-28-1x1-128-28-28-32-0x0-1x1-1x1-0-NCHW-FP16-F=ConvAsm1x1U:1,8,2,16,1,4,1,4;ConvOclDirectFwd1x1:1,64,1,1,0,4,16,4,0
256-56-56-1x1-128-56-56-64-0x0-1x1-1x1-0-NCHW-FP32-F=ConvAsm1x1U:3,32,7,32,1,1,1,1;ConvOclDirectFwd1x1:16,16,32,32,1,0,32,128,1;ConvActivAsm1x1U:3,16,3,64,4,1
1280-516-7-1x1-256-516-7-6-0x0-1x1-1x1-0-NCHW-FP32-W=ConvAsmBwdWrW1x1:2,8,4,4,8,1,2,4,0,1
320-7-7-3x3-160-7-7-1-1x1-1x1-1x1-0-NCHW-FP16-B=ConvOclDirectFwd:8,8,8,8,1,1,1,4,1
512-15-15-3x3-512-15-15-16-1x1-1x1-1x1-0-NCHW-FP32-B_g32=ConvOclDirectFwd:16,16,16,16,1,1,8,4,1
256-64-64-1x1-1024-64-64-4-0x0-1x1-1x1-0-NCHW-FP32-F=ConvOclDirectFwd1x1:1,64,1,1,1,4,16,2048,0
960-377-10-1x1-864-377-10-4-0x0-1x1-1x1-0-NCHW-FP32-F=ConvAsm1x1U:3,16,3,64,2,1,1,2;ConvOclDirectFwd1x1:1,64,1,1,1,1,64,2048,0
232-240-584-1x1-3-240-584-4-0x0-1x1-1x1-0-NCHW-FP32-F=ConvOclDirectFwd1x1:1,256,1,1,0,4,16,4,0
192-423-490-1x1-192-423-490-1-0x0-1x1-1x1-0-NCHW-FP32-B=ConvOclDirectFwd1x1:1,64,1,1,0,2,32,4,0
928-172-108-1x1-448-172-108-16-0x0-1x1-1x1-0-NCHW-FP32-B=ConvOclDirectFwd1x1:1,256,1,1,0,1,32,4,0
58-317-885-1x1-48-317-885-2-0x0-1x1-1x1-0-NCHW-FP32-B=ConvOclDirectFwd1x1:16,64,32,32,0,1,16,4,1
320-7-7-3x3-160-7-7-512-1x1-1x1-1x1-0-NCHW-FP32-W=ConvAsmBwdWrW3x3:0,1,8,4,7,1
960-14-14-1x1-128-14-14-512-0x0-1x1-1x1-0-NCHW-FP32-W=ConvAsmBwdWrW1x1:2,8,4,8,4,1,2,4,0,2
8-586-325-1x1-608-586-325-2-0x0-1x1-1x1-0-NCHW-FP32-B=ConvOclDirectFwd1x1:1,256,1,1,0,2,32,4,0
336-113-786-1x1-4-113-786-2-0x0-1x1-1x1-0-NCHW-FP32-F=ConvOclDirectFwd1x1:1,128,1,1,0,1,8,8,0
160-84-801-1x1-4-84-801-32-0x0-1x1-1x1-0-NCHW-FP32-F=ConvOclDirectFwd1x1:1,256,1,1,0,2,16,4,0
1008-422-51-1x1-16-422-51-16-0x0-1x1-1x1-0-NCHW-FP32-F=ConvOclDirectFwd1x1:1,64,1,1,1,1,64,2048,0
384-884-162-1x1-736-884-162-1-0x0-1x1-1x1-0-NCHW-FP32-F=ConvOclDirectFwd1x1:1,64,1,1,1,4,64,2048,0
256-20-84-3x3-256-20-84-16-1x1-1x1-1x1-0-NCHW-FP16-W=ConvAsmBwdWrW3x3:0,1,8,2,1,1
768-582-843-1x1-512-582-843-1-0x0-1x1-1x1-0-NCHW-FP32-B=ConvOclDirectFwd1x1:1,256,1,1,0,2,32,4,0
160-28-28-1x1-128-28-28-64-0x0-1x1-1x1-0-NCHW-FP16-B=ConvAsm1x1U:1,16,2,16,1,2,2,2;ConvOclDirectFwd1x1:1,64,1,1,0,4,16,4,0
192-14-14-1x1-2064-14-14-16-0x0-1x1-1x1-0-NCHW-FP16-W=ConvAsmBwdWrW1x1:4,4,4,4,4,1,1,2,0,2
32-241-555-1x1-32-241-555-32-0x0-1x1-1x1-0-NCHW-FP32-W=ConvAsmBwdWrW1x1:4,4,2,1,2,1,2,4,0,1
128-29-29-3x3-128-57-57-4-1x1-2x2-1x1-0-NCHW-FP32-B=ConvOclDirectFwd:8,16,32,32,4,2,4,4,1
144-1-877-1x1-1088-1-877-16-0x0-1x1-1x1-0-NCHW-FP32-B=ConvAsm1x1U:3,16,3,64,1,2,1,4;ConvOclDirectFwd1x1:1,128,1,1,0,1,32,4,0
224-334-18-1x1-720-334-18-48-0x0-1x1-1x1-0-NCHW-FP32-W=ConvAsmBwdWrW1x1:2,8,8,8,2,1,1,4,0,1
992-7-7-1x1-128-7-7-512-0x0-1x1-1x1-0-NCHW-FP16-F=ConvAsm1x1U:2,8,4,16,1,4,2,4;ConvOclDirectFwd1x1:1,64,1,1,0,1,16,4,0
60-28-28-1x1-240-28-28-2-0x0-1x1-1x1-0-NCHW-FP16-B_g3=ConvOclDirectFwd:16,16,16,16,1,1,8,4,2
320-8-8-1x1-1280-8-8-1-0x0-1x1-1x1-0-NCHW-FP32-B=ConvAsm1x1U:1,8,1,64,1,4,4,4;ConvOclDirectFwd1x1:1,256,1,1,0,1,4,8,0
384-13-13-3x3-256-13-13-128-1x1-1x1-1x1-0-NCHW-FP32-W=ConvAsmBwdWrW3x3:0,0,16,4,8,1
3-151-778-1x1-112-151-778-4-0x0-1x1-1x1-0-NCHW-FP32-F=ConvOclDirectFwd1x1:1,256,1,1,0,1,16,4,0
576-206-821-1x1-256-206-821-4-0x0-1x1-1x1-0-NCHW-FP32-F=ConvOclDirectFwd1x1:1,64,1,1,1,0,32,2048,0
232-3-620-1x1-672-3-620-1-0x0-1x1-1x1-0-NCHW-FP32-F=ConvAsm1x1U:3,8,3,64,1,4,1,8;ConvOclDirectFwd1x1:1,256,1,1,0,4,8,4,0
54-426-24-1x1-144-426-24-1-0x0-1x1-1x1-0-NCHW-FP32-B=ConvAsm1x1U:1,16,1,64,1,2,1,1;ConvOclDirectFwd1x1:1,256,1,1,0,2,16,4,0
928-968-25-1x1-736-968-25-4-0x0-1x1-1x1-0-NCHW-FP32-F=ConvOclDirectFwd1x1:1,64,1,1,1,4,64,2048,0
96-279-57-1x1-1760-279-57-2-0x0-1x1-1x1-0-NCHW-FP32-B=ConvOclDirectFwd1x1:1,256,1,1,0,1,32,4,0
24-924-880-1x1-2-924-880-8-0x0-1x1-1x1-0-NCHW-FP32-F=ConvOclDirectFwd1x1:1,64,1,1,0,4,16,4,0
2048-14-14-1x1-512-14-14-64-0x0-1x1-1x1-0-NCHW-FP16-W=ConvAsmBwdWrW1x1:2,8,4,8,2,2,1,4,0,1
192-28-28-1x1-32-28-28-1-0x0-1x1-1x1-0-NCHW-FP32-F=ConvAsm1x1U:1,8,1,64,1,4,2,1;ConvOclDirectFwd1x1:1,64,1,1,1,0,16,2048,0;ConvActivAsm1x1U:1,16,1,32,1,3
96-570-149-1x1-224-570-149-1-0x0-1x1-1x1-0-NCHW-FP32-F=ConvOclDirectFwd1x1:1,64,1,1,1,4,64,128,0
384-275-77-1x1-1312-275-77-2-0x0-1x1-1x1-0-NCHW-FP32-B=ConvOclDirectFwd1x1:1,256,1,1,0,1,32,4,0
80-240-29-1x1-144-240-29-4-0x0-1x1-1x1-0-NCHW-FP32-B=ConvAsm1x1U:4,16,4,64,2,2,1,1;ConvOclDirectFwd1x1:1,128,1,1,0,4,4,4,0
128-56-56-1x1-96-56-56-128-0x0-1x1-1x1-0-NCHW-FP16-W=ConvAsmBwdWrW1x1:4,4,4,1,8,1,4,4,0,0
120-14-14-3x3-120-7-7-4-1x1-2x2-1x1-0-NCHW-FP32-F=ConvOclDirectFwd:8,8,8,8,1,1,1,4,2
704-193-411-1x1-528-193-411-4-0x0-1x1-1x1-0-NCHW-FP32-F=ConvOclDirectFwd1x1:1,64,1,1,1,4,64,2048,0
432-510-1016-1x1-80-510-1016-2-0x0-1x1-1x1-0-NCHW-FP32-F=ConvOclDirectFwd1x1:1,64,1,1,1,4,64,2048,0
120-7-7-3x3-120-14-14-8-1x1-2x2-1x1-0-NCHW-FP16-B=ConvOclDirectFwd:16,8,16,16,1,2,1,4,1
512-14-14-3x3-512-28-28-32-1x1-2x2-1x1-0-NCHW-FP32-B_g32=ConvOclDirectFwd:8,16,32,32,4,2,4,4,2
19-178-269-1x1-464-178-269-2-0x0-1x1-1x1-0-NCHW-FP32-B=ConvOclDirectFwd1x1:1,256,1,1,0,2,8,4,0
128-28-28-1x1-160-28-28-128-0x0-1x1-1x1-0-NCHW-FP32-F=ConvAsm1x1U:3,16,3,32,2,2,2,2;ConvOclDirectFwd1x1:1,64,1,1,1,4,64,2048,0
48-35-35-1x1-256-35-35-256-0x0-1x1-1x1-0-NCHW-FP32-F=ConvAsm1x1U:2,16,2,64,3,2,2,1;ConvOclDirectFwd1x1:1,64,1,1,1,4,32,256,0
112-590-53-1x1-288-590-53-32-0x0-1x1-1x1-0-NCHW-FP32-W=ConvAsmBwdWrW1x1:4,4,8,4,2,1,1,2,0,1
544-412-34-1x1-32-412-34-1-0x0-1x1-1x1-0-NCHW-FP32-W=ConvAsmBwdWrW1x1:4,4,2,2,2,1,1,4,0,0
64-73-73-1x1-80-73-73-32-0x0-1x1-1x1-0-NCHW-FP32-F=ConvAsm1x1U:2,16,2,64,1,2,2,1;ConvOclDirectFwd1x1:1,64,1,1,1,0,16,256,0;ConvActivAsm1x1U:2,32,2,64,1,1
512-15-15-3x3-512-29-29-4-1x1-2x2-1x1-0-NCHW-FP32-B_g32=ConvOclDirectFwd:16,8,32,32,2,4,4,4,2
60-28-28-3x3-60-28-28-1024-1x1-1x1-1x1-0-NCHW-FP16-W=ConvAsmBwdWrW3x3:0,0,16,2,4,2
2016-586-84-1x1-352-586-84-1-0x0-1x1-1x1-0-NCHW-FP32-F=ConvOclDirectFwd1x1:1,64,1,1,1,0,64,2048,0
736-147-748-1x1-448-147-748-2-0x0-1x1-1x1-0-NCHW-FP32-B=ConvOclDirectFwd1x1:1,128,1,1,0,1,32,4,0
64-56-56-1x1-64-56-56-1-0x0-1x1-1x1-0-NCHW-FP32-F=ConvAsm1x1U:1,8,1,64,1,4,1,1;ConvOclDirectFwd1x1:1,64,1,1,1,0,16,256,0;ConvActivAsm1x1U:1,16,2,64,1,4
896-14-14-1x1-128-14-14-64-0x0-1x1-1x1-0-NCHW-FP16-W=ConvAsmBwdWrW1x1:2,8,4,8,2,1,2,4,0,1
256-56-56-1x1-128-56-56-16-0x0-1x1-1x1-0-NCHW-FP32-B=ConvAsm1x1U:2,32,2,64,1,1,2,2;ConvOclDirectFwd1x1:1,64,1,1,0,1,32,4,0
288-587-102-1x1-448-587-102-8-0x0-1x1-1x1-0-NCHW-FP32-B=ConvOclDirectFwd1x1:1,256,1,1,0,1,32,4,0
384-8-8-1x1-1280-8-8-256-0x0-1x1-1x1-0-NCHW-FP32-W=ConvAsmBwdWrW1x1:2,8,4,8,4,2,1,4,0,2
1-833-321-1x1-352-833-321-2-0x0-1x1-1x1-0-NCHW-FP32-F=ConvOclDirectFwd1x1:1,128,1,1,0,1,4,4,0
128-28-28-1x1-480-28-28-32-0x0-1x1-1x1-0-NCHW-FP32-B=ConvAsm1x1U:1,16,1,16,1,2,2,1;ConvOclDirectFwd1x1:1,128,1,1,0,4,16,4,0
432-524-324-1x1-1-524-324-6-0x0-1x1-1x1-0-NCHW-FP32-F=ConvOclDirectFwd1x1:1,256,1,1,0,4,16,4,0
336-83-654-1x1-320-83-654-8-0x0-1x1-1x1-0-NCHW-FP32-F=ConvOclDirectFwd1x1:1,64,1,1,1,1,32,2048,0
1024-15-15-1x1-512-15-15-48-0x0-1x1-1x1-0-NCHW-FP32-F=ConvAsm1x1U:4,16,4,64,3,2,1,2;ConvOclDirectFwd1x1:1,64,1,1,1,4,32,2048,0
480-9-936-1x1-832-9-936-32-0x0-1x1-1x1-0-NCHW-FP32-W=ConvAsmBwdWrW1x1:2,8,4,4,8,1,1,2,0,1
144-608-688-1x1-224-608-688-4-0x0-1x1-1x1-0-NCHW-FP32-F=ConvOclDirectFwd1x1:1,64,1,1,1,4,64,256,0
256-57-57-1x1-128-57-57-64-0x0-1x1-1x1-0-NCHW-FP32-F=ConvAsm1x1U:2,32,6,64,1,1,1,1;ConvOclDirectFwd1x1:1,64,1,1,1,1,16,2048,0
448-8-8-1x1-1280-8-8-256-0x0-1x1-1x1-0-NCHW-FP16-B=ConvAsm1x1U:1,16,2,32,1,2,1,8;ConvOclDirectFwd1x1:1,128,1,1,0,4,16,4,0
19-531-139-1x1-116-531-139-32-0x0-1x1-1x1-0-NCHW-FP32-W=ConvAsmBwdWrW1x1:4,4,2,2,4,1,2,4,0,2
224-31-155-1x1-1008-31-155-4-0x0-1x1-1x1-0-NCHW-FP32-B=ConvOclDirectFwd1x1:16,64,32,32,0,1,16,4,1
256-56-56-1x1-256-56-56-48-0x0-1x1-1x1-0-NCHW-FP32-F=ConvAsm1x1U:1,8,1,64,1,4,2,2;ConvOclDirectFwd1x1:1,64,1,1,1,1,16,2048,0
640-94-859-1x1-1120-94-859-4-0x0-1x1-1x1-0-NCHW-FP32-B=ConvOclDirectFwd1x1:1,128,1,1,0,2,32,4,0
3-224-224-7x7-96-109-109-256-0x0-2x2-1x1-0-NCHW-FP32-F=ConvOclDirectFwd:16,16,16,32,1,2,8,1,1
1024-14-14-1x1-256-14-14-1-0x0-1x1-1x1-0-NCHW-FP16-B=ConvAsm1x1U:1,8,2,32,1,4,4,1;ConvOclDirectFwd1x1:1,64,1,1,0,4,4,8,0
528-596-783-1x1-512-596-783-1-0x0-1x1-1x1-0-NCHW-FP32-F=ConvOclDirectFwd1x1:1,64,1,1,1,4,32,2048,0
480-507-212-1x1-800-507-212-1-0x0-1x1-1x1-0-NCHW-FP32-B=ConvOclDirectFwd1x1:1,64,1,1,0,1,32,4,0
128-56-56-1x1-256-56-56-64-0x0-1x1-1x1-0-NCHW-FP16-B=ConvAsm1x1U:1,8,2,64,1,4,2,2;ConvOclDirectFwd1x1:1,128,1,1,0,2,32,8,0
58-393-80-1x1-80-393-80-32-0x0-1x1-1x1-0-NCHW-FP32-W=ConvAsmBwdWrW1x1:4,4,4,4,2,1,2,4,0,1
256-17-17-3x3-224-35-35-256-0x0-2x2-1x1-0-NCHW-FP16-B=ConvOclDirectFwd:8,8,16,16,2,2,4,1,1
256-16-342-1x1-1584-16-342-4-0x0-1x1-1x1-0-NCHW-FP32-B=ConvOclDirectFwd1x1:1,256,1,1,0,4,16,8,0
384-301-760-1x1-672-301-760-1-0x0-1x1-1x1-0-NCHW-FP32-B=ConvOclDirectFwd1x1:1,128,1,1,0,1,32,4,0
352-188-246-1x1-992-188-246-2-0x0-1x1-1x1-0-NCHW-FP32-B=ConvOclDirectFwd1x1:1,256,1,1,0,4,16,4,0
58-814-965-1x1-8-814-965-1-0x0-1x1-1x1-0-NCHW-FP32-F=ConvOclDirectFwd1x1:1,64,1,1,0,2,16,4,0
128-14-14-1x1-320-14-14-128-0x0-1x1-1x1-0-NCHW-FP32-F=ConvAsm1x1U:4,16,4,64,1,2,1,2;ConvOclDirectFwd1x1:1,64,1,1,1,4,16,256,0
3-2-2-3x3-4-3-3-64-1x1-2x2-1x1-0-NCHW-FP32-W=ConvAsmBwdWrW3x3:0,0,16,1,3,3
352-709-754-1x1-3-709-754-1-0x0-1x1-1x1-0-NCHW-FP32-B=ConvOclDirectFwd1x1:1,256,1,1,0,2,16,8,0
416-28-28-1x1-128-28-28-64-0x0-1x1-1x1-0-NCHW-FP16-F=ConvAsm1x1U:1,8,2,16,2,4,1,4;ConvOclDirectFwd1x1:1,128,1,1,0,4,16,4,0
1024-8-8-3x3-1024-15-15-8-1x1-2x2-1x1-0-NCHW-FP32-W_g32=ConvOclBwdWrW2<1>:1,8,8,1,9;ConvOclBwdWrW2<2>:1,6,8,1,9;ConvOclBwdWrW2<4>:1,6,8,1,9;ConvOclBwdWrW2<8>:1,6,8,1,9;ConvAsmBwdWrW3x3:0,0,8,8,3,1
1248-545-31-1x1-256-545-31-8-0x0-1x1-1x1-0-NCHW-FP32-F=ConvOclDirectFwd1x1:1,64,1,1,1,0,32,2048,0
1296-133-289-1x1-960-133-289-2-0x0-1x1-1x1-0-NCHW-FP32-F=ConvOclDirectFwd1x1:1,64,1,1,1,0,16,2048,0
1-492-673-1x1-624-492-673-1-0x0-1x1-1x1-0-NCHW-FP32-B=ConvOclDirectFwd1x1:1,128,1,1,0,2,8,4,0
3-108-108-3x3-64-54-54-16-1x1-2x2-1x1-0-NCHW-FP32-F=ConvOclDirectFwd:16,16,16,16,1,1,8,1,1
960-14-14-1x1-128-14-14-64-0x0-1x1-1x1-0-NCHW-FP32-W=ConvAsmBwdWrW1x1:2,8,4,8,4,1,2,4,0,1
608-586-325-1x1-8-586-325-2-0x0-1x1-1x1-0-NCHW-FP32-F=ConvOclDirectFwd1x1:1,64,1,1,0,2,16,8,0
24-55-55-1x1-54-55-55-1024-0x0-1x1-1x1-0-NCHW-FP32-F=ConvAsm1x1U:1,8,1,16,1,1,1,1;ConvOclDirectFwd1x1:1,256,1,1,0,1,16,8,0
256-13-13-3x3-384-13-13-50-1x1-1x1-1x1-0-NCHW-FP32-W=ConvAsmBwdWrW3x3:0,0,16,4,8,1
232-144-143-1x1-864-144-143-6-0x0-1x1-1x1-0-NCHW-FP32-F=ConvOclDirectFwd1x1:1,128,1,1,0,2,32,4,0
112-858-27-1x1-232-858-27-16-0x0-1x1-1x1-0-NCHW-FP32-W=ConvAsmBwdWrW1x1:4,4,8,4,2,1,1,4,0,1
192-7-7-1x1-832-7-7-512-0x0-1x1-1x1-0-NCHW-FP16-B=ConvAsm1x1U:1,16,2,32,1,2,1,2;ConvOclDirectFwd1x1:1,64,1,1,0,1,32,4,0
256-475-238-1x1-1120-475-238-4-0x0-1x1-1x1-0-NCHW-FP32-B=ConvOclDirectFwd1x1:1,256,1,1,0,1,32,4,0
112-633-248-1x1-128-633-248-8-0x0-1x1-1x1-0-NCHW-FP32-B=ConvOclDirectFwd1x1:1,128,1,1,0,2,32,4,0
1968-203-385-1x1-144-203-385-1-0x0-1x1-1x1-0-NCHW-FP32-F=ConvOclDirectFwd1x1:1,64,1,1,1,0,32,256,0
116-14-14-1x1-116-14-14-16-0x0-1x1-1x1-0-NCHW-FP16-F=ConvAsm1x1U:1,8,2,16,1,2,2,1;ConvOclDirectFwd1x1:1,64,1,1,0,2,16,4,0
128-28-28-1x1-128-28-28-16-0x0-1x1-1x1-0-NCHW-FP32-F=ConvAsm1x1U:1,16,1,32,2,2,2,2;ConvOclDirectFwd1x1:1,64,1,1,1,4,16,256,0
1000-49-107-1x1-3-49-107-16-0x0-1x1-1x1-0-NCHW-FP32-F=ConvOclDirectFwd1x1:1,256,1,1,0,1,16,4,0
2-501-545-1x1-1-501-545-8-0x0-1x1-1x1-0-NCHW-FP32-B=ConvAsm1x1U:2,1,2,4,1,1,1,1;ConvOclDirectFwd1x1:1,256,1,1,0,1,4,4,0
64-14-14-1x1-512-14-14-512-0x0-1x1-1x1-0-NCHW-FP32-W=ConvAsmBwdWrW1x1:2,8,4,8,2,1,4,4,0,3
1920-135-814-1x1-928-135-814-1-0x0-1x1-1x1-0-NCHW-FP32-F=ConvOclDirectFwd1x1:1,64,1,1,1,1,64,2048,0
384-35-699-1x1-288-35-699-32-0x0-1x1-1x1-0-NCHW-FP32-B=ConvOclDirectFwd1x1:1,64,1,1,0,1,32,4,0
960-7-7-1x1-240-7-7-1024-0x0-1x1-1x1-0-NCHW-FP32-B_g3=ConvOclDirectFwd:8,8,8,8,1,1,8,2,2
128-56-56-3x3-128-56-56-64-1x1-1x1-1x1-0-NCHW-FP32-B_g32=ConvOclDirectFwd:8,32,16,32,2,1,8,4,2
144-557-55-1x1-1968-557-55-4-0x0-1x1-1x1-0-NCHW-FP32-B=ConvOclDirectFwd1x1:1,256,1,1,0,1,16,8,0
