src/kernels/gfx900_64.cd.pdb.txt
128-40-175-5x5-256-19-87-16-1x1-2x2-1x1-0-NCHW-FP32-F=ConvOclDirectFwd:16,16,16,32,1,2,8,1,2
224-28-28-1x1-128-28-28-16-0x0-1x1-1x1-0-NCHW-FP16-F=ConvOclDirectFwd1x1:1,64,1,1,0,4,16,4,0;ConvAsm1x1U:1,8,2,32,1,4,2,2
4-98-634-1x1-240-98-634-2-0x0-1x1-1x1-0-NCHW-FP32-B=ConvOclDirectFwd1x1:1,256,1,1,0,2,16,4,0
480-56-18-1x1-1760-56-18-64-0x0-1x1-1x1-0-NCHW-FP32-B=ConvOclDirectFwd1x1:1,64,1,1,0,4,16,4,0;ConvAsm1x1U:3,32,3,16,1,1,1,1
48-724-645-1x1-116-724-645-1-0x0-1x1-1x1-0-NCHW-FP32-F=ConvOclDirectFwd1x1:1,256,1,1,0,4,8,8,0
224-874-49-1x1-704-874-49-8-0x0-1x1-1x1-0-NCHW-FP32-B=ConvOclDirectFwd1x1:1,256,1,1,0,2,32,4,0
8-935-128-1x1-992-935-128-2-0x0-1x1-1x1-0-NCHW-FP32-F=ConvOclDirectFwd1x1:1,128,1,1,0,1,32,4,0
512-112-245-1x1-64-112-245-1-0x0-1x1-1x1-0-NCHW-FP32-F=ConvOclDirectFwd1x1:1,64,1,1,1,1,16,2048,0
32-79-341-5x10-32-38-166-1-0x0-2x2-1x1-0-NCHW-FP32-F=ConvOclDirectFwd:16,16,16,16,1,1,4,1,1
1664-69-693-1x1-896-69-693-6-0x0-1x1-1x1-0-NCHW-FP32-F=ConvOclDirectFwd1x1:1,64,1,1,1,0,16,2048,0
256-17-17-3x3-224-35-35-4-0x0-2x2-1x1-0-NCHW-FP16-B=ConvOclDirectFwd:8,16,16,16,2,1,4,1,2
128-14-14-1x1-480-14-14-16-0x0-1x1-1x1-0-NCHW-FP16-B=ConvOclDirectFwd1x1:1,64,1,1,0,4,8,4,0;ConvAsm1x1U:1,8,2,16,1,4,1,4
896-1-67-1x1-352-1-67-64-0x0-1x1-1x1-0-NCHW-FP32-W=ConvAsmBwdWrW1x1:1,16,2,8,4,1,2,4,0,3
256-56-56-3x3-256-28-28-48-1x1-2x2-1x1-0-NCHW-FP32-F_g32=ConvOclDirectFwd:16,16,32,32,2,2,8,2,1
256-683-104-1x1-96-683-104-2-0x0-1x1-1x1-0-NCHW-FP32-F=ConvOclDirectFwd1x1:1,64,1,1,1,4,64,2048,0
816-99-77-1x1-928-99-77-1-0x0-1x1-1x1-0-NCHW-FP32-F=ConvOclDirectFwd1x1:1,64,1,1,1,4,64,2048,0
736-22-189-1x1-24-22-189-8-0x0-1x1-1x1-0-NCHW-FP32-B=ConvOclDirectFwd1x1:1,256,1,1,0,1,16,4,0;ConvAsm1x1U:2,8,3,64,4,2,1,1
256-17-17-3x3-224-35-35-1-0x0-2x2-1x1-0-NCHW-FP32-B=ConvOclDirectFwd:8,16,32,32,4,2,4,4,1
832-7-7-1x1-48-7-7-512-0x0-1x1-1x1-0-NCHW-FP16-F=ConvOclDirectFwd1x1:1,64,1,1,0,1,16,4,0;ConvAsm1x1U:2,8,4,16,1,4,4,1
64-35-35-1x1-288-35-35-1-0x0-1x1-1x1-0-NCHW-FP32-W=ConvAsmBwdWrW1x1:2,8,2,4,2,1,1,4,0,1
800-9-873-1x1-1664-9-873-16-0x0-1x1-1x1-0-NCHW-FP32-B=ConvOclDirectFwd1x1:1,256,1,1,0,1,32,4,0
120-14-14-1x1-480-14-14-1024-0x0-1x1-1x1-0-NCHW-FP32-F_g3=ConvOclDirectFwd:16,16,16,16,1,1,8,4,2
768-17-17-1x1-128-17-17-256-0x0-1x1-1x1-0-NCHW-FP32-F=ConvOclDirectFwd1x1:1,64,1,1,1,1,32,2048,0;ConvAsm1x1U:4,16,5,64,1,2,1,2;ConvActivAsm1x1U:3,16,5,64,1,1
128-28-28-1x1-512-14-14-1-0x0-2x2-1x1-0-NCHW-FP16-F=ConvOclDirectFwd1x1:1,64,1,1,0,1,8,8,0;ConvAsm1x1U:1,8,2,64,1,4,4,2
80-73-73-1x1-64-73-73-64-0x0-1x1-1x1-0-NCHW-FP32-B=ConvOclDirectFwd1x1:1,256,1,1,0,1,32,4,0;ConvAsm1x1U:1,32,1,64,1,1,2,2
704-4-404-1x1-992-4-404-8-0x0-1x1-1x1-0-NCHW-FP32-F=ConvOclDirectFwd1x1:1,64,1,1,1,4,64,2048,0;ConvAsm1x1U:2,16,6,32,2,2,1,1
576-258-164-1x1-704-258-164-16-0x0-1x1-1x1-0-NCHW-FP32-F=ConvOclDirectFwd1x1:1,64,1,1,1,0,32,2048,0
480-28-28-1x1-128-28-28-32-0x0-1x1-1x1-0-NCHW-FP32-B=ConvOclDirectFwd1x1:1,128,1,1,0,4,16,4,0;ConvAsm1x1U:2,16,2,32,1,2,2,2
232-238-622-1x1-160-238-622-8-0x0-1x1-1x1-0-NCHW-FP32-F=ConvOclDirectFwd1x1:1,64,1,1,0,1,32,4,0
544-252-743-1x1-160-252-743-1-0x0-1x1-1x1-0-NCHW-FP32-F=ConvOclDirectFwd1x1:1,64,1,1,1,4,64,2048,0
416-13-493-1x1-928-13-493-32-0x0-1x1-1x1-0-NCHW-FP32-F=ConvOclDirectFwd1x1:1,64,1,1,1,4,64,2048,0
128-420-995-1x1-112-420-995-2-0x0-1x1-1x1-0-NCHW-FP32-F=ConvOclDirectFwd1x1:1,64,1,1,1,0,64,128,0
1-574-783-1x1-160-574-783-4-0x0-1x1-1x1-0-NCHW-FP32-F=ConvOclDirectFwd1x1:1,256,1,1,0,2,32,4,0
704-356-273-1x1-320-356-273-1-0x0-1x1-1x1-0-NCHW-FP32-F=ConvOclDirectFwd1x1:1,64,1,1,1,0,16,2048,0
832-7-7-1x1-384-7-7-32-0x0-1x1-1x1-0-NCHW-FP16-F=ConvOclDirectFwd1x1:1,128,1,1,0,1,8,8,0;ConvAsm1x1U:2,8,4,16,1,4,4,1
1296-70-40-1x1-288-70-40-2-0x0-1x1-1x1-0-NCHW-FP32-F=ConvOclDirectFwd1x1:1,64,1,1,1,1,16,2048,0;ConvAsm1x1U:4,8,7,64,2,4,1,4
480-50-150-1x1-1104-50-150-4-0x0-1x1-1x1-0-NCHW-FP32-B=ConvOclDirectFwd1x1:1,256,1,1,0,4,16,8,0
256-57-57-1x1-64-57-57-32-0x0-1x1-1x1-0-NCHW-FP32-B=ConvOclDirectFwd1x1:1,128,1,1,0,1,32,4,0;ConvAsm1x1U:2,16,3,64,3,1,1,4
58-896-800-1x1-32-896-800-2-0x0-1x1-1x1-0-NCHW-FP32-F=ConvOclDirectFwd1x1:1,256,1,1,0,1,32,4,0
128-7-7-5x5-32-7-7-128-2x2-1x1-1x1-0-NCHW-FP16-B=ConvOclDirectFwd:8,8,8,8,1,1,4,4,2
192-14-14-1x1-1104-14-14-16-0x0-1x1-1x1-0-NCHW-FP32-F=ConvOclDirectFwd1x1:1,64,1,1,1,4,16,2048,0;ConvAsm1x1U:1,16,1,32,4,2,1,8
112-14-14-3x3-224-14-14-64-1x1-1x1-1x1-0-NCHW-FP16-F=ConvOclDirectFwd:8,16,16,16,2,1,8,4,2;ConvOclDirectFwdFused:8,16,16,16,2,1,8,4,1
16-176-547-1x1-96-176-547-8-0x0-1x1-1x1-0-NCHW-FP32-W=ConvAsmBwdWrW1x1:4,4,4,1,2,1,2,4,0,1
3-90-771-1x1-24-90-771-8-0x0-1x1-1x1-0-NCHW-FP32-F=ConvOclDirectFwd1x1:1,128,1,1,0,1,8,4,0;ConvAsm1x1U:1,16,8,64,1,1,1,1
576-14-14-1x1-128-14-14-64-0x0-1x1-1x1-0-NCHW-FP32-B=ConvOclDirectFwd1x1:1,64,1,1,0,2,16,4,0;ConvAsm1x1U:1,16,1,64,2,2,2,2
32-147-147-3x3-32-149-149-16-0x0-1x1-1x1-0-NCHW-FP16-B=ConvOclDirectFwd:16,16,32,32,2,2,8,2,2
320-513-667-1x1-4-513-667-4-0x0-1x1-1x1-0-NCHW-FP32-F=ConvOclDirectFwd1x1:1,256,1,1,0,1,16,8,0
116-456-557-1x1-1472-456-557-1-0x0-1x1-1x1-0-NCHW-FP32-B=ConvOclDirectFwd1x1:1,128,1,1,0,2,32,4,0
96-54-54-1x1-16-54-54-64-0x0-1x1-1x1-0-NCHW-FP32-F=ConvOclDirectFwd1x1:1,64,1,1,1,1,64,128,0;ConvAsm1x1U:1,16,3,64,4,1,1,1
320-8-8-1x1-2048-8-8-64-0x0-1x1-1x1-0-NCHW-FP32-W=ConvAsmBwdWrW1x1:2,8,4,4,8,1,2,4,0,1
2048-8-8-1x1-1024-15-15-16-0x0-2x2-1x1-0-NCHW-FP32-B=ConvOclDirectFwd1x1:1,256,1,1,0,1,16,4,0;ConvAsm1x1U:2,16,2,32,2,2,2,4
144-14-14-1x1-512-14-14-16-0x0-1x1-1x1-0-NCHW-FP32-W=ConvAsmBwdWrW1x1:2,8,2,8,2,1,1,4,0,1
128-54-54-1x1-32-54-54-16-0x0-1x1-1x1-0-NCHW-FP16-F=ConvOclDirectFwd1x1:1,64,1,1,0,2,16,4,0;ConvAsm1x1U:1,8,2,32,1,4,2,2
512-28-28-1x1-256-28-28-32-0x0-1x1-1x1-0-NCHW-FP32-F=ConvOclDirectFwd1x1:1,64,1,1,1,4,32,2048,0;ConvAsm1x1U:3,16,5,32,2,2,2,1
54-699-97-1x1-608-699-97-1-0x0-1x1-1x1-0-NCHW-FP32-B=ConvOclDirectFwd1x1:1,256,1,1,0,1,32,4,0
128-28-28-1x1-288-28-28-32-0x0-1x1-1x1-0-NCHW-FP32-F=ConvOclDirectFwd1x1:1,64,1,1,1,1,32,2048,0;ConvAsm1x1U:1,16,1,64,4,2,2,2
80-773-644-1x1-116-773-644-6-0x0-1x1-1x1-0-NCHW-FP32-B=ConvOclDirectFwd1x1:1,128,1,1,0,2,16,8,0
16-318-20-1x1-2048-318-20-2-0x0-1x1-1x1-0-NCHW-FP32-F=ConvOclDirectFwd1x1:1,64,1,1,1,1,16,64,0
352-475-908-1x1-736-475-908-1-0x0-1x1-1x1-0-NCHW-FP32-F=ConvOclDirectFwd1x1:1,64,1,1,1,1,64,2048,0
448-971-137-1x1-54-971-137-6-0x0-1x1-1x1-0-NCHW-FP32-F=ConvOclDirectFwd1x1:1,256,1,1,0,1,8,4,0
4-455-878-1x1-16-455-878-12-0x0-1x1-1x1-0-NCHW-FP32-F=ConvOclDirectFwd1x1:1,256,1,1,0,2,16,4,0
4-454-464-1x1-4-454-464-12-0x0-1x1-1x1-0-NCHW-FP32-W=ConvAsmBwdWrW1x1:4,4,2,1,2,1,4,4,0,2
192-28-28-1x1-288-28-28-16-0x0-1x1-1x1-0-NCHW-FP16-W=ConvAsmBwdWrW1x1:4,4,4,4,4,1,2,2,0,1
1000-748-72-1x1-432-748-72-6-0x0-1x1-1x1-0-NCHW-FP32-B=ConvOclDirectFwd1x1:1,256,1,1,0,4,16,4,0
64-56-56-3x3-64-56-56-2-1x1-1x1-1x1-0-NCHW-FP16-W=ConvAsmBwdWrW3x3:0,0,16,1,2,1
64-64-128-5x5-24-64-128-1-2x2-1x1-1x1-0-NCHW-FP16-B=ConvOclDirectFwd:8,32,16,32,2,1,2,4,1
128-14-14-1x1-288-14-14-128-0x0-1x1-1x1-0-NCHW-FP32-W=ConvAsmBwdWrW1x1:4,4,4,4,4,1,2,4,0,0
128-789-88-1x1-992-789-88-6-0x0-1x1-1x1-0-NCHW-FP32-F=ConvOclDirectFwd1x1:1,64,1,1,1,0,64,2048,0
512-14-14-1x1-192-14-14-4-0x0-1x1-1x1-0-NCHW-FP32-F=ConvOclDirectFwd1x1:1,64,1,1,1,4,16,128,0;ConvAsm1x1U:4,8,4,64,1,4,4,1
512-14-14-1x1-112-14-14-16-0x0-1x1-1x1-0-NCHW-FP16-F=ConvOclDirectFwd1x1:1,128,1,1,0,4,4,4,0;ConvAsm1x1U:1,8,2,64,2,4,4,2
3-145-295-1x1-1024-145-295-6-0x0-1x1-1x1-0-NCHW-FP32-F=ConvOclDirectFwd1x1:1,256,1,1,0,1,64,4,0
528-326-201-1x1-256-326-201-6-0x0-1x1-1x1-0-NCHW-FP32-B=ConvOclDirectFwd1x1:1,256,1,1,0,2,32,4,0
96-109-109-7x7-3-224-224-64-0x0-2x2-1x1-0-NCHW-FP32-B=ConvOclDirectFwd:16,16,32,32,2,2,8,2,1
608-326-11-1x1-1008-326-11-1-0x0-1x1-1x1-0-NCHW-FP32-W=ConvAsmBwdWrW1x1:2,8,4,4,8,1,1,4,0,1
128-14-14-1x1-256-14-14-32-0x0-1x1-1x1-0-NCHW-FP32-B=ConvOclDirectFwd1x1:1,64,1,1,0,4,16,4,0;ConvAsm1x1U:1,16,1,32,1,2,1,2
128-28-28-3x3-128-28-28-16-1x1-1x1-1x1-0-NCHW-FP16-F=ConvOclDirectFwd:16,16,32,32,2,2,8,2,2;ConvOclDirectFwdFused:16,16,32,32,2,2,8,2,1
256-13-13-3x3-384-13-13-2-1x1-1x1-1x1-0-NCHW-FP32-W=ConvAsmBwdWrW3x3:0,1,16,2,5,1
624-202-586-1x1-1104-202-586-1-0x0-1x1-1x1-0-NCHW-FP32-F=ConvOclDirectFwd1x1:1,64,1,1,1,1,32,2048,0
512-14-14-1x1-24-14-14-512-0x0-1x1-1x1-0-NCHW-FP16-F=ConvOclDirectFwd1x1:1,256,1,1,0,4,16,4,0;ConvAsm1x1U:2,8,4,64,1,4,4,1
64-73-73-3x3-96-71-71-4-0x0-1x1-1x1-0-NCHW-FP32-F=ConvOclDirectFwd:16,8,16,16,1,2,8,4,2
2-23-920-1x1-1-23-920-1024-0x0-1x1-1x1-0-NCHW-FP32-B=ConvOclDirectFwd1x1:1,128,1,1,0,1,16,4,0;ConvAsm1x1U:1,1,1,4,1,1,1,1
128-17-17-1x1-1024-17-17-256-0x0-1x1-1x1-0-NCHW-FP16-B=ConvOclDirectFwd1x1:1,64,1,1,0,1,16,4,0;ConvAsm1x1U:1,16,2,32,1,2,1,2
416-856-12-1x1-8-856-12-1-0x0-1x1-1x1-0-NCHW-FP32-F=ConvOclDirectFwd1x1:1,64,1,1,0,1,4,8,0
16-54-54-1x1-64-54-54-128-0x0-1x1-1x1-0-NCHW-FP16-W=ConvAsmBwdWrW1x1:4,4,2,1,4,1,4,4,0,2
16-641-405-1x1-80-641-405-12-0x0-1x1-1x1-0-NCHW-FP32-B=ConvOclDirectFwd1x1:1,256,1,1,0,1,16,8,0
416-142-3-1x1-832-142-3-256-0x0-1x1-1x1-0-NCHW-FP32-F=ConvOclDirectFwd1x1:1,64,1,1,1,0,16,2048,0;ConvAsm1x1U:1,32,7,16,1,1,1,1
256-7-7-3x3-256-14-14-512-1x1-2x2-1x1-0-NCHW-FP32-W=ConvAsmBwdWrW3x3:0,0,8,8,6,1
32-10-890-1x1-736-10-890-32-0x0-1x1-1x1-0-NCHW-FP32-B=ConvOclDirectFwd1x1:1,256,1,1,0,4,16,8,0
320-38-704-1x1-1056-38-704-12-0x0-1x1-1x1-0-NCHW-FP32-B=ConvOclDirectFwd1x1:1,128,1,1,0,2,32,4,0
24-545-385-1x1-128-545-385-12-0x0-1x1-1x1-0-NCHW-FP32-F=ConvOclDirectFwd1x1:1,256,1,1,0,1,32,4,0
512-28-28-3x3-256-28-28-32-1x1-1x1-1x1-0-NCHW-FP16-B=ConvOclDirectFwd:32,8,32,32,1,4,8,2,2
192-28-28-1x1-128-28-28-16-0x0-1x1-1x1-0-NCHW-FP16-B=ConvOclDirectFwd1x1:1,64,1,1,0,4,16,4,0;ConvAsm1x1U:1,8,2,32,1,4,2,2
48-353-40-1x1-544-353-40-2-0x0-1x1-1x1-0-NCHW-FP32-F=ConvOclDirectFwd1x1:1,64,1,1,1,4,64,2048,0
32-27-27-1x1-128-27-27-512-0x0-1x1-1x1-0-NCHW-FP16-F=ConvOclDirectFwd1x1:1,256,1,1,0,1,32,4,0;ConvAsm1x1U:1,16,2,64,1,2,1,2
224-744-773-1x1-128-744-773-4-0x0-1x1-1x1-0-NCHW-FP32-B=ConvOclDirectFwd1x1:1,128,1,1,0,2,32,4,0
432-882-210-1x1-448-882-210-2-0x0-1x1-1x1-0-NCHW-FP32-F=ConvOclDirectFwd1x1:1,64,1,1,1,4,32,2048,0
960-103-581-1x1-672-103-581-8-0x0-1x1-1x1-0-NCHW-FP32-F=ConvOclDirectFwd1x1:1,64,1,1,1,4,64,2048,0
64-28-28-3x3-64-56-56-64-1x1-2x2-1x1-0-NCHW-FP16-B=ConvOclDirectFwd:16,16,32,32,2,2,8,2,2
256-13-13-3x3-256-13-13-512-1x1-1x1-1x1-0-NCHW-FP16-F=ConvOclDirectFwd:8,8,16,16,2,2,8,1,1
64-57-57-1x1-128-57-57-48-0x0-1x1-1x1-0-NCHW-FP32-F=ConvOclDirectFwd1x1:1,64,1,1,1,1,16,2048,0;ConvAsm1x1U:2,16,2,32,1,1,1,1
576-224-404-1x1-116-224-404-1-0x0-1x1-1x1-0-NCHW-FP32-B=ConvOclDirectFwd1x1:1,128,1,1,0,4,8,4,0
8-34-864-1x1-4-34-864-4-0x0-1x1-1x1-0-NCHW-FP32-W=ConvAsmBwdWrW1x1:4,4,2,1,2,1,4,4,0,3
832-9-464-1x1-816-9-464-64-0x0-1x1-1x1-0-NCHW-FP32-B=ConvOclDirectFwd1x1:1,128,1,1,0,2,16,8,0;ConvAsm1x1U:4,16,6,64,1,1,2,2
1024-15-15-1x1-1024-15-15-8-0x0-1x1-1x1-0-NCHW-FP32-W=ConvAsmBwdWrW1x1:1,16,4,4,8,1,1,4,0,1
80-73-73-1x1-64-73-73-64-0x0-1x1-1x1-0-NCHW-FP16-B=ConvOclDirectFwd1x1:1,256,1,1,0,1,32,4,0;ConvAsm1x1U:1,16,2,64,1,2,1,4
128-39-174-5x5-64-80-350-16-1x1-2x2-1x1-0-NCHW-FP32-B=ConvOclDirectFwd:16,32,16,32,1,1,4,2,1
116-14-14-1x1-116-14-14-8-0x0-1x1-1x1-0-NCHW-FP32-W=ConvAsmBwdWrW1x1:4,4,4,2,2,1,1,4,0,1
192-35-35-1x1-384-35-35-64-0x0-1x1-1x1-0-NCHW-FP16-W=ConvAsmBwdWrW1x1:4,4,4,4,4,1,4,2,0,2
64-35-35-1x1-256-35-35-256-0x0-1x1-1x1-0-NCHW-FP32-W=ConvAsmBwdWrW1x1:2,8,2,4,4,1,2,4,0,3
896-67-906-1x1-320-67-906-2-0x0-1x1-1x1-0-NCHW-FP32-B=ConvOclDirectFwd1x1:1,256,1,1,0,1,32,4,0
58-542-795-1x1-58-542-795-4-0x0-1x1-1x1-0-NCHW-FP32-F=ConvOclDirectFwd1x1:1,256,1,1,0,2,16,4,0
64-28-28-1x1-192-28-28-32-0x0-1x1-1x1-0-NCHW-FP16-W=ConvAsmBwdWrW1x1:4,4,4,1,8,1,2,4,0,1
1104-108-238-1x1-2-108-238-12-0x0-1x1-1x1-0-NCHW-FP32-F=ConvOclDirectFwd1x1:1,256,1,1,0,4,16,4,0
160-109-662-1x1-576-109-662-8-0x0-1x1-1x1-0-NCHW-FP32-F=ConvOclDirectFwd1x1:1,64,1,1,1,0,32,2048,0
816-646-252-1x1-896-646-252-2-0x0-1x1-1x1-0-NCHW-FP32-F=ConvOclDirectFwd1x1:1,64,1,1,1,1,16,2048,0
336-223-788-1x1-48-223-788-4-0x0-1x1-1x1-0-NCHW-FP32-F=ConvOclDirectFwd1x1:1,64,1,1,1,4,32,2048,0
1088-202-662-1x1-800-202-662-2-0x0-1x1-1x1-0-NCHW-FP32-F=ConvOclDirectFwd1x1:1,64,1,1,1,4,64,2048,0
32-27-27-1x1-256-27-27-64-0x0-1x1-1x1-0-NCHW-FP32-W=ConvAsmBwdWrW1x1:4,4,4,2,4,1,2,4,0,2
1024-7-7-1x1-464-7-7-32-0x0-1x1-1x1-0-NCHW-FP32-W=ConvAsmBwdWrW1x1:1,16,4,4,8,1,1,4,0,1
640-7-7-1x1-128-7-7-256-0x0-1x1-1x1-0-NCHW-FP32-W=ConvAsmBwdWrW1x1:4,4,4,4,2,1,1,4,0,0
800-305-208-1x1-1000-305-208-2-0x0-1x1-1x1-0-NCHW-FP32-B=ConvOclDirectFwd1x1:1,256,1,1,0,2,16,8,0
704-112-79-1x1-1216-112-79-2-0x0-1x1-1x1-0-NCHW-FP32-B=ConvOclDirectFwd1x1:1,128,1,1,0,2,32,4,0
576-142-34-1x1-288-142-34-48-0x0-1x1-1x1-0-NCHW-FP32-F=ConvOclDirectFwd1x1:1,64,1,1,1,0,64,2048,0;ConvAsm1x1U:2,32,7,64,1,1,1,1
128-28-28-3x3-32-28-28-32-1x1-1x1-1x1-0-NCHW-FP16-B=ConvOclDirectFwd:16,16,32,32,2,2,4,4,2
224-861-24-1x1-144-861-24-48-0x0-1x1-1x1-0-NCHW-FP32-F=ConvOclDirectFwd1x1:1,64,1,1,1,1,32,2048,0
528-20-667-1x1-480-20-667-6-0x0-1x1-1x1-0-NCHW-FP32-B=ConvOclDirectFwd1x1:1,128,1,1,0,2,32,4,0
8-668-720-1x1-832-668-720-1-0x0-1x1-1x1-0-NCHW-FP32-F=ConvOclDirectFwd1x1:1,64,1,1,0,1,32,4,0
192-28-28-1x1-32-28-28-128-0x0-1x1-1x1-0-NCHW-FP16-B=ConvOclDirectFwd1x1:1,64,1,1,0,4,16,4,0;ConvAsm1x1U:1,8,2,16,1,4,2,2
120-14-14-3x3-120-7-7-16-1x1-2x2-1x1-0-NCHW-FP32-F=ConvOclDirectFwd:8,8,8,8,1,1,4,1,2
58-28-28-1x1-58-28-28-1-0x0-1x1-1x1-0-NCHW-FP16-W=ConvAsmBwdWrW1x1:4,4,2,1,2,1,1,2,0,1
192-28-28-1x1-672-28-28-16-0x0-1x1-1x1-0-NCHW-FP32-W=ConvAsmBwdWrW1x1:1,16,2,8,4,1,2,4,0,2
336-858-414-1x1-192-858-414-4-0x0-1x1-1x1-0-NCHW-FP32-F=ConvOclDirectFwd1x1:1,64,1,1,1,0,16,2048,0
144-324-635-1x1-58-324-635-6-0x0-1x1-1x1-0-NCHW-FP32-F=ConvOclDirectFwd1x1:1,256,1,1,0,4,4,8,0
1968-380-42-1x1-864-380-42-12-0x0-1x1-1x1-0-NCHW-FP32-F=ConvOclDirectFwd1x1:1,64,1,1,1,0,64,2048,0
528-393-459-1x1-544-393-459-1-0x0-1x1-1x1-0-NCHW-FP32-F=ConvOclDirectFwd1x1:1,64,1,1,1,0,64,2048,0
544-295-48-1x1-2-295-48-16-0x0-1x1-1x1-0-NCHW-FP32-B=ConvOclDirectFwd1x1:1,128,1,1,0,2,16,8,0
64-112-112-1x1-64-112-112-64-0x0-1x1-1x1-0-NCHW-FP32-B=ConvOclDirectFwd1x1:1,256,1,1,0,2,32,4,0;ConvAsm1x1U:2,32,3,16,1,1,1,2
896-726-283-1x1-224-726-283-2-0x0-1x1-1x1-0-NCHW-FP32-B=ConvOclDirectFwd1x1:1,64,1,1,0,2,32,4,0
256-13-13-3x3-384-13-13-2-1x1-1x1-1x1-0-NCHW-FP16-W=ConvAsmBwdWrW3x3:0,0,8,4,1,1
1312-683-174-1x1-1-683-174-1-0x0-1x1-1x1-0-NCHW-FP32-F=ConvOclDirectFwd1x1:1,256,1,1,0,2,16,8,0
896-88-372-1x1-544-88-372-1-0x0-1x1-1x1-0-NCHW-FP32-B=ConvOclDirectFwd1x1:1,64,1,1,0,2,32,4,0
128-56-56-1x1-96-56-56-64-0x0-1x1-1x1-0-NCHW-FP32-W=ConvAsmBwdWrW1x1:4,4,4,2,8,1,4,4,0,1
608-7-7-1x1-128-7-7-16-0x0-1x1-1x1-0-NCHW-FP32-W=ConvAsmBwdWrW1x1:2,8,2,8,2,1,2,4,0,0
64-12-120-3x3-32-12-120-4-1x1-1x1-1x1-0-NCHW-FP32-W=ConvAsmBwdWrW3x3:0,0,16,2,1,4
128-112-112-3x3-128-112-112-64-1x1-1x1-1x1-0-NCHW-FP16-B=ConvOclDirectFwd:8,16,16,32,2,2,8,1,1
1280-824-121-1x1-160-824-121-2-0x0-1x1-1x1-0-NCHW-FP32-F=ConvOclDirectFwd1x1:1,64,1,1,1,4,64,2048,0
24-909-928-1x1-232-909-928-1-0x0-1x1-1x1-0-NCHW-FP32-B=ConvOclDirectFwd1x1:1,256,1,1,0,2,16,8,0
256-80-128-3x3-256-80-128-32-1x1-1x1-1x1-0-NCHW-FP16-B=ConvOclDirectFwd:8,16,16,32,2,2,8,1,1
288-112-116-1x1-80-112-116-8-0x0-1x1-1x1-0-NCHW-FP32-F=ConvOclDirectFwd1x1:1,64,1,1,1,4,64,2048,0;ConvAsm1x1U:4,16,4,64,3,1,1,1
384-27-27-1x1-48-27-27-512-0x0-1x1-1x1-0-NCHW-FP16-F=ConvOclDirectFwd1x1:1,128,1,1,0,1,16,4,0;ConvAsm1x1U:2,8,4,64,1,4,1,2
64-27-27-1x1-384-27-27-512-0x0-1x1-1x1-0-NCHW-FP16-B=ConvOclDirectFwd1x1:1,128,1,1,0,1,32,4,0;ConvAsm1x1U:1,16,2,16,1,2,1,4
512-28-28-1x1-256-56-56-4-0x0-2x2-1x1-0-NCHW-FP16-W=ConvAsmBwdWrW1x1:2,8,4,4,2,1,1,4,0,1
144-374-73-1x1-1024-374-73-6-0x0-1x1-1x1-0-NCHW-FP32-B=ConvOclDirectFwd1x1:1,128,1,1,0,2,32,4,0
32-14-14-3x3-128-14-14-512-1x1-1x1-1x1-0-NCHW-FP16-W=ConvAsmBwdWrW3x3:0,0,8,2,8,8
256-27-27-1x1-32-27-27-64-0x0-1x1-1x1-0-NCHW-FP32-B=ConvOclDirectFwd1x1:1,256,1,1,0,1,32,4,0;ConvAsm1x1U:2,32,2,64,1,1,2,1
232-7-7-1x1-232-7-7-2-0x0-1x1-1x1-0-NCHW-FP32-W=ConvAsmBwdWrW1x1:1,16,2,2,2,1,1,4,0,2
528-486-56-1x1-480-486-56-8-0x0-1x1-1x1-0-NCHW-FP32-F=ConvOclDirectFwd1x1:1,64,1,1,1,4,64,2048,0
640-79-149-1x1-640-79-149-48-0x0-1x1-1x1-0-NCHW-FP32-B=ConvOclDirectFwd1x1:1,256,1,1,0,1,32,4,0
224-14-14-1x1-576-14-14-32-0x0-1x1-1x1-0-NCHW-FP32-W=ConvAsmBwdWrW1x1:2,8,4,8,4,1,2,4,0,1
128-7-7-1x1-576-7-7-128-0x0-1x1-1x1-0-NCHW-FP16-W=ConvAsmBwdWrW1x1:4,4,4,4,2,1,2,2,0,1
19-544-337-1x1-4-544-337-12-0x0-1x1-1x1-0-NCHW-FP32-B=ConvOclDirectFwd1x1:1,128,1,1,0,2,16,4,0;ConvAsm1x1U:1,4,4,1,1,1,1,1
512-14-14-1x1-24-14-14-256-0x0-1x1-1x1-0-NCHW-FP16-F=ConvOclDirectFwd1x1:1,256,1,1,0,2,8,4,0;ConvAsm1x1U:2,8,4,64,1,4,4,1
384-13-13-3x3-192-13-13-8-1x1-1x1-1x1-0-NCHW-FP16-W=ConvAsmBwdWrW3x3:0,0,8,4,3,1
448-8-8-1x1-1280-8-8-32-0x0-1x1-1x1-0-NCHW-FP32-B=ConvOclDirectFwd1x1:1,64,1,1,0,4,8,4,0;ConvAsm1x1U:1,32,1,64,2,1,2,2
128-7-7-1x1-832-7-7-256-0x0-1x1-1x1-0-NCHW-FP32-F=ConvOclDirectFwd1x1:1,64,1,1,1,1,32,256,0;ConvAsm1x1U:1,8,1,64,2,4,1,8
288-35-35-1x1-64-35-35-128-0x0-1x1-1x1-0-NCHW-FP32-F=ConvOclDirectFwd1x1:1,64,1,1,1,0,16,2048,0;ConvAsm1x1U:3,16,3,64,2,2,1,4;ConvActivAsm1x1U:2,16,2,64,3,1
64-80-350-3x3-64-80-350-2-1x1-1x1-1x1-0-NCHW-FP16-F=ConvOclDirectFwd:8,32,16,32,2,1,8,2,2
8-801-977-1x1-512-801-977-1-0x0-1x1-1x1-0-NCHW-FP32-B=ConvOclDirectFwd1x1:1,256,1,1,0,1,32,4,0
992-106-711-1x1-912-106-711-1-0x0-1x1-1x1-0-NCHW-FP32-B=ConvOclDirectFwd1x1:1,256,1,1,0,2,16,4,0
32-14-14-1x1-512-14-14-64-0x0-1x1-1x1-0-NCHW-FP32-B=ConvOclDirectFwd1x1:1,256,1,1,0,4,16,4,0;ConvAsm1x1U:1,16,1,64,1,2,2,2
288-14-14-3x3-144-14-14-16-1x1-1x1-1x1-0-NCHW-FP16-B=ConvOclDirectFwd:16,8,16,16,1,2,4,2,2
1104-685-273-1x1-640-685-273-1-0x0-1x1-1x1-0-NCHW-FP32-F=ConvOclDirectFwd1x1:1,64,1,1,1,4,16,2048,0
1000-129-8-1x1-1824-129-8-1-0x0-1x1-1x1-0-NCHW-FP32-W=ConvAsmBwdWrW1x1:1,16,4,8,4,1,1,4,0,1
116-136-53-1x1-1856-136-53-16-0x0-1x1-1x1-0-NCHW-FP32-W=ConvAsmBwdWrW1x1:2,8,4,8,4,1,1,4,0,1
1200-56-162-1x1-672-56-162-1-0x0-1x1-1x1-0-NCHW-FP32-F=ConvOclDirectFwd1x1:1,64,1,1,1,4,64,2048,0
384-35-35-1x1-64-35-35-256-0x0-1x1-1x1-0-NCHW-FP32-W=ConvAsmBwdWrW1x1:2,8,4,4,4,1,4,4,0,1
704-241-322-1x1-48-241-322-8-0x0-1x1-1x1-0-NCHW-FP32-B=ConvOclDirectFwd1x1:1,256,1,1,0,2,16,4,0
528-600-546-1x1-1152-600-546-1-0x0-1x1-1x1-0-NCHW-FP32-B=ConvOclDirectFwd1x1:1,64,1,1,0,2,32,4,0
16-433-909-1x1-24-433-909-4-0x0-1x1-1x1-0-NCHW-FP32-F=ConvOclDirectFwd1x1:1,256,1,1,0,1,16,8,0
224-68-740-1x1-528-68-740-6-0x0-1x1-1x1-0-NCHW-FP32-B=ConvOclDirectFwd1x1:1,256,1,1,0,4,16,8,0
96-1016-147-1x1-1000-1016-147-2-0x0-1x1-1x1-0-NCHW-FP32-F=ConvOclDirectFwd1x1:1,256,1,1,0,2,16,4,0
576-7-7-1x1-128-7-7-512-0x0-1x1-1x1-0-NCHW-FP32-F=ConvOclDirectFwd1x1:1,64,1,1,1,4,32,2048,0;ConvAsm1x1U:2,16,2,32,2,2,2,2
128-64-128-1x1-832-64-128-1-0x0-1x1-1x1-0-NCHW-FP32-W=ConvAsmBwdWrW1x1:2,8,4,4,8,1,2,4,0,1
512-64-128-1x1-160-64-128-1-0x0-1x1-1x1-0-NCHW-FP32-F=ConvOclDirectFwd1x1:1,64,1,1,1,0,16,2048,0;ConvOclDirectFwdFused:1,64,1,1,1,4,16,256,0
3-624-829-1x1-2-624-829-1-0x0-1x1-1x1-0-NCHW-FP32-B=ConvOclDirectFwd1x1:16,64,32,32,0,2,16,4,1;ConvAsm1x1U:4,1,8,4,1,1,1,2
544-627-707-1x1-912-627-707-1-0x0-1x1-1x1-0-NCHW-FP32-B=ConvOclDirectFwd1x1:1,256,1,1,0,1,16,8,0
128-28-28-1x1-480-28-28-512-0x0-1x1-1x1-0-NCHW-FP16-B=ConvOclDirectFwd1x1:1,64,1,1,0,4,16,4,0;ConvAsm1x1U:1,16,2,16,1,2,1,1
116-28-28-1x1-116-28-28-16-0x0-1x1-1x1-0-NCHW-FP16-B=ConvOclDirectFwd1x1:1,64,1,1,0,2,8,4,0;ConvAsm1x1U:2,4,4,4,1,2,1,4
384-870-139-1x1-224-870-139-2-0x0-1x1-1x1-0-NCHW-FP32-F=ConvOclDirectFwd1x1:1,64,1,1,1,0,64,2048,0
96-691-378-1x1-4-691-378-16-0x0-1x1-1x1-0-NCHW-FP32-F=ConvOclDirectFwd1x1:1,256,1,1,0,2,16,8,0
672-14-14-1x1-128-14-14-32-0x0-1x1-1x1-0-NCHW-FP32-B=ConvOclDirectFwd1x1:1,256,1,1,0,4,16,4,0;ConvAsm1x1U:1,16,1,16,1,1,2,2
512-7-7-1x1-512-7-7-16-0x0-1x1-1x1-0-NCHW-FP16-F=ConvOclDirectFwd1x1:1,128,1,1,0,1,8,8,0;ConvAsm1x1U:2,8,4,16,1,4,4,1
416-211-31-1x1-16-211-31-1-0x0-1x1-1x1-0-NCHW-FP32-F=ConvOclDirectFwd1x1:1,64,1,1,1,4,32,64,0;ConvAsm1x1U:1,8,1,64,1,4,2,1
48-35-35-1x1-256-35-35-128-0x0-1x1-1x1-0-NCHW-FP32-B=ConvOclDirectFwd1x1:1,256,1,1,0,1,32,4,0;ConvAsm1x1U:1,32,1,64,1,1,1,1
32-14-14-5x5-64-14-14-32-2x2-1x1-1x1-0-NCHW-FP32-F=ConvOclDirectFwd:8,16,16,16,2,1,4,4,2;ConvOclDirectFwdFused:8,8,16,16,2,2,4,4,2
384-13-13-3x3-384-13-13-16-1x1-1x1-1x1-0-NCHW-FP16-W=ConvAsmBwdWrW3x3:0,0,8,4,4,1
384-35-35-1x1-96-35-35-32-0x0-1x1-1x1-0-NCHW-FP16-F=ConvOclDirectFwd1x1:1,64,1,1,0,1,16,4,0;ConvAsm1x1U:2,8,4,64,1,4,2,2
128-7-7-1x1-640-7-7-32-0x0-1x1-1x1-0-NCHW-FP32-F=ConvOclDirectFwd1x1:1,64,1,1,1,0,16,256,0;ConvAsm1x1U:1,8,1,64,2,4,1,4
672-678-91-1x1-464-678-91-4-0x0-1x1-1x1-0-NCHW-FP32-B=ConvOclDirectFwd1x1:1,128,1,1,0,2,16,4,0
192-13-13-3x3-384-13-13-2048-1x1-1x1-1x1-0-NCHW-FP16-F=ConvOclDirectFwd:8,8,16,16,2,2,8,4,2
896-7-7-1x1-128-7-7-64-0x0-1x1-1x1-0-NCHW-FP32-B=ConvOclDirectFwd1x1:1,128,1,1,0,1,8,4,0;ConvAsm1x1U:2,16,2,32,1,2,4,1
352-6-749-1x1-224-6-749-64-0x0-1x1-1x1-0-NCHW-FP32-W=ConvAsmBwdWrW1x1:4,4,4,4,8,1,1,4,0,1
1472-710-396-1x1-4-710-396-1-0x0-1x1-1x1-0-NCHW-FP32-F=ConvOclDirectFwd1x1:1,256,1,1,0,4,16,4,0
1056-103-150-1x1-608-103-150-16-0x0-1x1-1x1-0-NCHW-FP32-B=ConvOclDirectFwd1x1:1,64,1,1,0,2,32,4,0
160-14-14-1x1-528-14-14-128-0x0-1x1-1x1-0-NCHW-FP32-B=ConvOclDirectFwd1x1:1,256,1,1,0,4,16,4,0;ConvAsm1x1U:1,16,1,32,2,1,1,4
128-28-28-1x1-416-28-28-64-0x0-1x1-1x1-0-NCHW-FP32-W=ConvAsmBwdWrW1x1:1,16,2,8,4,1,4,4,0,1
128-633-248-1x1-112-633-248-8-0x0-1x1-1x1-0-NCHW-FP32-F=ConvOclDirectFwd1x1:1,64,1,1,1,4,32,128,0
384-14-14-1x1-128-14-14-512-0x0-1x1-1x1-0-NCHW-FP16-W=ConvAsmBwdWrW1x1:2,8,2,8,2,1,4,4,0,2
144-110-364-1x1-48-110-364-64-0x0-1x1-1x1-0-NCHW-FP32-B=ConvOclDirectFwd1x1:1,256,1,1,0,4,16,8,0
512-14-14-1x1-1024-14-14-256-0x0-1x1-1x1-0-NCHW-FP32-B=ConvOclDirectFwd1x1:1,128,1,1,0,2,32,4,0;ConvAsm1x1U:1,32,1,32,2,1,1,4
448-8-8-1x1-1280-8-8-8-0x0-1x1-1x1-0-NCHW-FP32-B=ConvOclDirectFwd1x1:1,128,1,1,0,2,8,8,0;ConvAsm1x1U:1,16,1,64,2,2,2,2
1888-335-316-1x1-48-335-316-1-0x0-1x1-1x1-0-NCHW-FP32-F=ConvOclDirectFwd1x1:1,64,1,1,1,1,32,256,0
224-150-88-1x1-432-150-88-4-0x0-1x1-1x1-0-NCHW-FP32-W=ConvAsmBwdWrW1x1:4,4,4,4,8,1,1,4,0,1
864-464-176-1x1-1216-464-176-4-0x0-1x1-1x1-0-NCHW-FP32-B=ConvOclDirectFwd1x1:1,256,1,1,0,1,32,4,0
232-118-278-1x1-320-118-278-12-0x0-1x1-1x1-0-NCHW-FP32-W=ConvAsmBwdWrW1x1:4,4,8,4,4,1,1,4,0,1
160-462-263-1x1-240-462-263-16-0x0-1x1-1x1-0-NCHW-FP32-B=ConvOclDirectFwd1x1:1,256,1,1,0,2,16,8,0
256-56-56-3x3-256-28-28-6-1x1-2x2-1x1-0-NCHW-FP32-F_g32=ConvOclDirectFwd:32,8,32,16,1,2,8,1,1
32-28-28-1x1-192-28-28-8-0x0-1x1-1x1-0-NCHW-FP16-B=ConvOclDirectFwd1x1:1,64,1,1,0,2,8,4,0;ConvAsm1x1U:1,8,2,16,1,2,1,4
64-512-1024-7x7-3-1024-2048-1-3x3-2x2-1x1-0-NCHW-FP32-B=ConvOclDirectFwd:16,16,32,32,2,2,8,2,1
48-317-53-1x1-624-317-53-2-0x0-1x1-1x1-0-NCHW-FP32-W=ConvAsmBwdWrW1x1:4,4,4,4,2,1,1,4,0,1
256-57-57-1x1-256-57-57-64-0x0-1x1-1x1-0-NCHW-FP32-B=ConvOclDirectFwd1x1:1,256,1,1,0,1,32,4,0;ConvAsm1x1U:3,32,4,32,1,1,1,1
512-28-28-1x1-512-28-28-32-0x0-1x1-1x1-0-NCHW-FP32-F=ConvOclDirectFwd1x1:1,64,1,1,1,4,16,2048,0;ConvAsm1x1U:4,16,5,16,2,2,1,2
448-518-21-1x1-480-518-21-4-0x0-1x1-1x1-0-NCHW-FP32-W=ConvAsmBwdWrW1x1:2,8,8,8,2,1,1,4,0,1
128-7-7-1x1-960-7-7-512-0x0-1x1-1x1-0-NCHW-FP16-W=ConvAsmBwdWrW1x1:2,8,8,8,2,2,2,2,0,3
112-363-53-1x1-608-363-53-6-0x0-1x1-1x1-0-NCHW-FP32-B=ConvOclDirectFwd1x1:1,256,1,1,0,1,32,4,0
116-219-113-1x1-80-219-113-12-0x0-1x1-1x1-0-NCHW-FP32-B=ConvOclDirectFwd1x1:1,128,1,1,0,1,16,4,0;ConvAsm1x1U:3,16,3,64,1,1,1,4
48-35-35-1x1-192-35-35-4-0x0-1x1-1x1-0-NCHW-FP32-W=ConvAsmBwdWrW1x1:4,4,4,1,8,1,2,4,0,1
832-6-738-1x1-896-6-738-32-0x0-1x1-1x1-0-NCHW-FP32-F=ConvOclDirectFwd1x1:1,64,1,1,1,1,16,2048,0;ConvAsm1x1U:2,16,7,64,1,2,1,1
32-86-293-1x1-832-86-293-2-0x0-1x1-1x1-0-NCHW-FP32-F=ConvOclDirectFwd1x1:1,64,1,1,1,1,16,2048,0
2-165-165-1x1-448-165-165-2-0x0-1x1-1x1-0-NCHW-FP32-W=ConvAsmBwdWrW1x1:4,4,4,1,2,1,1,4,0,3
32-28-28-5x5-192-28-28-16-2x2-1x1-1x1-0-NCHW-FP32-B=ConvOclDirectFwd:16,16,32,32,2,2,4,2,2
24-1-787-1x1-704-1-787-4-0x0-1x1-1x1-0-NCHW-FP32-F=ConvOclDirectFwd1x1:1,256,1,1,0,1,8,8,0;ConvAsm1x1U:1,8,1,16,1,2,4,2
128-7-7-5x5-832-7-7-64-2x2-1x1-1x1-0-NCHW-FP32-B=ConvOclDirectFwd:8,8,8,8,1,1,8,2,1
960-41-338-1x1-736-41-338-16-0x0-1x1-1x1-0-NCHW-FP32-F=ConvOclDirectFwd1x1:1,64,1,1,1,0,64,2048,0
192-35-35-1x1-48-35-35-4-0x0-1x1-1x1-0-NCHW-FP32-F=ConvOclDirectFwd1x1:1,64,1,1,1,1,32,64,0;ConvAsm1x1U:2,8,2,64,1,4,2,1;ConvActivAsm1x1U:2,16,2,16,1,4
96-35-35-1x1-384-35-35-32-0x0-1x1-1x1-0-NCHW-FP32-W=ConvAsmBwdWrW1x1:4,4,8,4,4,1,2,4,0,1
512-14-14-3x3-512-14-14-128-1x1-1x1-1x1-0-NCHW-FP16-W=ConvAsmBwdWrW3x3:0,0,8,2,10,1
48-35-35-1x1-288-35-35-16-0x0-1x1-1x1-0-NCHW-FP16-W=ConvAsmBwdWrW1x1:4,4,4,4,2,1,4,4,0,0
160-64-128-1x1-528-64-128-1-0x0-1x1-1x1-0-NCHW-FP16-W=ConvAsmBwdWrW1x1:4,4,8,4,4,1,1,2,0,1
128-56-56-1x1-160-56-56-128-0x0-1x1-1x1-0-NCHW-FP16-B=ConvOclDirectFwd1x1:1,64,1,1,0,4,16,4,0;ConvAsm1x1U:1,16,2,32,1,2,1,2
528-874-40-1x1-1024-874-40-4-0x0-1x1-1x1-0-NCHW-FP32-B=ConvOclDirectFwd1x1:1,128,1,1,0,2,32,4,0
232-14-14-1x1-232-14-14-4-0x0-1x1-1x1-0-NCHW-FP32-F=ConvOclDirectFwd1x1:1,128,1,1,0,4,4,4,0;ConvAsm1x1U:2,8,2,32,1,4,2,1
64-73-73-1x1-160-73-73-8-0x0-1x1-1x1-0-NCHW-FP16-B=ConvOclDirectFwd1x1:1,64,1,1,0,1,32,4,0;ConvAsm1x1U:1,16,2,64,1,2,2,2
928-992-4-1x1-704-992-4-6-0x0-1x1-1x1-0-NCHW-FP32-B=ConvOclDirectFwd1x1:1,64,1,1,0,2,32,4,0;ConvAsm1x1U:1,32,3,32,1,1,1,1
480-642-54-1x1-16-642-54-16-0x0-1x1-1x1-0-NCHW-FP32-W=ConvAsmBwdWrW1x1:4,4,2,1,2,1,1,2,0,1
80-939-682-1x1-80-939-682-1-0x0-1x1-1x1-0-NCHW-FP32-B=ConvOclDirectFwd1x1:1,256,1,1,0,2,16,8,0
128-14-14-1x1-960-14-14-128-0x0-1x1-1x1-0-NCHW-FP16-F=ConvOclDirectFwd1x1:1,256,1,1,0,2,16,4,0;ConvAsm1x1U:1,8,2,16,2,4,1,8
224-28-28-1x1-128-28-28-64-0x0-1x1-1x1-0-NCHW-FP16-F=ConvOclDirectFwd1x1:1,64,1,1,0,2,32,4,0;ConvAsm1x1U:1,8,2,32,1,4,1,4
224-758-445-1x1-144-758-445-2-0x0-1x1-1x1-0-NCHW-FP32-B=ConvOclDirectFwd1x1:1,256,1,1,0,2,16,4,0
3-641-651-1x1-80-641-651-6-0x0-1x1-1x1-0-NCHW-FP32-B=ConvOclDirectFwd1x1:1,256,1,1,0,1,16,4,0
32-27-27-1x1-128-27-27-32-0x0-1x1-1x1-0-NCHW-FP16-F=ConvOclDirectFwd1x1:1,64,1,1,0,1,32,4,0;ConvAsm1x1U:1,8,2,16,1,4,1,4
192-7-7-1x1-2016-7-7-16-0x0-1x1-1x1-0-NCHW-FP16-B=ConvOclDirectFwd1x1:1,128,1,1,0,1,8,4,0;ConvAsm1x1U:1,16,2,16,1,2,2,2
32-38-166-5x10-32-79-341-16-0x0-2x2-1x1-0-NCHW-FP32-W=ConvOclBwdWrW2<1>:3,10,3,3,5;ConvOclBwdWrW2<16>:8,7,1,3,5;ConvOclBwdWrW2<8>:3,10,3,3,5;ConvOclBwdWrW2<4>:8,7,1,3,5;ConvOclBwdWrW2<2>:8,7,1,3,5
1776-213-193-1x1-48-213-193-6-0x0-1x1-1x1-0-NCHW-FP32-F=ConvOclDirectFwd1x1:1,64,1,1,1,0,32,256,0
256-29-29-3x3-256-29-29-8-1x1-1x1-1x1-0-NCHW-FP32-F_g32=ConvOclDirectFwd:16,16,16,32,1,2,8,4,1
3-228-799-1x1-544-228-799-4-0x0-1x1-1x1-0-NCHW-FP32-F=ConvOclDirectFwd1x1:1,256,1,1,0,4,16,4,0
512-14-14-3x3-512-14-14-32-1x1-1x1-1x1-0-NCHW-FP16-W=ConvAsmBwdWrW3x3:0,0,8,4,4,1
232-988-143-1x1-576-988-143-1-0x0-1x1-1x1-0-NCHW-FP32-F=ConvOclDirectFwd1x1:1,256,1,1,0,2,32,4,0
112-512-934-1x1-672-512-934-1-0x0-1x1-1x1-0-NCHW-FP32-B=ConvOclDirectFwd1x1:1,64,1,1,0,4,16,8,0
320-8-8-3x3-192-17-17-64-0x0-2x2-1x1-0-NCHW-FP16-B=ConvOclDirectFwd:32,16,32,32,1,2,4,2,2
1024-14-14-1x1-512-14-14-512-0x0-1x1-1x1-0-NCHW-FP16-F=ConvOclDirectFwd1x1:1,128,1,1,0,4,16,4,0;ConvAsm1x1U:1,8,2,64,3,4,2,2
416-218-239-1x1-640-218-239-16-0x0-1x1-1x1-0-NCHW-FP32-B=ConvOclDirectFwd1x1:1,256,1,1,0,2,32,4,0
1184-241-984-1x1-80-241-984-1-0x0-1x1-1x1-0-NCHW-FP32-F=ConvOclDirectFwd1x1:1,64,1,1,1,0,32,256,0
1280-985-97-1x1-1184-985-97-4-0x0-1x1-1x1-0-NCHW-FP32-B=ConvOclDirectFwd1x1:1,128,1,1,0,1,32,4,0
576-45-421-1x1-720-45-421-16-0x0-1x1-1x1-0-NCHW-FP32-B=ConvOclDirectFwd1x1:1,256,1,1,0,1,16,4,0
432-1018-1-1x1-64-1018-1-32-0x0-1x1-1x1-0-NCHW-FP32-F=ConvOclDirectFwd1x1:1,64,1,1,1,4,32,2048,0;ConvAsm1x1U:2,16,2,64,4,1,1,2
32-61-142-1x1-1088-61-142-4-0x0-1x1-1x1-0-NCHW-FP32-W=ConvAsmBwdWrW1x1:4,4,8,1,8,1,1,4,0,1
128-56-56-3x3-256-56-56-256-1x1-1x1-1x1-0-NCHW-FP16-B=ConvOclDirectFwd:16,16,32,32,2,2,8,1,1
116-386-223-1x1-8-386-223-6-0x0-1x1-1x1-0-NCHW-FP32-B=ConvOclDirectFwd1x1:1,128,1,1,0,2,16,4,0
58-216-841-1x1-54-216-841-2-0x0-1x1-1x1-0-NCHW-FP32-F=ConvOclDirectFwd1x1:1,256,1,1,0,4,16,4,0
2048-66-57-1x1-1152-66-57-6-0x0-1x1-1x1-0-NCHW-FP32-B=ConvOclDirectFwd1x1:1,128,1,1,0,2,32,4,0
232-251-34-1x1-928-251-34-12-0x0-1x1-1x1-0-NCHW-FP32-F=ConvOclDirectFwd1x1:1,256,1,1,0,2,32,4,0
576-904-881-1x1-116-904-881-1-0x0-1x1-1x1-0-NCHW-FP32-F=ConvOclDirectFwd1x1:1,256,1,1,0,2,4,8,0
32-910-227-1x1-80-910-227-32-0x0-1x1-1x1-0-NCHW-FP32-W=ConvAsmBwdWrW1x1:4,4,4,2,2,1,2,4,0,1
256-28-28-3x3-512-28-28-512-1x1-1x1-1x1-0-NCHW-FP16-W=ConvAsmBwdWrW3x3:0,0,8,4,2,1
4-372-27-1x1-1000-372-27-16-0x0-1x1-1x1-0-NCHW-FP32-W=ConvAsmBwdWrW1x1:4,4,2,1,2,1,1,2,0,1
128-14-14-1x1-704-14-14-64-0x0-1x1-1x1-0-NCHW-FP16-F=ConvOclDirectFwd1x1:1,256,1,1,0,4,8,4,0;ConvAsm1x1U:1,16,2,16,2,2,1,4
512-214-3-1x1-1872-214-3-16-0x0-1x1-1x1-0-NCHW-FP32-W=ConvAsmBwdWrW1x1:1,16,2,8,8,1,1,4,0,1
240-7-7-1x1-960-7-7-1-0x0-1x1-1x1-0-NCHW-FP16-B_g3=ConvOclDirectFwd:8,8,8,8,1,1,8,2,1
32-54-54-3x3-128-54-54-512-1x1-1x1-1x1-0-NCHW-FP16-B=ConvOclDirectFwd:8,16,16,32,2,2,8,1,1
19-779-753-1x1-8-779-753-1-0x0-1x1-1x1-0-NCHW-FP32-B=ConvOclDirectFwd1x1:1,256,1,1,0,1,16,4,0
32-14-14-5x5-64-14-14-64-2x2-1x1-1x1-0-NCHW-FP16-F=ConvOclDirectFwd:8,8,16,16,2,2,4,4,2;ConvOclDirectFwdFused:8,8,16,16,2,2,4,4,2
1920-142-844-1x1-352-142-844-1-0x0-1x1-1x1-0-NCHW-FP32-F=ConvOclDirectFwd1x1:1,64,1,1,1,0,64,2048,0
256-15-15-3x3-256-29-29-1-1x1-2x2-1x1-0-NCHW-FP32-W=ConvAsmBwdWrW3x3:0,0,8,4,1,1
432-63-15-1x1-1104-63-15-16-0x0-1x1-1x1-0-NCHW-FP32-F=ConvOclDirectFwd1x1:1,64,1,1,1,0,64,2048,0;ConvAsm1x1U:2,16,6,32,1,2,2,2
116-14-14-1x1-116-14-14-8-0x0-1x1-1x1-0-NCHW-FP32-B=ConvOclDirectFwd1x1:1,256,1,1,0,4,16,4,0;ConvAsm1x1U:4,4,4,4,1,4,1,8
24-36-742-1x1-576-36-742-1-0x0-1x1-1x1-0-NCHW-FP32-F=ConvOclDirectFwd1x1:1,128,1,1,0,1,32,4,0
1376-284-78-1x1-80-284-78-2-0x0-1x1-1x1-0-NCHW-FP32-F=ConvOclDirectFwd1x1:1,64,1,1,1,4,64,256,0
1472-456-557-1x1-116-456-557-1-0x0-1x1-1x1-0-NCHW-FP32-F=ConvOclDirectFwd1x1:1,256,1,1,0,4,16,8,0
256-13-13-3x3-64-13-13-64-1x1-1x1-1x1-0-NCHW-FP32-W=ConvAsmBwdWrW3x3:0,0,16,2,11,1
528-17-467-1x1-992-17-467-64-0x0-1x1-1x1-0-NCHW-FP32-W=ConvAsmBwdWrW1x1:1,16,4,8,4,1,1,4,0,2
128-28-28-3x3-128-28-28-64-1x1-1x1-1x1-0-NCHW-FP32-W=ConvAsmBwdWrW3x3:0,0,8,2,3,1
256-57-57-1x1-64-57-57-16-0x0-1x1-1x1-0-NCHW-FP32-W=ConvAsmBwdWrW1x1:4,4,4,2,8,1,4,4,0,1
232-14-14-1x1-232-14-14-8-0x0-1x1-1x1-0-NCHW-FP32-B=ConvOclDirectFwd1x1:1,64,1,1,0,1,16,8,0;ConvAsm1x1U:1,8,1,32,1,2,2,2
19-222-306-1x1-2-222-306-32-0x0-1x1-1x1-0-NCHW-FP32-W=ConvAsmBwdWrW1x1:4,4,2,1,2,2,4,4,0,2
128-28-28-1x1-448-28-28-512-0x0-1x1-1x1-0-NCHW-FP32-F=ConvOclDirectFwd1x1:1,64,1,1,1,1,32,2048,0;ConvAsm1x1U:1,8,1,32,2,4,1,4
232-3-620-1x1-672-3-620-1-0x0-1x1-1x1-0-NCHW-FP32-F=ConvOclDirectFwd1x1:1,256,1,1,0,4,8,4,0;ConvAsm1x1U:3,8,3,64,1,4,1,8
256-14-14-1x1-128-14-14-128-0x0-1x1-1x1-0-NCHW-FP32-W=ConvAsmBwdWrW1x1:2,8,4,8,2,1,4,4,0,1
128-7-7-1x1-960-7-7-64-0x0-1x1-1x1-0-NCHW-FP32-W=ConvAsmBwdWrW1x1:1,16,2,8,4,1,2,4,0,2
64-28-28-1x1-192-28-28-64-0x0-1x1-1x1-0-NCHW-FP16-W=ConvAsmBwdWrW1x1:4,4,4,1,8,1,2,4,0,1
3-182-357-1x1-448-182-357-2-0x0-1x1-1x1-0-NCHW-FP32-B=ConvOclDirectFwd1x1:1,256,1,1,0,1,64,4,0
116-320-876-1x1-608-320-876-2-0x0-1x1-1x1-0-NCHW-FP32-F=ConvOclDirectFwd1x1:1,256,1,1,0,1,32,4,0
256-13-13-3x3-256-13-13-4-1x1-1x1-1x1-0-NCHW-FP16-W=ConvAsmBwdWrW3x3:0,0,8,4,1,1
352-11-19-1x1-256-11-19-512-0x0-1x1-1x1-0-NCHW-FP32-F=ConvOclDirectFwd1x1:1,64,1,1,1,4,16,2048,0;ConvAsm1x1U:2,16,4,64,1,2,1,1
1296-669-148-1x1-640-669-148-4-0x0-1x1-1x1-0-NCHW-FP32-F=ConvOclDirectFwd1x1:1,64,1,1,1,4,16,2048,0
896-194-506-1x1-1776-194-506-2-0x0-1x1-1x1-0-NCHW-FP32-B=ConvOclDirectFwd1x1:1,128,1,1,0,4,16,8,0
544-186-598-1x1-576-186-598-4-0x0-1x1-1x1-0-NCHW-FP32-B=ConvOclDirectFwd1x1:1,128,1,1,0,1,32,4,0
320-14-14-3x3-160-14-14-4-1x1-1x1-1x1-0-NCHW-FP16-B=ConvOclDirectFwd:16,16,16,16,1,1,2,4,2
2048-8-8-1x1-1024-8-8-64-0x0-1x1-1x1-0-NCHW-FP32-B=ConvOclDirectFwd1x1:1,64,1,1,0,4,16,4,0;ConvAsm1x1U:1,16,1,64,4,2,2,2
1056-7-7-1x1-128-7-7-64-0x0-1x1-1x1-0-NCHW-FP16-F=ConvOclDirectFwd1x1:1,64,1,1,0,1,8,4,0;ConvAsm1x1U:2,8,4,16,1,4,4,2
32-28-28-1x1-192-28-28-128-0x0-1x1-1x1-0-NCHW-FP32-W=ConvAsmBwdWrW1x1:4,4,4,2,4,1,4,4,0,1
288-28-28-1x1-128-28-28-256-0x0-1x1-1x1-0-NCHW-FP16-W=ConvAsmBwdWrW1x1:4,4,4,1,8,1,4,4,0,2
256-653-30-1x1-416-653-30-2-0x0-1x1-1x1-0-NCHW-FP32-W=ConvAsmBwdWrW1x1:4,4,4,4,8,1,1,4,0,0
112-14-14-1x1-512-14-14-8-0x0-1x1-1x1-0-NCHW-FP32-W=ConvAsmBwdWrW1x1:2,8,2,4,2,1,1,4,0,1
512-14-14-1x1-1024-14-14-16-0x0-1x1-1x1-0-NCHW-FP32-B=ConvOclDirectFwd1x1:1,256,1,1,0,4,16,4,0;ConvAsm1x1U:1,32,1,16,2,1,2,2
704-14-1010-1x1-32-14-1010-6-0x0-1x1-1x1-0-NCHW-FP32-F=ConvOclDirectFwd1x1:1,64,1,1,1,4,64,2048,0
960-163-5-1x1-528-163-5-6-0x0-1x1-1x1-0-NCHW-FP32-W=ConvAsmBwdWrW1x1:1,16,2,8,8,1,1,4,0,1
896-14-14-1x1-128-14-14-64-0x0-1x1-1x1-0-NCHW-FP16-B=ConvOclDirectFwd1x1:1,64,1,1,0,2,8,4,0;ConvAsm1x1U:1,16,2,16,1,2,4,1
128-28-28-1x1-160-28-28-512-0x0-1x1-1x1-0-NCHW-FP16-B=ConvOclDirectFwd1x1:1,64,1,1,0,4,16,4,0;ConvAsm1x1U:1,16,2,16,1,2,1,2
608-51-635-1x1-192-51-635-12-0x0-1x1-1x1-0-NCHW-FP32-F=ConvOclDirectFwd1x1:1,64,1,1,1,1,16,2048,0
736-229-90-1x1-116-229-90-32-0x0-1x1-1x1-0-NCHW-FP32-B=ConvOclDirectFwd1x1:1,64,1,1,0,2,8,4,0
192-17-17-1x1-768-17-17-8-0x0-1x1-1x1-0-NCHW-FP32-W=ConvAsmBwdWrW1x1:1,16,2,8,4,1,2,4,0,0
32-904-184-1x1-144-904-184-12-0x0-1x1-1x1-0-NCHW-FP32-B=ConvOclDirectFwd1x1:1,64,1,1,0,1,16,4,0
448-440-20-1x1-512-440-20-64-0x0-1x1-1x1-0-NCHW-FP32-F=ConvOclDirectFwd1x1:1,64,1,1,1,4,16,2048,0
992-332-117-1x1-288-332-117-6-0x0-1x1-1x1-0-NCHW-FP32-B=ConvOclDirectFwd1x1:1,128,1,1,0,2,32,4,0
448-27-889-1x1-160-27-889-8-0x0-1x1-1x1-0-NCHW-FP32-B=ConvOclDirectFwd1x1:1,128,1,1,0,1,32,4,0
3-701-793-1x1-3-701-793-32-0x0-1x1-1x1-0-NCHW-FP32-W=ConvAsmBwdWrW1x1:4,4,2,1,2,1,4,4,0,1
512-28-28-1x1-256-56-56-256-0x0-2x2-1x1-0-NCHW-FP32-B=ConvOclDirectFwd1x1:1,256,1,1,0,2,32,4,0;ConvAsm1x1U:4,16,5,32,2,2,1,2
116-811-847-1x1-288-811-847-2-0x0-1x1-1x1-0-NCHW-FP32-B=ConvOclDirectFwd1x1:1,256,1,1,0,1,32,4,0
512-7-7-3x3-512-14-14-128-1x1-2x2-1x1-0-NCHW-FP32-B=ConvOclDirectFwd:8,8,8,8,1,1,2,2,1
1000-829-5-1x1-54-829-5-6-0x0-1x1-1x1-0-NCHW-FP32-F=ConvOclDirectFwd1x1:1,256,1,1,0,1,16,4,0;ConvAsm1x1U:3,16,3,64,3,2,1,1
384-17-17-1x1-1024-17-17-32-0x0-1x1-1x1-0-NCHW-FP32-W=ConvAsmBwdWrW1x1:1,16,4,8,4,1,1,4,0,2
800-328-44-1x1-1120-328-44-6-0x0-1x1-1x1-0-NCHW-FP32-W=ConvAsmBwdWrW1x1:2,8,4,8,4,1,1,4,0,1
416-120-181-1x1-1504-120-181-12-0x0-1x1-1x1-0-NCHW-FP32-B=ConvOclDirectFwd1x1:1,128,1,1,0,2,32,4,0
256-28-28-1x1-512-28-28-8-0x0-1x1-1x1-0-NCHW-FP32-W=ConvAsmBwdWrW1x1:1,16,4,4,4,1,2,4,0,1
864-1-663-1x1-1408-1-663-32-0x0-1x1-1x1-0-NCHW-FP32-W=ConvAsmBwdWrW1x1:2,8,4,4,8,1,1,4,0,1
1000-66-795-1x1-1120-66-795-1-0x0-1x1-1x1-0-NCHW-FP32-B=ConvOclDirectFwd1x1:1,256,1,1,0,2,32,4,0
240-28-28-1x1-60-28-28-256-0x0-1x1-1x1-0-NCHW-FP16-F_g3=ConvOclDirectFwd:16,16,32,32,2,2,8,2,1
128-56-56-1x1-128-56-56-32-0x0-1x1-1x1-0-NCHW-FP16-F=ConvOclDirectFwd1x1:1,64,1,1,0,4,16,4,0;ConvAsm1x1U:1,8,2,64,2,4,1,4
16-676-315-1x1-80-676-315-6-0x0-1x1-1x1-0-NCHW-FP32-B=ConvOclDirectFwd1x1:1,256,1,1,0,4,16,8,0
384-27-27-1x1-64-27-27-64-0x0-1x1-1x1-0-NCHW-FP32-B=ConvOclDirectFwd1x1:1,256,1,1,0,1,32,4,0;ConvAsm1x1U:3,32,3,64,1,1,1,1
288-243-14-1x1-116-243-14-1-0x0-1x1-1x1-0-NCHW-FP32-W=ConvAsmBwdWrW1x1:2,8,2,4,2,1,1,4,0,1
128-7-7-1x1-928-7-7-256-0x0-1x1-1x1-0-NCHW-FP16-B=ConvOclDirectFwd1x1:1,256,1,1,0,1,8,4,0;ConvAsm1x1U:1,16,2,32,1,2,1,2
80-730-644-1x1-16-730-644-8-0x0-1x1-1x1-0-NCHW-FP32-B=ConvOclDirectFwd1x1:1,256,1,1,0,2,16,4,0
64-13-13-1x1-512-13-13-32-0x0-1x1-1x1-0-NCHW-FP32-F=ConvOclDirectFwd1x1:1,64,1,1,1,4,16,256,0;ConvAsm1x1U:3,16,3,64,1,2,1,1
384-300-19-1x1-320-300-19-6-0x0-1x1-1x1-0-NCHW-FP32-F=ConvOclDirectFwd1x1:1,64,1,1,1,1,16,2048,0;ConvAsm1x1U:4,16,6,64,2,2,1,2
96-716-37-1x1-1440-716-37-6-0x0-1x1-1x1-0-NCHW-FP32-B=ConvOclDirectFwd1x1:1,256,1,1,0,2,32,4,0
80-73-73-3x3-192-71-71-64-0x0-1x1-1x1-0-NCHW-FP32-F=ConvOclDirectFwd:16,8,16,16,1,2,8,2,1
8-294-750-1x1-416-294-750-2-0x0-1x1-1x1-0-NCHW-FP32-F=ConvOclDirectFwd1x1:1,64,1,1,0,4,8,8,0
576-186-598-1x1-544-186-598-4-0x0-1x1-1x1-0-NCHW-FP32-F=ConvOclDirectFwd1x1:1,64,1,1,1,4,64,2048,0
16-103-539-1x1-1568-103-539-1-0x0-1x1-1x1-0-NCHW-FP32-B=ConvOclDirectFwd1x1:1,256,1,1,0,1,32,4,0
2-856-32-1x1-2-856-32-4-0x0-1x1-1x1-0-NCHW-FP32-F=ConvOclDirectFwd1x1:1,64,1,1,0,4,16,4,0;ConvAsm1x1U:3,1,3,4,1,1,1,2
64-35-35-1x1-192-35-35-4-0x0-1x1-1x1-0-NCHW-FP32-B=ConvOclDirectFwd1x1:1,256,1,1,0,1,8,8,0;ConvAsm1x1U:1,16,1,64,1,2,2,2
544-14-14-1x1-128-14-14-32-0x0-1x1-1x1-0-NCHW-FP16-B=ConvOclDirectFwd1x1:1,64,1,1,0,4,4,4,0;ConvAsm1x1U:1,16,2,32,1,2,4,2
992-40-139-1x1-80-40-139-2-0x0-1x1-1x1-0-NCHW-FP32-F=ConvOclDirectFwd1x1:1,64,1,1,1,4,64,256,0
2048-7-7-1x1-512-7-7-8-0x0-1x1-1x1-0-NCHW-FP16-B=ConvOclDirectFwd1x1:1,128,1,1,0,1,8,8,0;ConvAsm1x1U:1,8,4,16,1,4,4,2
8-393-462-1x1-736-393-462-2-0x0-1x1-1x1-0-NCHW-FP32-F=ConvOclDirectFwd1x1:1,128,1,1,0,2,32,4,0
116-46-763-1x1-58-46-763-8-0x0-1x1-1x1-0-NCHW-FP32-B=ConvOclDirectFwd1x1:1,256,1,1,0,2,8,4,0;ConvAsm1x1U:4,1,5,4,1,1,1,8
1216-597-183-1x1-704-597-183-1-0x0-1x1-1x1-0-NCHW-FP32-F=ConvOclDirectFwd1x1:1,64,1,1,1,4,16,2048,0
16-14-14-1x1-480-14-14-256-0x0-1x1-1x1-0-NCHW-FP16-F=ConvOclDirectFwd1x1:1,128,1,1,0,4,8,4,0;ConvAsm1x1U:1,8,2,64,1,4,1,4
4-181-72-1x1-2064-181-72-4-0x0-1x1-1x1-0-NCHW-FP32-B=ConvOclDirectFwd1x1:1,256,1,1,0,1,4,4,0
58-269-858-1x1-2160-269-858-1-0x0-1x1-1x1-0-NCHW-FP32-B=ConvOclDirectFwd1x1:1,256,1,1,0,1,16,4,0
576-422-94-1x1-432-422-94-8-0x0-1x1-1x1-0-NCHW-FP32-B=ConvOclDirectFwd1x1:1,64,1,1,0,4,16,4,0
128-112-112-3x3-128-112-112-256-1x1-1x1-1x1-0-NCHW-FP32-W=ConvAsmBwdWrW3x3:0,1,8,4,1,1
1216-72-347-1x1-544-72-347-4-0x0-1x1-1x1-0-NCHW-FP32-F=ConvOclDirectFwd1x1:1,64,1,1,1,4,64,2048,0
256-14-14-1x1-512-7-7-256-0x0-2x2-1x1-0-NCHW-FP32-F=ConvOclDirectFwd1x1:1,64,1,1,1,1,32,2048,0;ConvAsm1x1U:1,16,1,64,4,2,1,4
1024-8-8-3x3-1024-8-8-32-1x1-1x1-1x1-0-NCHW-FP32-W_g32=ConvOclBwdWrW2<4>:1,8,8,1,9;ConvOclBwdWrW2<2>:1,8,8,1,9;ConvOclBwdWrW2<1>:1,6,8,1,9;ConvOclBwdWrW2<16>:1,8,8,1,9;ConvAsmBwdWrW3x3:0,0,16,2,7,1;ConvOclBwdWrW2<8>:1,6,8,1,9
24-653-725-1x1-448-653-725-1-0x0-1x1-1x1-0-NCHW-FP32-B=ConvOclDirectFwd1x1:1,256,1,1,0,1,32,4,0
64-56-56-1x1-64-56-56-1-0x0-1x1-1x1-0-NCHW-FP16-F=ConvOclDirectFwd1x1:1,128,1,1,0,2,4,4,0;ConvAsm1x1U:1,8,2,64,1,2,4,2
1280-8-8-1x1-384-8-8-64-0x0-1x1-1x1-0-NCHW-FP32-F=ConvOclDirectFwd1x1:1,64,1,1,1,1,16,2048,0;ConvAsm1x1U:4,16,4,16,2,2,4,1;ConvActivAsm1x1U:2,16,2,32,4,4
448-14-14-1x1-128-14-14-64-0x0-1x1-1x1-0-NCHW-FP16-B=ConvOclDirectFwd1x1:1,64,1,1,0,4,8,4,0;ConvAsm1x1U:1,16,2,16,1,2,4,1
2048-8-8-1x1-448-8-8-8-0x0-1x1-1x1-0-NCHW-FP32-F=ConvOclDirectFwd1x1:1,64,1,1,1,4,32,256,0;ConvAsm1x1U:4,8,4,16,1,4,2,2;ConvActivAsm1x1U:4,16,4,16,1,4
192-448-587-1x1-58-448-587-2-0x0-1x1-1x1-0-NCHW-FP32-F=ConvOclDirectFwd1x1:1,256,1,1,0,4,8,4,0
64-112-112-7x7-3-230-230-1-0x0-2x2-1x1-0-NCHW-FP32-B=ConvOclDirectFwd:16,32,32,32,2,1,1,4,1
32-26-808-1x1-1296-26-808-6-0x0-1x1-1x1-0-NCHW-FP32-B=ConvOclDirectFwd1x1:1,64,1,1,0,4,16,8,0
288-134-496-1x1-640-134-496-12-0x0-1x1-1x1-0-NCHW-FP32-F=ConvOclDirectFwd1x1:1,64,1,1,1,0,32,2048,0
800-158-143-1x1-224-158-143-8-0x0-1x1-1x1-0-NCHW-FP32-B=ConvOclDirectFwd1x1:1,256,1,1,0,2,32,4,0
116-727-140-1x1-704-727-140-1-0x0-1x1-1x1-0-NCHW-FP32-B=ConvOclDirectFwd1x1:1,256,1,1,0,2,32,4,0
2048-305-856-1x1-1104-305-856-1-0x0-1x1-1x1-0-NCHW-FP32-F=ConvOclDirectFwd1x1:1,64,1,1,1,1,64,2048,0
224-697-375-1x1-1104-697-375-1-0x0-1x1-1x1-0-NCHW-FP32-B=ConvOclDirectFwd1x1:1,128,1,1,0,1,16,4,0
2-369-831-1x1-672-369-831-2-0x0-1x1-1x1-0-NCHW-FP32-F=ConvOclDirectFwd1x1:1,256,1,1,0,1,32,4,0
320-81-309-1x1-48-81-309-8-0x0-1x1-1x1-0-NCHW-FP32-B=ConvOclDirectFwd1x1:16,64,32,32,0,1,16,4,1
58-103-724-1x1-3-103-724-48-0x0-1x1-1x1-0-NCHW-FP32-B=ConvOclDirectFwd1x1:1,256,1,1,0,4,16,4,0
1104-86-673-1x1-1-86-673-4-0x0-1x1-1x1-0-NCHW-FP32-F=ConvOclDirectFwd1x1:1,256,1,1,0,2,16,4,0
32-147-147-3x3-64-147-147-128-1x1-1x1-1x1-0-NCHW-FP16-F=ConvOclDirectFwd:16,16,32,32,2,2,8,2,1;ConvOclDirectFwdFused:16,16,32,32,2,2,8,4,1
128-7-7-1x1-864-7-7-32-0x0-1x1-1x1-0-NCHW-FP16-W=ConvAsmBwdWrW1x1:2,8,2,8,2,1,2,4,0,0
64-704-397-1x1-24-704-397-4-0x0-1x1-1x1-0-NCHW-FP32-F=ConvOclDirectFwd1x1:1,256,1,1,0,4,16,4,0
128-231-220-1x1-1024-231-220-6-0x0-1x1-1x1-0-NCHW-FP32-B=ConvOclDirectFwd1x1:1,256,1,1,0,1,32,4,0
384-35-35-1x1-192-35-35-1-0x0-1x1-1x1-0-NCHW-FP16-F=ConvOclDirectFwd1x1:1,256,1,1,0,1,8,8,0;ConvAsm1x1U:1,8,2,64,1,4,4,1
512-28-28-1x1-128-28-28-256-0x0-1x1-1x1-0-NCHW-FP16-B=ConvOclDirectFwd1x1:1,256,1,1,0,4,16,4,0;ConvAsm1x1U:1,16,2,16,1,2,1,4
288-145-74-1x1-992-145-74-16-0x0-1x1-1x1-0-NCHW-FP32-B=ConvOclDirectFwd1x1:1,128,1,1,0,2,32,4,0
1-828-665-1x1-128-828-665-1-0x0-1x1-1x1-0-NCHW-FP32-F=ConvOclDirectFwd1x1:1,64,1,1,0,4,8,4,0
64-35-35-1x1-288-35-35-8-0x0-1x1-1x1-0-NCHW-FP16-W=ConvAsmBwdWrW1x1:4,4,4,2,4,1,2,4,0,0
576-52-499-1x1-992-52-499-4-0x0-1x1-1x1-0-NCHW-FP32-F=ConvOclDirectFwd1x1:1,64,1,1,1,1,64,2048,0
160-14-14-3x3-320-14-14-512-1x1-1x1-1x1-0-NCHW-FP16-F=ConvOclDirectFwd:8,8,16,16,2,2,8,2,1;ConvOclDirectFwdFused:8,8,16,16,2,2,8,1,1
32-412-34-1x1-544-412-34-1-0x0-1x1-1x1-0-NCHW-FP32-F=ConvOclDirectFwd1x1:1,64,1,1,1,1,64,128,0
1024-15-15-1x1-512-29-29-2-0x0-2x2-1x1-0-NCHW-FP32-W=ConvAsmBwdWrW1x1:1,16,4,2,8,1,1,4,0,0
128-27-27-1x1-32-27-27-32-0x0-1x1-1x1-0-NCHW-FP16-F=ConvOclDirectFwd1x1:1,64,1,1,0,1,16,8,0;ConvAsm1x1U:1,8,2,32,1,4,2,4
992-252-53-1x1-2048-252-53-8-0x0-1x1-1x1-0-NCHW-FP32-F=ConvOclDirectFwd1x1:1,64,1,1,1,0,16,2048,0
416-419-192-1x1-58-419-192-1-0x0-1x1-1x1-0-NCHW-FP32-F=ConvOclDirectFwd1x1:1,256,1,1,0,1,16,4,0
896-14-14-1x1-128-14-14-256-0x0-1x1-1x1-0-NCHW-FP32-B=ConvOclDirectFwd1x1:1,256,1,1,0,1,32,4,0;ConvAsm1x1U:2,32,2,16,1,1,2,2
24-14-14-1x1-512-14-14-512-0x0-1x1-1x1-0-NCHW-FP32-B=ConvOclDirectFwd1x1:1,64,1,1,0,2,32,4,0;ConvAsm1x1U:1,16,1,64,1,2,2,1
224-35-35-3x3-192-35-35-8-1x1-1x1-1x1-0-NCHW-FP32-W=ConvAsmBwdWrW3x3:0,0,8,4,3,2
128-28-28-1x1-256-28-28-128-0x0-1x1-1x1-0-NCHW-FP16-W=ConvAsmBwdWrW1x1:4,4,8,1,8,1,2,4,0,1
16-113-2-1x1-1504-113-2-1-0x0-1x1-1x1-0-NCHW-FP32-B=ConvOclDirectFwd1x1:1,128,1,1,0,1,4,8,0;ConvAsm1x1U:1,8,1,64,1,2,2,2
512-13-13-1x1-1000-13-13-64-0x0-1x1-1x1-0-NCHW-FP32-F=ConvOclDirectFwd1x1:1,256,1,1,0,1,16,8,0;ConvAsm1x1U:3,16,3,64,2,2,1,2
64-35-35-5x5-48-35-35-512-2x2-1x1-1x1-0-NCHW-FP16-W=ConvOclBwdWrW2<1>:1,6,1,8,5;ConvOclBwdWrW2<16>:1,9,1,8,7;ConvOclBwdWrW2<8>:1,6,1,8,5;ConvOclBwdWrW2<4>:1,9,1,8,7;ConvOclBwdWrW2<2>:1,6,1,8,5
64-56-56-3x3-192-56-56-16-1x1-1x1-1x1-0-NCHW-FP16-F=ConvOclDirectFwd:32,8,32,32,1,4,8,1,2;ConvOclDirectFwdFused:32,8,32,32,1,4,8,1,2
1024-14-14-1x1-256-14-14-4-0x0-1x1-1x1-0-NCHW-FP16-B=ConvOclDirectFwd1x1:1,64,1,1,0,4,8,8,0;ConvAsm1x1U:1,8,2,64,1,4,4,4
1248-775-79-1x1-58-775-79-1-0x0-1x1-1x1-0-NCHW-FP32-F=ConvOclDirectFwd1x1:1,256,1,1,0,1,16,4,0
48-157-595-1x1-512-157-595-2-0x0-1x1-1x1-0-NCHW-FP32-B=ConvOclDirectFwd1x1:1,256,1,1,0,1,32,4,0
1536-14-14-1x1-192-14-14-16-0x0-1x1-1x1-0-NCHW-FP16-F=ConvOclDirectFwd1x1:1,64,1,1,0,4,8,4,0;ConvAsm1x1U:2,8,4,64,1,4,4,2
64-112-112-1x1-64-112-112-128-0x0-1x1-1x1-0-NCHW-FP32-W=ConvAsmBwdWrW1x1:4,4,4,2,4,1,4,4,0,1
64-14-14-5x5-32-14-14-64-2x2-1x1-1x1-0-NCHW-FP16-B=ConvOclDirectFwd:16,8,16,16,1,2,4,1,2
1000-570-120-1x1-1280-570-120-4-0x0-1x1-1x1-0-NCHW-FP32-F=ConvOclDirectFwd1x1:1,256,1,1,0,2,32,4,0
1488-571-65-1x1-928-571-65-1-0x0-1x1-1x1-0-NCHW-FP32-F=ConvOclDirectFwd1x1:1,64,1,1,1,1,64,2048,0
3-308-31-1x1-16-308-31-4-0x0-1x1-1x1-0-NCHW-FP32-F=ConvOclDirectFwd1x1:1,256,1,1,0,1,8,4,0;ConvAsm1x1U:1,8,1,64,2,1,1,1
672-56-162-1x1-1200-56-162-1-0x0-1x1-1x1-0-NCHW-FP32-W=ConvAsmBwdWrW1x1:2,8,4,4,8,1,1,4,0,1
256-209-396-1x1-1280-209-396-2-0x0-1x1-1x1-0-NCHW-FP32-B=ConvOclDirectFwd1x1:1,128,1,1,0,1,32,4,0
240-28-28-1x1-60-28-28-16-0x0-1x1-1x1-0-NCHW-FP16-B_g3=ConvOclDirectFwd:16,16,16,16,1,1,8,2,2
80-58-479-1x1-96-58-479-64-0x0-1x1-1x1-0-NCHW-FP32-B=ConvOclDirectFwd1x1:1,256,1,1,0,2,32,4,0;ConvAsm1x1U:1,32,1,16,1,1,1,1
58-244-222-1x1-1-244-222-2-0x0-1x1-1x1-0-NCHW-FP32-F=ConvOclDirectFwd1x1:1,64,1,1,0,2,4,4,0;ConvAsm1x1U:4,1,8,4,1,1,1,1
3-15-256-1x1-1104-15-256-4-0x0-1x1-1x1-0-NCHW-FP32-B=ConvOclDirectFwd1x1:1,256,1,1,0,2,4,4,0
80-121-21-1x1-896-121-21-4-0x0-1x1-1x1-0-NCHW-FP32-F=ConvOclDirectFwd1x1:1,64,1,1,1,1,16,256,0;ConvAsm1x1U:3,8,3,64,1,4,2,4
288-492-1-1x1-704-492-1-8-0x0-1x1-1x1-0-NCHW-FP32-W=ConvAsmBwdWrW1x1:2,8,4,8,4,1,1,4,0,1
3-224-224-3x3-24-112-112-256-1x1-2x2-1x1-0-NCHW-FP32-F=ConvOclDirectFwd:8,32,16,32,2,1,8,2,2
3-224-224-7x7-64-112-112-2-3x3-2x2-1x1-0-NCHW-FP32-F=ConvOclDirectFwd:8,32,16,32,2,1,8,1,2
58-598-654-1x1-512-598-654-2-0x0-1x1-1x1-0-NCHW-FP32-F=ConvOclDirectFwd1x1:1,64,1,1,0,1,64,4,0
1024-7-7-3x3-1024-7-7-64-1x1-1x1-1x1-0-NCHW-FP32-F_g32=ConvOclDirectFwd:8,8,8,8,1,1,8,2,2
384-8-8-1x1-2048-8-8-1-0x0-1x1-1x1-0-NCHW-FP16-W=ConvAsmBwdWrW1x1:1,16,2,4,2,1,1,4,0,0
32-132-511-1x1-1280-132-511-4-0x0-1x1-1x1-0-NCHW-FP32-F=ConvOclDirectFwd1x1:1,64,1,1,1,1,32,2048,0
1088-1-877-1x1-144-1-877-16-0x0-1x1-1x1-0-NCHW-FP32-F=ConvOclDirectFwd1x1:1,64,1,1,1,4,64,2048,0;ConvAsm1x1U:2,16,2,64,2,2,1,1
320-14-14-3x3-160-14-14-1-1x1-1x1-1x1-0-NCHW-FP16-B=ConvOclDirectFwd:16,16,16,16,1,1,1,4,1
1056-14-14-1x1-192-14-14-16-0x0-1x1-1x1-0-NCHW-FP16-W=ConvAsmBwdWrW1x1:2,8,2,8,2,1,2,4,0,1
528-14-14-1x1-160-14-14-256-0x0-1x1-1x1-0-NCHW-FP32-B=ConvOclDirectFwd1x1:1,128,1,1,0,1,32,4,0;ConvAsm1x1U:1,32,1,32,3,1,1,1
2048-7-7-1x1-512-7-7-256-0x0-1x1-1x1-0-NCHW-FP32-F=ConvOclDirectFwd1x1:1,64,1,1,1,1,64,2048,0;ConvAsm1x1U:4,16,4,16,2,2,1,4;ConvActivAsm1x1U:4,16,4,16,3,2
32-27-27-1x1-256-27-27-128-0x0-1x1-1x1-0-NCHW-FP32-F=ConvOclDirectFwd1x1:1,64,1,1,1,1,32,128,0;ConvAsm1x1U:2,16,2,64,2,2,1,1
512-7-7-1x1-512-7-7-64-0x0-1x1-1x1-0-NCHW-FP32-F=ConvOclDirectFwd1x1:1,64,1,1,1,1,32,2048,0;ConvAsm1x1U:2,16,2,32,2,2,1,2
160-56-56-1x1-128-56-56-128-0x0-1x1-1x1-0-NCHW-FP32-B=ConvOclDirectFwd1x1:1,256,1,1,0,1,32,4,0;ConvAsm1x1U:1,32,1,64,1,1,1,4
1-989-23-1x1-1296-989-23-1-0x0-1x1-1x1-0-NCHW-FP32-B=ConvOclDirectFwd1x1:1,256,1,1,0,1,4,4,0
128-7-7-1x1-544-7-7-32-0x0-1x1-1x1-0-NCHW-FP16-F=ConvOclDirectFwd1x1:1,64,1,1,0,1,8,4,0;ConvAsm1x1U:1,8,2,32,1,4,2,1
352-142-844-1x1-1920-142-844-1-0x0-1x1-1x1-0-NCHW-FP32-B=ConvOclDirectFwd1x1:1,128,1,1,0,2,32,4,0
192-14-14-1x1-480-14-14-128-0x0-1x1-1x1-0-NCHW-FP32-W=ConvAsmBwdWrW1x1:2,8,4,4,8,1,2,4,0,1
48-7-7-1x1-832-7-7-16-0x0-1x1-1x1-0-NCHW-FP16-B=ConvOclDirectFwd1x1:8,64,8,8,0,1,16,4,1;ConvAsm1x1U:1,8,2,16,1,2,2,1
528-179-422-1x1-1000-179-422-2-0x0-1x1-1x1-0-NCHW-FP32-B=ConvOclDirectFwd1x1:1,256,1,1,0,2,16,8,0
256-20-84-5x5-512-9-41-128-1x1-2x2-1x1-0-NCHW-FP32-F=ConvOclDirectFwd:16,8,16,16,1,2,8,1,2
928-967-6-1x1-240-967-6-12-0x0-1x1-1x1-0-NCHW-FP32-W=ConvAsmBwdWrW1x1:1,16,2,8,4,1,1,4,0,1
512-14-14-1x1-32-14-14-128-0x0-1x1-1x1-0-NCHW-FP16-F=ConvOclDirectFwd1x1:1,64,1,1,0,2,16,4,0;ConvAsm1x1U:2,8,4,64,1,4,4,1
640-353-418-1x1-256-353-418-1-0x0-1x1-1x1-0-NCHW-FP32-F=ConvOclDirectFwd1x1:1,64,1,1,1,4,16,2048,0
512-14-14-5x5-48-14-14-1-2x2-1x1-1x1-0-NCHW-FP32-F=ConvOclDirectFwd:16,16,16,16,1,1,1,4,1
19-779-753-1x1-8-779-753-1-0x0-1x1-1x1-0-NCHW-FP32-W=ConvAsmBwdWrW1x1:4,4,2,1,2,1,2,4,0,3
1000-347-655-1x1-480-347-655-2-0x0-1x1-1x1-0-NCHW-FP32-F=ConvOclDirectFwd1x1:1,256,1,1,0,1,32,4,0
928-70-206-1x1-3-70-206-16-0x0-1x1-1x1-0-NCHW-FP32-W=ConvAsmBwdWrW1x1:4,4,2,1,2,1,1,2,0,1
640-7-7-1x1-128-7-7-256-0x0-1x1-1x1-0-NCHW-FP32-B=ConvOclDirectFwd1x1:1,128,1,1,0,1,16,4,0;ConvAsm1x1U:2,16,2,32,1,2,2,2
832-7-7-1x1-32-7-7-64-0x0-1x1-1x1-0-NCHW-FP32-F=ConvOclDirectFwd1x1:1,64,1,1,1,0,16,128,0;ConvAsm1x1U:1,8,1,64,1,4,4,2;ConvActivAsm1x1U:2,16,2,16,1,4
144-471-99-1x1-1-471-99-1-0x0-1x1-1x1-0-NCHW-FP32-B=ConvOclDirectFwd1x1:1,256,1,1,0,1,8,4,0
1000-609-396-1x1-32-609-396-2-0x0-1x1-1x1-0-NCHW-FP32-B=ConvOclDirectFwd1x1:1,128,1,1,0,1,32,4,0
58-28-28-1x1-24-28-28-2-0x0-1x1-1x1-0-NCHW-FP16-W=ConvAsmBwdWrW1x1:4,4,2,1,2,1,1,2,0,1
128-7-7-1x1-704-7-7-32-0x0-1x1-1x1-0-NCHW-FP32-F=ConvOclDirectFwd1x1:1,64,1,1,1,4,16,256,0;ConvAsm1x1U:2,8,2,32,2,4,1,4
144-680-15-1x1-672-680-15-64-0x0-1x1-1x1-0-NCHW-FP32-W=ConvAsmBwdWrW1x1:1,16,2,4,4,1,1,4,0,1
128-56-56-3x3-128-28-28-1-1x1-2x2-1x1-0-NCHW-FP32-F=ConvOclDirectFwd:16,16,16,16,1,1,2,2,1
128-7-7-1x1-832-7-7-512-0x0-1x1-1x1-0-NCHW-FP32-W=ConvAsmBwdWrW1x1:2,8,4,8,4,2,2,4,0,2
160-228-438-1x1-3-228-438-1-0x0-1x1-1x1-0-NCHW-FP32-W=ConvAsmBwdWrW1x1:4,4,2,2,2,1,1,4,0,3
128-14-14-1x1-528-14-14-1-0x0-1x1-1x1-0-NCHW-FP32-B=ConvOclDirectFwd1x1:1,256,1,1,0,4,4,8,0
512-14-14-5x5-48-14-14-4-2x2-1x1-1x1-0-NCHW-FP32-F=ConvOclDirectFwd:16,16,16,16,1,1,1,2,1
1000-95-823-1x1-116-95-823-1-0x0-1x1-1x1-0-NCHW-FP32-B=ConvOclDirectFwd1x1:1,256,1,1,0,1,16,4,0
512-669-770-1x1-32-669-770-1-0x0-1x1-1x1-0-NCHW-FP32-B=ConvOclDirectFwd1x1:1,256,1,1,0,1,32,4,0
116-86-18-1x1-240-86-18-4-0x0-1x1-1x1-0-NCHW-FP32-B=ConvOclDirectFwd1x1:1,64,1,1,0,4,16,4,0;ConvAsm1x1U:1,16,1,64,2,2,1,1
2048-7-7-1x1-512-7-7-8-0x0-1x1-1x1-0-NCHW-FP32-B=ConvOclDirectFwd1x1:1,128,1,1,0,1,4,8,0;ConvAsm1x1U:2,16,2,32,1,2,4,1
64-112-112-3x3-128-112-112-32-1x1-1x1-1x1-0-NCHW-FP16-W=ConvAsmBwdWrW3x3:0,1,16,2,1,8
128-10-10-1x1-512-10-10-64-0x0-1x1-1x1-0-NCHW-FP32-B=ConvOclDirectFwd1x1:1,256,1,1,0,4,16,4,0;ConvAsm1x1U:1,16,1,64,2,2,1,4
352-126-134-1x1-864-126-134-8-0x0-1x1-1x1-0-NCHW-FP32-W=ConvAsmBwdWrW1x1:2,8,4,4,8,1,2,4,0,1
288-14-14-1x1-128-14-14-64-0x0-1x1-1x1-0-NCHW-FP16-B=ConvOclDirectFwd1x1:1,64,1,1,0,4,8,4,0;ConvAsm1x1U:1,16,2,16,1,2,4,2
19-942-5-1x1-1504-942-5-1-0x0-1x1-1x1-0-NCHW-FP32-B=ConvOclDirectFwd1x1:1,256,1,1,0,1,4,4,0
192-17-17-7x1-160-17-17-512-3x0-1x1-1x1-0-NCHW-FP16-W=ConvOclBwdWrW2<1>:1,6,8,3,7;ConvOclBwdWrW2<16>:1,6,8,3,7;ConvOclBwdWrW2<8>:1,6,8,3,7;ConvOclBwdWrW2<4>:1,9,8,3,9;ConvOclBwdWrW2<2>:1,6,8,3,7
64-56-56-1x1-128-56-56-512-0x0-1x1-1x1-0-NCHW-FP16-B=ConvOclDirectFwd1x1:1,128,1,1,0,4,16,4,0;ConvAsm1x1U:1,16,2,32,1,2,1,4
192-35-35-1x1-32-35-35-16-0x0-1x1-1x1-0-NCHW-FP16-F=ConvOclDirectFwd1x1:16,64,32,32,0,1,16,4,1;ConvAsm1x1U:1,8,2,64,1,4,2,2
128-28-28-1x1-224-28-28-32-0x0-1x1-1x1-0-NCHW-FP16-B=ConvOclDirectFwd1x1:1,64,1,1,0,4,16,4,0;ConvAsm1x1U:1,16,2,16,1,2,2,2
128-161-208-1x1-1472-161-208-1-0x0-1x1-1x1-0-NCHW-FP32-B=ConvOclDirectFwd1x1:1,128,1,1,0,2,32,4,0
128-14-14-1x1-512-14-14-1-0x0-1x1-1x1-0-NCHW-FP32-B=ConvOclDirectFwd1x1:1,64,1,1,0,4,4,8,0;ConvAsm1x1U:1,8,1,64,1,2,4,1
128-7-7-5x5-32-7-7-1-2x2-1x1-1x1-0-NCHW-FP32-B=ConvOclDirectFwd:8,8,8,8,1,1,1,4,1
384-7-7-3x3-192-7-7-4-1x1-1x1-1x1-0-NCHW-FP32-W=ConvAsmBwdWrW3x3:0,1,8,4,5,1
128-7-7-1x1-736-7-7-32-0x0-1x1-1x1-0-NCHW-FP16-F=ConvOclDirectFwd1x1:1,128,1,1,0,1,8,4,0;ConvAsm1x1U:1,8,2,16,1,4,1,8
256-14-14-3x3-128-14-14-8-1x1-1x1-1x1-0-NCHW-FP16-W=ConvAsmBwdWrW3x3:0,0,8,2,3,1
128-14-14-1x1-992-14-14-64-0x0-1x1-1x1-0-NCHW-FP16-F=ConvOclDirectFwd1x1:1,128,1,1,0,4,8,4,0;ConvAsm1x1U:2,8,4,64,1,4,1,1
16-6-929-1x1-1056-6-929-48-0x0-1x1-1x1-0-NCHW-FP32-B=ConvOclDirectFwd1x1:1,256,1,1,0,2,32,4,0
288-145-74-1x1-992-145-74-16-0x0-1x1-1x1-0-NCHW-FP32-W=ConvAsmBwdWrW1x1:2,8,8,8,2,1,1,2,0,1
192-56-56-1x1-128-56-56-64-0x0-1x1-1x1-0-NCHW-FP16-F=ConvOclDirectFwd1x1:1,256,1,1,0,4,16,4,0;ConvAsm1x1U:1,8,2,64,2,4,1,4
256-57-57-1x1-512-29-29-8-0x0-2x2-1x1-0-NCHW-FP32-F=ConvOclDirectFwd1x1:1,64,1,1,1,1,16,256,0;ConvAsm1x1U:2,16,2,64,2,2,4,1
128-720-475-1x1-24-720-475-8-0x0-1x1-1x1-0-NCHW-FP32-F=ConvOclDirectFwd1x1:1,256,1,1,0,2,16,4,0
992-413-32-1x1-832-413-32-1-0x0-1x1-1x1-0-NCHW-FP32-B=ConvOclDirectFwd1x1:1,256,1,1,0,4,16,8,0
896-7-7-1x1-128-7-7-32-0x0-1x1-1x1-0-NCHW-FP16-B=ConvOclDirectFwd1x1:1,64,1,1,0,1,8,8,0;ConvAsm1x1U:1,8,2,32,1,4,4,4
128-28-28-1x1-256-28-28-512-0x0-1x1-1x1-0-NCHW-FP32-F=ConvOclDirectFwd1x1:1,64,1,1,1,4,32,128,0;ConvAsm1x1U:2,16,2,32,2,2,1,4
576-14-14-1x1-128-14-14-16-0x0-1x1-1x1-0-NCHW-FP16-W=ConvAsmBwdWrW1x1:4,4,4,4,2,1,2,4,0,0
288-93-765-1x1-928-93-765-4-0x0-1x1-1x1-0-NCHW-FP32-B=ConvOclDirectFwd1x1:1,128,1,1,0,1,32,4,0
608-14-14-1x1-192-14-14-32-0x0-1x1-1x1-0-NCHW-FP32-F=ConvOclDirectFwd1x1:1,64,1,1,1,1,16,2048,0;ConvAsm1x1U:4,16,4,64,1,2,2,1;ConvActivAsm1x1U:3,16,3,16,4,2
48-27-27-1x1-384-27-27-128-0x0-1x1-1x1-0-NCHW-FP16-B=ConvOclDirectFwd1x1:1,256,1,1,0,1,64,4,0;ConvAsm1x1U:3,8,6,64,1,4,1,1
1472-166-606-1x1-832-166-606-1-0x0-1x1-1x1-0-NCHW-FP32-F=ConvOclDirectFwd1x1:1,64,1,1,1,1,16,256,0
4-103-69-1x1-48-103-69-32-0x0-1x1-1x1-0-NCHW-FP32-F=ConvOclDirectFwd1x1:1,256,1,1,0,1,16,4,0;ConvAsm1x1U:1,8,1,16,1,1,4,1
112-3-506-1x1-1104-3-506-8-0x0-1x1-1x1-0-NCHW-FP32-W=ConvAsmBwdWrW1x1:4,4,8,4,4,1,1,4,0,1
1104-277-150-1x1-768-277-150-4-0x0-1x1-1x1-0-NCHW-FP32-B=ConvOclDirectFwd1x1:1,128,1,1,0,2,32,4,0
256-27-27-1x1-48-27-27-256-0x0-1x1-1x1-0-NCHW-FP32-B=ConvOclDirectFwd1x1:1,256,1,1,0,1,16,4,0;ConvAsm1x1U:3,16,3,64,4,2,1,1
352-49-952-1x1-1504-49-952-6-0x0-1x1-1x1-0-NCHW-FP32-B=ConvOclDirectFwd1x1:1,128,1,1,0,1,32,4,0
720-420-236-1x1-54-420-236-4-0x0-1x1-1x1-0-NCHW-FP32-F=ConvOclDirectFwd1x1:1,64,1,1,0,2,8,4,0
160-64-128-1x1-512-64-128-1-0x0-1x1-1x1-0-NCHW-FP32-W=ConvAsmBwdWrW1x1:2,8,4,4,4,1,1,4,0,2
320-291-885-1x1-320-291-885-2-0x0-1x1-1x1-0-NCHW-FP32-B=ConvOclDirectFwd1x1:1,64,1,1,0,1,32,4,0
736-14-14-1x1-128-14-14-64-0x0-1x1-1x1-0-NCHW-FP32-F=ConvOclDirectFwd1x1:1,64,1,1,1,1,16,2048,0;ConvAsm1x1U:4,8,7,32,2,2,1,4
24-21-258-1x1-224-21-258-8-0x0-1x1-1x1-0-NCHW-FP32-F=ConvOclDirectFwd1x1:1,256,1,1,0,2,32,4,0;ConvAsm1x1U:1,8,1,64,1,2,4,2
128-428-133-1x1-4-428-133-6-0x0-1x1-1x1-0-NCHW-FP32-W=ConvAsmBwdWrW1x1:4,4,2,1,2,1,2,4,0,2
2048-8-8-1x1-1024-8-8-16-0x0-1x1-1x1-0-NCHW-FP32-W=ConvAsmBwdWrW1x1:1,16,4,4,8,1,1,4,0,1
512-14-14-1x1-2048-14-14-128-0x0-1x1-1x1-0-NCHW-FP16-B=ConvOclDirectFwd1x1:1,64,1,1,0,2,16,4,0;ConvAsm1x1U:2,8,4,64,1,4,4,1
16-422-51-1x1-1008-422-51-16-0x0-1x1-1x1-0-NCHW-FP32-B=ConvOclDirectFwd1x1:1,256,1,1,0,2,16,8,0
80-581-187-1x1-480-581-187-4-0x0-1x1-1x1-0-NCHW-FP32-F=ConvOclDirectFwd1x1:16,16,32,32,1,0,32,128,1
2048-7-7-1x1-1024-7-7-8-0x0-1x1-1x1-0-NCHW-FP32-W=ConvAsmBwdWrW1x1:1,16,4,4,8,1,1,4,0,1
480-293-7-1x1-528-293-7-6-0x0-1x1-1x1-0-NCHW-FP32-F=ConvOclDirectFwd1x1:1,64,1,1,1,4,64,2048,0;ConvAsm1x1U:3,16,3,64,2,2,1,4
32-35-35-1x1-192-35-35-64-0x0-1x1-1x1-0-NCHW-FP32-B=ConvOclDirectFwd1x1:1,256,1,1,0,1,32,4,0;ConvAsm1x1U:2,32,2,64,1,1,2,1
128-28-28-1x1-288-28-28-64-0x0-1x1-1x1-0-NCHW-FP32-W=ConvAsmBwdWrW1x1:4,4,4,4,4,2,2,2,0,1
144-241-383-1x1-512-241-383-4-0x0-1x1-1x1-0-NCHW-FP32-F=ConvOclDirectFwd1x1:1,64,1,1,1,0,32,2048,0
960-299-4-1x1-432-299-4-32-0x0-1x1-1x1-0-NCHW-FP32-B=ConvOclDirectFwd1x1:1,64,1,1,0,4,16,4,0;ConvAsm1x1U:3,16,5,64,1,2,1,2
352-353-719-1x1-224-353-719-1-0x0-1x1-1x1-0-NCHW-FP32-F=ConvOclDirectFwd1x1:1,64,1,1,1,0,64,2048,0
96-172-265-1x1-1152-172-265-8-0x0-1x1-1x1-0-NCHW-FP32-B=ConvOclDirectFwd1x1:1,128,1,1,0,2,32,4,0
640-669-148-1x1-1296-669-148-4-0x0-1x1-1x1-0-NCHW-FP32-B=ConvOclDirectFwd1x1:1,256,1,1,0,4,16,4,0
704-281-670-1x1-800-281-670-1-0x0-1x1-1x1-0-NCHW-FP32-B=ConvOclDirectFwd1x1:1,256,1,1,0,1,32,4,0
512-14-14-1x1-32-14-14-1-0x0-1x1-1x1-0-NCHW-FP32-F=ConvOclDirectFwd1x1:1,64,1,1,1,4,16,64,0;ConvAsm1x1U:1,8,1,16,1,4,4,1;ConvActivAsm1x1U:1,16,1,16,1,3
1-352-545-1x1-64-352-545-6-0x0-1x1-1x1-0-NCHW-FP32-W=ConvAsmBwdWrW1x1:4,4,2,1,2,1,4,4,0,1
128-104-104-3x3-64-104-104-256-1x1-1x1-1x1-0-NCHW-FP32-W=ConvAsmBwdWrW3x3:0,0,16,4,2,1
96-200-717-1x1-448-200-717-4-0x0-1x1-1x1-0-NCHW-FP32-F=ConvOclDirectFwd1x1:16,16,32,32,1,0,32,128,1
528-23-401-1x1-80-23-401-16-0x0-1x1-1x1-0-NCHW-FP32-F=ConvOclDirectFwd1x1:1,64,1,1,1,0,64,2048,0
704-337-63-1x1-1-337-63-4-0x0-1x1-1x1-0-NCHW-FP32-B=ConvOclDirectFwd1x1:1,128,1,1,0,1,16,4,0
64-56-56-3x3-64-56-56-32-1x1-1x1-1x1-0-NCHW-FP16-F=ConvOclDirectFwd:32,8,32,32,1,4,8,1,2;ConvOclDirectFwdFused:32,8,32,32,1,4,8,1,2
2-116-261-1x1-768-116-261-2-0x0-1x1-1x1-0-NCHW-FP32-F=ConvOclDirectFwd1x1:1,256,1,1,0,4,4,4,0
128-14-14-1x1-768-14-14-64-0x0-1x1-1x1-0-NCHW-FP32-B=ConvOclDirectFwd1x1:8,64,16,16,0,2,16,4,1;ConvAsm1x1U:1,16,1,64,2,2,1,2
992-608-769-1x1-768-608-769-1-0x0-1x1-1x1-0-NCHW-FP32-B=ConvOclDirectFwd1x1:1,256,1,1,0,2,32,4,0
112-14-14-1x1-512-14-14-1-0x0-1x1-1x1-0-NCHW-FP16-W=ConvAsmBwdWrW1x1:2,8,2,2,2,1,1,4,0,0
416-703-29-1x1-480-703-29-6-0x0-1x1-1x1-0-NCHW-FP32-B=ConvOclDirectFwd1x1:1,256,1,1,0,1,32,4,0
4-505-882-1x1-2-505-882-2-0x0-1x1-1x1-0-NCHW-FP32-F=ConvOclDirectFwd1x1:1,256,1,1,0,1,4,4,0;ConvAsm1x1U:4,1,4,4,1,1,1,2
64-112-112-7x7-3-224-224-256-3x3-2x2-1x1-0-NCHW-FP32-W=ConvOclBwdWrW2<1>:3,7,1,1,7;ConvOclBwdWrW2<16>:3,9,3,3,7;ConvOclBwdWrW2<8>:3,10,3,1,7;ConvOclBwdWrW2<4>:3,8,3,1,7;ConvOclBwdWrW2<2>:3,7,8,1,7
544-107-673-1x1-1152-107-673-1-0x0-1x1-1x1-0-NCHW-FP32-B=ConvOclDirectFwd1x1:1,256,1,1,0,1,32,4,0
256-68-369-1x1-1024-68-369-4-0x0-1x1-1x1-0-NCHW-FP32-F=ConvOclDirectFwd1x1:1,64,1,1,1,1,32,2048,0
1680-362-156-1x1-1056-362-156-2-0x0-1x1-1x1-0-NCHW-FP32-F=ConvOclDirectFwd1x1:1,64,1,1,1,4,64,2048,0
58-18-189-1x1-48-18-189-12-0x0-1x1-1x1-0-NCHW-FP32-F=ConvOclDirectFwd1x1:1,256,1,1,0,1,16,4,0;ConvAsm1x1U:3,16,3,64,1,1,1,1
192-35-35-1x1-48-35-35-256-0x0-1x1-1x1-0-NCHW-FP16-F=ConvOclDirectFwd1x1:1,256,1,1,0,1,16,8,0;ConvAsm1x1U:2,16,4,64,1,2,1,1
12-16-16-1x1-512-16-16-4-0x0-1x1-1x1-0-NCHW-FP32-W=ConvAsmBwdWrW1x1:4,4,2,1,2,1,1,2,0,1
192-28-28-3x3-128-28-28-16-1x1-1x1-1x1-0-NCHW-FP32-W=ConvAsmBwdWrW3x3:0,0,8,2,4,1
1024-77-955-1x1-672-77-955-6-0x0-1x1-1x1-0-NCHW-FP32-F=ConvOclDirectFwd1x1:1,64,1,1,1,4,64,2048,0
432-148-376-1x1-480-148-376-1-0x0-1x1-1x1-0-NCHW-FP32-F=ConvOclDirectFwd1x1:1,64,1,1,1,4,64,2048,0
192-17-17-1x1-1024-17-17-8-0x0-1x1-1x1-0-NCHW-FP16-W=ConvAsmBwdWrW1x1:4,4,4,4,4,1,1,2,0,1
240-28-28-1x1-60-28-28-64-0x0-1x1-1x1-0-NCHW-FP16-B_g3=ConvOclDirectFwd:16,16,16,16,1,1,8,2,1
768-28-28-1x1-384-28-28-16-0x0-1x1-1x1-0-NCHW-FP16-F=ConvOclDirectFwd1x1:1,64,1,1,0,2,8,4,0;ConvAsm1x1U:1,8,2,32,2,4,1,8
64-27-27-5x5-192-27-27-32-2x2-1x1-1x1-0-NCHW-FP16-B=ConvOclDirectFwd:16,16,32,32,2,2,8,4,2
128-14-14-1x1-896-14-14-512-0x0-1x1-1x1-0-NCHW-FP16-F=ConvOclDirectFwd1x1:1,256,1,1,0,2,16,4,0;ConvAsm1x1U:1,8,2,16,2,4,1,8
320-574-228-1x1-1600-574-228-1-0x0-1x1-1x1-0-NCHW-FP32-B=ConvOclDirectFwd1x1:1,128,1,1,0,1,32,4,0
3-34-846-1x1-512-34-846-1-0x0-1x1-1x1-0-NCHW-FP32-B=ConvOclDirectFwd1x1:1,256,1,1,0,1,4,4,0
448-926-321-1x1-58-926-321-2-0x0-1x1-1x1-0-NCHW-FP32-F=ConvOclDirectFwd1x1:1,256,1,1,0,2,4,4,0
1024-7-7-1x1-464-7-7-1-0x0-1x1-1x1-0-NCHW-FP32-W=ConvAsmBwdWrW1x1:1,16,4,4,2,1,1,2,0,1
58-930-7-1x1-432-930-7-1-0x0-1x1-1x1-0-NCHW-FP32-W=ConvAsmBwdWrW1x1:4,4,2,4,4,1,1,4,0,1
448-28-28-1x1-128-28-28-512-0x0-1x1-1x1-0-NCHW-FP16-F=ConvOclDirectFwd1x1:1,128,1,1,0,4,16,4,0;ConvAsm1x1U:1,16,2,32,2,2,1,4
864-322-430-1x1-448-322-430-1-0x0-1x1-1x1-0-NCHW-FP32-B=ConvOclDirectFwd1x1:1,128,1,1,0,4,16,8,0
288-106-37-1x1-192-106-37-6-0x0-1x1-1x1-0-NCHW-FP32-B=ConvOclDirectFwd1x1:1,64,1,1,0,2,32,4,0;ConvAsm1x1U:2,16,3,64,1,2,1,4
832-521-14-1x1-1056-521-14-48-0x0-1x1-1x1-0-NCHW-FP32-B=ConvOclDirectFwd1x1:1,128,1,1,0,2,32,4,0
192-27-27-5x5-64-27-27-4-2x2-1x1-1x1-0-NCHW-FP32-B=ConvOclDirectFwd:16,16,32,32,2,2,2,4,2
704-155-16-1x1-58-155-16-32-0x0-1x1-1x1-0-NCHW-FP32-F=ConvOclDirectFwd1x1:1,128,1,1,0,4,8,4,0;ConvAsm1x1U:3,32,5,16,1,1,1,1
4-762-471-1x1-416-762-471-1-0x0-1x1-1x1-0-NCHW-FP32-B=ConvOclDirectFwd1x1:1,256,1,1,0,2,32,4,0
232-97-653-1x1-384-97-653-1-0x0-1x1-1x1-0-NCHW-FP32-B=ConvOclDirectFwd1x1:1,128,1,1,0,1,32,4,0
1024-17-17-1x1-128-17-17-256-0x0-1x1-1x1-0-NCHW-FP32-B=ConvOclDirectFwd1x1:1,256,1,1,0,1,32,4,0;ConvAsm1x1U:1,32,1,64,2,1,2,2
144-14-14-1x1-512-14-14-1-0x0-1x1-1x1-0-NCHW-FP16-W=ConvAsmBwdWrW1x1:2,8,4,1,4,1,1,4,0,0
8-657-35-1x1-640-657-35-1-0x0-1x1-1x1-0-NCHW-FP32-W=ConvAsmBwdWrW1x1:4,4,2,2,2,1,1,4,0,1
256-17-17-1x1-1024-17-17-32-0x0-1x1-1x1-0-NCHW-FP16-B=ConvOclDirectFwd1x1:1,64,1,1,0,1,16,4,0;ConvAsm1x1U:1,16,2,32,1,2,1,2
512-453-398-1x1-288-453-398-2-0x0-1x1-1x1-0-NCHW-FP32-B=ConvOclDirectFwd1x1:1,64,1,1,0,1,32,4,0
832-811-24-1x1-624-811-24-12-0x0-1x1-1x1-0-NCHW-FP32-W=ConvAsmBwdWrW1x1:4,4,4,4,8,1,2,4,0,0
768-287-39-1x1-1200-287-39-4-0x0-1x1-1x1-0-NCHW-FP32-W=ConvAsmBwdWrW1x1:2,8,4,4,8,1,1,4,0,1
160-56-56-1x1-128-56-56-16-0x0-1x1-1x1-0-NCHW-FP16-W=ConvAsmBwdWrW1x1:4,4,4,2,4,1,4,4,0,1
384-8-8-1x1-1536-8-8-16-0x0-1x1-1x1-0-NCHW-FP32-B=ConvOclDirectFwd1x1:1,64,1,1,0,4,8,4,0;ConvAsm1x1U:1,16,1,64,2,2,2,4
240-7-7-3x3-240-7-7-32-1x1-1x1-1x1-0-NCHW-FP32-W=ConvAsmBwdWrW3x3:0,1,8,2,7,1
288-1-100-1x1-1632-1-100-256-0x0-1x1-1x1-0-NCHW-FP32-W=ConvAsmBwdWrW1x1:1,16,4,4,8,1,1,4,0,1
3-996-79-1x1-1-996-79-64-0x0-1x1-1x1-0-NCHW-FP32-F=ConvOclDirectFwd1x1:1,128,1,1,0,1,8,4,0;ConvAsm1x1U:1,1,1,4,1,1,1,1
58-56-56-1x1-24-56-56-4-0x0-1x1-1x1-0-NCHW-FP32-W=ConvAsmBwdWrW1x1:4,4,2,2,2,1,4,4,0,1
3-1-1-3x3-4-2-2-128-0x0-2x2-1x1-0-NCHW-FP32-B=ConvOclDirectFwd:8,8,8,8,1,1,1,2,2
48-358-31-1x1-720-358-31-6-0x0-1x1-1x1-0-NCHW-FP32-W=ConvAsmBwdWrW1x1:4,4,4,4,4,1,1,4,0,1
672-1-501-1x1-80-1-501-128-0x0-1x1-1x1-0-NCHW-FP32-F=ConvOclDirectFwd1x1:1,64,1,1,1,4,64,2048,0;ConvAsm1x1U:3,16,3,64,4,1,1,1
256-7-7-1x1-832-7-7-4-0x0-1x1-1x1-0-NCHW-FP32-B=ConvOclDirectFwd1x1:1,128,1,1,0,1,4,8,0;ConvAsm1x1U:1,8,1,64,1,4,2,4
64-6-60-3x3-128-6-60-16-1x1-1x1-1x1-0-NCHW-FP16-F=ConvOclDirectFwd:8,16,8,32,1,2,8,2,2
3-225-225-7x7-64-112-112-16-2x2-2x2-1x1-0-NCHW-FP32-F=ConvOclDirectFwd:16,8,16,16,1,2,8,1,2;ConvOclDirectFwdFused:16,8,16,16,1,2,8,1,2
1008-485-200-1x1-448-485-200-2-0x0-1x1-1x1-0-NCHW-FP32-F=ConvOclDirectFwd1x1:1,64,1,1,1,4,16,2048,0
232-121-612-1x1-128-121-612-12-0x0-1x1-1x1-0-NCHW-FP32-F=ConvOclDirectFwd1x1:1,128,1,1,0,2,32,4,0
704-8-933-1x1-1472-8-933-48-0x0-1x1-1x1-0-NCHW-FP32-W=ConvAsmBwdWrW1x1:1,16,2,8,8,1,1,4,0,1
96-35-35-3x3-96-35-35-16-1x1-1x1-1x1-0-NCHW-FP16-F=ConvOclDirectFwd:16,8,16,16,1,2,8,1,1;ConvOclDirectFwdFused:16,8,16,16,1,2,8,1,1
256-56-56-1x1-128-28-28-16-0x0-2x2-1x1-0-NCHW-FP32-F=ConvOclDirectFwd1x1:1,64,1,1,1,0,32,2048,0;ConvAsm1x1U:2,16,2,32,2,2,2,2
8-187-660-1x1-1008-187-660-2-0x0-1x1-1x1-0-NCHW-FP32-B=ConvOclDirectFwd1x1:1,256,1,1,0,2,16,8,0
704-273-479-1x1-320-273-479-1-0x0-1x1-1x1-0-NCHW-FP32-B=ConvOclDirectFwd1x1:1,256,1,1,0,1,32,4,0
192-472-135-1x1-128-472-135-16-0x0-1x1-1x1-0-NCHW-FP32-F=ConvOclDirectFwd1x1:1,64,1,1,1,1,16,2048,0
192-35-35-3x3-192-71-71-4-0x0-2x2-1x1-0-NCHW-FP16-B=ConvOclDirectFwd:8,8,16,16,2,2,4,1,1
64-301-901-1x1-384-301-901-1-0x0-1x1-1x1-0-NCHW-FP32-F=ConvOclDirectFwd1x1:16,16,32,32,1,0,32,128,1
384-17-17-3x3-384-35-35-128-0x0-2x2-1x1-0-NCHW-FP16-B=ConvOclDirectFwd:16,8,16,16,1,2,4,1,2
1-266-28-1x1-624-266-28-64-0x0-1x1-1x1-0-NCHW-FP32-W=ConvAsmBwdWrW1x1:4,4,2,1,2,1,1,2,0,1
32-14-14-1x1-528-14-14-32-0x0-1x1-1x1-0-NCHW-FP32-W=ConvAsmBwdWrW1x1:4,4,4,4,4,1,2,4,0,1
120-7-7-3x3-120-14-14-128-1x1-2x2-1x1-0-NCHW-FP16-B=ConvOclDirectFwd:8,8,16,16,2,2,4,1,2
256-27-27-1x1-64-27-27-256-0x0-1x1-1x1-0-NCHW-FP32-B=ConvOclDirectFwd1x1:1,256,1,1,0,1,32,4,0;ConvAsm1x1U:1,16,1,64,1,2,1,4
32-259-850-1x1-192-259-850-12-0x0-1x1-1x1-0-NCHW-FP32-B=ConvOclDirectFwd1x1:1,128,1,1,0,2,32,4,0
64-97-954-1x1-16-97-954-8-0x0-1x1-1x1-0-NCHW-FP32-F=ConvOclDirectFwd1x1:16,16,32,32,1,0,32,128,1
8-707-542-1x1-80-707-542-4-0x0-1x1-1x1-0-NCHW-FP32-F=ConvOclDirectFwd1x1:1,256,1,1,0,2,16,4,0
16-932-41-1x1-24-932-41-6-0x0-1x1-1x1-0-NCHW-FP32-F=ConvOclDirectFwd1x1:1,64,1,1,0,4,16,8,0;ConvAsm1x1U:2,8,7,64,3,1,1,1
96-54-54-1x1-16-54-54-512-0x0-1x1-1x1-0-NCHW-FP32-F=ConvOclDirectFwd1x1:1,64,1,1,1,1,32,2048,0;ConvAsm1x1U:2,8,4,64,4,1,1,2
116-28-28-1x1-116-28-28-32-0x0-1x1-1x1-0-NCHW-FP16-B=ConvOclDirectFwd1x1:1,256,1,1,0,1,16,4,0;ConvAsm1x1U:4,4,8,4,1,2,1,4
116-28-28-1x1-116-28-28-512-0x0-1x1-1x1-0-NCHW-FP16-F=ConvOclDirectFwd1x1:1,64,1,1,0,2,16,4,0;ConvAsm1x1U:1,8,2,16,1,4,1,4
960-50-500-1x1-3-50-500-8-0x0-1x1-1x1-0-NCHW-FP32-B=ConvOclDirectFwd1x1:1,128,1,1,0,4,16,4,0
384-8-8-1x1-1536-8-8-4-0x0-1x1-1x1-0-NCHW-FP16-B=ConvOclDirectFwd1x1:1,64,1,1,0,2,4,4,0;ConvAsm1x1U:1,8,2,32,1,4,4,2
192-7-7-1x1-1584-7-7-16-0x0-1x1-1x1-0-NCHW-FP32-B=ConvOclDirectFwd1x1:1,256,1,1,0,1,8,4,0;ConvAsm1x1U:1,16,1,64,2,2,2,2
512-28-28-3x3-512-14-14-32-1x1-2x2-1x1-0-NCHW-FP32-F_g32=ConvOclDirectFwd:16,16,16,16,1,1,8,2,2
128-28-28-1x1-512-14-14-16-0x0-2x2-1x1-0-NCHW-FP32-F=ConvOclDirectFwd1x1:1,64,1,1,1,4,32,2048,0;ConvAsm1x1U:1,16,1,32,4,2,1,8
704-7-7-1x1-128-7-7-64-0x0-1x1-1x1-0-NCHW-FP32-B=ConvOclDirectFwd1x1:1,64,1,1,0,1,8,4,0;ConvAsm1x1U:1,16,1,64,2,2,4,1
128-7-7-1x1-992-7-7-64-0x0-1x1-1x1-0-NCHW-FP32-W=ConvAsmBwdWrW1x1:1,16,2,8,4,1,2,4,0,2
64-13-13-3x3-256-13-13-32-1x1-1x1-1x1-0-NCHW-FP32-W=ConvAsmBwdWrW3x3:0,0,16,2,11,1
232-14-14-1x1-232-14-14-1024-0x0-1x1-1x1-0-NCHW-FP32-W=ConvAsmBwdWrW1x1:4,4,8,4,4,1,2,4,0,0
128-14-14-1x1-512-14-14-64-0x0-1x1-1x1-0-NCHW-FP32-B=ConvOclDirectFwd1x1:1,128,1,1,0,4,16,4,0;ConvAsm1x1U:1,32,1,32,2,1,2,1
448-3-505-1x1-224-3-505-8-0x0-1x1-1x1-0-NCHW-FP32-B=ConvOclDirectFwd1x1:1,128,1,1,0,1,32,4,0;ConvAsm1x1U:3,16,3,32,1,2,1,4
1392-249-70-1x1-224-249-70-16-0x0-1x1-1x1-0-NCHW-FP32-F=ConvOclDirectFwd1x1:1,64,1,1,1,0,64,2048,0
128-28-28-1x1-256-56-56-4-0x0-2x2-1x1-0-NCHW-FP32-W=ConvAsmBwdWrW1x1:2,8,2,4,2,2,2,4,0,1
768-75-681-1x1-1056-75-681-4-0x0-1x1-1x1-0-NCHW-FP32-F=ConvOclDirectFwd1x1:1,64,1,1,1,4,64,2048,0
54-55-55-1x1-24-55-55-64-0x0-1x1-1x1-0-NCHW-FP32-W=ConvAsmBwdWrW1x1:4,4,2,2,2,1,2,4,0,3
448-210-448-1x1-624-210-448-6-0x0-1x1-1x1-0-NCHW-FP32-B=ConvOclDirectFwd1x1:1,256,1,1,0,2,16,8,0
128-28-28-1x1-480-28-28-128-0x0-1x1-1x1-0-NCHW-FP32-W=ConvAsmBwdWrW1x1:2,8,4,8,2,2,2,4,0,2
608-367-149-1x1-384-367-149-16-0x0-1x1-1x1-0-NCHW-FP32-B=ConvOclDirectFwd1x1:1,128,1,1,0,1,32,4,0
128-14-14-3x3-128-28-28-256-1x1-2x2-1x1-0-NCHW-FP32-B=ConvOclDirectFwd:8,32,32,32,4,1,8,2,1
2048-7-7-1x1-1024-4-4-256-0x0-2x2-1x1-0-NCHW-FP32-F=ConvOclDirectFwd1x1:1,64,1,1,1,0,64,2048,0;ConvAsm1x1U:1,16,1,16,4,2,4,2
4-182-402-1x1-256-182-402-1-0x0-1x1-1x1-0-NCHW-FP32-B=ConvOclDirectFwd1x1:1,128,1,1,0,1,4,4,0
16-24-240-3x3-32-24-240-2-1x1-1x1-1x1-0-NCHW-FP32-F=ConvAsm3x3U:0,4,1;ConvOclDirectFwd:16,16,16,32,1,2,8,4,2
1856-163-287-1x1-1280-163-287-6-0x0-1x1-1x1-0-NCHW-FP32-F=ConvOclDirectFwd1x1:1,64,1,1,1,1,16,2048,0
128-112-112-3x3-64-112-112-256-1x1-1x1-1x1-0-NCHW-FP16-F=ConvOclDirectFwd:8,16,16,32,2,2,8,1,1
64-27-27-1x1-384-27-27-256-0x0-1x1-1x1-0-NCHW-FP16-W=ConvAsmBwdWrW1x1:2,8,8,4,2,1,4,4,0,1
384-303-274-1x1-1200-303-274-2-0x0-1x1-1x1-0-NCHW-FP32-B=ConvOclDirectFwd1x1:16,64,32,32,0,2,16,4,1
58-413-809-1x1-32-413-809-2-0x0-1x1-1x1-0-NCHW-FP32-B=ConvOclDirectFwd1x1:1,256,1,1,0,1,32,4,0
58-39-106-1x1-256-39-106-64-0x0-1x1-1x1-0-NCHW-FP32-F=ConvOclDirectFwd1x1:1,64,1,1,0,1,64,4,0;ConvAsm1x1U:1,16,1,64,2,2,1,1
80-581-717-1x1-160-581-717-8-0x0-1x1-1x1-0-NCHW-FP32-B=ConvOclDirectFwd1x1:1,128,1,1,0,1,32,4,0
64-112-112-3x3-128-112-112-1-1x1-1x1-1x1-0-NCHW-FP16-F=ConvOclDirectFwd:8,32,16,32,2,1,8,4,1;ConvOclDirectFwdFused:8,32,16,32,2,1,8,2,1
58-394-844-1x1-256-394-844-4-0x0-1x1-1x1-0-NCHW-FP32-B=ConvOclDirectFwd1x1:1,64,1,1,0,1,64,4,0
480-172-394-1x1-960-172-394-1-0x0-1x1-1x1-0-NCHW-FP32-F=ConvOclDirectFwd1x1:1,64,1,1,1,4,16,2048,0
64-112-112-7x7-3-225-225-8-2x2-2x2-1x1-0-NCHW-FP32-B=ConvOclDirectFwd:16,16,32,32,2,2,8,2,1
19-793-251-1x1-1-793-251-16-0x0-1x1-1x1-0-NCHW-FP32-B=ConvOclDirectFwd1x1:1,256,1,1,0,1,8,4,0;ConvAsm1x1U:1,1,4,1,1,1,1,1
1776-29-887-1x1-416-29-887-4-0x0-1x1-1x1-0-NCHW-FP32-F=ConvOclDirectFwd1x1:1,64,1,1,1,0,64,2048,0
1280-8-8-1x1-384-8-8-8-0x0-1x1-1x1-0-NCHW-FP16-F=ConvOclDirectFwd1x1:1,128,1,1,0,2,4,4,0;ConvAsm1x1U:1,8,2,32,2,4,4,2
192-853-713-1x1-336-853-713-2-0x0-1x1-1x1-0-NCHW-FP32-B=ConvOclDirectFwd1x1:1,256,1,1,0,1,16,8,0
256-28-28-1x1-512-28-28-48-0x0-1x1-1x1-0-NCHW-FP32-B=ConvOclDirectFwd1x1:1,64,1,1,0,2,32,4,0;ConvAsm1x1U:2,16,2,32,1,2,1,4
128-14-14-1x1-608-14-14-16-0x0-1x1-1x1-0-NCHW-FP16-F=ConvOclDirectFwd1x1:1,64,1,1,0,4,8,4,0;ConvAsm1x1U:1,8,2,16,1,4,1,4
128-14-14-1x1-288-14-14-512-0x0-1x1-1x1-0-NCHW-FP16-W=ConvAsmBwdWrW1x1:2,8,2,8,2,1,4,4,0,1
16-73-105-1x1-224-73-105-128-0x0-1x1-1x1-0-NCHW-FP32-B=ConvOclDirectFwd1x1:1,256,1,1,0,1,32,4,0;ConvAsm1x1U:1,8,1,16,1,1,1,1
640-14-14-1x1-128-14-14-64-0x0-1x1-1x1-0-NCHW-FP32-B=ConvOclDirectFwd1x1:1,128,1,1,0,4,16,4,0;ConvAsm1x1U:1,16,1,32,3,2,2,2
16-54-54-3x3-64-54-54-512-1x1-1x1-1x1-0-NCHW-FP16-B=ConvOclDirectFwd:8,16,16,32,2,2,8,1,1
8-459-371-1x1-512-459-371-2-0x0-1x1-1x1-0-NCHW-FP32-F=ConvOclDirectFwd1x1:1,256,1,1,0,1,32,4,0
1024-14-14-1x1-256-14-14-1-0x0-1x1-1x1-0-NCHW-FP16-F=ConvOclDirectFwd1x1:1,128,1,1,0,4,4,8,0;ConvAsm1x1U:1,8,2,32,1,4,4,1
58-28-28-1x1-58-28-28-64-0x0-1x1-1x1-0-NCHW-FP16-B=ConvOclDirectFwd1x1:1,128,1,1,0,4,4,4,0
8-850-279-1x1-1248-850-279-1-0x0-1x1-1x1-0-NCHW-FP32-B=ConvOclDirectFwd1x1:1,256,1,1,0,2,32,4,0
192-56-56-1x1-192-56-56-16-0x0-1x1-1x1-0-NCHW-FP32-B=ConvOclDirectFwd1x1:1,256,1,1,0,2,32,4,0;ConvAsm1x1U:1,32,1,64,1,1,1,2
128-14-14-1x1-576-14-14-256-0x0-1x1-1x1-0-NCHW-FP32-F=ConvOclDirectFwd1x1:1,64,1,1,1,0,32,2048,0;ConvAsm1x1U:2,16,2,64,3,2,2,2
232-76-721-1x1-864-76-721-6-0x0-1x1-1x1-0-NCHW-FP32-F=ConvOclDirectFwd1x1:1,256,1,1,0,2,32,4,0
48-327-466-1x1-48-327-466-1-0x0-1x1-1x1-0-NCHW-FP32-W=ConvAsmBwdWrW1x1:4,4,2,4,2,1,1,4,0,3
960-172-642-1x1-1440-172-642-2-0x0-1x1-1x1-0-NCHW-FP32-B=ConvOclDirectFwd1x1:1,64,1,1,0,2,32,4,0
60-14-14-3x3-60-28-28-16-1x1-2x2-1x1-0-NCHW-FP32-W=ConvAsmBwdWrW3x3:0,0,16,4,5,2
128-906-368-1x1-4-906-368-6-0x0-1x1-1x1-0-NCHW-FP32-F=ConvOclDirectFwd1x1:1,256,1,1,0,4,16,4,0
32-79-341-5x20-1-161-700-256-0x0-2x2-1x1-0-NCHW-FP32-W=ConvOclBwdWrW2<1>:8,7,1,3,5;ConvOclBwdWrW2<16>:8,7,1,3,5;ConvOclBwdWrW2<8>:8,7,3,1,5;ConvOclBwdWrW2<4>:8,7,3,1,5;ConvOclBwdWrW2<2>:8,7,3,1,5
352-14-14-1x1-128-14-14-32-0x0-1x1-1x1-0-NCHW-FP32-B=ConvOclDirectFwd1x1:1,256,1,1,0,2,16,4,0;ConvAsm1x1U:1,16,1,32,2,2,2,2
384-7-7-1x1-832-7-7-32-0x0-1x1-1x1-0-NCHW-FP16-W=ConvAsmBwdWrW1x1:1,16,2,8,2,1,2,4,0,1
672-7-7-1x1-128-7-7-32-0x0-1x1-1x1-0-NCHW-FP32-B=ConvOclDirectFwd1x1:1,256,1,1,0,1,4,8,0;ConvAsm1x1U:1,16,1,64,1,2,4,2
1024-7-7-1x1-2048-7-7-32-0x0-1x1-1x1-0-NCHW-FP32-F=ConvOclDirectFwd1x1:1,64,1,1,1,1,64,2048,0;ConvAsm1x1U:2,16,2,32,3,2,4,1
672-813-54-1x1-352-813-54-12-0x0-1x1-1x1-0-NCHW-FP32-B=ConvOclDirectFwd1x1:1,256,1,1,0,1,32,4,0
80-74-393-1x1-4-74-393-6-0x0-1x1-1x1-0-NCHW-FP32-B=ConvOclDirectFwd1x1:1,256,1,1,0,1,8,4,0;ConvAsm1x1U:3,4,5,4,1,1,1,1
32-405-23-1x1-1408-405-23-2-0x0-1x1-1x1-0-NCHW-FP32-W=ConvAsmBwdWrW1x1:4,4,8,1,8,1,1,4,0,0
256-29-29-3x3-256-29-29-16-1x1-1x1-1x1-0-NCHW-FP32-F_g32=ConvOclDirectFwd:16,16,32,32,2,2,8,2,1
128-7-7-1x1-992-7-7-16-0x0-1x1-1x1-0-NCHW-FP16-B=ConvOclDirectFwd1x1:1,128,1,1,0,1,8,4,0;ConvAsm1x1U:1,8,2,32,1,2,2,2
416-70-242-1x1-544-70-242-16-0x0-1x1-1x1-0-NCHW-FP32-W=ConvAsmBwdWrW1x1:4,4,4,4,8,1,1,4,0,1
256-14-14-3x3-256-14-14-1-1x1-1x1-1x1-0-NCHW-FP32-W=ConvAsmBwdWrW3x3:0,1,8,2,2,1
224-28-28-1x1-128-28-28-64-0x0-1x1-1x1-0-NCHW-FP16-W=ConvAsmBwdWrW1x1:4,4,8,1,8,1,2,4,0,1
256-56-56-1x1-128-56-56-2-0x0-1x1-1x1-0-NCHW-FP32-F=ConvOclDirectFwd1x1:1,64,1,1,1,1,16,256,0;ConvAsm1x1U:4,8,4,64,1,4,1,4
128-17-17-1x1-768-17-17-8-0x0-1x1-1x1-0-NCHW-FP32-W=ConvAsmBwdWrW1x1:1,16,2,4,8,1,2,4,0,1
720-311-209-1x1-736-311-209-8-0x0-1x1-1x1-0-NCHW-FP32-F=ConvOclDirectFwd1x1:1,64,1,1,1,0,64,2048,0
144-287-301-1x1-480-287-301-4-0x0-1x1-1x1-0-NCHW-FP32-F=ConvOclDirectFwd1x1:1,64,1,1,1,4,64,256,0
512-14-14-1x1-160-14-14-128-0x0-1x1-1x1-0-NCHW-FP16-F=ConvOclDirectFwd1x1:1,256,1,1,0,4,16,4,0;ConvAsm1x1U:2,8,4,64,1,4,2,2
24-55-55-1x1-54-55-55-4-0x0-1x1-1x1-0-NCHW-FP32-F=ConvOclDirectFwd1x1:1,256,1,1,0,1,8,4,0;ConvAsm1x1U:1,8,1,64,2,1,2,4
128-64-128-5x5-32-64-128-1-2x2-1x1-1x1-0-NCHW-FP32-B=ConvOclDirectFwd:8,32,16,32,2,1,2,4,1
704-364-56-1x1-736-364-56-16-0x0-1x1-1x1-0-NCHW-FP32-B=ConvOclDirectFwd1x1:1,64,1,1,0,2,32,4,0
1-126-137-1x1-640-126-137-8-0x0-1x1-1x1-0-NCHW-FP32-F=ConvOclDirectFwd1x1:1,128,1,1,0,1,4,4,0
60-14-14-1x1-240-14-14-4-0x0-1x1-1x1-0-NCHW-FP16-F_g3=ConvOclDirectFwd:16,8,16,8,1,1,4,4,2
160-747-248-1x1-1280-747-248-1-0x0-1x1-1x1-0-NCHW-FP32-B=ConvOclDirectFwd1x1:1,128,1,1,0,1,32,4,0
1088-158-475-1x1-256-158-475-6-0x0-1x1-1x1-0-NCHW-FP32-F=ConvOclDirectFwd1x1:1,64,1,1,1,4,32,2048,0
528-32-146-1x1-736-32-146-6-0x0-1x1-1x1-0-NCHW-FP32-F=ConvOclDirectFwd1x1:1,64,1,1,1,4,64,2048,0;ConvAsm1x1U:3,32,7,32,1,1,1,1
608-140-28-1x1-3-140-28-64-0x0-1x1-1x1-0-NCHW-FP32-W=ConvAsmBwdWrW1x1:4,4,2,1,2,1,1,2,0,1
480-74-76-1x1-864-74-76-12-0x0-1x1-1x1-0-NCHW-FP32-W=ConvAsmBwdWrW1x1:2,8,8,8,2,1,1,4,0,1
256-28-28-3x3-512-28-28-16-1x1-1x1-1x1-0-NCHW-FP16-W=ConvAsmBwdWrW3x3:0,1,8,4,2,1
144-180-176-1x1-1776-180-176-6-0x0-1x1-1x1-0-NCHW-FP32-B=ConvOclDirectFwd1x1:1,256,1,1,0,1,16,8,0
160-393-963-1x1-64-393-963-4-0x0-1x1-1x1-0-NCHW-FP32-F=ConvOclDirectFwd1x1:1,64,1,1,1,0,16,2048,0
128-56-56-3x3-128-56-56-16-1x1-1x1-1x1-0-NCHW-FP32-F_g32=ConvOclDirectFwd:16,16,16,32,1,2,4,2,1
704-7-7-1x1-128-7-7-512-0x0-1x1-1x1-0-NCHW-FP16-F=ConvOclDirectFwd1x1:8,64,8,8,0,1,16,4,1;ConvAsm1x1U:2,8,4,16,1,4,1,4
352-1-67-1x1-896-1-67-64-0x0-1x1-1x1-0-NCHW-FP32-F=ConvOclDirectFwd1x1:1,64,1,1,1,1,16,2048,0;ConvAsm1x1U:3,8,3,32,2,4,1,4
48-27-27-1x1-256-27-27-128-0x0-1x1-1x1-0-NCHW-FP16-W=ConvAsmBwdWrW1x1:4,4,8,4,2,1,4,2,0,1
32-394-581-1x1-32-394-581-12-0x0-1x1-1x1-0-NCHW-FP32-W=ConvAsmBwdWrW1x1:4,4,2,1,2,1,2,4,0,3
448-929-16-1x1-112-929-16-1-0x0-1x1-1x1-0-NCHW-FP32-F=ConvOclDirectFwd1x1:1,64,1,1,1,1,64,2048,0
736-520-7-1x1-116-520-7-32-0x0-1x1-1x1-0-NCHW-FP32-F=ConvOclDirectFwd1x1:1,256,1,1,0,2,16,4,0;ConvAsm1x1U:2,16,8,64,1,2,1,1
1056-7-7-1x1-192-7-7-64-0x0-1x1-1x1-0-NCHW-FP16-F=ConvOclDirectFwd1x1:1,64,1,1,0,1,8,4,0;ConvAsm1x1U:2,8,4,16,1,4,4,2
192-7-7-1x1-1344-7-7-16-0x0-1x1-1x1-0-NCHW-FP16-B=ConvOclDirectFwd1x1:1,64,1,1,0,1,8,4,0;ConvAsm1x1U:1,16,2,32,1,2,4,1
24-257-115-1x1-1280-257-115-1-0x0-1x1-1x1-0-NCHW-FP32-F=ConvOclDirectFwd1x1:1,256,1,1,0,1,4,8,0
32-28-28-5x5-16-28-28-8-2x2-1x1-1x1-0-NCHW-FP32-B=ConvOclDirectFwd:8,32,32,32,4,1,1,4,2
128-465-8-1x1-24-465-8-1024-0x0-1x1-1x1-0-NCHW-FP32-W=ConvAsmBwdWrW1x1:4,4,4,2,2,1,2,4,0,1
512-28-28-1x1-256-56-56-8-0x0-2x2-1x1-0-NCHW-FP32-W=ConvAsmBwdWrW1x1:2,8,4,4,4,1,1,4,0,1
2-283-216-1x1-128-283-216-32-0x0-1x1-1x1-0-NCHW-FP32-F=ConvOclDirectFwd1x1:1,64,1,1,0,1,64,4,0
240-14-14-1x1-60-14-14-256-0x0-1x1-1x1-0-NCHW-FP32-B_g3=ConvOclDirectFwd:16,8,16,8,1,1,8,2,1
704-661-7-1x1-48-661-7-64-0x0-1x1-1x1-0-NCHW-FP32-B=ConvOclDirectFwd1x1:1,256,1,1,0,1,16,4,0;ConvAsm1x1U:1,16,4,16,1,1,1,1
96-801-243-1x1-320-801-243-2-0x0-1x1-1x1-0-NCHW-FP32-B=ConvOclDirectFwd1x1:1,128,1,1,0,1,32,4,0
1584-39-133-1x1-768-39-133-64-0x0-1x1-1x1-0-NCHW-FP32-F=ConvOclDirectFwd1x1:1,64,1,1,1,1,16,2048,0
32-60-71-1x1-2048-60-71-48-0x0-1x1-1x1-0-NCHW-FP32-B=ConvOclDirectFwd1x1:1,256,1,1,0,2,32,4,0
256-14-14-3x3-256-14-14-128-1x1-1x1-1x1-0-NCHW-FP16-B=ConvOclDirectFwd:8,8,16,16,2,2,8,2,2
4-83-388-1x1-2048-83-388-4-0x0-1x1-1x1-0-NCHW-FP32-F=ConvOclDirectFwd1x1:1,256,1,1,0,2,32,4,0
116-4-915-1x1-704-4-915-8-0x0-1x1-1x1-0-NCHW-FP32-W=ConvAsmBwdWrW1x1:2,8,4,8,2,1,1,4,0,1
96-863-652-1x1-24-863-652-6-0x0-1x1-1x1-0-NCHW-FP32-F=ConvOclDirectFwd1x1:1,256,1,1,0,2,16,4,0
624-452-55-1x1-288-452-55-6-0x0-1x1-1x1-0-NCHW-FP32-F=ConvOclDirectFwd1x1:1,64,1,1,1,0,64,2048,0
240-623-369-1x1-480-623-369-4-0x0-1x1-1x1-0-NCHW-FP32-F=ConvOclDirectFwd1x1:1,64,1,1,1,4,64,256,0
32-5-330-1x1-64-5-330-2048-0x0-1x1-1x1-0-NCHW-FP32-W=ConvAsmBwdWrW1x1:4,4,2,2,2,1,4,4,0,2
128-855-172-1x1-224-855-172-6-0x0-1x1-1x1-0-NCHW-FP32-B=ConvOclDirectFwd1x1:1,64,1,1,0,2,32,4,0
1184-166-119-1x1-448-166-119-12-0x0-1x1-1x1-0-NCHW-FP32-F=ConvOclDirectFwd1x1:1,64,1,1,1,4,16,2048,0
192-17-17-1x1-1024-17-17-32-0x0-1x1-1x1-0-NCHW-FP16-W=ConvAsmBwdWrW1x1:4,4,4,4,4,1,1,2,0,2
224-35-35-3x3-192-35-35-256-1x1-1x1-1x1-0-NCHW-FP32-W=ConvAsmBwdWrW3x3:0,0,8,4,3,4
64-224-224-3x3-3-224-224-2-1x1-1x1-1x1-0-NCHW-FP32-B=ConvAsm3x3U:1,3,2;ConvOclDirectFwd:16,16,16,32,1,2,2,2,2
128-28-28-1x1-448-28-28-512-0x0-1x1-1x1-0-NCHW-FP16-B=ConvOclDirectFwd1x1:1,128,1,1,0,4,16,4,0;ConvAsm1x1U:1,16,2,16,1,2,1,2
160-14-14-1x1-512-14-14-32-0x0-1x1-1x1-0-NCHW-FP32-W=ConvAsmBwdWrW1x1:2,8,4,2,8,2,1,4,0,1
54-106-273-1x1-232-106-273-64-0x0-1x1-1x1-0-NCHW-FP32-W=ConvAsmBwdWrW1x1:4,4,4,4,2,1,1,4,0,1
1856-22-945-1x1-144-22-945-12-0x0-1x1-1x1-0-NCHW-FP32-F=ConvOclDirectFwd1x1:1,64,1,1,1,0,32,256,0
192-27-27-5x5-64-27-27-4096-2x2-1x1-1x1-0-NCHW-FP16-W=ConvOclBwdWrW2<2>:1,10,1,8,9;ConvOclBwdWrW2<16>:1,10,1,8,9;ConvOclBwdWrW2<4>:1,10,1,8,9;ConvOclBwdWrW2<8>:1,10,1,8,9
1024-482-462-1x1-256-482-462-2-0x0-1x1-1x1-0-NCHW-FP32-F=ConvOclDirectFwd1x1:16,16,32,32,1,0,32,128,1
896-1000-17-1x1-96-1000-17-6-0x0-1x1-1x1-0-NCHW-FP32-B=ConvOclDirectFwd1x1:1,256,1,1,0,2,32,4,0
1024-7-7-3x3-1024-7-7-64-1x1-1x1-1x1-0-NCHW-FP32-W_g32=ConvOclBwdWrW2<4>:1,7,8,1,7;ConvOclBwdWrW2<2>:1,7,8,1,7;ConvOclBwdWrW2<1>:1,7,8,1,7;ConvOclBwdWrW2<16>:1,7,8,1,7;ConvAsmBwdWrW3x3:0,0,8,4,7,1;ConvOclBwdWrW2<8>:1,7,8,1,7
704-20-11-1x1-352-20-11-48-0x0-1x1-1x1-0-NCHW-FP32-B=ConvOclDirectFwd1x1:1,256,1,1,0,2,32,4,0;ConvAsm1x1U:2,16,2,64,1,2,4,1
116-14-14-1x1-116-14-14-16-0x0-1x1-1x1-0-NCHW-FP16-B=ConvOclDirectFwd1x1:1,128,1,1,0,2,16,4,0;ConvAsm1x1U:2,4,4,4,1,2,2,4
192-14-14-1x1-1440-14-14-16-0x0-1x1-1x1-0-NCHW-FP16-B=ConvOclDirectFwd1x1:1,64,1,1,0,4,16,4,0;ConvAsm1x1U:1,16,2,16,1,2,2,2
224-13-70-1x1-160-13-70-512-0x0-1x1-1x1-0-NCHW-FP32-W=ConvAsmBwdWrW1x1:4,4,4,2,8,1,1,4,0,1
352-703-241-1x1-128-703-241-2-0x0-1x1-1x1-0-NCHW-FP32-F=ConvOclDirectFwd1x1:1,64,1,1,1,0,16,2048,0
32-24-240-3x3-16-24-240-32-1x1-1x1-1x1-0-NCHW-FP32-W=ConvAsmBwdWrW3x3:0,0,16,2,2,8
832-14-14-1x1-128-14-14-16-0x0-1x1-1x1-0-NCHW-FP16-B=ConvOclDirectFwd1x1:1,256,1,1,0,4,4,4,0;ConvAsm1x1U:2,8,4,64,1,4,4,2
96-362-124-1x1-116-362-124-4-0x0-1x1-1x1-0-NCHW-FP32-W=ConvAsmBwdWrW1x1:4,4,4,4,4,1,4,4,0,2
54-451-922-1x1-576-451-922-2-0x0-1x1-1x1-0-NCHW-FP32-B=ConvOclDirectFwd1x1:1,128,1,1,0,1,64,4,0
288-35-35-3x3-384-17-17-32-0x0-2x2-1x1-0-NCHW-FP32-F=ConvOclDirectFwd:32,8,32,32,1,4,8,1,2
2048-959-133-1x1-1584-959-133-2-0x0-1x1-1x1-0-NCHW-FP32-B=ConvOclDirectFwd1x1:1,256,1,1,0,1,16,8,0
128-14-14-1x1-832-14-14-128-0x0-1x1-1x1-0-NCHW-FP32-F=ConvOclDirectFwd1x1:1,64,1,1,1,0,32,256,0;ConvAsm1x1U:2,16,2,64,3,2,2,1
128-7-7-1x1-512-7-7-128-0x0-1x1-1x1-0-NCHW-FP32-F=ConvOclDirectFwd1x1:1,64,1,1,1,1,32,2048,0;ConvAsm1x1U:1,16,1,64,4,2,1,4
128-28-28-1x1-256-28-28-256-0x0-1x1-1x1-0-NCHW-FP32-F=ConvOclDirectFwd1x1:1,64,1,1,1,4,32,2048,0;ConvAsm1x1U:1,16,1,32,3,2,1,8
384-27-27-1x1-64-27-27-128-0x0-1x1-1x1-0-NCHW-FP32-B=ConvOclDirectFwd1x1:1,64,1,1,0,1,32,4,0;ConvAsm1x1U:2,16,2,64,2,2,2,2
1-558-871-1x1-1-558-871-4-0x0-1x1-1x1-0-NCHW-FP32-B=ConvOclDirectFwd1x1:1,256,1,1,0,1,4,4,0;ConvAsm1x1U:4,1,7,4,1,1,1,1
480-621-577-1x1-1104-621-577-1-0x0-1x1-1x1-0-NCHW-FP32-F=ConvOclDirectFwd1x1:1,64,1,1,1,0,32,2048,0
128-57-57-3x3-128-57-57-16-1x1-1x1-1x1-0-NCHW-FP32-B_g32=ConvOclDirectFwd:8,32,32,32,4,1,8,4,2
384-226-591-1x1-384-226-591-8-0x0-1x1-1x1-0-NCHW-FP32-F=ConvOclDirectFwd1x1:1,64,1,1,1,0,32,2048,0
128-28-28-1x1-512-14-14-256-0x0-2x2-1x1-0-NCHW-FP32-F=ConvOclDirectFwd1x1:16,16,32,32,1,0,32,128,1;ConvAsm1x1U:4,16,4,64,1,2,2,1
64-73-73-1x1-160-73-73-32-0x0-1x1-1x1-0-NCHW-FP32-W=ConvAsmBwdWrW1x1:4,4,4,2,8,2,4,4,0,2
240-934-325-1x1-320-934-325-4-0x0-1x1-1x1-0-NCHW-FP32-F=ConvOclDirectFwd1x1:1,64,1,1,1,4,32,2048,0
1-116-418-1x1-1120-116-418-6-0x0-1x1-1x1-0-NCHW-FP32-B=ConvOclDirectFwd1x1:1,256,1,1,0,4,16,4,0
128-895-468-1x1-1008-895-468-1-0x0-1x1-1x1-0-NCHW-FP32-B=ConvOclDirectFwd1x1:1,256,1,1,0,4,16,8,0
384-8-8-1x1-1536-8-8-16-0x0-1x1-1x1-0-NCHW-FP32-W=ConvAsmBwdWrW1x1:1,16,2,4,8,1,2,4,0,0
128-39-174-5x5-64-80-350-2-1x1-2x2-1x1-0-NCHW-FP32-B=ConvOclDirectFwd:16,8,16,32,1,4,4,1,2
256-27-27-1x1-64-27-27-128-0x0-1x1-1x1-0-NCHW-FP16-F=ConvOclDirectFwd1x1:1,256,1,1,0,1,16,4,0;ConvAsm1x1U:2,8,4,64,1,4,1,4
512-9-41-5x5-256-20-84-64-1x1-2x2-1x1-0-NCHW-FP32-B=ConvOclDirectFwd:32,8,32,32,1,4,4,2,2
116-28-28-1x1-116-28-28-16-0x0-1x1-1x1-0-NCHW-FP32-F=ConvOclDirectFwd1x1:1,256,1,1,0,4,8,4,0;ConvAsm1x1U:1,16,1,32,4,2,1,1
352-910-51-1x1-2-910-51-8-0x0-1x1-1x1-0-NCHW-FP32-B=ConvOclDirectFwd1x1:1,256,1,1,0,1,16,8,0
128-14-14-1x1-384-14-14-512-0x0-1x1-1x1-0-NCHW-FP32-W=ConvAsmBwdWrW1x1:4,4,8,4,4,2,2,4,0,1
192-14-14-1x1-1152-14-14-16-0x0-1x1-1x1-0-NCHW-FP16-B=ConvOclDirectFwd1x1:1,64,1,1,0,4,16,4,0;ConvAsm1x1U:1,16,2,16,1,2,2,2
80-666-355-1x1-24-666-355-16-0x0-1x1-1x1-0-NCHW-FP32-F=ConvOclDirectFwd1x1:1,256,1,1,0,2,16,4,0
96-28-28-1x1-192-28-28-128-0x0-1x1-1x1-0-NCHW-FP32-B=ConvOclDirectFwd1x1:1,64,1,1,0,1,32,4,0;ConvAsm1x1U:1,32,1,32,1,1,1,1
80-73-73-3x3-192-71-71-32-0x0-1x1-1x1-0-NCHW-FP32-F=ConvOclDirectFwd:16,8,16,16,1,2,8,4,1
608-65-527-1x1-1000-65-527-6-0x0-1x1-1x1-0-NCHW-FP32-B=ConvOclDirectFwd1x1:1,128,1,1,0,1,16,4,0
128-210-687-1x1-528-210-687-1-0x0-1x1-1x1-0-NCHW-FP32-B=ConvOclDirectFwd1x1:1,256,1,1,0,2,16,8,0
24-56-56-1x1-58-56-56-128-0x0-1x1-1x1-0-NCHW-FP16-F=ConvOclDirectFwd1x1:1,256,1,1,0,4,16,8,0;ConvAsm1x1U:1,8,2,32,2,4,2,1
256-14-14-1x1-128-14-14-256-0x0-1x1-1x1-0-NCHW-FP32-W=ConvAsmBwdWrW1x1:2,8,4,8,2,1,4,4,0,3
64-3-236-1x1-1728-3-236-64-0x0-1x1-1x1-0-NCHW-FP32-B=ConvOclDirectFwd1x1:1,256,1,1,0,2,32,4,0;ConvAsm1x1U:1,32,2,16,1,1,1,1
992-968-22-1x1-1104-968-22-1-0x0-1x1-1x1-0-NCHW-FP32-F=ConvOclDirectFwd1x1:1,64,1,1,1,0,32,2048,0
5-10-10-3x3-3-10-10-64-1x1-1x1-1x1-0-NCHW-FP32-B=ConvOclDirectFwd:8,16,16,16,2,1,1,4,2
128-28-28-1x1-352-28-28-16-0x0-1x1-1x1-0-NCHW-FP32-F=ConvOclDirectFwd1x1:1,64,1,1,1,1,16,128,0;ConvAsm1x1U:3,16,3,16,2,2,1,2
80-112-1016-1x1-1376-112-1016-2-0x0-1x1-1x1-0-NCHW-FP32-B=ConvOclDirectFwd1x1:1,128,1,1,0,2,32,4,0
144-148-70-1x1-58-148-70-64-0x0-1x1-1x1-0-NCHW-FP32-B=ConvOclDirectFwd1x1:1,256,1,1,0,2,16,4,0;ConvAsm1x1U:4,1,7,4,2,4,1,4
64-28-28-3x3-64-28-28-32-1x1-1x1-1x1-0-NCHW-FP32-W=ConvAsmBwdWrW3x3:0,0,8,2,7,2
1280-16-51-1x1-1000-16-51-8-0x0-1x1-1x1-0-NCHW-FP32-F=ConvOclDirectFwd1x1:1,256,1,1,0,2,16,4,0;ConvAsm1x1U:4,8,7,64,2,2,1,4
256-374-124-1x1-544-374-124-2-0x0-1x1-1x1-0-NCHW-FP32-B=ConvOclDirectFwd1x1:1,256,1,1,0,1,32,4,0
116-28-28-1x1-116-28-28-64-0x0-1x1-1x1-0-NCHW-FP32-F=ConvOclDirectFwd1x1:1,256,1,1,0,4,16,4,0;ConvAsm1x1U:1,16,1,64,2,2,2,4
1536-453-8-1x1-128-453-8-8-0x0-1x1-1x1-0-NCHW-FP32-F=ConvOclDirectFwd1x1:1,64,1,1,1,1,16,2048,0
256-29-29-3x3-256-29-29-256-1x1-1x1-1x1-0-NCHW-FP32-W_g32=ConvOclBwdWrW2<4>:1,6,8,1,9;ConvOclBwdWrW2<2>:1,6,8,1,5;ConvOclBwdWrW2<1>:1,7,8,1,7;ConvOclBwdWrW2<16>:1,9,8,1,11;ConvAsmBwdWrW3x3:0,0,8,1,2,1;ConvOclBwdWrW2<8>:1,6,8,1,9
128-14-14-3x3-192-7-7-32-1x1-2x2-1x1-0-NCHW-FP32-F=ConvOclDirectFwd:8,8,8,8,1,1,8,1,2
128-28-28-3x3-128-28-28-32-1x1-1x1-1x1-0-NCHW-FP16-B=ConvOclDirectFwd:8,16,32,32,4,2,8,1,1
32-28-28-3x3-128-28-28-512-1x1-1x1-1x1-0-NCHW-FP16-F=ConvOclDirectFwd:32,8,32,32,1,4,8,1,1
832-7-7-1x1-128-7-7-64-0x0-1x1-1x1-0-NCHW-FP16-B=ConvOclDirectFwd1x1:1,64,1,1,0,1,8,4,0;ConvAsm1x1U:1,16,2,16,1,2,4,4
352-243-120-1x1-320-243-120-16-0x0-1x1-1x1-0-NCHW-FP32-B=ConvOclDirectFwd1x1:1,256,1,1,0,1,32,4,0
3-408-419-1x1-1184-408-419-2-0x0-1x1-1x1-0-NCHW-FP32-B=ConvOclDirectFwd1x1:1,256,1,1,0,4,16,4,0
128-28-28-1x1-256-56-56-16-0x0-2x2-1x1-0-NCHW-FP16-B=ConvOclDirectFwd1x1:1,256,1,1,0,1,32,4,0;ConvAsm1x1U:1,16,2,16,1,2,2,2
32-766-185-1x1-64-766-185-16-0x0-1x1-1x1-0-NCHW-FP32-B=ConvOclDirectFwd1x1:1,256,1,1,0,2,32,4,0
1728-79-438-1x1-192-79-438-6-0x0-1x1-1x1-0-NCHW-FP32-F=ConvOclDirectFwd1x1:16,16,32,32,1,0,32,128,1
736-7-7-1x1-128-7-7-512-0x0-1x1-1x1-0-NCHW-FP16-B=ConvOclDirectFwd1x1:1,64,1,1,0,1,32,4,0;ConvAsm1x1U:1,16,2,16,1,2,2,2
768-7-7-1x1-128-7-7-128-0x0-1x1-1x1-0-NCHW-FP16-B=ConvOclDirectFwd1x1:1,64,1,1,0,1,8,4,0;ConvAsm1x1U:2,8,4,16,1,4,4,2
2160-129-10-1x1-8-129-10-1-0x0-1x1-1x1-0-NCHW-FP32-F=ConvOclDirectFwd1x1:1,128,1,1,0,1,4,4,0;ConvAsm1x1U:1,8,1,16,1,4,4,1
160-855-92-1x1-48-855-92-6-0x0-1x1-1x1-0-NCHW-FP32-F=ConvOclDirectFwd1x1:1,64,1,1,1,4,32,2048,0
384-20-165-1x1-1000-20-165-16-0x0-1x1-1x1-0-NCHW-FP32-F=ConvOclDirectFwd1x1:1,256,1,1,0,4,8,4,0;ConvAsm1x1U:2,16,6,64,2,2,1,2
128-7-7-1x1-896-7-7-512-0x0-1x1-1x1-0-NCHW-FP16-B=ConvOclDirectFwd1x1:1,256,1,1,0,1,32,4,0;ConvAsm1x1U:1,16,2,32,1,2,1,2
112-76-261-1x1-1392-76-261-12-0x0-1x1-1x1-0-NCHW-FP32-B=ConvOclDirectFwd1x1:1,256,1,1,0,2,16,4,0
8-736-704-1x1-32-736-704-8-0x0-1x1-1x1-0-NCHW-FP32-W=ConvAsmBwdWrW1x1:4,4,2,1,2,1,2,4,0,3
256-7-7-1x1-832-7-7-16-0x0-1x1-1x1-0-NCHW-FP32-B=ConvOclDirectFwd1x1:1,256,1,1,0,1,8,4,0;ConvAsm1x1U:1,16,1,64,1,2,2,1
288-28-28-1x1-128-28-28-64-0x0-1x1-1x1-0-NCHW-FP32-W=ConvAsmBwdWrW1x1:1,16,2,8,4,1,4,4,0,2
1280-703-208-1x1-736-703-208-1-0x0-1x1-1x1-0-NCHW-FP32-F=ConvOclDirectFwd1x1:1,64,1,1,1,4,64,2048,0
448-408-400-1x1-1664-408-400-1-0x0-1x1-1x1-0-NCHW-FP32-B=ConvOclDirectFwd1x1:1,64,1,1,0,2,32,4,0
80-547-547-1x1-480-547-547-2-0x0-1x1-1x1-0-NCHW-FP32-F=ConvOclDirectFwd1x1:1,64,1,1,1,4,64,2048,0
58-975-372-1x1-16-975-372-16-0x0-1x1-1x1-0-NCHW-FP32-B=ConvOclDirectFwd1x1:1,64,1,1,0,1,16,4,0
2-44-520-1x1-576-44-520-12-0x0-1x1-1x1-0-NCHW-FP32-B=ConvOclDirectFwd1x1:1,64,1,1,0,4,16,4,0
1152-134-249-1x1-1-134-249-6-0x0-1x1-1x1-0-NCHW-FP32-F=ConvOclDirectFwd1x1:1,256,1,1,0,2,16,8,0
512-28-28-1x1-256-28-28-128-0x0-1x1-1x1-0-NCHW-FP16-W=ConvAsmBwdWrW1x1:2,8,4,8,2,1,2,2,0,1
4-543-349-1x1-144-543-349-12-0x0-1x1-1x1-0-NCHW-FP32-B=ConvOclDirectFwd1x1:1,256,1,1,0,1,16,4,0
256-57-57-3x3-256-29-29-4-1x1-2x2-1x1-0-NCHW-FP32-F_g32=ConvOclDirectFwd:16,16,32,32,2,2,8,1,1
232-822-123-1x1-116-822-123-1-0x0-1x1-1x1-0-NCHW-FP32-F=ConvOclDirectFwd1x1:1,256,1,1,0,2,16,4,0
58-525-171-1x1-288-525-171-12-0x0-1x1-1x1-0-NCHW-FP32-B=ConvOclDirectFwd1x1:1,256,1,1,0,1,32,4,0
64-28-28-1x1-256-28-28-64-0x0-1x1-1x1-0-NCHW-FP32-B=ConvOclDirectFwd1x1:1,256,1,1,0,1,32,4,0;ConvAsm1x1U:1,32,1,32,1,1,1,1
32-24-240-3x3-16-24-240-16-1x1-1x1-1x1-0-NCHW-FP32-W=ConvAsmBwdWrW3x3:0,0,16,2,1,8
116-28-28-1x1-116-28-28-128-0x0-1x1-1x1-0-NCHW-FP16-W=ConvAsmBwdWrW1x1:4,4,8,4,2,1,4,4,0,1
1000-837-138-1x1-96-837-138-2-0x0-1x1-1x1-0-NCHW-FP32-F=ConvOclDirectFwd1x1:1,128,1,1,0,1,32,4,0
528-2-424-1x1-3-2-424-6-0x0-1x1-1x1-0-NCHW-FP32-W=ConvAsmBwdWrW1x1:4,4,2,2,2,2,1,4,0,2
54-55-55-1x1-24-55-55-512-0x0-1x1-1x1-0-NCHW-FP16-W=ConvAsmBwdWrW1x1:4,4,2,4,2,1,4,4,0,1
1000-39-610-1x1-576-39-610-16-0x0-1x1-1x1-0-NCHW-FP32-B=ConvOclDirectFwd1x1:1,64,1,1,0,1,32,4,0
128-14-14-1x1-544-14-14-128-0x0-1x1-1x1-0-NCHW-FP16-W=ConvAsmBwdWrW1x1:2,8,2,8,2,1,4,4,0,1
1856-800-65-1x1-32-800-65-2-0x0-1x1-1x1-0-NCHW-FP32-F=ConvOclDirectFwd1x1:1,64,1,1,1,1,64,2048,0
128-56-56-3x3-128-56-56-128-1x1-1x1-1x1-0-NCHW-FP32-W_g32=ConvOclBwdWrW2<4>:1,7,3,1,5;ConvOclBwdWrW2<2>:1,7,1,1,3;ConvOclBwdWrW2<1>:1,12,3,1,3;ConvOclBwdWrW2<16>:1,6,3,1,3;ConvAsmBwdWrW3x3:0,0,16,1,2,1;ConvOclBwdWrW2<8>:1,6,3,1,3
544-587-77-1x1-64-587-77-1-0x0-1x1-1x1-0-NCHW-FP32-F=ConvOclDirectFwd1x1:1,64,1,1,1,0,16,2048,0
288-193-290-1x1-544-193-290-16-0x0-1x1-1x1-0-NCHW-FP32-B=ConvOclDirectFwd1x1:1,128,1,1,0,1,32,4,0
608-811-143-1x1-64-811-143-2-0x0-1x1-1x1-0-NCHW-FP32-F=ConvOclDirectFwd1x1:16,16,32,32,1,0,32,128,1
480-14-14-1x1-120-14-14-128-0x0-1x1-1x1-0-NCHW-FP16-F_g3=ConvOclDirectFwd:16,16,16,16,1,1,8,2,2
224-67-248-1x1-160-67-248-8-0x0-1x1-1x1-0-NCHW-FP32-F=ConvOclDirectFwd1x1:1,64,1,1,1,0,64,2048,0;ConvAsm1x1U:3,16,6,64,1,1,1,2
16-72-717-1x1-1-72-717-8-0x0-1x1-1x1-0-NCHW-FP32-F=ConvOclDirectFwd1x1:1,256,1,1,0,1,4,8,0;ConvAsm1x1U:1,1,1,4,1,1,4,1
896-7-7-1x1-128-7-7-64-0x0-1x1-1x1-0-NCHW-FP32-F=ConvOclDirectFwd1x1:1,64,1,1,1,1,16,2048,0;ConvAsm1x1U:4,8,4,16,1,4,2,2
192-8-8-1x1-2048-8-8-16-0x0-1x1-1x1-0-NCHW-FP16-B=ConvOclDirectFwd1x1:1,128,1,1,0,4,16,4,0;ConvAsm1x1U:1,16,2,32,1,2,2,4
704-624-10-1x1-384-624-10-32-0x0-1x1-1x1-0-NCHW-FP32-W=ConvAsmBwdWrW1x1:4,4,8,2,8,1,1,2,0,1
96-606-71-1x1-54-606-71-128-0x0-1x1-1x1-0-NCHW-FP32-F=ConvOclDirectFwd1x1:1,256,1,1,0,1,8,8,0;ConvAsm1x1U:1,32,2,16,1,1,1,1
16-14-14-1x1-480-14-14-256-0x0-1x1-1x1-0-NCHW-FP16-W=ConvAsmBwdWrW1x1:4,4,4,4,2,2,4,4,0,2
576-14-14-1x1-128-14-14-16-0x0-1x1-1x1-0-NCHW-FP16-B=ConvOclDirectFwd1x1:1,256,1,1,0,4,4,4,0;ConvAsm1x1U:2,8,4,64,1,4,4,2
512-15-15-3x3-512-8-8-4-1x1-2x2-1x1-0-NCHW-FP32-F=ConvOclDirectFwd:8,8,8,8,1,1,2,2,1
60-14-14-3x3-60-28-28-2-1x1-2x2-1x1-0-NCHW-FP16-W=ConvAsmBwdWrW3x3:0,0,16,1,1,1
224-12-75-1x1-1104-12-75-6-0x0-1x1-1x1-0-NCHW-FP32-W=ConvAsmBwdWrW1x1:1,16,4,4,8,1,2,4,0,1
320-739-169-1x1-1584-739-169-2-0x0-1x1-1x1-0-NCHW-FP32-B=ConvOclDirectFwd1x1:1,64,1,1,0,1,16,4,0
288-1005-140-1x1-224-1005-140-8-0x0-1x1-1x1-0-NCHW-FP32-F=ConvOclDirectFwd1x1:1,64,1,1,1,4,64,2048,0
32-14-14-5x5-128-14-14-32-2x2-1x1-1x1-0-NCHW-FP32-F=ConvOclDirectFwd:8,8,16,16,2,2,4,1,2;ConvOclDirectFwdFused:8,8,16,16,2,2,4,1,2
1056-22-538-1x1-528-22-538-2-0x0-1x1-1x1-0-NCHW-FP32-B=ConvOclDirectFwd1x1:1,256,1,1,0,4,16,8,0
192-248-331-1x1-48-248-331-32-0x0-1x1-1x1-0-NCHW-FP32-W=ConvAsmBwdWrW1x1:4,4,4,2,8,1,2,4,0,1
116-194-705-1x1-2-194-705-8-0x0-1x1-1x1-0-NCHW-FP32-W=ConvAsmBwdWrW1x1:4,4,2,1,2,1,2,4,0,1
24-128-128-1x1-512-128-128-1-0x0-1x1-1x1-0-NCHW-FP32-W=ConvAsmBwdWrW1x1:4,4,8,4,2,1,1,4,0,3
128-7-7-3x3-32-7-7-16-1x1-1x1-1x1-0-NCHW-FP16-W=ConvAsmBwdWrW3x3:0,0,8,2,3,4
16-522-8-1x1-576-522-8-1-0x0-1x1-1x1-0-NCHW-FP32-F=ConvOclDirectFwd1x1:1,64,1,1,1,1,16,64,0;ConvAsm1x1U:1,8,1,64,1,2,1,2
640-2-711-1x1-232-2-711-6-0x0-1x1-1x1-0-NCHW-FP32-W=ConvAsmBwdWrW1x1:1,16,2,8,2,1,1,4,0,1
512-14-14-1x1-1024-14-14-256-0x0-1x1-1x1-0-NCHW-FP16-B=ConvOclDirectFwd1x1:1,64,1,1,0,2,32,4,0;ConvAsm1x1U:1,16,2,16,1,2,2,2
256-56-56-1x1-128-56-56-128-0x0-1x1-1x1-0-NCHW-FP16-W=ConvAsmBwdWrW1x1:4,4,8,1,8,2,2,4,0,1
896-34-870-1x1-112-34-870-8-0x0-1x1-1x1-0-NCHW-FP32-F=ConvOclDirectFwd1x1:1,64,1,1,1,1,64,2048,0
1536-8-8-1x1-256-8-8-32-0x0-1x1-1x1-0-NCHW-FP32-F=ConvOclDirectFwd1x1:1,64,1,1,1,1,16,256,0;ConvAsm1x1U:2,8,2,32,1,4,1,8;ConvActivAsm1x1U:2,16,2,32,4,4
256-13-13-3x3-384-13-13-2048-1x1-1x1-1x1-0-NCHW-FP16-W=ConvAsmBwdWrW3x3:0,1,8,4,6,2
992-2-950-1x1-544-2-950-1-0x0-1x1-1x1-0-NCHW-FP32-W=ConvAsmBwdWrW1x1:2,8,4,4,8,1,1,4,0,1
512-52-41-1x1-1776-52-41-128-0x0-1x1-1x1-0-NCHW-FP32-W=ConvAsmBwdWrW1x1:1,16,2,8,8,1,1,4,0,0
58-860-189-1x1-58-860-189-16-0x0-1x1-1x1-0-NCHW-FP32-B=ConvOclDirectFwd1x1:1,256,1,1,0,1,8,4,0
1024-7-7-1x1-256-14-14-4-0x0-2x2-1x1-0-NCHW-FP32-W=ConvAsmBwdWrW1x1:1,16,2,4,4,1,1,4,0,1
16-28-28-1x1-192-28-28-4-0x0-1x1-1x1-0-NCHW-FP32-B=ConvOclDirectFwd1x1:1,128,1,1,0,1,8,4,0;ConvAsm1x1U:1,8,1,32,1,2,1,1
736-17-20-1x1-544-17-20-64-0x0-1x1-1x1-0-NCHW-FP32-F=ConvOclDirectFwd1x1:1,64,1,1,1,4,64,2048,0;ConvAsm1x1U:2,16,6,64,1,2,2,2
2048-421-362-1x1-80-421-362-1-0x0-1x1-1x1-0-NCHW-FP32-B=ConvOclDirectFwd1x1:1,256,1,1,0,2,16,8,0
64-14-14-1x1-512-14-14-256-0x0-1x1-1x1-0-NCHW-FP32-B=ConvOclDirectFwd1x1:1,64,1,1,0,2,32,4,0;ConvAsm1x1U:1,16,1,64,2,2,1,2
64-328-180-1x1-2-328-180-64-0x0-1x1-1x1-0-NCHW-FP32-W=ConvAsmBwdWrW1x1:4,4,2,1,2,1,2,4,0,1
160-14-14-1x1-512-14-14-8-0x0-1x1-1x1-0-NCHW-FP32-W=ConvAsmBwdWrW1x1:1,16,2,8,2,1,2,4,0,1
832-217-66-1x1-1-217-66-2-0x0-1x1-1x1-0-NCHW-FP32-B=ConvOclDirectFwd1x1:1,128,1,1,0,2,16,8,0
24-128-128-1x1-512-128-128-1-0x0-1x1-1x1-0-NCHW-FP32-B=ConvOclDirectFwd1x1:1,256,1,1,0,2,16,4,0
2048-8-8-1x1-1024-15-15-16-0x0-2x2-1x1-0-NCHW-FP32-W=ConvAsmBwdWrW1x1:1,16,4,4,8,1,1,4,0,1
64-35-35-1x1-192-35-35-32-0x0-1x1-1x1-0-NCHW-FP16-W=ConvAsmBwdWrW1x1:4,4,8,4,2,1,4,2,0,1
160-14-14-1x1-512-14-14-1-0x0-1x1-1x1-0-NCHW-FP16-W=ConvAsmBwdWrW1x1:2,8,2,2,2,1,1,4,0,1
24-44-275-1x1-1200-44-275-12-0x0-1x1-1x1-0-NCHW-FP32-B=ConvOclDirectFwd1x1:1,256,1,1,0,4,16,8,0
128-14-14-1x1-832-14-14-256-0x0-1x1-1x1-0-NCHW-FP16-B=ConvOclDirectFwd1x1:1,256,1,1,0,2,32,4,0;ConvAsm1x1U:1,16,2,16,1,2,1,4
544-348-484-1x1-58-348-484-2-0x0-1x1-1x1-0-NCHW-FP32-F=ConvOclDirectFwd1x1:1,256,1,1,0,4,16,4,0
128-14-14-1x1-960-14-14-32-0x0-1x1-1x1-0-NCHW-FP32-F=ConvOclDirectFwd1x1:1,64,1,1,1,4,16,2048,0;ConvAsm1x1U:4,8,4,64,1,4,2,2
2048-8-8-1x1-1024-8-8-2-0x0-1x1-1x1-0-NCHW-FP32-B=ConvOclDirectFwd1x1:1,256,1,1,0,1,4,4,0;ConvAsm1x1U:1,8,1,64,2,4,4,2
2-798-53-1x1-736-798-53-16-0x0-1x1-1x1-0-NCHW-FP32-F=ConvOclDirectFwd1x1:1,128,1,1,0,2,32,4,0
832-21-791-1x1-544-21-791-32-0x0-1x1-1x1-0-NCHW-FP32-F=ConvOclDirectFwd1x1:1,64,1,1,1,0,64,2048,0
608-48-15-1x1-1152-48-15-512-0x0-1x1-1x1-0-NCHW-FP32-W=ConvAsmBwdWrW1x1:1,16,2,8,4,1,1,4,0,2
736-641-919-1x1-144-641-919-1-0x0-1x1-1x1-0-NCHW-FP32-F=ConvOclDirectFwd1x1:1,64,1,1,1,0,32,2048,0
58-295-536-1x1-1728-295-536-1-0x0-1x1-1x1-0-NCHW-FP32-B=ConvOclDirectFwd1x1:1,256,1,1,0,2,32,4,0
256-28-28-1x1-512-28-28-256-0x0-1x1-1x1-0-NCHW-FP16-F=ConvOclDirectFwd1x1:1,128,1,1,0,4,16,4,0;ConvAsm1x1U:1,8,2,32,2,4,1,4
128-28-28-1x1-416-28-28-256-0x0-1x1-1x1-0-NCHW-FP16-W=ConvAsmBwdWrW1x1:1,16,2,8,2,1,4,4,0,3
48-143-446-1x1-336-143-446-1-0x0-1x1-1x1-0-NCHW-FP32-B=ConvOclDirectFwd1x1:1,256,1,1,0,2,16,4,0
96-28-28-3x3-64-28-28-32-1x1-1x1-1x1-0-NCHW-FP32-W=ConvAsmBwdWrW3x3:0,0,8,2,5,2
960-7-7-1x1-128-7-7-32-0x0-1x1-1x1-0-NCHW-FP16-B=ConvOclDirectFwd1x1:1,64,1,1,0,1,8,8,0;ConvAsm1x1U:1,8,2,32,1,4,4,4
192-7-7-1x1-1488-7-7-16-0x0-1x1-1x1-0-NCHW-FP16-B=ConvOclDirectFwd1x1:1,128,1,1,0,1,8,4,0;ConvAsm1x1U:1,8,2,32,1,2,2,2
232-14-14-1x1-232-14-14-32-0x0-1x1-1x1-0-NCHW-FP16-F=ConvOclDirectFwd1x1:1,64,1,1,0,4,16,4,0;ConvAsm1x1U:1,8,2,16,1,4,1,4
1008-1005-47-1x1-704-1005-47-8-0x0-1x1-1x1-0-NCHW-FP32-F=ConvOclDirectFwd1x1:1,64,1,1,1,1,16,2048,0
128-7-7-3x3-32-7-7-512-1x1-1x1-1x1-0-NCHW-FP16-B=ConvOclDirectFwd:8,8,8,8,1,1,8,4,2
704-532-121-1x1-1-532-121-4-0x0-1x1-1x1-0-NCHW-FP32-F=ConvOclDirectFwd1x1:1,256,1,1,0,4,16,8,0
128-56-56-1x1-256-56-56-16-0x0-1x1-1x1-0-NCHW-FP32-F=ConvOclDirectFwd1x1:1,64,1,1,1,0,32,256,0;ConvAsm1x1U:2,16,2,64,3,2,1,2
128-943-482-1x1-80-943-482-8-0x0-1x1-1x1-0-NCHW-FP32-B=ConvOclDirectFwd1x1:1,256,1,1,0,1,16,8,0
48-8-213-1x1-960-8-213-16-0x0-1x1-1x1-0-NCHW-FP32-W=ConvAsmBwdWrW1x1:4,4,2,4,4,1,1,4,0,0
1008-639-196-1x1-144-639-196-1-0x0-1x1-1x1-0-NCHW-FP32-F=ConvOclDirectFwd1x1:1,64,1,1,1,1,32,2048,0
224-339-140-1x1-384-339-140-2-0x0-1x1-1x1-0-NCHW-FP32-B=ConvOclDirectFwd1x1:1,128,1,1,0,1,32,4,0
512-7-7-1x1-512-7-7-8-0x0-1x1-1x1-0-NCHW-FP32-W=ConvAsmBwdWrW1x1:1,16,2,4,4,1,1,4,0,1
144-22-386-1x1-232-22-386-4-0x0-1x1-1x1-0-NCHW-FP32-W=ConvAsmBwdWrW1x1:4,4,4,4,8,1,2,4,0,1
96-62-39-1x1-320-62-39-16-0x0-1x1-1x1-0-NCHW-FP32-F=ConvOclDirectFwd1x1:1,64,1,1,1,1,16,2048,0;ConvAsm1x1U:2,16,2,64,1,2,2,1
2048-28-543-1x1-1824-28-543-12-0x0-1x1-1x1-0-NCHW-FP32-B=ConvOclDirectFwd1x1:1,256,1,1,0,2,32,4,0
2064-1-660-1x1-352-1-660-4-0x0-1x1-1x1-0-NCHW-FP32-F=ConvOclDirectFwd1x1:1,64,1,1,1,1,64,256,0;ConvAsm1x1U:4,8,4,16,1,4,1,4
608-275-52-1x1-1280-275-52-8-0x0-1x1-1x1-0-NCHW-FP32-B=ConvOclDirectFwd1x1:1,64,1,1,0,2,32,4,0
128-56-56-3x3-128-56-56-8-1x1-1x1-1x1-0-NCHW-FP32-W_g32=ConvOclBwdWrW2<1>:1,9,1,1,7;ConvOclBwdWrW2<8>:1,7,1,1,7;ConvAsmBwdWrW3x3:0,1,16,1,3,4;ConvOclBwdWrW2<4>:1,7,1,1,7;ConvOclBwdWrW2<2>:1,7,1,1,7
160-28-28-1x1-128-28-28-256-0x0-1x1-1x1-0-NCHW-FP16-B=ConvOclDirectFwd1x1:1,64,1,1,0,4,16,4,0;ConvAsm1x1U:1,16,2,16,1,2,1,2
32-812-289-1x1-4-812-289-16-0x0-1x1-1x1-0-NCHW-FP32-B=ConvOclDirectFwd1x1:1,256,1,1,0,2,16,4,0
800-13-426-1x1-80-13-426-4-0x0-1x1-1x1-0-NCHW-FP32-B=ConvOclDirectFwd1x1:1,64,1,1,0,2,16,4,0
1888-152-440-1x1-448-152-440-4-0x0-1x1-1x1-0-NCHW-FP32-F=ConvOclDirectFwd1x1:1,64,1,1,1,1,16,2048,0
116-304-578-1x1-1968-304-578-1-0x0-1x1-1x1-0-NCHW-FP32-B=ConvOclDirectFwd1x1:1,256,1,1,0,4,16,4,0
704-353-155-1x1-58-353-155-12-0x0-1x1-1x1-0-NCHW-FP32-F=ConvOclDirectFwd1x1:1,256,1,1,0,1,16,4,0
416-28-28-1x1-128-28-28-64-0x0-1x1-1x1-0-NCHW-FP32-F=ConvOclDirectFwd1x1:1,64,1,1,1,0,16,2048,0;ConvAsm1x1U:3,16,3,32,2,2,2,2
256-13-13-3x3-384-13-13-64-1x1-1x1-1x1-0-NCHW-FP16-B=ConvOclDirectFwd:8,8,16,16,2,2,8,2,2
384-27-27-1x1-48-27-27-64-0x0-1x1-1x1-0-NCHW-FP16-F=ConvOclDirectFwd1x1:16,64,32,32,0,1,16,4,1;ConvAsm1x1U:3,8,6,64,1,4,2,2
144-48-525-1x1-1632-48-525-4-0x0-1x1-1x1-0-NCHW-FP32-B=ConvOclDirectFwd1x1:1,256,1,1,0,2,32,4,0
1-723-522-1x1-3-723-522-2-0x0-1x1-1x1-0-NCHW-FP32-W=ConvAsmBwdWrW1x1:4,4,2,1,2,1,2,4,0,3
58-28-28-1x1-58-28-28-16-0x0-1x1-1x1-0-NCHW-FP16-W=ConvAsmBwdWrW1x1:4,4,2,1,2,1,2,4,0,1
4-182-655-1x1-320-182-655-12-0x0-1x1-1x1-0-NCHW-FP32-B=ConvOclDirectFwd1x1:1,256,1,1,0,2,32,4,0
64-112-112-7x7-3-230-230-64-0x0-2x2-1x1-0-NCHW-FP16-B=ConvOclDirectFwd:16,16,32,32,2,2,8,2,1
1024-7-7-3x3-1024-7-7-32-1x1-1x1-1x1-0-NCHW-FP32-B_g32=ConvOclDirectFwd:8,8,8,8,1,1,8,4,2
1376-379-232-1x1-80-379-232-1-0x0-1x1-1x1-0-NCHW-FP32-F=ConvOclDirectFwd1x1:1,64,1,1,1,4,32,256,0
256-13-13-3x3-64-13-13-16-1x1-1x1-1x1-0-NCHW-FP16-W=ConvAsmBwdWrW3x3:0,1,8,4,1,1
128-39-174-5x5-64-80-350-256-1x1-2x2-1x1-0-NCHW-FP32-W=ConvOclBwdWrW2<1>:8,7,1,3,5;ConvOclBwdWrW2<16>:3,12,3,3,5;ConvOclBwdWrW2<8>:8,7,1,3,5;ConvOclBwdWrW2<4>:3,12,3,3,5;ConvOclBwdWrW2<2>:8,7,1,3,5
128-14-14-1x1-480-14-14-256-0x0-1x1-1x1-0-NCHW-FP16-F=ConvOclDirectFwd1x1:1,256,1,1,0,2,16,4,0;ConvAsm1x1U:1,16,2,16,2,2,1,2
1568-453-59-1x1-19-453-59-1-0x0-1x1-1x1-0-NCHW-FP32-F=ConvOclDirectFwd1x1:1,256,1,1,0,1,16,8,0
32-28-28-5x5-192-28-28-64-2x2-1x1-1x1-0-NCHW-FP32-W=ConvOclBwdWrW2<1>:1,11,3,3,7;ConvOclBwdWrW2<16>:1,10,1,3,7;ConvOclBwdWrW2<8>:1,7,3,3,7;ConvOclBwdWrW2<4>:1,7,3,3,7;ConvOclBwdWrW2<2>:1,7,1,3,5
528-14-14-1x1-128-14-14-32-0x0-1x1-1x1-0-NCHW-FP16-F=ConvOclDirectFwd1x1:1,64,1,1,0,4,8,4,0;ConvAsm1x1U:2,8,4,64,1,4,2,4
80-73-73-1x1-64-73-73-4-0x0-1x1-1x1-0-NCHW-FP32-W=ConvAsmBwdWrW1x1:4,4,2,2,2,1,1,4,0,3
1968-7-7-1x1-192-7-7-16-0x0-1x1-1x1-0-NCHW-FP32-F=ConvOclDirectFwd1x1:1,64,1,1,1,1,16,256,0;ConvAsm1x1U:2,8,4,16,1,4,4,2;ConvActivAsm1x1U:2,16,4,16,1,4
384-35-35-1x1-64-35-35-256-0x0-1x1-1x1-0-NCHW-FP16-W=ConvAsmBwdWrW1x1:4,4,8,4,2,1,2,4,0,1
480-14-14-1x1-16-14-14-4-0x0-1x1-1x1-0-NCHW-FP16-F=ConvOclDirectFwd1x1:1,64,1,1,0,4,4,8,0;ConvAsm1x1U:1,8,2,16,1,4,4,1
128-40-175-5x5-256-19-87-256-1x1-2x2-1x1-0-NCHW-FP32-F=ConvOclDirectFwd:16,16,16,32,1,2,8,2,1
832-7-7-1x1-384-7-7-4-0x0-1x1-1x1-0-NCHW-FP16-W=ConvAsmBwdWrW1x1:1,16,4,4,2,1,1,4,0,0
54-110-712-1x1-24-110-712-8-0x0-1x1-1x1-0-NCHW-FP32-B=ConvOclDirectFwd1x1:1,256,1,1,0,4,16,4,0
256-14-14-1x1-1024-14-14-16-0x0-1x1-1x1-0-NCHW-FP32-F=ConvOclDirectFwd1x1:1,64,1,1,1,4,32,2048,0;ConvAsm1x1U:4,16,4,64,1,2,1,2;ConvActivAsm1x1U:3,32,7,32,1,1
352-6-749-1x1-224-6-749-64-0x0-1x1-1x1-0-NCHW-FP32-B=ConvOclDirectFwd1x1:1,256,1,1,0,2,32,4,0;ConvAsm1x1U:2,32,4,32,1,1,1,1
3-511-407-1x1-3-511-407-48-0x0-1x1-1x1-0-NCHW-FP32-B=ConvOclDirectFwd1x1:1,128,1,1,0,1,8,4,0;ConvAsm1x1U:1,1,1,4,1,1,1,1
116-28-28-1x1-116-28-28-256-0x0-1x1-1x1-0-NCHW-FP16-B=ConvOclDirectFwd1x1:1,128,1,1,0,4,16,4,0;ConvAsm1x1U:4,4,8,4,1,2,1,4
256-13-13-3x3-64-13-13-32-1x1-1x1-1x1-0-NCHW-FP16-B=ConvOclDirectFwd:16,8,16,16,1,2,4,2,2
1104-969-67-1x1-1632-969-67-4-0x0-1x1-1x1-0-NCHW-FP32-B=ConvOclDirectFwd1x1:1,128,1,1,0,1,32,4,0
1488-241-258-1x1-256-241-258-2-0x0-1x1-1x1-0-NCHW-FP32-F=ConvOclDirectFwd1x1:1,64,1,1,1,4,16,256,0
224-14-14-1x1-576-14-14-64-0x0-1x1-1x1-0-NCHW-FP32-B=ConvOclDirectFwd1x1:8,64,16,16,0,2,16,4,1;ConvAsm1x1U:1,16,1,32,2,2,1,4
128-14-14-1x1-800-14-14-32-0x0-1x1-1x1-0-NCHW-FP16-B=ConvOclDirectFwd1x1:1,256,1,1,0,4,16,4,0;ConvAsm1x1U:1,16,2,16,1,2,1,2
256-13-13-3x3-384-13-13-50-1x1-1x1-1x1-0-NCHW-FP32-W=ConvAsmBwdWrW3x3:0,0,16,4,8,1
1024-8-8-1x1-2048-8-8-2-0x0-1x1-1x1-0-NCHW-FP32-F=ConvOclDirectFwd1x1:8,8,8,8,1,0,32,128,1;ConvAsm1x1U:4,8,4,16,1,4,4,1
512-14-14-3x3-512-14-14-64-1x1-1x1-1x1-0-NCHW-FP16-W=ConvAsmBwdWrW3x3:0,0,8,4,2,1
320-22-503-1x1-160-22-503-48-0x0-1x1-1x1-0-NCHW-FP32-B=ConvOclDirectFwd1x1:1,128,1,1,0,2,32,4,0;ConvAsm1x1U:1,32,5,64,1,1,1,1
240-114-211-1x1-384-114-211-8-0x0-1x1-1x1-0-NCHW-FP32-F=ConvOclDirectFwd1x1:1,64,1,1,1,4,32,2048,0
48-203-296-1x1-58-203-296-32-0x0-1x1-1x1-0-NCHW-FP32-F=ConvOclDirectFwd1x1:1,256,1,1,0,4,16,4,0;ConvAsm1x1U:1,32,1,16,1,1,1,1
480-507-212-1x1-800-507-212-1-0x0-1x1-1x1-0-NCHW-FP32-B=ConvOclDirectFwd1x1:1,64,1,1,0,1,32,4,0
54-268-454-1x1-240-268-454-2-0x0-1x1-1x1-0-NCHW-FP32-B=ConvOclDirectFwd1x1:1,256,1,1,0,4,16,4,0
384-13-13-3x3-384-13-13-1024-1x1-1x1-1x1-0-NCHW-FP16-F=ConvOclDirectFwd:8,8,16,16,2,2,8,4,2;ConvOclDirectFwdFused:8,8,16,16,2,2,8,4,1
160-624-790-1x1-58-624-790-4-0x0-1x1-1x1-0-NCHW-FP32-F=ConvOclDirectFwd1x1:1,256,1,1,0,4,8,8,0
192-14-14-1x1-480-14-14-64-0x0-1x1-1x1-0-NCHW-FP32-W=ConvAsmBwdWrW1x1:1,16,2,4,8,1,2,4,0,1
160-7-7-3x3-320-7-7-64-1x1-1x1-1x1-0-NCHW-FP16-F=ConvOclDirectFwd:8,8,8,8,1,1,8,4,2;ConvOclDirectFwdFused:8,8,8,8,1,1,8,4,2
240-7-7-3x3-240-7-7-512-1x1-1x1-1x1-0-NCHW-FP16-W=ConvAsmBwdWrW3x3:0,0,8,2,1,1
320-14-14-1x1-128-14-14-32-0x0-1x1-1x1-0-NCHW-FP16-W=ConvAsmBwdWrW1x1:4,4,4,4,2,1,2,2,0,2
128-28-28-1x1-352-28-28-32-0x0-1x1-1x1-0-NCHW-FP16-W=ConvAsmBwdWrW1x1:2,8,2,8,2,1,4,4,0,1
192-14-14-1x1-1344-14-14-16-0x0-1x1-1x1-0-NCHW-FP16-B=ConvOclDirectFwd1x1:1,64,1,1,0,4,16,4,0;ConvAsm1x1U:1,16,2,16,1,2,2,2
800-7-7-1x1-128-7-7-32-0x0-1x1-1x1-0-NCHW-FP16-B=ConvOclDirectFwd1x1:1,64,1,1,0,1,8,8,0;ConvAsm1x1U:1,8,2,32,1,4,4,2
192-7-7-1x1-1104-7-7-16-0x0-1x1-1x1-0-NCHW-FP16-B=ConvOclDirectFwd1x1:1,64,1,1,0,1,8,4,0;ConvAsm1x1U:1,16,2,32,1,2,4,1
192-7-7-3x3-384-7-7-512-1x1-1x1-1x1-0-NCHW-FP16-F=ConvOclDirectFwd:8,8,8,8,1,1,8,4,2;ConvOclDirectFwdFused:8,8,8,8,1,1,8,4,2
1104-37-194-1x1-1088-37-194-12-0x0-1x1-1x1-0-NCHW-FP32-B=ConvOclDirectFwd1x1:1,64,1,1,0,1,32,4,0
192-14-14-1x1-512-14-14-1-0x0-1x1-1x1-0-NCHW-FP16-W=ConvAsmBwdWrW1x1:2,8,2,4,2,1,1,2,0,1
928-310-58-1x1-512-310-58-32-0x0-1x1-1x1-0-NCHW-FP32-F=ConvOclDirectFwd1x1:1,64,1,1,1,0,16,2048,0
864-104-71-1x1-2048-104-71-4-0x0-1x1-1x1-0-NCHW-FP32-W=ConvAsmBwdWrW1x1:1,16,4,4,8,1,1,4,0,1
2016-445-383-1x1-448-445-383-1-0x0-1x1-1x1-0-NCHW-FP32-F=ConvOclDirectFwd1x1:1,64,1,1,1,1,16,2048,0
3-622-369-1x1-3-622-369-128-0x0-1x1-1x1-0-NCHW-FP32-F=ConvOclDirectFwd1x1:1,128,1,1,0,2,16,4,0;ConvAsm1x1U:1,1,2,4,1,1,1,1
2048-215-6-1x1-912-215-6-8-0x0-1x1-1x1-0-NCHW-FP32-W=ConvAsmBwdWrW1x1:2,8,4,4,8,1,1,4,0,1
192-14-14-3x3-48-14-14-16-1x1-1x1-1x1-0-NCHW-FP16-F=ConvOclDirectFwd:16,16,16,16,1,1,4,4,2;ConvOclDirectFwdFused:16,16,16,16,1,1,4,4,2
384-109-217-1x1-224-109-217-2-0x0-1x1-1x1-0-NCHW-FP32-F=ConvOclDirectFwd1x1:1,64,1,1,1,4,64,2048,0
1-188-665-1x1-58-188-665-48-0x0-1x1-1x1-0-NCHW-FP32-F=ConvOclDirectFwd1x1:1,256,1,1,0,1,16,4,0
464-729-2-1x1-736-729-2-4-0x0-1x1-1x1-0-NCHW-FP32-F=ConvOclDirectFwd1x1:1,64,1,1,1,4,64,2048,0;ConvAsm1x1U:3,16,6,64,1,2,1,4
768-417-13-1x1-768-417-13-8-0x0-1x1-1x1-0-NCHW-FP32-B=ConvOclDirectFwd1x1:1,128,1,1,0,1,32,4,0;ConvAsm1x1U:3,32,7,32,1,1,1,1
768-17-17-1x1-192-17-17-16-0x0-1x1-1x1-0-NCHW-FP32-F=ConvOclDirectFwd1x1:1,64,1,1,1,1,16,2048,0;ConvAsm1x1U:3,16,5,64,1,2,4,1;ConvActivAsm1x1U:2,16,2,32,4,2
1024-8-8-3x3-1024-15-15-256-1x1-2x2-1x1-0-NCHW-FP32-B_g32=ConvOclDirectFwd:16,8,16,16,1,2,4,1,2
32-14-14-3x3-128-14-14-32-1x1-1x1-1x1-0-NCHW-FP16-B=ConvOclDirectFwd:8,16,16,16,2,1,8,1,2
192-35-35-1x1-48-35-35-64-0x0-1x1-1x1-0-NCHW-FP16-F=ConvOclDirectFwd1x1:1,64,1,1,0,1,16,8,0;ConvAsm1x1U:2,8,4,64,1,4,2,2
608-754-238-1x1-116-754-238-4-0x0-1x1-1x1-0-NCHW-FP32-B=ConvOclDirectFwd1x1:1,256,1,1,0,4,16,8,0
416-457-352-1x1-160-457-352-6-0x0-1x1-1x1-0-NCHW-FP32-F=ConvOclDirectFwd1x1:1,64,1,1,1,4,64,2048,0
64-788-288-1x1-768-788-288-1-0x0-1x1-1x1-0-NCHW-FP32-B=ConvOclDirectFwd1x1:1,128,1,1,0,2,32,4,0
96-56-56-1x1-128-56-56-512-0x0-1x1-1x1-0-NCHW-FP16-B=ConvOclDirectFwd1x1:1,128,1,1,0,4,16,4,0;ConvAsm1x1U:1,16,2,64,1,2,1,4
64-264-583-1x1-160-264-583-12-0x0-1x1-1x1-0-NCHW-FP32-B=ConvOclDirectFwd1x1:1,128,1,1,0,2,32,4,0
1024-7-7-1x1-464-7-7-64-0x0-1x1-1x1-0-NCHW-FP16-W=ConvAsmBwdWrW1x1:1,16,4,8,2,1,1,2,0,1
512-14-14-3x3-512-14-14-4-1x1-1x1-1x1-0-NCHW-FP16-B=ConvOclDirectFwd:16,8,16,16,1,2,4,2,2
2112-7-7-1x1-192-7-7-16-0x0-1x1-1x1-0-NCHW-FP32-F=ConvOclDirectFwd1x1:1,64,1,1,1,0,16,256,0;ConvAsm1x1U:4,8,4,16,1,4,4,2;ConvActivAsm1x1U:2,16,4,16,1,3
32-464-3-1x1-224-464-3-1024-0x0-1x1-1x1-0-NCHW-FP32-B=ConvOclDirectFwd1x1:1,128,1,1,0,2,32,4,0;ConvAsm1x1U:1,8,1,16,1,1,1,1
256-14-14-1x1-128-14-14-16-0x0-1x1-1x1-0-NCHW-FP16-W=ConvAsmBwdWrW1x1:4,4,4,1,4,2,1,4,0,1
384-8-8-1x1-1536-8-8-32-0x0-1x1-1x1-0-NCHW-FP16-B=ConvOclDirectFwd1x1:1,256,1,1,0,4,16,4,0;ConvAsm1x1U:1,16,2,32,1,2,2,4
80-23-401-1x1-528-23-401-16-0x0-1x1-1x1-0-NCHW-FP32-W=ConvAsmBwdWrW1x1:4,4,8,4,4,1,2,4,0,0
384-8-8-1x1-2048-8-8-64-0x0-1x1-1x1-0-NCHW-FP16-B=ConvOclDirectFwd1x1:1,64,1,1,0,4,16,4,0;ConvAsm1x1U:1,16,2,32,1,2,2,4
112-14-14-1x1-512-14-14-256-0x0-1x1-1x1-0-NCHW-FP32-W=ConvAsmBwdWrW1x1:4,4,8,4,4,1,2,4,0,1
48-35-35-1x1-288-35-35-1-0x0-1x1-1x1-0-NCHW-FP32-B=ConvOclDirectFwd1x1:1,256,1,1,0,1,8,8,0;ConvAsm1x1U:1,16,1,64,1,1,4,1
58-274-276-1x1-576-274-276-12-0x0-1x1-1x1-0-NCHW-FP32-F=ConvOclDirectFwd1x1:1,128,1,1,0,1,64,4,0
192-7-7-1x1-1056-7-7-32-0x0-1x1-1x1-0-NCHW-FP32-W=ConvAsmBwdWrW1x1:1,16,2,4,8,1,1,4,0,1
640-725-21-1x1-288-725-21-12-0x0-1x1-1x1-0-NCHW-FP32-F=ConvOclDirectFwd1x1:1,64,1,1,1,0,64,2048,0
1600-577-6-1x1-1024-577-6-32-0x0-1x1-1x1-0-NCHW-FP32-F=ConvOclDirectFwd1x1:1,64,1,1,1,0,16,2048,0
1888-136-103-1x1-116-136-103-12-0x0-1x1-1x1-0-NCHW-FP32-F=ConvOclDirectFwd1x1:1,256,1,1,0,1,8,8,0
384-703-60-1x1-144-703-60-1-0x0-1x1-1x1-0-NCHW-FP32-F=ConvOclDirectFwd1x1:1,64,1,1,1,4,64,2048,0
192-27-27-5x5-64-27-27-16-2x2-1x1-1x1-0-NCHW-FP16-B=ConvOclDirectFwd:16,16,32,32,2,2,4,2,2
1280-45-182-1x1-1312-45-182-16-0x0-1x1-1x1-0-NCHW-FP32-B=ConvOclDirectFwd1x1:1,64,1,1,0,2,32,4,0
128-28-28-3x3-128-56-56-128-1x1-2x2-1x1-0-NCHW-FP16-W=ConvAsmBwdWrW3x3:0,0,8,4,4,1
96-67-453-1x1-1152-67-453-4-0x0-1x1-1x1-0-NCHW-FP32-B=ConvOclDirectFwd1x1:1,256,1,1,0,1,32,4,0
80-366-992-1x1-1376-366-992-1-0x0-1x1-1x1-0-NCHW-FP32-B=ConvOclDirectFwd1x1:1,64,1,1,0,1,32,4,0
512-291-448-1x1-1-291-448-2-0x0-1x1-1x1-0-NCHW-FP32-F=ConvOclDirectFwd1x1:1,64,1,1,0,1,16,8,0
8-530-376-1x1-32-530-376-2-0x0-1x1-1x1-0-NCHW-FP32-F=ConvOclDirectFwd1x1:1,256,1,1,0,2,32,4,0
80-73-73-1x1-64-73-73-16-0x0-1x1-1x1-0-NCHW-FP16-W=ConvAsmBwdWrW1x1:4,4,4,4,2,1,4,4,0,1
224-28-500-1x1-992-28-500-6-0x0-1x1-1x1-0-NCHW-FP32-B=ConvOclDirectFwd1x1:1,64,1,1,0,2,32,4,0
128-128-256-3x3-192-128-256-1-1x1-1x1-1x1-0-NCHW-FP16-F=ConvOclDirectFwd:16,16,32,32,2,2,8,1,1
464-7-7-1x1-1024-7-7-16-0x0-1x1-1x1-0-NCHW-FP32-F=ConvOclDirectFwd1x1:1,64,1,1,1,1,16,2048,0;ConvAsm1x1U:2,16,2,32,2,2,2,1
624-141-112-1x1-128-141-112-2-0x0-1x1-1x1-0-NCHW-FP32-F=ConvOclDirectFwd1x1:1,64,1,1,1,4,32,2048,0
224-789-6-1x1-1184-789-6-16-0x0-1x1-1x1-0-NCHW-FP32-W=ConvAsmBwdWrW1x1:1,16,2,8,8,1,1,4,0,1
8-199-269-1x1-240-199-269-6-0x0-1x1-1x1-0-NCHW-FP32-W=ConvAsmBwdWrW1x1:4,4,4,1,2,1,1,4,0,1
128-602-353-1x1-576-602-353-1-0x0-1x1-1x1-0-NCHW-FP32-F=ConvOclDirectFwd1x1:16,16,32,32,1,0,32,128,1
256-28-28-3x3-512-28-28-64-1x1-1x1-1x1-0-NCHW-FP16-F=ConvOclDirectFwd:16,16,32,32,2,2,8,1,2;ConvOclDirectFwdFused:16,16,32,32,2,2,8,1,1
32-14-14-5x5-128-14-14-64-2x2-1x1-1x1-0-NCHW-FP32-F=ConvOclDirectFwd:8,8,16,16,2,2,4,2,2;ConvOclDirectFwdFused:8,8,16,16,2,2,4,2,2
384-35-35-1x1-192-35-35-128-0x0-1x1-1x1-0-NCHW-FP32-F=ConvOclDirectFwd1x1:1,64,1,1,1,1,32,2048,0;ConvAsm1x1U:3,16,3,64,2,2,2,2;ConvActivAsm1x1U:2,16,3,32,4,1
1024-14-14-1x1-1024-14-14-256-0x0-1x1-1x1-0-NCHW-FP32-B=ConvOclDirectFwd1x1:1,256,1,1,0,4,16,8,0;ConvAsm1x1U:1,32,2,16,1,1,1,1
256-14-14-1x1-512-28-28-4-0x0-2x2-1x1-0-NCHW-FP16-B=ConvOclDirectFwd1x1:1,64,1,1,0,1,8,4,0;ConvAsm1x1U:1,8,2,32,1,4,2,4
256-29-29-3x3-256-57-57-4-1x1-2x2-1x1-0-NCHW-FP32-W_g32=ConvOclBwdWrW2<1>:1,6,3,1,3;ConvAsmBwdWrW3x3:0,0,16,2,3,1;ConvOclBwdWrW2<4>:1,6,3,1,7;ConvOclBwdWrW2<2>:1,7,1,1,3
256-28-28-3x3-512-28-28-4-1x1-1x1-1x1-0-NCHW-FP16-F=ConvOclDirectFwd:8,32,32,32,4,1,8,2,2;ConvOclDirectFwdFused:16,16,32,32,2,2,8,2,1
288-28-406-1x1-544-28-406-2-0x0-1x1-1x1-0-NCHW-FP32-W=ConvAsmBwdWrW1x1:2,8,4,4,8,1,1,4,0,1
336-636-859-1x1-16-636-859-1-0x0-1x1-1x1-0-NCHW-FP32-F=ConvOclDirectFwd1x1:1,64,1,1,1,0,64,2048,0
528-64-128-1x1-256-64-128-1-0x0-1x1-1x1-0-NCHW-FP32-F=ConvOclDirectFwd1x1:1,64,1,1,1,4,32,2048,0;ConvOclDirectFwdFused:1,64,1,1,1,1,32,2048,0
416-128-454-1x1-448-128-454-8-0x0-1x1-1x1-0-NCHW-FP32-B=ConvOclDirectFwd1x1:1,256,1,1,0,4,16,8,0
528-527-599-1x1-512-527-599-1-0x0-1x1-1x1-0-NCHW-FP32-F=ConvOclDirectFwd1x1:1,64,1,1,1,4,32,2048,0
160-73-73-1x1-64-73-73-256-0x0-1x1-1x1-0-NCHW-FP16-F=ConvOclDirectFwd1x1:1,64,1,1,0,1,32,4,0;ConvAsm1x1U:2,8,4,64,1,4,1,4
1120-464-153-1x1-1104-464-153-2-0x0-1x1-1x1-0-NCHW-FP32-F=ConvOclDirectFwd1x1:1,64,1,1,1,1,32,2048,0
1024-14-14-1x1-1024-14-14-8-0x0-1x1-1x1-0-NCHW-FP32-W=ConvAsmBwdWrW1x1:1,16,4,4,8,1,1,4,0,1
32-28-28-1x1-256-28-28-8-0x0-1x1-1x1-0-NCHW-FP16-W=ConvAsmBwdWrW1x1:4,4,2,2,2,2,1,4,0,1
60-28-28-3x3-60-28-28-512-1x1-1x1-1x1-0-NCHW-FP32-W=ConvAsmBwdWrW3x3:0,1,16,4,4,2
448-8-8-1x1-2048-8-8-64-0x0-1x1-1x1-0-NCHW-FP16-W=ConvAsmBwdWrW1x1:2,8,4,4,4,1,1,2,0,1
32-28-28-5x5-96-28-28-128-2x2-1x1-1x1-0-NCHW-FP16-F=ConvOclDirectFwd:16,16,32,32,2,2,8,1,2;ConvOclDirectFwdFused:16,16,32,32,2,2,8,1,2
544-289-526-1x1-416-289-526-2-0x0-1x1-1x1-0-NCHW-FP32-F=ConvOclDirectFwd1x1:1,64,1,1,1,4,64,2048,0
160-56-56-1x1-128-56-56-128-0x0-1x1-1x1-0-NCHW-FP16-W=ConvAsmBwdWrW1x1:4,4,4,1,8,2,4,4,0,3
144-31-477-1x1-640-31-477-12-0x0-1x1-1x1-0-NCHW-FP32-F=ConvOclDirectFwd1x1:1,64,1,1,1,4,32,2048,0
320-8-8-1x1-1280-8-8-512-0x0-1x1-1x1-0-NCHW-FP16-B=ConvOclDirectFwd1x1:1,256,1,1,0,2,32,4,0;ConvAsm1x1U:1,16,2,16,1,2,1,1
1680-364-300-1x1-768-364-300-1-0x0-1x1-1x1-0-NCHW-FP32-F=ConvOclDirectFwd1x1:1,64,1,1,1,0,32,2048,0
640-7-7-1x1-128-7-7-128-0x0-1x1-1x1-0-NCHW-FP16-W=ConvAsmBwdWrW1x1:4,4,4,4,2,1,2,2,0,2
160-7-7-1x1-832-7-7-4-0x0-1x1-1x1-0-NCHW-FP32-B=ConvOclDirectFwd1x1:1,64,1,1,0,1,4,8,0;ConvAsm1x1U:1,8,1,64,1,4,2,2
128-14-14-1x1-960-14-14-128-0x0-1x1-1x1-0-NCHW-FP16-B=ConvOclDirectFwd1x1:1,256,1,1,0,2,32,4,0;ConvAsm1x1U:1,16,2,16,1,2,1,4
320-8-8-1x1-1280-8-8-1-0x0-1x1-1x1-0-NCHW-FP16-B=ConvOclDirectFwd1x1:1,256,1,1,0,1,4,8,0;ConvAsm1x1U:1,8,2,32,1,4,4,1
864-127-681-1x1-144-127-681-6-0x0-1x1-1x1-0-NCHW-FP32-F=ConvOclDirectFwd1x1:1,64,1,1,1,1,64,2048,0
480-124-956-1x1-512-124-956-1-0x0-1x1-1x1-0-NCHW-FP32-F=ConvOclDirectFwd1x1:1,64,1,1,1,4,32,2048,0
2064-1004-3-1x1-544-1004-3-1-0x0-1x1-1x1-0-NCHW-FP32-F=ConvOclDirectFwd1x1:1,64,1,1,1,4,64,256,0
16-1008-358-1x1-704-1008-358-2-0x0-1x1-1x1-0-NCHW-FP32-F=ConvOclDirectFwd1x1:1,64,1,1,1,1,16,2048,0
80-26-72-1x1-4-26-72-256-0x0-1x1-1x1-0-NCHW-FP32-W=ConvAsmBwdWrW1x1:4,4,2,1,2,2,4,4,0,3
448-674-83-1x1-54-674-83-4-0x0-1x1-1x1-0-NCHW-FP32-F=ConvOclDirectFwd1x1:1,256,1,1,0,1,16,4,0
512-7-7-1x1-1024-14-14-16-0x0-2x2-1x1-0-NCHW-FP16-W=ConvAsmBwdWrW1x1:1,16,2,8,2,1,1,2,0,1
704-742-912-1x1-58-742-912-1-0x0-1x1-1x1-0-NCHW-FP32-F=ConvOclDirectFwd1x1:1,256,1,1,0,4,16,4,0
16-930-36-1x1-80-930-36-6-0x0-1x1-1x1-0-NCHW-FP32-B=ConvOclDirectFwd1x1:1,256,1,1,0,2,16,4,0;ConvAsm1x1U:4,16,4,64,3,2,1,4
1-161-700-5x5-64-80-349-32-1x1-2x2-1x1-0-NCHW-FP32-F=ConvOclDirectFwd:8,32,16,32,2,1,8,1,2
864-96-13-1x1-192-96-13-8-0x0-1x1-1x1-0-NCHW-FP32-F=ConvOclDirectFwd1x1:1,64,1,1,1,4,16,2048,0;ConvAsm1x1U:4,8,4,64,2,2,1,4
448-133-556-1x1-54-133-556-6-0x0-1x1-1x1-0-NCHW-FP32-F=ConvOclDirectFwd1x1:1,64,1,1,0,2,16,4,0
16-54-54-3x3-64-54-54-32-1x1-1x1-1x1-0-NCHW-FP32-W=ConvAsmBwdWrW3x3:0,1,16,4,3,8
128-56-56-3x3-32-56-56-16-1x1-1x1-1x1-0-NCHW-FP32-W=ConvAsmBwdWrW3x3:0,0,16,2,5,1
64-64-128-1x1-512-64-128-1-0x0-1x1-1x1-0-NCHW-FP32-W=ConvAsmBwdWrW1x1:2,8,2,4,4,1,1,4,0,3
192-466-175-1x1-160-466-175-12-0x0-1x1-1x1-0-NCHW-FP32-F=ConvOclDirectFwd1x1:1,64,1,1,1,4,64,256,0
192-17-17-1x1-768-17-17-64-0x0-1x1-1x1-0-NCHW-FP32-B=ConvOclDirectFwd1x1:1,256,1,1,0,1,32,4,0;ConvAsm1x1U:1,32,1,64,2,1,2,2
8-304-878-1x1-912-304-878-2-0x0-1x1-1x1-0-NCHW-FP32-B=ConvOclDirectFwd1x1:1,64,1,1,0,4,16,8,0
160-317-94-1x1-432-317-94-12-0x0-1x1-1x1-0-NCHW-FP32-B=ConvOclDirectFwd1x1:1,128,1,1,0,1,16,4,0
160-56-56-1x1-128-56-56-256-0x0-1x1-1x1-0-NCHW-FP16-F=ConvOclDirectFwd1x1:1,64,1,1,0,4,16,4,0;ConvAsm1x1U:1,8,2,64,2,4,1,4
928-70-206-1x1-3-70-206-16-0x0-1x1-1x1-0-NCHW-FP32-B=ConvOclDirectFwd1x1:1,64,1,1,0,4,16,8,0
512-7-7-1x1-1024-14-14-2-0x0-2x2-1x1-0-NCHW-FP32-B=ConvOclDirectFwd1x1:1,256,1,1,0,1,4,8,0;ConvAsm1x1U:2,8,2,32,1,2,4,2
2048-57-573-1x1-4-57-573-6-0x0-1x1-1x1-0-NCHW-FP32-B=ConvOclDirectFwd1x1:1,256,1,1,0,1,16,8,0
64-54-54-3x3-16-54-54-256-1x1-1x1-1x1-0-NCHW-FP16-B=ConvOclDirectFwd:16,16,32,32,2,2,8,2,1
1-835-429-1x1-116-835-429-6-0x0-1x1-1x1-0-NCHW-FP32-F=ConvOclDirectFwd1x1:1,128,1,1,0,1,16,4,0
1-65-655-1x1-4-65-655-12-0x0-1x1-1x1-0-NCHW-FP32-B=ConvOclDirectFwd1x1:1,128,1,1,0,1,4,4,0;ConvAsm1x1U:1,4,1,4,1,1,1,1
336-888-14-1x1-19-888-14-6-0x0-1x1-1x1-0-NCHW-FP32-F=ConvOclDirectFwd1x1:1,256,1,1,0,4,16,8,0;ConvAsm1x1U:3,8,4,64,2,1,1,1
64-112-112-3x3-128-112-112-256-1x1-1x1-1x1-0-NCHW-FP16-B=ConvOclDirectFwd:8,16,16,32,2,2,8,1,1
48-241-934-1x1-24-241-934-32-0x0-1x1-1x1-0-NCHW-FP32-W=ConvAsmBwdWrW1x1:4,4,2,2,2,1,2,4,0,2
3-267-264-1x1-96-267-264-12-0x0-1x1-1x1-0-NCHW-FP32-F=ConvOclDirectFwd1x1:1,256,1,1,0,1,32,4,0
96-74-318-1x1-224-74-318-48-0x0-1x1-1x1-0-NCHW-FP32-B=ConvOclDirectFwd1x1:1,256,1,1,0,4,16,4,0
64-54-54-1x1-16-54-54-128-0x0-1x1-1x1-0-NCHW-FP16-B=ConvOclDirectFwd1x1:1,256,1,1,0,2,16,8,0;ConvAsm1x1U:3,8,6,64,4,2,1,1
416-159-111-1x1-144-159-111-8-0x0-1x1-1x1-0-NCHW-FP32-B=ConvOclDirectFwd1x1:1,128,1,1,0,1,16,8,0
64-114-114-7x7-3-227-227-48-3x3-2x2-1x1-0-NCHW-FP32-W=ConvOclBwdWrW2<1>:3,7,3,3,7;ConvOclBwdWrW2<16>:3,10,1,3,7;ConvOclBwdWrW2<8>:3,6,3,1,7;ConvOclBwdWrW2<4>:3,6,3,1,7;ConvOclBwdWrW2<2>:3,6,3,1,7
64-35-35-3x3-96-35-35-32-1x1-1x1-1x1-0-NCHW-FP16-F=ConvOclDirectFwd:16,8,16,16,1,2,8,2,2;ConvOclDirectFwdFused:16,8,16,16,1,2,8,1,1
160-141-160-1x1-624-141-160-2-0x0-1x1-1x1-0-NCHW-FP32-B=ConvOclDirectFwd1x1:1,256,1,1,0,4,16,4,0
192-27-27-1x1-48-27-27-512-0x0-1x1-1x1-0-NCHW-FP16-F=ConvOclDirectFwd1x1:1,256,1,1,0,1,16,8,0;ConvAsm1x1U:3,8,6,64,1,4,1,2
192-80-146-1x1-2-80-146-16-0x0-1x1-1x1-0-NCHW-FP32-B=ConvOclDirectFwd1x1:1,128,1,1,0,4,8,4,0;ConvAsm1x1U:4,1,4,4,1,2,2,2
992-80-1000-1x1-1248-80-1000-2-0x0-1x1-1x1-0-NCHW-FP32-B=ConvOclDirectFwd1x1:1,256,1,1,0,1,32,4,0
2048-7-7-1x1-512-7-7-128-0x0-1x1-1x1-0-NCHW-FP32-F=ConvOclDirectFwd1x1:1,64,1,1,1,0,32,2048,0;ConvAsm1x1U:2,16,2,32,2,2,1,8;ConvActivAsm1x1U:4,16,4,16,3,2
512-29-29-3x3-512-15-15-1-1x1-2x2-1x1-0-NCHW-FP32-F_g32=ConvOclDirectFwd:16,16,16,16,1,1,2,2,1
1056-15-267-1x1-48-15-267-4-0x0-1x1-1x1-0-NCHW-FP32-W=ConvAsmBwdWrW1x1:4,4,4,2,4,1,1,4,0,0
116-71-613-1x1-48-71-613-6-0x0-1x1-1x1-0-NCHW-FP32-W=ConvAsmBwdWrW1x1:4,4,4,1,8,1,2,4,0,3
32-28-28-5x5-16-28-28-4-2x2-1x1-1x1-0-NCHW-FP32-B=ConvOclDirectFwd:16,16,16,16,1,1,2,4,2
544-387-891-1x1-58-387-891-2-0x0-1x1-1x1-0-NCHW-FP32-B=ConvOclDirectFwd1x1:1,256,1,1,0,1,8,4,0
384-421-98-1x1-1856-421-98-1-0x0-1x1-1x1-0-NCHW-FP32-B=ConvOclDirectFwd1x1:1,256,1,1,0,1,32,4,0
144-185-514-1x1-416-185-514-8-0x0-1x1-1x1-0-NCHW-FP32-F=ConvOclDirectFwd1x1:1,64,1,1,1,4,64,256,0
2160-162-32-1x1-1280-162-32-16-0x0-1x1-1x1-0-NCHW-FP32-F=ConvOclDirectFwd1x1:1,64,1,1,1,0,16,2048,0
256-57-57-1x1-512-29-29-256-0x0-2x2-1x1-0-NCHW-FP32-F=ConvOclDirectFwd1x1:1,64,1,1,1,0,32,2048,0;ConvAsm1x1U:4,32,7,64,1,1,1,1
192-17-17-1x1-1024-17-17-1-0x0-1x1-1x1-0-NCHW-FP32-W=ConvAsmBwdWrW1x1:1,16,2,4,4,1,1,4,0,1
192-28-28-1x1-480-28-28-16-0x0-1x1-1x1-0-NCHW-FP32-B=ConvOclDirectFwd1x1:1,128,1,1,0,4,16,4,0;ConvAsm1x1U:1,16,1,16,1,2,2,1
32-211-649-1x1-608-211-649-1-0x0-1x1-1x1-0-NCHW-FP32-B=ConvOclDirectFwd1x1:1,128,1,1,0,1,32,4,0
4-869-918-1x1-2-869-918-6-0x0-1x1-1x1-0-NCHW-FP32-W=ConvAsmBwdWrW1x1:4,4,2,1,2,1,4,4,0,3
144-276-96-1x1-1024-276-96-4-0x0-1x1-1x1-0-NCHW-FP32-F=ConvOclDirectFwd1x1:1,64,1,1,1,4,16,2048,0
64-54-54-3x3-16-54-54-512-1x1-1x1-1x1-0-NCHW-FP16-F=ConvOclDirectFwd:32,8,32,32,1,4,8,1,1
64-35-35-1x1-256-35-35-1-0x0-1x1-1x1-0-NCHW-FP16-B=ConvOclDirectFwd1x1:1,128,1,1,0,1,4,4,0;ConvAsm1x1U:1,8,2,64,1,2,4,1
64-56-56-1x1-64-56-56-64-0x0-1x1-1x1-0-NCHW-FP16-F=ConvOclDirectFwd1x1:1,128,1,1,0,2,32,4,0;ConvAsm1x1U:1,8,2,64,1,4,1,4
128-28-28-1x1-384-28-28-16-0x0-1x1-1x1-0-NCHW-FP16-F=ConvOclDirectFwd1x1:1,64,1,1,0,4,16,4,0;ConvAsm1x1U:1,8,2,32,2,4,1,8
512-7-7-1x1-2048-7-7-8-0x0-1x1-1x1-0-NCHW-FP32-W=ConvAsmBwdWrW1x1:1,16,2,4,8,1,1,4,0,1
704-484-3-1x1-672-484-3-128-0x0-1x1-1x1-0-NCHW-FP32-B=ConvOclDirectFwd1x1:1,256,1,1,0,2,32,4,0;ConvAsm1x1U:3,32,3,32,1,1,1,1
512-14-14-1x1-128-28-28-32-0x0-2x2-1x1-0-NCHW-FP32-W=ConvAsmBwdWrW1x1:2,8,4,4,4,1,2,4,0,1
64-147-147-3x3-96-73-73-8-0x0-2x2-1x1-0-NCHW-FP32-F=ConvOclDirectFwd:16,16,16,16,1,1,8,2,1
128-7-7-1x1-576-7-7-32-0x0-1x1-1x1-0-NCHW-FP16-F=ConvOclDirectFwd1x1:1,64,1,1,0,1,8,4,0;ConvAsm1x1U:2,8,4,16,1,2,2,2
19-17-77-1x1-1696-17-77-2-0x0-1x1-1x1-0-NCHW-FP32-W=ConvAsmBwdWrW1x1:4,4,2,4,2,1,1,4,0,0
960-397-15-1x1-1504-397-15-6-0x0-1x1-1x1-0-NCHW-FP32-B=ConvOclDirectFwd1x1:1,256,1,1,0,1,32,4,0
116-28-28-1x1-116-28-28-32-0x0-1x1-1x1-0-NCHW-FP32-W=ConvAsmBwdWrW1x1:2,8,2,4,4,2,4,4,0,1
160-411-987-1x1-58-411-987-4-0x0-1x1-1x1-0-NCHW-FP32-B=ConvOclDirectFwd1x1:1,256,1,1,0,1,16,8,0
96-144-368-1x1-864-144-368-1-0x0-1x1-1x1-0-NCHW-FP32-F=ConvOclDirectFwd1x1:1,64,1,1,1,4,64,128,0
320-765-921-1x1-48-765-921-1-0x0-1x1-1x1-0-NCHW-FP32-F=ConvOclDirectFwd1x1:1,64,1,1,1,1,32,128,0
240-7-7-1x1-960-7-7-64-0x0-1x1-1x1-0-NCHW-FP16-F_g3=ConvOclDirectFwd:8,8,8,8,1,1,8,2,1
256-968-46-1x1-352-968-46-12-0x0-1x1-1x1-0-NCHW-FP32-W=ConvAsmBwdWrW1x1:4,4,8,4,4,1,1,4,0,0
128-28-28-1x1-128-28-28-32-0x0-1x1-1x1-0-NCHW-FP32-W=ConvAsmBwdWrW1x1:2,8,2,8,2,1,4,4,0,1
320-7-7-3x3-160-7-7-512-1x1-1x1-1x1-0-NCHW-FP16-W=ConvAsmBwdWrW3x3:0,1,8,4,7,2
256-956-86-1x1-608-956-86-8-0x0-1x1-1x1-0-NCHW-FP32-B=ConvOclDirectFwd1x1:1,64,1,1,0,2,32,4,0
4-85-177-1x1-160-85-177-64-0x0-1x1-1x1-0-NCHW-FP32-F=ConvOclDirectFwd1x1:1,256,1,1,0,1,32,4,0;ConvAsm1x1U:1,8,1,16,1,1,1,1
80-528-119-1x1-736-528-119-2-0x0-1x1-1x1-0-NCHW-FP32-F=ConvOclDirectFwd1x1:16,16,32,32,1,0,32,128,1
58-269-529-1x1-448-269-529-2-0x0-1x1-1x1-0-NCHW-FP32-B=ConvOclDirectFwd1x1:1,256,1,1,0,1,64,4,0
64-35-35-1x1-192-35-35-8-0x0-1x1-1x1-0-NCHW-FP16-B=ConvOclDirectFwd1x1:1,256,1,1,0,1,8,4,0;ConvAsm1x1U:1,16,2,64,1,2,1,4
128-28-28-1x1-160-28-28-256-0x0-1x1-1x1-0-NCHW-FP32-F=ConvOclDirectFwd1x1:1,64,1,1,1,1,16,2048,0;ConvAsm1x1U:3,16,4,16,1,2,2,2
1664-21-625-1x1-512-21-625-16-0x0-1x1-1x1-0-NCHW-FP32-F=ConvOclDirectFwd1x1:1,64,1,1,1,1,16,256,0
256-14-14-1x1-256-14-14-256-0x0-1x1-1x1-0-NCHW-FP32-W=ConvAsmBwdWrW1x1:1,16,2,8,4,1,4,4,0,3
912-599-921-1x1-192-599-921-1-0x0-1x1-1x1-0-NCHW-FP32-F=ConvOclDirectFwd1x1:1,64,1,1,1,4,32,2048,0
64-28-28-1x1-192-28-28-512-0x0-1x1-1x1-0-NCHW-FP32-W=ConvAsmBwdWrW1x1:4,4,4,2,8,2,4,4,0,1
608-573-78-1x1-1632-573-78-6-0x0-1x1-1x1-0-NCHW-FP32-B=ConvOclDirectFwd1x1:1,128,1,1,0,1,32,4,0
2-87-26-1x1-4-87-26-2-0x0-1x1-1x1-0-NCHW-FP32-F=ConvOclDirectFwd1x1:1,128,1,1,0,2,16,4,0;ConvAsm1x1U:3,1,8,4,1,1,1,1
224-109-217-1x1-384-109-217-2-0x0-1x1-1x1-0-NCHW-FP32-W=ConvAsmBwdWrW1x1:4,4,4,4,8,1,1,4,0,1
48-193-408-1x1-232-193-408-4-0x0-1x1-1x1-0-NCHW-FP32-B=ConvOclDirectFwd1x1:1,256,1,1,0,4,16,4,0
96-31-256-1x1-960-31-256-16-0x0-1x1-1x1-0-NCHW-FP32-B=ConvOclDirectFwd1x1:1,256,1,1,0,1,32,4,0
1296-919-259-1x1-864-919-259-1-0x0-1x1-1x1-0-NCHW-FP32-F=ConvOclDirectFwd1x1:1,64,1,1,1,0,64,2048,0
736-22-540-1x1-32-22-540-12-0x0-1x1-1x1-0-NCHW-FP32-B=ConvOclDirectFwd1x1:1,64,1,1,0,1,32,4,0
128-14-14-1x1-896-14-14-32-0x0-1x1-1x1-0-NCHW-FP32-F=ConvOclDirectFwd1x1:1,64,1,1,1,0,32,2048,0;ConvAsm1x1U:2,16,2,64,2,2,2,2
54-163-157-1x1-1-163-157-6-0x0-1x1-1x1-0-NCHW-FP32-B=ConvOclDirectFwd1x1:1,256,1,1,0,1,16,4,0;ConvAsm1x1U:3,1,5,4,1,1,1,1
2-422-76-1x1-1408-422-76-1-0x0-1x1-1x1-0-NCHW-FP32-B=ConvOclDirectFwd1x1:1,256,1,1,0,2,4,4,0
288-28-28-1x1-128-28-28-256-0x0-1x1-1x1-0-NCHW-FP32-F=ConvOclDirectFwd1x1:1,64,1,1,1,1,32,2048,0;ConvAsm1x1U:2,16,2,32,3,2,1,4
32-806-45-1x1-64-806-45-4-0x0-1x1-1x1-0-NCHW-FP32-B=ConvOclDirectFwd1x1:1,256,1,1,0,2,32,4,0;ConvAsm1x1U:3,16,3,64,4,1,1,4
160-46-840-1x1-19-46-840-8-0x0-1x1-1x1-0-NCHW-FP32-F=ConvOclDirectFwd1x1:1,256,1,1,0,2,16,8,0
116-790-650-1x1-16-790-650-8-0x0-1x1-1x1-0-NCHW-FP32-B=ConvOclDirectFwd1x1:1,256,1,1,0,4,16,4,0
19-209-450-1x1-32-209-450-6-0x0-1x1-1x1-0-NCHW-FP32-B=ConvOclDirectFwd1x1:1,256,1,1,0,2,32,4,0;ConvAsm1x1U:1,16,3,64,1,1,4,2
800-6-236-1x1-192-6-236-256-0x0-1x1-1x1-0-NCHW-FP32-W=ConvAsmBwdWrW1x1:1,16,4,4,4,1,1,4,0,2
832-244-10-1x1-64-244-10-6-0x0-1x1-1x1-0-NCHW-FP32-B=ConvOclDirectFwd1x1:1,256,1,1,0,2,16,4,0;ConvAsm1x1U:1,16,2,64,1,2,1,1
1312-331-191-1x1-232-331-191-6-0x0-1x1-1x1-0-NCHW-FP32-F=ConvOclDirectFwd1x1:1,256,1,1,0,1,16,4,0
32-7-7-1x1-832-7-7-32-0x0-1x1-1x1-0-NCHW-FP32-B=ConvOclDirectFwd1x1:1,256,1,1,0,1,8,4,0;ConvAsm1x1U:1,16,1,64,1,2,2,1
240-574-594-1x1-640-574-594-1-0x0-1x1-1x1-0-NCHW-FP32-F=ConvOclDirectFwd1x1:1,64,1,1,1,0,32,2048,0
64-73-73-3x3-96-71-71-4-0x0-1x1-1x1-0-NCHW-FP16-F=ConvOclDirectFwd:16,8,16,16,1,2,8,4,2;ConvOclDirectFwdFused:16,8,16,16,1,2,8,4,2
1680-63-379-1x1-768-63-379-8-0x0-1x1-1x1-0-NCHW-FP32-F=ConvOclDirectFwd1x1:1,64,1,1,1,0,16,2048,0
128-12-514-1x1-960-12-514-12-0x0-1x1-1x1-0-NCHW-FP32-B=ConvOclDirectFwd1x1:1,128,1,1,0,4,16,8,0
64-35-35-1x1-384-35-35-8-0x0-1x1-1x1-0-NCHW-FP32-B=ConvOclDirectFwd1x1:1,256,1,1,0,1,16,8,0;ConvAsm1x1U:1,16,1,64,2,2,1,2
256-28-28-3x3-256-14-14-512-1x1-2x2-1x1-0-NCHW-FP32-F=ConvOclDirectFwd:8,16,16,16,2,1,8,1,2
256-7-7-1x1-832-7-7-512-0x0-1x1-1x1-0-NCHW-FP16-W=ConvAsmBwdWrW1x1:1,16,4,8,2,1,2,2,0,3
704-129-42-1x1-528-129-42-128-0x0-1x1-1x1-0-NCHW-FP32-F=ConvOclDirectFwd1x1:1,64,1,1,1,4,32,2048,0;ConvAsm1x1U:3,16,6,32,2,2,1,4
528-64-128-1x1-32-64-128-1-0x0-1x1-1x1-0-NCHW-FP16-F=ConvOclDirectFwd1x1:1,64,1,1,0,2,4,8,0
128-14-14-1x1-528-14-14-256-0x0-1x1-1x1-0-NCHW-FP32-B=ConvOclDirectFwd1x1:1,256,1,1,0,2,16,4,0;ConvAsm1x1U:1,16,1,64,2,2,1,2
192-35-35-3x3-224-35-35-64-1x1-1x1-1x1-0-NCHW-FP16-F=ConvOclDirectFwd:8,8,16,16,2,2,8,2,2;ConvOclDirectFwdFused:8,8,16,16,2,2,8,2,1
96-54-54-1x1-16-54-54-256-0x0-1x1-1x1-0-NCHW-FP16-F=ConvOclDirectFwd1x1:1,256,1,1,0,2,16,8,0;ConvAsm1x1U:1,16,6,64,1,2,1,1
1600-61-743-1x1-960-61-743-6-0x0-1x1-1x1-0-NCHW-FP32-F=ConvOclDirectFwd1x1:1,64,1,1,1,1,16,2048,0
2-864-173-1x1-58-864-173-4-0x0-1x1-1x1-0-NCHW-FP32-F=ConvOclDirectFwd1x1:1,128,1,1,0,2,8,4,0
224-110-986-1x1-144-110-986-8-0x0-1x1-1x1-0-NCHW-FP32-F=ConvOclDirectFwd1x1:1,64,1,1,1,0,32,2048,0
1248-73-798-1x1-512-73-798-4-0x0-1x1-1x1-0-NCHW-FP32-F=ConvOclDirectFwd1x1:1,64,1,1,1,4,16,256,0
224-48-342-1x1-528-48-342-8-0x0-1x1-1x1-0-NCHW-FP32-F=ConvOclDirectFwd1x1:1,64,1,1,1,1,32,256,0
448-616-384-1x1-1104-616-384-1-0x0-1x1-1x1-0-NCHW-FP32-F=ConvOclDirectFwd1x1:1,64,1,1,1,0,32,2048,0
928-251-34-1x1-232-251-34-12-0x0-1x1-1x1-0-NCHW-FP32-W=ConvAsmBwdWrW1x1:2,8,8,8,2,1,1,2,0,1
352-1-885-1x1-1104-1-885-256-0x0-1x1-1x1-0-NCHW-FP32-W=ConvAsmBwdWrW1x1:1,16,4,8,4,1,1,4,0,1
64-56-56-1x1-128-56-56-2-0x0-1x1-1x1-0-NCHW-FP32-F=ConvOclDirectFwd1x1:1,64,1,1,1,4,16,64,0;ConvAsm1x1U:1,8,1,64,1,4,2,1
120-14-14-1x1-480-14-14-1-0x0-1x1-1x1-0-NCHW-FP16-B_g3=ConvOclDirectFwd:8,16,8,16,1,1,2,2,1
384-17-17-3x3-384-35-35-4-0x0-2x2-1x1-0-NCHW-FP32-B=ConvOclDirectFwd:16,16,16,16,1,1,4,1,2
960-145-663-1x1-256-145-663-1-0x0-1x1-1x1-0-NCHW-FP32-B=ConvOclDirectFwd1x1:1,128,1,1,0,1,32,4,0
512-274-16-1x1-464-274-16-12-0x0-1x1-1x1-0-NCHW-FP32-B=ConvOclDirectFwd1x1:1,256,1,1,0,4,16,4,0;ConvAsm1x1U:2,16,5,64,1,1,1,1
992-14-14-1x1-128-14-14-512-0x0-1x1-1x1-0-NCHW-FP16-F=ConvOclDirectFwd1x1:1,64,1,1,0,4,16,4,0;ConvAsm1x1U:2,8,4,64,1,4,1,2
528-127-326-1x1-64-127-326-12-0x0-1x1-1x1-0-NCHW-FP32-B=ConvOclDirectFwd1x1:1,128,1,1,0,1,32,4,0
120-14-14-3x3-120-14-14-8-1x1-1x1-1x1-0-NCHW-FP32-W=ConvAsmBwdWrW3x3:0,0,8,2,3,1
192-28-28-1x1-64-28-28-8-0x0-1x1-1x1-0-NCHW-FP32-F=ConvOclDirectFwd1x1:1,64,1,1,1,0,16,64,0;ConvAsm1x1U:1,8,1,32,1,4,2,2;ConvActivAsm1x1U:2,16,3,16,1,4
1104-7-992-1x1-1696-7-992-2-0x0-1x1-1x1-0-NCHW-FP32-W=ConvAsmBwdWrW1x1:2,8,4,4,8,1,1,2,0,2
1184-79-544-1x1-80-79-544-2-0x0-1x1-1x1-0-NCHW-FP32-F=ConvOclDirectFwd1x1:1,64,1,1,1,0,64,2048,0
768-1015-347-1x1-3-1015-347-1-0x0-1x1-1x1-0-NCHW-FP32-F=ConvOclDirectFwd1x1:1,256,1,1,0,1,16,8,0
4-399-245-1x1-1312-399-245-4-0x0-1x1-1x1-0-NCHW-FP32-B=ConvOclDirectFwd1x1:1,256,1,1,0,1,32,4,0
512-15-15-3x3-512-15-15-256-1x1-1x1-1x1-0-NCHW-FP32-W_g32=ConvOclBwdWrW2<4>:1,6,8,1,5;ConvOclBwdWrW2<2>:1,6,8,1,5;ConvOclBwdWrW2<1>:1,6,8,1,9;ConvOclBwdWrW2<16>:1,6,8,1,5;ConvAsmBwdWrW3x3:0,0,16,2,3,1;ConvOclBwdWrW2<8>:1,6,8,1,9
624-432-411-1x1-48-432-411-4-0x0-1x1-1x1-0-NCHW-FP32-F=ConvOclDirectFwd1x1:1,64,1,1,1,0,32,2048,0
144-109-337-1x1-116-109-337-32-0x0-1x1-1x1-0-NCHW-FP32-F=ConvOclDirectFwd1x1:1,256,1,1,0,1,16,4,0
144-79-39-1x1-832-79-39-128-0x0-1x1-1x1-0-NCHW-FP32-B=ConvOclDirectFwd1x1:1,128,1,1,0,1,32,4,0;ConvAsm1x1U:1,32,1,32,1,1,1,1
288-144-530-1x1-2048-144-530-1-0x0-1x1-1x1-0-NCHW-FP32-B=ConvOclDirectFwd1x1:1,256,1,1,0,4,16,8,0
1024-103-228-1x1-128-103-228-6-0x0-1x1-1x1-0-NCHW-FP32-B=ConvOclDirectFwd1x1:1,64,1,1,0,1,32,4,0
144-305-887-1x1-54-305-887-4-0x0-1x1-1x1-0-NCHW-FP32-F=ConvOclDirectFwd1x1:1,64,1,1,0,1,8,4,0
2-725-304-1x1-232-725-304-2-0x0-1x1-1x1-0-NCHW-FP32-B=ConvOclDirectFwd1x1:1,256,1,1,0,2,16,4,0
1-242-85-1x1-48-242-85-1-0x0-1x1-1x1-0-NCHW-FP32-B=ConvOclDirectFwd1x1:1,256,1,1,0,1,4,4,0;ConvAsm1x1U:1,8,1,64,1,1,1,2
232-622-604-1x1-58-622-604-2-0x0-1x1-1x1-0-NCHW-FP32-F=ConvOclDirectFwd1x1:1,256,1,1,0,4,8,4,0
240-7-7-3x3-240-7-7-16-1x1-1x1-1x1-0-NCHW-FP32-W=ConvAsmBwdWrW3x3:0,1,8,2,6,1
416-1011-558-1x1-320-1011-558-2-0x0-1x1-1x1-0-NCHW-FP32-F=ConvOclDirectFwd1x1:1,64,1,1,1,4,16,2048,0
256-56-56-3x3-128-56-56-4-1x1-1x1-1x1-0-NCHW-FP32-W=ConvAsmBwdWrW3x3:0,1,16,4,3,1
160-56-56-1x1-128-56-56-512-0x0-1x1-1x1-0-NCHW-FP16-W=ConvAsmBwdWrW1x1:4,4,4,1,8,1,4,4,0,2
672-130-591-1x1-16-130-591-4-0x0-1x1-1x1-0-NCHW-FP32-F=ConvOclDirectFwd1x1:1,64,1,1,1,1,64,2048,0
160-213-354-1x1-144-213-354-8-0x0-1x1-1x1-0-NCHW-FP32-B=ConvOclDirectFwd1x1:1,64,1,1,0,1,16,4,0
128-14-14-1x1-416-14-14-512-0x0-1x1-1x1-0-NCHW-FP16-F=ConvOclDirectFwd1x1:1,128,1,1,0,2,16,4,0;ConvAsm1x1U:2,8,4,64,1,4,1,2
480-50-150-1x1-1104-50-150-4-0x0-1x1-1x1-0-NCHW-FP32-W=ConvAsmBwdWrW1x1:2,8,4,4,8,1,1,4,0,1
192-14-14-1x1-1968-14-14-16-0x0-1x1-1x1-0-NCHW-FP32-B=ConvOclDirectFwd1x1:1,256,1,1,0,2,16,4,0
448-347-130-1x1-24-347-130-1-0x0-1x1-1x1-0-NCHW-FP32-F=ConvOclDirectFwd1x1:1,128,1,1,0,2,16,4,0
256-29-29-3x3-256-57-57-8-1x1-2x2-1x1-0-NCHW-FP32-B_g32=ConvOclDirectFwd:8,16,32,32,4,2,8,1,1
232-851-746-1x1-416-851-746-2-0x0-1x1-1x1-0-NCHW-FP32-F=ConvOclDirectFwd1x1:1,128,1,1,0,1,32,4,0
448-41-458-1x1-4-41-458-1-0x0-1x1-1x1-0-NCHW-FP32-B=ConvOclDirectFwd1x1:1,256,1,1,0,2,4,4,0
608-7-7-1x1-128-7-7-256-0x0-1x1-1x1-0-NCHW-FP16-B=ConvOclDirectFwd1x1:1,64,1,1,0,1,16,4,0;ConvAsm1x1U:2,8,4,16,1,4,4,1
112-694-72-1x1-1296-694-72-6-0x0-1x1-1x1-0-NCHW-FP32-B=ConvOclDirectFwd1x1:1,128,1,1,0,4,16,4,0
24-190-2-1x1-512-190-2-6-0x0-1x1-1x1-0-NCHW-FP32-F=ConvOclDirectFwd1x1:1,64,1,1,0,1,8,8,0;ConvAsm1x1U:1,8,1,16,1,4,2,4
64-127-326-1x1-528-127-326-12-0x0-1x1-1x1-0-NCHW-FP32-F=ConvOclDirectFwd1x1:1,64,1,1,1,4,64,256,0
256-924-16-1x1-2112-924-16-8-0x0-1x1-1x1-0-NCHW-FP32-B=ConvOclDirectFwd1x1:1,128,1,1,0,2,32,4,0
768-17-17-1x1-128-17-17-1-0x0-1x1-1x1-0-NCHW-FP32-F=ConvOclDirectFwd1x1:1,64,1,1,1,0,16,64,0;ConvAsm1x1U:1,8,1,64,1,4,4,1;ConvActivAsm1x1U:1,16,1,64,1,4
128-56-56-3x3-128-56-56-128-1x1-1x1-1x1-0-NCHW-FP32-F_g32=ConvOclDirectFwd:16,16,16,32,1,2,8,4,2
384-8-8-1x1-1280-8-8-256-0x0-1x1-1x1-0-NCHW-FP16-B=ConvOclDirectFwd1x1:1,256,1,1,0,4,16,4,0;ConvAsm1x1U:1,16,2,32,1,2,2,2
576-7-7-1x1-128-7-7-64-0x0-1x1-1x1-0-NCHW-FP32-B=ConvOclDirectFwd1x1:1,64,1,1,0,1,8,4,0;ConvAsm1x1U:4,8,4,16,1,4,2,4
120-7-7-3x3-120-14-14-1024-1x1-2x2-1x1-0-NCHW-FP32-B=ConvOclDirectFwd:8,16,8,16,1,1,4,1,2
608-943-721-1x1-24-943-721-1-0x0-1x1-1x1-0-NCHW-FP32-B=ConvOclDirectFwd1x1:1,256,1,1,0,1,16,4,0
192-549-26-1x1-1696-549-26-2-0x0-1x1-1x1-0-NCHW-FP32-B=ConvOclDirectFwd1x1:1,128,1,1,0,2,32,4,0
128-112-112-3x3-128-112-112-256-1x1-1x1-1x1-0-NCHW-FP16-W=ConvAsmBwdWrW3x3:0,1,16,4,1,1
128-28-28-1x1-512-28-28-128-0x0-1x1-1x1-0-NCHW-FP16-B=ConvOclDirectFwd1x1:1,64,1,1,0,4,16,4,0;ConvAsm1x1U:1,16,2,16,1,2,1,4
544-2-162-1x1-672-2-162-16-0x0-1x1-1x1-0-NCHW-FP32-B=ConvOclDirectFwd1x1:1,64,1,1,0,4,16,4,0;ConvAsm1x1U:2,16,2,64,1,2,2,2
1312-251-710-1x1-352-251-710-1-0x0-1x1-1x1-0-NCHW-FP32-F=ConvOclDirectFwd1x1:1,64,1,1,1,4,64,2048,0
864-14-14-1x1-128-14-14-256-0x0-1x1-1x1-0-NCHW-FP16-W=ConvAsmBwdWrW1x1:2,8,2,8,2,1,4,4,0,2
1248-808-208-1x1-1000-808-208-2-0x0-1x1-1x1-0-NCHW-FP32-F=ConvOclDirectFwd1x1:1,128,1,1,0,2,16,4,0
256-27-27-1x1-32-27-27-256-0x0-1x1-1x1-0-NCHW-FP16-B=ConvOclDirectFwd1x1:1,64,1,1,0,1,32,4,0;ConvAsm1x1U:1,16,2,64,1,2,2,2
128-28-28-3x3-32-28-28-512-1x1-1x1-1x1-0-NCHW-FP16-F=ConvOclDirectFwd:16,16,32,32,2,2,8,1,2
24-11-937-1x1-576-11-937-2-0x0-1x1-1x1-0-NCHW-FP32-F=ConvOclDirectFwd1x1:1,256,1,1,0,1,4,4,0
128-7-7-3x3-32-7-7-512-1x1-1x1-1x1-0-NCHW-FP32-W=ConvAsmBwdWrW3x3:0,0,8,2,7,4
704-484-3-1x1-672-484-3-128-0x0-1x1-1x1-0-NCHW-FP32-W=ConvAsmBwdWrW1x1:2,8,4,8,4,1,1,4,0,1
928-387-154-1x1-2016-387-154-1-0x0-1x1-1x1-0-NCHW-FP32-B=ConvOclDirectFwd1x1:1,256,1,1,0,1,32,4,0
1088-164-157-1x1-1000-164-157-6-0x0-1x1-1x1-0-NCHW-FP32-F=ConvOclDirectFwd1x1:1,256,1,1,0,2,8,4,0
1344-57-787-1x1-928-57-787-4-0x0-1x1-1x1-0-NCHW-FP32-F=ConvOclDirectFwd1x1:1,64,1,1,1,1,64,2048,0
512-14-14-5x5-48-14-14-64-2x2-1x1-1x1-0-NCHW-FP32-F=ConvOclDirectFwd:16,8,16,16,1,2,8,4,2
384-682-3-1x1-2160-682-3-4-0x0-1x1-1x1-0-NCHW-FP32-W=ConvAsmBwdWrW1x1:1,16,4,8,4,1,1,4,0,1
64-53-105-1x1-608-53-105-8-0x0-1x1-1x1-0-NCHW-FP32-W=ConvAsmBwdWrW1x1:4,4,4,4,4,1,1,4,0,1
160-73-73-1x1-64-73-73-128-0x0-1x1-1x1-0-NCHW-FP32-F=ConvOclDirectFwd1x1:1,64,1,1,1,1,16,256,0;ConvAsm1x1U:2,16,2,64,3,2,1,4;ConvActivAsm1x1U:2,32,3,64,2,1
1568-533-113-1x1-672-533-113-4-0x0-1x1-1x1-0-NCHW-FP32-F=ConvOclDirectFwd1x1:1,64,1,1,1,0,16,2048,0
1024-7-7-1x1-2048-7-7-48-0x0-1x1-1x1-0-NCHW-FP32-W=ConvAsmBwdWrW1x1:1,16,4,4,8,1,1,4,0,1
128-7-7-1x1-672-7-7-128-0x0-1x1-1x1-0-NCHW-FP32-F=ConvOclDirectFwd1x1:1,64,1,1,1,1,16,128,0;ConvAsm1x1U:1,8,1,64,4,4,1,4
32-234-109-1x1-1000-234-109-12-0x0-1x1-1x1-0-NCHW-FP32-B=ConvOclDirectFwd1x1:1,256,1,1,0,2,8,8,0
64-56-56-1x1-64-56-56-4-0x0-1x1-1x1-0-NCHW-FP32-F=ConvOclDirectFwd1x1:1,64,1,1,1,4,16,128,0;ConvAsm1x1U:1,8,1,64,1,4,2,2;ConvActivAsm1x1U:1,16,1,64,2,3
1056-66-299-1x1-448-66-299-8-0x0-1x1-1x1-0-NCHW-FP32-B=ConvOclDirectFwd1x1:1,256,1,1,0,2,32,4,0
128-7-7-5x5-832-7-7-1-2x2-1x1-1x1-0-NCHW-FP32-W=ConvOclBwdWrW2<1>:1,7,1,8,7
1280-159-906-1x1-1440-159-906-2-0x0-1x1-1x1-0-NCHW-FP32-B=ConvOclDirectFwd1x1:1,256,1,1,0,2,32,4,0
192-28-28-3x3-128-28-28-1-1x1-1x1-1x1-0-NCHW-FP32-W=ConvAsmBwdWrW3x3:0,0,8,2,2,1
1024-828-188-1x1-864-828-188-2-0x0-1x1-1x1-0-NCHW-FP32-F=ConvOclDirectFwd1x1:1,64,1,1,1,4,16,128,0
1920-322-343-1x1-416-322-343-1-0x0-1x1-1x1-0-NCHW-FP32-F=ConvOclDirectFwd1x1:1,64,1,1,1,4,64,2048,0
256-237-110-1x1-116-237-110-48-0x0-1x1-1x1-0-NCHW-FP32-B=ConvOclDirectFwd1x1:1,64,1,1,0,2,16,4,0
816-256-149-1x1-512-256-149-12-0x0-1x1-1x1-0-NCHW-FP32-F=ConvOclDirectFwd1x1:1,64,1,1,1,1,16,2048,0
192-7-7-1x1-1152-7-7-16-0x0-1x1-1x1-0-NCHW-FP16-B=ConvOclDirectFwd1x1:1,128,1,1,0,1,8,4,0;ConvAsm1x1U:1,8,2,32,1,4,2,2
192-8-8-1x1-1280-8-8-4-0x0-1x1-1x1-0-NCHW-FP16-B=ConvOclDirectFwd1x1:1,256,1,1,0,2,4,4,0;ConvAsm1x1U:1,8,2,16,1,2,4,1
116-520-7-1x1-736-520-7-32-0x0-1x1-1x1-0-NCHW-FP32-B=ConvOclDirectFwd1x1:1,256,1,1,0,2,32,4,0;ConvAsm1x1U:1,8,1,64,1,4,1,4
512-695-29-1x1-1024-695-29-16-0x0-1x1-1x1-0-NCHW-FP32-B=ConvOclDirectFwd1x1:1,256,1,1,0,1,32,4,0
64-177-344-1x1-80-177-344-8-0x0-1x1-1x1-0-NCHW-FP32-F=ConvOclDirectFwd1x1:1,64,1,1,1,4,64,128,0
8-46-744-1x1-256-46-744-16-0x0-1x1-1x1-0-NCHW-FP32-B=ConvOclDirectFwd1x1:1,128,1,1,0,2,16,8,0
512-7-7-1x1-2048-7-7-256-0x0-1x1-1x1-0-NCHW-FP16-F=ConvOclDirectFwd1x1:1,256,1,1,0,1,16,4,0;ConvAsm1x1U:2,8,4,16,1,4,1,8
3-225-225-7x7-64-112-112-512-2x2-2x2-1x1-0-NCHW-FP32-F=ConvOclDirectFwd:16,8,16,16,1,2,8,1,1;ConvOclDirectFwdFused:16,8,16,16,1,2,8,1,1
512-32-32-1x1-2048-32-32-4-0x0-1x1-1x1-0-NCHW-FP32-W=ConvAsmBwdWrW1x1:2,8,2,8,8,1,1,2,0,2
128-54-54-3x3-32-54-54-32-1x1-1x1-1x1-0-NCHW-FP16-F=ConvOclDirectFwd:16,16,32,32,2,2,8,4,2
640-588-80-1x1-928-588-80-1-0x0-1x1-1x1-0-NCHW-FP32-F=ConvOclDirectFwd1x1:1,64,1,1,1,0,64,2048,0
32-54-54-3x3-128-54-54-16-1x1-1x1-1x1-0-NCHW-FP16-W=ConvAsmBwdWrW3x3:0,1,8,2,1,8
3-6-6-3x3-4-2-2-16-0x0-2x2-1x1-0-NCHW-FP32-F=ConvOclDirectFwd:8,8,8,8,1,1,2,2,2
16-935-496-1x1-54-935-496-4-0x0-1x1-1x1-0-NCHW-FP32-F=ConvOclDirectFwd1x1:1,256,1,1,0,4,16,4,0
224-574-17-1x1-608-574-17-48-0x0-1x1-1x1-0-NCHW-FP32-B=ConvOclDirectFwd1x1:1,256,1,1,0,2,32,4,0
128-7-7-1x1-800-7-7-256-0x0-1x1-1x1-0-NCHW-FP16-F=ConvOclDirectFwd1x1:1,128,1,1,0,1,16,4,0;ConvAsm1x1U:2,8,4,16,1,4,1,2
128-28-28-3x3-32-28-28-32-1x1-1x1-1x1-0-NCHW-FP16-F=ConvOclDirectFwd:16,16,32,32,2,2,4,4,2
768-17-17-1x1-128-17-17-8-0x0-1x1-1x1-0-NCHW-FP32-F=ConvOclDirectFwd1x1:1,64,1,1,1,4,16,256,0;ConvAsm1x1U:4,8,5,32,1,4,2,2;ConvActivAsm1x1U:4,16,5,64,1,4
19-622-313-1x1-2-622-313-48-0x0-1x1-1x1-0-NCHW-FP32-B=ConvOclDirectFwd1x1:1,256,1,1,0,2,16,4,0;ConvAsm1x1U:1,1,2,4,1,1,1,1
960-251-55-1x1-24-251-55-6-0x0-1x1-1x1-0-NCHW-FP32-B=ConvOclDirectFwd1x1:1,128,1,1,0,1,16,8,0
2-934-810-1x1-1-934-810-16-0x0-1x1-1x1-0-NCHW-FP32-F=ConvOclDirectFwd1x1:1,256,1,1,0,2,16,4,0;ConvAsm1x1U:1,1,1,4,1,1,1,1
128-14-14-1x1-384-14-14-64-0x0-1x1-1x1-0-NCHW-FP32-B=ConvOclDirectFwd1x1:1,256,1,1,0,2,16,8,0;ConvAsm1x1U:1,16,1,64,2,2,2,2
864-365-549-1x1-288-365-549-1-0x0-1x1-1x1-0-NCHW-FP32-B=ConvOclDirectFwd1x1:1,128,1,1,0,1,32,4,0
1000-6-543-1x1-672-6-543-6-0x0-1x1-1x1-0-NCHW-FP32-W=ConvAsmBwdWrW1x1:2,8,4,8,4,1,1,4,0,2
64-13-13-1x1-512-13-13-512-0x0-1x1-1x1-0-NCHW-FP32-F=ConvOclDirectFwd1x1:8,8,16,16,1,0,32,128,1;ConvAsm1x1U:1,16,1,64,4,2,1,4
704-730-108-1x1-1408-730-108-1-0x0-1x1-1x1-0-NCHW-FP32-B=ConvOclDirectFwd1x1:1,64,1,1,0,2,32,4,0
224-359-506-1x1-1376-359-506-2-0x0-1x1-1x1-0-NCHW-FP32-B=ConvOclDirectFwd1x1:1,64,1,1,0,2,32,4,0
96-35-35-3x3-96-35-35-16-1x1-1x1-1x1-0-NCHW-FP16-B=ConvOclDirectFwd:16,8,16,16,1,2,8,1,2
512-84-345-1x1-320-84-345-6-0x0-1x1-1x1-0-NCHW-FP32-W=ConvAsmBwdWrW1x1:4,4,8,2,8,1,2,4,0,0
144-534-148-1x1-32-534-148-2-0x0-1x1-1x1-0-NCHW-FP32-B=ConvOclDirectFwd1x1:1,64,1,1,0,1,32,4,0
624-32-966-1x1-32-32-966-2-0x0-1x1-1x1-0-NCHW-FP32-F=ConvOclDirectFwd1x1:1,64,1,1,1,4,64,2048,0
128-14-14-1x1-288-14-14-128-0x0-1x1-1x1-0-NCHW-FP16-B=ConvOclDirectFwd1x1:1,128,1,1,0,2,32,8,0;ConvAsm1x1U:1,16,2,16,1,2,2,2
320-28-28-1x1-128-28-28-512-0x0-1x1-1x1-0-NCHW-FP32-B=ConvOclDirectFwd1x1:1,256,1,1,0,1,32,4,0;ConvAsm1x1U:1,32,2,16,1,1,1,4
144-217-847-1x1-1776-217-847-1-0x0-1x1-1x1-0-NCHW-FP32-B=ConvOclDirectFwd1x1:1,256,1,1,0,1,16,4,0
320-462-817-1x1-1056-462-817-1-0x0-1x1-1x1-0-NCHW-FP32-F=ConvOclDirectFwd1x1:1,64,1,1,1,0,64,2048,0
336-8-574-1x1-288-8-574-32-0x0-1x1-1x1-0-NCHW-FP32-F=ConvOclDirectFwd1x1:1,64,1,1,1,4,64,2048,0;ConvAsm1x1U:1,32,7,32,1,1,1,1
3-109-443-1x1-54-109-443-12-0x0-1x1-1x1-0-NCHW-FP32-F=ConvOclDirectFwd1x1:1,256,1,1,0,1,16,4,0;ConvAsm1x1U:1,8,1,64,1,1,2,1
320-424-620-1x1-288-424-620-2-0x0-1x1-1x1-0-NCHW-FP32-F=ConvOclDirectFwd1x1:1,64,1,1,1,0,64,2048,0
64-112-112-7x7-3-225-225-4-2x2-2x2-1x1-0-NCHW-FP32-B=ConvOclDirectFwd:16,16,32,32,2,2,8,2,1
512-14-14-3x3-512-14-14-32-1x1-1x1-1x1-0-NCHW-FP32-F_g32=ConvOclDirectFwd:16,16,16,16,1,1,4,4,2
232-984-72-1x1-528-984-72-8-0x0-1x1-1x1-0-NCHW-FP32-B=ConvOclDirectFwd1x1:1,128,1,1,0,1,16,4,0
8-177-418-1x1-736-177-418-2-0x0-1x1-1x1-0-NCHW-FP32-B=ConvOclDirectFwd1x1:1,256,1,1,0,1,32,4,0
128-28-28-1x1-416-28-28-512-0x0-1x1-1x1-0-NCHW-FP16-B=ConvOclDirectFwd1x1:1,256,1,1,0,4,16,4,0;ConvAsm1x1U:1,16,2,16,1,2,1,1
1-590-9-1x1-1664-590-9-32-0x0-1x1-1x1-0-NCHW-FP32-B=ConvOclDirectFwd1x1:1,256,1,1,0,2,4,4,0
1184-296-83-1x1-736-296-83-2-0x0-1x1-1x1-0-NCHW-FP32-F=ConvOclDirectFwd1x1:1,64,1,1,1,4,64,2048,0
512-4-4-3x3-512-7-7-32-1x1-2x2-1x1-0-NCHW-FP32-B=ConvOclDirectFwd:8,8,8,8,1,1,2,2,1
480-47-335-1x1-864-47-335-32-0x0-1x1-1x1-0-NCHW-FP32-B=ConvOclDirectFwd1x1:1,256,1,1,0,1,32,4,0
1680-7-7-1x1-192-7-7-16-0x0-1x1-1x1-0-NCHW-FP16-F=ConvOclDirectFwd1x1:1,64,1,1,0,1,4,8,0;ConvAsm1x1U:1,8,2,32,1,4,4,1
1024-15-15-1x1-1024-15-15-128-0x0-1x1-1x1-0-NCHW-FP32-B=ConvOclDirectFwd1x1:1,256,1,1,0,1,32,4,0;ConvAsm1x1U:1,32,2,16,1,1,1,1
512-28-28-1x1-512-28-28-8-0x0-1x1-1x1-0-NCHW-FP32-W=ConvAsmBwdWrW1x1:1,16,2,4,8,1,1,4,0,1
160-14-14-1x1-576-14-14-32-0x0-1x1-1x1-0-NCHW-FP32-W=ConvAsmBwdWrW1x1:1,16,2,4,8,1,2,4,0,1
80-474-20-1x1-928-474-20-4-0x0-1x1-1x1-0-NCHW-FP32-W=ConvAsmBwdWrW1x1:4,4,8,4,4,1,1,4,0,1
128-28-28-1x1-256-56-56-16-0x0-2x2-1x1-0-NCHW-FP16-W=ConvAsmBwdWrW1x1:4,4,4,1,8,1,2,4,0,0
128-28-28-1x1-480-28-28-512-0x0-1x1-1x1-0-NCHW-FP16-W=ConvAsmBwdWrW1x1:2,8,2,8,2,1,2,4,0,1
128-28-28-3x3-128-28-28-2-1x1-1x1-1x1-0-NCHW-FP32-W=ConvAsmBwdWrW3x3:0,1,8,2,2,1
480-974-23-1x1-1472-974-23-4-0x0-1x1-1x1-0-NCHW-FP32-B=ConvOclDirectFwd1x1:1,256,1,1,0,2,32,4,0
816-554-392-1x1-1056-554-392-1-0x0-1x1-1x1-0-NCHW-FP32-F=ConvOclDirectFwd1x1:1,64,1,1,1,4,64,2048,0
1024-13-13-3x3-512-13-13-256-1x1-1x1-1x1-0-NCHW-FP32-W=ConvAsmBwdWrW3x3:0,1,8,8,3,1
48-414-271-1x1-8-414-271-2-0x0-1x1-1x1-0-NCHW-FP32-B=ConvOclDirectFwd1x1:1,256,1,1,0,1,8,4,0
832-7-7-5x5-128-7-7-16-2x2-1x1-1x1-0-NCHW-FP32-F=ConvOclDirectFwd:8,8,8,8,1,1,2,1,2
528-19-300-1x1-128-19-300-32-0x0-1x1-1x1-0-NCHW-FP32-W=ConvAsmBwdWrW1x1:2,8,4,8,2,1,1,4,0,1
800-274-481-1x1-2016-274-481-2-0x0-1x1-1x1-0-NCHW-FP32-B=ConvOclDirectFwd1x1:1,256,1,1,0,2,32,4,0
192-56-56-1x1-128-56-56-32-0x0-1x1-1x1-0-NCHW-FP16-B=ConvOclDirectFwd1x1:1,128,1,1,0,4,16,4,0;ConvAsm1x1U:1,16,2,32,1,2,2,2
672-785-7-1x1-736-785-7-48-0x0-1x1-1x1-0-NCHW-FP32-B=ConvOclDirectFwd1x1:1,256,1,1,0,1,32,4,0;ConvAsm1x1U:3,32,3,64,1,1,2,2
112-330-72-1x1-232-330-72-8-0x0-1x1-1x1-0-NCHW-FP32-B=ConvOclDirectFwd1x1:1,64,1,1,0,4,16,4,0
1000-2-198-1x1-256-2-198-12-0x0-1x1-1x1-0-NCHW-FP32-B=ConvOclDirectFwd1x1:8,64,8,32,0,2,16,4,1;ConvAsm1x1U:1,32,1,32,1,1,2,2
1104-543-106-1x1-64-543-106-8-0x0-1x1-1x1-0-NCHW-FP32-F=ConvOclDirectFwd1x1:16,16,32,32,1,0,32,128,1
192-199-5-1x1-416-199-5-16-0x0-1x1-1x1-0-NCHW-FP32-W=ConvAsmBwdWrW1x1:4,4,8,4,4,1,1,4,0,1
512-10-41-1x1-928-10-41-256-0x0-1x1-1x1-0-NCHW-FP32-F=ConvOclDirectFwd1x1:1,64,1,1,1,4,64,2048,0;ConvAsm1x1U:4,16,5,32,2,1,1,1
1216-112-79-1x1-704-112-79-2-0x0-1x1-1x1-0-NCHW-FP32-F=ConvOclDirectFwd1x1:1,64,1,1,1,0,16,256,0
896-278-705-1x1-240-278-705-1-0x0-1x1-1x1-0-NCHW-FP32-B=ConvOclDirectFwd1x1:1,256,1,1,0,2,16,8,0
1024-369-647-1x1-960-369-647-2-0x0-1x1-1x1-0-NCHW-FP32-F=ConvOclDirectFwd1x1:1,64,1,1,1,0,16,2048,0
320-907-356-1x1-8-907-356-1-0x0-1x1-1x1-0-NCHW-FP32-B=ConvOclDirectFwd1x1:1,128,1,1,0,4,16,8,0
320-28-28-1x1-128-28-28-64-0x0-1x1-1x1-0-NCHW-FP32-F=ConvOclDirectFwd1x1:1,64,1,1,1,0,32,2048,0;ConvAsm1x1U:2,16,2,32,2,2,1,4;ConvActivAsm1x1U:2,16,3,32,2,1
576-532-411-1x1-1440-532-411-1-0x0-1x1-1x1-0-NCHW-FP32-B=ConvOclDirectFwd1x1:1,256,1,1,0,2,32,4,0
64-56-56-1x1-128-56-56-48-0x0-1x1-1x1-0-NCHW-FP32-F=ConvOclDirectFwd1x1:1,64,1,1,1,4,16,2048,0;ConvAsm1x1U:1,8,1,64,1,2,1,1
480-209-434-1x1-1-209-434-1-0x0-1x1-1x1-0-NCHW-FP32-B=ConvOclDirectFwd1x1:1,256,1,1,0,2,16,8,0
992-924-182-1x1-116-924-182-2-0x0-1x1-1x1-0-NCHW-FP32-B=ConvOclDirectFwd1x1:1,256,1,1,0,2,8,4,0
64-35-35-1x1-384-35-35-8-0x0-1x1-1x1-0-NCHW-FP16-B=ConvOclDirectFwd1x1:1,256,1,1,0,1,32,4,0;ConvAsm1x1U:1,16,2,32,1,2,1,4
1-336-133-1x1-256-336-133-4-0x0-1x1-1x1-0-NCHW-FP32-W=ConvAsmBwdWrW1x1:4,4,2,1,2,1,2,4,0,1
160-547-244-1x1-112-547-244-6-0x0-1x1-1x1-0-NCHW-FP32-F=ConvOclDirectFwd1x1:1,64,1,1,1,1,64,256,0
64-54-54-1x1-16-54-54-512-0x0-1x1-1x1-0-NCHW-FP32-F=ConvOclDirectFwd1x1:1,64,1,1,1,1,64,64,0;ConvAsm1x1U:1,16,2,64,4,1,1,1
576-1-904-1x1-800-1-904-48-0x0-1x1-1x1-0-NCHW-FP32-W=ConvAsmBwdWrW1x1:2,8,4,4,8,1,1,4,0,1
544-94-138-1x1-256-94-138-2-0x0-1x1-1x1-0-NCHW-FP32-W=ConvAsmBwdWrW1x1:1,16,2,8,4,1,1,4,0,2
80-866-356-1x1-320-866-356-1-0x0-1x1-1x1-0-NCHW-FP32-B=ConvOclDirectFwd1x1:1,256,1,1,0,2,32,4,0
19-531-139-1x1-116-531-139-32-0x0-1x1-1x1-0-NCHW-FP32-W=ConvAsmBwdWrW1x1:4,4,2,2,4,1,2,4,0,2
8-99-153-1x1-8-99-153-1024-0x0-1x1-1x1-0-NCHW-FP32-B=ConvOclDirectFwd1x1:1,256,1,1,0,1,16,8,0;ConvAsm1x1U:1,8,1,16,1,1,1,1
1024-7-7-3x3-1024-14-14-6-1x1-2x2-1x1-0-NCHW-FP32-W_g32=ConvOclBwdWrW2<1>:1,7,8,1,7;ConvAsmBwdWrW3x3:0,0,8,4,12,1;ConvOclBwdWrW2<4>:1,7,8,1,7;ConvOclBwdWrW2<2>:1,7,8,1,7
672-266-272-1x1-192-266-272-6-0x0-1x1-1x1-0-NCHW-FP32-B=ConvOclDirectFwd1x1:1,128,1,1,0,1,32,4,0
128-7-7-1x1-736-7-7-64-0x0-1x1-1x1-0-NCHW-FP16-B=ConvOclDirectFwd1x1:1,128,1,1,0,1,8,4,0;ConvAsm1x1U:2,8,4,16,1,4,1,8
4-802-7-1x1-416-802-7-64-0x0-1x1-1x1-0-NCHW-FP32-F=ConvOclDirectFwd1x1:1,256,1,1,0,2,32,4,0;ConvAsm1x1U:1,8,1,16,1,1,1,1
736-364-56-1x1-704-364-56-16-0x0-1x1-1x1-0-NCHW-FP32-F=ConvOclDirectFwd1x1:1,64,1,1,1,1,16,2048,0
1408-286-618-1x1-832-286-618-1-0x0-1x1-1x1-0-NCHW-FP32-F=ConvOclDirectFwd1x1:1,64,1,1,1,4,16,2048,0
1600-50-70-1x1-672-50-70-16-0x0-1x1-1x1-0-NCHW-FP32-F=ConvOclDirectFwd1x1:1,64,1,1,1,4,64,2048,0
992-968-165-1x1-512-968-165-1-0x0-1x1-1x1-0-NCHW-FP32-B=ConvOclDirectFwd1x1:1,256,1,1,0,2,32,4,0
116-104-533-1x1-960-104-533-1-0x0-1x1-1x1-0-NCHW-FP32-F=ConvOclDirectFwd1x1:1,256,1,1,0,4,16,4,0
32-14-14-1x1-528-14-14-128-0x0-1x1-1x1-0-NCHW-FP16-W=ConvAsmBwdWrW1x1:4,4,8,1,8,2,2,4,0,1
128-14-14-1x1-528-14-14-256-0x0-1x1-1x1-0-NCHW-FP16-F=ConvOclDirectFwd1x1:1,256,1,1,0,4,16,4,0;ConvAsm1x1U:1,16,2,16,2,2,1,4
128-104-104-3x3-64-104-104-128-1x1-1x1-1x1-0-NCHW-FP32-W=ConvAsmBwdWrW3x3:0,1,16,4,3,1
128-17-17-1x1-768-17-17-256-0x0-1x1-1x1-0-NCHW-FP32-F=ConvOclDirectFwd1x1:1,64,1,1,1,1,32,2048,0;ConvAsm1x1U:1,16,1,64,4,2,1,4
256-304-93-1x1-320-304-93-32-0x0-1x1-1x1-0-NCHW-FP32-B=ConvOclDirectFwd1x1:1,128,1,1,0,2,32,4,0
1024-7-7-1x1-464-7-7-256-0x0-1x1-1x1-0-NCHW-FP32-B=ConvOclDirectFwd1x1:1,128,1,1,0,1,16,8,0;ConvAsm1x1U:1,16,1,64,2,2,4,1
128-14-14-1x1-928-14-14-64-0x0-1x1-1x1-0-NCHW-FP32-W=ConvAsmBwdWrW1x1:4,4,8,4,4,1,1,4,0,1
448-14-14-1x1-128-14-14-128-0x0-1x1-1x1-0-NCHW-FP16-B=ConvOclDirectFwd1x1:1,64,1,1,0,2,32,8,0;ConvAsm1x1U:1,16,2,16,1,2,2,4
512-161-8-1x1-16-161-8-2-0x0-1x1-1x1-0-NCHW-FP32-B=ConvOclDirectFwd1x1:1,256,1,1,0,1,4,8,0;ConvAsm1x1U:1,8,2,64,1,4,4,1
128-28-28-3x3-192-28-28-4-1x1-1x1-1x1-0-NCHW-FP16-F=ConvOclDirectFwd:16,16,32,32,2,2,4,2,2;ConvOclDirectFwdFused:16,16,32,32,2,2,4,4,2
1056-7-7-1x1-128-7-7-64-0x0-1x1-1x1-0-NCHW-FP32-F=ConvOclDirectFwd1x1:1,64,1,1,1,4,32,256,0;ConvAsm1x1U:4,8,4,16,1,4,2,4
128-56-56-3x3-256-56-56-128-1x1-1x1-1x1-0-NCHW-FP16-F=ConvOclDirectFwd:32,8,32,32,1,4,8,1,2;ConvOclDirectFwdFused:32,8,32,32,1,4,8,1,1
1-134-58-1x1-432-134-58-128-0x0-1x1-1x1-0-NCHW-FP32-W=ConvAsmBwdWrW1x1:4,4,2,1,2,1,1,2,0,1
112-439-860-1x1-116-439-860-6-0x0-1x1-1x1-0-NCHW-FP32-B=ConvOclDirectFwd1x1:1,256,1,1,0,4,16,4,0
384-13-13-3x3-192-13-13-128-1x1-1x1-1x1-0-NCHW-FP16-B=ConvOclDirectFwd:8,8,16,16,2,2,8,2,1
3-620-411-1x1-4-620-411-32-0x0-1x1-1x1-0-NCHW-FP32-B=ConvOclDirectFwd1x1:1,256,1,1,0,4,8,4,0;ConvAsm1x1U:3,1,3,4,1,1,2,4
8-966-461-1x1-24-966-461-2-0x0-1x1-1x1-0-NCHW-FP32-F=ConvOclDirectFwd1x1:1,256,1,1,0,2,16,4,0
1024-7-7-3x3-1024-14-14-2-1x1-2x2-1x1-0-NCHW-FP32-W_g32=ConvOclBwdWrW2<1>:1,7,8,1,7;ConvAsmBwdWrW3x3:0,0,8,4,3,1;ConvOclBwdWrW2<2>:1,7,8,1,7
768-17-17-1x1-160-17-17-32-0x0-1x1-1x1-0-NCHW-FP32-F=ConvOclDirectFwd1x1:1,64,1,1,1,1,16,2048,0;ConvAsm1x1U:3,16,5,32,1,2,4,1;ConvActivAsm1x1U:4,32,7,16,1,2
224-56-56-1x1-128-56-56-64-0x0-1x1-1x1-0-NCHW-FP16-F=ConvOclDirectFwd1x1:1,128,1,1,0,4,16,4,0;ConvAsm1x1U:1,8,2,32,1,4,1,4
2-260-966-1x1-3-260-966-8-0x0-1x1-1x1-0-NCHW-FP32-B=ConvOclDirectFwd1x1:1,128,1,1,0,1,4,4,0;ConvAsm1x1U:3,1,3,4,1,1,1,2
8-891-330-1x1-96-891-330-16-0x0-1x1-1x1-0-NCHW-FP32-B=ConvOclDirectFwd1x1:1,128,1,1,0,2,32,4,0
896-14-14-1x1-128-14-14-16-0x0-1x1-1x1-0-NCHW-FP16-W=ConvAsmBwdWrW1x1:2,8,2,8,2,1,2,4,0,0
48-7-7-1x1-832-7-7-128-0x0-1x1-1x1-0-NCHW-FP32-B=ConvOclDirectFwd1x1:1,128,1,1,0,1,16,8,0;ConvAsm1x1U:1,16,1,64,2,2,1,4
608-14-14-1x1-128-14-14-128-0x0-1x1-1x1-0-NCHW-FP16-W=ConvAsmBwdWrW1x1:2,8,2,8,2,1,4,4,0,2
1472-880-5-1x1-416-880-5-12-0x0-1x1-1x1-0-NCHW-FP32-F=ConvOclDirectFwd1x1:1,64,1,1,1,4,64,2048,0
512-7-7-1x1-2048-7-7-32-0x0-1x1-1x1-0-NCHW-FP16-B=ConvOclDirectFwd1x1:1,64,1,1,0,1,8,4,0;ConvAsm1x1U:1,16,2,16,1,2,2,2
1056-362-156-1x1-1680-362-156-2-0x0-1x1-1x1-0-NCHW-FP32-B=ConvOclDirectFwd1x1:1,256,1,1,0,4,16,4,0
128-7-7-1x1-768-7-7-256-0x0-1x1-1x1-0-NCHW-FP16-W=ConvAsmBwdWrW1x1:2,8,2,8,2,1,2,4,0,1
960-349-161-1x1-576-349-161-8-0x0-1x1-1x1-0-NCHW-FP32-F=ConvOclDirectFwd1x1:1,64,1,1,1,1,16,2048,0
232-42-134-1x1-896-42-134-2-0x0-1x1-1x1-0-NCHW-FP32-B=ConvOclDirectFwd1x1:1,256,1,1,0,4,16,8,0
128-56-56-1x1-192-56-56-32-0x0-1x1-1x1-0-NCHW-FP32-B=ConvOclDirectFwd1x1:1,128,1,1,0,1,32,4,0;ConvAsm1x1U:1,16,1,64,1,2,2,2
96-35-35-3x3-64-35-35-32-1x1-1x1-1x1-0-NCHW-FP32-W=ConvAsmBwdWrW3x3:0,0,8,4,3,4
240-7-7-1x1-960-7-7-32-0x0-1x1-1x1-0-NCHW-FP32-F_g3=ConvOclDirectFwd:8,8,8,8,1,1,8,4,2
192-28-28-1x1-16-28-28-4-0x0-1x1-1x1-0-NCHW-FP16-F=ConvOclDirectFwd1x1:1,128,1,1,0,1,4,8,0;ConvAsm1x1U:1,8,2,16,1,4,4,1
16-680-405-1x1-736-680-405-1-0x0-1x1-1x1-0-NCHW-FP32-B=ConvOclDirectFwd1x1:1,256,1,1,0,2,32,4,0
1008-449-314-1x1-144-449-314-2-0x0-1x1-1x1-0-NCHW-FP32-F=ConvOclDirectFwd1x1:1,64,1,1,1,1,64,2048,0
8-386-22-1x1-704-386-22-1-0x0-1x1-1x1-0-NCHW-FP32-B=ConvOclDirectFwd1x1:1,256,1,1,0,2,4,8,0
128-729-936-1x1-32-729-936-1-0x0-1x1-1x1-0-NCHW-FP32-B=ConvOclDirectFwd1x1:1,64,1,1,0,2,32,4,0
128-57-57-3x3-128-57-57-2-1x1-1x1-1x1-0-NCHW-FP32-W_g32=ConvOclBwdWrW2<1>:1,9,1,1,7;ConvAsmBwdWrW3x3:0,1,16,1,2,2;ConvOclBwdWrW2<2>:1,7,1,1,7
608-14-14-1x1-128-14-14-64-0x0-1x1-1x1-0-NCHW-FP16-F=ConvOclDirectFwd1x1:8,64,16,16,0,2,16,4,1;ConvAsm1x1U:2,8,4,64,1,4,4,2
24-15-226-1x1-1536-15-226-64-0x0-1x1-1x1-0-NCHW-FP32-B=ConvOclDirectFwd1x1:1,128,1,1,0,2,32,4,0
192-35-35-1x1-48-35-35-16-0x0-1x1-1x1-0-NCHW-FP32-F=ConvOclDirectFwd1x1:1,64,1,1,1,0,16,2048,0;ConvAsm1x1U:2,16,2,64,1,2,2,1;ConvActivAsm1x1U:2,16,2,64,2,3
19-124-415-1x1-1280-124-415-4-0x0-1x1-1x1-0-NCHW-FP32-B=ConvOclDirectFwd1x1:1,128,1,1,0,4,16,4,0
1024-17-17-1x1-128-17-17-256-0x0-1x1-1x1-0-NCHW-FP16-F=ConvOclDirectFwd1x1:1,256,1,1,0,1,16,4,0;ConvAsm1x1U:2,16,4,16,1,2,4,1
32-14-14-3x3-128-14-14-64-1x1-1x1-1x1-0-NCHW-FP32-W=ConvAsmBwdWrW3x3:0,1,8,4,3,4
800-75-692-1x1-1-75-692-4-0x0-1x1-1x1-0-NCHW-FP32-B=ConvOclDirectFwd1x1:1,128,1,1,0,4,16,4,0
384-114-211-1x1-240-114-211-8-0x0-1x1-1x1-0-NCHW-FP32-B=ConvOclDirectFwd1x1:1,256,1,1,0,2,16,8,0
128-27-27-3x3-32-27-27-256-1x1-1x1-1x1-0-NCHW-FP16-W=ConvAsmBwdWrW3x3:0,0,8,2,2,8
1792-114-7-1x1-640-114-7-1-0x0-1x1-1x1-0-NCHW-FP32-F=ConvOclDirectFwd1x1:1,64,1,1,1,1,16,2048,0;ConvAsm1x1U:2,16,5,64,1,2,4,1
192-17-17-1x1-768-17-17-64-0x0-1x1-1x1-0-NCHW-FP16-B=ConvOclDirectFwd1x1:16,64,32,32,0,1,16,4,1;ConvAsm1x1U:1,16,2,32,1,2,1,2
992-737-25-1x1-768-737-25-4-0x0-1x1-1x1-0-NCHW-FP32-F=ConvOclDirectFwd1x1:1,64,1,1,1,1,16,256,0
3-84-217-1x1-192-84-217-16-0x0-1x1-1x1-0-NCHW-FP32-B=ConvOclDirectFwd1x1:1,256,1,1,0,4,4,4,0;ConvAsm1x1U:1,8,2,64,1,1,1,1
256-56-56-1x1-64-56-56-16-0x0-1x1-1x1-0-NCHW-FP16-B=ConvOclDirectFwd1x1:1,64,1,1,0,4,16,4,0;ConvAsm1x1U:1,16,2,64,1,2,4,1
1200-58-580-1x1-288-58-580-1-0x0-1x1-1x1-0-NCHW-FP32-F=ConvOclDirectFwd1x1:1,64,1,1,1,4,64,2048,0
32-149-149-3x3-3-299-299-256-0x0-2x2-1x1-0-NCHW-FP32-B=ConvOclDirectFwd:16,16,32,32,2,2,8,2,1
608-53-105-1x1-64-53-105-8-0x0-1x1-1x1-0-NCHW-FP32-F=ConvOclDirectFwd1x1:1,64,1,1,1,1,16,2048,0;ConvAsm1x1U:3,16,3,64,4,1,1,2
320-498-278-1x1-128-498-278-2-0x0-1x1-1x1-0-NCHW-FP32-B=ConvOclDirectFwd1x1:1,64,1,1,0,4,16,8,0
480-28-28-1x1-128-28-28-256-0x0-1x1-1x1-0-NCHW-FP16-F=ConvOclDirectFwd1x1:1,64,1,1,0,4,16,4,0;ConvAsm1x1U:2,8,4,16,1,4,1,4
416-14-14-1x1-128-14-14-128-0x0-1x1-1x1-0-NCHW-FP16-B=ConvOclDirectFwd1x1:1,64,1,1,0,2,32,8,0;ConvAsm1x1U:1,16,2,16,1,2,2,4
512-493-456-1x1-416-493-456-1-0x0-1x1-1x1-0-NCHW-FP32-F=ConvOclDirectFwd1x1:1,64,1,1,1,1,64,2048,0
8-382-731-1x1-128-382-731-1-0x0-1x1-1x1-0-NCHW-FP32-B=ConvOclDirectFwd1x1:1,256,1,1,0,2,32,4,0
512-19-19-3x3-256-38-38-32-1x1-2x2-1x1-0-NCHW-FP32-W=ConvAsmBwdWrW3x3:0,0,8,8,1,1
1296-225-116-1x1-288-225-116-6-0x0-1x1-1x1-0-NCHW-FP32-F=ConvOclDirectFwd1x1:1,64,1,1,1,0,64,2048,0
480-420-131-1x1-232-420-131-12-0x0-1x1-1x1-0-NCHW-FP32-B=ConvOclDirectFwd1x1:1,256,1,1,0,2,8,4,0
928-168-1010-1x1-416-168-1010-2-0x0-1x1-1x1-0-NCHW-FP32-F=ConvOclDirectFwd1x1:1,64,1,1,1,0,64,2048,0
64-411-41-1x1-464-411-41-1-0x0-1x1-1x1-0-NCHW-FP32-B=ConvOclDirectFwd1x1:1,256,1,1,0,1,16,8,0
1056-41-391-1x1-1856-41-391-12-0x0-1x1-1x1-0-NCHW-FP32-B=ConvOclDirectFwd1x1:1,128,1,1,0,1,32,4,0
128-29-29-3x3-128-57-57-256-1x1-2x2-1x1-0-NCHW-FP32-B=ConvOclDirectFwd:16,16,16,32,1,2,8,1,2
528-4-112-1x1-80-4-112-32-0x0-1x1-1x1-0-NCHW-FP32-F=ConvOclDirectFwd1x1:1,64,1,1,1,0,64,2048,0;ConvAsm1x1U:3,16,3,64,4,2,2,1
640-14-14-1x1-128-14-14-64-0x0-1x1-1x1-0-NCHW-FP16-W=ConvAsmBwdWrW1x1:2,8,2,8,2,1,4,4,0,2
24-10-947-1x1-768-10-947-64-0x0-1x1-1x1-0-NCHW-FP32-F=ConvOclDirectFwd1x1:1,256,1,1,0,2,32,4,0
64-55-55-1x1-64-55-55-32-0x0-1x1-1x1-0-NCHW-FP32-B=ConvOclDirectFwd1x1:1,256,1,1,0,1,32,4,0;ConvAsm1x1U:2,32,2,64,1,1,2,1
512-14-14-1x1-128-28-28-1-0x0-2x2-1x1-0-NCHW-FP16-W=ConvAsmBwdWrW1x1:2,8,2,2,2,1,1,4,0,1
4-2-2-3x3-3-1-1-256-0x0-2x2-1x1-0-NCHW-FP32-F=ConvOclDirectFwd:8,8,8,8,1,1,1,4,2
16-98-322-1x1-96-98-322-1-0x0-1x1-1x1-0-NCHW-FP32-B=ConvOclDirectFwd1x1:1,256,1,1,0,1,32,4,0;ConvAsm1x1U:1,32,3,64,1,1,1,1
544-323-44-1x1-64-323-44-12-0x0-1x1-1x1-0-NCHW-FP32-W=ConvAsmBwdWrW1x1:2,8,2,4,2,1,1,2,0,1
736-7-7-1x1-128-7-7-16-0x0-1x1-1x1-0-NCHW-FP16-F=ConvOclDirectFwd1x1:1,64,1,1,0,1,4,8,0;ConvAsm1x1U:1,8,2,16,1,4,4,1
64-398-699-1x1-160-398-699-4-0x0-1x1-1x1-0-NCHW-FP32-F=ConvOclDirectFwd1x1:1,64,1,1,1,4,64,2048,0
128-112-112-3x3-128-112-112-32-1x1-1x1-1x1-0-NCHW-FP32-W=ConvAsmBwdWrW3x3:0,0,16,4,2,1
128-14-14-1x1-864-14-14-512-0x0-1x1-1x1-0-NCHW-FP16-W=ConvAsmBwdWrW1x1:2,8,4,8,2,1,2,4,0,1
128-14-14-1x1-352-14-14-512-0x0-1x1-1x1-0-NCHW-FP32-F=ConvOclDirectFwd1x1:1,64,1,1,1,0,32,256,0;ConvAsm1x1U:4,8,4,32,1,4,1,4
576-4-4-1x1-128-4-4-32-0x0-1x1-1x1-0-NCHW-FP32-F=ConvOclDirectFwd1x1:1,64,1,1,1,4,16,128,0;ConvAsm1x1U:1,8,1,16,1,4,4,1;ConvActivAsm1x1U:1,16,1,16,1,4
4-335-616-1x1-352-335-616-1-0x0-1x1-1x1-0-NCHW-FP32-F=ConvOclDirectFwd1x1:1,128,1,1,0,2,32,4,0
384-8-8-1x1-1536-8-8-128-0x0-1x1-1x1-0-NCHW-FP32-W=ConvAsmBwdWrW1x1:2,8,4,4,8,1,2,4,0,1
3-685-973-1x1-80-685-973-1-0x0-1x1-1x1-0-NCHW-FP32-B=ConvOclDirectFwd1x1:1,256,1,1,0,1,16,4,0
80-73-73-3x3-192-71-71-1-0x0-1x1-1x1-0-NCHW-FP16-F=ConvOclDirectFwd:16,16,16,32,1,2,8,2,1;ConvOclDirectFwdFused:16,16,16,32,1,2,8,2,1
232-7-7-1x1-232-7-7-16-0x0-1x1-1x1-0-NCHW-FP32-W=ConvAsmBwdWrW1x1:1,16,2,4,2,1,2,4,0,1
512-15-15-1x1-1024-15-15-256-0x0-1x1-1x1-0-NCHW-FP32-W=ConvAsmBwdWrW1x1:1,16,4,8,4,1,1,4,0,2
232-14-14-1x1-232-14-14-2-0x0-1x1-1x1-0-NCHW-FP16-B=ConvOclDirectFwd1x1:1,64,1,1,0,1,16,8,0;ConvAsm1x1U:1,8,2,32,1,2,4,1
192-50-116-1x1-224-50-116-6-0x0-1x1-1x1-0-NCHW-FP32-F=ConvOclDirectFwd1x1:1,64,1,1,1,4,64,256,0;ConvAsm1x1U:4,16,6,64,1,2,1,4
384-8-8-1x1-1536-8-8-1-0x0-1x1-1x1-0-NCHW-FP32-B=ConvOclDirectFwd1x1:1,256,1,1,0,1,4,8,0;ConvAsm1x1U:1,8,1,64,1,4,4,2
1760-367-687-1x1-48-367-687-1-0x0-1x1-1x1-0-NCHW-FP32-F=ConvOclDirectFwd1x1:1,64,1,1,1,0,32,256,0
64-408-472-1x1-24-408-472-32-0x0-1x1-1x1-0-NCHW-FP32-B=ConvOclDirectFwd1x1:1,128,1,1,0,1,16,8,0
128-310-305-1x1-8-310-305-8-0x0-1x1-1x1-0-NCHW-FP32-F=ConvOclDirectFwd1x1:1,256,1,1,0,1,16,4,0
3-71-124-1x1-1056-71-124-32-0x0-1x1-1x1-0-NCHW-FP32-F=ConvOclDirectFwd1x1:1,128,1,1,0,2,32,4,0
24-347-130-1x1-448-347-130-1-0x0-1x1-1x1-0-NCHW-FP32-B=ConvOclDirectFwd1x1:1,128,1,1,0,2,32,4,0
1632-234-989-1x1-4-234-989-1-0x0-1x1-1x1-0-NCHW-FP32-F=ConvOclDirectFwd1x1:1,256,1,1,0,2,16,8,0
80-112-116-1x1-288-112-116-8-0x0-1x1-1x1-0-NCHW-FP32-B=ConvOclDirectFwd1x1:1,256,1,1,0,2,32,4,0;ConvAsm1x1U:1,32,7,64,1,1,1,1
1056-198-498-1x1-80-198-498-4-0x0-1x1-1x1-0-NCHW-FP32-F=ConvOclDirectFwd1x1:1,64,1,1,1,4,64,2048,0
512-14-14-1x1-2048-14-14-64-0x0-1x1-1x1-0-NCHW-FP32-B=ConvOclDirectFwd1x1:1,256,1,1,0,4,16,8,0;ConvAsm1x1U:1,16,1,32,2,2,1,4
288-446-518-1x1-1000-446-518-1-0x0-1x1-1x1-0-NCHW-FP32-B=ConvOclDirectFwd1x1:1,256,1,1,0,4,16,4,0
3-225-225-7x7-64-112-112-128-2x2-2x2-1x1-0-NCHW-FP32-F=ConvOclDirectFwd:16,8,16,16,1,2,8,1,1;ConvOclDirectFwdFused:16,8,16,16,1,2,8,1,1
4-983-463-1x1-80-983-463-4-0x0-1x1-1x1-0-NCHW-FP32-B=ConvOclDirectFwd1x1:1,64,1,1,0,1,4,4,0
256-56-56-1x1-128-56-56-64-0x0-1x1-1x1-0-NCHW-FP16-B=ConvOclDirectFwd1x1:1,256,1,1,0,4,16,4,0;ConvAsm1x1U:1,16,2,64,1,2,1,4
992-14-14-1x1-128-14-14-64-0x0-1x1-1x1-0-NCHW-FP32-B=ConvOclDirectFwd1x1:1,64,1,1,0,4,16,4,0;ConvAsm1x1U:4,32,7,32,1,1,2,1
256-104-264-1x1-576-104-264-1-0x0-1x1-1x1-0-NCHW-FP32-F=ConvOclDirectFwd1x1:1,64,1,1,1,0,16,2048,0
192-28-28-1x1-128-28-28-32-0x0-1x1-1x1-0-NCHW-FP16-F=ConvOclDirectFwd1x1:1,128,1,1,0,4,16,4,0;ConvAsm1x1U:1,8,2,16,1,4,1,4
1664-408-400-1x1-448-408-400-1-0x0-1x1-1x1-0-NCHW-FP32-F=ConvOclDirectFwd1x1:1,64,1,1,1,1,16,256,0
128-14-14-1x1-544-14-14-256-0x0-1x1-1x1-0-NCHW-FP16-B=ConvOclDirectFwd1x1:1,256,1,1,0,2,32,4,0;ConvAsm1x1U:1,16,2,16,1,2,2,2
128-28-28-1x1-192-28-28-256-0x0-1x1-1x1-0-NCHW-FP16-F=ConvOclDirectFwd1x1:1,128,1,1,0,4,16,4,0;ConvAsm1x1U:1,8,2,16,2,4,1,4
192-71-71-3x3-192-35-35-128-0x0-2x2-1x1-0-NCHW-FP32-F=ConvOclDirectFwd:16,16,16,16,1,1,8,2,2
224-28-28-1x1-128-28-28-32-0x0-1x1-1x1-0-NCHW-FP16-F=ConvOclDirectFwd1x1:1,128,1,1,0,4,16,4,0;ConvAsm1x1U:1,8,2,32,2,4,1,4
64-35-35-5x5-48-35-35-32-2x2-1x1-1x1-0-NCHW-FP16-B=ConvOclDirectFwd:8,8,16,16,2,2,8,2,2
128-56-56-1x1-224-56-56-128-0x0-1x1-1x1-0-NCHW-FP32-W=ConvAsmBwdWrW1x1:4,4,4,4,4,1,2,4,0,1
256-57-57-1x1-128-57-57-64-0x0-1x1-1x1-0-NCHW-FP32-W=ConvAsmBwdWrW1x1:4,4,4,4,2,1,1,4,0,1
320-100-103-1x1-2160-100-103-4-0x0-1x1-1x1-0-NCHW-FP32-B=ConvOclDirectFwd1x1:1,256,1,1,0,2,16,8,0
4-680-893-1x1-8-680-893-4-0x0-1x1-1x1-0-NCHW-FP32-W=ConvAsmBwdWrW1x1:4,4,2,1,2,1,4,4,0,1
384-7-7-3x3-192-7-7-128-1x1-1x1-1x1-0-NCHW-FP16-B=ConvOclDirectFwd:8,8,8,8,1,1,8,4,1
64-35-35-1x1-192-35-35-256-0x0-1x1-1x1-0-NCHW-FP16-B=ConvOclDirectFwd1x1:1,256,1,1,0,1,32,4,0;ConvAsm1x1U:1,16,2,16,1,2,1,4
512-14-14-1x1-32-14-14-4-0x0-1x1-1x1-0-NCHW-FP32-F=ConvOclDirectFwd1x1:1,64,1,1,1,4,16,64,0;ConvAsm1x1U:1,8,1,16,1,4,4,1;ConvActivAsm1x1U:1,16,1,16,1,4
288-204-842-1x1-32-204-842-1-0x0-1x1-1x1-0-NCHW-FP32-F=ConvOclDirectFwd1x1:1,64,1,1,1,4,64,2048,0
64-13-13-1x1-256-13-13-128-0x0-1x1-1x1-0-NCHW-FP16-F=ConvOclDirectFwd1x1:8,64,16,16,0,1,16,4,1;ConvAsm1x1U:3,8,6,32,1,4,1,4
480-420-34-1x1-1024-420-34-12-0x0-1x1-1x1-0-NCHW-FP32-F=ConvOclDirectFwd1x1:1,64,1,1,1,1,16,2048,0
528-972-108-1x1-2112-972-108-2-0x0-1x1-1x1-0-NCHW-FP32-B=ConvOclDirectFwd1x1:1,128,1,1,0,2,32,4,0
192-128-256-1x1-64-128-256-1-0x0-1x1-1x1-0-NCHW-FP16-F=ConvOclDirectFwd1x1:1,256,1,1,0,4,16,4,0
116-417-315-1x1-24-417-315-32-0x0-1x1-1x1-0-NCHW-FP32-W=ConvAsmBwdWrW1x1:4,4,4,2,2,1,2,4,0,1
58-163-750-1x1-144-163-750-6-0x0-1x1-1x1-0-NCHW-FP32-F=ConvOclDirectFwd1x1:1,128,1,1,0,1,16,4,0
512-28-28-3x3-256-28-28-512-1x1-1x1-1x1-0-NCHW-FP16-B=ConvOclDirectFwd:16,8,32,32,2,4,8,1,1
58-84-246-1x1-1824-84-246-4-0x0-1x1-1x1-0-NCHW-FP32-B=ConvOclDirectFwd1x1:1,256,1,1,0,4,16,4,0
128-28-28-3x3-32-28-28-32-1x1-1x1-1x1-0-NCHW-FP16-W=ConvAsmBwdWrW3x3:0,1,8,2,2,8
288-732-611-1x1-3-732-611-4-0x0-1x1-1x1-0-NCHW-FP32-F=ConvOclDirectFwd1x1:1,256,1,1,0,4,8,4,0
24-488-891-1x1-2-488-891-48-0x0-1x1-1x1-0-NCHW-FP32-F=ConvOclDirectFwd1x1:1,256,1,1,0,4,16,4,0
384-162-94-1x1-1472-162-94-1-0x0-1x1-1x1-0-NCHW-FP32-B=ConvOclDirectFwd1x1:1,256,1,1,0,4,16,8,0
48-35-35-1x1-256-35-35-4-0x0-1x1-1x1-0-NCHW-FP32-W=ConvAsmBwdWrW1x1:4,4,2,4,2,1,1,4,0,2
64-253-355-1x1-320-253-355-6-0x0-1x1-1x1-0-NCHW-FP32-F=ConvOclDirectFwd1x1:16,16,32,32,1,0,32,128,1
768-538-677-1x1-832-538-677-1-0x0-1x1-1x1-0-NCHW-FP32-B=ConvOclDirectFwd1x1:1,256,1,1,0,2,32,4,0
928-7-7-1x1-128-7-7-512-0x0-1x1-1x1-0-NCHW-FP16-B=ConvOclDirectFwd1x1:1,256,1,1,0,1,16,4,0;ConvAsm1x1U:1,16,2,32,1,2,4,1
1-959-795-1x1-32-959-795-12-0x0-1x1-1x1-0-NCHW-FP32-F=ConvOclDirectFwd1x1:1,256,1,1,0,1,16,4,0
576-4-621-1x1-640-4-621-1-0x0-1x1-1x1-0-NCHW-FP32-B=ConvOclDirectFwd1x1:1,128,1,1,0,2,32,4,0;ConvAsm1x1U:1,16,1,64,1,2,2,2
128-28-28-1x1-192-28-28-128-0x0-1x1-1x1-0-NCHW-FP32-W=ConvAsmBwdWrW1x1:2,8,2,8,4,2,4,4,0,1
128-7-7-3x3-32-7-7-32-1x1-1x1-1x1-0-NCHW-FP32-W=ConvAsmBwdWrW3x3:0,1,8,2,6,3
384-536-142-1x1-128-536-142-2-0x0-1x1-1x1-0-NCHW-FP32-F=ConvOclDirectFwd1x1:1,64,1,1,1,0,16,2048,0
16-28-28-5x5-32-28-28-512-2x2-1x1-1x1-0-NCHW-FP16-F=ConvOclDirectFwd:16,16,32,32,2,2,8,1,2;ConvOclDirectFwdFused:16,16,32,32,2,2,8,1,2
48-110-1017-1x1-58-110-1017-4-0x0-1x1-1x1-0-NCHW-FP32-B=ConvOclDirectFwd1x1:1,256,1,1,0,1,16,8,0
160-88-204-1x1-24-88-204-12-0x0-1x1-1x1-0-NCHW-FP32-F=ConvOclDirectFwd1x1:1,128,1,1,0,2,16,8,0;ConvAsm1x1U:3,8,7,64,3,1,1,1
192-14-14-1x1-512-14-14-64-0x0-1x1-1x1-0-NCHW-FP32-W=ConvAsmBwdWrW1x1:1,16,2,4,8,1,2,4,0,1
192-17-17-1x1-768-17-17-256-0x0-1x1-1x1-0-NCHW-FP16-W=ConvAsmBwdWrW1x1:2,8,4,4,4,2,4,4,0,1
128-250-128-1x1-144-250-128-4-0x0-1x1-1x1-0-NCHW-FP32-F=ConvOclDirectFwd1x1:16,16,32,32,1,0,32,128,1
192-17-17-3x3-192-8-8-128-0x0-2x2-1x1-0-NCHW-FP32-F=ConvOclDirectFwd:8,8,8,8,1,1,8,2,2
480-986-176-1x1-2-986-176-6-0x0-1x1-1x1-0-NCHW-FP32-F=ConvOclDirectFwd1x1:1,256,1,1,0,4,16,4,0
2048-95-114-1x1-24-95-114-6-0x0-1x1-1x1-0-NCHW-FP32-B=ConvOclDirectFwd1x1:1,64,1,1,0,2,16,8,0
128-14-14-1x1-256-14-14-16-0x0-1x1-1x1-0-NCHW-FP16-B=ConvOclDirectFwd1x1:1,64,1,1,0,4,8,4,0;ConvAsm1x1U:1,8,2,16,1,2,2,2
512-29-29-1x1-256-29-29-64-0x0-1x1-1x1-0-NCHW-FP32-F=ConvOclDirectFwd1x1:1,64,1,1,1,1,16,2048,0;ConvAsm1x1U:3,16,6,16,2,2,1,2
64-112-112-3x3-128-112-112-4-1x1-1x1-1x1-0-NCHW-FP16-F=ConvOclDirectFwd:8,16,16,16,2,1,8,4,2;ConvOclDirectFwdFused:8,16,16,16,2,1,8,4,2
1872-368-67-1x1-544-368-67-4-0x0-1x1-1x1-0-NCHW-FP32-F=ConvOclDirectFwd1x1:1,64,1,1,1,1,64,2048,0
512-28-28-1x1-256-14-14-2-0x0-2x2-1x1-0-NCHW-FP32-F=ConvOclDirectFwd1x1:1,64,1,1,1,4,16,64,0;ConvAsm1x1U:1,8,1,64,1,4,2,1
48-111-493-1x1-2-111-493-8-0x0-1x1-1x1-0-NCHW-FP32-B=ConvOclDirectFwd1x1:1,64,1,1,0,1,16,8,0;ConvAsm1x1U:1,1,1,4,1,1,1,2
64-13-13-3x3-256-13-13-32-1x1-1x1-1x1-0-NCHW-FP16-F=ConvOclDirectFwd:8,8,16,16,2,2,8,4,2
720-45-209-1x1-960-45-209-8-0x0-1x1-1x1-0-NCHW-FP32-F=ConvOclDirectFwd1x1:1,64,1,1,1,4,32,2048,0
1776-45-529-1x1-704-45-529-4-0x0-1x1-1x1-0-NCHW-FP32-F=ConvOclDirectFwd1x1:1,64,1,1,1,4,16,2048,0
704-7-7-1x1-128-7-7-256-0x0-1x1-1x1-0-NCHW-FP16-W=ConvAsmBwdWrW1x1:2,8,2,8,2,1,2,4,0,1
704-7-7-1x1-128-7-7-256-0x0-1x1-1x1-0-NCHW-FP32-B=ConvOclDirectFwd1x1:8,64,8,8,0,1,16,4,1;ConvAsm1x1U:1,16,1,64,2,2,4,1
256-17-17-1x1-1024-17-17-128-0x0-1x1-1x1-0-NCHW-FP32-W=ConvAsmBwdWrW1x1:2,8,4,4,8,1,1,4,0,1
192-35-35-3x3-224-35-35-1-1x1-1x1-1x1-0-NCHW-FP16-F=ConvOclDirectFwd:16,16,16,16,1,1,8,2,1;ConvOclDirectFwdFused:8,16,16,16,2,1,4,2,1
48-773-11-1x1-608-773-11-32-0x0-1x1-1x1-0-NCHW-FP32-W=ConvAsmBwdWrW1x1:2,8,2,4,2,1,1,2,0,1
96-986-146-1x1-96-986-146-12-0x0-1x1-1x1-0-NCHW-FP32-W=ConvAsmBwdWrW1x1:4,4,4,2,8,1,4,4,0,1
992-7-7-1x1-128-7-7-64-0x0-1x1-1x1-0-NCHW-FP32-B=ConvOclDirectFwd1x1:1,64,1,1,0,1,8,4,0;ConvAsm1x1U:4,8,4,16,1,4,2,4
864-825-8-1x1-2-825-8-32-0x0-1x1-1x1-0-NCHW-FP32-W=ConvAsmBwdWrW1x1:4,4,2,1,2,1,1,2,0,1
2-739-280-1x1-64-739-280-32-0x0-1x1-1x1-0-NCHW-FP32-F=ConvOclDirectFwd1x1:1,256,1,1,0,1,64,4,0
736-273-776-1x1-48-273-776-2-0x0-1x1-1x1-0-NCHW-FP32-B=ConvOclDirectFwd1x1:1,256,1,1,0,2,16,4,0
1600-665-447-1x1-2-665-447-1-0x0-1x1-1x1-0-NCHW-FP32-F=ConvOclDirectFwd1x1:1,64,1,1,0,1,16,8,0
32-35-35-1x1-192-35-35-512-0x0-1x1-1x1-0-NCHW-FP16-W=ConvAsmBwdWrW1x1:2,8,2,4,2,1,4,4,0,1
96-25-107-1x1-128-25-107-128-0x0-1x1-1x1-0-NCHW-FP32-F=ConvOclDirectFwd1x1:16,16,32,32,1,0,32,128,1;ConvAsm1x1U:1,16,1,64,2,2,2,1
352-7-7-1x1-1024-7-7-64-0x0-1x1-1x1-0-NCHW-FP16-B=ConvOclDirectFwd1x1:1,256,1,1,0,1,8,4,0;ConvAsm1x1U:1,16,2,32,1,2,2,2
544-170-677-1x1-19-170-677-4-0x0-1x1-1x1-0-NCHW-FP32-F=ConvOclDirectFwd1x1:1,256,1,1,0,2,4,4,0
320-585-196-1x1-16-585-196-1-0x0-1x1-1x1-0-NCHW-FP32-F=ConvOclDirectFwd1x1:1,64,1,1,1,4,64,2048,0
4-293-66-1x1-864-293-66-2-0x0-1x1-1x1-0-NCHW-FP32-W=ConvAsmBwdWrW1x1:4,4,2,1,4,1,2,4,0,1
128-7-7-1x1-576-7-7-32-0x0-1x1-1x1-0-NCHW-FP16-B=ConvOclDirectFwd1x1:1,64,1,1,0,1,8,4,0;ConvAsm1x1U:1,16,2,32,1,2,2,2
448-217-165-1x1-576-217-165-16-0x0-1x1-1x1-0-NCHW-FP32-F=ConvOclDirectFwd1x1:1,64,1,1,1,4,32,2048,0
54-55-55-1x1-24-55-55-256-0x0-1x1-1x1-0-NCHW-FP16-W=ConvAsmBwdWrW1x1:4,4,2,2,2,1,4,4,0,3
1-39-744-1x1-32-39-744-128-0x0-1x1-1x1-0-NCHW-FP32-B=ConvOclDirectFwd1x1:1,64,1,1,0,2,32,4,0;ConvAsm1x1U:1,8,1,16,1,1,1,1
192-35-35-3x3-192-71-71-128-0x0-2x2-1x1-0-NCHW-FP32-B=ConvOclDirectFwd:16,16,16,16,1,1,4,1,1
1024-25-815-1x1-1344-25-815-1-0x0-1x1-1x1-0-NCHW-FP32-B=ConvOclDirectFwd1x1:1,256,1,1,0,1,32,4,0
1024-14-14-1x1-512-28-28-32-0x0-2x2-1x1-0-NCHW-FP32-B=ConvOclDirectFwd1x1:1,256,1,1,0,1,32,4,0;ConvAsm1x1U:2,16,2,64,2,2,2,2
80-73-73-1x1-64-73-73-256-0x0-1x1-1x1-0-NCHW-FP16-W=ConvAsmBwdWrW1x1:4,4,4,4,2,1,4,4,0,1
192-28-773-1x1-192-28-773-2-0x0-1x1-1x1-0-NCHW-FP32-W=ConvAsmBwdWrW1x1:4,4,4,4,8,1,2,4,0,1
320-323-636-1x1-1440-323-636-1-0x0-1x1-1x1-0-NCHW-FP32-B=ConvOclDirectFwd1x1:1,256,1,1,0,2,32,4,0
544-289-909-1x1-1760-289-909-1-0x0-1x1-1x1-0-NCHW-FP32-B=ConvOclDirectFwd1x1:1,64,1,1,0,1,32,4,0
224-585-72-1x1-512-585-72-16-0x0-1x1-1x1-0-NCHW-FP32-F=ConvOclDirectFwd1x1:1,64,1,1,1,4,32,2048,0
64-57-57-1x1-128-57-57-128-0x0-1x1-1x1-0-NCHW-FP32-F=ConvOclDirectFwd1x1:1,64,1,1,1,0,64,2048,0;ConvAsm1x1U:1,8,1,64,1,4,1,4
64-904-13-1x1-128-904-13-16-0x0-1x1-1x1-0-NCHW-FP32-W=ConvAsmBwdWrW1x1:4,4,2,4,4,1,2,2,0,3
3-770-117-1x1-624-770-117-2-0x0-1x1-1x1-0-NCHW-FP32-B=ConvOclDirectFwd1x1:1,128,1,1,0,2,4,4,0
144-339-173-1x1-96-339-173-4-0x0-1x1-1x1-0-NCHW-FP32-B=ConvOclDirectFwd1x1:1,256,1,1,0,1,32,4,0
64-112-112-1x1-64-112-112-128-0x0-1x1-1x1-0-NCHW-FP32-F=ConvOclDirectFwd1x1:1,64,1,1,1,1,64,256,0;ConvAsm1x1U:1,32,1,64,1,1,1,1
960-132-813-1x1-512-132-813-4-0x0-1x1-1x1-0-NCHW-FP32-B=ConvOclDirectFwd1x1:1,256,1,1,0,2,32,4,0
1392-499-640-1x1-832-499-640-1-0x0-1x1-1x1-0-NCHW-FP32-F=ConvOclDirectFwd1x1:1,64,1,1,1,4,16,2048,0
832-7-7-1x1-32-7-7-256-0x0-1x1-1x1-0-NCHW-FP16-F=ConvOclDirectFwd1x1:1,64,1,1,0,1,8,4,0;ConvAsm1x1U:2,8,4,16,1,4,4,1
992-14-14-1x1-128-14-14-16-0x0-1x1-1x1-0-NCHW-FP32-B=ConvOclDirectFwd1x1:1,64,1,1,0,1,8,4,0;ConvAsm1x1U:2,16,2,64,1,2,4,1
128-28-28-1x1-512-14-14-8-0x0-2x2-1x1-0-NCHW-FP32-F=ConvOclDirectFwd1x1:1,64,1,1,1,4,16,2048,0;ConvAsm1x1U:2,16,2,64,1,2,2,1
288-56-56-1x1-192-56-56-16-0x0-1x1-1x1-0-NCHW-FP16-F=ConvOclDirectFwd1x1:1,128,1,1,0,4,16,4,0;ConvAsm1x1U:1,8,2,32,1,4,1,4
480-14-14-1x1-96-14-14-4-0x0-1x1-1x1-0-NCHW-FP16-F=ConvOclDirectFwd1x1:1,256,1,1,0,4,4,4,0;ConvAsm1x1U:1,8,2,16,1,4,4,1
128-14-14-1x1-736-14-14-64-0x0-1x1-1x1-0-NCHW-FP32-B=ConvOclDirectFwd1x1:1,256,1,1,0,2,32,4,0;ConvAsm1x1U:1,16,1,64,2,2,2,2
480-103-636-1x1-16-103-636-2-0x0-1x1-1x1-0-NCHW-FP32-F=ConvOclDirectFwd1x1:1,64,1,1,1,1,64,2048,0
112-756-316-1x1-192-756-316-8-0x0-1x1-1x1-0-NCHW-FP32-B=ConvOclDirectFwd1x1:1,128,1,1,0,1,32,4,0
2-94-80-1x1-864-94-80-1-0x0-1x1-1x1-0-NCHW-FP32-F=ConvOclDirectFwd1x1:1,128,1,1,0,2,4,4,0
704-73-797-1x1-960-73-797-1-0x0-1x1-1x1-0-NCHW-FP32-F=ConvOclDirectFwd1x1:1,64,1,1,1,1,16,2048,0
128-616-93-1x1-416-616-93-4-0x0-1x1-1x1-0-NCHW-FP32-B=ConvOclDirectFwd1x1:1,128,1,1,0,2,32,4,0
16-1010-41-1x1-1664-1010-41-6-0x0-1x1-1x1-0-NCHW-FP32-B=ConvOclDirectFwd1x1:1,256,1,1,0,2,32,4,0
448-144-927-1x1-256-144-927-1-0x0-1x1-1x1-0-NCHW-FP32-B=ConvOclDirectFwd1x1:1,64,1,1,0,2,32,4,0
64-224-224-3x3-3-224-224-64-1x1-1x1-1x1-0-NCHW-FP16-W=ConvAsmBwdWrW3x3:0,1,16,1,1,4
192-423-490-1x1-192-423-490-1-0x0-1x1-1x1-0-NCHW-FP32-F=ConvOclDirectFwd1x1:1,64,1,1,1,4,16,2048,0
1-909-149-1x1-192-909-149-6-0x0-1x1-1x1-0-NCHW-FP32-F=ConvOclDirectFwd1x1:1,256,1,1,0,1,8,4,0
192-27-27-5x5-64-27-27-32-2x2-1x1-1x1-0-NCHW-FP16-F=ConvOclDirectFwd:16,16,32,32,2,2,8,1,2
160-14-14-1x1-528-14-14-512-0x0-1x1-1x1-0-NCHW-FP32-B=ConvOclDirectFwd1x1:1,256,1,1,0,2,16,4,0;ConvAsm1x1U:1,16,1,32,2,1,2,2
128-492-132-1x1-1-492-132-16-0x0-1x1-1x1-0-NCHW-FP32-W=ConvAsmBwdWrW1x1:4,4,2,1,2,1,2,4,0,1
116-198-211-1x1-80-198-211-1-0x0-1x1-1x1-0-NCHW-FP32-B=ConvOclDirectFwd1x1:16,64,32,32,0,2,16,4,1
16-494-236-1x1-1104-494-236-2-0x0-1x1-1x1-0-NCHW-FP32-F=ConvOclDirectFwd1x1:1,64,1,1,1,1,32,128,0
4-142-19-1x1-160-142-19-512-0x0-1x1-1x1-0-NCHW-FP32-B=ConvOclDirectFwd1x1:1,256,1,1,0,2,32,4,0;ConvAsm1x1U:1,8,1,16,1,1,1,1
120-7-7-3x3-120-14-14-128-1x1-2x2-1x1-0-NCHW-FP16-W=ConvAsmBwdWrW3x3:0,0,8,2,9,2
32-5-330-1x1-64-5-330-2048-0x0-1x1-1x1-0-NCHW-FP32-B=ConvOclDirectFwd1x1:1,256,1,1,0,2,32,4,0;ConvAsm1x1U:1,8,1,16,1,1,1,1
1024-179-116-1x1-1008-179-116-8-0x0-1x1-1x1-0-NCHW-FP32-B=ConvOclDirectFwd1x1:1,128,1,1,0,4,16,8,0
416-245-104-1x1-80-245-104-8-0x0-1x1-1x1-0-NCHW-FP32-W=ConvAsmBwdWrW1x1:4,4,4,4,4,1,1,4,0,1
16-83-338-1x1-4-83-338-2-0x0-1x1-1x1-0-NCHW-FP32-W=ConvAsmBwdWrW1x1:4,4,2,1,2,1,2,4,0,3
240-287-52-1x1-672-287-52-1-0x0-1x1-1x1-0-NCHW-FP32-F=ConvOclDirectFwd1x1:1,64,1,1,1,4,64,2048,0
144-14-14-1x1-512-14-14-4-0x0-1x1-1x1-0-NCHW-FP16-B=ConvOclDirectFwd1x1:1,64,1,1,0,4,4,4,0;ConvAsm1x1U:1,8,2,64,1,4,2,1
64-478-98-1x1-1776-478-98-4-0x0-1x1-1x1-0-NCHW-FP32-B=ConvOclDirectFwd1x1:1,128,1,1,0,4,16,8,0
128-6-60-3x3-64-6-60-256-1x1-1x1-1x1-0-NCHW-FP32-W=ConvAsmBwdWrW3x3:0,0,16,4,6,1
192-7-7-1x1-1584-7-7-16-0x0-1x1-1x1-0-NCHW-FP16-B=ConvOclDirectFwd1x1:1,128,1,1,0,1,8,4,0;ConvAsm1x1U:1,8,2,32,1,2,2,2
24-387-502-1x1-19-387-502-64-0x0-1x1-1x1-0-NCHW-FP32-F=ConvOclDirectFwd1x1:1,256,1,1,0,2,16,4,0
64-112-112-7x7-3-224-224-256-3x3-2x2-1x1-0-NCHW-FP16-W=ConvOclBwdWrW2<1>:3,7,3,3,7;ConvOclBwdWrW2<16>:3,10,3,1,7;ConvOclBwdWrW2<8>:3,6,1,3,7;ConvOclBwdWrW2<4>:8,10,1,3,7;ConvOclBwdWrW2<2>:3,11,3,3,7
1000-657-620-1x1-192-657-620-1-0x0-1x1-1x1-0-NCHW-FP32-B=ConvOclDirectFwd1x1:1,128,1,1,0,1,32,4,0
32-28-28-5x5-16-28-28-1-2x2-1x1-1x1-0-NCHW-FP16-B=ConvOclDirectFwd:16,16,16,16,1,1,1,4,1
96-35-35-3x3-64-35-35-1-1x1-1x1-1x1-0-NCHW-FP32-W=ConvAsmBwdWrW3x3:0,1,16,2,2,1
3-230-230-7x7-64-112-112-4-0x0-2x2-1x1-0-NCHW-FP32-F=ConvOclDirectFwd:16,16,16,32,1,2,8,1,2;ConvOclDirectFwdFused:16,16,16,32,1,2,8,1,2
240-14-14-1x1-60-14-14-512-0x0-1x1-1x1-0-NCHW-FP32-B_g3=ConvOclDirectFwd:16,8,16,8,1,1,8,4,1
544-964-10-1x1-736-964-10-16-0x0-1x1-1x1-0-NCHW-FP32-B=ConvOclDirectFwd1x1:1,256,1,1,0,4,16,4,0
608-38-202-1x1-1856-38-202-1-0x0-1x1-1x1-0-NCHW-FP32-B=ConvOclDirectFwd1x1:1,256,1,1,0,4,16,8,0
288-35-35-1x1-64-35-35-4-0x0-1x1-1x1-0-NCHW-FP32-F=ConvOclDirectFwd1x1:1,64,1,1,1,1,16,128,0;ConvAsm1x1U:2,8,2,64,1,4,2,2;ConvActivAsm1x1U:2,16,3,32,1,4
232-642-242-1x1-2-642-242-1-0x0-1x1-1x1-0-NCHW-FP32-B=ConvOclDirectFwd1x1:1,256,1,1,0,2,16,8,0
64-112-112-7x7-3-224-224-256-3x3-2x2-1x1-0-NCHW-FP16-B=ConvOclDirectFwd:8,32,32,32,4,1,2,2,2
160-563-268-1x1-928-563-268-2-0x0-1x1-1x1-0-NCHW-FP32-B=ConvOclDirectFwd1x1:1,256,1,1,0,1,32,4,0
960-591-60-1x1-54-591-60-12-0x0-1x1-1x1-0-NCHW-FP32-F=ConvOclDirectFwd1x1:1,256,1,1,0,1,16,4,0
64-496-141-1x1-576-496-141-8-0x0-1x1-1x1-0-NCHW-FP32-F=ConvOclDirectFwd1x1:16,16,32,32,1,0,32,128,1
160-709-879-1x1-3-709-879-4-0x0-1x1-1x1-0-NCHW-FP32-F=ConvOclDirectFwd1x1:1,128,1,1,0,1,16,8,0
16-824-94-1x1-32-824-94-2-0x0-1x1-1x1-0-NCHW-FP32-F=ConvOclDirectFwd1x1:1,64,1,1,1,0,64,2048,0;ConvAsm1x1U:3,32,3,64,2,1,1,1
96-14-14-1x1-480-14-14-512-0x0-1x1-1x1-0-NCHW-FP16-W=ConvAsmBwdWrW1x1:2,8,2,8,2,1,4,4,0,3
96-35-35-3x3-96-35-35-512-1x1-1x1-1x1-0-NCHW-FP16-F=ConvOclDirectFwd:8,8,16,16,2,2,8,4,2
432-397-232-1x1-4-397-232-4-0x0-1x1-1x1-0-NCHW-FP32-F=ConvOclDirectFwd1x1:1,256,1,1,0,4,16,4,0
128-54-54-1x1-32-54-54-32-0x0-1x1-1x1-0-NCHW-FP32-F=ConvOclDirectFwd1x1:1,64,1,1,1,0,32,256,0;ConvAsm1x1U:2,16,2,64,2,1,1,1
128-14-14-1x1-512-14-14-16-0x0-1x1-1x1-0-NCHW-FP16-B=ConvOclDirectFwd1x1:1,256,1,1,0,4,8,4,0;ConvAsm1x1U:1,8,2,16,1,4,1,4
192-14-14-1x1-480-14-14-8-0x0-1x1-1x1-0-NCHW-FP16-B=ConvOclDirectFwd1x1:1,128,1,1,0,4,8,8,0;ConvAsm1x1U:1,16,2,16,1,2,2,8
58-8-293-1x1-232-8-293-64-0x0-1x1-1x1-0-NCHW-FP32-F=ConvOclDirectFwd1x1:1,256,1,1,0,1,16,4,0;ConvAsm1x1U:1,16,2,16,1,1,1,1
64-14-14-1x1-480-14-14-4-0x0-1x1-1x1-0-NCHW-FP32-W=ConvAsmBwdWrW1x1:2,8,2,4,4,1,4,4,0,0
116-514-319-1x1-720-514-319-2-0x0-1x1-1x1-0-NCHW-FP32-B=ConvOclDirectFwd1x1:1,256,1,1,0,2,16,4,0
128-28-28-1x1-480-28-28-64-0x0-1x1-1x1-0-NCHW-FP32-W=ConvAsmBwdWrW1x1:1,16,2,8,4,1,4,4,0,2
992-147-905-1x1-1-147-905-2-0x0-1x1-1x1-0-NCHW-FP32-F=ConvOclDirectFwd1x1:1,256,1,1,0,1,16,8,0
288-74-441-1x1-58-74-441-1-0x0-1x1-1x1-0-NCHW-FP32-W=ConvAsmBwdWrW1x1:4,4,4,4,2,1,1,4,0,1
320-314-4-1x1-480-314-4-2-0x0-1x1-1x1-0-NCHW-FP32-F=ConvOclDirectFwd1x1:1,64,1,1,1,1,16,2048,0;ConvAsm1x1U:3,16,5,64,1,2,2,1
64-27-27-3x3-256-27-27-512-1x1-1x1-1x1-0-NCHW-FP16-F=ConvOclDirectFwd:8,32,32,32,4,1,8,1,2
128-54-54-1x1-32-54-54-128-0x0-1x1-1x1-0-NCHW-FP16-F=ConvOclDirectFwd1x1:1,256,1,1,0,2,16,4,0;ConvAsm1x1U:1,8,2,64,1,4,2,2
80-989-184-1x1-1-989-184-16-0x0-1x1-1x1-0-NCHW-FP32-F=ConvOclDirectFwd1x1:1,256,1,1,0,2,16,8,0
192-27-27-5x5-64-27-27-32-2x2-1x1-1x1-0-NCHW-FP16-W=ConvOclBwdWrW2<1>:1,10,1,8,9;ConvOclBwdWrW2<16>:1,10,1,8,9;ConvOclBwdWrW2<8>:1,6,1,8,9;ConvOclBwdWrW2<4>:1,6,1,8,9;ConvOclBwdWrW2<2>:1,10,1,8,9
128-57-57-1x1-256-57-57-128-0x0-1x1-1x1-0-NCHW-FP32-F=ConvOclDirectFwd1x1:16,16,32,32,1,0,32,128,1;ConvAsm1x1U:1,8,1,64,1,4,1,8
256-29-29-3x3-256-57-57-1-1x1-2x2-1x1-0-NCHW-FP32-B_g32=ConvOclDirectFwd:32,32,32,32,1,1,4,2,1
1024-15-15-1x1-512-15-15-4-0x0-1x1-1x1-0-NCHW-FP32-F=ConvOclDirectFwd1x1:1,64,1,1,1,4,16,2048,0;ConvAsm1x1U:2,8,4,64,1,4,4,1
1280-318-141-1x1-1-318-141-6-0x0-1x1-1x1-0-NCHW-FP32-F=ConvOclDirectFwd1x1:1,256,1,1,0,1,16,8,0
1568-214-30-1x1-640-214-30-1-0x0-1x1-1x1-0-NCHW-FP32-F=ConvOclDirectFwd1x1:1,64,1,1,1,0,32,2048,0
120-14-14-3x3-120-14-14-4-1x1-1x1-1x1-0-NCHW-FP32-W=ConvAsmBwdWrW3x3:0,1,8,2,3,1
416-28-28-1x1-128-28-28-32-0x0-1x1-1x1-0-NCHW-FP32-B=ConvOclDirectFwd1x1:1,128,1,1,0,4,16,4,0;ConvAsm1x1U:2,16,2,32,1,2,4,1
816-4-722-1x1-896-4-722-2-0x0-1x1-1x1-0-NCHW-FP32-F=ConvOclDirectFwd1x1:1,64,1,1,1,0,16,2048,0;ConvAsm1x1U:4,16,6,64,1,2,2,2
116-28-300-1x1-64-28-300-256-0x0-1x1-1x1-0-NCHW-FP32-B=ConvOclDirectFwd1x1:1,64,1,1,0,1,32,4,0;ConvAsm1x1U:1,16,1,16,1,1,1,4
512-7-7-3x3-512-4-4-16-1x1-2x2-1x1-0-NCHW-FP32-F=ConvOclDirectFwd:8,8,8,8,1,1,8,1,2
2-209-35-1x1-160-209-35-16-0x0-1x1-1x1-0-NCHW-FP32-F=ConvOclDirectFwd1x1:1,128,1,1,0,1,4,4,0;ConvAsm1x1U:1,8,1,64,1,1,2,1
128-56-56-1x1-96-56-56-512-0x0-1x1-1x1-0-NCHW-FP32-W=ConvAsmBwdWrW1x1:2,8,2,8,2,1,4,4,0,1
192-7-7-1x1-2112-7-7-16-0x0-1x1-1x1-0-NCHW-FP32-B=ConvOclDirectFwd1x1:8,64,8,8,0,1,16,4,1;ConvAsm1x1U:2,16,2,32,1,2,2,2
128-7-7-1x1-832-7-7-8-0x0-1x1-1x1-0-NCHW-FP16-W=ConvAsmBwdWrW1x1:2,8,2,8,2,1,2,4,0,0
960-14-14-1x1-192-14-14-16-0x0-1x1-1x1-0-NCHW-FP16-F=ConvOclDirectFwd1x1:1,64,1,1,0,4,8,4,0;ConvAsm1x1U:2,8,4,64,1,4,4,2
2016-35-935-1x1-58-35-935-6-0x0-1x1-1x1-0-NCHW-FP32-F=ConvOclDirectFwd1x1:1,256,1,1,0,1,8,4,0
19-356-686-1x1-2-356-686-1-0x0-1x1-1x1-0-NCHW-FP32-W=ConvAsmBwdWrW1x1:4,4,2,1,2,1,1,4,0,3
96-426-354-1x1-832-426-354-1-0x0-1x1-1x1-0-NCHW-FP32-B=ConvOclDirectFwd1x1:1,256,1,1,0,4,16,8,0
992-28-500-1x1-224-28-500-6-0x0-1x1-1x1-0-NCHW-FP32-F=ConvOclDirectFwd1x1:1,64,1,1,1,1,64,2048,0
960-79-299-1x1-864-79-299-1-0x0-1x1-1x1-0-NCHW-FP32-B=ConvOclDirectFwd1x1:1,256,1,1,0,1,32,4,0
80-818-497-1x1-80-818-497-2-0x0-1x1-1x1-0-NCHW-FP32-B=ConvOclDirectFwd1x1:1,256,1,1,0,2,16,8,0
288-44-657-1x1-32-44-657-6-0x0-1x1-1x1-0-NCHW-FP32-B=ConvOclDirectFwd1x1:1,128,1,1,0,2,32,4,0
128-56-56-1x1-256-56-56-16-0x0-1x1-1x1-0-NCHW-FP32-B=ConvOclDirectFwd1x1:1,128,1,1,0,1,32,4,0;ConvAsm1x1U:1,32,1,64,1,1,1,1
64-35-35-1x1-288-35-35-256-0x0-1x1-1x1-0-NCHW-FP16-W=ConvAsmBwdWrW1x1:4,4,8,4,2,2,2,4,0,1
1-393-223-1x1-58-393-223-64-0x0-1x1-1x1-0-NCHW-FP32-W=ConvAsmBwdWrW1x1:4,4,2,1,2,1,2,4,0,1
416-621-150-1x1-352-621-150-8-0x0-1x1-1x1-0-NCHW-FP32-F=ConvOclDirectFwd1x1:1,64,1,1,1,0,64,2048,0
128-14-14-1x1-384-14-14-256-0x0-1x1-1x1-0-NCHW-FP16-B=ConvOclDirectFwd1x1:1,256,1,1,0,4,16,4,0;ConvAsm1x1U:1,16,2,16,1,2,1,4
3-644-324-1x1-64-644-324-6-0x0-1x1-1x1-0-NCHW-FP32-F=ConvOclDirectFwd1x1:1,256,1,1,0,1,64,4,0
16-14-14-5x5-48-14-14-256-2x2-1x1-1x1-0-NCHW-FP16-F=ConvOclDirectFwd:8,8,16,16,2,2,8,1,2;ConvOclDirectFwdFused:8,8,16,16,2,2,8,2,2
768-186-151-1x1-4-186-151-16-0x0-1x1-1x1-0-NCHW-FP32-F=ConvOclDirectFwd1x1:1,256,1,1,0,2,16,8,0
128-27-27-3x3-32-27-27-64-1x1-1x1-1x1-0-NCHW-FP32-W=ConvAsmBwdWrW3x3:0,0,8,4,2,4
672-714-65-1x1-832-714-65-8-0x0-1x1-1x1-0-NCHW-FP32-B=ConvOclDirectFwd1x1:1,128,1,1,0,2,32,4,0
64-14-14-1x1-512-14-14-8-0x0-1x1-1x1-0-NCHW-FP32-B=ConvOclDirectFwd1x1:1,128,1,1,0,4,8,4,0;ConvAsm1x1U:1,8,1,64,1,4,1,2
256-56-56-3x3-256-56-56-256-1x1-1x1-1x1-0-NCHW-FP32-W=ConvAsmBwdWrW3x3:0,1,8,4,2,1
1-495-226-1x1-192-495-226-4-0x0-1x1-1x1-0-NCHW-FP32-B=ConvOclDirectFwd1x1:1,256,1,1,0,2,16,4,0
8-45-411-1x1-576-45-411-12-0x0-1x1-1x1-0-NCHW-FP32-W=ConvAsmBwdWrW1x1:4,4,4,2,4,1,4,4,0,2
384-17-17-3x3-384-35-35-32-0x0-2x2-1x1-0-NCHW-FP32-B=ConvOclDirectFwd:16,16,16,16,1,1,4,1,1
384-8-8-1x1-1536-8-8-64-0x0-1x1-1x1-0-NCHW-FP16-B=ConvOclDirectFwd1x1:1,64,1,1,0,4,16,4,0;ConvAsm1x1U:1,16,2,32,1,2,2,2
4-647-556-1x1-832-647-556-1-0x0-1x1-1x1-0-NCHW-FP32-B=ConvOclDirectFwd1x1:1,256,1,1,0,2,32,4,0
512-14-14-3x3-512-14-14-8-1x1-1x1-1x1-0-NCHW-FP16-F=ConvOclDirectFwd:8,16,16,16,2,1,8,1,2;ConvOclDirectFwdFused:8,16,16,16,2,1,8,1,2
960-122-20-1x1-192-122-20-12-0x0-1x1-1x1-0-NCHW-FP32-W=ConvAsmBwdWrW1x1:1,16,4,8,4,1,2,4,0,2
116-28-28-1x1-116-28-28-2-0x0-1x1-1x1-0-NCHW-FP16-W=ConvAsmBwdWrW1x1:4,4,4,1,2,1,1,4,0,1
3-296-311-1x1-2-296-311-1-0x0-1x1-1x1-0-NCHW-FP32-W=ConvAsmBwdWrW1x1:4,4,2,1,2,1,1,4,0,3
232-698-1-1x1-544-698-1-6-0x0-1x1-1x1-0-NCHW-FP32-W=ConvAsmBwdWrW1x1:4,4,8,4,4,1,1,4,0,0
512-474-28-1x1-1728-474-28-4-0x0-1x1-1x1-0-NCHW-FP32-B=ConvOclDirectFwd1x1:1,256,1,1,0,1,32,4,0
96-254-843-1x1-704-254-843-2-0x0-1x1-1x1-0-NCHW-FP32-B=ConvOclDirectFwd1x1:1,256,1,1,0,2,32,4,0
32-7-7-3x3-128-7-7-512-1x1-1x1-1x1-0-NCHW-FP16-W=ConvAsmBwdWrW3x3:0,0,8,2,7,8
160-103-11-1x1-528-103-11-6-0x0-1x1-1x1-0-NCHW-FP32-B=ConvOclDirectFwd1x1:1,64,1,1,0,1,16,4,0;ConvAsm1x1U:3,16,3,64,1,2,2,2
256-56-56-1x1-64-56-56-4-0x0-1x1-1x1-0-NCHW-FP16-F=ConvOclDirectFwd1x1:1,64,1,1,0,2,8,4,0;ConvAsm1x1U:1,8,2,64,1,4,2,2
128-56-56-3x3-128-56-56-48-1x1-1x1-1x1-0-NCHW-FP32-F_g32=ConvOclDirectFwd:8,32,32,32,4,1,8,2,2
128-14-14-1x1-992-14-14-256-0x0-1x1-1x1-0-NCHW-FP16-F=ConvOclDirectFwd1x1:1,256,1,1,0,4,16,4,0;ConvAsm1x1U:1,16,2,16,2,2,1,2
232-402-53-1x1-464-402-53-12-0x0-1x1-1x1-0-NCHW-FP32-B=ConvOclDirectFwd1x1:1,128,1,1,0,2,16,4,0
128-556-187-1x1-416-556-187-8-0x0-1x1-1x1-0-NCHW-FP32-F=ConvOclDirectFwd1x1:1,64,1,1,1,4,64,128,0
1008-435-245-1x1-96-435-245-2-0x0-1x1-1x1-0-NCHW-FP32-F=ConvOclDirectFwd1x1:1,64,1,1,1,1,64,2048,0
576-14-14-1x1-128-14-14-512-0x0-1x1-1x1-0-NCHW-FP32-B=ConvOclDirectFwd1x1:1,256,1,1,0,1,32,4,0;ConvAsm1x1U:1,32,1,16,2,1,1,2
64-56-56-3x3-64-56-56-1-1x1-1x1-1x1-0-NCHW-FP16-B=ConvOclDirectFwd:16,16,16,16,1,1,4,4,1
60-14-14-3x3-60-28-28-64-1x1-2x2-1x1-0-NCHW-FP16-B=ConvOclDirectFwd:8,8,32,32,4,4,4,2,1
128-28-28-1x1-480-28-28-32-0x0-1x1-1x1-0-NCHW-FP16-B=ConvOclDirectFwd1x1:1,64,1,1,0,4,16,4,0;ConvAsm1x1U:1,16,2,16,1,2,1,2
19-499-1008-1x1-32-499-1008-6-0x0-1x1-1x1-0-NCHW-FP32-B=ConvOclDirectFwd1x1:1,256,1,1,0,1,32,4,0
256-14-14-1x1-128-28-28-128-0x0-2x2-1x1-0-NCHW-FP32-B=ConvOclDirectFwd1x1:1,64,1,1,0,1,32,4,0;ConvAsm1x1U:1,32,1,32,2,1,2,2
232-475-425-1x1-1152-475-425-2-0x0-1x1-1x1-0-NCHW-FP32-B=ConvOclDirectFwd1x1:1,256,1,1,0,1,32,4,0
1632-175-292-1x1-1-175-292-4-0x0-1x1-1x1-0-NCHW-FP32-F=ConvOclDirectFwd1x1:1,64,1,1,0,4,16,4,0
608-309-52-1x1-116-309-52-48-0x0-1x1-1x1-0-NCHW-FP32-B=ConvOclDirectFwd1x1:1,256,1,1,0,4,16,4,0
512-15-15-3x3-512-29-29-8-1x1-2x2-1x1-0-NCHW-FP32-W_g32=ConvOclBwdWrW2<1>:1,6,8,1,5;ConvOclBwdWrW2<8>:1,6,8,1,5;ConvAsmBwdWrW3x3:0,0,16,4,4,1;ConvOclBwdWrW2<4>:1,7,3,1,5;ConvOclBwdWrW2<2>:1,7,3,1,5
48-27-27-3x3-192-27-27-256-1x1-1x1-1x1-0-NCHW-FP16-B=ConvOclDirectFwd:16,16,32,32,2,2,8,4,2
256-13-13-3x3-64-13-13-256-1x1-1x1-1x1-0-NCHW-FP16-F=ConvOclDirectFwd:8,8,16,16,2,2,8,2,1
528-278-836-1x1-116-278-836-4-0x0-1x1-1x1-0-NCHW-FP32-B=ConvOclDirectFwd1x1:1,64,1,1,0,2,16,4,0
16-176-202-1x1-116-176-202-64-0x0-1x1-1x1-0-NCHW-FP32-B=ConvOclDirectFwd1x1:1,128,1,1,0,1,16,4,0;ConvAsm1x1U:4,4,4,4,1,2,1,2
128-14-14-1x1-256-14-14-512-0x0-1x1-1x1-0-NCHW-FP32-B=ConvOclDirectFwd1x1:1,256,1,1,0,1,32,4,0;ConvAsm1x1U:1,16,1,32,2,1,1,4
960-144-724-1x1-116-144-724-2-0x0-1x1-1x1-0-NCHW-FP32-B=ConvOclDirectFwd1x1:1,256,1,1,0,1,8,4,0
32-7-7-5x5-128-7-7-32-2x2-1x1-1x1-0-NCHW-FP32-F=ConvOclDirectFwd:8,8,8,8,1,1,4,4,2;ConvOclDirectFwdFused:8,8,8,8,1,1,4,4,2
1280-176-155-1x1-1584-176-155-12-0x0-1x1-1x1-0-NCHW-FP32-B=ConvOclDirectFwd1x1:1,128,1,1,0,4,16,4,0
48-27-27-1x1-384-27-27-16-0x0-1x1-1x1-0-NCHW-FP16-B=ConvOclDirectFwd1x1:1,128,1,1,0,1,4,4,0;ConvAsm1x1U:1,16,2,16,1,2,1,4
160-101-408-1x1-928-101-408-4-0x0-1x1-1x1-0-NCHW-FP32-F=ConvOclDirectFwd1x1:1,64,1,1,1,0,64,2048,0
832-499-640-1x1-1392-499-640-1-0x0-1x1-1x1-0-NCHW-FP32-B=ConvOclDirectFwd1x1:1,64,1,1,0,4,16,8,0
48-35-35-1x1-256-35-35-16-0x0-1x1-1x1-0-NCHW-FP32-W=ConvAsmBwdWrW1x1:4,4,4,4,4,1,4,4,0,1
1296-149-124-1x1-224-149-124-12-0x0-1x1-1x1-0-NCHW-FP32-F=ConvOclDirectFwd1x1:1,64,1,1,1,4,64,2048,0
58-33-361-1x1-384-33-361-4-0x0-1x1-1x1-0-NCHW-FP32-W=ConvAsmBwdWrW1x1:4,4,4,2,8,1,1,4,0,1
2048-8-8-1x1-320-8-8-16-0x0-1x1-1x1-0-NCHW-FP32-F=ConvOclDirectFwd1x1:1,64,1,1,1,0,16,256,0;ConvAsm1x1U:4,8,4,16,2,4,2,2;ConvActivAsm1x1U:2,16,2,32,3,4
480-14-14-1x1-64-14-14-256-0x0-1x1-1x1-0-NCHW-FP32-W=ConvAsmBwdWrW1x1:2,8,4,8,2,1,4,4,0,2
232-22-85-1x1-224-22-85-6-0x0-1x1-1x1-0-NCHW-FP32-F=ConvOclDirectFwd1x1:1,64,1,1,0,2,32,4,0;ConvAsm1x1U:3,16,5,64,1,2,1,1
128-112-112-3x3-128-112-112-4-1x1-1x1-1x1-0-NCHW-FP16-W=ConvAsmBwdWrW3x3:0,1,16,2,1,1
256-27-27-1x1-32-27-27-32-0x0-1x1-1x1-0-NCHW-FP32-B=ConvOclDirectFwd1x1:1,64,1,1,0,1,16,8,0;ConvAsm1x1U:1,16,1,64,1,2,2,1
160-17-17-1x1-768-17-17-32-0x0-1x1-1x1-0-NCHW-FP32-W=ConvAsmBwdWrW1x1:2,8,4,4,8,1,2,4,0,1
128-38-38-1x1-64-75-75-64-0x0-2x2-1x1-0-NCHW-FP32-W=ConvAsmBwdWrW1x1:4,4,4,4,2,1,4,4,0,2
128-56-56-3x3-128-56-56-256-1x1-1x1-1x1-0-NCHW-FP32-W_g32=ConvOclBwdWrW2<4>:1,7,1,1,3;ConvOclBwdWrW2<2>:1,7,1,1,3;ConvOclBwdWrW2<1>:1,7,1,1,3;ConvOclBwdWrW2<16>:1,8,1,1,5;ConvAsmBwdWrW3x3:0,0,16,1,2,1;ConvOclBwdWrW2<8>:1,9,3,1,5
448-1012-11-1x1-1200-1012-11-6-0x0-1x1-1x1-0-NCHW-FP32-B=ConvOclDirectFwd1x1:1,256,1,1,0,4,16,4,0
416-336-725-1x1-288-336-725-2-0x0-1x1-1x1-0-NCHW-FP32-F=ConvOclDirectFwd1x1:1,64,1,1,1,4,64,2048,0
512-14-14-3x3-512-28-28-1-1x1-2x2-1x1-0-NCHW-FP32-W_g32=ConvOclBwdWrW2<1>:1,7,3,1,5;ConvAsmBwdWrW3x3:0,0,8,2,1,1
3-39-28-1x1-232-39-28-4-0x0-1x1-1x1-0-NCHW-FP32-B=ConvOclDirectFwd1x1:1,128,1,1,0,2,4,4,0;ConvAsm1x1U:1,8,1,64,1,1,1,1
19-55-161-1x1-1888-55-161-1-0x0-1x1-1x1-0-NCHW-FP32-B=ConvOclDirectFwd1x1:1,256,1,1,0,1,4,4,0
256-28-28-3x3-256-28-28-6-1x1-1x1-1x1-0-NCHW-FP32-F_g32=ConvOclDirectFwd:16,16,32,32,2,2,8,2,1
2048-8-8-1x1-1024-8-8-48-0x0-1x1-1x1-0-NCHW-FP32-F=ConvOclDirectFwd1x1:1,64,1,1,1,1,64,2048,0;ConvAsm1x1U:2,16,2,32,3,2,1,1
128-28-28-1x1-160-28-28-16-0x0-1x1-1x1-0-NCHW-FP32-F=ConvOclDirectFwd1x1:1,64,1,1,1,0,64,256,0;ConvAsm1x1U:1,8,1,32,2,4,1,4
320-28-28-1x1-128-28-28-16-0x0-1x1-1x1-0-NCHW-FP16-B=ConvOclDirectFwd1x1:1,64,1,1,0,4,16,4,0;ConvAsm1x1U:1,16,2,16,1,2,4,1
96-35-35-3x3-96-35-35-32-1x1-1x1-1x1-0-NCHW-FP16-B=ConvOclDirectFwd:16,8,16,16,1,2,8,1,1
192-153-244-1x1-720-153-244-2-0x0-1x1-1x1-0-NCHW-FP32-B=ConvOclDirectFwd1x1:1,128,1,1,0,4,16,4,0
384-8-8-1x1-1536-8-8-4-0x0-1x1-1x1-0-NCHW-FP32-B=ConvOclDirectFwd1x1:1,64,1,1,0,1,4,8,0;ConvAsm1x1U:2,8,2,32,1,2,2,2
1024-14-14-1x1-256-14-14-2-0x0-1x1-1x1-0-NCHW-FP16-B=ConvOclDirectFwd1x1:1,64,1,1,0,4,8,8,0;ConvAsm1x1U:1,8,2,32,1,4,4,1
192-7-7-1x1-1968-7-7-16-0x0-1x1-1x1-0-NCHW-FP16-B=ConvOclDirectFwd1x1:1,64,1,1,0,1,8,4,0;ConvAsm1x1U:1,16,2,16,1,2,2,2
544-7-7-1x1-128-7-7-128-0x0-1x1-1x1-0-NCHW-FP16-W=ConvAsmBwdWrW1x1:2,8,2,8,2,2,2,4,0,1
2-754-524-1x1-58-754-524-16-0x0-1x1-1x1-0-NCHW-FP32-B=ConvOclDirectFwd1x1:1,128,1,1,0,1,16,4,0
896-680-641-1x1-256-680-641-1-0x0-1x1-1x1-0-NCHW-FP32-B=ConvOclDirectFwd1x1:1,256,1,1,0,2,32,4,0
528-14-14-1x1-32-14-14-8-0x0-1x1-1x1-0-NCHW-FP32-F=ConvOclDirectFwd1x1:1,64,1,1,1,1,16,64,0;ConvAsm1x1U:1,8,1,16,1,4,4,1;ConvActivAsm1x1U:1,16,1,16,1,4
128-14-14-1x1-512-14-14-8-0x0-1x1-1x1-0-NCHW-FP16-B=ConvOclDirectFwd1x1:1,256,1,1,0,4,8,4,0;ConvAsm1x1U:1,8,2,64,1,4,1,4
324-3-3-3x3-256-3-3-32-1x1-1x1-1x1-0-NCHW-FP32-W=ConvAsmBwdWrW3x3:0,0,8,2,3,1
96-68-212-1x1-464-68-212-1-0x0-1x1-1x1-0-NCHW-FP32-W=ConvAsmBwdWrW1x1:4,4,4,4,4,1,1,4,0,1
672-45-330-1x1-432-45-330-1-0x0-1x1-1x1-0-NCHW-FP32-W=ConvAsmBwdWrW1x1:1,16,8,8,2,1,1,4,0,1
24-79-183-1x1-512-79-183-1-0x0-1x1-1x1-0-NCHW-FP32-F=ConvOclDirectFwd1x1:1,256,1,1,0,1,4,4,0
128-177-21-1x1-480-177-21-128-0x0-1x1-1x1-0-NCHW-FP32-W=ConvAsmBwdWrW1x1:4,4,8,4,4,1,2,4,0,0
992-329-686-1x1-336-329-686-1-0x0-1x1-1x1-0-NCHW-FP32-B=ConvOclDirectFwd1x1:1,128,1,1,0,2,16,4,0
432-600-18-1x1-144-600-18-64-0x0-1x1-1x1-0-NCHW-FP32-F=ConvOclDirectFwd1x1:1,64,1,1,1,0,64,2048,0
896-5-88-1x1-1568-5-88-4-0x0-1x1-1x1-0-NCHW-FP32-W=ConvAsmBwdWrW1x1:1,16,4,4,8,1,1,4,0,1
608-7-7-1x1-128-7-7-16-0x0-1x1-1x1-0-NCHW-FP16-W=ConvAsmBwdWrW1x1:2,8,4,4,2,2,2,4,0,0
232-71-334-1x1-256-71-334-16-0x0-1x1-1x1-0-NCHW-FP32-B=ConvOclDirectFwd1x1:1,256,1,1,0,1,32,4,0
16-54-54-1x1-128-54-54-64-0x0-1x1-1x1-0-NCHW-FP32-B=ConvOclDirectFwd1x1:1,256,1,1,0,2,32,4,0;ConvAsm1x1U:1,8,1,64,1,4,4,2
2-12-365-1x1-800-12-365-32-0x0-1x1-1x1-0-NCHW-FP32-B=ConvOclDirectFwd1x1:1,64,1,1,0,4,4,4,0;ConvAsm1x1U:1,8,1,16,1,1,1,1
256-13-13-1x1-64-13-13-256-0x0-1x1-1x1-0-NCHW-FP16-B=ConvOclDirectFwd1x1:1,256,1,1,0,1,32,4,0;ConvAsm1x1U:3,8,6,32,2,2,1,8
1376-31-176-1x1-24-31-176-1-0x0-1x1-1x1-0-NCHW-FP32-F=ConvOclDirectFwd1x1:1,256,1,1,0,1,4,4,0
256-14-14-1x1-128-28-28-256-0x0-2x2-1x1-0-NCHW-FP16-W=ConvAsmBwdWrW1x1:2,8,4,8,2,2,4,4,0,1
96-503-492-1x1-19-503-492-4-0x0-1x1-1x1-0-NCHW-FP32-F=ConvOclDirectFwd1x1:1,128,1,1,0,2,8,8,0
640-14-14-1x1-128-14-14-512-0x0-1x1-1x1-0-NCHW-FP32-B=ConvOclDirectFwd1x1:1,128,1,1,0,1,32,4,0;ConvAsm1x1U:1,32,1,16,2,1,1,2
512-124-956-1x1-480-124-956-1-0x0-1x1-1x1-0-NCHW-FP32-B=ConvOclDirectFwd1x1:1,64,1,1,0,1,32,4,0
48-298-912-1x1-58-298-912-4-0x0-1x1-1x1-0-NCHW-FP32-B=ConvOclDirectFwd1x1:1,256,1,1,0,4,8,4,0
464-7-7-1x1-1024-7-7-4-0x0-1x1-1x1-0-NCHW-FP16-F=ConvOclDirectFwd1x1:1,128,1,1,0,1,8,8,0;ConvAsm1x1U:1,8,2,32,1,4,4,2
640-236-143-1x1-672-236-143-12-0x0-1x1-1x1-0-NCHW-FP32-F=ConvOclDirectFwd1x1:1,64,1,1,1,4,64,2048,0
32-52-73-1x1-1000-52-73-8-0x0-1x1-1x1-0-NCHW-FP32-W=ConvAsmBwdWrW1x1:4,4,2,2,8,1,1,4,0,0
128-56-56-3x3-32-56-56-64-1x1-1x1-1x1-0-NCHW-FP16-F=ConvOclDirectFwd:32,8,32,32,1,4,8,1,2
608-1-624-1x1-1824-1-624-128-0x0-1x1-1x1-0-NCHW-FP32-B=ConvOclDirectFwd1x1:1,256,1,1,0,1,32,4,0;ConvAsm1x1U:1,32,2,32,1,1,1,1
256-171-70-1x1-1024-171-70-12-0x0-1x1-1x1-0-NCHW-FP32-F=ConvOclDirectFwd1x1:1,64,1,1,1,0,32,2048,0
58-799-154-1x1-48-799-154-32-0x0-1x1-1x1-0-NCHW-FP32-F=ConvOclDirectFwd1x1:1,256,1,1,0,1,16,4,0
256-27-27-1x1-48-27-27-512-0x0-1x1-1x1-0-NCHW-FP16-B=ConvOclDirectFwd1x1:1,128,1,1,0,1,16,4,0;ConvAsm1x1U:1,16,2,64,1,2,1,1
352-25-532-1x1-1184-25-532-6-0x0-1x1-1x1-0-NCHW-FP32-W=ConvAsmBwdWrW1x1:2,8,4,4,8,1,1,4,0,1
128-7-7-1x1-832-7-7-256-0x0-1x1-1x1-0-NCHW-FP16-W=ConvAsmBwdWrW1x1:2,8,4,8,2,2,2,4,0,1
384-194-225-1x1-58-194-225-16-0x0-1x1-1x1-0-NCHW-FP32-B=ConvOclDirectFwd1x1:1,256,1,1,0,1,8,8,0
96-39-298-1x1-992-39-298-12-0x0-1x1-1x1-0-NCHW-FP32-F=ConvOclDirectFwd1x1:1,64,1,1,1,4,64,256,0
128-536-142-1x1-384-536-142-2-0x0-1x1-1x1-0-NCHW-FP32-B=ConvOclDirectFwd1x1:1,256,1,1,0,4,16,8,0
928-126-115-1x1-432-126-115-6-0x0-1x1-1x1-0-NCHW-FP32-W=ConvAsmBwdWrW1x1:2,8,8,4,4,1,1,4,0,1
672-14-14-1x1-128-14-14-128-0x0-1x1-1x1-0-NCHW-FP32-B=ConvOclDirectFwd1x1:1,64,1,1,0,4,16,4,0;ConvAsm1x1U:2,16,2,64,1,2,2,2
512-423-325-1x1-192-423-325-4-0x0-1x1-1x1-0-NCHW-FP32-F=ConvOclDirectFwd1x1:1,64,1,1,1,0,16,2048,0
384-13-13-3x3-192-13-13-256-1x1-1x1-1x1-0-NCHW-FP32-W=ConvAsmBwdWrW3x3:0,0,16,4,4,1
232-14-14-1x1-232-14-14-512-0x0-1x1-1x1-0-NCHW-FP16-F=ConvOclDirectFwd1x1:1,256,1,1,0,4,16,4,0;ConvAsm1x1U:2,8,4,64,1,4,2,1
832-14-14-1x1-128-14-14-16-0x0-1x1-1x1-0-NCHW-FP32-B=ConvOclDirectFwd1x1:1,64,1,1,0,4,8,8,0;ConvAsm1x1U:2,16,2,64,1,2,4,1
128-56-56-3x3-128-56-56-32-1x1-1x1-1x1-0-NCHW-FP32-F_g32=ConvOclDirectFwd:16,16,32,32,2,2,8,4,2
64-147-147-3x3-32-147-147-16-1x1-1x1-1x1-0-NCHW-FP16-B=ConvOclDirectFwd:16,16,32,32,2,2,8,2,2
16-54-54-3x3-64-54-54-512-1x1-1x1-1x1-0-NCHW-FP32-F=ConvAsm3x3U:7,8,6;ConvOclDirectFwd:8,16,16,32,2,2,8,2,2
672-612-595-1x1-144-612-595-1-0x0-1x1-1x1-0-NCHW-FP32-B=ConvOclDirectFwd1x1:1,256,1,1,0,2,16,4,0
128-56-56-1x1-256-56-56-256-0x0-1x1-1x1-0-NCHW-FP16-F=ConvOclDirectFwd1x1:1,256,1,1,0,4,16,4,0;ConvAsm1x1U:1,8,2,32,1,4,1,4
544-142-822-1x1-352-142-822-8-0x0-1x1-1x1-0-NCHW-FP32-B=ConvOclDirectFwd1x1:1,128,1,1,0,1,32,4,0
54-282-828-1x1-116-282-828-12-0x0-1x1-1x1-0-NCHW-FP32-B=ConvOclDirectFwd1x1:1,256,1,1,0,4,16,4,0
128-17-17-1x1-768-17-17-256-0x0-1x1-1x1-0-NCHW-FP16-F=ConvOclDirectFwd1x1:1,128,1,1,0,1,16,4,0;ConvAsm1x1U:2,16,4,16,1,2,1,4
128-57-57-3x3-128-57-57-1-1x1-1x1-1x1-0-NCHW-FP32-B_g32=ConvOclDirectFwd:16,16,16,16,1,1,8,2,1
1024-8-8-1x1-2048-8-8-4-0x0-1x1-1x1-0-NCHW-FP32-B=ConvOclDirectFwd1x1:1,128,1,1,0,4,8,8,0;ConvAsm1x1U:1,8,1,64,2,4,2,4
232-797-619-1x1-1024-797-619-1-0x0-1x1-1x1-0-NCHW-FP32-F=ConvOclDirectFwd1x1:1,256,1,1,0,1,32,4,0
544-561-369-1x1-832-561-369-2-0x0-1x1-1x1-0-NCHW-FP32-F=ConvOclDirectFwd1x1:1,64,1,1,1,1,16,2048,0
232-167-242-1x1-896-167-242-1-0x0-1x1-1x1-0-NCHW-FP32-B=ConvOclDirectFwd1x1:1,256,1,1,0,2,32,4,0
128-27-27-1x1-32-27-27-64-0x0-1x1-1x1-0-NCHW-FP32-F=ConvOclDirectFwd1x1:1,64,1,1,1,0,32,2048,0;ConvAsm1x1U:2,16,2,64,2,1,2,1
144-397-243-1x1-624-397-243-2-0x0-1x1-1x1-0-NCHW-FP32-B=ConvOclDirectFwd1x1:16,64,32,32,0,1,16,4,1
320-28-28-1x1-64-28-28-64-0x0-1x1-1x1-0-NCHW-FP32-F=ConvOclDirectFwd1x1:1,64,1,1,1,0,16,2048,0;ConvAsm1x1U:1,16,1,16,2,2,1,4;ConvActivAsm1x1U:3,16,3,32,2,2
960-497-868-1x1-2-497-868-1-0x0-1x1-1x1-0-NCHW-FP32-F=ConvOclDirectFwd1x1:1,64,1,1,0,4,16,4,0
192-7-7-1x1-832-7-7-1-0x0-1x1-1x1-0-NCHW-FP32-W=ConvAsmBwdWrW1x1:1,16,2,4,2,1,1,4,0,1
112-15-496-1x1-912-15-496-64-0x0-1x1-1x1-0-NCHW-FP32-B=ConvOclDirectFwd1x1:1,256,1,1,0,1,16,4,0
192-17-17-1x1-768-17-17-128-0x0-1x1-1x1-0-NCHW-FP32-W=ConvAsmBwdWrW1x1:1,16,4,4,8,1,2,4,0,1
128-56-56-1x1-192-56-56-128-0x0-1x1-1x1-0-NCHW-FP16-B=ConvOclDirectFwd1x1:1,64,1,1,0,4,16,4,0;ConvAsm1x1U:1,16,2,32,1,2,1,2
16-10-10-5x5-6-14-14-64-0x0-1x1-1x1-0-NCHW-FP16-B=ConvOclDirectFwd:8,16,16,16,2,1,1,4,2
1600-250-43-1x1-128-250-43-12-0x0-1x1-1x1-0-NCHW-FP32-F=ConvOclDirectFwd1x1:1,64,1,1,1,0,32,2048,0
1248-813-37-1x1-704-813-37-8-0x0-1x1-1x1-0-NCHW-FP32-F=ConvOclDirectFwd1x1:1,64,1,1,1,1,16,2048,0
1000-88-821-1x1-768-88-821-6-0x0-1x1-1x1-0-NCHW-FP32-B=ConvOclDirectFwd1x1:1,256,1,1,0,2,32,4,0
192-80-146-1x1-2-80-146-16-0x0-1x1-1x1-0-NCHW-FP32-W=ConvAsmBwdWrW1x1:4,4,2,2,2,1,4,4,0,3
3-95-709-1x1-144-95-709-1-0x0-1x1-1x1-0-NCHW-FP32-B=ConvOclDirectFwd1x1:1,256,1,1,0,1,4,4,0
192-8-8-1x1-1280-8-8-128-0x0-1x1-1x1-0-NCHW-FP32-B=ConvOclDirectFwd1x1:1,256,1,1,0,2,16,4,0;ConvAsm1x1U:1,16,1,64,2,2,1,4
1024-155-854-1x1-352-155-854-2-0x0-1x1-1x1-0-NCHW-FP32-B=ConvOclDirectFwd1x1:1,64,1,1,0,2,32,4,0
112-105-367-1x1-464-105-367-8-0x0-1x1-1x1-0-NCHW-FP32-B=ConvOclDirectFwd1x1:16,64,32,32,0,1,16,4,1
16-564-802-1x1-8-564-802-64-0x0-1x1-1x1-0-NCHW-FP32-W=ConvAsmBwdWrW1x1:4,4,2,1,2,1,4,4,0,1
144-48-795-1x1-1664-48-795-1-0x0-1x1-1x1-0-NCHW-FP32-B=ConvOclDirectFwd1x1:1,128,1,1,0,2,32,4,0
128-7-7-1x1-896-7-7-128-0x0-1x1-1x1-0-NCHW-FP32-F=ConvOclDirectFwd1x1:1,64,1,1,1,1,32,256,0;ConvAsm1x1U:4,8,4,16,1,4,1,4
64-35-35-1x1-256-35-35-8-0x0-1x1-1x1-0-NCHW-FP16-B=ConvOclDirectFwd1x1:1,64,1,1,0,1,8,8,0;ConvAsm1x1U:1,16,2,16,1,2,1,4
116-122-480-1x1-320-122-480-8-0x0-1x1-1x1-0-NCHW-FP32-B=ConvOclDirectFwd1x1:1,64,1,1,0,2,32,4,0
576-433-615-1x1-224-433-615-1-0x0-1x1-1x1-0-NCHW-FP32-F=ConvOclDirectFwd1x1:1,64,1,1,1,1,64,2048,0
256-13-13-3x3-384-13-13-1024-1x1-1x1-1x1-0-NCHW-FP16-W=ConvAsmBwdWrW3x3:0,1,8,4,7,1
120-7-7-1x1-480-7-7-16-0x0-1x1-1x1-0-NCHW-FP32-F_g3=ConvOclDirectFwd:8,8,8,8,1,1,8,4,2
24-715-555-1x1-160-715-555-4-0x0-1x1-1x1-0-NCHW-FP32-B=ConvOclDirectFwd1x1:1,256,1,1,0,1,32,4,0
736-147-748-1x1-448-147-748-2-0x0-1x1-1x1-0-NCHW-FP32-B=ConvOclDirectFwd1x1:1,128,1,1,0,1,32,4,0
1344-172-355-1x1-19-172-355-6-0x0-1x1-1x1-0-NCHW-FP32-F=ConvOclDirectFwd1x1:1,64,1,1,0,4,8,4,0
128-57-57-1x1-64-57-57-32-0x0-1x1-1x1-0-NCHW-FP32-W=ConvAsmBwdWrW1x1:4,4,2,4,4,1,2,4,0,2
512-15-15-1x1-1024-15-15-2-0x0-1x1-1x1-0-NCHW-FP32-F=ConvOclDirectFwd1x1:1,64,1,1,1,4,16,2048,0;ConvAsm1x1U:2,8,4,64,1,4,4,1
512-29-29-1x1-512-29-29-8-0x0-1x1-1x1-0-NCHW-FP32-B=ConvOclDirectFwd1x1:1,256,1,1,0,1,32,4,0;ConvAsm1x1U:2,16,2,64,1,2,1,4
192-64-128-1x1-832-64-128-1-0x0-1x1-1x1-0-NCHW-FP16-W=ConvAsmBwdWrW1x1:4,4,2,2,8,1,1,4,0,2
576-982-10-1x1-544-982-10-12-0x0-1x1-1x1-0-NCHW-FP32-F=ConvOclDirectFwd1x1:1,64,1,1,1,4,64,2048,0
32-28-28-3x3-128-28-28-128-1x1-1x1-1x1-0-NCHW-FP16-B=ConvOclDirectFwd:16,16,32,32,2,2,8,2,2
112-14-14-1x1-512-14-14-16-0x0-1x1-1x1-0-NCHW-FP16-B=ConvOclDirectFwd1x1:1,256,1,1,0,4,8,4,0;ConvAsm1x1U:1,16,2,16,1,2,2,2
432-402-268-1x1-448-402-268-6-0x0-1x1-1x1-0-NCHW-FP32-F=ConvOclDirectFwd1x1:1,64,1,1,1,0,16,2048,0
80-608-402-1x1-3-608-402-12-0x0-1x1-1x1-0-NCHW-FP32-F=ConvOclDirectFwd1x1:1,64,1,1,0,1,16,8,0
128-28-28-1x1-352-28-28-512-0x0-1x1-1x1-0-NCHW-FP32-W=ConvAsmBwdWrW1x1:1,16,2,8,4,1,4,4,0,1
232-356-28-1x1-672-356-28-6-0x0-1x1-1x1-0-NCHW-FP32-W=ConvAsmBwdWrW1x1:1,16,2,4,8,1,1,4,0,3
1-475-279-1x1-3-475-279-48-0x0-1x1-1x1-0-NCHW-FP32-W=ConvAsmBwdWrW1x1:4,4,2,1,2,1,4,4,0,1
768-239-79-1x1-1344-239-79-8-0x0-1x1-1x1-0-NCHW-FP32-B=ConvOclDirectFwd1x1:1,256,1,1,0,1,32,4,0
1024-4-4-1x1-2048-7-7-32-0x0-2x2-1x1-0-NCHW-FP32-W=ConvAsmBwdWrW1x1:1,16,2,4,8,1,1,4,0,0
384-315-497-1x1-528-315-497-6-0x0-1x1-1x1-0-NCHW-FP32-B=ConvOclDirectFwd1x1:1,256,1,1,0,1,16,8,0
928-208-751-1x1-224-208-751-1-0x0-1x1-1x1-0-NCHW-FP32-B=ConvOclDirectFwd1x1:1,64,1,1,0,2,32,4,0
608-50-868-1x1-32-50-868-12-0x0-1x1-1x1-0-NCHW-FP32-F=ConvOclDirectFwd1x1:1,64,1,1,1,0,64,2048,0
1248-517-12-1x1-24-517-12-4-0x0-1x1-1x1-0-NCHW-FP32-F=ConvOclDirectFwd1x1:1,64,1,1,0,4,16,4,0
640-301-99-1x1-352-301-99-4-0x0-1x1-1x1-0-NCHW-FP32-F=ConvOclDirectFwd1x1:1,64,1,1,1,0,64,2048,0
128-28-28-1x1-384-28-28-16-0x0-1x1-1x1-0-NCHW-FP32-W=ConvAsmBwdWrW1x1:1,16,2,8,2,1,4,4,0,1
16-192-686-1x1-800-192-686-1-0x0-1x1-1x1-0-NCHW-FP32-F=ConvOclDirectFwd1x1:1,64,1,1,1,4,64,256,0
4-418-751-1x1-48-418-751-32-0x0-1x1-1x1-0-NCHW-FP32-W=ConvAsmBwdWrW1x1:4,4,2,1,2,1,4,4,0,1
48-116-533-1x1-19-116-533-12-0x0-1x1-1x1-0-NCHW-FP32-F=ConvOclDirectFwd1x1:1,256,1,1,0,1,16,8,0;ConvAsm1x1U:2,8,6,32,2,2,1,2
256-27-27-1x1-64-27-27-256-0x0-1x1-1x1-0-NCHW-FP16-F=ConvOclDirectFwd1x1:1,256,1,1,0,1,16,8,0;ConvAsm1x1U:2,8,4,64,1,4,1,4
144-429-414-1x1-8-429-414-12-0x0-1x1-1x1-0-NCHW-FP32-F=ConvOclDirectFwd1x1:1,256,1,1,0,2,16,4,0
256-109-175-3x3-256-109-175-128-1x1-1x1-1x1-0-NCHW-FP16-F=ConvOclDirectFwd:8,16,16,32,2,2,8,1,2
128-14-14-1x1-352-14-14-512-0x0-1x1-1x1-0-NCHW-FP32-W=ConvAsmBwdWrW1x1:4,4,4,4,4,1,4,4,0,1
32-35-35-1x1-192-35-35-1-0x0-1x1-1x1-0-NCHW-FP32-B=ConvOclDirectFwd1x1:1,256,1,1,0,1,4,4,0;ConvAsm1x1U:1,8,2,64,1,4,1,1
1392-191-12-1x1-8-191-12-1-0x0-1x1-1x1-0-NCHW-FP32-F=ConvOclDirectFwd1x1:1,64,1,1,0,1,4,4,0;ConvAsm1x1U:1,8,1,32,1,4,4,1
32-147-147-3x3-32-149-149-16-0x0-1x1-1x1-0-NCHW-FP32-B=ConvOclDirectFwd:16,16,16,32,1,2,8,4,2
1392-7-7-1x1-192-7-7-16-0x0-1x1-1x1-0-NCHW-FP16-F=ConvOclDirectFwd1x1:1,64,1,1,0,1,4,4,0;ConvAsm1x1U:1,8,2,32,1,4,4,1
240-113-301-1x1-16-113-301-64-0x0-1x1-1x1-0-NCHW-FP32-F=ConvOclDirectFwd1x1:1,64,1,1,1,1,32,2048,0
128-7-7-5x5-832-7-7-32-2x2-1x1-1x1-0-NCHW-FP32-W=ConvOclBwdWrW2<1>:1,7,1,8,7;ConvOclBwdWrW2<16>:1,7,1,8,7;ConvOclBwdWrW2<8>:1,7,1,8,7;ConvOclBwdWrW2<4>:1,7,1,8,7;ConvOclBwdWrW2<2>:1,7,1,8,7
1-134-249-1x1-1152-134-249-6-0x0-1x1-1x1-0-NCHW-FP32-B=ConvOclDirectFwd1x1:1,256,1,1,0,2,4,4,0
240-28-28-1x1-60-28-28-1-0x0-1x1-1x1-0-NCHW-FP16-F_g3=ConvOclDirectFwd:16,16,16,16,1,1,1,2,1
3-702-169-1x1-1120-702-169-1-0x0-1x1-1x1-0-NCHW-FP32-B=ConvOclDirectFwd1x1:1,64,1,1,0,2,16,4,0
60-28-28-3x3-60-28-28-128-1x1-1x1-1x1-0-NCHW-FP16-F=ConvOclDirectFwd:16,16,32,32,2,2,8,2,1
864-828-188-1x1-1024-828-188-2-0x0-1x1-1x1-0-NCHW-FP32-B=ConvOclDirectFwd1x1:1,256,1,1,0,2,32,4,0
896-5-890-1x1-1056-5-890-8-0x0-1x1-1x1-0-NCHW-FP32-B=ConvOclDirectFwd1x1:1,128,1,1,0,2,32,4,0
448-28-28-1x1-128-28-28-16-0x0-1x1-1x1-0-NCHW-FP32-B=ConvOclDirectFwd1x1:1,128,1,1,0,2,16,4,0;ConvAsm1x1U:2,16,2,64,1,2,2,2
32-205-659-1x1-512-205-659-2-0x0-1x1-1x1-0-NCHW-FP32-F=ConvOclDirectFwd1x1:1,64,1,1,1,1,64,2048,0
64-875-68-1x1-64-875-68-32-0x0-1x1-1x1-0-NCHW-FP32-B=ConvOclDirectFwd1x1:1,64,1,1,0,2,32,4,0;ConvAsm1x1U:1,16,1,64,1,1,1,4
1776-112-260-1x1-960-112-260-2-0x0-1x1-1x1-0-NCHW-FP32-F=ConvOclDirectFwd1x1:1,64,1,1,1,0,16,2048,0
1600-132-739-1x1-256-132-739-2-0x0-1x1-1x1-0-NCHW-FP32-F=ConvOclDirectFwd1x1:1,64,1,1,1,4,64,2048,0
320-14-14-1x1-128-14-14-32-0x0-1x1-1x1-0-NCHW-FP32-B=ConvOclDirectFwd1x1:1,256,1,1,0,4,16,4,0;ConvAsm1x1U:1,16,1,32,1,2,2,2
256-56-56-3x3-128-56-56-16-1x1-1x1-1x1-0-NCHW-FP16-F=ConvOclDirectFwd:32,8,32,32,1,4,8,1,2
800-7-7-1x1-128-7-7-16-0x0-1x1-1x1-0-NCHW-FP16-B=ConvOclDirectFwd1x1:1,64,1,1,0,1,8,8,0;ConvAsm1x1U:1,8,2,16,1,4,4,2
58-28-28-1x1-24-28-28-1-0x0-1x1-1x1-0-NCHW-FP16-B=ConvOclDirectFwd1x1:1,64,1,1,0,2,16,4,0;ConvAsm1x1U:1,8,2,16,1,2,1,1
2048-6-892-1x1-1872-6-892-12-0x0-1x1-1x1-0-NCHW-FP32-B=ConvOclDirectFwd1x1:1,256,1,1,0,4,16,8,0
3-13-122-1x1-1248-13-122-4-0x0-1x1-1x1-0-NCHW-FP32-B=ConvOclDirectFwd1x1:1,256,1,1,0,1,4,4,0;ConvAsm1x1U:1,8,1,64,1,1,2,1
320-187-93-1x1-112-187-93-8-0x0-1x1-1x1-0-NCHW-FP32-F=ConvOclDirectFwd1x1:1,64,1,1,1,4,64,2048,0
48-788-346-1x1-80-788-346-16-0x0-1x1-1x1-0-NCHW-FP32-F=ConvOclDirectFwd1x1:1,64,1,1,1,1,32,2048,0
128-356-504-1x1-58-356-504-6-0x0-1x1-1x1-0-NCHW-FP32-B=ConvOclDirectFwd1x1:1,128,1,1,0,4,16,4,0
48-7-7-5x5-128-7-7-8-2x2-1x1-1x1-0-NCHW-FP32-F=ConvOclDirectFwd:8,8,8,8,1,1,2,2,2;ConvOclDirectFwdFused:8,8,8,8,1,1,2,4,2
256-14-14-1x1-528-14-14-8-0x0-1x1-1x1-0-NCHW-FP16-B=ConvOclDirectFwd1x1:1,64,1,1,0,4,8,4,0;ConvAsm1x1U:1,16,2,16,1,2,2,2
3-224-224-7x7-96-112-112-16-3x3-2x2-1x1-0-NCHW-FP32-F=ConvOclDirectFwd:16,8,16,16,1,2,8,1,1
512-14-14-1x1-24-14-14-1-0x0-1x1-1x1-0-NCHW-FP16-F=ConvOclDirectFwd1x1:1,64,1,1,0,4,4,8,0;ConvAsm1x1U:1,8,2,16,1,4,4,1
288-129-848-1x1-1120-129-848-1-0x0-1x1-1x1-0-NCHW-FP32-B=ConvOclDirectFwd1x1:1,256,1,1,0,2,32,4,0
24-56-56-1x1-58-56-56-128-0x0-1x1-1x1-0-NCHW-FP32-F=ConvOclDirectFwd1x1:1,128,1,1,0,1,16,4,0;ConvAsm1x1U:1,16,2,64,2,2,1,1
128-28-28-1x1-192-28-28-256-0x0-1x1-1x1-0-NCHW-FP16-B=ConvOclDirectFwd1x1:1,128,1,1,0,4,16,4,0;ConvAsm1x1U:1,16,2,16,1,2,1,2
2048-8-8-1x1-1024-8-8-2-0x0-1x1-1x1-0-NCHW-FP32-F=ConvOclDirectFwd1x1:8,8,8,8,1,0,32,128,1;ConvAsm1x1U:1,8,1,64,2,4,4,1
864-61-78-1x1-608-61-78-8-0x0-1x1-1x1-0-NCHW-FP32-W=ConvAsmBwdWrW1x1:2,8,4,4,8,1,1,4,0,1
288-465-273-1x1-224-465-273-6-0x0-1x1-1x1-0-NCHW-FP32-F=ConvOclDirectFwd1x1:1,64,1,1,1,1,64,2048,0
16-288-462-1x1-320-288-462-8-0x0-1x1-1x1-0-NCHW-FP32-B=ConvOclDirectFwd1x1:1,128,1,1,0,4,16,8,0
928-725-744-1x1-16-725-744-1-0x0-1x1-1x1-0-NCHW-FP32-F=ConvOclDirectFwd1x1:1,64,1,1,1,1,64,2048,0
1200-238-153-1x1-448-238-153-2-0x0-1x1-1x1-0-NCHW-FP32-F=ConvOclDirectFwd1x1:1,64,1,1,1,1,16,2048,0
256-14-14-1x1-1024-14-14-512-0x0-1x1-1x1-0-NCHW-FP32-W=ConvAsmBwdWrW1x1:1,16,4,8,4,1,2,4,0,2
64-56-56-3x3-64-56-56-64-1x1-1x1-1x1-0-NCHW-FP32-W=ConvAsmBwdWrW3x3:0,1,8,4,2,8
352-25-532-1x1-1184-25-532-6-0x0-1x1-1x1-0-NCHW-FP32-B=ConvOclDirectFwd1x1:1,128,1,1,0,2,32,4,0
1728-3-236-1x1-64-3-236-64-0x0-1x1-1x1-0-NCHW-FP32-F=ConvOclDirectFwd1x1:8,16,8,32,1,0,32,128,1;ConvAsm1x1U:1,32,3,16,1,1,1,1
128-7-7-1x1-928-7-7-128-0x0-1x1-1x1-0-NCHW-FP16-F=ConvOclDirectFwd1x1:1,64,1,1,0,1,8,4,0;ConvAsm1x1U:2,8,4,16,1,4,1,2
128-56-56-1x1-128-56-56-128-0x0-1x1-1x1-0-NCHW-FP32-F=ConvOclDirectFwd1x1:1,64,1,1,1,4,32,128,0;ConvAsm1x1U:2,16,2,64,3,2,1,4
288-3-557-1x1-1280-3-557-1-0x0-1x1-1x1-0-NCHW-FP32-W=ConvAsmBwdWrW1x1:1,16,4,8,4,1,1,4,0,1
128-7-7-1x1-992-7-7-32-0x0-1x1-1x1-0-NCHW-FP16-F=ConvOclDirectFwd1x1:1,128,1,1,0,1,8,4,0;ConvAsm1x1U:2,8,4,16,1,4,1,8
16-469-225-1x1-608-469-225-6-0x0-1x1-1x1-0-NCHW-FP32-B=ConvOclDirectFwd1x1:1,256,1,1,0,1,32,4,0
288-131-596-1x1-32-131-596-12-0x0-1x1-1x1-0-NCHW-FP32-B=ConvOclDirectFwd1x1:1,64,1,1,0,1,32,4,0
4-297-424-1x1-3-297-424-1024-0x0-1x1-1x1-0-NCHW-FP32-F=ConvOclDirectFwd1x1:1,256,1,1,0,1,16,4,0;ConvAsm1x1U:1,1,1,4,1,1,1,1
464-7-7-1x1-1024-7-7-4-0x0-1x1-1x1-0-NCHW-FP32-F=ConvOclDirectFwd1x1:1,64,1,1,1,1,16,128,0;ConvAsm1x1U:2,8,2,32,1,4,2,1
64-27-27-5x5-192-27-27-64-2x2-1x1-1x1-0-NCHW-FP32-B=ConvOclDirectFwd:16,16,32,32,2,2,8,2,1
832-668-720-1x1-8-668-720-1-0x0-1x1-1x1-0-NCHW-FP32-B=ConvOclDirectFwd1x1:1,256,1,1,0,2,16,8,0
16-14-14-1x1-480-14-14-256-0x0-1x1-1x1-0-NCHW-FP32-B=ConvOclDirectFwd1x1:1,256,1,1,0,2,32,4,0;ConvAsm1x1U:1,16,1,64,2,2,2,1
256-29-29-3x3-256-15-15-64-1x1-2x2-1x1-0-NCHW-FP32-F=ConvOclDirectFwd:16,16,16,16,1,1,8,2,2
64-73-73-1x1-160-73-73-32-0x0-1x1-1x1-0-NCHW-FP32-B=ConvOclDirectFwd1x1:1,256,1,1,0,1,32,4,0;ConvAsm1x1U:1,32,1,64,1,1,1,1
704-14-14-1x1-128-14-14-128-0x0-1x1-1x1-0-NCHW-FP32-B=ConvOclDirectFwd1x1:8,64,16,16,0,2,16,4,1;ConvAsm1x1U:2,32,2,16,1,1,2,2
64-14-14-1x1-480-14-14-32-0x0-1x1-1x1-0-NCHW-FP16-B=ConvOclDirectFwd1x1:1,64,1,1,0,4,8,4,0;ConvAsm1x1U:1,16,2,16,1,2,2,2
128-40-175-5x5-256-19-87-8-1x1-2x2-1x1-0-NCHW-FP32-F=ConvOclDirectFwd:8,32,16,32,2,1,8,2,2
256-7-7-3x3-256-14-14-32-1x1-2x2-1x1-0-NCHW-FP16-B=ConvOclDirectFwd:8,8,8,16,1,2,4,1,1
912-884-147-1x1-320-884-147-4-0x0-1x1-1x1-0-NCHW-FP32-F=ConvOclDirectFwd1x1:1,64,1,1,1,4,32,2048,0
1280-610-86-1x1-896-610-86-2-0x0-1x1-1x1-0-NCHW-FP32-F=ConvOclDirectFwd1x1:1,64,1,1,1,0,16,2048,0
24-14-14-1x1-512-14-14-256-0x0-1x1-1x1-0-NCHW-FP16-B=ConvOclDirectFwd1x1:1,256,1,1,0,2,8,4,0;ConvAsm1x1U:1,16,2,16,1,2,1,8
116-225-792-1x1-16-225-792-6-0x0-1x1-1x1-0-NCHW-FP32-F=ConvOclDirectFwd1x1:1,128,1,1,0,2,16,4,0
256-120-192-3x3-256-120-192-64-1x1-1x1-1x1-0-NCHW-FP16-B=ConvOclDirectFwd:16,16,32,32,2,2,8,4,1
64-54-54-3x3-16-54-54-64-1x1-1x1-1x1-0-NCHW-FP16-F=ConvOclDirectFwd:16,16,32,32,2,2,8,4,2
928-13-493-1x1-416-13-493-32-0x0-1x1-1x1-0-NCHW-FP32-W=ConvAsmBwdWrW1x1:2,8,4,4,8,1,2,4,0,1
288-28-28-1x1-128-28-28-512-0x0-1x1-1x1-0-NCHW-FP32-B=ConvOclDirectFwd1x1:1,128,1,1,0,4,16,4,0;ConvAsm1x1U:1,16,1,32,2,2,1,4
64-56-56-3x3-192-56-56-64-1x1-1x1-1x1-0-NCHW-FP16-F=ConvOclDirectFwd:32,8,32,32,1,4,8,1,2;ConvOclDirectFwdFused:32,8,32,32,1,4,8,1,2
416-292-423-1x1-768-292-423-4-0x0-1x1-1x1-0-NCHW-FP32-F=ConvOclDirectFwd1x1:1,64,1,1,1,0,32,2048,0
480-14-14-1x1-128-14-14-32-0x0-1x1-1x1-0-NCHW-FP32-B=ConvOclDirectFwd1x1:1,256,1,1,0,4,16,4,0;ConvAsm1x1U:2,16,2,64,1,2,4,1
128-57-57-1x1-64-57-57-32-0x0-1x1-1x1-0-NCHW-FP32-B=ConvOclDirectFwd1x1:1,256,1,1,0,1,32,4,0;ConvAsm1x1U:1,16,3,64,3,1,1,4
16-73-550-1x1-160-73-550-32-0x0-1x1-1x1-0-NCHW-FP32-B=ConvOclDirectFwd1x1:1,128,1,1,0,2,32,4,0
224-75-346-1x1-1392-75-346-6-0x0-1x1-1x1-0-NCHW-FP32-B=ConvOclDirectFwd1x1:1,128,1,1,0,1,16,4,0
96-2-494-1x1-1184-2-494-6-0x0-1x1-1x1-0-NCHW-FP32-W=ConvAsmBwdWrW1x1:4,4,4,4,8,1,1,4,0,0
3-224-224-7x7-64-112-112-8-3x3-2x2-1x1-0-NCHW-FP32-F=ConvOclDirectFwd:16,16,16,32,1,2,8,1,1
1056-3-180-1x1-24-3-180-32-0x0-1x1-1x1-0-NCHW-FP32-W=ConvAsmBwdWrW1x1:4,4,2,4,4,1,1,4,0,0
768-450-588-1x1-1824-450-588-1-0x0-1x1-1x1-0-NCHW-FP32-B=ConvOclDirectFwd1x1:1,256,1,1,0,1,32,4,0
464-178-269-1x1-19-178-269-2-0x0-1x1-1x1-0-NCHW-FP32-F=ConvOclDirectFwd1x1:1,256,1,1,0,1,16,4,0
128-56-56-1x1-224-56-56-128-0x0-1x1-1x1-0-NCHW-FP32-F=ConvOclDirectFwd1x1:1,64,1,1,1,1,32,256,0;ConvAsm1x1U:2,16,2,64,2,2,1,2
48-35-35-1x1-288-35-35-32-0x0-1x1-1x1-0-NCHW-FP32-B=ConvOclDirectFwd1x1:1,256,1,1,0,1,32,4,0;ConvAsm1x1U:1,16,1,32,1,2,2,2
512-14-14-3x3-512-14-14-1-1x1-1x1-1x1-0-NCHW-FP32-B_g32=ConvOclDirectFwd:16,16,16,16,1,1,2,4,1
128-14-14-1x1-608-14-14-128-0x0-1x1-1x1-0-NCHW-FP16-B=ConvOclDirectFwd1x1:1,128,1,1,0,4,16,4,0;ConvAsm1x1U:1,16,2,16,1,2,1,4
3-147-429-1x1-480-147-429-12-0x0-1x1-1x1-0-NCHW-FP32-F=ConvOclDirectFwd1x1:1,256,1,1,0,1,32,4,0
320-353-985-1x1-1280-353-985-1-0x0-1x1-1x1-0-NCHW-FP32-F=ConvOclDirectFwd1x1:1,64,1,1,1,0,32,2048,0
1152-72-824-1x1-64-72-824-1-0x0-1x1-1x1-0-NCHW-FP32-F=ConvOclDirectFwd1x1:1,64,1,1,1,4,16,128,0
80-347-620-1x1-576-347-620-4-0x0-1x1-1x1-0-NCHW-FP32-B=ConvOclDirectFwd1x1:1,128,1,1,0,2,32,4,0
1408-250-313-1x1-1-250-313-4-0x0-1x1-1x1-0-NCHW-FP32-F=ConvOclDirectFwd1x1:1,256,1,1,0,2,16,8,0
640-218-239-1x1-416-218-239-16-0x0-1x1-1x1-0-NCHW-FP32-F=ConvOclDirectFwd1x1:1,64,1,1,1,0,64,2048,0
80-647-22-1x1-128-647-22-128-0x0-1x1-1x1-0-NCHW-FP32-W=ConvAsmBwdWrW1x1:4,4,4,4,4,1,4,4,0,2
192-328-621-1x1-704-328-621-1-0x0-1x1-1x1-0-NCHW-FP32-F=ConvOclDirectFwd1x1:1,64,1,1,1,4,32,2048,0
1792-298-74-1x1-2-298-74-2-0x0-1x1-1x1-0-NCHW-FP32-F=ConvOclDirectFwd1x1:1,64,1,1,0,4,16,8,0
128-14-14-1x1-608-14-14-256-0x0-1x1-1x1-0-NCHW-FP16-F=ConvOclDirectFwd1x1:8,64,16,16,0,2,16,4,1;ConvAsm1x1U:1,8,2,16,2,4,1,4
1056-19-905-1x1-1696-19-905-4-0x0-1x1-1x1-0-NCHW-FP32-B=ConvOclDirectFwd1x1:1,256,1,1,0,1,32,4,0
1280-8-8-1x1-320-8-8-256-0x0-1x1-1x1-0-NCHW-FP16-F=ConvOclDirectFwd1x1:1,128,1,1,0,4,8,4,0;ConvAsm1x1U:1,8,2,32,2,4,1,4
896-17-376-1x1-480-17-376-64-0x0-1x1-1x1-0-NCHW-FP32-W=ConvAsmBwdWrW1x1:1,16,4,8,4,1,1,4,0,2
24-14-14-1x1-512-14-14-1-0x0-1x1-1x1-0-NCHW-FP16-W=ConvAsmBwdWrW1x1:4,4,2,1,4,1,1,2,0,1
192-28-28-1x1-64-28-28-2-0x0-1x1-1x1-0-NCHW-FP32-F=ConvOclDirectFwd1x1:1,64,1,1,1,0,16,2048,0;ConvAsm1x1U:1,8,1,32,1,4,2,2;ConvActivAsm1x1U:1,16,1,32,1,4
1312-92-92-1x1-1056-92-92-4-0x0-1x1-1x1-0-NCHW-FP32-F=ConvOclDirectFwd1x1:1,64,1,1,1,0,64,2048,0
832-9-936-1x1-480-9-936-32-0x0-1x1-1x1-0-NCHW-FP32-F=ConvOclDirectFwd1x1:1,64,1,1,1,4,64,2048,0
256-544-546-1x1-336-544-546-1-0x0-1x1-1x1-0-NCHW-FP32-B=ConvOclDirectFwd1x1:1,256,1,1,0,4,16,8,0
128-28-28-3x3-128-28-28-128-1x1-1x1-1x1-0-NCHW-FP32-W=ConvAsmBwdWrW3x3:0,1,8,4,3,1
4-505-850-1x1-8-505-850-12-0x0-1x1-1x1-0-NCHW-FP32-W=ConvAsmBwdWrW1x1:4,4,2,1,2,1,4,4,0,1
112-19-392-1x1-1280-19-392-32-0x0-1x1-1x1-0-NCHW-FP32-W=ConvAsmBwdWrW1x1:2,8,8,8,2,1,1,4,0,1
256-63-751-1x1-384-63-751-1-0x0-1x1-1x1-0-NCHW-FP32-F=ConvOclDirectFwd1x1:1,64,1,1,1,0,16,2048,0
128-57-57-1x1-64-57-57-2-0x0-1x1-1x1-0-NCHW-FP32-B=ConvOclDirectFwd1x1:1,64,1,1,0,1,8,4,0;ConvAsm1x1U:1,8,1,64,1,4,2,2
2-501-545-1x1-1-501-545-8-0x0-1x1-1x1-0-NCHW-FP32-B=ConvOclDirectFwd1x1:1,256,1,1,0,1,4,4,0;ConvAsm1x1U:2,1,2,4,1,1,1,1
1024-17-17-1x1-256-17-17-16-0x0-1x1-1x1-0-NCHW-FP16-F=ConvOclDirectFwd1x1:1,64,1,1,0,1,8,8,0;ConvAsm1x1U:3,8,6,32,1,4,4,1
112-544-183-1x1-48-544-183-4-0x0-1x1-1x1-0-NCHW-FP32-W=ConvAsmBwdWrW1x1:4,4,4,4,2,1,2,4,0,1
1-177-639-1x1-3-177-639-128-0x0-1x1-1x1-0-NCHW-FP32-B=ConvOclDirectFwd1x1:1,128,1,1,0,1,4,4,0;ConvAsm1x1U:1,1,1,4,1,1,1,1
256-7-7-3x3-256-14-14-64-1x1-2x2-1x1-0-NCHW-FP16-W=ConvAsmBwdWrW3x3:0,0,8,4,5,1
19-416-294-1x1-3-416-294-16-0x0-1x1-1x1-0-NCHW-FP32-B=ConvOclDirectFwd1x1:1,128,1,1,0,1,16,4,0;ConvAsm1x1U:4,1,4,4,1,1,4,2
256-13-13-3x3-384-13-13-128-1x1-1x1-1x1-0-NCHW-FP16-B=ConvOclDirectFwd:8,8,16,16,2,2,8,2,2
240-1011-900-1x1-384-1011-900-1-0x0-1x1-1x1-0-NCHW-FP32-F=ConvOclDirectFwd1x1:1,64,1,1,1,0,32,2048,0
32-28-28-1x1-256-28-28-32-0x0-1x1-1x1-0-NCHW-FP16-B=ConvOclDirectFwd1x1:1,64,1,1,0,2,8,4,0;ConvAsm1x1U:1,8,2,16,1,4,1,4
64-44-886-1x1-1248-44-886-1-0x0-1x1-1x1-0-NCHW-FP32-B=ConvOclDirectFwd1x1:1,64,1,1,0,4,16,8,0
128-56-56-1x1-192-56-56-256-0x0-1x1-1x1-0-NCHW-FP16-B=ConvOclDirectFwd1x1:1,128,1,1,0,4,16,4,0;ConvAsm1x1U:1,16,2,32,1,2,1,4
192-276-582-1x1-96-276-582-2-0x0-1x1-1x1-0-NCHW-FP32-F=ConvOclDirectFwd1x1:1,64,1,1,1,4,64,2048,0
64-56-56-1x1-256-56-56-8-0x0-1x1-1x1-0-NCHW-FP16-B=ConvOclDirectFwd1x1:1,64,1,1,0,2,8,4,0;ConvAsm1x1U:1,16,2,32,1,2,1,4
3-108-108-3x3-64-54-54-128-1x1-2x2-1x1-0-NCHW-FP32-F=ConvOclDirectFwd:16,16,16,16,1,1,8,2,1
3-230-230-7x7-64-112-112-128-0x0-2x2-1x1-0-NCHW-FP32-F=ConvOclDirectFwd:16,8,16,16,1,2,8,1,1;ConvOclDirectFwdFused:16,8,16,16,1,2,8,1,1
960-503-246-1x1-608-503-246-2-0x0-1x1-1x1-0-NCHW-FP32-F=ConvOclDirectFwd1x1:1,64,1,1,1,1,64,2048,0
2-766-22-1x1-192-766-22-12-0x0-1x1-1x1-0-NCHW-FP32-W=ConvAsmBwdWrW1x1:4,4,2,2,4,1,4,4,0,3
192-739-319-1x1-352-739-319-1-0x0-1x1-1x1-0-NCHW-FP32-B=ConvOclDirectFwd1x1:1,256,1,1,0,1,32,4,0
128-28-28-1x1-256-28-28-16-0x0-1x1-1x1-0-NCHW-FP16-F=ConvOclDirectFwd1x1:1,64,1,1,0,4,16,4,0;ConvAsm1x1U:1,8,2,16,1,4,1,8
224-1005-140-1x1-288-1005-140-8-0x0-1x1-1x1-0-NCHW-FP32-B=ConvOclDirectFwd1x1:1,128,1,1,0,1,32,4,0
1584-69-422-1x1-1-69-422-8-0x0-1x1-1x1-0-NCHW-FP32-F=ConvOclDirectFwd1x1:1,256,1,1,0,2,16,8,0
1344-342-158-1x1-1104-342-158-2-0x0-1x1-1x1-0-NCHW-FP32-F=ConvOclDirectFwd1x1:1,64,1,1,1,4,32,2048,0
1000-1005-321-1x1-1632-1005-321-1-0x0-1x1-1x1-0-NCHW-FP32-B=ConvOclDirectFwd1x1:1,128,1,1,0,1,32,4,0
2-20-247-1x1-1344-20-247-4-0x0-1x1-1x1-0-NCHW-FP32-B=ConvOclDirectFwd1x1:1,256,1,1,0,1,4,4,0
384-7-7-1x1-832-7-7-512-0x0-1x1-1x1-0-NCHW-FP32-B=ConvOclDirectFwd1x1:1,64,1,1,0,1,32,4,0;ConvAsm1x1U:1,16,1,64,4,2,1,1
1504-692-165-1x1-992-692-165-2-0x0-1x1-1x1-0-NCHW-FP32-F=ConvOclDirectFwd1x1:1,64,1,1,1,4,64,2048,0
2048-7-7-1x1-1024-4-4-32-0x0-2x2-1x1-0-NCHW-FP16-F=ConvOclDirectFwd1x1:1,256,1,1,0,1,16,4,0;ConvAsm1x1U:2,4,4,4,1,2,2,4
832-14-14-1x1-128-14-14-64-0x0-1x1-1x1-0-NCHW-FP32-B=ConvOclDirectFwd1x1:8,64,16,16,0,2,16,4,1;ConvAsm1x1U:4,16,4,64,1,2,4,1
384-950-27-1x1-160-950-27-48-0x0-1x1-1x1-0-NCHW-FP32-F=ConvOclDirectFwd1x1:1,64,1,1,1,0,64,2048,0
928-135-801-1x1-320-135-801-4-0x0-1x1-1x1-0-NCHW-FP32-B=ConvOclDirectFwd1x1:1,128,1,1,0,1,32,4,0
96-28-28-5x5-32-28-28-512-2x2-1x1-1x1-0-NCHW-FP16-B=ConvOclDirectFwd:16,16,32,32,2,2,8,4,2
1056-410-685-1x1-736-410-685-1-0x0-1x1-1x1-0-NCHW-FP32-F=ConvOclDirectFwd1x1:1,64,1,1,1,4,64,2048,0
80-73-73-1x1-64-73-73-128-0x0-1x1-1x1-0-NCHW-FP16-W=ConvAsmBwdWrW1x1:4,4,4,4,2,2,4,4,0,1
192-909-149-1x1-1-909-149-6-0x0-1x1-1x1-0-NCHW-FP32-B=ConvOclDirectFwd1x1:1,256,1,1,0,1,16,8,0
192-28-28-1x1-672-28-28-16-0x0-1x1-1x1-0-NCHW-FP32-B=ConvOclDirectFwd1x1:1,64,1,1,0,4,16,4,0;ConvAsm1x1U:1,16,1,16,1,2,2,2
432-326-123-1x1-1280-326-123-2-0x0-1x1-1x1-0-NCHW-FP32-F=ConvOclDirectFwd1x1:1,64,1,1,1,0,16,2048,0
960-13-954-1x1-256-13-954-8-0x0-1x1-1x1-0-NCHW-FP32-W=ConvAsmBwdWrW1x1:1,16,4,4,4,1,1,4,0,1
320-317-18-1x1-64-317-18-128-0x0-1x1-1x1-0-NCHW-FP32-F=ConvOclDirectFwd1x1:16,16,32,32,1,0,32,128,1;ConvAsm1x1U:1,32,4,16,1,1,1,1
512-28-28-1x1-128-28-28-128-0x0-1x1-1x1-0-NCHW-FP32-W=ConvAsmBwdWrW1x1:2,8,2,8,2,2,1,4,0,1
160-332-283-1x1-80-332-283-2-0x0-1x1-1x1-0-NCHW-FP32-B=ConvOclDirectFwd1x1:1,256,1,1,0,4,16,4,0
352-7-7-1x1-1024-7-7-64-0x0-1x1-1x1-0-NCHW-FP16-W=ConvAsmBwdWrW1x1:2,8,4,8,2,2,1,2,0,2
64-28-28-1x1-192-28-28-16-0x0-1x1-1x1-0-NCHW-FP16-W=ConvAsmBwdWrW1x1:2,8,2,4,2,1,4,4,0,1
64-56-56-1x1-128-56-56-256-0x0-1x1-1x1-0-NCHW-FP32-B=ConvOclDirectFwd1x1:1,64,1,1,0,2,32,4,0;ConvAsm1x1U:1,32,1,64,1,1,1,1
192-8-8-1x1-1280-8-8-64-0x0-1x1-1x1-0-NCHW-FP16-B=ConvOclDirectFwd1x1:1,64,1,1,0,4,16,4,0;ConvAsm1x1U:1,16,2,32,1,2,2,4
512-28-28-3x3-512-28-28-64-1x1-1x1-1x1-0-NCHW-FP16-B=ConvOclDirectFwd:16,16,32,32,2,2,8,1,1
216-28-28-1x1-54-28-28-2-0x0-1x1-1x1-0-NCHW-FP16-B_g3=ConvOclDirectFwd:16,16,16,16,1,1,2,2,2
1024-14-14-1x1-256-14-14-4-0x0-1x1-1x1-0-NCHW-FP32-F=ConvOclDirectFwd1x1:1,64,1,1,1,0,16,256,0;ConvAsm1x1U:4,8,4,64,1,4,2,2;ConvActivAsm1x1U:2,16,2,32,2,3
64-209-209-3x3-128-104-104-32-0x0-2x2-1x1-0-NCHW-FP32-F=ConvOclDirectFwd:16,8,16,16,1,2,8,2,2
704-6-238-1x1-864-6-238-8-0x0-1x1-1x1-0-NCHW-FP32-B=ConvOclDirectFwd1x1:1,256,1,1,0,4,16,8,0;ConvAsm1x1U:3,16,3,64,1,2,1,4
1056-50-2-1x1-3-50-2-48-0x0-1x1-1x1-0-NCHW-FP32-W=ConvAsmBwdWrW1x1:4,4,2,4,2,2,1,4,0,1
58-28-28-1x1-24-28-28-1-0x0-1x1-1x1-0-NCHW-FP32-W=ConvAsmBwdWrW1x1:4,4,2,1,2,1,1,2,0,1
256-13-13-3x3-256-13-13-2048-1x1-1x1-1x1-0-NCHW-FP32-W=ConvAsmBwdWrW3x3:0,1,8,8,3,1
512-29-29-1x1-512-29-29-32-0x0-1x1-1x1-0-NCHW-FP32-W=ConvAsmBwdWrW1x1:1,16,2,8,4,1,1,4,0,1
144-136-950-1x1-896-136-950-2-0x0-1x1-1x1-0-NCHW-FP32-F=ConvOclDirectFwd1x1:1,64,1,1,1,4,32,2048,0
192-504-21-1x1-768-504-21-1-0x0-1x1-1x1-0-NCHW-FP32-W=ConvAsmBwdWrW1x1:1,16,2,4,8,1,1,4,0,2
256-14-14-3x3-256-28-28-16-1x1-2x2-1x1-0-NCHW-FP16-W=ConvAsmBwdWrW3x3:0,0,8,4,6,1
1600-276-552-1x1-80-276-552-1-0x0-1x1-1x1-0-NCHW-FP32-F=ConvOclDirectFwd1x1:1,64,1,1,1,4,32,256,0
320-182-655-1x1-4-182-655-12-0x0-1x1-1x1-0-NCHW-FP32-F=ConvOclDirectFwd1x1:1,256,1,1,0,2,16,8,0
232-45-340-1x1-144-45-340-48-0x0-1x1-1x1-0-NCHW-FP32-W=ConvAsmBwdWrW1x1:2,8,2,8,2,1,1,4,0,1
80-38-866-1x1-160-38-866-2-0x0-1x1-1x1-0-NCHW-FP32-W=ConvAsmBwdWrW1x1:4,4,4,4,4,1,2,4,0,1
1872-36-476-1x1-32-36-476-4-0x0-1x1-1x1-0-NCHW-FP32-F=ConvOclDirectFwd1x1:1,64,1,1,1,4,64,2048,0
128-14-14-1x1-512-14-14-1-0x0-1x1-1x1-0-NCHW-FP16-W=ConvAsmBwdWrW1x1:2,8,2,2,2,1,1,4,0,0
32-378-133-1x1-528-378-133-6-0x0-1x1-1x1-0-NCHW-FP32-B=ConvOclDirectFwd1x1:1,256,1,1,0,2,16,8,0
3-227-227-7x7-64-114-114-64-3x3-2x2-1x1-0-NCHW-FP32-F=ConvOclDirectFwd:16,16,16,32,1,2,8,1,2
320-8-8-1x1-2048-8-8-16-0x0-1x1-1x1-0-NCHW-FP16-B=ConvOclDirectFwd1x1:1,64,1,1,0,4,16,4,0;ConvAsm1x1U:1,16,2,32,1,2,2,4
576-25-144-1x1-4-25-144-8-0x0-1x1-1x1-0-NCHW-FP32-W=ConvAsmBwdWrW1x1:4,4,2,2,2,1,1,4,0,2
1248-223-784-1x1-128-223-784-1-0x0-1x1-1x1-0-NCHW-FP32-F=ConvOclDirectFwd1x1:1,64,1,1,1,0,16,256,0
112-627-423-1x1-832-627-423-1-0x0-1x1-1x1-0-NCHW-FP32-B=ConvOclDirectFwd1x1:1,256,1,1,0,1,32,4,0
48-35-35-1x1-288-35-35-64-0x0-1x1-1x1-0-NCHW-FP16-W=ConvAsmBwdWrW1x1:4,4,8,4,2,1,4,4,0,1
3-332-937-1x1-24-332-937-64-0x0-1x1-1x1-0-NCHW-FP32-W=ConvAsmBwdWrW1x1:4,4,2,1,2,1,4,4,0,1
1000-13-13-1x1-512-13-13-256-0x0-1x1-1x1-0-NCHW-FP16-F=ConvOclDirectFwd1x1:8,64,16,16,0,1,16,4,1;ConvAsm1x1U:3,8,6,32,1,4,1,1
58-811-19-1x1-112-811-19-32-0x0-1x1-1x1-0-NCHW-FP32-F=ConvOclDirectFwd1x1:1,64,1,1,0,1,16,4,0;ConvAsm1x1U:1,16,1,64,1,2,1,4
58-28-28-1x1-24-28-28-16-0x0-1x1-1x1-0-NCHW-FP32-W=ConvAsmBwdWrW1x1:4,4,2,2,2,1,4,4,0,1
192-8-8-3x3-192-17-17-128-0x0-2x2-1x1-0-NCHW-FP32-B=ConvOclDirectFwd:16,8,32,32,2,4,4,4,2
256-279-1022-1x1-512-279-1022-1-0x0-1x1-1x1-0-NCHW-FP32-F=ConvOclDirectFwd1x1:1,64,1,1,1,0,32,2048,0
32-28-28-5x5-192-28-28-4-2x2-1x1-1x1-0-NCHW-FP32-W=ConvOclBwdWrW2<1>:1,10,1,3,7;ConvOclBwdWrW2<4>:1,10,1,3,7;ConvOclBwdWrW2<2>:1,7,1,8,7
1024-7-7-1x1-192-7-7-32-0x0-1x1-1x1-0-NCHW-FP16-F=ConvOclDirectFwd1x1:1,64,1,1,0,1,8,8,0;ConvAsm1x1U:2,8,4,16,1,4,4,1
672-7-7-1x1-128-7-7-256-0x0-1x1-1x1-0-NCHW-FP16-W=ConvAsmBwdWrW1x1:2,8,2,8,2,1,2,4,0,1
192-14-14-1x1-480-14-14-1-0x0-1x1-1x1-0-NCHW-FP16-B=ConvOclDirectFwd1x1:1,64,1,1,0,4,4,8,0;ConvAsm1x1U:1,8,2,64,1,4,4,2
4-16-96-1x1-2112-16-96-16-0x0-1x1-1x1-0-NCHW-FP32-B=ConvOclDirectFwd1x1:1,128,1,1,0,1,4,4,0;ConvAsm1x1U:1,8,1,16,1,1,1,1
116-424-799-1x1-8-424-799-4-0x0-1x1-1x1-0-NCHW-FP32-F=ConvOclDirectFwd1x1:1,256,1,1,0,4,16,4,0
896-14-14-1x1-128-14-14-128-0x0-1x1-1x1-0-NCHW-FP16-B=ConvOclDirectFwd1x1:1,256,1,1,0,2,32,8,0;ConvAsm1x1U:1,16,2,16,1,2,4,2
2016-7-7-1x1-192-7-7-16-0x0-1x1-1x1-0-NCHW-FP32-F=ConvOclDirectFwd1x1:1,64,1,1,1,4,16,256,0;ConvAsm1x1U:4,8,4,16,1,4,4,1;ConvActivAsm1x1U:4,16,4,16,1,4
640-391-326-1x1-1504-391-326-2-0x0-1x1-1x1-0-NCHW-FP32-B=ConvOclDirectFwd1x1:1,256,1,1,0,1,32,4,0
8-535-185-1x1-160-535-185-4-0x0-1x1-1x1-0-NCHW-FP32-B=ConvOclDirectFwd1x1:1,256,1,1,0,1,32,4,0
128-28-28-3x3-96-28-28-32-1x1-1x1-1x1-0-NCHW-FP16-B=ConvOclDirectFwd:32,8,32,32,1,4,8,2,2
512-14-14-3x3-512-14-14-512-1x1-1x1-1x1-0-NCHW-FP16-W=ConvAsmBwdWrW3x3:0,0,8,4,3,1
16-207-180-1x1-544-207-180-2-0x0-1x1-1x1-0-NCHW-FP32-F=ConvOclDirectFwd1x1:1,64,1,1,1,1,64,2048,0
256-14-14-1x1-128-14-14-32-0x0-1x1-1x1-0-NCHW-FP32-F=ConvOclDirectFwd1x1:1,64,1,1,1,0,16,2048,0;ConvAsm1x1U:4,8,4,64,1,4,1,2
896-125-162-1x1-928-125-162-2-0x0-1x1-1x1-0-NCHW-FP32-F=ConvOclDirectFwd1x1:1,64,1,1,1,0,64,2048,0
1248-272-24-1x1-192-272-24-48-0x0-1x1-1x1-0-NCHW-FP32-F=ConvOclDirectFwd1x1:16,16,32,32,1,0,32,128,1
160-85-177-1x1-4-85-177-64-0x0-1x1-1x1-0-NCHW-FP32-B=ConvOclDirectFwd1x1:1,256,1,1,0,1,16,4,0;ConvAsm1x1U:1,4,3,4,1,1,1,1
32-292-195-1x1-1792-292-195-1-0x0-1x1-1x1-0-NCHW-FP32-B=ConvOclDirectFwd1x1:1,256,1,1,0,2,32,4,0
144-553-474-1x1-1312-553-474-1-0x0-1x1-1x1-0-NCHW-FP32-B=ConvOclDirectFwd1x1:1,128,1,1,0,1,32,4,0
64-739-280-1x1-2-739-280-32-0x0-1x1-1x1-0-NCHW-FP32-W=ConvAsmBwdWrW1x1:4,4,2,1,2,1,4,4,0,1
256-13-13-3x3-384-13-13-4-1x1-1x1-1x1-0-NCHW-FP16-W=ConvAsmBwdWrW3x3:0,1,8,4,1,1
704-992-4-1x1-928-992-4-6-0x0-1x1-1x1-0-NCHW-FP32-F=ConvOclDirectFwd1x1:1,64,1,1,1,1,64,2048,0;ConvAsm1x1U:2,16,5,64,2,1,1,1
512-29-29-1x1-256-57-57-128-0x0-2x2-1x1-0-NCHW-FP32-B=ConvOclDirectFwd1x1:1,256,1,1,0,1,32,4,0;ConvAsm1x1U:1,32,3,16,1,1,1,1
128-14-14-1x1-800-14-14-128-0x0-1x1-1x1-0-NCHW-FP16-W=ConvAsmBwdWrW1x1:2,8,4,8,2,1,2,4,0,1
512-340-76-1x1-2016-340-76-8-0x0-1x1-1x1-0-NCHW-FP32-B=ConvOclDirectFwd1x1:1,256,1,1,0,2,32,4,0
2-334-897-1x1-624-334-897-1-0x0-1x1-1x1-0-NCHW-FP32-B=ConvOclDirectFwd1x1:1,256,1,1,0,2,16,4,0
704-60-284-1x1-352-60-284-4-0x0-1x1-1x1-0-NCHW-FP32-F=ConvOclDirectFwd1x1:1,64,1,1,1,4,64,2048,0
58-617-103-1x1-3-617-103-8-0x0-1x1-1x1-0-NCHW-FP32-B=ConvOclDirectFwd1x1:1,256,1,1,0,1,16,4,0;ConvAsm1x1U:2,1,2,4,1,1,2,2
128-7-7-1x1-544-7-7-32-0x0-1x1-1x1-0-NCHW-FP32-F=ConvOclDirectFwd1x1:1,64,1,1,1,1,16,256,0;ConvAsm1x1U:1,8,1,64,3,4,1,4
80-997-396-1x1-1104-997-396-1-0x0-1x1-1x1-0-NCHW-FP32-F=ConvOclDirectFwd1x1:1,64,1,1,1,0,32,128,0
800-67-441-1x1-8-67-441-1-0x0-1x1-1x1-0-NCHW-FP32-F=ConvOclDirectFwd1x1:1,256,1,1,0,1,16,4,0
1104-464-153-1x1-1120-464-153-2-0x0-1x1-1x1-0-NCHW-FP32-B=ConvOclDirectFwd1x1:1,64,1,1,0,2,32,4,0
768-330-1-1x1-64-330-1-6-0x0-1x1-1x1-0-NCHW-FP32-W=ConvAsmBwdWrW1x1:1,16,2,4,2,1,1,4,0,2
192-14-14-1x1-912-14-14-16-0x0-1x1-1x1-0-NCHW-FP32-W=ConvAsmBwdWrW1x1:1,16,2,8,4,1,1,4,0,1
1-7-767-1x1-32-7-767-512-0x0-1x1-1x1-0-NCHW-FP32-F=ConvOclDirectFwd1x1:1,256,1,1,0,1,32,4,0;ConvAsm1x1U:1,8,1,16,1,1,1,1
3-2-2-3x3-4-3-3-128-1x1-2x2-1x1-0-NCHW-FP32-W=ConvAsmBwdWrW3x3:0,0,16,1,3,5
960-28-275-1x1-116-28-275-12-0x0-1x1-1x1-0-NCHW-FP32-B=ConvOclDirectFwd1x1:1,64,1,1,0,4,8,4,0
192-35-35-3x3-192-71-71-32-0x0-2x2-1x1-0-NCHW-FP32-B=ConvOclDirectFwd:16,16,16,16,1,1,4,1,1
3-503-91-1x1-3-503-91-512-0x0-1x1-1x1-0-NCHW-FP32-B=ConvOclDirectFwd1x1:1,128,1,1,0,1,16,4,0;ConvAsm1x1U:1,1,1,4,1,1,1,1
3-225-225-7x7-64-112-112-64-2x2-2x2-1x1-0-NCHW-FP32-F=ConvOclDirectFwd:16,8,16,16,1,2,8,1,2;ConvOclDirectFwdFused:16,8,16,16,1,2,8,1,2
64-655-840-1x1-384-655-840-2-0x0-1x1-1x1-0-NCHW-FP32-F=ConvOclDirectFwd1x1:16,16,32,32,1,0,32,128,1
1-548-151-1x1-544-548-151-8-0x0-1x1-1x1-0-NCHW-FP32-B=ConvOclDirectFwd1x1:1,128,1,1,0,4,8,4,0
64-114-114-7x7-3-227-227-8-3x3-2x2-1x1-0-NCHW-FP32-B=ConvOclDirectFwd:8,16,32,32,4,2,1,2,2
624-308-771-1x1-3-308-771-2-0x0-1x1-1x1-0-NCHW-FP32-F=ConvOclDirectFwd1x1:1,256,1,1,0,4,8,4,0
928-9-155-1x1-54-9-155-64-0x0-1x1-1x1-0-NCHW-FP32-F=ConvOclDirectFwd1x1:1,256,1,1,0,1,16,4,0;ConvAsm1x1U:1,32,6,32,1,1,1,1
736-13-178-1x1-1056-13-178-6-0x0-1x1-1x1-0-NCHW-FP32-W=ConvAsmBwdWrW1x1:2,8,4,4,8,1,1,4,0,1
1056-7-7-1x1-192-7-7-32-0x0-1x1-1x1-0-NCHW-FP16-F=ConvOclDirectFwd1x1:1,64,1,1,0,1,8,4,0;ConvAsm1x1U:1,8,2,32,1,4,4,2
64-775-902-1x1-480-775-902-1-0x0-1x1-1x1-0-NCHW-FP32-B=ConvOclDirectFwd1x1:1,256,1,1,0,2,32,4,0
24-64-128-1x1-512-64-128-1-0x0-1x1-1x1-0-NCHW-FP32-W=ConvAsmBwdWrW1x1:2,8,2,2,4,1,1,4,0,3
256-20-84-3x3-256-20-84-16-1x1-1x1-1x1-0-NCHW-FP16-B=ConvOclDirectFwd:16,16,32,32,2,2,8,4,2
992-197-170-1x1-960-197-170-4-0x0-1x1-1x1-0-NCHW-FP32-B=ConvOclDirectFwd1x1:1,128,1,1,0,1,32,4,0
224-56-56-1x1-128-56-56-32-0x0-1x1-1x1-0-NCHW-FP32-B=ConvOclDirectFwd1x1:1,128,1,1,0,1,32,4,0;ConvAsm1x1U:1,32,1,64,1,1,1,2
16-28-28-5x5-32-28-28-16-2x2-1x1-1x1-0-NCHW-FP16-F=ConvOclDirectFwd:8,32,32,32,4,1,4,4,2;ConvOclDirectFwdFused:8,32,32,32,4,1,4,4,2
24-3-180-1x1-1056-3-180-32-0x0-1x1-1x1-0-NCHW-FP32-F=ConvOclDirectFwd1x1:1,256,1,1,0,4,4,8,0;ConvAsm1x1U:1,8,1,16,1,1,1,1
2048-178-52-1x1-928-178-52-6-0x0-1x1-1x1-0-NCHW-FP32-F=ConvOclDirectFwd1x1:1,64,1,1,1,0,64,2048,0
288-28-28-1x1-128-28-28-32-0x0-1x1-1x1-0-NCHW-FP16-F=ConvOclDirectFwd1x1:1,64,1,1,0,4,8,4,0;ConvAsm1x1U:1,8,2,16,1,4,1,4
2-825-8-1x1-864-825-8-32-0x0-1x1-1x1-0-NCHW-FP32-F=ConvOclDirectFwd1x1:1,64,1,1,0,2,32,4,0
512-14-14-1x1-112-14-14-1-0x0-1x1-1x1-0-NCHW-FP32-F=ConvOclDirectFwd1x1:1,64,1,1,1,0,64,64,0;ConvAsm1x1U:1,8,1,64,1,4,4,1;ConvActivAsm1x1U:1,16,1,32,1,4
672-14-14-1x1-128-14-14-16-0x0-1x1-1x1-0-NCHW-FP16-F=ConvOclDirectFwd1x1:1,128,1,1,0,2,4,4,0;ConvAsm1x1U:2,8,4,64,1,4,4,4
416-108-111-1x1-80-108-111-64-0x0-1x1-1x1-0-NCHW-FP32-W=ConvAsmBwdWrW1x1:2,8,2,4,4,1,1,4,0,1
1056-1-640-1x1-112-1-640-4-0x0-1x1-1x1-0-NCHW-FP32-F=ConvOclDirectFwd1x1:1,64,1,1,1,4,32,256,0;ConvAsm1x1U:4,8,5,64,1,4,2,2
128-28-28-3x3-32-28-28-256-1x1-1x1-1x1-0-NCHW-FP16-W=ConvAsmBwdWrW3x3:0,0,8,2,2,8
144-258-470-1x1-1-258-470-6-0x0-1x1-1x1-0-NCHW-FP32-B=ConvOclDirectFwd1x1:1,64,1,1,0,4,8,8,0
128-56-56-1x1-96-56-56-32-0x0-1x1-1x1-0-NCHW-FP32-W=ConvAsmBwdWrW1x1:4,4,4,4,4,1,4,4,0,1
960-399-189-1x1-624-399-189-4-0x0-1x1-1x1-0-NCHW-FP32-B=ConvOclDirectFwd1x1:1,256,1,1,0,1,16,8,0
512-7-7-3x3-512-14-14-64-1x1-2x2-1x1-0-NCHW-FP16-W=ConvAsmBwdWrW3x3:0,0,8,4,1,1
1-967-24-1x1-64-967-24-64-0x0-1x1-1x1-0-NCHW-FP32-F=ConvOclDirectFwd1x1:1,256,1,1,0,1,64,4,0;ConvAsm1x1U:1,8,1,16,1,1,1,1
128-14-14-1x1-608-14-14-32-0x0-1x1-1x1-0-NCHW-FP32-W=ConvAsmBwdWrW1x1:1,16,2,4,8,1,2,4,0,1
256-8-8-1x1-1536-8-8-32-0x0-1x1-1x1-0-NCHW-FP32-W=ConvAsmBwdWrW1x1:2,8,2,4,8,1,1,4,0,3
192-14-14-1x1-1584-14-14-16-0x0-1x1-1x1-0-NCHW-FP16-W=ConvAsmBwdWrW1x1:2,8,4,8,2,1,2,4,0,1
288-38-390-1x1-1888-38-390-8-0x0-1x1-1x1-0-NCHW-FP32-B=ConvOclDirectFwd1x1:1,128,1,1,0,1,32,4,0
32-7-7-5x5-128-7-7-32-2x2-1x1-1x1-0-NCHW-FP16-F=ConvOclDirectFwd:8,8,8,8,1,1,4,4,2;ConvOclDirectFwdFused:8,8,8,8,1,1,4,4,2
1216-205-358-1x1-480-205-358-4-0x0-1x1-1x1-0-NCHW-FP32-F=ConvOclDirectFwd1x1:1,64,1,1,1,0,64,2048,0
144-55-153-1x1-544-55-153-16-0x0-1x1-1x1-0-NCHW-FP32-F=ConvOclDirectFwd1x1:1,64,1,1,1,4,64,256,0
160-7-7-1x1-832-7-7-256-0x0-1x1-1x1-0-NCHW-FP32-B=ConvOclDirectFwd1x1:1,256,1,1,0,1,32,4,0;ConvAsm1x1U:1,16,1,64,2,2,1,4
19-156-159-1x1-1056-156-159-1-0x0-1x1-1x1-0-NCHW-FP32-B=ConvOclDirectFwd1x1:1,256,1,1,0,4,4,4,0
448-28-28-1x1-128-28-28-64-0x0-1x1-1x1-0-NCHW-FP16-B=ConvOclDirectFwd1x1:1,64,1,1,0,4,16,4,0;ConvAsm1x1U:1,16,2,16,1,2,2,2
608-409-918-1x1-336-409-918-1-0x0-1x1-1x1-0-NCHW-FP32-B=ConvOclDirectFwd1x1:1,128,1,1,0,2,16,4,0
512-15-15-3x3-512-29-29-2-1x1-2x2-1x1-0-NCHW-FP32-W_g32=ConvOclBwdWrW2<1>:1,7,3,1,5;ConvAsmBwdWrW3x3:0,0,16,4,6,1;ConvOclBwdWrW2<2>:1,7,3,1,5
128-14-14-3x3-256-14-14-64-1x1-1x1-1x1-0-NCHW-FP16-F=ConvOclDirectFwd:8,16,16,16,2,1,8,1,2;ConvOclDirectFwdFused:8,8,16,16,2,2,8,2,1
384-13-13-3x3-192-13-13-512-1x1-1x1-1x1-0-NCHW-FP16-F=ConvOclDirectFwd:8,8,16,16,2,2,8,1,1
16-1009-98-1x1-32-1009-98-48-0x0-1x1-1x1-0-NCHW-FP32-F=ConvOclDirectFwd1x1:1,64,1,1,1,0,16,128,0;ConvAsm1x1U:1,8,1,64,2,1,4,4
1728-295-536-1x1-58-295-536-1-0x0-1x1-1x1-0-NCHW-FP32-F=ConvOclDirectFwd1x1:1,64,1,1,0,4,16,4,0
1024-7-7-1x1-2048-7-7-64-0x0-1x1-1x1-0-NCHW-FP32-B=ConvOclDirectFwd1x1:1,256,1,1,0,1,32,4,0;ConvAsm1x1U:1,16,1,64,4,2,1,1
864-555-22-1x1-144-555-22-2-0x0-1x1-1x1-0-NCHW-FP32-B=ConvOclDirectFwd1x1:1,128,1,1,0,2,16,4,0
512-28-28-1x1-128-28-28-128-0x0-1x1-1x1-0-NCHW-FP32-B=ConvOclDirectFwd1x1:1,64,1,1,0,1,32,4,0;ConvAsm1x1U:1,32,1,64,2,1,1,4
608-14-14-1x1-192-14-14-64-0x0-1x1-1x1-0-NCHW-FP32-F=ConvOclDirectFwd1x1:1,64,1,1,1,4,16,2048,0;ConvAsm1x1U:2,16,2,64,2,2,1,1;ConvActivAsm1x1U:2,16,4,64,1,1
1200-509-32-1x1-672-509-32-4-0x0-1x1-1x1-0-NCHW-FP32-F=ConvOclDirectFwd1x1:1,64,1,1,1,0,64,2048,0
832-154-770-1x1-704-154-770-4-0x0-1x1-1x1-0-NCHW-FP32-B=ConvOclDirectFwd1x1:1,128,1,1,0,2,32,4,0
64-56-56-1x1-64-56-56-8-0x0-1x1-1x1-0-NCHW-FP16-B=ConvOclDirectFwd1x1:1,256,1,1,0,2,16,8,0;ConvAsm1x1U:1,8,2,64,1,4,2,4
32-14-14-5x5-64-14-14-1-2x2-1x1-1x1-0-NCHW-FP32-F=ConvOclDirectFwd:16,16,16,16,1,1,1,4,1;ConvOclDirectFwdFused:16,16,16,16,1,1,1,4,1
512-28-28-3x3-256-28-28-4-1x1-1x1-1x1-0-NCHW-FP32-W=ConvAsmBwdWrW3x3:0,0,8,4,3,1
160-17-17-1x1-768-17-17-8-0x0-1x1-1x1-0-NCHW-FP32-B=ConvOclDirectFwd1x1:1,64,1,1,0,1,16,4,0;ConvAsm1x1U:1,16,1,64,2,2,1,1
1024-14-14-1x1-256-14-14-128-0x0-1x1-1x1-0-NCHW-FP16-B=ConvOclDirectFwd1x1:1,64,1,1,0,2,32,8,0;ConvAsm1x1U:1,16,2,16,1,2,2,2
128-28-28-1x1-448-28-28-32-0x0-1x1-1x1-0-NCHW-FP16-W=ConvAsmBwdWrW1x1:4,4,8,4,2,1,2,4,0,0
512-32-32-1x1-1024-64-64-4-0x0-2x2-1x1-0-NCHW-FP32-B=ConvOclDirectFwd1x1:1,256,1,1,0,2,16,4,0
16-395-397-1x1-1600-395-397-2-0x0-1x1-1x1-0-NCHW-FP32-B=ConvOclDirectFwd1x1:1,256,1,1,0,1,32,4,0
1024-15-15-1x1-512-15-15-48-0x0-1x1-1x1-0-NCHW-FP32-B=ConvOclDirectFwd1x1:1,256,1,1,0,1,32,4,0;ConvAsm1x1U:4,16,4,64,1,2,2,2
192-14-14-1x1-480-14-14-1-0x0-1x1-1x1-0-NCHW-FP32-W=ConvAsmBwdWrW1x1:2,8,8,2,2,1,1,4,0,1
1024-7-7-3x3-1024-7-7-256-1x1-1x1-1x1-0-NCHW-FP32-F_g32=ConvOclDirectFwd:8,8,8,8,1,1,8,2,1
2112-175-779-1x1-116-175-779-1-0x0-1x1-1x1-0-NCHW-FP32-F=ConvOclDirectFwd1x1:1,256,1,1,0,1,16,4,0
192-27-27-5x5-64-27-27-64-2x2-1x1-1x1-0-NCHW-FP16-F=ConvOclDirectFwd:16,16,32,32,2,2,8,1,2
160-14-14-1x1-512-14-14-16-0x0-1x1-1x1-0-NCHW-FP32-B=ConvOclDirectFwd1x1:1,64,1,1,0,2,16,4,0;ConvAsm1x1U:1,16,1,32,1,2,1,4
16-42-562-1x1-384-42-562-16-0x0-1x1-1x1-0-NCHW-FP32-B=ConvOclDirectFwd1x1:1,256,1,1,0,4,16,8,0
2-8-783-1x1-224-8-783-16-0x0-1x1-1x1-0-NCHW-FP32-F=ConvOclDirectFwd1x1:1,256,1,1,0,1,4,4,0;ConvAsm1x1U:1,8,1,64,1,1,2,8
720-166-34-1x1-704-166-34-64-0x0-1x1-1x1-0-NCHW-FP32-F=ConvOclDirectFwd1x1:1,64,1,1,1,4,16,128,0;ConvAsm1x1U:1,32,3,32,2,1,2,2
512-42-472-1x1-32-42-472-6-0x0-1x1-1x1-0-NCHW-FP32-W=ConvAsmBwdWrW1x1:4,4,8,2,2,1,1,4,0,1
448-21-927-1x1-384-21-927-8-0x0-1x1-1x1-0-NCHW-FP32-W=ConvAsmBwdWrW1x1:2,8,8,8,2,1,1,4,0,1
64-35-35-1x1-256-35-35-32-0x0-1x1-1x1-0-NCHW-FP16-W=ConvAsmBwdWrW1x1:4,4,8,4,2,1,4,4,0,1
24-14-14-1x1-512-14-14-8-0x0-1x1-1x1-0-NCHW-FP32-W=ConvAsmBwdWrW1x1:4,4,2,4,2,1,1,4,0,2
2048-80-8-1x1-512-80-8-1-0x0-1x1-1x1-0-NCHW-FP32-W=ConvAsmBwdWrW1x1:1,16,2,8,4,1,1,4,0,1
128-7-7-1x1-800-7-7-64-0x0-1x1-1x1-0-NCHW-FP32-W=ConvAsmBwdWrW1x1:1,16,2,4,8,1,2,4,0,2
288-134-292-1x1-832-134-292-1-0x0-1x1-1x1-0-NCHW-FP32-B=ConvOclDirectFwd1x1:1,256,1,1,0,2,32,4,0
64-80-349-5x5-1-161-700-64-1x1-2x2-1x1-0-NCHW-FP32-W=ConvOclBwdWrW2<1>:8,6,8,1,5;ConvOclBwdWrW2<16>:8,7,3,1,5;ConvOclBwdWrW2<8>:8,7,3,1,5;ConvOclBwdWrW2<4>:8,7,3,1,5;ConvOclBwdWrW2<2>:8,7,3,1,5
144-423-789-1x1-1-423-789-4-0x0-1x1-1x1-0-NCHW-FP32-B=ConvOclDirectFwd1x1:1,128,1,1,0,1,16,8,0
256-13-13-3x3-256-13-13-512-1x1-1x1-1x1-0-NCHW-FP16-W=ConvAsmBwdWrW3x3:0,1,8,4,3,1
1024-14-14-1x1-512-14-14-256-0x0-1x1-1x1-0-NCHW-FP16-F=ConvOclDirectFwd1x1:1,64,1,1,0,2,16,4,0;ConvAsm1x1U:2,8,4,64,1,4,2,4
384-368-223-1x1-32-368-223-12-0x0-1x1-1x1-0-NCHW-FP32-B=ConvOclDirectFwd1x1:1,128,1,1,0,2,32,4,0
3-207-672-1x1-4-207-672-128-0x0-1x1-1x1-0-NCHW-FP32-W=ConvAsmBwdWrW1x1:4,4,2,1,2,1,4,4,0,1
768-172-380-1x1-192-172-380-8-0x0-1x1-1x1-0-NCHW-FP32-F=ConvOclDirectFwd1x1:1,64,1,1,1,0,32,2048,0
1-121-1000-1x1-4-121-1000-2-0x0-1x1-1x1-0-NCHW-FP32-W=ConvAsmBwdWrW1x1:4,4,2,1,2,1,2,4,0,3
544-14-14-1x1-128-14-14-128-0x0-1x1-1x1-0-NCHW-FP32-B=ConvOclDirectFwd1x1:1,128,1,1,0,2,16,4,0;ConvAsm1x1U:2,16,2,64,1,2,2,2
128-28-28-3x3-128-56-56-64-1x1-2x2-1x1-0-NCHW-FP32-W=ConvAsmBwdWrW3x3:0,0,8,8,4,1
928-7-7-1x1-128-7-7-256-0x0-1x1-1x1-0-NCHW-FP32-W=ConvAsmBwdWrW1x1:4,4,8,4,2,1,1,4,0,0
640-254-3-1x1-1024-254-3-256-0x0-1x1-1x1-0-NCHW-FP32-F=ConvOclDirectFwd1x1:1,64,1,1,1,4,16,2048,0;ConvAsm1x1U:3,16,3,64,2,2,2,2
608-7-7-1x1-128-7-7-256-0x0-1x1-1x1-0-NCHW-FP16-W=ConvAsmBwdWrW1x1:4,4,4,4,2,1,2,2,0,2
480-35-197-1x1-96-35-197-1-0x0-1x1-1x1-0-NCHW-FP32-F=ConvOclDirectFwd1x1:1,64,1,1,1,1,16,2048,0;ConvAsm1x1U:3,16,3,64,1,2,2,1
116-14-14-1x1-116-14-14-128-0x0-1x1-1x1-0-NCHW-FP32-B=ConvOclDirectFwd1x1:1,64,1,1,0,4,8,4,0;ConvAsm1x1U:2,4,4,4,1,4,1,4
256-14-14-1x1-1024-14-14-512-0x0-1x1-1x1-0-NCHW-FP32-F=ConvOclDirectFwd1x1:1,64,1,1,1,0,32,2048,0;ConvAsm1x1U:4,16,4,64,1,2,1,4
192-14-14-1x1-480-14-14-4-0x0-1x1-1x1-0-NCHW-FP16-W=ConvAsmBwdWrW1x1:2,8,4,4,2,1,2,4,0,0
32-7-7-5x5-128-7-7-4-2x2-1x1-1x1-0-NCHW-FP32-F=ConvOclDirectFwd:8,8,8,8,1,1,1,2,2;ConvOclDirectFwdFused:8,8,8,8,1,1,1,4,2
32-28-28-1x1-256-28-28-256-0x0-1x1-1x1-0-NCHW-FP16-W=ConvAsmBwdWrW1x1:4,4,4,4,2,1,4,4,0,2
144-32-879-1x1-720-32-879-1-0x0-1x1-1x1-0-NCHW-FP32-B=ConvOclDirectFwd1x1:1,64,1,1,0,4,16,8,0
512-7-7-1x1-1024-14-14-1-0x0-2x2-1x1-0-NCHW-FP32-W=ConvAsmBwdWrW1x1:1,16,2,2,4,1,1,4,0,1
1488-7-7-1x1-192-7-7-16-0x0-1x1-1x1-0-NCHW-FP32-F=ConvOclDirectFwd1x1:1,64,1,1,1,4,16,256,0;ConvAsm1x1U:4,8,4,16,1,4,4,2;ConvActivAsm1x1U:4,16,4,16,1,4
208-14-14-3x3-96-14-14-16-1x1-1x1-1x1-0-NCHW-FP16-W=ConvAsmBwdWrW3x3:0,0,8,2,3,2
864-202-578-1x1-1440-202-578-1-0x0-1x1-1x1-0-NCHW-FP32-B=ConvOclDirectFwd1x1:1,64,1,1,0,1,32,4,0
1024-15-15-3x3-1024-8-8-128-1x1-2x2-1x1-0-NCHW-FP32-F_g32=ConvOclDirectFwd:8,8,8,8,1,1,8,2,2
464-68-365-1x1-448-68-365-12-0x0-1x1-1x1-0-NCHW-FP32-F=ConvOclDirectFwd1x1:1,64,1,1,1,0,32,2048,0
96-14-14-1x1-608-14-14-32-0x0-1x1-1x1-0-NCHW-FP16-W=ConvAsmBwdWrW1x1:1,16,2,8,2,1,4,4,0,1
1024-7-7-1x1-464-7-7-16-0x0-1x1-1x1-0-NCHW-FP32-B=ConvOclDirectFwd1x1:1,128,1,1,0,1,8,4,0;ConvAsm1x1U:2,16,2,32,1,2,4,2
512-14-14-1x1-1024-14-14-64-0x0-1x1-1x1-0-NCHW-FP32-B=ConvOclDirectFwd1x1:1,256,1,1,0,2,32,4,0;ConvAsm1x1U:1,32,1,32,2,1,1,4
864-14-14-1x1-128-14-14-32-0x0-1x1-1x1-0-NCHW-FP16-B=ConvOclDirectFwd1x1:1,128,1,1,0,2,32,8,0;ConvAsm1x1U:1,16,2,32,1,2,4,2
1152-404-993-1x1-1-404-993-1-0x0-1x1-1x1-0-NCHW-FP32-F=ConvOclDirectFwd1x1:1,256,1,1,0,4,8,8,0
64-83-580-1x1-1152-83-580-8-0x0-1x1-1x1-0-NCHW-FP32-B=ConvOclDirectFwd1x1:1,128,1,1,0,2,32,4,0
416-278-666-1x1-352-278-666-4-0x0-1x1-1x1-0-NCHW-FP32-F=ConvOclDirectFwd1x1:1,64,1,1,1,0,64,2048,0
24-564-34-1x1-1872-564-34-6-0x0-1x1-1x1-0-NCHW-FP32-B=ConvOclDirectFwd1x1:1,256,1,1,0,4,16,8,0
128-28-28-1x1-128-28-28-64-0x0-1x1-1x1-0-NCHW-FP16-B=ConvOclDirectFwd1x1:1,256,1,1,0,2,32,4,0;ConvAsm1x1U:1,8,2,16,1,4,1,4
1408-51-655-1x1-16-51-655-8-0x0-1x1-1x1-0-NCHW-FP32-F=ConvOclDirectFwd1x1:1,64,1,1,1,1,64,2048,0
224-56-56-1x1-128-56-56-128-0x0-1x1-1x1-0-NCHW-FP32-F=ConvOclDirectFwd1x1:1,64,1,1,1,4,32,256,0;ConvAsm1x1U:2,16,2,64,3,2,1,2
352-56-104-1x1-160-56-104-64-0x0-1x1-1x1-0-NCHW-FP32-B=ConvOclDirectFwd1x1:1,128,1,1,0,1,32,4,0;ConvAsm1x1U:2,32,4,32,1,1,1,1
64-224-224-3x3-3-224-224-128-1x1-1x1-1x1-0-NCHW-FP32-W=ConvAsmBwdWrW3x3:0,1,16,1,2,2
384-28-28-1x1-128-28-28-512-0x0-1x1-1x1-0-NCHW-FP32-W=ConvAsmBwdWrW1x1:1,16,2,8,2,1,4,4,0,0
1024-456-22-1x1-64-456-22-8-0x0-1x1-1x1-0-NCHW-FP32-F=ConvOclDirectFwd1x1:16,16,32,32,1,0,32,128,1
58-28-28-1x1-58-28-28-128-0x0-1x1-1x1-0-NCHW-FP32-W=ConvAsmBwdWrW1x1:4,4,2,2,4,1,4,4,0,3
928-14-14-1x1-128-14-14-32-0x0-1x1-1x1-0-NCHW-FP16-B=ConvOclDirectFwd1x1:1,128,1,1,0,2,32,8,0;ConvAsm1x1U:1,16,2,64,1,2,4,2
128-64-128-5x5-48-64-128-1-2x2-1x1-1x1-0-NCHW-FP32-B=ConvOclDirectFwd:16,16,16,32,1,2,4,4,1
64-13-13-1x1-256-13-13-16-0x0-1x1-1x1-0-NCHW-FP16-B=ConvOclDirectFwd1x1:1,128,1,1,0,1,8,4,0;ConvAsm1x1U:1,8,2,32,1,2,2,2
128-28-28-1x1-320-28-28-16-0x0-1x1-1x1-0-NCHW-FP32-B=ConvOclDirectFwd1x1:1,128,1,1,0,2,16,4,0;ConvAsm1x1U:1,16,1,16,1,2,2,1
480-7-7-1x1-120-7-7-32-0x0-1x1-1x1-0-NCHW-FP32-B_g3=ConvOclDirectFwd:8,8,8,8,1,1,8,4,2
96-54-54-1x1-16-54-54-16-0x0-1x1-1x1-0-NCHW-FP32-B=ConvOclDirectFwd1x1:1,64,1,1,0,2,8,4,0;ConvAsm1x1U:1,8,1,64,2,2,1,1
1000-156-279-1x1-1280-156-279-2-0x0-1x1-1x1-0-NCHW-FP32-F=ConvOclDirectFwd1x1:1,256,1,1,0,2,32,4,0
320-7-7-3x3-160-7-7-256-1x1-1x1-1x1-0-NCHW-FP32-W=ConvAsmBwdWrW3x3:0,0,8,4,6,1
1-56-286-1x1-48-56-286-4-0x0-1x1-1x1-0-NCHW-FP32-B=ConvOclDirectFwd1x1:1,128,1,1,0,1,4,4,0;ConvAsm1x1U:1,16,1,64,2,1,1,1
896-167-242-1x1-232-167-242-1-0x0-1x1-1x1-0-NCHW-FP32-F=ConvOclDirectFwd1x1:1,256,1,1,0,2,16,8,0
192-17-17-1x1-768-17-17-256-0x0-1x1-1x1-0-NCHW-FP16-F=ConvOclDirectFwd1x1:1,256,1,1,0,1,16,4,0;ConvAsm1x1U:2,16,4,16,1,2,1,4
128-14-14-1x1-512-14-14-512-0x0-1x1-1x1-0-NCHW-FP16-B=ConvOclDirectFwd1x1:1,256,1,1,0,2,32,4,0;ConvAsm1x1U:1,16,2,16,1,2,1,4
240-7-7-1x1-960-7-7-2-0x0-1x1-1x1-0-NCHW-FP32-F_g3=ConvOclDirectFwd:8,8,8,8,1,1,4,4,2
912-370-937-1x1-416-370-937-1-0x0-1x1-1x1-0-NCHW-FP32-F=ConvOclDirectFwd1x1:1,64,1,1,1,1,64,2048,0
1120-475-238-1x1-256-475-238-4-0x0-1x1-1x1-0-NCHW-FP32-F=ConvOclDirectFwd1x1:1,64,1,1,1,4,32,2048,0
128-647-22-1x1-80-647-22-128-0x0-1x1-1x1-0-NCHW-FP32-F=ConvOclDirectFwd1x1:1,64,1,1,1,4,64,128,0;ConvAsm1x1U:2,32,2,32,1,1,1,1
64-112-112-3x3-128-112-112-64-1x1-1x1-1x1-0-NCHW-FP16-W=ConvAsmBwdWrW3x3:0,1,16,2,1,4
80-847-728-1x1-352-847-728-2-0x0-1x1-1x1-0-NCHW-FP32-F=ConvOclDirectFwd1x1:1,64,1,1,1,0,64,2048,0
768-17-17-1x1-160-17-17-256-0x0-1x1-1x1-0-NCHW-FP16-W=ConvAsmBwdWrW1x1:4,4,8,4,4,2,1,2,0,2
320-839-142-1x1-1000-839-142-1-0x0-1x1-1x1-0-NCHW-FP32-B=ConvOclDirectFwd1x1:1,64,1,1,0,2,16,8,0
128-14-14-1x1-768-14-14-32-0x0-1x1-1x1-0-NCHW-FP16-F=ConvOclDirectFwd1x1:1,64,1,1,0,4,8,4,0;ConvAsm1x1U:1,8,2,32,2,4,1,4
96-424-365-1x1-768-424-365-2-0x0-1x1-1x1-0-NCHW-FP32-B=ConvOclDirectFwd1x1:1,128,1,1,0,2,32,4,0
64-380-144-1x1-960-380-144-6-0x0-1x1-1x1-0-NCHW-FP32-B=ConvOclDirectFwd1x1:1,256,1,1,0,2,32,4,0
64-224-224-3x3-3-224-224-4-1x1-1x1-1x1-0-NCHW-FP16-B=ConvOclDirectFwd:16,16,32,32,2,2,8,2,1
24-290-742-1x1-528-290-742-2-0x0-1x1-1x1-0-NCHW-FP32-B=ConvOclDirectFwd1x1:1,256,1,1,0,4,16,8,0
3-627-619-1x1-8-627-619-8-0x0-1x1-1x1-0-NCHW-FP32-B=ConvOclDirectFwd1x1:1,128,1,1,0,1,16,4,0;ConvAsm1x1U:3,8,7,64,2,1,2,1
2048-150-38-1x1-1280-150-38-4-0x0-1x1-1x1-0-NCHW-FP32-F=ConvOclDirectFwd1x1:1,64,1,1,1,4,16,2048,0
528-14-14-1x1-192-14-14-16-0x0-1x1-1x1-0-NCHW-FP32-F=ConvOclDirectFwd1x1:1,64,1,1,1,1,16,128,0;ConvAsm1x1U:3,16,4,64,1,2,4,1;ConvActivAsm1x1U:3,16,3,16,4,4
256-57-57-1x1-64-57-57-4-0x0-1x1-1x1-0-NCHW-FP32-B=ConvOclDirectFwd1x1:1,128,1,1,0,1,32,4,0;ConvAsm1x1U:1,16,1,64,1,2,2,2
192-28-28-3x3-128-28-28-128-1x1-1x1-1x1-0-NCHW-FP16-B=ConvOclDirectFwd:16,16,32,32,2,2,8,1,2
64-77-262-1x1-720-77-262-1-0x0-1x1-1x1-0-NCHW-FP32-W=ConvAsmBwdWrW1x1:4,4,2,4,8,1,1,4,0,3
1536-8-8-1x1-384-8-8-1-0x0-1x1-1x1-0-NCHW-FP32-F=ConvOclDirectFwd1x1:1,64,1,1,1,1,16,64,0;ConvAsm1x1U:1,8,1,64,1,4,4,1;ConvActivAsm1x1U:1,16,1,32,1,4
54-432-384-1x1-2-432-384-8-0x0-1x1-1x1-0-NCHW-FP32-B=ConvOclDirectFwd1x1:1,256,1,1,0,1,8,4,0
384-28-28-1x1-128-28-28-32-0x0-1x1-1x1-0-NCHW-FP16-W=ConvAsmBwdWrW1x1:2,8,2,8,2,1,4,4,0,1
1-10-417-1x1-352-10-417-2-0x0-1x1-1x1-0-NCHW-FP32-B=ConvOclDirectFwd1x1:1,256,1,1,0,1,4,4,0;ConvAsm1x1U:1,8,1,16,1,1,1,4
32-28-28-1x1-192-28-28-512-0x0-1x1-1x1-0-NCHW-FP16-B=ConvOclDirectFwd1x1:1,256,1,1,0,2,32,4,0;ConvAsm1x1U:1,16,2,16,1,2,1,4
1440-847-11-1x1-1-847-11-12-0x0-1x1-1x1-0-NCHW-FP32-F=ConvOclDirectFwd1x1:1,128,1,1,0,1,16,8,0
1152-713-164-1x1-640-713-164-2-0x0-1x1-1x1-0-NCHW-FP32-F=ConvOclDirectFwd1x1:1,64,1,1,1,1,16,2048,0
16-28-28-5x5-32-28-28-256-2x2-1x1-1x1-0-NCHW-FP32-F=ConvOclDirectFwd:16,16,32,32,2,2,8,1,2;ConvOclDirectFwdFused:16,16,32,32,2,2,8,1,2
736-528-119-1x1-80-528-119-2-0x0-1x1-1x1-0-NCHW-FP32-B=ConvOclDirectFwd1x1:1,256,1,1,0,4,16,8,0
80-659-232-1x1-448-659-232-6-0x0-1x1-1x1-0-NCHW-FP32-B=ConvOclDirectFwd1x1:1,128,1,1,0,2,32,4,0
288-312-785-1x1-352-312-785-4-0x0-1x1-1x1-0-NCHW-FP32-B=ConvOclDirectFwd1x1:1,256,1,1,0,2,32,4,0
384-8-8-1x1-1280-8-8-32-0x0-1x1-1x1-0-NCHW-FP16-W=ConvAsmBwdWrW1x1:2,8,8,4,2,1,1,4,0,0
240-28-28-1x1-60-28-28-64-0x0-1x1-1x1-0-NCHW-FP32-B_g3=ConvOclDirectFwd:16,16,16,16,1,1,4,4,1
16-821-622-1x1-480-821-622-1-0x0-1x1-1x1-0-NCHW-FP32-B=ConvOclDirectFwd1x1:1,128,1,1,0,2,32,4,0
448-292-13-1x1-1408-292-13-32-0x0-1x1-1x1-0-NCHW-FP32-W=ConvAsmBwdWrW1x1:2,8,4,8,4,1,1,4,0,2
1680-163-13-1x1-544-163-13-128-0x0-1x1-1x1-0-NCHW-FP32-F=ConvOclDirectFwd1x1:1,64,1,1,1,0,64,2048,0;ConvAsm1x1U:3,16,5,32,2,2,2,2
512-8-8-3x3-512-15-15-48-1x1-2x2-1x1-0-NCHW-FP32-W=ConvAsmBwdWrW3x3:0,0,8,8,6,1
512-28-28-1x1-128-28-28-32-0x0-1x1-1x1-0-NCHW-FP32-B=ConvOclDirectFwd1x1:1,128,1,1,0,4,16,4,0;ConvAsm1x1U:3,16,3,32,1,2,2,2
19-401-554-1x1-3-401-554-1-0x0-1x1-1x1-0-NCHW-FP32-W=ConvAsmBwdWrW1x1:4,4,2,1,2,1,1,4,0,3
128-14-14-1x1-832-14-14-32-0x0-1x1-1x1-0-NCHW-FP16-W=ConvAsmBwdWrW1x1:2,8,4,8,2,1,2,2,0,1
576-849-61-1x1-864-849-61-2-0x0-1x1-1x1-0-NCHW-FP32-F=ConvOclDirectFwd1x1:1,64,1,1,1,0,64,2048,0
192-8-8-1x1-2048-8-8-1-0x0-1x1-1x1-0-NCHW-FP32-W=ConvAsmBwdWrW1x1:1,16,2,2,8,1,1,4,0,0
58-406-148-1x1-128-406-148-64-0x0-1x1-1x1-0-NCHW-FP32-F=ConvOclDirectFwd1x1:1,64,1,1,0,1,64,4,0
32-7-7-1x1-832-7-7-4-0x0-1x1-1x1-0-NCHW-FP32-W=ConvAsmBwdWrW1x1:1,16,2,1,8,1,2,4,0,1
64-256-512-1x1-64-256-512-1-0x0-1x1-1x1-0-NCHW-FP32-F=ConvOclDirectFwd1x1:1,64,1,1,1,0,32,256,0;ConvOclDirectFwdFused:1,64,1,1,1,4,32,128,0
384-7-7-3x3-192-7-7-32-1x1-1x1-1x1-0-NCHW-FP16-W=ConvAsmBwdWrW3x3:0,0,8,4,3,1
4-828-689-1x1-54-828-689-6-0x0-1x1-1x1-0-NCHW-FP32-F=ConvOclDirectFwd1x1:1,128,1,1,0,4,8,4,0
1024-14-14-1x1-1024-14-14-2-0x0-1x1-1x1-0-NCHW-FP32-B=ConvOclDirectFwd1x1:1,64,1,1,0,4,4,4,0;ConvAsm1x1U:4,8,4,64,1,4,2,2
1-503-167-1x1-1000-503-167-1-0x0-1x1-1x1-0-NCHW-FP32-B=ConvOclDirectFwd1x1:1,128,1,1,0,1,4,4,0
2-979-351-1x1-24-979-351-8-0x0-1x1-1x1-0-NCHW-FP32-W=ConvAsmBwdWrW1x1:4,4,2,1,2,1,4,4,0,1
4-98-623-1x1-24-98-623-48-0x0-1x1-1x1-0-NCHW-FP32-W=ConvAsmBwdWrW1x1:4,4,2,1,2,1,4,4,0,1
192-35-35-1x1-32-35-35-4-0x0-1x1-1x1-0-NCHW-FP32-F=ConvOclDirectFwd1x1:1,64,1,1,1,4,16,64,0;ConvAsm1x1U:2,8,2,64,1,4,4,1;ConvActivAsm1x1U:1,16,1,32,1,4
864-104-71-1x1-2048-104-71-4-0x0-1x1-1x1-0-NCHW-FP32-B=ConvOclDirectFwd1x1:1,256,1,1,0,2,32,4,0
256-14-14-3x3-192-14-14-32-1x1-1x1-1x1-0-NCHW-FP32-W=ConvAsmBwdWrW3x3:0,1,8,4,4,1
3-1-1-3x3-4-2-2-16-0x0-2x2-1x1-0-NCHW-FP32-B=ConvOclDirectFwd:8,8,8,8,1,1,1,1,2
2-252-71-1x1-96-252-71-128-0x0-1x1-1x1-0-NCHW-FP32-F=ConvOclDirectFwd1x1:1,64,1,1,0,2,32,4,0;ConvAsm1x1U:1,8,1,16,1,1,1,1
192-28-28-1x1-16-28-28-8-0x0-1x1-1x1-0-NCHW-FP32-F=ConvOclDirectFwd1x1:1,64,1,1,1,1,64,64,0;ConvAsm1x1U:1,8,1,64,1,4,4,1;ConvActivAsm1x1U:1,16,1,16,1,4
1056-7-7-1x1-192-7-7-64-0x0-1x1-1x1-0-NCHW-FP32-F=ConvOclDirectFwd1x1:1,64,1,1,1,4,16,256,0;ConvAsm1x1U:2,16,4,16,1,2,4,1;ConvActivAsm1x1U:4,16,4,16,1,2
256-35-35-1x1-64-35-35-512-0x0-1x1-1x1-0-NCHW-FP16-F=ConvOclDirectFwd1x1:1,256,1,1,0,1,16,4,0;ConvAsm1x1U:1,8,2,64,1,4,2,2
80-73-73-1x1-64-73-73-4-0x0-1x1-1x1-0-NCHW-FP16-W=ConvAsmBwdWrW1x1:4,4,4,4,2,1,4,2,0,1
256-28-28-3x3-512-28-28-128-1x1-1x1-1x1-0-NCHW-FP16-B=ConvOclDirectFwd:8,16,32,32,4,2,8,1,1
928-62-2-1x1-1728-62-2-8-0x0-1x1-1x1-0-NCHW-FP32-W=ConvAsmBwdWrW1x1:1,16,4,8,4,1,1,4,0,1
128-14-14-1x1-512-14-14-64-0x0-1x1-1x1-0-NCHW-FP16-W=ConvAsmBwdWrW1x1:4,4,8,4,2,2,1,2,0,1
1-86-673-1x1-1104-86-673-4-0x0-1x1-1x1-0-NCHW-FP32-B=ConvOclDirectFwd1x1:1,128,1,1,0,2,8,4,0
1568-952-57-1x1-58-952-57-1-0x0-1x1-1x1-0-NCHW-FP32-F=ConvOclDirectFwd1x1:1,256,1,1,0,2,8,4,0
32-27-1023-1x1-58-27-1023-16-0x0-1x1-1x1-0-NCHW-FP32-B=ConvOclDirectFwd1x1:1,256,1,1,0,1,16,8,0;ConvAsm1x1U:2,1,3,4,1,1,1,8
19-144-145-1x1-4-144-145-6-0x0-1x1-1x1-0-NCHW-FP32-B=ConvOclDirectFwd1x1:16,64,32,32,0,2,16,4,1;ConvAsm1x1U:4,4,4,4,1,1,1,1
64-256-512-1x1-64-256-512-1-0x0-1x1-1x1-0-NCHW-FP16-F=ConvOclDirectFwd1x1:1,128,1,1,0,4,16,4,0
128-14-14-1x1-640-14-14-64-0x0-1x1-1x1-0-NCHW-FP16-F=ConvOclDirectFwd1x1:1,64,1,1,0,4,8,4,0;ConvAsm1x1U:1,8,2,16,2,4,1,8
256-57-57-1x1-256-57-57-8-0x0-1x1-1x1-0-NCHW-FP32-B=ConvOclDirectFwd1x1:1,128,1,1,0,1,32,4,0;ConvAsm1x1U:4,32,7,64,1,1,1,2
736-878-22-1x1-720-878-22-8-0x0-1x1-1x1-0-NCHW-FP32-B=ConvOclDirectFwd1x1:1,256,1,1,0,4,16,4,0
144-575-197-1x1-384-575-197-8-0x0-1x1-1x1-0-NCHW-FP32-B=ConvOclDirectFwd1x1:1,256,1,1,0,1,32,4,0
64-224-224-3x3-3-224-224-16-1x1-1x1-1x1-0-NCHW-FP32-F=ConvAsm3x3U:1,3,2;ConvOclDirectFwd:16,16,32,32,2,2,8,2,1
128-7-7-1x1-576-7-7-16-0x0-1x1-1x1-0-NCHW-FP32-F=ConvOclDirectFwd1x1:1,64,1,1,1,1,16,2048,0;ConvAsm1x1U:1,8,1,64,2,4,2,4
256-20-84-5x5-512-9-41-2-1x1-2x2-1x1-0-NCHW-FP32-F=ConvOclDirectFwd:16,8,16,16,1,2,8,1,1
64-28-301-1x1-336-28-301-8-0x0-1x1-1x1-0-NCHW-FP32-W=ConvAsmBwdWrW1x1:4,4,2,4,4,1,1,4,0,2
1000-309-39-1x1-464-309-39-1-0x0-1x1-1x1-0-NCHW-FP32-B=ConvOclDirectFwd1x1:1,256,1,1,0,1,16,4,0
512-28-28-1x1-128-28-28-128-0x0-1x1-1x1-0-NCHW-FP16-B=ConvOclDirectFwd1x1:1,256,1,1,0,4,16,4,0;ConvAsm1x1U:1,16,2,16,1,2,1,4
96-166-242-1x1-16-166-242-4-0x0-1x1-1x1-0-NCHW-FP32-W=ConvAsmBwdWrW1x1:4,4,2,1,4,1,2,4,0,3
544-219-14-1x1-704-219-14-1-0x0-1x1-1x1-0-NCHW-FP32-W=ConvAsmBwdWrW1x1:1,16,4,8,4,1,1,4,0,1
96-28-28-1x1-192-28-28-16-0x0-1x1-1x1-0-NCHW-FP32-B=ConvOclDirectFwd1x1:1,64,1,1,0,2,16,4,0;ConvAsm1x1U:1,16,1,16,1,2,2,2
512-334-691-1x1-384-334-691-2-0x0-1x1-1x1-0-NCHW-FP32-F=ConvOclDirectFwd1x1:1,64,1,1,1,0,32,2048,0
4-168-13-1x1-528-168-13-4-0x0-1x1-1x1-0-NCHW-FP32-B=ConvOclDirectFwd1x1:1,256,1,1,0,1,4,4,0;ConvAsm1x1U:1,8,1,16,1,2,2,1
1104-27-219-1x1-640-27-219-64-0x0-1x1-1x1-0-NCHW-FP32-F=ConvOclDirectFwd1x1:1,64,1,1,1,4,16,2048,0
448-34-454-1x1-448-34-454-12-0x0-1x1-1x1-0-NCHW-FP32-F=ConvOclDirectFwd1x1:1,64,1,1,1,4,16,2048,0
232-732-794-1x1-8-732-794-1-0x0-1x1-1x1-0-NCHW-FP32-F=ConvOclDirectFwd1x1:1,256,1,1,0,4,16,4,0
1664-54-509-1x1-256-54-509-8-0x0-1x1-1x1-0-NCHW-FP32-F=ConvOclDirectFwd1x1:1,64,1,1,1,4,64,2048,0
1-651-199-1x1-288-651-199-12-0x0-1x1-1x1-0-NCHW-FP32-B=ConvOclDirectFwd1x1:1,256,1,1,0,1,32,4,0
64-54-54-1x1-16-54-54-256-0x0-1x1-1x1-0-NCHW-FP16-F=ConvOclDirectFwd1x1:1,256,1,1,0,4,16,8,0;ConvAsm1x1U:3,8,6,64,2,2,1,1
1280-25-674-1x1-768-25-674-16-0x0-1x1-1x1-0-NCHW-FP32-B=ConvOclDirectFwd1x1:1,64,1,1,0,2,32,4,0
160-603-107-1x1-608-603-107-12-0x0-1x1-1x1-0-NCHW-FP32-F=ConvOclDirectFwd1x1:1,64,1,1,1,4,32,2048,0
512-29-29-1x1-512-29-29-16-0x0-1x1-1x1-0-NCHW-FP32-W=ConvAsmBwdWrW1x1:1,16,2,8,4,1,1,4,0,1
128-10-10-1x1-512-10-10-32-0x0-1x1-1x1-0-NCHW-FP32-W=ConvAsmBwdWrW1x1:4,4,4,4,2,1,1,4,0,1
448-362-720-1x1-116-362-720-1-0x0-1x1-1x1-0-NCHW-FP32-F=ConvOclDirectFwd1x1:1,128,1,1,0,4,16,4,0
1024-15-15-1x1-512-15-15-2-0x0-1x1-1x1-0-NCHW-FP32-F=ConvOclDirectFwd1x1:1,64,1,1,1,4,16,256,0;ConvAsm1x1U:4,8,4,64,1,4,4,1
544-428-76-1x1-1056-428-76-6-0x0-1x1-1x1-0-NCHW-FP32-F=ConvOclDirectFwd1x1:1,64,1,1,1,0,64,2048,0
256-14-14-1x1-1024-14-14-64-0x0-1x1-1x1-0-NCHW-FP32-W=ConvAsmBwdWrW1x1:1,16,4,8,4,1,2,4,0,1
128-14-14-1x1-800-14-14-64-0x0-1x1-1x1-0-NCHW-FP32-B=ConvOclDirectFwd1x1:1,256,1,1,0,4,16,8,0;ConvAsm1x1U:1,16,1,64,2,2,2,2
320-8-8-1x1-1280-8-8-32-0x0-1x1-1x1-0-NCHW-FP32-B=ConvOclDirectFwd1x1:8,64,8,8,0,2,16,4,1;ConvAsm1x1U:1,16,1,64,2,2,1,4
336-501-773-1x1-320-501-773-1-0x0-1x1-1x1-0-NCHW-FP32-F=ConvOclDirectFwd1x1:1,64,1,1,1,4,32,2048,0
416-142-555-1x1-3-142-555-2-0x0-1x1-1x1-0-NCHW-FP32-F=ConvOclDirectFwd1x1:1,256,1,1,0,1,8,4,0
1280-326-123-1x1-432-326-123-2-0x0-1x1-1x1-0-NCHW-FP32-B=ConvOclDirectFwd1x1:1,128,1,1,0,2,16,8,0
54-165-38-1x1-800-165-38-1-0x0-1x1-1x1-0-NCHW-FP32-W=ConvAsmBwdWrW1x1:4,4,8,4,2,1,1,4,0,1
16-54-54-3x3-64-54-54-32-1x1-1x1-1x1-0-NCHW-FP32-B=ConvAsm3x3U:0,8,3;ConvOclDirectFwd:16,8,16,16,1,2,8,2,1
128-14-14-1x1-832-14-14-16-0x0-1x1-1x1-0-NCHW-FP32-W=ConvAsmBwdWrW1x1:2,8,4,8,2,1,1,4,0,1
24-320-579-1x1-224-320-579-2-0x0-1x1-1x1-0-NCHW-FP32-B=ConvOclDirectFwd1x1:1,256,1,1,0,2,32,4,0
384-731-19-1x1-1376-731-19-12-0x0-1x1-1x1-0-NCHW-FP32-B=ConvOclDirectFwd1x1:1,128,1,1,0,1,32,4,0
1776-478-98-1x1-64-478-98-4-0x0-1x1-1x1-0-NCHW-FP32-F=ConvOclDirectFwd1x1:16,16,32,32,1,0,32,128,1
384-35-35-1x1-64-35-35-4-0x0-1x1-1x1-0-NCHW-FP16-F=ConvOclDirectFwd1x1:1,64,1,1,0,1,8,8,0;ConvAsm1x1U:1,8,2,64,1,4,4,1
64-336-656-1x1-48-336-656-32-0x0-1x1-1x1-0-NCHW-FP32-B=ConvOclDirectFwd1x1:1,256,1,1,0,2,16,4,0
240-86-18-1x1-116-86-18-4-0x0-1x1-1x1-0-NCHW-FP32-F=ConvOclDirectFwd1x1:1,64,1,1,0,4,16,8,0;ConvAsm1x1U:1,8,1,64,4,4,1,8
64-12-120-3x3-32-12-120-256-1x1-1x1-1x1-0-NCHW-FP32-W=ConvAsmBwdWrW3x3:0,0,16,4,2,8
384-35-35-1x1-64-35-35-16-0x0-1x1-1x1-0-NCHW-FP16-F=ConvOclDirectFwd1x1:1,64,1,1,0,1,16,4,0;ConvAsm1x1U:2,8,4,64,1,2,2,2
112-54-2-1x1-1376-54-2-2048-0x0-1x1-1x1-0-NCHW-FP32-B=ConvOclDirectFwd1x1:1,256,1,1,0,4,16,4,0;ConvAsm1x1U:1,32,2,32,1,1,1,1
128-14-14-1x1-928-14-14-32-0x0-1x1-1x1-0-NCHW-FP16-W=ConvAsmBwdWrW1x1:2,8,4,8,2,1,2,2,0,1
96-35-35-1x1-384-35-35-4-0x0-1x1-1x1-0-NCHW-FP16-B=ConvOclDirectFwd1x1:1,128,1,1,0,1,4,4,0;ConvAsm1x1U:1,16,2,32,1,2,2,2
416-215-185-1x1-384-215-185-4-0x0-1x1-1x1-0-NCHW-FP32-F=ConvOclDirectFwd1x1:1,64,1,1,1,4,32,2048,0
128-14-14-1x1-832-14-14-32-0x0-1x1-1x1-0-NCHW-FP16-B=ConvOclDirectFwd1x1:1,64,1,1,0,4,8,4,0;ConvAsm1x1U:1,16,2,16,1,2,2,2
128-405-559-1x1-232-405-559-6-0x0-1x1-1x1-0-NCHW-FP32-B=ConvOclDirectFwd1x1:1,256,1,1,0,1,16,4,0
480-71-1022-1x1-4-71-1022-4-0x0-1x1-1x1-0-NCHW-FP32-F=ConvOclDirectFwd1x1:1,256,1,1,0,2,16,8,0
2048-7-7-1x1-1024-7-7-32-0x0-1x1-1x1-0-NCHW-FP32-F=ConvOclDirectFwd1x1:1,64,1,1,1,1,32,2048,0;ConvAsm1x1U:4,16,4,16,1,2,1,2
1-612-475-1x1-24-612-475-2-0x0-1x1-1x1-0-NCHW-FP32-F=ConvOclDirectFwd1x1:1,128,1,1,0,1,8,4,0
1024-7-7-3x3-1024-7-7-48-1x1-1x1-1x1-0-NCHW-FP32-W_g32=ConvOclBwdWrW2<4>:1,7,8,1,7;ConvOclBwdWrW2<2>:1,7,8,1,7;ConvOclBwdWrW2<1>:1,7,8,1,7;ConvOclBwdWrW2<16>:1,7,8,1,7;ConvAsmBwdWrW3x3:0,1,8,4,6,1;ConvOclBwdWrW2<8>:1,7,8,1,7
128-28-28-3x3-96-28-28-16-1x1-1x1-1x1-0-NCHW-FP32-W=ConvAsmBwdWrW3x3:0,0,8,4,3,2
128-14-14-1x1-992-14-14-256-0x0-1x1-1x1-0-NCHW-FP16-W=ConvAsmBwdWrW1x1:2,8,4,8,2,1,2,2,0,3
32-7-7-3x3-128-7-7-16-1x1-1x1-1x1-0-NCHW-FP16-W=ConvAsmBwdWrW3x3:0,0,8,2,5,4
232-7-7-1x1-232-7-7-256-0x0-1x1-1x1-0-NCHW-FP32-B=ConvOclDirectFwd1x1:1,256,1,1,0,1,8,4,0;ConvAsm1x1U:1,8,1,64,2,4,1,8
416-155-661-1x1-720-155-661-4-0x0-1x1-1x1-0-NCHW-FP32-B=ConvOclDirectFwd1x1:1,256,1,1,0,1,16,4,0
1-161-700-5x5-64-80-349-128-1x1-2x2-1x1-0-NCHW-FP32-F=ConvOclDirectFwd:16,16,32,32,2,2,8,2,1
288-851-52-1x1-192-851-52-4-0x0-1x1-1x1-0-NCHW-FP32-W=ConvAsmBwdWrW1x1:2,8,4,8,4,1,2,4,0,1
48-64-128-1x1-832-64-128-1-0x0-1x1-1x1-0-NCHW-FP32-W=ConvAsmBwdWrW1x1:2,8,2,4,8,1,1,4,0,2
2-106-389-1x1-960-106-389-4-0x0-1x1-1x1-0-NCHW-FP32-F=ConvOclDirectFwd1x1:1,256,1,1,0,2,16,4,0
256-29-29-3x3-256-29-29-48-1x1-1x1-1x1-0-NCHW-FP32-F_g32=ConvOclDirectFwd:32,8,32,32,1,4,8,2,1
16-28-28-1x1-192-28-28-4-0x0-1x1-1x1-0-NCHW-FP16-B=ConvOclDirectFwd1x1:1,64,1,1,0,2,4,4,0;ConvAsm1x1U:1,8,2,32,1,4,1,1
128-14-14-1x1-320-14-14-32-0x0-1x1-1x1-0-NCHW-FP16-W=ConvAsmBwdWrW1x1:4,4,4,4,2,1,2,4,0,0
16-14-14-1x1-480-14-14-256-0x0-1x1-1x1-0-NCHW-FP32-W=ConvAsmBwdWrW1x1:4,4,4,4,2,1,4,4,0,3
256-57-57-1x1-128-57-57-256-0x0-1x1-1x1-0-NCHW-FP32-B=ConvOclDirectFwd1x1:1,64,1,1,0,1,32,4,0;ConvAsm1x1U:1,16,1,64,1,2,1,1
54-55-55-1x1-24-55-55-32-0x0-1x1-1x1-0-NCHW-FP32-B=ConvOclDirectFwd1x1:1,128,1,1,0,1,16,4,0;ConvAsm1x1U:4,8,4,64,2,1,1,1
32-38-166-5x10-32-79-341-32-0x0-2x2-1x1-0-NCHW-FP32-W=ConvOclBwdWrW2<1>:3,10,3,3,5;ConvOclBwdWrW2<16>:8,7,1,3,5;ConvOclBwdWrW2<8>:8,9,1,3,5;ConvOclBwdWrW2<4>:8,7,1,3,5;ConvOclBwdWrW2<2>:8,9,1,3,5
112-2-13-1x1-1920-2-13-2-0x0-1x1-1x1-0-NCHW-FP32-W=ConvAsmBwdWrW1x1:1,16,2,4,2,1,1,4,0,1
64-273-638-1x1-1152-273-638-1-0x0-1x1-1x1-0-NCHW-FP32-B=ConvOclDirectFwd1x1:1,256,1,1,0,2,32,4,0
1000-1-569-1x1-16-1-569-256-0x0-1x1-1x1-0-NCHW-FP32-W=ConvAsmBwdWrW1x1:4,4,4,4,4,1,2,4,0,1
3-119-257-1x1-512-119-257-8-0x0-1x1-1x1-0-NCHW-FP32-F=ConvOclDirectFwd1x1:1,256,1,1,0,1,64,4,0
1024-20-936-1x1-896-20-936-2-0x0-1x1-1x1-0-NCHW-FP32-B=ConvOclDirectFwd1x1:1,256,1,1,0,1,32,4,0
128-1020-42-1x1-1-1020-42-2-0x0-1x1-1x1-0-NCHW-FP32-W=ConvAsmBwdWrW1x1:4,4,2,1,2,1,2,4,0,3
1024-797-619-1x1-232-797-619-1-0x0-1x1-1x1-0-NCHW-FP32-B=ConvOclDirectFwd1x1:1,256,1,1,0,1,16,4,0
800-14-14-1x1-128-14-14-32-0x0-1x1-1x1-0-NCHW-FP16-F=ConvOclDirectFwd1x1:1,64,1,1,0,4,8,4,0;ConvAsm1x1U:2,8,4,64,1,4,4,2
4-244-357-1x1-112-244-357-32-0x0-1x1-1x1-0-NCHW-FP32-F=ConvOclDirectFwd1x1:1,256,1,1,0,4,16,4,0
32-6-131-1x1-1472-6-131-16-0x0-1x1-1x1-0-NCHW-FP32-B=ConvOclDirectFwd1x1:1,256,1,1,0,2,32,4,0;ConvAsm1x1U:2,8,2,32,4,4,2,1
80-208-1007-1x1-160-208-1007-8-0x0-1x1-1x1-0-NCHW-FP32-F=ConvOclDirectFwd1x1:1,64,1,1,1,4,64,128,0
48-110-1017-1x1-58-110-1017-4-0x0-1x1-1x1-0-NCHW-FP32-W=ConvAsmBwdWrW1x1:4,4,2,1,8,1,2,4,0,3
512-4-4-3x3-512-7-7-128-1x1-2x2-1x1-0-NCHW-FP16-B=ConvOclDirectFwd:8,8,8,8,1,1,4,4,2
112-187-93-1x1-320-187-93-8-0x0-1x1-1x1-0-NCHW-FP32-W=ConvAsmBwdWrW1x1:4,4,8,4,4,1,2,2,0,1
928-92-347-1x1-160-92-347-8-0x0-1x1-1x1-0-NCHW-FP32-B=ConvOclDirectFwd1x1:1,256,1,1,0,2,32,4,0
256-5-5-3x3-128-10-10-32-1x1-2x2-1x1-0-NCHW-FP32-W=ConvAsmBwdWrW3x3:0,0,8,4,3,1
16-410-182-1x1-1280-410-182-2-0x0-1x1-1x1-0-NCHW-FP32-B=ConvOclDirectFwd1x1:1,256,1,1,0,4,16,8,0
1104-621-577-1x1-480-621-577-1-0x0-1x1-1x1-0-NCHW-FP32-B=ConvOclDirectFwd1x1:1,256,1,1,0,1,32,4,0
256-56-56-1x1-128-28-28-128-0x0-2x2-1x1-0-NCHW-FP32-F=ConvOclDirectFwd1x1:1,64,1,1,1,4,16,256,0;ConvAsm1x1U:4,16,5,32,1,2,2,2
288-14-14-3x3-144-14-14-64-1x1-1x1-1x1-0-NCHW-FP16-B=ConvOclDirectFwd:8,8,16,16,2,2,8,4,2
192-8-8-1x1-2048-8-8-16-0x0-1x1-1x1-0-NCHW-FP32-W=ConvAsmBwdWrW1x1:2,8,4,4,4,1,1,4,0,0
240-7-7-1x1-960-7-7-8-0x0-1x1-1x1-0-NCHW-FP32-F_g3=ConvOclDirectFwd:8,8,8,8,1,1,8,4,2
256-28-28-1x1-128-28-28-8-0x0-1x1-1x1-0-NCHW-FP16-F=ConvOclDirectFwd1x1:1,256,1,1,0,2,16,4,0;ConvAsm1x1U:1,8,2,32,2,4,2,8
96-35-35-1x1-384-35-35-8-0x0-1x1-1x1-0-NCHW-FP32-B=ConvOclDirectFwd1x1:1,256,1,1,0,1,8,4,0;ConvAsm1x1U:1,16,1,64,2,1,1,4
96-14-14-1x1-480-14-14-8-0x0-1x1-1x1-0-NCHW-FP16-W=ConvAsmBwdWrW1x1:4,4,4,4,2,1,2,4,0,0
32-44-657-1x1-288-44-657-6-0x0-1x1-1x1-0-NCHW-FP32-F=ConvOclDirectFwd1x1:1,64,1,1,1,1,64,2048,0
1776-13-51-1x1-2-13-51-128-0x0-1x1-1x1-0-NCHW-FP32-F=ConvOclDirectFwd1x1:1,128,1,1,0,1,16,8,0;ConvAsm1x1U:3,1,3,4,1,1,1,1
256-29-29-3x3-256-57-57-256-1x1-2x2-1x1-0-NCHW-FP32-W_g32=ConvOclBwdWrW2<4>:1,8,8,1,5;ConvOclBwdWrW2<2>:1,7,1,1,3;ConvOclBwdWrW2<1>:1,7,1,1,3;ConvOclBwdWrW2<16>:1,6,3,1,3;ConvAsmBwdWrW3x3:0,0,8,2,6,1;ConvOclBwdWrW2<8>:1,6,8,1,5
352-171-742-1x1-64-171-742-2-0x0-1x1-1x1-0-NCHW-FP32-F=ConvOclDirectFwd1x1:16,16,32,32,1,0,32,128,1
1280-209-396-1x1-256-209-396-2-0x0-1x1-1x1-0-NCHW-FP32-F=ConvOclDirectFwd1x1:1,64,1,1,1,1,32,2048,0
896-14-14-1x1-128-14-14-512-0x0-1x1-1x1-0-NCHW-FP16-B=ConvOclDirectFwd1x1:1,64,1,1,0,2,32,8,0;ConvAsm1x1U:1,16,2,16,1,2,2,4
256-14-14-1x1-1024-14-14-8-0x0-1x1-1x1-0-NCHW-FP32-B=ConvOclDirectFwd1x1:8,64,16,16,0,2,16,4,1;ConvAsm1x1U:1,16,1,64,2,2,1,1
232-720-523-1x1-96-720-523-6-0x0-1x1-1x1-0-NCHW-FP32-F=ConvOclDirectFwd1x1:1,256,1,1,0,2,32,4,0
112-34-870-1x1-896-34-870-8-0x0-1x1-1x1-0-NCHW-FP32-B=ConvOclDirectFwd1x1:1,64,1,1,0,4,16,4,0
128-28-28-1x1-256-28-28-8-0x0-1x1-1x1-0-NCHW-FP16-W=ConvAsmBwdWrW1x1:2,8,2,4,2,1,2,4,0,1
1024-15-15-1x1-1024-15-15-256-0x0-1x1-1x1-0-NCHW-FP32-F=ConvOclDirectFwd1x1:8,8,16,16,1,0,32,128,1;ConvAsm1x1U:3,16,4,32,3,2,2,1
60-14-14-3x3-60-28-28-512-1x1-2x2-1x1-0-NCHW-FP16-B=ConvOclDirectFwd:8,32,32,32,4,1,4,4,2
16-54-54-3x3-64-54-54-128-1x1-1x1-1x1-0-NCHW-FP32-W=ConvAsmBwdWrW3x3:0,1,16,4,3,8
1024-14-14-1x1-2048-7-7-8-0x0-2x2-1x1-0-NCHW-FP16-F=ConvOclDirectFwd1x1:1,256,1,1,0,1,16,4,0;ConvAsm1x1U:2,8,4,16,1,4,2,8
720-700-23-1x1-24-700-23-12-0x0-1x1-1x1-0-NCHW-FP32-F=ConvOclDirectFwd1x1:1,256,1,1,0,4,16,4,0
320-320-217-1x1-58-320-217-1-0x0-1x1-1x1-0-NCHW-FP32-F=ConvOclDirectFwd1x1:1,64,1,1,0,4,16,4,0
480-590-244-1x1-448-590-244-6-0x0-1x1-1x1-0-NCHW-FP32-F=ConvOclDirectFwd1x1:1,64,1,1,1,4,16,2048,0
192-71-71-3x3-80-73-73-512-0x0-1x1-1x1-0-NCHW-FP16-B=ConvOclDirectFwd:8,16,16,32,2,2,8,4,2
800-14-14-1x1-128-14-14-256-0x0-1x1-1x1-0-NCHW-FP16-F=ConvOclDirectFwd1x1:1,256,1,1,0,2,8,4,0;ConvAsm1x1U:2,8,4,64,1,4,2,2
896-236-379-1x1-768-236-379-4-0x0-1x1-1x1-0-NCHW-FP32-F=ConvOclDirectFwd1x1:1,64,1,1,1,0,16,2048,0
320-545-699-1x1-608-545-699-1-0x0-1x1-1x1-0-NCHW-FP32-F=ConvOclDirectFwd1x1:1,64,1,1,1,0,64,2048,0
640-214-30-1x1-1568-214-30-1-0x0-1x1-1x1-0-NCHW-FP32-W=ConvAsmBwdWrW1x1:2,8,4,8,4,1,1,4,0,1
1536-8-8-1x1-384-8-8-32-0x0-1x1-1x1-0-NCHW-FP16-F=ConvOclDirectFwd1x1:1,256,1,1,0,2,8,4,0;ConvAsm1x1U:1,8,2,16,2,4,2,2
832-647-83-1x1-352-647-83-2-0x0-1x1-1x1-0-NCHW-FP32-B=ConvOclDirectFwd1x1:1,256,1,1,0,1,32,4,0
128-28-28-3x3-128-56-56-16-1x1-2x2-1x1-0-NCHW-FP32-B=ConvOclDirectFwd:32,8,32,32,1,4,8,2,2
64-57-57-1x1-256-57-57-4-0x0-1x1-1x1-0-NCHW-FP32-F=ConvOclDirectFwd1x1:1,64,1,1,1,1,32,64,0;ConvAsm1x1U:1,8,1,64,1,4,2,2
512-7-7-1x1-1024-14-14-512-0x0-2x2-1x1-0-NCHW-FP32-B=ConvOclDirectFwd1x1:1,256,1,1,0,1,32,4,0;ConvAsm1x1U:1,16,1,64,2,2,2,2
128-28-28-1x1-352-28-28-256-0x0-1x1-1x1-0-NCHW-FP32-F=ConvOclDirectFwd1x1:1,64,1,1,1,0,64,256,0;ConvAsm1x1U:3,16,3,16,1,2,2,2
912-649-444-1x1-8-649-444-1-0x0-1x1-1x1-0-NCHW-FP32-F=ConvOclDirectFwd1x1:1,256,1,1,0,2,16,4,0
224-56-56-1x1-128-56-56-128-0x0-1x1-1x1-0-NCHW-FP32-B=ConvOclDirectFwd1x1:1,128,1,1,0,1,32,4,0;ConvAsm1x1U:2,32,2,32,1,1,1,2
512-7-7-1x1-1024-14-14-16-0x0-2x2-1x1-0-NCHW-FP16-B=ConvOclDirectFwd1x1:8,64,16,16,0,1,16,4,1;ConvAsm1x1U:2,8,4,16,1,4,2,4
256-28-28-1x1-64-56-56-64-0x0-2x2-1x1-0-NCHW-FP32-B=ConvOclDirectFwd1x1:1,256,1,1,0,1,32,4,0;ConvAsm1x1U:1,32,7,64,1,1,1,1
256-13-13-3x3-64-13-13-128-1x1-1x1-1x1-0-NCHW-FP16-B=ConvOclDirectFwd:8,8,16,16,2,2,8,4,1
1584-57-203-1x1-544-57-203-6-0x0-1x1-1x1-0-NCHW-FP32-F=ConvOclDirectFwd1x1:1,64,1,1,1,4,64,2048,0
16-730-644-1x1-80-730-644-8-0x0-1x1-1x1-0-NCHW-FP32-F=ConvOclDirectFwd1x1:1,64,1,1,1,1,32,64,0
1-429-783-1x1-64-429-783-4-0x0-1x1-1x1-0-NCHW-FP32-B=ConvOclDirectFwd1x1:1,256,1,1,0,1,64,4,0
720-498-852-1x1-288-498-852-1-0x0-1x1-1x1-0-NCHW-FP32-F=ConvOclDirectFwd1x1:1,64,1,1,1,0,64,2048,0
256-27-27-1x1-64-27-27-64-0x0-1x1-1x1-0-NCHW-FP32-B=ConvOclDirectFwd1x1:1,256,1,1,0,1,32,4,0;ConvAsm1x1U:1,32,1,64,1,1,2,2
144-96-898-1x1-1824-96-898-1-0x0-1x1-1x1-0-NCHW-FP32-B=ConvOclDirectFwd1x1:1,256,1,1,0,4,16,8,0
128-14-14-1x1-768-14-14-512-0x0-1x1-1x1-0-NCHW-FP16-F=ConvOclDirectFwd1x1:8,64,16,16,0,2,16,4,1;ConvAsm1x1U:1,8,2,64,2,4,1,4
128-274-776-1x1-608-274-776-2-0x0-1x1-1x1-0-NCHW-FP32-B=ConvOclDirectFwd1x1:1,256,1,1,0,1,32,4,0
232-858-27-1x1-112-858-27-16-0x0-1x1-1x1-0-NCHW-FP32-F=ConvOclDirectFwd1x1:1,64,1,1,0,2,16,8,0
128-14-14-3x3-128-28-28-64-1x1-2x2-1x1-0-NCHW-FP16-W=ConvAsmBwdWrW3x3:0,0,8,4,2,1
192-8-8-1x1-1280-8-8-64-0x0-1x1-1x1-0-NCHW-FP16-W=ConvAsmBwdWrW1x1:1,16,4,8,2,1,2,4,0,1
128-7-7-1x1-672-7-7-512-0x0-1x1-1x1-0-NCHW-FP16-W=ConvAsmBwdWrW1x1:1,16,2,8,2,1,4,2,0,2
128-7-7-3x3-32-7-7-128-1x1-1x1-1x1-0-NCHW-FP32-W=ConvAsmBwdWrW3x3:0,1,8,2,6,4
800-7-7-1x1-128-7-7-256-0x0-1x1-1x1-0-NCHW-FP32-B=ConvOclDirectFwd1x1:1,256,1,1,0,1,16,4,0;ConvAsm1x1U:2,16,2,32,1,2,4,1
64-114-114-7x7-3-227-227-256-3x3-2x2-1x1-0-NCHW-FP32-B=ConvOclDirectFwd:16,8,16,16,1,2,1,1,1
1-350-452-1x1-58-350-452-12-0x0-1x1-1x1-0-NCHW-FP32-W=ConvAsmBwdWrW1x1:4,4,2,1,2,1,4,4,0,1
32-741-218-1x1-8-741-218-4-0x0-1x1-1x1-0-NCHW-FP32-W=ConvAsmBwdWrW1x1:4,4,2,1,2,1,2,4,0,3
2048-7-7-1x1-1024-14-14-1-0x0-2x2-1x1-0-NCHW-FP16-W=ConvAsmBwdWrW1x1:1,16,2,4,4,1,1,2,0,2
2048-7-7-1x1-512-7-7-8-0x0-1x1-1x1-0-NCHW-FP16-W=ConvAsmBwdWrW1x1:1,16,4,4,4,1,1,2,0,2
192-8-8-3x3-192-17-17-64-0x0-2x2-1x1-0-NCHW-FP32-B=ConvOclDirectFwd:32,8,32,32,1,4,4,4,1
19-359-309-1x1-448-359-309-8-0x0-1x1-1x1-0-NCHW-FP32-B=ConvOclDirectFwd1x1:1,128,1,1,0,1,64,4,0
1184-6-22-1x1-1056-6-22-48-0x0-1x1-1x1-0-NCHW-FP32-F=ConvOclDirectFwd1x1:1,64,1,1,1,4,64,2048,0;ConvAsm1x1U:2,16,5,32,1,2,1,1
3-411-812-1x1-8-411-812-48-0x0-1x1-1x1-0-NCHW-FP32-F=ConvOclDirectFwd1x1:1,256,1,1,0,4,16,4,0;ConvAsm1x1U:1,8,1,16,1,1,1,1
24-28-28-1x1-58-28-28-4-0x0-1x1-1x1-0-NCHW-FP32-F=ConvOclDirectFwd1x1:1,256,1,1,0,4,8,4,0;ConvAsm1x1U:1,8,1,16,1,1,1,1
256-57-57-3x3-256-29-29-48-1x1-2x2-1x1-0-NCHW-FP32-F_g32=ConvOclDirectFwd:16,16,32,32,2,2,8,2,1
960-7-7-1x1-240-7-7-64-0x0-1x1-1x1-0-NCHW-FP32-B_g3=ConvOclDirectFwd:8,8,8,8,1,1,8,4,2
384-8-8-1x1-1536-8-8-4-0x0-1x1-1x1-0-NCHW-FP32-W=ConvAsmBwdWrW1x1:1,16,2,4,4,1,2,4,0,1
528-363-485-1x1-896-363-485-1-0x0-1x1-1x1-0-NCHW-FP32-B=ConvOclDirectFwd1x1:1,256,1,1,0,1,32,4,0
240-950-167-1x1-4-950-167-12-0x0-1x1-1x1-0-NCHW-FP32-F=ConvOclDirectFwd1x1:1,256,1,1,0,2,16,8,0
19-531-139-1x1-116-531-139-32-0x0-1x1-1x1-0-NCHW-FP32-B=ConvOclDirectFwd1x1:1,256,1,1,0,1,16,4,0
416-28-28-1x1-128-28-28-128-0x0-1x1-1x1-0-NCHW-FP16-B=ConvOclDirectFwd1x1:1,128,1,1,0,4,16,4,0;ConvAsm1x1U:1,16,2,16,1,2,2,2
1504-392-445-1x1-58-392-445-1-0x0-1x1-1x1-0-NCHW-FP32-F=ConvOclDirectFwd1x1:1,64,1,1,0,1,16,8,0
1472-744-52-1x1-24-744-52-2-0x0-1x1-1x1-0-NCHW-FP32-F=ConvOclDirectFwd1x1:1,128,1,1,0,4,16,4,0
4-534-855-1x1-3-534-855-16-0x0-1x1-1x1-0-NCHW-FP32-B=ConvOclDirectFwd1x1:1,256,1,1,0,1,16,4,0;ConvAsm1x1U:1,1,2,4,1,1,1,1
256-35-35-1x1-64-35-35-32-0x0-1x1-1x1-0-NCHW-FP32-F=ConvOclDirectFwd1x1:1,64,1,1,1,0,16,2048,0;ConvAsm1x1U:4,16,5,64,1,2,1,1;ConvActivAsm1x1U:2,16,2,64,3,1
448-14-14-1x1-128-14-14-512-0x0-1x1-1x1-0-NCHW-FP16-B=ConvOclDirectFwd1x1:1,128,1,1,0,2,32,8,0;ConvAsm1x1U:1,16,2,16,1,2,4,2
1024-8-8-3x3-1024-15-15-48-1x1-2x2-1x1-0-NCHW-FP32-B_g32=ConvOclDirectFwd:16,16,16,16,1,1,4,1,2
960-505-377-1x1-992-505-377-2-0x0-1x1-1x1-0-NCHW-FP32-F=ConvOclDirectFwd1x1:1,64,1,1,1,0,16,2048,0
128-28-28-1x1-192-28-28-64-0x0-1x1-1x1-0-NCHW-FP16-B=ConvOclDirectFwd1x1:1,64,1,1,0,4,16,4,0;ConvAsm1x1U:1,16,2,16,1,2,2,2
96-701-370-1x1-80-701-370-6-0x0-1x1-1x1-0-NCHW-FP32-B=ConvOclDirectFwd1x1:1,256,1,1,0,2,16,4,0
96-135-182-1x1-768-135-182-16-0x0-1x1-1x1-0-NCHW-FP32-B=ConvOclDirectFwd1x1:1,256,1,1,0,2,32,4,0
224-27-741-1x1-1184-27-741-4-0x0-1x1-1x1-0-NCHW-FP32-B=ConvOclDirectFwd1x1:1,64,1,1,0,1,32,4,0
1-256-726-1x1-232-256-726-6-0x0-1x1-1x1-0-NCHW-FP32-F=ConvOclDirectFwd1x1:1,256,1,1,0,4,16,4,0
512-7-7-1x1-2048-7-7-4-0x0-1x1-1x1-0-NCHW-FP32-F=ConvOclDirectFwd1x1:1,64,1,1,1,0,16,256,0;ConvAsm1x1U:1,8,1,64,4,4,2,2;ConvActivAsm1x1U:2,16,2,32,2,4
3-227-227-7x7-64-114-114-2-3x3-2x2-1x1-0-NCHW-FP32-F=ConvOclDirectFwd:16,16,16,32,1,2,8,1,2
1152-94-17-1x1-19-94-17-2-0x0-1x1-1x1-0-NCHW-FP32-F=ConvOclDirectFwd1x1:1,256,1,1,0,2,16,8,0;ConvAsm1x1U:1,8,1,32,1,4,2,1
64-512-512-7x7-3-1030-1030-4-0x0-2x2-1x1-0-NCHW-FP32-B=ConvOclDirectFwd:8,16,32,32,4,2,2,2,2
768-39-463-1x1-992-39-463-16-0x0-1x1-1x1-0-NCHW-FP32-B=ConvOclDirectFwd1x1:1,256,1,1,0,1,32,4,0
128-28-28-3x3-96-28-28-512-1x1-1x1-1x1-0-NCHW-FP16-B=ConvOclDirectFwd:32,8,32,32,1,4,8,4,1
736-625-441-1x1-896-625-441-1-0x0-1x1-1x1-0-NCHW-FP32-B=ConvOclDirectFwd1x1:1,256,1,1,0,1,32,4,0
224-603-966-1x1-19-603-966-1-0x0-1x1-1x1-0-NCHW-FP32-F=ConvOclDirectFwd1x1:1,256,1,1,0,2,16,8,0
128-221-337-1x1-224-221-337-12-0x0-1x1-1x1-0-NCHW-FP32-B=ConvOclDirectFwd1x1:1,256,1,1,0,1,32,4,0
232-86-151-1x1-224-86-151-4-0x0-1x1-1x1-0-NCHW-FP32-W=ConvAsmBwdWrW1x1:4,4,8,2,8,1,2,4,0,0
1-39-233-1x1-2160-39-233-1-0x0-1x1-1x1-0-NCHW-FP32-B=ConvOclDirectFwd1x1:1,128,1,1,0,1,4,4,0
192-7-7-1x1-1152-7-7-16-0x0-1x1-1x1-0-NCHW-FP32-B=ConvOclDirectFwd1x1:8,64,8,8,0,1,16,4,1;ConvAsm1x1U:2,16,2,32,1,2,2,2
128-56-56-1x1-224-56-56-512-0x0-1x1-1x1-0-NCHW-FP16-W=ConvAsmBwdWrW1x1:4,4,8,1,8,1,2,4,0,1
384-14-14-1x1-128-14-14-512-0x0-1x1-1x1-0-NCHW-FP32-W=ConvAsmBwdWrW1x1:4,4,8,4,4,2,2,4,0,1
128-7-7-1x1-928-7-7-64-0x0-1x1-1x1-0-NCHW-FP32-B=ConvOclDirectFwd1x1:1,256,1,1,0,1,8,4,0;ConvAsm1x1U:1,16,1,64,2,2,2,2
1280-481-862-1x1-832-481-862-1-0x0-1x1-1x1-0-NCHW-FP32-F=ConvOclDirectFwd1x1:1,64,1,1,1,4,16,2048,0
1024-14-14-1x1-512-28-28-512-0x0-2x2-1x1-0-NCHW-FP32-B=ConvOclDirectFwd1x1:1,128,1,1,0,2,32,4,0;ConvAsm1x1U:1,32,1,16,3,1,1,2
1104-14-14-1x1-192-14-14-16-0x0-1x1-1x1-0-NCHW-FP32-W=ConvAsmBwdWrW1x1:2,8,4,8,4,1,1,4,0,1
160-7-7-1x1-832-7-7-1-0x0-1x1-1x1-0-NCHW-FP32-B=ConvOclDirectFwd1x1:1,256,1,1,0,1,4,8,0;ConvAsm1x1U:1,8,1,64,1,4,2,1
864-527-23-1x1-2064-527-23-1-0x0-1x1-1x1-0-NCHW-FP32-B=ConvOclDirectFwd1x1:1,256,1,1,0,1,16,8,0
320-266-292-1x1-768-266-292-1-0x0-1x1-1x1-0-NCHW-FP32-B=ConvOclDirectFwd1x1:1,128,1,1,0,1,32,4,0
576-523-160-1x1-128-523-160-1-0x0-1x1-1x1-0-NCHW-FP32-F=ConvOclDirectFwd1x1:1,64,1,1,1,1,16,2048,0
128-38-38-3x3-64-75-75-32-1x1-2x2-1x1-0-NCHW-FP32-W=ConvAsmBwdWrW3x3:0,0,8,4,3,1
64-28-28-1x1-256-28-28-32-0x0-1x1-1x1-0-NCHW-FP16-W=ConvAsmBwdWrW1x1:4,4,4,1,8,1,2,4,0,1
928-331-475-1x1-432-331-475-1-0x0-1x1-1x1-0-NCHW-FP32-B=ConvOclDirectFwd1x1:1,256,1,1,0,1,16,4,0
3-525-285-1x1-224-525-285-8-0x0-1x1-1x1-0-NCHW-FP32-F=ConvOclDirectFwd1x1:1,256,1,1,0,1,32,4,0
1536-134-567-1x1-480-134-567-4-0x0-1x1-1x1-0-NCHW-FP32-F=ConvOclDirectFwd1x1:1,64,1,1,1,0,64,2048,0
2-53-214-1x1-16-53-214-256-0x0-1x1-1x1-0-NCHW-FP32-W=ConvAsmBwdWrW1x1:4,4,2,1,2,1,4,4,0,1
32-86-584-1x1-1536-86-584-2-0x0-1x1-1x1-0-NCHW-FP32-B=ConvOclDirectFwd1x1:1,256,1,1,0,1,32,4,0
128-7-7-5x5-832-7-7-8-2x2-1x1-1x1-0-NCHW-FP32-B=ConvOclDirectFwd:8,8,8,8,1,1,8,1,2
240-7-7-1x1-960-7-7-32-0x0-1x1-1x1-0-NCHW-FP16-B_g3=ConvOclDirectFwd:8,8,8,8,1,1,8,2,1
336-106-990-1x1-352-106-990-12-0x0-1x1-1x1-0-NCHW-FP32-F=ConvOclDirectFwd1x1:1,64,1,1,1,0,64,2048,0
480-226-27-1x1-48-226-27-48-0x0-1x1-1x1-0-NCHW-FP32-B=ConvOclDirectFwd1x1:1,128,1,1,0,2,16,8,0;ConvAsm1x1U:2,16,7,64,1,1,1,1
1104-67-454-1x1-8-67-454-12-0x0-1x1-1x1-0-NCHW-FP32-F=ConvOclDirectFwd1x1:1,256,1,1,0,2,16,8,0
128-14-14-1x1-928-14-14-256-0x0-1x1-1x1-0-NCHW-FP32-F=ConvOclDirectFwd1x1:1,64,1,1,1,4,32,2048,0;ConvAsm1x1U:1,16,1,32,4,2,2,2
192-1006-425-1x1-1056-1006-425-1-0x0-1x1-1x1-0-NCHW-FP32-B=ConvOclDirectFwd1x1:1,256,1,1,0,2,32,4,0
128-7-7-5x5-48-7-7-256-2x2-1x1-1x1-0-NCHW-FP16-B=ConvOclDirectFwd:8,8,8,8,1,1,8,2,2
144-1-365-1x1-624-1-365-2048-0x0-1x1-1x1-0-NCHW-FP32-W=ConvAsmBwdWrW1x1:4,4,8,4,4,1,1,4,0,0
192-28-28-1x1-128-28-28-32-0x0-1x1-1x1-0-NCHW-FP32-B=ConvOclDirectFwd1x1:1,128,1,1,0,4,16,4,0;ConvAsm1x1U:1,16,1,32,1,2,2,2
192-35-35-3x3-192-71-71-1-0x0-2x2-1x1-0-NCHW-FP32-B=ConvOclDirectFwd:8,16,16,32,2,2,8,4,1
896-14-14-1x1-128-14-14-32-0x0-1x1-1x1-0-NCHW-FP16-W=ConvAsmBwdWrW1x1:2,8,4,4,4,1,2,2,0,1
16-7-541-1x1-192-7-541-512-0x0-1x1-1x1-0-NCHW-FP32-F=ConvOclDirectFwd1x1:1,64,1,1,1,1,16,2048,0;ConvAsm1x1U:1,8,1,64,1,4,1,8
512-28-28-1x1-256-56-56-8-0x0-2x2-1x1-0-NCHW-FP16-W=ConvAsmBwdWrW1x1:2,8,4,8,2,1,2,2,0,1
256-38-38-3x3-128-38-38-64-1x1-1x1-1x1-0-NCHW-FP32-W=ConvAsmBwdWrW3x3:0,0,8,4,3,4
416-216-986-1x1-928-216-986-1-0x0-1x1-1x1-0-NCHW-FP32-F=ConvOclDirectFwd1x1:1,64,1,1,1,4,64,2048,0
544-14-14-1x1-128-14-14-64-0x0-1x1-1x1-0-NCHW-FP16-W=ConvAsmBwdWrW1x1:2,8,2,4,4,1,4,4,0,1
960-7-7-1x1-240-7-7-512-0x0-1x1-1x1-0-NCHW-FP16-F_g3=ConvOclDirectFwd:8,8,8,8,1,1,8,2,1
288-35-35-1x1-64-35-35-256-0x0-1x1-1x1-0-NCHW-FP16-F=ConvOclDirectFwd1x1:1,256,1,1,0,1,16,8,0;ConvAsm1x1U:2,8,4,64,1,4,1,4
64-56-56-3x3-64-56-56-1-1x1-1x1-1x1-0-NCHW-FP16-F=ConvOclDirectFwd:16,16,16,16,1,1,4,4,1;ConvOclDirectFwdFused:16,16,16,16,1,1,4,4,1
128-7-7-5x5-832-7-7-64-2x2-1x1-1x1-0-NCHW-FP32-W=ConvOclBwdWrW2<1>:1,6,1,3,7;ConvOclBwdWrW2<16>:1,7,1,8,7;ConvOclBwdWrW2<8>:1,7,1,8,7;ConvOclBwdWrW2<4>:1,7,3,3,7;ConvOclBwdWrW2<2>:1,7,1,8,7
2048-7-7-1x1-1024-4-4-64-0x0-2x2-1x1-0-NCHW-FP16-F=ConvOclDirectFwd1x1:1,256,1,1,0,1,8,4,0;ConvAsm1x1U:2,4,4,4,2,4,1,8
384-35-35-1x1-64-35-35-1-0x0-1x1-1x1-0-NCHW-FP32-F=ConvOclDirectFwd1x1:1,64,1,1,1,0,16,64,0;ConvAsm1x1U:1,8,1,64,1,4,4,1;ConvActivAsm1x1U:2,16,2,64,1,4
2-65-851-1x1-160-65-851-8-0x0-1x1-1x1-0-NCHW-FP32-F=ConvOclDirectFwd1x1:1,256,1,1,0,1,32,4,0
1696-11-105-1x1-384-11-105-16-0x0-1x1-1x1-0-NCHW-FP32-F=ConvOclDirectFwd1x1:1,64,1,1,1,0,32,2048,0;ConvAsm1x1U:3,16,5,16,2,2,1,1
1728-3-421-1x1-64-3-421-32-0x0-1x1-1x1-0-NCHW-FP32-F=ConvOclDirectFwd1x1:1,64,1,1,1,0,16,128,0;ConvAsm1x1U:2,16,5,32,1,1,1,1
48-27-27-1x1-384-27-27-128-0x0-1x1-1x1-0-NCHW-FP32-F=ConvOclDirectFwd1x1:1,64,1,1,1,0,16,2048,0;ConvAsm1x1U:2,16,2,64,3,2,1,2
2-33-693-1x1-624-33-693-6-0x0-1x1-1x1-0-NCHW-FP32-B=ConvOclDirectFwd1x1:1,256,1,1,0,1,4,4,0
