src/kernels/gfx900_56.cd.pdb.txt
128-14-14-1x1-608-14-14-256-0x0-1x1-1x1-0-NCHW-FP32-F=ConvAsm1x1U:1,16,1,32,4,2,2,2;ConvOclDirectFwd1x1:1,64,1,1,1,1,16,2048,0
192-14-14-1x1-432-14-14-16-0x0-1x1-1x1-0-NCHW-FP32-B=ConvAsm1x1U:1,16,1,32,2,2,1,1;ConvOclDirectFwd1x1:1,256,1,1,0,4,16,4,0
160-17-17-1x1-768-17-17-128-0x0-1x1-1x1-0-NCHW-FP16-W=ConvAsmBwdWrW1x1:2,8,4,8,2,1,2,4,0,1
256-57-57-1x1-128-57-57-16-0x0-1x1-1x1-0-NCHW-FP32-B=ConvAsm1x1U:2,32,7,64,1,1,1,4;ConvOclDirectFwd1x1:1,256,1,1,0,1,32,4,0
464-7-7-1x1-1024-7-7-32-0x0-1x1-1x1-0-NCHW-FP16-F=ConvAsm1x1U:2,8,4,16,1,4,2,4;ConvOclDirectFwd1x1:8,64,8,8,0,1,16,4,1
1-7-7-3x3-1-5-5-512-0x0-1x1-1x1-0-NCHW-FP32-F=ConvOclDirectFwd:8,8,8,8,1,1,1,1,2
128-14-14-1x1-384-14-14-64-0x0-1x1-1x1-0-NCHW-FP32-W=ConvAsmBwdWrW1x1:1,16,2,8,4,1,4,4,0,1
1280-8-8-1x1-320-8-8-128-0x0-1x1-1x1-0-NCHW-FP32-F=ConvAsm1x1U:2,16,2,32,3,2,4,1;ConvOclDirectFwd1x1:1,64,1,1,1,1,16,2048,0;ConvActivAsm1x1U:2,16,2,32,4,4
192-28-28-1x1-576-28-28-16-0x0-1x1-1x1-0-NCHW-FP32-B=ConvAsm1x1U:2,16,2,32,1,2,2,2;ConvOclDirectFwd1x1:1,64,1,1,0,4,16,4,0
2048-8-8-1x1-192-8-8-4-0x0-1x1-1x1-0-NCHW-FP16-F=ConvAsm1x1U:1,8,2,16,1,4,4,1;ConvOclDirectFwd1x1:1,128,1,1,0,1,4,4,0
736-14-14-1x1-128-14-14-16-0x0-1x1-1x1-0-NCHW-FP16-B=ConvAsm1x1U:2,8,4,64,1,4,4,2;ConvOclDirectFwd1x1:1,256,1,1,0,4,4,4,0
512-14-14-1x1-24-14-14-256-0x0-1x1-1x1-0-NCHW-FP16-B=ConvAsm1x1U:2,8,4,64,1,4,4,1;ConvOclDirectFwd1x1:1,64,1,1,0,4,8,4,0
512-7-7-1x1-2048-7-7-2-0x0-1x1-1x1-0-NCHW-FP32-F=ConvAsm1x1U:2,8,2,32,1,4,2,2;ConvOclDirectFwd1x1:1,64,1,1,1,4,32,64,0;ConvActivAsm1x1U:2,16,2,32,1,2
528-64-128-1x1-128-64-128-1-0x0-1x1-1x1-0-NCHW-FP16-F=ConvOclDirectFwd1x1:1,128,1,1,0,2,8,4,0
512-520-732-1x1-1-520-732-1-0x0-1x1-1x1-0-NCHW-FP32-F=ConvOclDirectFwd1x1:1,128,1,1,0,2,16,8,0
32-54-54-1x1-128-54-54-128-0x0-1x1-1x1-0-NCHW-FP16-W=ConvAsmBwdWrW1x1:4,4,2,1,8,1,4,4,0,3
1568-379-62-1x1-3-379-62-1-0x0-1x1-1x1-0-NCHW-FP32-F=ConvOclDirectFwd1x1:1,256,1,1,0,1,16,8,0
192-64-128-1x1-480-64-128-1-0x0-1x1-1x1-0-NCHW-FP16-W=ConvAsmBwdWrW1x1:4,4,4,4,2,1,1,4,0,3
256-217-250-1x1-288-217-250-32-0x0-1x1-1x1-0-NCHW-FP32-F=ConvOclDirectFwd1x1:1,64,1,1,1,4,64,256,0
32-14-14-1x1-512-14-14-512-0x0-1x1-1x1-0-NCHW-FP16-B=ConvAsm1x1U:1,16,2,16,1,2,1,4;ConvOclDirectFwd1x1:1,256,1,1,0,2,32,4,0
128-56-56-1x1-256-56-56-16-0x0-1x1-1x1-0-NCHW-FP16-B=ConvAsm1x1U:1,16,2,32,1,2,1,4;ConvOclDirectFwd1x1:1,128,1,1,0,4,16,4,0
2048-7-7-1x1-1024-14-14-8-0x0-2x2-1x1-0-NCHW-FP32-B=ConvAsm1x1U:2,16,2,32,1,2,4,4;ConvOclDirectFwd1x1:1,256,1,1,0,1,8,8,0
116-717-195-1x1-256-717-195-12-0x0-1x1-1x1-0-NCHW-FP32-F=ConvOclDirectFwd1x1:1,64,1,1,0,1,32,4,0
24-56-56-1x1-58-56-56-128-0x0-1x1-1x1-0-NCHW-FP32-F=ConvAsm1x1U:1,16,2,64,2,2,1,1;ConvOclDirectFwd1x1:1,128,1,1,0,1,16,4,0
768-14-14-1x1-128-14-14-256-0x0-1x1-1x1-0-NCHW-FP16-F=ConvAsm1x1U:2,8,4,64,1,4,1,4;ConvOclDirectFwd1x1:8,64,16,16,0,2,16,4,1
128-14-14-1x1-640-14-14-256-0x0-1x1-1x1-0-NCHW-FP16-B=ConvAsm1x1U:1,16,2,16,1,2,1,4;ConvOclDirectFwd1x1:1,256,1,1,0,2,32,4,0
512-128-128-1x1-12-128-128-4-0x0-1x1-1x1-0-NCHW-FP32-F=ConvOclDirectFwd1x1:1,64,1,1,0,4,8,4,0
232-118-200-1x1-1312-118-200-1-0x0-1x1-1x1-0-NCHW-FP32-B=ConvOclDirectFwd1x1:1,128,1,1,0,2,32,4,0
1056-198-498-1x1-80-198-498-4-0x0-1x1-1x1-0-NCHW-FP32-F=ConvOclDirectFwd1x1:1,64,1,1,1,4,64,2048,0
112-37-729-1x1-1104-37-729-16-0x0-1x1-1x1-0-NCHW-FP32-B=ConvOclDirectFwd1x1:1,256,1,1,0,1,16,4,0
32-54-54-1x1-128-54-54-16-0x0-1x1-1x1-0-NCHW-FP32-B=ConvAsm1x1U:1,16,1,64,1,2,2,1;ConvOclDirectFwd1x1:1,64,1,1,0,2,32,4,0
256-56-56-3x3-128-56-56-64-1x1-1x1-1x1-0-NCHW-FP16-B=ConvOclDirectFwd:32,8,32,32,1,4,8,1,1
116-28-28-1x1-116-28-28-64-0x0-1x1-1x1-0-NCHW-FP16-B=ConvAsm1x1U:4,4,8,4,1,2,1,8;ConvOclDirectFwd1x1:1,256,1,1,0,4,8,4,0
48-14-14-5x5-16-14-14-128-2x2-1x1-1x1-0-NCHW-FP16-B=ConvOclDirectFwd:16,8,16,16,1,2,4,1,2
928-178-52-1x1-2048-178-52-6-0x0-1x1-1x1-0-NCHW-FP32-B=ConvOclDirectFwd1x1:1,128,1,1,0,2,32,4,0
112-14-14-1x1-512-14-14-256-0x0-1x1-1x1-0-NCHW-FP16-B=ConvAsm1x1U:1,16,2,16,1,2,1,4;ConvOclDirectFwd1x1:1,256,1,1,0,2,16,4,0
64-28-28-1x1-256-28-28-32-0x0-1x1-1x1-0-NCHW-FP16-W=ConvAsmBwdWrW1x1:4,4,4,1,8,1,2,4,0,1
528-14-14-1x1-256-14-14-1-0x0-1x1-1x1-0-NCHW-FP32-F=ConvAsm1x1U:1,8,1,64,1,4,4,1;ConvOclDirectFwd1x1:1,64,1,1,1,0,16,64,0;ConvActivAsm1x1U:1,16,1,64,1,4
160-73-73-1x1-64-73-73-128-0x0-1x1-1x1-0-NCHW-FP32-F=ConvAsm1x1U:2,16,2,64,3,2,1,4;ConvOclDirectFwd1x1:1,64,1,1,1,1,16,256,0;ConvActivAsm1x1U:2,32,3,64,2,1
128-27-27-3x3-128-27-27-8-1x1-1x1-1x1-0-NCHW-FP16-F=ConvOclDirectFwd:16,16,32,32,2,2,4,2,2
256-56-56-1x1-64-56-56-256-0x0-1x1-1x1-0-NCHW-FP16-W=ConvAsmBwdWrW1x1:4,4,8,1,8,2,4,4,0,1
128-14-14-1x1-480-14-14-16-0x0-1x1-1x1-0-NCHW-FP16-F=ConvAsm1x1U:1,8,2,16,1,4,1,4;ConvOclDirectFwd1x1:1,64,1,1,0,4,8,4,0
16-211-31-1x1-416-211-31-1-0x0-1x1-1x1-0-NCHW-FP32-B=ConvAsm1x1U:1,8,1,32,1,2,2,2;ConvOclDirectFwd1x1:1,256,1,1,0,1,8,4,0
928-2-74-1x1-2-2-74-2048-0x0-1x1-1x1-0-NCHW-FP32-F=ConvAsm1x1U:2,1,5,4,1,1,1,1;ConvOclDirectFwd1x1:1,256,1,1,0,4,16,8,0
128-7-7-1x1-640-7-7-512-0x0-1x1-1x1-0-NCHW-FP16-B=ConvAsm1x1U:1,16,2,32,1,2,1,2;ConvOclDirectFwd1x1:1,64,1,1,0,1,32,4,0
3-10-10-3x3-5-10-10-32-1x1-1x1-1x1-0-NCHW-FP16-B=ConvOclDirectFwd:16,16,16,16,1,1,1,2,2
128-28-28-3x3-64-56-56-12-1x1-2x2-1x1-0-NCHW-FP32-W=ConvAsmBwdWrW3x3:0,0,16,4,5,1
216-28-28-1x1-54-28-28-64-0x0-1x1-1x1-0-NCHW-FP32-B_g3=ConvOclDirectFwd:16,16,16,16,1,1,8,2,1
832-7-7-1x1-48-7-7-32-0x0-1x1-1x1-0-NCHW-FP16-F=ConvAsm1x1U:1,8,2,32,1,4,4,1;ConvOclDirectFwd1x1:1,64,1,1,0,1,4,8,0
256-14-14-3x3-256-7-7-32-1x1-2x2-1x1-0-NCHW-FP32-F=ConvOclDirectFwd:8,8,8,8,1,1,8,2,1
1760-344-325-1x1-608-344-325-1-0x0-1x1-1x1-0-NCHW-FP32-F=ConvOclDirectFwd1x1:1,64,1,1,1,4,64,2048,0
528-14-14-1x1-256-14-14-16-0x0-1x1-1x1-0-NCHW-FP32-F=ConvAsm1x1U:4,16,4,64,1,2,2,1;ConvOclDirectFwd1x1:1,64,1,1,1,4,16,2048,0;ConvActivAsm1x1U:2,16,2,16,4,2
256-15-15-3x3-256-29-29-32-1x1-2x2-1x1-0-NCHW-FP32-W=ConvAsmBwdWrW3x3:0,0,8,8,4,1
256-28-28-1x1-64-56-56-128-0x0-2x2-1x1-0-NCHW-FP32-B=ConvAsm1x1U:1,8,1,32,1,2,4,1;ConvOclDirectFwd1x1:1,256,1,1,0,1,32,4,0
512-7-7-1x1-1024-14-14-64-0x0-2x2-1x1-0-NCHW-FP16-W=ConvAsmBwdWrW1x1:1,16,4,8,2,1,1,2,0,2
128-128-128-1x1-512-128-128-4-0x0-1x1-1x1-0-NCHW-FP32-F=ConvOclDirectFwd1x1:1,64,1,1,1,1,32,256,0
128-28-28-1x1-256-56-56-16-0x0-2x2-1x1-0-NCHW-FP32-B=ConvAsm1x1U:1,16,1,32,1,2,1,1;ConvOclDirectFwd1x1:1,256,1,1,0,1,32,4,0
528-14-14-1x1-160-14-14-256-0x0-1x1-1x1-0-NCHW-FP32-W=ConvAsmBwdWrW1x1:2,8,4,8,4,1,2,4,0,2
128-27-27-3x3-128-27-27-256-1x1-1x1-1x1-0-NCHW-FP32-W=ConvAsmBwdWrW3x3:0,1,8,4,2,1
256-56-56-1x1-128-28-28-128-0x0-2x2-1x1-0-NCHW-FP32-F=ConvAsm1x1U:4,16,5,32,1,2,2,2;ConvOclDirectFwd1x1:1,64,1,1,1,4,16,256,0
16-54-54-3x3-64-54-54-128-1x1-1x1-1x1-0-NCHW-FP32-B=ConvOclDirectFwd:16,8,16,16,1,2,8,2,2;ConvAsm3x3U:7,8,3
720-161-30-1x1-192-161-30-16-0x0-1x1-1x1-0-NCHW-FP32-F=ConvAsm1x1U:3,16,5,64,2,1,1,1;ConvOclDirectFwd1x1:1,64,1,1,1,0,16,256,0
256-27-27-1x1-64-27-27-32-0x0-1x1-1x1-0-NCHW-FP32-B=ConvAsm1x1U:3,32,3,64,1,1,2,1;ConvOclDirectFwd1x1:1,256,1,1,0,1,32,4,0
512-14-14-1x1-192-14-14-1-0x0-1x1-1x1-0-NCHW-FP16-F=ConvAsm1x1U:1,8,2,32,1,4,4,1;ConvOclDirectFwd1x1:1,128,1,1,0,4,4,8,0
256-14-14-1x1-512-28-28-8-0x0-2x2-1x1-0-NCHW-FP16-W=ConvAsmBwdWrW1x1:2,8,4,4,2,1,1,4,0,1
288-28-28-1x1-128-28-28-512-0x0-1x1-1x1-0-NCHW-FP32-B=ConvAsm1x1U:1,16,1,32,2,2,1,4;ConvOclDirectFwd1x1:1,128,1,1,0,4,16,4,0
192-231-115-1x1-1248-231-115-12-0x0-1x1-1x1-0-NCHW-FP32-B=ConvOclDirectFwd1x1:1,64,1,1,0,1,32,4,0
192-28-28-1x1-32-28-28-1-0x0-1x1-1x1-0-NCHW-FP32-F=ConvAsm1x1U:1,8,1,64,1,4,2,1;ConvOclDirectFwd1x1:1,64,1,1,1,0,16,2048,0;ConvActivAsm1x1U:1,16,1,32,1,3
1104-219-758-1x1-160-219-758-2-0x0-1x1-1x1-0-NCHW-FP32-B=ConvOclDirectFwd1x1:1,128,1,1,0,2,32,4,0
2048-215-6-1x1-912-215-6-8-0x0-1x1-1x1-0-NCHW-FP32-B=ConvAsm1x1U:2,16,6,32,1,2,1,4;ConvOclDirectFwd1x1:1,256,1,1,0,2,16,4,0
128-7-7-1x1-928-7-7-128-0x0-1x1-1x1-0-NCHW-FP16-F=ConvAsm1x1U:2,8,4,16,1,4,1,2;ConvOclDirectFwd1x1:1,64,1,1,0,1,8,4,0
256-963-9-1x1-64-963-9-6-0x0-1x1-1x1-0-NCHW-FP32-B=ConvAsm1x1U:1,32,7,64,1,1,1,2;ConvOclDirectFwd1x1:1,64,1,1,0,1,32,4,0
1024-17-17-1x1-256-17-17-1-0x0-1x1-1x1-0-NCHW-FP16-F=ConvAsm1x1U:1,8,2,64,1,4,4,1;ConvOclDirectFwd1x1:1,128,1,1,0,1,4,8,0
192-7-7-1x1-1680-7-7-16-0x0-1x1-1x1-0-NCHW-FP16-W=ConvAsmBwdWrW1x1:1,16,2,8,2,1,2,4,0,1
64-56-56-1x1-256-56-56-256-0x0-1x1-1x1-0-NCHW-FP32-W=ConvAsmBwdWrW1x1:4,4,4,2,2,1,1,4,0,1
256-32-32-1x1-2048-32-32-4-0x0-1x1-1x1-0-NCHW-FP32-B=ConvAsm1x1U:1,32,1,64,2,1,1,2;ConvOclDirectFwd1x1:1,128,1,1,0,2,16,4,0
128-28-28-1x1-128-28-28-128-0x0-1x1-1x1-0-NCHW-FP32-F=ConvAsm1x1U:2,16,2,32,3,2,1,1;ConvOclDirectFwd1x1:1,64,1,1,1,4,32,2048,0
224-86-151-1x1-232-86-151-4-0x0-1x1-1x1-0-NCHW-FP32-F=ConvAsm1x1U:2,16,6,64,2,1,1,1;ConvOclDirectFwd1x1:1,256,1,1,0,2,16,4,0
64-128-256-1x1-192-128-256-1-0x0-1x1-1x1-0-NCHW-FP32-W=ConvAsmBwdWrW1x1:4,4,4,1,8,1,1,4,0,2
640-71-256-1x1-24-71-256-12-0x0-1x1-1x1-0-NCHW-FP32-B=ConvOclDirectFwd1x1:1,256,1,1,0,2,16,8,0
2064-243-28-1x1-3-243-28-32-0x0-1x1-1x1-0-NCHW-FP32-F=ConvOclDirectFwd1x1:1,128,1,1,0,4,16,4,0
16-54-54-3x3-64-54-54-128-1x1-1x1-1x1-0-NCHW-FP16-W=ConvAsmBwdWrW3x3:0,1,8,2,2,8
128-7-7-1x1-608-7-7-64-0x0-1x1-1x1-0-NCHW-FP32-B=ConvAsm1x1U:1,8,1,64,2,4,1,8;ConvOclDirectFwd1x1:1,64,1,1,0,1,16,8,0
19-103-427-1x1-232-103-427-1-0x0-1x1-1x1-0-NCHW-FP32-B=ConvOclDirectFwd1x1:1,256,1,1,0,1,16,4,0
64-54-54-3x3-3-108-108-2-1x1-2x2-1x1-0-NCHW-FP32-B=ConvOclDirectFwd:8,8,32,32,4,4,1,4,1
80-666-355-1x1-24-666-355-16-0x0-1x1-1x1-0-NCHW-FP32-F=ConvOclDirectFwd1x1:1,256,1,1,0,2,16,4,0
768-7-7-1x1-128-7-7-16-0x0-1x1-1x1-0-NCHW-FP32-W=ConvAsmBwdWrW1x1:2,8,2,8,2,1,2,4,0,1
512-523-298-1x1-448-523-298-6-0x0-1x1-1x1-0-NCHW-FP32-B=ConvOclDirectFwd1x1:1,256,1,1,0,2,32,4,0
352-19-778-1x1-96-19-778-64-0x0-1x1-1x1-0-NCHW-FP32-F=ConvOclDirectFwd1x1:1,64,1,1,1,0,64,2048,0
1728-62-2-1x1-928-62-2-8-0x0-1x1-1x1-0-NCHW-FP32-F=ConvAsm1x1U:4,8,4,32,1,4,1,4;ConvOclDirectFwd1x1:1,64,1,1,1,0,16,2048,0
64-35-35-1x1-192-35-35-256-0x0-1x1-1x1-0-NCHW-FP32-B=ConvAsm1x1U:1,32,1,64,1,1,1,1;ConvOclDirectFwd1x1:1,256,1,1,0,1,32,4,0
256-29-29-3x3-256-57-57-1-1x1-2x2-1x1-0-NCHW-FP32-B_g32=ConvOclDirectFwd:32,32,32,32,1,1,4,2,1
128-56-56-1x1-160-56-56-128-0x0-1x1-1x1-0-NCHW-FP32-W=ConvAsmBwdWrW1x1:2,8,2,8,4,1,4,4,0,3
128-112-112-3x3-64-112-112-64-1x1-1x1-1x1-0-NCHW-FP16-F=ConvOclDirectFwd:16,8,16,32,1,4,8,1,1
576-10-292-1x1-288-10-292-256-0x0-1x1-1x1-0-NCHW-FP32-W=ConvAsmBwdWrW1x1:2,8,8,4,4,1,1,4,0,1
256-14-14-1x1-128-28-28-128-0x0-2x2-1x1-0-NCHW-FP16-B=ConvAsm1x1U:1,16,2,16,1,2,2,4;ConvOclDirectFwd1x1:1,128,1,1,0,1,32,4,0
1776-1007-11-1x1-1024-1007-11-1-0x0-1x1-1x1-0-NCHW-FP32-F=ConvOclDirectFwd1x1:1,64,1,1,1,0,32,2048,0
576-45-421-1x1-720-45-421-16-0x0-1x1-1x1-0-NCHW-FP32-B=ConvOclDirectFwd1x1:1,256,1,1,0,1,16,4,0
64-28-28-1x1-192-28-28-32-0x0-1x1-1x1-0-NCHW-FP16-W=ConvAsmBwdWrW1x1:4,4,4,1,8,1,2,4,0,1
116-28-28-1x1-116-28-28-1-0x0-1x1-1x1-0-NCHW-FP32-F=ConvAsm1x1U:1,8,1,32,1,4,1,1;ConvOclDirectFwd1x1:1,256,1,1,0,1,16,4,0
3-6-6-3x3-4-2-2-512-0x0-2x2-1x1-0-NCHW-FP32-F=ConvOclDirectFwd:8,8,8,8,1,1,4,1,2
64-73-73-1x1-160-73-73-32-0x0-1x1-1x1-0-NCHW-FP32-B=ConvAsm1x1U:1,32,1,64,1,1,1,1;ConvOclDirectFwd1x1:1,256,1,1,0,1,32,4,0
192-27-27-5x5-64-27-27-64-2x2-1x1-1x1-0-NCHW-FP32-W=ConvOclBwdWrW2<1>:1,11,3,3,7;ConvOclBwdWrW2<2>:1,10,1,3,7;ConvOclBwdWrW2<4>:1,11,3,3,7;ConvOclBwdWrW2<16>:1,10,3,3,5;ConvOclBwdWrW2<8>:1,10,1,3,7
256-14-14-1x1-512-28-28-32-0x0-2x2-1x1-0-NCHW-FP16-B=ConvAsm1x1U:1,16,2,16,1,2,2,4;ConvOclDirectFwd1x1:1,64,1,1,0,1,32,4,0
224-28-28-1x1-128-28-28-256-0x0-1x1-1x1-0-NCHW-FP16-B=ConvAsm1x1U:1,16,2,16,1,2,1,8;ConvOclDirectFwd1x1:1,128,1,1,0,4,16,4,0
576-4-4-1x1-128-4-4-32-0x0-1x1-1x1-0-NCHW-FP16-F=ConvAsm1x1U:2,4,4,4,1,4,4,1;ConvOclDirectFwd1x1:1,64,1,1,0,1,4,8,0
80-73-73-1x1-64-73-73-1-0x0-1x1-1x1-0-NCHW-FP32-W=ConvAsmBwdWrW1x1:4,4,2,2,2,1,1,4,0,2
256-56-56-1x1-64-56-56-32-0x0-1x1-1x1-0-NCHW-FP16-B=ConvAsm1x1U:1,16,2,64,1,2,2,2;ConvOclDirectFwd1x1:1,128,1,1,0,4,16,4,0
960-14-14-1x1-128-14-14-512-0x0-1x1-1x1-0-NCHW-FP32-B=ConvAsm1x1U:1,32,1,16,2,1,2,2;ConvOclDirectFwd1x1:1,256,1,1,0,1,32,4,0
192-27-27-5x5-64-27-27-16-2x2-1x1-1x1-0-NCHW-FP32-F=ConvOclDirectFwd:16,16,32,32,2,2,4,2,2
288-35-35-1x1-64-35-35-8-0x0-1x1-1x1-0-NCHW-FP16-F=ConvAsm1x1U:1,8,2,64,1,4,4,2;ConvOclDirectFwd1x1:1,128,1,1,0,1,8,8,0
128-7-7-1x1-512-7-7-512-0x0-1x1-1x1-0-NCHW-FP16-F=ConvAsm1x1U:2,8,4,16,1,4,1,4;ConvOclDirectFwd1x1:1,256,1,1,0,1,16,4,0
64-233-626-1x1-128-233-626-12-0x0-1x1-1x1-0-NCHW-FP32-B=ConvOclDirectFwd1x1:1,128,1,1,0,2,32,4,0
320-3-238-1x1-24-3-238-4-0x0-1x1-1x1-0-NCHW-FP32-F=ConvAsm1x1U:1,8,1,16,1,4,2,1;ConvOclDirectFwd1x1:1,64,1,1,0,1,16,8,0
64-112-112-1x1-64-112-112-16-0x0-1x1-1x1-0-NCHW-FP32-F=ConvAsm1x1U:1,8,1,64,1,4,1,8;ConvOclDirectFwd1x1:1,64,1,1,1,4,32,128,0;ConvActivAsm1x1U:1,32,3,64,1,1
96-35-35-3x3-96-35-35-16-1x1-1x1-1x1-0-NCHW-FP32-W=ConvAsmBwdWrW3x3:0,1,8,4,3,4
4-182-845-1x1-24-182-845-1-0x0-1x1-1x1-0-NCHW-FP32-B=ConvAsm1x1U:3,8,3,64,1,1,1,2;ConvOclDirectFwd1x1:1,256,1,1,0,1,8,4,0
1024-4-4-1x1-2048-7-7-256-0x0-2x2-1x1-0-NCHW-FP16-W=ConvAsmBwdWrW1x1:1,16,4,8,2,2,1,2,0,1
896-172-626-1x1-1-172-626-4-0x0-1x1-1x1-0-NCHW-FP32-F=ConvOclDirectFwd1x1:1,256,1,1,0,4,16,8,0
224-716-686-1x1-4-716-686-4-0x0-1x1-1x1-0-NCHW-FP32-B=ConvOclDirectFwd1x1:1,256,1,1,0,4,16,8,0
64-56-56-1x1-64-56-56-32-0x0-1x1-1x1-0-NCHW-FP16-F=ConvAsm1x1U:1,8,2,32,1,4,1,2;ConvOclDirectFwd1x1:1,64,1,1,0,4,16,4,0
704-704-12-1x1-144-704-12-32-0x0-1x1-1x1-0-NCHW-FP32-F=ConvOclDirectFwd1x1:1,64,1,1,1,0,32,2048,0
1280-8-8-1x1-320-8-8-4-0x0-1x1-1x1-0-NCHW-FP32-F=ConvAsm1x1U:2,8,2,32,1,4,4,1;ConvOclDirectFwd1x1:8,8,8,8,1,0,32,128,1;ConvActivAsm1x1U:1,16,2,16,1,4
2-1022-327-1x1-116-1022-327-4-0x0-1x1-1x1-0-NCHW-FP32-F=ConvOclDirectFwd1x1:1,128,1,1,0,2,16,4,0
256-29-29-1x1-512-29-29-16-0x0-1x1-1x1-0-NCHW-FP32-B=ConvAsm1x1U:3,16,3,64,1,2,2,2;ConvOclDirectFwd1x1:1,128,1,1,0,1,32,4,0
32-14-14-5x5-64-14-14-1-2x2-1x1-1x1-0-NCHW-FP16-F=ConvOclDirectFwd:16,16,16,16,1,1,1,4,1;ConvOclDirectFwdFused:16,16,16,16,1,1,1,4,1
160-28-28-1x1-128-28-28-32-0x0-1x1-1x1-0-NCHW-FP32-F=ConvAsm1x1U:1,16,1,32,3,2,1,1;ConvOclDirectFwd1x1:1,64,1,1,1,0,16,2048,0
1024-7-7-1x1-464-7-7-2-0x0-1x1-1x1-0-NCHW-FP16-B=ConvAsm1x1U:1,8,2,16,1,2,4,1;ConvOclDirectFwd1x1:1,128,1,1,0,1,8,8,0
128-14-14-3x3-32-14-14-16-1x1-1x1-1x1-0-NCHW-FP16-F=ConvOclDirectFwd:16,16,16,16,1,1,2,4,2
32-7-7-1x1-832-7-7-8-0x0-1x1-1x1-0-NCHW-FP32-B=ConvAsm1x1U:1,16,1,64,1,2,1,1;ConvOclDirectFwd1x1:1,256,1,1,0,1,4,8,0
1024-8-8-1x1-2048-8-8-64-0x0-1x1-1x1-0-NCHW-FP32-W=ConvAsmBwdWrW1x1:1,16,4,8,4,1,1,4,0,1
192-28-28-1x1-16-28-28-1-0x0-1x1-1x1-0-NCHW-FP32-F=ConvAsm1x1U:1,8,1,16,1,4,4,1;ConvOclDirectFwd1x1:1,64,1,1,1,4,64,64,0;ConvActivAsm1x1U:1,16,1,16,1,3
1024-14-14-1x1-512-14-14-32-0x0-1x1-1x1-0-NCHW-FP32-F=ConvAsm1x1U:3,16,4,64,1,2,1,8;ConvOclDirectFwd1x1:1,64,1,1,1,1,32,2048,0
480-64-128-1x1-64-64-128-1-0x0-1x1-1x1-0-NCHW-FP32-F=ConvAsm1x1U:2,16,4,64,1,2,2,2;ConvOclDirectFwd1x1:1,64,1,1,1,1,16,256,0;ConvActivAsm1x1U:3,16,4,64,1,4
128-14-14-1x1-480-14-14-512-0x0-1x1-1x1-0-NCHW-FP32-F=ConvAsm1x1U:2,16,2,16,3,2,1,4;ConvOclDirectFwd1x1:1,64,1,1,1,0,64,128,0
232-44-785-1x1-1696-44-785-6-0x0-1x1-1x1-0-NCHW-FP32-B=ConvOclDirectFwd1x1:1,256,1,1,0,2,32,4,0
128-28-28-1x1-224-28-28-128-0x0-1x1-1x1-0-NCHW-FP32-F=ConvAsm1x1U:1,16,1,64,4,2,2,2;ConvOclDirectFwd1x1:1,64,1,1,1,0,16,2048,0
960-666-5-1x1-1088-666-5-48-0x0-1x1-1x1-0-NCHW-FP32-W=ConvAsmBwdWrW1x1:1,16,2,8,8,1,1,4,0,0
384-13-13-3x3-192-13-13-32-1x1-1x1-1x1-0-NCHW-FP32-W=ConvAsmBwdWrW3x3:0,1,16,4,10,1
512-14-14-3x3-512-14-14-64-1x1-1x1-1x1-0-NCHW-FP16-F=ConvOclDirectFwd:8,8,16,16,2,2,8,1,2;ConvOclDirectFwdFused:8,8,16,16,2,2,8,1,2
192-7-7-1x1-1024-7-7-64-0x0-1x1-1x1-0-NCHW-FP16-W=ConvAsmBwdWrW1x1:1,16,2,8,2,1,2,4,0,1
1056-7-7-1x1-160-7-7-64-0x0-1x1-1x1-0-NCHW-FP32-F=ConvAsm1x1U:2,16,2,32,3,2,4,1;ConvOclDirectFwd1x1:1,64,1,1,1,1,64,256,0;ConvActivAsm1x1U:4,16,4,16,3,4
128-7-7-1x1-512-7-7-64-0x0-1x1-1x1-0-NCHW-FP32-F=ConvAsm1x1U:2,8,2,32,2,2,1,8;ConvOclDirectFwd1x1:1,64,1,1,1,1,32,256,0
832-389-298-1x1-768-389-298-2-0x0-1x1-1x1-0-NCHW-FP32-F=ConvOclDirectFwd1x1:1,64,1,1,1,4,16,2048,0
128-7-7-1x1-864-7-7-256-0x0-1x1-1x1-0-NCHW-FP16-B=ConvAsm1x1U:1,16,2,32,1,2,1,1;ConvOclDirectFwd1x1:8,64,8,8,0,1,16,4,1
116-14-14-1x1-116-14-14-8-0x0-1x1-1x1-0-NCHW-FP16-B=ConvAsm1x1U:2,4,4,4,1,2,2,1;ConvOclDirectFwd1x1:1,64,1,1,0,2,8,4,0
224-28-28-1x1-128-28-28-512-0x0-1x1-1x1-0-NCHW-FP16-W=ConvAsmBwdWrW1x1:2,8,2,8,2,1,4,4,0,1
192-28-28-1x1-64-28-28-512-0x0-1x1-1x1-0-NCHW-FP16-F=ConvAsm1x1U:1,8,2,32,2,4,1,4;ConvOclDirectFwd1x1:1,256,1,1,0,4,16,4,0
48-35-35-1x1-256-35-35-8-0x0-1x1-1x1-0-NCHW-FP32-W=ConvAsmBwdWrW1x1:4,4,2,4,2,1,1,4,0,2
32-14-14-1x1-528-14-14-1-0x0-1x1-1x1-0-NCHW-FP32-B=ConvOclDirectFwd1x1:1,64,1,1,0,4,4,8,0
32-28-28-1x1-192-28-28-32-0x0-1x1-1x1-0-NCHW-FP32-B=ConvAsm1x1U:1,16,1,32,1,2,2,1;ConvOclDirectFwd1x1:1,128,1,1,0,2,16,4,0
896-764-93-1x1-1120-764-93-6-0x0-1x1-1x1-0-NCHW-FP32-B=ConvOclDirectFwd1x1:1,128,1,1,0,2,32,4,0
256-14-14-3x3-128-14-14-8-1x1-1x1-1x1-0-NCHW-FP16-B=ConvOclDirectFwd:16,16,16,16,1,1,4,4,2
448-14-14-1x1-128-14-14-64-0x0-1x1-1x1-0-NCHW-FP16-W=ConvAsmBwdWrW1x1:2,8,4,4,2,1,2,4,0,1
960-14-14-1x1-128-14-14-512-0x0-1x1-1x1-0-NCHW-FP16-W=ConvAsmBwdWrW1x1:4,4,8,4,4,2,2,4,0,1
240-7-7-1x1-960-7-7-128-0x0-1x1-1x1-0-NCHW-FP32-B_g3=ConvOclDirectFwd:8,8,8,8,1,1,8,4,1
232-679-535-1x1-448-679-535-2-0x0-1x1-1x1-0-NCHW-FP32-B=ConvOclDirectFwd1x1:1,128,1,1,0,1,32,4,0
1024-14-14-1x1-512-14-14-4-0x0-1x1-1x1-0-NCHW-FP32-B=ConvAsm1x1U:2,16,2,64,1,2,4,2;ConvOclDirectFwd1x1:1,128,1,1,0,2,4,4,0
1024-8-8-3x3-1024-15-15-128-1x1-2x2-1x1-0-NCHW-FP32-B_g32=ConvOclDirectFwd:8,8,8,16,1,2,4,1,2
192-27-27-1x1-48-27-27-128-0x0-1x1-1x1-0-NCHW-FP16-B=ConvAsm1x1U:1,16,2,64,1,2,1,1;ConvOclDirectFwd1x1:16,64,32,32,0,1,16,4,1
160-7-7-1x1-832-7-7-16-0x0-1x1-1x1-0-NCHW-FP32-B=ConvAsm1x1U:1,16,1,64,1,2,2,1;ConvOclDirectFwd1x1:1,64,1,1,0,1,8,4,0
512-28-28-1x1-256-28-28-64-0x0-1x1-1x1-0-NCHW-FP16-F=ConvAsm1x1U:2,8,4,16,1,4,1,4;ConvOclDirectFwd1x1:1,64,1,1,0,4,16,4,0
192-28-28-1x1-128-28-28-128-0x0-1x1-1x1-0-NCHW-FP32-B=ConvAsm1x1U:1,16,1,32,1,2,2,2;ConvOclDirectFwd1x1:1,64,1,1,0,1,32,4,0
64-27-27-1x1-384-27-27-512-0x0-1x1-1x1-0-NCHW-FP32-F=ConvAsm1x1U:1,16,1,64,4,2,1,8;ConvOclDirectFwd1x1:16,16,32,32,1,0,32,128,1
128-28-28-1x1-416-28-28-64-0x0-1x1-1x1-0-NCHW-FP16-W=ConvAsmBwdWrW1x1:4,4,8,1,8,2,1,4,0,1
96-17-17-3x3-96-35-35-32-0x0-2x2-1x1-0-NCHW-FP16-B=ConvOclDirectFwd:8,8,16,16,2,2,4,1,2
232-14-14-1x1-232-14-14-64-0x0-1x1-1x1-0-NCHW-FP32-W=ConvAsmBwdWrW1x1:4,4,8,4,4,1,2,4,0,1
384-13-13-3x3-256-13-13-32-1x1-1x1-1x1-0-NCHW-FP16-W=ConvAsmBwdWrW3x3:0,1,8,4,3,1
64-224-224-3x3-64-224-224-64-1x1-1x1-1x1-0-NCHW-FP32-W=ConvAsmBwdWrW3x3:0,0,16,4,2,2
512-28-28-1x1-256-28-28-64-0x0-1x1-1x1-0-NCHW-FP32-F=ConvAsm1x1U:2,16,5,16,2,2,1,2;ConvOclDirectFwd1x1:1,64,1,1,1,0,32,2048,0;ConvActivAsm1x1U:4,16,5,32,2,1
832-7-7-1x1-128-7-7-128-0x0-1x1-1x1-0-NCHW-FP16-W=ConvAsmBwdWrW1x1:2,8,4,8,2,2,2,4,0,1
3-224-224-3x3-64-224-224-32-1x1-1x1-1x1-0-NCHW-FP32-F=ConvOclDirectFwd:8,32,32,32,4,1,4,1,2;ConvOclDirectFwdFused:8,32,32,32,4,1,4,1,2
224-150-88-1x1-432-150-88-4-0x0-1x1-1x1-0-NCHW-FP32-B=ConvOclDirectFwd1x1:1,256,1,1,0,4,16,8,0
256-28-28-1x1-128-28-28-256-0x0-1x1-1x1-0-NCHW-FP32-F=ConvActivAsm1x1U:3,32,3,32,2,1
240-7-7-3x3-240-7-7-256-1x1-1x1-1x1-0-NCHW-FP16-B=ConvOclDirectFwd:8,8,8,8,1,1,8,2,1
256-304-93-1x1-320-304-93-32-0x0-1x1-1x1-0-NCHW-FP32-W=ConvAsmBwdWrW1x1:4,4,8,4,4,1,1,4,0,1
512-32-32-1x1-1024-64-64-4-0x0-2x2-1x1-0-NCHW-FP32-B=ConvOclDirectFwd1x1:1,256,1,1,0,2,16,4,0
240-103-304-1x1-896-103-304-8-0x0-1x1-1x1-0-NCHW-FP32-F=ConvOclDirectFwd1x1:1,64,1,1,1,4,16,2048,0
64-13-13-3x3-256-13-13-32-1x1-1x1-1x1-0-NCHW-FP16-B=ConvOclDirectFwd:8,8,16,16,2,2,8,2,2
128-56-56-1x1-256-56-56-32-0x0-1x1-1x1-0-NCHW-FP16-B=ConvAsm1x1U:1,16,2,32,1,2,1,4;ConvOclDirectFwd1x1:1,64,1,1,0,4,16,4,0
256-55-55-1x1-512-28-28-32-0x0-2x2-1x1-0-NCHW-FP16-F=ConvAsm1x1U:1,8,2,32,2,4,1,8;ConvOclDirectFwd1x1:1,256,1,1,0,1,16,4,0
256-7-7-1x1-832-7-7-32-0x0-1x1-1x1-0-NCHW-FP32-W=ConvAsmBwdWrW1x1:1,16,2,4,8,1,1,4,0,2
352-28-28-1x1-128-28-28-128-0x0-1x1-1x1-0-NCHW-FP32-B=ConvAsm1x1U:1,32,1,64,2,1,1,2;ConvOclDirectFwd1x1:1,128,1,1,0,1,32,4,0
128-14-14-1x1-928-14-14-512-0x0-1x1-1x1-0-NCHW-FP32-F=ConvAsm1x1U:1,16,1,32,4,2,2,2;ConvOclDirectFwd1x1:1,64,1,1,1,4,32,256,0
160-14-14-1x1-512-14-14-32-0x0-1x1-1x1-0-NCHW-FP16-B=ConvAsm1x1U:1,16,2,16,1,2,2,2;ConvOclDirectFwd1x1:1,64,1,1,0,4,8,4,0
352-28-28-1x1-128-28-28-32-0x0-1x1-1x1-0-NCHW-FP32-B=ConvAsm1x1U:3,16,3,32,1,2,2,2;ConvOclDirectFwd1x1:1,128,1,1,0,4,16,4,0
128-14-14-1x1-960-14-14-128-0x0-1x1-1x1-0-NCHW-FP16-W=ConvAsmBwdWrW1x1:2,8,4,8,2,1,2,4,0,1
4-809-394-1x1-1312-809-394-1-0x0-1x1-1x1-0-NCHW-FP32-B=ConvOclDirectFwd1x1:1,256,1,1,0,2,32,4,0
1024-15-15-1x1-1024-15-15-4-0x0-1x1-1x1-0-NCHW-FP32-W=ConvAsmBwdWrW1x1:1,16,4,8,4,1,1,4,0,1
64-56-56-3x3-64-56-56-2-1x1-1x1-1x1-0-NCHW-FP32-W=ConvAsmBwdWrW3x3:0,0,16,2,2,2
128-14-14-1x1-768-14-14-16-0x0-1x1-1x1-0-NCHW-FP16-F=ConvAsm1x1U:2,8,4,64,1,4,1,1;ConvOclDirectFwd1x1:1,64,1,1,0,4,8,4,0
32-38-166-5x10-32-79-341-128-0x0-2x2-1x1-0-NCHW-FP32-B=ConvOclDirectFwd:16,16,16,32,1,2,8,4,1
512-14-14-3x3-512-28-28-64-1x1-2x2-1x1-0-NCHW-FP32-B_g32=ConvOclDirectFwd:16,16,32,32,2,2,4,4,2
58-32-558-1x1-24-32-558-48-0x0-1x1-1x1-0-NCHW-FP32-F=ConvAsm1x1U:1,16,3,16,1,1,1,1;ConvOclDirectFwd1x1:1,64,1,1,0,1,16,4,0
512-8-8-3x3-512-15-15-128-1x1-2x2-1x1-0-NCHW-FP32-W=ConvAsmBwdWrW3x3:0,0,8,8,2,1
256-14-14-1x1-256-14-14-8-0x0-1x1-1x1-0-NCHW-FP32-B=ConvAsm1x1U:1,16,1,16,1,2,2,2;ConvOclDirectFwd1x1:1,256,1,1,0,4,8,8,0
32-56-56-3x3-128-56-56-128-1x1-1x1-1x1-0-NCHW-FP16-W=ConvAsmBwdWrW3x3:0,1,8,4,1,4
128-7-7-3x3-256-14-14-12-1x1-2x2-1x1-0-NCHW-FP32-B=ConvOclDirectFwd:8,8,16,16,2,2,2,2,2
64-56-56-1x1-64-56-56-64-0x0-1x1-1x1-0-NCHW-FP32-F=ConvAsm1x1U:2,16,2,64,1,2,1,1;ConvOclDirectFwd1x1:1,64,1,1,1,4,16,256,0
224-35-35-3x3-192-35-35-128-1x1-1x1-1x1-0-NCHW-FP16-W=ConvAsmBwdWrW3x3:0,1,8,4,1,4
32-7-7-1x1-832-7-7-512-0x0-1x1-1x1-0-NCHW-FP32-B=ConvAsm1x1U:1,16,1,64,2,2,1,4;ConvOclDirectFwd1x1:1,256,1,1,0,1,32,4,0
128-28-28-1x1-320-28-28-512-0x0-1x1-1x1-0-NCHW-FP16-B=ConvAsm1x1U:1,16,2,16,1,2,1,4;ConvOclDirectFwd1x1:1,256,1,1,0,4,16,4,0
352-7-7-1x1-1024-7-7-64-0x0-1x1-1x1-0-NCHW-FP16-W=ConvAsmBwdWrW1x1:2,8,4,8,2,2,1,2,0,2
3-32-32-1x1-3-32-32-512-0x0-1x1-1x1-0-NCHW-FP32-W=ConvAsmBwdWrW1x1:4,4,2,1,2,1,4,4,0,3
288-14-14-3x3-144-14-14-16-1x1-1x1-1x1-0-NCHW-FP16-W=ConvAsmBwdWrW3x3:0,1,8,2,3,4
528-14-14-1x1-192-14-14-16-0x0-1x1-1x1-0-NCHW-FP16-F=ConvAsm1x1U:1,8,2,64,1,4,2,4;ConvOclDirectFwd1x1:1,64,1,1,0,2,8,4,0
192-28-28-1x1-64-28-28-4-0x0-1x1-1x1-0-NCHW-FP16-F=ConvAsm1x1U:1,8,2,16,1,4,4,2;ConvOclDirectFwd1x1:1,128,1,1,0,2,4,4,0
32-356-322-1x1-192-356-322-4-0x0-1x1-1x1-0-NCHW-FP32-F=ConvOclDirectFwd1x1:1,64,1,1,1,1,16,2048,0
1024-7-7-1x1-2048-7-7-48-0x0-1x1-1x1-0-NCHW-FP32-F=ConvAsm1x1U:2,16,2,32,3,2,4,1;ConvOclDirectFwd1x1:1,64,1,1,1,1,64,2048,0
128-56-56-1x1-256-56-56-64-0x0-1x1-1x1-0-NCHW-FP32-F=ConvAsm1x1U:2,16,2,64,2,2,1,4;ConvOclDirectFwd1x1:1,64,1,1,1,4,32,2048,0
480-41-277-1x1-480-41-277-6-0x0-1x1-1x1-0-NCHW-FP32-W=ConvAsmBwdWrW1x1:1,16,4,4,4,1,1,4,0,1
96-35-35-3x3-96-35-35-32-1x1-1x1-1x1-0-NCHW-FP16-F=ConvOclDirectFwd:8,16,16,16,2,1,8,4,2;ConvOclDirectFwdFused:8,16,16,16,2,1,8,4,2
3-32-32-1x1-3-32-32-256-0x0-1x1-1x1-0-NCHW-FP32-F=ConvAsm1x1U:2,1,4,4,1,1,1,1;ConvOclDirectFwd1x1:1,256,1,1,0,4,4,4,0
24-55-55-1x1-54-55-55-32-0x0-1x1-1x1-0-NCHW-FP32-F=ConvAsm1x1U:1,8,1,64,4,2,1,2;ConvOclDirectFwd1x1:1,256,1,1,0,1,16,8,0
3-108-108-3x3-64-54-54-4-1x1-2x2-1x1-0-NCHW-FP32-F=ConvOclDirectFwd:16,16,16,16,1,1,8,1,2
1152-134-249-1x1-1-134-249-6-0x0-1x1-1x1-0-NCHW-FP32-F=ConvOclDirectFwd1x1:1,256,1,1,0,2,16,8,0
256-14-14-1x1-512-28-28-8-0x0-2x2-1x1-0-NCHW-FP16-B=ConvAsm1x1U:1,16,2,64,1,2,2,4;ConvOclDirectFwd1x1:1,256,1,1,0,1,8,8,0
256-28-28-3x3-256-28-28-16-1x1-1x1-1x1-0-NCHW-FP32-W_g32=ConvOclBwdWrW2<4>:1,7,8,1,7;ConvOclBwdWrW2<16>:1,7,1,1,7;ConvOclBwdWrW2<8>:1,6,3,1,7;ConvOclBwdWrW2<1>:1,6,3,1,7;ConvOclBwdWrW2<2>:1,6,3,1,7;ConvAsmBwdWrW3x3:0,0,8,1,10,1
384-159-3-1x1-1584-159-3-128-0x0-1x1-1x1-0-NCHW-FP32-B=ConvAsm1x1U:2,16,2,64,1,1,1,1;ConvOclDirectFwd1x1:1,128,1,1,0,1,16,4,0
144-14-367-1x1-1408-14-367-4-0x0-1x1-1x1-0-NCHW-FP32-B=ConvOclDirectFwd1x1:1,256,1,1,0,2,32,4,0
128-54-54-1x1-32-54-54-32-0x0-1x1-1x1-0-NCHW-FP16-F=ConvAsm1x1U:1,8,2,64,1,4,2,2;ConvOclDirectFwd1x1:1,256,1,1,0,2,16,8,0
960-333-64-1x1-1664-333-64-4-0x0-1x1-1x1-0-NCHW-FP32-B=ConvOclDirectFwd1x1:1,64,1,1,0,2,32,4,0
1856-222-383-1x1-64-222-383-2-0x0-1x1-1x1-0-NCHW-FP32-F=ConvOclDirectFwd1x1:16,16,32,32,1,0,32,128,1
112-100-345-1x1-32-100-345-2-0x0-1x1-1x1-0-NCHW-FP32-W=ConvAsmBwdWrW1x1:4,4,2,2,4,1,2,4,0,3
672-216-207-1x1-48-216-207-12-0x0-1x1-1x1-0-NCHW-FP32-F=ConvOclDirectFwd1x1:1,64,1,1,1,0,32,2048,0
128-14-14-1x1-288-14-14-32-0x0-1x1-1x1-0-NCHW-FP32-F=ConvAsm1x1U:2,16,2,16,1,2,1,2;ConvOclDirectFwd1x1:1,64,1,1,1,1,64,256,0
992-145-74-1x1-288-145-74-16-0x0-1x1-1x1-0-NCHW-FP32-F=ConvOclDirectFwd1x1:1,64,1,1,1,4,64,2048,0
1056-7-7-1x1-128-7-7-32-0x0-1x1-1x1-0-NCHW-FP16-F=ConvAsm1x1U:1,8,2,32,1,4,4,4;ConvOclDirectFwd1x1:1,64,1,1,0,1,8,8,0
192-56-56-1x1-128-56-56-256-0x0-1x1-1x1-0-NCHW-FP32-W=ConvAsmBwdWrW1x1:2,8,4,4,4,1,4,4,0,3
160-563-268-1x1-928-563-268-2-0x0-1x1-1x1-0-NCHW-FP32-B=ConvOclDirectFwd1x1:1,256,1,1,0,1,32,4,0
768-921-447-1x1-1104-921-447-1-0x0-1x1-1x1-0-NCHW-FP32-F=ConvOclDirectFwd1x1:1,64,1,1,1,0,32,2048,0
116-28-28-1x1-116-28-28-4-0x0-1x1-1x1-0-NCHW-FP32-F=ConvAsm1x1U:1,8,1,16,1,4,1,1;ConvOclDirectFwd1x1:1,64,1,1,0,2,16,4,0
1584-24-834-1x1-224-24-834-6-0x0-1x1-1x1-0-NCHW-FP32-F=ConvOclDirectFwd1x1:1,64,1,1,1,4,64,2048,0
1760-321-541-1x1-54-321-541-1-0x0-1x1-1x1-0-NCHW-FP32-F=ConvOclDirectFwd1x1:1,256,1,1,0,1,8,4,0
256-15-15-3x3-256-29-29-8-1x1-2x2-1x1-0-NCHW-FP32-W=ConvAsmBwdWrW3x3:0,0,8,8,3,1
288-35-35-1x1-64-35-35-64-0x0-1x1-1x1-0-NCHW-FP16-F=ConvAsm1x1U:2,8,4,64,1,4,1,4;ConvOclDirectFwd1x1:1,256,1,1,0,1,16,8,0
32-147-147-3x3-32-149-149-128-0x0-1x1-1x1-0-NCHW-FP16-B=ConvOclDirectFwd:16,16,32,32,2,2,8,4,2
116-28-28-1x1-116-28-28-4-0x0-1x1-1x1-0-NCHW-FP32-B=ConvAsm1x1U:4,4,4,4,1,2,2,1;ConvOclDirectFwd1x1:1,64,1,1,0,2,16,4,0
96-35-35-3x3-96-35-35-64-1x1-1x1-1x1-0-NCHW-FP16-W=ConvAsmBwdWrW3x3:0,1,8,2,2,8
640-713-164-1x1-1152-713-164-2-0x0-1x1-1x1-0-NCHW-FP32-B=ConvOclDirectFwd1x1:1,256,1,1,0,2,32,4,0
1280-8-8-1x1-320-8-8-256-0x0-1x1-1x1-0-NCHW-FP32-F=ConvAsm1x1U:2,16,2,32,3,2,4,1;ConvOclDirectFwd1x1:1,64,1,1,1,0,32,2048,0;ConvActivAsm1x1U:2,16,4,16,3,4
64-14-14-5x5-32-14-14-256-2x2-1x1-1x1-0-NCHW-FP32-B=ConvOclDirectFwd:8,8,16,16,2,2,4,2,2
256-56-56-1x1-512-28-28-32-0x0-2x2-1x1-0-NCHW-FP32-F=ConvAsm1x1U:3,16,3,32,2,2,1,4;ConvOclDirectFwd1x1:1,64,1,1,1,0,32,2048,0
6-128-128-1x1-512-128-128-4-0x0-1x1-1x1-0-NCHW-FP32-W=ConvAsmBwdWrW1x1:4,4,4,1,4,1,1,2,0,3
512-15-15-3x3-512-29-29-2-1x1-2x2-1x1-0-NCHW-FP32-W_g32=ConvOclBwdWrW2<1>:1,7,3,1,5;ConvOclBwdWrW2<2>:1,7,3,1,5;ConvAsmBwdWrW3x3:0,0,16,4,6,1
120-7-7-3x3-120-14-14-128-1x1-2x2-1x1-0-NCHW-FP16-B=ConvOclDirectFwd:8,8,16,16,2,2,4,1,2
64-112-112-3x3-128-112-112-256-1x1-1x1-1x1-0-NCHW-FP16-W=ConvAsmBwdWrW3x3:0,0,16,4,1,1
384-13-13-3x3-384-13-13-1024-1x1-1x1-1x1-0-NCHW-FP32-W=ConvAsmBwdWrW3x3:0,0,8,8,7,1
2-106-389-1x1-960-106-389-4-0x0-1x1-1x1-0-NCHW-FP32-F=ConvOclDirectFwd1x1:1,256,1,1,0,2,16,4,0
192-35-35-1x1-32-35-35-128-0x0-1x1-1x1-0-NCHW-FP16-F=ConvAsm1x1U:1,8,2,32,1,4,1,4;ConvOclDirectFwd1x1:1,64,1,1,0,1,16,8,0
1088-207-547-1x1-416-207-547-1-0x0-1x1-1x1-0-NCHW-FP32-F=ConvOclDirectFwd1x1:1,64,1,1,1,4,64,2048,0
128-14-14-1x1-448-14-14-128-0x0-1x1-1x1-0-NCHW-FP16-W=ConvAsmBwdWrW1x1:4,4,4,4,4,1,2,2,0,1
64-56-56-1x1-256-56-56-16-0x0-1x1-1x1-0-NCHW-FP32-B=ConvAsm1x1U:1,32,1,64,1,1,1,1;ConvOclDirectFwd1x1:1,64,1,1,0,1,32,4,0
544-7-7-1x1-128-7-7-64-0x0-1x1-1x1-0-NCHW-FP16-W=ConvAsmBwdWrW1x1:2,8,2,8,2,2,2,4,0,1
256-14-14-1x1-256-14-14-32-0x0-1x1-1x1-0-NCHW-FP32-W=ConvAsmBwdWrW1x1:1,16,2,8,4,1,4,4,0,1
2048-8-8-1x1-320-8-8-128-0x0-1x1-1x1-0-NCHW-FP32-F=ConvAsm1x1U:3,16,4,16,3,2,1,2;ConvOclDirectFwd1x1:1,64,1,1,1,4,32,2048,0;ConvActivAsm1x1U:3,16,4,16,3,2
384-8-8-1x1-1536-8-8-8-0x0-1x1-1x1-0-NCHW-FP32-B=ConvAsm1x1U:1,16,1,32,2,2,2,2;ConvOclDirectFwd1x1:1,256,1,1,0,4,8,8,0
192-14-14-1x1-512-14-14-2-0x0-1x1-1x1-0-NCHW-FP32-B=ConvAsm1x1U:1,8,1,32,1,4,2,8;ConvOclDirectFwd1x1:1,64,1,1,0,4,4,4,0
512-28-28-3x3-512-28-28-32-1x1-1x1-1x1-0-NCHW-FP16-B=ConvOclDirectFwd:32,8,32,32,1,4,8,4,1
128-28-28-1x1-448-28-28-256-0x0-1x1-1x1-0-NCHW-FP32-B=ConvAsm1x1U:1,16,1,32,2,1,1,2;ConvOclDirectFwd1x1:1,256,1,1,0,1,32,4,0
128-7-7-1x1-544-7-7-256-0x0-1x1-1x1-0-NCHW-FP16-F=ConvAsm1x1U:2,8,4,16,1,4,1,4;ConvOclDirectFwd1x1:1,64,1,1,0,1,16,4,0
160-64-128-1x1-832-64-128-1-0x0-1x1-1x1-0-NCHW-FP32-B=ConvOclDirectFwd1x1:1,64,1,1,0,2,16,4,0
160-28-28-1x1-128-28-28-64-0x0-1x1-1x1-0-NCHW-FP32-B=ConvAsm1x1U:2,16,2,32,1,2,2,2;ConvOclDirectFwd1x1:1,256,1,1,0,4,16,4,0
448-8-8-1x1-2048-8-8-4-0x0-1x1-1x1-0-NCHW-FP32-W=ConvAsmBwdWrW1x1:1,16,2,4,8,1,2,4,0,0
768-963-132-1x1-160-963-132-1-0x0-1x1-1x1-0-NCHW-FP32-B=ConvOclDirectFwd1x1:1,256,1,1,0,2,32,4,0
2048-8-8-1x1-1024-8-8-64-0x0-1x1-1x1-0-NCHW-FP32-F=ConvAsm1x1U:2,16,2,32,3,2,1,1;ConvOclDirectFwd1x1:1,64,1,1,1,4,64,2048,0
64-56-56-1x1-128-56-56-32-0x0-1x1-1x1-0-NCHW-FP32-F=ConvAsm1x1U:1,16,1,64,2,2,2,1;ConvOclDirectFwd1x1:1,64,1,1,1,0,32,128,0
624-659-240-1x1-24-659-240-4-0x0-1x1-1x1-0-NCHW-FP32-F=ConvOclDirectFwd1x1:1,64,1,1,0,2,16,8,0
992-131-402-1x1-32-131-402-8-0x0-1x1-1x1-0-NCHW-FP32-F=ConvOclDirectFwd1x1:1,64,1,1,1,1,64,2048,0
608-807-128-1x1-800-807-128-4-0x0-1x1-1x1-0-NCHW-FP32-F=ConvOclDirectFwd1x1:1,64,1,1,1,4,64,2048,0
224-80-166-1x1-256-80-166-8-0x0-1x1-1x1-0-NCHW-FP32-W=ConvAsmBwdWrW1x1:4,4,8,2,8,1,2,4,0,0
544-444-955-1x1-416-444-955-1-0x0-1x1-1x1-0-NCHW-FP32-B=ConvOclDirectFwd1x1:1,64,1,1,0,2,32,4,0
736-369-832-1x1-160-369-832-2-0x0-1x1-1x1-0-NCHW-FP32-F=ConvOclDirectFwd1x1:1,64,1,1,1,0,64,2048,0
256-28-28-1x1-512-28-28-128-0x0-1x1-1x1-0-NCHW-FP16-B=ConvAsm1x1U:1,16,2,16,1,2,1,1;ConvOclDirectFwd1x1:1,128,1,1,0,2,32,4,0
288-14-14-1x1-128-14-14-256-0x0-1x1-1x1-0-NCHW-FP16-F=ConvAsm1x1U:1,8,2,16,2,4,1,8;ConvOclDirectFwd1x1:1,256,1,1,0,2,32,4,0
192-28-28-3x3-128-28-28-8-1x1-1x1-1x1-0-NCHW-FP32-W=ConvAsmBwdWrW3x3:0,0,8,2,3,1
3-10-10-3x3-5-10-10-512-1x1-1x1-1x1-0-NCHW-FP32-B=ConvOclDirectFwd:8,16,16,16,2,1,2,1,2
1696-70-189-1x1-19-70-189-4-0x0-1x1-1x1-0-NCHW-FP32-F=ConvOclDirectFwd1x1:1,64,1,1,0,1,16,8,0
896-7-7-1x1-128-7-7-128-0x0-1x1-1x1-0-NCHW-FP32-B=ConvAsm1x1U:2,16,2,32,1,2,4,1;ConvOclDirectFwd1x1:1,128,1,1,0,1,8,4,0
128-14-14-1x1-384-14-14-32-0x0-1x1-1x1-0-NCHW-FP32-F=ConvAsm1x1U:2,16,2,64,2,2,2,2;ConvOclDirectFwd1x1:1,64,1,1,1,4,16,256,0
96-28-28-5x5-32-28-28-128-2x2-1x1-1x1-0-NCHW-FP16-B=ConvOclDirectFwd:16,16,32,32,2,2,8,4,2
256-256-256-1x1-128-128-128-4-0x0-2x2-1x1-0-NCHW-FP32-F=ConvOclDirectFwd1x1:1,64,1,1,1,4,32,2048,0
64-27-27-3x3-256-27-27-32-1x1-1x1-1x1-0-NCHW-FP32-W=ConvAsmBwdWrW3x3:0,1,8,4,4,1
256-7-7-1x1-832-7-7-4-0x0-1x1-1x1-0-NCHW-FP16-W=ConvAsmBwdWrW1x1:1,16,2,8,2,1,2,4,0,0
384-28-28-1x1-128-28-28-256-0x0-1x1-1x1-0-NCHW-FP16-F=ConvAsm1x1U:1,8,2,32,2,4,1,4;ConvOclDirectFwd1x1:1,64,1,1,0,4,16,4,0
800-718-208-1x1-160-718-208-4-0x0-1x1-1x1-0-NCHW-FP32-B=ConvOclDirectFwd1x1:1,128,1,1,0,1,32,4,0
1280-8-8-1x1-192-8-8-64-0x0-1x1-1x1-0-NCHW-FP32-F=ConvAsm1x1U:4,8,4,16,1,4,1,4;ConvOclDirectFwd1x1:1,64,1,1,1,1,16,256,0;ConvActivAsm1x1U:2,16,2,32,2,2
192-7-7-1x1-1056-7-7-64-0x0-1x1-1x1-0-NCHW-FP32-B=ConvAsm1x1U:1,16,1,64,2,2,2,2;ConvOclDirectFwd1x1:1,128,1,1,0,1,16,4,0
192-56-56-3x3-64-56-56-64-1x1-1x1-1x1-0-NCHW-FP16-B=ConvOclDirectFwd:16,16,32,32,2,2,8,1,2
128-14-14-1x1-992-14-14-512-0x0-1x1-1x1-0-NCHW-FP32-F=ConvAsm1x1U:1,16,1,32,4,2,2,2;ConvOclDirectFwd1x1:1,64,1,1,1,4,32,256,0
128-14-14-3x3-256-14-14-512-1x1-1x1-1x1-0-NCHW-FP16-F=ConvOclDirectFwd:8,8,16,16,2,2,8,1,1;ConvOclDirectFwdFused:8,8,16,16,2,2,8,1,1
256-28-28-1x1-32-28-28-256-0x0-1x1-1x1-0-NCHW-FP16-B=ConvAsm1x1U:1,16,2,16,1,2,2,2;ConvOclDirectFwd1x1:1,64,1,1,0,4,16,4,0
416-703-106-1x1-224-703-106-16-0x0-1x1-1x1-0-NCHW-FP32-B=ConvOclDirectFwd1x1:1,256,1,1,0,1,32,4,0
128-17-17-7x1-128-17-17-512-3x0-1x1-1x1-0-NCHW-FP16-W=ConvOclBwdWrW2<1>:1,6,8,3,7;ConvOclBwdWrW2<2>:1,9,8,3,9;ConvOclBwdWrW2<4>:1,9,8,3,9;ConvOclBwdWrW2<16>:1,6,8,3,7;ConvOclBwdWrW2<8>:1,6,8,3,7
1024-14-14-1x1-512-14-14-64-0x0-1x1-1x1-0-NCHW-FP32-B=ConvAsm1x1U:1,32,1,32,2,1,1,1;ConvOclDirectFwd1x1:1,256,1,1,0,1,32,4,0
576-14-14-1x1-128-14-14-32-0x0-1x1-1x1-0-NCHW-FP32-W=ConvAsmBwdWrW1x1:2,8,2,8,2,1,2,4,0,0
64-56-56-1x1-256-56-56-256-0x0-1x1-1x1-0-NCHW-FP16-W=ConvAsmBwdWrW1x1:4,4,8,1,8,2,4,4,0,1
128-54-54-3x3-32-54-54-256-1x1-1x1-1x1-0-NCHW-FP16-W=ConvAsmBwdWrW3x3:0,0,8,4,1,4
224-56-56-1x1-128-56-56-64-0x0-1x1-1x1-0-NCHW-FP32-B=ConvAsm1x1U:1,32,2,64,1,1,1,2;ConvOclDirectFwd1x1:1,256,1,1,0,1,32,4,0
512-14-14-1x1-1024-14-14-512-0x0-1x1-1x1-0-NCHW-FP16-B=ConvAsm1x1U:1,16,2,16,1,2,2,2;ConvOclDirectFwd1x1:1,64,1,1,0,2,32,4,0
800-214-22-1x1-1536-214-22-64-0x0-1x1-1x1-0-NCHW-FP32-W=ConvAsmBwdWrW1x1:1,16,2,8,8,1,2,4,0,1
256-29-29-3x3-256-29-29-8-1x1-1x1-1x1-0-NCHW-FP32-F_g32=ConvOclDirectFwd:16,16,16,32,1,2,8,4,1
2048-14-14-1x1-512-14-14-64-0x0-1x1-1x1-0-NCHW-FP32-F=ConvAsm1x1U:3,32,7,32,1,1,1,2;ConvOclDirectFwd1x1:1,64,1,1,1,0,32,2048,0
256-7-7-3x3-256-14-14-16-1x1-2x2-1x1-0-NCHW-FP16-W=ConvAsmBwdWrW3x3:0,0,8,4,3,1
528-14-14-1x1-128-14-14-256-0x0-1x1-1x1-0-NCHW-FP32-B=ConvAsm1x1U:1,32,1,32,2,1,1,4;ConvOclDirectFwd1x1:1,256,1,1,0,1,32,4,0
256-14-14-1x1-128-14-14-128-0x0-1x1-1x1-0-NCHW-FP16-B=ConvAsm1x1U:1,16,2,16,1,2,2,2;ConvOclDirectFwd1x1:1,256,1,1,0,4,8,4,0
320-792-182-1x1-54-792-182-8-0x0-1x1-1x1-0-NCHW-FP32-F=ConvOclDirectFwd1x1:1,128,1,1,0,4,16,8,0
32-7-7-1x1-832-7-7-512-0x0-1x1-1x1-0-NCHW-FP32-W=ConvAsmBwdWrW1x1:1,16,2,4,4,1,4,4,0,3
128-14-14-1x1-864-14-14-64-0x0-1x1-1x1-0-NCHW-FP16-F=ConvAsm1x1U:2,8,4,64,1,4,1,4;ConvOclDirectFwd1x1:1,128,1,1,0,4,8,4,0
2048-7-7-1x1-1024-14-14-1-0x0-2x2-1x1-0-NCHW-FP32-B=ConvAsm1x1U:1,8,1,64,1,4,4,2;ConvOclDirectFwd1x1:1,128,1,1,0,1,4,4,0
24-408-472-1x1-64-408-472-32-0x0-1x1-1x1-0-NCHW-FP32-F=ConvOclDirectFwd1x1:1,256,1,1,0,2,32,4,0
58-231-706-1x1-80-231-706-6-0x0-1x1-1x1-0-NCHW-FP32-W=ConvAsmBwdWrW1x1:4,4,4,1,8,1,4,4,0,1
1184-73-662-1x1-960-73-662-2-0x0-1x1-1x1-0-NCHW-FP32-F=ConvOclDirectFwd1x1:1,64,1,1,1,0,16,2048,0
64-35-35-1x1-384-35-35-1-0x0-1x1-1x1-0-NCHW-FP32-W=ConvAsmBwdWrW1x1:4,4,4,2,4,1,2,4,0,1
224-838-57-1x1-416-838-57-16-0x0-1x1-1x1-0-NCHW-FP32-B=ConvOclDirectFwd1x1:1,256,1,1,0,2,32,4,0
320-28-28-1x1-128-28-28-32-0x0-1x1-1x1-0-NCHW-FP16-B=ConvAsm1x1U:1,16,2,16,1,2,4,1;ConvOclDirectFwd1x1:1,64,1,1,0,4,16,4,0
224-372-103-1x1-16-372-103-32-0x0-1x1-1x1-0-NCHW-FP32-B=ConvOclDirectFwd1x1:1,64,1,1,0,4,16,8,0
64-13-13-1x1-512-13-13-128-0x0-1x1-1x1-0-NCHW-FP32-F=ConvAsm1x1U:1,8,1,64,4,4,1,4;ConvOclDirectFwd1x1:1,64,1,1,1,0,32,128,0
240-7-7-3x3-240-7-7-4-1x1-1x1-1x1-0-NCHW-FP32-W=ConvAsmBwdWrW3x3:0,1,8,2,6,1
120-7-7-3x3-120-14-14-256-1x1-2x2-1x1-0-NCHW-FP16-B=ConvOclDirectFwd:8,8,16,16,2,2,4,1,2
800-14-14-1x1-128-14-14-32-0x0-1x1-1x1-0-NCHW-FP16-W=ConvAsmBwdWrW1x1:2,8,4,8,2,2,2,4,0,0
544-14-14-1x1-128-14-14-32-0x0-1x1-1x1-0-NCHW-FP16-F=ConvAsm1x1U:1,8,2,64,1,4,2,4;ConvOclDirectFwd1x1:1,64,1,1,0,4,8,4,0
480-14-14-1x1-192-14-14-64-0x0-1x1-1x1-0-NCHW-FP32-F=ConvAsm1x1U:2,16,2,64,2,2,1,2;ConvOclDirectFwd1x1:1,64,1,1,1,4,16,2048,0;ConvActivAsm1x1U:3,16,4,64,1,1
64-27-27-1x1-384-27-27-32-0x0-1x1-1x1-0-NCHW-FP16-B=ConvAsm1x1U:1,16,2,16,1,2,1,2;ConvOclDirectFwd1x1:1,256,1,1,0,1,4,4,0
512-7-7-1x1-2048-7-7-128-0x0-1x1-1x1-0-NCHW-FP32-W=ConvAsmBwdWrW1x1:1,16,4,4,8,1,1,4,0,1
128-28-28-1x1-224-28-28-16-0x0-1x1-1x1-0-NCHW-FP16-W=ConvAsmBwdWrW1x1:2,8,4,1,8,1,2,4,0,1
512-14-14-3x3-512-28-28-32-1x1-2x2-1x1-0-NCHW-FP32-B_g32=ConvOclDirectFwd:8,16,32,32,4,2,4,4,2
1024-14-14-1x1-512-7-7-256-0x0-2x2-1x1-0-NCHW-FP32-F=ConvAsm1x1U:2,16,2,32,2,2,1,8;ConvOclDirectFwd1x1:1,64,1,1,1,1,32,2048,0
1504-49-952-1x1-352-49-952-6-0x0-1x1-1x1-0-NCHW-FP32-F=ConvOclDirectFwd1x1:1,64,1,1,1,4,64,2048,0
128-7-7-1x1-832-7-7-16-0x0-1x1-1x1-0-NCHW-FP16-B=ConvAsm1x1U:1,8,2,32,1,4,2,2;ConvOclDirectFwd1x1:1,64,1,1,0,1,8,4,0
512-7-7-1x1-2048-7-7-256-0x0-1x1-1x1-0-NCHW-FP16-W=ConvAsmBwdWrW1x1:1,16,4,8,2,1,1,2,0,2
640-564-37-1x1-128-564-37-6-0x0-1x1-1x1-0-NCHW-FP32-F=ConvOclDirectFwd1x1:1,64,1,1,1,0,16,2048,0
64-56-56-1x1-256-28-28-2-0x0-2x2-1x1-0-NCHW-FP32-F=ConvAsm1x1U:1,8,1,64,1,4,1,8;ConvOclDirectFwd1x1:1,64,1,1,1,0,16,128,0
54-55-55-1x1-24-55-55-64-0x0-1x1-1x1-0-NCHW-FP32-B=ConvAsm1x1U:3,8,6,64,4,1,1,2;ConvOclDirectFwd1x1:1,256,1,1,0,1,16,4,0
512-7-7-1x1-2048-7-7-2-0x0-1x1-1x1-0-NCHW-FP32-W=ConvAsmBwdWrW1x1:1,16,2,4,8,1,1,4,0,0
832-142-3-1x1-416-142-3-256-0x0-1x1-1x1-0-NCHW-FP32-B=ConvAsm1x1U:1,32,2,16,1,1,1,1;ConvOclDirectFwd1x1:1,256,1,1,0,2,32,4,0
384-35-35-1x1-96-35-35-256-0x0-1x1-1x1-0-NCHW-FP16-F=ConvAsm1x1U:2,16,4,64,1,2,1,2;ConvOclDirectFwd1x1:1,64,1,1,0,1,16,4,0
96-54-54-1x1-16-54-54-32-0x0-1x1-1x1-0-NCHW-FP32-W=ConvAsmBwdWrW1x1:4,4,2,2,2,2,2,4,0,3
160-14-14-1x1-576-14-14-64-0x0-1x1-1x1-0-NCHW-FP32-W=ConvAsmBwdWrW1x1:1,16,2,4,8,1,2,4,0,2
58-56-56-1x1-24-56-56-1-0x0-1x1-1x1-0-NCHW-FP16-W=ConvAsmBwdWrW1x1:4,4,2,1,2,1,1,2,0,1
256-28-28-1x1-64-28-28-1-0x0-1x1-1x1-0-NCHW-FP32-F=ConvAsm1x1U:1,8,1,64,1,4,4,2;ConvOclDirectFwd1x1:1,64,1,1,1,0,16,64,0;ConvActivAsm1x1U:1,16,1,32,1,4
192-14-14-1x1-1728-14-14-16-0x0-1x1-1x1-0-NCHW-FP32-B=ConvAsm1x1U:1,16,1,32,2,2,2,4;ConvOclDirectFwd1x1:1,128,1,1,0,4,16,4,0
1728-474-28-1x1-512-474-28-4-0x0-1x1-1x1-0-NCHW-FP32-F=ConvOclDirectFwd1x1:1,64,1,1,1,4,64,2048,0
736-3-50-1x1-1184-3-50-12-0x0-1x1-1x1-0-NCHW-FP32-W=ConvAsmBwdWrW1x1:1,16,4,8,4,1,1,4,0,1
992-14-14-1x1-128-14-14-256-0x0-1x1-1x1-0-NCHW-FP16-F=ConvAsm1x1U:2,8,4,64,1,4,1,2;ConvOclDirectFwd1x1:8,64,16,16,0,2,16,4,1
384-35-35-1x1-96-35-35-1-0x0-1x1-1x1-0-NCHW-FP16-F=ConvAsm1x1U:1,8,2,64,1,4,4,1;ConvOclDirectFwd1x1:1,64,1,1,0,1,4,4,0
992-14-14-1x1-128-14-14-64-0x0-1x1-1x1-0-NCHW-FP16-B=ConvAsm1x1U:1,16,2,16,1,2,4,1;ConvOclDirectFwd1x1:1,64,1,1,0,2,8,4,0
512-7-7-1x1-2048-7-7-128-0x0-1x1-1x1-0-NCHW-FP16-B=ConvAsm1x1U:1,16,2,16,1,2,2,2;ConvOclDirectFwd1x1:1,128,1,1,0,1,16,4,0
116-904-27-1x1-80-904-27-4-0x0-1x1-1x1-0-NCHW-FP32-F=ConvAsm1x1U:4,32,6,64,1,1,1,2;ConvOclDirectFwd1x1:1,256,1,1,0,4,8,4,0
256-56-56-1x1-128-28-28-16-0x0-2x2-1x1-0-NCHW-FP16-F=ConvAsm1x1U:1,8,2,32,1,4,1,4;ConvOclDirectFwd1x1:1,64,1,1,0,2,16,8,0
256-17-17-3x3-224-35-35-4-0x0-2x2-1x1-0-NCHW-FP16-B=ConvOclDirectFwd:8,16,16,16,2,1,4,1,2
384-56-56-1x1-192-56-56-16-0x0-1x1-1x1-0-NCHW-FP16-F=ConvAsm1x1U:1,8,2,64,2,4,1,4;ConvOclDirectFwd1x1:1,128,1,1,0,4,16,4,0
576-14-14-1x1-160-14-14-32-0x0-1x1-1x1-0-NCHW-FP32-F=ConvAsm1x1U:4,16,5,16,1,2,2,1;ConvOclDirectFwd1x1:1,64,1,1,1,4,16,2048,0;ConvActivAsm1x1U:3,16,5,16,1,2
544-517-450-1x1-160-517-450-4-0x0-1x1-1x1-0-NCHW-FP32-B=ConvOclDirectFwd1x1:1,128,1,1,0,2,32,4,0
256-15-15-3x3-256-29-29-128-1x1-2x2-1x1-0-NCHW-FP32-B=ConvOclDirectFwd:32,16,32,32,1,2,8,4,1
512-29-29-1x1-512-29-29-8-0x0-1x1-1x1-0-NCHW-FP32-W=ConvAsmBwdWrW1x1:1,16,2,8,4,1,1,4,0,1
480-14-14-1x1-16-14-14-256-0x0-1x1-1x1-0-NCHW-FP16-F=ConvAsm1x1U:2,8,4,64,1,4,2,2;ConvOclDirectFwd1x1:1,64,1,1,0,4,16,4,0
64-13-13-1x1-256-13-13-128-0x0-1x1-1x1-0-NCHW-FP16-F=ConvAsm1x1U:3,8,6,32,1,4,1,4;ConvOclDirectFwd1x1:8,64,16,16,0,1,16,4,1
48-7-7-1x1-832-7-7-16-0x0-1x1-1x1-0-NCHW-FP32-W=ConvAsmBwdWrW1x1:4,4,2,4,4,1,1,4,0,1
256-29-29-1x1-512-29-29-2-0x0-1x1-1x1-0-NCHW-FP32-W=ConvAsmBwdWrW1x1:1,16,2,4,4,1,2,4,0,0
48-27-27-1x1-192-27-27-64-0x0-1x1-1x1-0-NCHW-FP32-F=ConvAsm1x1U:2,16,2,64,2,2,1,1;ConvOclDirectFwd1x1:1,64,1,1,1,0,16,128,0
256-56-56-1x1-64-56-56-16-0x0-1x1-1x1-0-NCHW-FP32-B=ConvAsm1x1U:1,16,1,64,1,2,1,4;ConvOclDirectFwd1x1:1,128,1,1,0,4,16,4,0
192-56-56-1x1-128-56-56-32-0x0-1x1-1x1-0-NCHW-FP32-F=ConvAsm1x1U:3,16,3,64,2,2,1,2;ConvOclDirectFwd1x1:1,64,1,1,1,4,16,2048,0
1312-388-887-1x1-116-388-887-1-0x0-1x1-1x1-0-NCHW-FP32-F=ConvOclDirectFwd1x1:1,256,1,1,0,1,16,4,0
16-54-54-3x3-64-54-54-32-1x1-1x1-1x1-0-NCHW-FP16-F=ConvOclDirectFwd:32,8,32,32,1,4,8,1,2
288-14-14-3x3-144-14-14-512-1x1-1x1-1x1-0-NCHW-FP16-B=ConvOclDirectFwd:8,8,16,16,2,2,8,2,2
58-28-28-1x1-58-28-28-128-0x0-1x1-1x1-0-NCHW-FP32-W=ConvAsmBwdWrW1x1:4,4,2,2,4,1,4,4,0,3
216-28-28-1x1-54-28-28-8-0x0-1x1-1x1-0-NCHW-FP16-B_g3=ConvOclDirectFwd:16,16,16,16,1,1,4,4,2
240-7-7-3x3-240-7-7-4-1x1-1x1-1x1-0-NCHW-FP16-B=ConvOclDirectFwd:8,8,8,8,1,1,1,4,2
384-14-14-1x1-128-14-14-64-0x0-1x1-1x1-0-NCHW-FP32-F=ConvAsm1x1U:3,16,4,64,1,2,2,2;ConvOclDirectFwd1x1:1,64,1,1,1,1,32,2048,0
288-657-245-1x1-544-657-245-2-0x0-1x1-1x1-0-NCHW-FP32-B=ConvOclDirectFwd1x1:1,256,1,1,0,1,32,4,0
64-774-281-1x1-24-774-281-6-0x0-1x1-1x1-0-NCHW-FP32-W=ConvAsmBwdWrW1x1:4,4,2,2,2,1,2,4,0,2
320-153-752-1x1-144-153-752-6-0x0-1x1-1x1-0-NCHW-FP32-B=ConvOclDirectFwd1x1:1,64,1,1,0,4,16,4,0
128-56-56-1x1-224-56-56-256-0x0-1x1-1x1-0-NCHW-FP32-F=ConvAsm1x1U:1,16,1,64,3,2,1,8;ConvOclDirectFwd1x1:1,64,1,1,1,1,32,2048,0
64-28-28-1x1-192-28-28-128-0x0-1x1-1x1-0-NCHW-FP16-W=ConvAsmBwdWrW1x1:4,4,8,1,8,2,4,4,0,1
3-659-647-1x1-128-659-647-4-0x0-1x1-1x1-0-NCHW-FP32-B=ConvOclDirectFwd1x1:1,256,1,1,0,1,64,4,0
576-9-694-1x1-2160-9-694-32-0x0-1x1-1x1-0-NCHW-FP32-W=ConvAsmBwdWrW1x1:1,16,2,8,8,1,1,4,0,1
448-14-14-1x1-128-14-14-16-0x0-1x1-1x1-0-NCHW-FP16-F=ConvAsm1x1U:1,8,2,64,1,4,2,8;ConvOclDirectFwd1x1:1,64,1,1,0,4,8,4,0
160-73-73-1x1-64-73-73-256-0x0-1x1-1x1-0-NCHW-FP32-F=ConvAsm1x1U:2,16,2,64,3,2,1,4;ConvOclDirectFwd1x1:1,64,1,1,1,1,16,256,0;ConvActivAsm1x1U:3,32,3,64,2,1
48-27-27-3x3-192-27-27-16-1x1-1x1-1x1-0-NCHW-FP32-W=ConvAsmBwdWrW3x3:0,1,8,4,2,4
64-28-28-1x1-192-28-28-64-0x0-1x1-1x1-0-NCHW-FP32-W=ConvAsmBwdWrW1x1:4,4,8,4,2,1,4,4,0,1
480-14-14-1x1-96-14-14-256-0x0-1x1-1x1-0-NCHW-FP16-B=ConvAsm1x1U:1,16,2,16,1,2,2,2;ConvOclDirectFwd1x1:1,64,1,1,0,2,32,8,0
128-7-7-1x1-928-7-7-256-0x0-1x1-1x1-0-NCHW-FP16-F=ConvAsm1x1U:2,8,4,16,1,4,1,1;ConvOclDirectFwd1x1:1,256,1,1,0,1,16,4,0
512-14-14-3x3-512-14-14-2-1x1-1x1-1x1-0-NCHW-FP32-F_g32=ConvOclDirectFwd:16,16,16,16,1,1,4,4,2
64-13-13-1x1-512-13-13-256-0x0-1x1-1x1-0-NCHW-FP16-W=ConvAsmBwdWrW1x1:2,8,4,8,2,2,4,4,0,1
1024-8-8-3x3-1024-8-8-256-1x1-1x1-1x1-0-NCHW-FP32-W_g32=ConvOclBwdWrW2<4>:1,7,3,1,9;ConvOclBwdWrW2<16>:1,8,8,1,9;ConvOclBwdWrW2<8>:1,6,8,1,5;ConvOclBwdWrW2<1>:1,8,8,1,5;ConvOclBwdWrW2<2>:1,6,8,1,5;ConvAsmBwdWrW3x3:0,1,8,4,8,1
960-160-422-1x1-1216-160-422-2-0x0-1x1-1x1-0-NCHW-FP32-B=ConvOclDirectFwd1x1:1,64,1,1,0,2,32,4,0
256-29-29-3x3-256-29-29-1-1x1-1x1-1x1-0-NCHW-FP32-F_g32=ConvOclDirectFwd:16,16,16,16,1,1,4,1,1
896-7-7-1x1-128-7-7-16-0x0-1x1-1x1-0-NCHW-FP16-B=ConvAsm1x1U:1,8,2,32,1,4,4,1;ConvOclDirectFwd1x1:1,64,1,1,0,1,4,8,0
64-55-55-11x11-3-224-224-64-2x2-4x4-1x1-0-NCHW-FP16-W=ConvOclBwdWrW2<1>:8,7,1,8,11;ConvOclBwdWrW2<2>:8,9,1,8,11;ConvOclBwdWrW2<4>:8,9,1,8,11;ConvOclBwdWrW2<16>:8,7,1,8,11;ConvOclBwdWrW2<8>:8,9,1,8,11
128-14-14-1x1-640-14-14-128-0x0-1x1-1x1-0-NCHW-FP16-F=ConvAsm1x1U:1,8,2,16,2,4,1,4;ConvOclDirectFwd1x1:1,256,1,1,0,2,16,4,0
576-476-107-1x1-704-476-107-4-0x0-1x1-1x1-0-NCHW-FP32-F=ConvOclDirectFwd1x1:1,64,1,1,1,4,16,2048,0
128-14-14-1x1-576-14-14-256-0x0-1x1-1x1-0-NCHW-FP16-B=ConvAsm1x1U:1,16,2,16,1,2,1,4;ConvOclDirectFwd1x1:1,128,1,1,0,2,32,4,0
64-147-147-3x3-32-147-147-256-1x1-1x1-1x1-0-NCHW-FP16-W=ConvAsmBwdWrW3x3:0,0,16,4,1,4
512-14-14-1x1-1024-14-14-32-0x0-1x1-1x1-0-NCHW-FP32-F=ConvAsm1x1U:3,8,7,32,1,2,1,4;ConvOclDirectFwd1x1:1,64,1,1,1,0,32,2048,0
256-13-13-3x3-384-13-13-256-1x1-1x1-1x1-0-NCHW-FP32-W=ConvAsmBwdWrW3x3:0,0,16,4,4,1
512-28-28-1x1-256-28-28-256-0x0-1x1-1x1-0-NCHW-FP32-W=ConvAsmBwdWrW1x1:2,8,4,8,4,2,2,4,0,1
192-7-7-1x1-1056-7-7-16-0x0-1x1-1x1-0-NCHW-FP16-B=ConvAsm1x1U:1,8,2,32,1,4,2,2;ConvOclDirectFwd1x1:1,128,1,1,0,1,4,4,0
48-27-27-1x1-384-27-27-512-0x0-1x1-1x1-0-NCHW-FP32-F=ConvAsm1x1U:1,8,1,64,3,4,1,8;ConvOclDirectFwd1x1:1,64,1,1,1,0,16,128,0
16-28-28-5x5-32-28-28-128-2x2-1x1-1x1-0-NCHW-FP16-F=ConvOclDirectFwd:16,16,32,32,2,2,8,1,2;ConvOclDirectFwdFused:16,16,32,32,2,2,8,1,2
48-35-35-1x1-256-35-35-32-0x0-1x1-1x1-0-NCHW-FP16-B=ConvAsm1x1U:1,16,2,16,1,2,1,2;ConvOclDirectFwd1x1:1,64,1,1,0,1,32,4,0
48-489-748-1x1-3-489-748-12-0x0-1x1-1x1-0-NCHW-FP32-F=ConvOclDirectFwd1x1:1,256,1,1,0,4,16,4,0
384-194-225-1x1-58-194-225-16-0x0-1x1-1x1-0-NCHW-FP32-B=ConvOclDirectFwd1x1:1,256,1,1,0,1,8,8,0
144-14-14-1x1-512-14-14-256-0x0-1x1-1x1-0-NCHW-FP32-W=ConvAsmBwdWrW1x1:2,8,4,4,8,2,2,4,0,1
128-39-800-1x1-64-39-800-48-0x0-1x1-1x1-0-NCHW-FP32-W=ConvAsmBwdWrW1x1:4,4,4,1,2,1,1,4,0,1
256-28-28-1x1-512-28-28-8-0x0-1x1-1x1-0-NCHW-FP32-W=ConvAsmBwdWrW1x1:1,16,4,4,4,1,2,4,0,1
528-604-36-1x1-1-604-36-32-0x0-1x1-1x1-0-NCHW-FP32-F=ConvOclDirectFwd1x1:1,128,1,1,0,2,16,8,0
352-28-28-1x1-128-28-28-512-0x0-1x1-1x1-0-NCHW-FP16-B=ConvAsm1x1U:1,16,2,16,1,2,1,4;ConvOclDirectFwd1x1:1,256,1,1,0,4,16,4,0
128-28-28-1x1-512-28-28-256-0x0-1x1-1x1-0-NCHW-FP16-B=ConvAsm1x1U:1,16,2,16,1,2,1,4;ConvOclDirectFwd1x1:1,64,1,1,0,4,16,4,0
672-14-14-1x1-128-14-14-64-0x0-1x1-1x1-0-NCHW-FP32-F=ConvAsm1x1U:4,8,7,32,2,2,1,4;ConvOclDirectFwd1x1:1,64,1,1,1,1,16,2048,0
448-344-718-1x1-232-344-718-1-0x0-1x1-1x1-0-NCHW-FP32-F=ConvOclDirectFwd1x1:1,256,1,1,0,4,8,8,0
16-14-14-1x1-480-14-14-64-0x0-1x1-1x1-0-NCHW-FP16-B=ConvAsm1x1U:1,16,2,64,1,2,1,1;ConvOclDirectFwd1x1:1,64,1,1,0,4,8,4,0
128-7-7-1x1-832-7-7-16-0x0-1x1-1x1-0-NCHW-FP32-W=ConvAsmBwdWrW1x1:1,16,2,8,2,1,1,4,0,2
352-292-124-1x1-240-292-124-4-0x0-1x1-1x1-0-NCHW-FP32-B=ConvOclDirectFwd1x1:1,128,1,1,0,4,16,4,0
64-35-35-1x1-192-35-35-128-0x0-1x1-1x1-0-NCHW-FP32-B=ConvAsm1x1U:1,16,1,64,2,2,2,2;ConvOclDirectFwd1x1:1,256,1,1,0,1,32,4,0
256-27-27-3x3-64-27-27-16-1x1-1x1-1x1-0-NCHW-FP16-B=ConvOclDirectFwd:16,16,32,32,2,2,4,4,2
64-14-14-5x5-32-14-14-1-2x2-1x1-1x1-0-NCHW-FP16-B=ConvOclDirectFwd:16,16,16,16,1,1,1,4,1
192-28-28-1x1-64-28-28-256-0x0-1x1-1x1-0-NCHW-FP32-F=ConvAsm1x1U:3,16,5,32,1,2,1,4;ConvOclDirectFwd1x1:1,64,1,1,1,1,16,2048,0;ConvActivAsm1x1U:3,32,3,32,1,1
320-8-8-1x1-1280-8-8-512-0x0-1x1-1x1-0-NCHW-FP16-B=ConvAsm1x1U:1,16,2,16,1,2,1,1;ConvOclDirectFwd1x1:1,256,1,1,0,2,32,4,0
128-56-56-1x1-96-56-56-256-0x0-1x1-1x1-0-NCHW-FP32-F=ConvAsm1x1U:3,16,5,64,1,2,2,2;ConvOclDirectFwd1x1:1,64,1,1,1,1,16,128,0
1000-13-13-1x1-512-13-13-128-0x0-1x1-1x1-0-NCHW-FP16-W=ConvAsmBwdWrW1x1:1,16,4,8,2,1,1,4,0,1
1088-61-142-1x1-32-61-142-4-0x0-1x1-1x1-0-NCHW-FP32-F=ConvOclDirectFwd1x1:1,64,1,1,1,1,64,2048,0
116-14-14-1x1-116-14-14-2-0x0-1x1-1x1-0-NCHW-FP32-W=ConvAsmBwdWrW1x1:2,8,2,1,2,1,1,4,0,1
120-14-14-3x3-120-14-14-8-1x1-1x1-1x1-0-NCHW-FP16-W=ConvAsmBwdWrW3x3:0,1,8,1,2,1
240-7-7-1x1-960-7-7-2-0x0-1x1-1x1-0-NCHW-FP16-B_g3=ConvOclDirectFwd:8,8,8,8,1,1,2,4,2
128-437-83-1x1-1-437-83-32-0x0-1x1-1x1-0-NCHW-FP32-W=ConvAsmBwdWrW1x1:4,4,2,1,2,2,4,4,0,3
64-35-35-1x1-384-35-35-64-0x0-1x1-1x1-0-NCHW-FP32-B=ConvAsm1x1U:1,16,1,64,2,2,2,2;ConvOclDirectFwd1x1:1,256,1,1,0,1,32,4,0
640-196-38-1x1-928-196-38-12-0x0-1x1-1x1-0-NCHW-FP32-W=ConvAsmBwdWrW1x1:1,16,8,8,2,1,1,4,0,1
96-109-109-7x7-3-224-224-256-0x0-2x2-1x1-0-NCHW-FP16-B=ConvOclDirectFwd:32,8,32,32,1,4,1,4,2
240-28-28-1x1-60-28-28-8-0x0-1x1-1x1-0-NCHW-FP32-F_g3=ConvOclDirectFwd:16,16,16,16,1,1,8,2,1
240-14-14-1x1-60-14-14-2-0x0-1x1-1x1-0-NCHW-FP32-B_g3=ConvOclDirectFwd:8,8,8,8,1,1,2,4,2
1024-8-8-3x3-1024-15-15-8-1x1-2x2-1x1-0-NCHW-FP32-B_g32=ConvOclDirectFwd:8,16,16,16,2,1,2,2,2
232-102-31-1x1-1104-102-31-128-0x0-1x1-1x1-0-NCHW-FP32-B=ConvAsm1x1U:1,16,1,64,1,1,1,1;ConvOclDirectFwd1x1:1,256,1,1,0,2,16,4,0
64-208-208-3x3-32-417-417-64-0x0-2x2-1x1-0-NCHW-FP32-B=ConvOclDirectFwd:32,32,32,32,1,1,8,2,1
1024-8-8-1x1-2048-8-8-256-0x0-1x1-1x1-0-NCHW-FP32-W=ConvAsmBwdWrW1x1:1,16,4,4,8,1,1,4,0,1
4-54-1021-1x1-352-54-1021-16-0x0-1x1-1x1-0-NCHW-FP32-F=ConvOclDirectFwd1x1:1,256,1,1,0,2,32,4,0
3-230-230-7x7-64-112-112-1-0x0-2x2-1x1-0-NCHW-FP32-F=ConvOclDirectFwd:16,8,16,16,1,2,8,1,1;ConvOclDirectFwdFused:16,8,16,16,1,2,8,1,1
512-14-14-1x1-64-14-14-1-0x0-1x1-1x1-0-NCHW-FP16-F=ConvAsm1x1U:1,8,2,16,1,4,4,1;ConvOclDirectFwd1x1:1,64,1,1,0,4,4,8,0
64-35-35-1x1-384-35-35-1-0x0-1x1-1x1-0-NCHW-FP32-B=ConvAsm1x1U:1,8,1,64,1,4,1,2;ConvOclDirectFwd1x1:1,128,1,1,0,1,8,4,0
448-28-28-1x1-128-28-28-32-0x0-1x1-1x1-0-NCHW-FP16-W=ConvAsmBwdWrW1x1:4,4,8,2,4,1,2,2,0,1
128-28-28-1x1-512-28-28-512-0x0-1x1-1x1-0-NCHW-FP16-W=ConvAsmBwdWrW1x1:4,4,8,4,2,1,1,4,0,2
1024-8-8-3x3-1024-15-15-48-1x1-2x2-1x1-0-NCHW-FP32-W_g32=ConvOclBwdWrW2<4>:1,6,8,1,9;ConvOclBwdWrW2<16>:1,7,3,1,9;ConvOclBwdWrW2<8>:1,6,8,1,9;ConvOclBwdWrW2<1>:1,6,8,1,9;ConvOclBwdWrW2<2>:1,6,8,1,9;ConvAsmBwdWrW3x3:0,0,8,8,3,1
128-7-7-1x1-672-7-7-16-0x0-1x1-1x1-0-NCHW-FP32-F=ConvAsm1x1U:1,8,1,64,2,4,1,4;ConvOclDirectFwd1x1:1,64,1,1,1,4,16,2048,0
192-8-8-1x1-2048-8-8-8-0x0-1x1-1x1-0-NCHW-FP32-W=ConvAsmBwdWrW1x1:2,8,4,2,8,1,1,4,0,0
256-13-13-3x3-256-13-13-4096-1x1-1x1-1x1-0-NCHW-FP16-B=ConvOclDirectFwd:8,8,16,16,2,2,8,2,2
320-8-8-1x1-2048-8-8-64-0x0-1x1-1x1-0-NCHW-FP16-B=ConvAsm1x1U:1,16,2,32,1,2,2,4;ConvOclDirectFwd1x1:1,128,1,1,0,4,16,4,0
256-14-14-1x1-512-28-28-128-0x0-2x2-1x1-0-NCHW-FP16-W=ConvAsmBwdWrW1x1:2,8,4,8,2,1,2,4,0,1
256-15-15-3x3-256-29-29-16-1x1-2x2-1x1-0-NCHW-FP32-W=ConvAsmBwdWrW3x3:0,0,8,8,4,1
64-56-56-1x1-128-56-56-256-0x0-1x1-1x1-0-NCHW-FP32-F=ConvAsm1x1U:1,16,1,64,4,2,1,8;ConvOclDirectFwd1x1:1,64,1,1,1,4,32,128,0
32-128-256-1x1-256-128-256-1-0x0-1x1-1x1-0-NCHW-FP32-B=ConvOclDirectFwd1x1:1,64,1,1,0,4,16,8,0
128-28-28-1x1-512-28-28-4-0x0-1x1-1x1-0-NCHW-FP32-B=ConvAsm1x1U:1,8,1,16,1,4,1,4;ConvOclDirectFwd1x1:16,64,32,32,0,2,16,4,1
19-138-1-1x1-3-138-1-2-0x0-1x1-1x1-0-NCHW-FP32-B=ConvAsm1x1U:1,1,3,4,1,1,4,1;ConvOclDirectFwd1x1:1,128,1,1,0,2,16,4,0
240-7-7-1x1-960-7-7-256-0x0-1x1-1x1-0-NCHW-FP32-B_g3=ConvOclDirectFwd:8,8,8,8,1,1,8,4,1
256-28-28-1x1-128-28-28-512-0x0-1x1-1x1-0-NCHW-FP16-F=ConvAsm1x1U:1,16,2,16,2,2,1,4;ConvOclDirectFwd1x1:1,128,1,1,0,4,16,4,0
320-8-8-1x1-2048-8-8-4-0x0-1x1-1x1-0-NCHW-FP16-W=ConvAsmBwdWrW1x1:1,16,2,4,2,1,1,4,0,0
64-73-73-1x1-160-73-73-4-0x0-1x1-1x1-0-NCHW-FP16-W=ConvAsmBwdWrW1x1:4,4,4,4,2,1,4,4,0,0
128-931-233-1x1-116-931-233-1-0x0-1x1-1x1-0-NCHW-FP32-B=ConvOclDirectFwd1x1:1,256,1,1,0,1,16,8,0
64-27-27-1x1-384-27-27-16-0x0-1x1-1x1-0-NCHW-FP32-F=ConvAsm1x1U:1,16,1,64,4,2,1,1;ConvOclDirectFwd1x1:1,64,1,1,1,4,32,128,0
128-176-14-1x1-352-176-14-32-0x0-1x1-1x1-0-NCHW-FP32-W=ConvAsmBwdWrW1x1:4,4,8,4,4,1,2,4,0,0
2048-7-7-1x1-512-7-7-8-0x0-1x1-1x1-0-NCHW-FP32-W=ConvAsmBwdWrW1x1:1,16,4,4,8,1,1,2,0,1
992-14-14-1x1-128-14-14-16-0x0-1x1-1x1-0-NCHW-FP16-B=ConvAsm1x1U:2,8,4,64,1,4,4,2;ConvOclDirectFwd1x1:1,256,1,1,0,4,4,4,0
832-408-33-1x1-960-408-33-16-0x0-1x1-1x1-0-NCHW-FP32-B=ConvOclDirectFwd1x1:1,256,1,1,0,2,32,4,0
48-601-13-1x1-116-601-13-8-0x0-1x1-1x1-0-NCHW-FP32-W=ConvAsmBwdWrW1x1:4,4,2,4,4,1,4,4,0,2
256-56-56-3x3-256-56-56-128-1x1-1x1-1x1-0-NCHW-FP16-F=ConvOclDirectFwd:16,16,32,32,2,2,8,2,1;ConvOclDirectFwdFused:32,8,32,32,1,4,8,1,1
1104-14-14-1x1-192-14-14-16-0x0-1x1-1x1-0-NCHW-FP32-B=ConvAsm1x1U:1,32,1,32,1,1,2,2;ConvOclDirectFwd1x1:1,256,1,1,0,4,8,4,0
864-212-12-1x1-144-212-12-12-0x0-1x1-1x1-0-NCHW-FP32-B=ConvAsm1x1U:3,16,3,64,3,2,1,1;ConvOclDirectFwd1x1:1,128,1,1,0,4,16,4,0
768-7-7-1x1-128-7-7-32-0x0-1x1-1x1-0-NCHW-FP16-B=ConvAsm1x1U:1,8,2,32,1,4,4,2;ConvOclDirectFwd1x1:1,64,1,1,0,1,8,8,0
288-688-285-1x1-160-688-285-4-0x0-1x1-1x1-0-NCHW-FP32-F=ConvOclDirectFwd1x1:1,64,1,1,1,0,64,2048,0
16-556-713-1x1-96-556-713-6-0x0-1x1-1x1-0-NCHW-FP32-F=ConvOclDirectFwd1x1:1,64,1,1,1,4,16,2048,0
480-14-14-1x1-96-14-14-1-0x0-1x1-1x1-0-NCHW-FP32-F=ConvAsm1x1U:1,8,1,32,1,4,4,2;ConvOclDirectFwd1x1:1,64,1,1,1,0,16,64,0;ConvActivAsm1x1U:1,16,2,16,1,4
960-14-14-1x1-128-14-14-32-0x0-1x1-1x1-0-NCHW-FP16-B=ConvAsm1x1U:1,16,2,16,1,2,4,1;ConvOclDirectFwd1x1:1,64,1,1,0,2,32,8,0
512-10-42-3x3-512-10-42-1-1x1-1x1-1x1-0-NCHW-FP16-F=ConvOclDirectFwd:16,16,16,16,1,1,8,2,1
128-112-112-3x3-64-112-112-256-1x1-1x1-1x1-0-NCHW-FP16-B=ConvOclDirectFwd:16,8,16,32,1,4,8,1,2
2048-8-8-1x1-384-8-8-1-0x0-1x1-1x1-0-NCHW-FP32-F=ConvAsm1x1U:1,8,2,32,1,4,4,1;ConvOclDirectFwd1x1:1,64,1,1,1,1,16,128,0;ConvActivAsm1x1U:1,16,1,32,1,3
128-57-57-3x3-128-29-29-1-1x1-2x2-1x1-0-NCHW-FP32-F=ConvOclDirectFwd:16,16,16,16,1,1,2,2,1
224-35-35-3x3-192-35-35-8-1x1-1x1-1x1-0-NCHW-FP32-W=ConvAsmBwdWrW3x3:0,0,8,4,3,2
192-56-56-1x1-96-56-56-16-0x0-1x1-1x1-0-NCHW-FP16-B=ConvAsm1x1U:1,16,2,32,1,2,2,2;ConvOclDirectFwd1x1:1,64,1,1,0,4,16,4,0
2048-7-7-1x1-512-7-7-256-0x0-1x1-1x1-0-NCHW-FP32-B=ConvAsm1x1U:1,32,1,64,2,1,2,2;ConvOclDirectFwd1x1:1,256,1,1,0,1,32,4,0
64-35-35-5x5-48-35-35-128-2x2-1x1-1x1-0-NCHW-FP16-B=ConvOclDirectFwd:8,8,16,16,2,2,8,2,2
512-29-29-1x1-512-29-29-2-0x0-1x1-1x1-0-NCHW-FP32-W=ConvAsmBwdWrW1x1:1,16,4,8,2,1,1,4,0,1
192-28-28-1x1-96-28-28-256-0x0-1x1-1x1-0-NCHW-FP16-F=ConvAsm1x1U:1,8,2,32,2,4,1,4;ConvOclDirectFwd1x1:1,256,1,1,0,4,16,4,0
384-35-35-1x1-192-35-35-1-0x0-1x1-1x1-0-NCHW-FP16-F=ConvAsm1x1U:1,8,2,64,1,4,4,1;ConvOclDirectFwd1x1:1,256,1,1,0,1,8,8,0
128-28-28-1x1-192-28-28-64-0x0-1x1-1x1-0-NCHW-FP32-F=ConvAsm1x1U:1,16,1,32,3,2,2,4;ConvOclDirectFwd1x1:1,64,1,1,1,4,16,2048,0
160-17-17-1x1-768-17-17-64-0x0-1x1-1x1-0-NCHW-FP32-B=ConvAsm1x1U:1,16,1,64,4,2,1,2;ConvOclDirectFwd1x1:1,256,1,1,0,1,32,4,0
96-14-14-1x1-480-14-14-256-0x0-1x1-1x1-0-NCHW-FP16-W=ConvAsmBwdWrW1x1:2,8,2,8,2,1,4,4,0,2
128-7-7-1x1-832-7-7-4-0x0-1x1-1x1-0-NCHW-FP16-B=ConvAsm1x1U:1,8,2,32,1,2,4,1;ConvOclDirectFwd1x1:1,64,1,1,0,1,4,8,0
128-57-57-3x3-128-29-29-2-1x1-2x2-1x1-0-NCHW-FP32-F=ConvOclDirectFwd:16,16,16,16,1,1,4,2,2
256-13-13-1x1-64-13-13-128-0x0-1x1-1x1-0-NCHW-FP16-W=ConvAsmBwdWrW1x1:4,4,4,4,2,1,4,4,0,1
192-14-14-1x1-384-14-14-16-0x0-1x1-1x1-0-NCHW-FP16-W=ConvAsmBwdWrW1x1:2,8,2,8,2,1,2,4,0,1
128-28-28-1x1-256-28-28-32-0x0-1x1-1x1-0-NCHW-FP16-B=ConvAsm1x1U:1,16,2,16,1,2,2,2;ConvOclDirectFwd1x1:1,64,1,1,0,4,16,4,0
128-28-28-1x1-448-28-28-128-0x0-1x1-1x1-0-NCHW-FP32-W=ConvAsmBwdWrW1x1:1,16,2,8,4,1,4,4,0,1
352-833-321-1x1-1-833-321-2-0x0-1x1-1x1-0-NCHW-FP32-B=ConvOclDirectFwd1x1:1,64,1,1,0,1,16,8,0
256-56-56-1x1-64-56-56-64-0x0-1x1-1x1-0-NCHW-FP32-F=ConvAsm1x1U:3,16,6,64,1,2,1,4;ConvOclDirectFwd1x1:1,64,1,1,1,4,16,2048,0;ConvActivAsm1x1U:3,32,3,64,1,1
1392-637-30-1x1-232-637-30-2-0x0-1x1-1x1-0-NCHW-FP32-F=ConvOclDirectFwd1x1:1,128,1,1,0,2,16,4,0
128-57-57-1x1-256-57-57-16-0x0-1x1-1x1-0-NCHW-FP32-F=ConvAsm1x1U:3,16,3,64,1,2,2,1;ConvOclDirectFwd1x1:1,64,1,1,1,1,16,256,0
352-28-28-1x1-128-28-28-512-0x0-1x1-1x1-0-NCHW-FP32-B=ConvAsm1x1U:1,32,1,32,2,1,1,4;ConvOclDirectFwd1x1:1,128,1,1,0,1,32,4,0
384-13-13-3x3-384-13-13-256-1x1-1x1-1x1-0-NCHW-FP16-F=ConvOclDirectFwd:8,8,16,16,2,2,8,4,1;ConvOclDirectFwdFused:8,8,16,16,2,2,8,1,1
32-28-28-3x3-128-28-28-128-1x1-1x1-1x1-0-NCHW-FP16-B=ConvOclDirectFwd:16,16,32,32,2,2,8,2,2
128-28-28-1x1-256-28-28-1-0x0-1x1-1x1-0-NCHW-FP16-W=ConvAsmBwdWrW1x1:4,4,2,4,2,1,1,2,0,1
576-7-7-1x1-128-7-7-256-0x0-1x1-1x1-0-NCHW-FP16-F=ConvAsm1x1U:2,8,4,16,1,4,2,4;ConvOclDirectFwd1x1:1,64,1,1,0,1,16,4,0
19-18-87-1x1-1680-18-87-32-0x0-1x1-1x1-0-NCHW-FP32-B=ConvAsm1x1U:1,8,1,16,1,1,1,1;ConvOclDirectFwd1x1:1,64,1,1,0,2,16,4,0
256-29-29-1x1-512-29-29-16-0x0-1x1-1x1-0-NCHW-FP32-W=ConvAsmBwdWrW1x1:1,16,2,4,4,1,1,4,0,2
128-112-112-3x3-64-112-112-2-1x1-1x1-1x1-0-NCHW-FP32-W=ConvAsmBwdWrW3x3:0,0,16,4,2,1
320-14-14-1x1-128-14-14-64-0x0-1x1-1x1-0-NCHW-FP32-F=ConvAsm1x1U:1,16,1,64,2,2,1,1;ConvOclDirectFwd1x1:1,64,1,1,1,4,32,2048,0
128-7-7-1x1-704-7-7-16-0x0-1x1-1x1-0-NCHW-FP16-W=ConvAsmBwdWrW1x1:4,4,4,4,2,1,1,2,0,1
384-13-13-3x3-192-13-13-256-1x1-1x1-1x1-0-NCHW-FP16-B=ConvOclDirectFwd:8,8,16,16,2,2,8,2,1
256-365-89-1x1-608-365-89-2-0x0-1x1-1x1-0-NCHW-FP32-F=ConvOclDirectFwd1x1:1,64,1,1,1,4,64,256,0
32-79-341-5x10-32-38-166-16-0x0-2x2-1x1-0-NCHW-FP32-F=ConvOclDirectFwd:16,8,16,16,1,2,8,1,1
480-28-28-1x1-128-28-28-16-0x0-1x1-1x1-0-NCHW-FP32-F=ConvAsm1x1U:4,16,4,32,1,2,1,1;ConvOclDirectFwd1x1:1,64,1,1,1,0,32,2048,0
8-870-1019-1x1-4-870-1019-16-0x0-1x1-1x1-0-NCHW-FP32-B=ConvOclDirectFwd1x1:1,256,1,1,0,2,16,8,0
512-28-28-1x1-1024-14-14-2-0x0-2x2-1x1-0-NCHW-FP16-F=ConvAsm1x1U:2,8,4,64,1,4,4,1;ConvOclDirectFwd1x1:1,64,1,1,0,2,16,8,0
54-999-76-1x1-1584-999-76-2-0x0-1x1-1x1-0-NCHW-FP32-B=ConvOclDirectFwd1x1:1,256,1,1,0,1,16,4,0
120-14-14-1x1-480-14-14-16-0x0-1x1-1x1-0-NCHW-FP32-B_g3=ConvOclDirectFwd:8,8,8,8,1,1,8,4,1
58-138-989-1x1-384-138-989-8-0x0-1x1-1x1-0-NCHW-FP32-F=ConvOclDirectFwd1x1:1,256,1,1,0,2,32,4,0
256-29-29-3x3-256-57-57-32-1x1-2x2-1x1-0-NCHW-FP32-B_g32=ConvOclDirectFwd:8,8,16,32,2,4,8,1,1
128-7-7-5x5-32-7-7-64-2x2-1x1-1x1-0-NCHW-FP16-B=ConvOclDirectFwd:8,8,8,8,1,1,2,1,2
1280-985-97-1x1-1184-985-97-4-0x0-1x1-1x1-0-NCHW-FP32-B=ConvOclDirectFwd1x1:1,128,1,1,0,1,32,4,0
64-56-56-1x1-256-56-56-8-0x0-1x1-1x1-0-NCHW-FP32-F=ConvAsm1x1U:1,16,1,64,3,2,1,4;ConvOclDirectFwd1x1:1,64,1,1,1,4,16,256,0;ConvActivAsm1x1U:1,32,1,64,3,1
4-2-2-3x3-3-1-1-512-0x0-2x2-1x1-0-NCHW-FP32-F=ConvOclDirectFwd:8,8,8,8,1,1,1,2,2
256-20-84-5x5-512-9-41-4-1x1-2x2-1x1-0-NCHW-FP32-F=ConvOclDirectFwd:16,8,16,16,1,2,8,1,2
256-29-29-3x3-256-29-29-4-1x1-1x1-1x1-0-NCHW-FP32-F_g32=ConvOclDirectFwd:16,16,16,32,1,2,8,4,1
480-56-505-1x1-608-56-505-2-0x0-1x1-1x1-0-NCHW-FP32-F=ConvOclDirectFwd1x1:1,64,1,1,1,4,64,2048,0
256-28-28-3x3-512-28-28-16-1x1-1x1-1x1-0-NCHW-FP16-W=ConvAsmBwdWrW3x3:0,1,8,4,2,1
128-7-7-1x1-608-7-7-64-0x0-1x1-1x1-0-NCHW-FP32-W=ConvAsmBwdWrW1x1:1,16,2,8,2,1,2,4,0,3
128-56-56-3x3-128-28-28-1-1x1-2x2-1x1-0-NCHW-FP32-F=ConvOclDirectFwd:16,16,16,16,1,1,2,2,1
58-65-405-1x1-240-65-405-1-0x0-1x1-1x1-0-NCHW-FP32-W=ConvAsmBwdWrW1x1:4,4,8,1,4,1,1,4,0,2
96-14-14-1x1-480-14-14-1-0x0-1x1-1x1-0-NCHW-FP16-W=ConvAsmBwdWrW1x1:2,8,2,2,2,1,1,4,0,1
80-73-73-1x1-64-73-73-256-0x0-1x1-1x1-0-NCHW-FP32-W=ConvAsmBwdWrW1x1:4,4,4,4,2,1,2,4,0,2
64-80-349-5x5-1-161-700-16-1x1-2x2-1x1-0-NCHW-FP32-W=ConvOclBwdWrW2<1>:8,10,8,1,5;ConvOclBwdWrW2<2>:8,10,8,1,5;ConvOclBwdWrW2<4>:8,9,1,3,5;ConvOclBwdWrW2<16>:8,11,1,1,7;ConvOclBwdWrW2<8>:8,7,1,3,5
116-625-13-1x1-256-625-13-4-0x0-1x1-1x1-0-NCHW-FP32-F=ConvAsm1x1U:4,16,4,64,1,2,1,8;ConvOclDirectFwd1x1:1,256,1,1,0,1,32,4,0
464-7-7-1x1-1024-7-7-1024-0x0-1x1-1x1-0-NCHW-FP32-F=ConvAsm1x1U:2,16,2,32,3,2,2,1;ConvOclDirectFwd1x1:1,64,1,1,1,1,16,2048,0
544-7-7-1x1-128-7-7-64-0x0-1x1-1x1-0-NCHW-FP16-B=ConvAsm1x1U:1,16,2,16,1,2,4,4;ConvOclDirectFwd1x1:1,64,1,1,0,1,8,4,0
64-13-13-1x1-512-13-13-256-0x0-1x1-1x1-0-NCHW-FP32-F=ConvAsm1x1U:1,8,1,64,3,4,1,8;ConvOclDirectFwd1x1:1,64,1,1,1,4,32,128,0
32-28-28-1x1-192-28-28-1-0x0-1x1-1x1-0-NCHW-FP16-B=ConvAsm1x1U:1,8,2,64,1,2,2,4;ConvOclDirectFwd1x1:1,64,1,1,0,1,8,4,0
128-28-28-1x1-480-28-28-16-0x0-1x1-1x1-0-NCHW-FP32-W=ConvAsmBwdWrW1x1:1,16,2,8,2,1,4,4,0,1
2048-8-8-1x1-384-8-8-256-0x0-1x1-1x1-0-NCHW-FP16-F=ConvAsm1x1U:1,8,2,32,2,4,2,2;ConvOclDirectFwd1x1:1,128,1,1,0,4,16,8,0
128-57-57-3x3-128-57-57-64-1x1-1x1-1x1-0-NCHW-FP32-B_g32=ConvOclDirectFwd:8,16,16,32,2,2,8,2,2
448-14-14-1x1-128-14-14-512-0x0-1x1-1x1-0-NCHW-FP16-B=ConvAsm1x1U:1,16,2,16,1,2,4,2;ConvOclDirectFwd1x1:1,128,1,1,0,2,32,8,0
416-28-28-1x1-128-28-28-512-0x0-1x1-1x1-0-NCHW-FP32-B=ConvAsm1x1U:1,32,1,64,2,1,1,4;ConvOclDirectFwd1x1:1,64,1,1,0,1,32,4,0
192-28-28-1x1-16-28-28-32-0x0-1x1-1x1-0-NCHW-FP16-F=ConvAsm1x1U:1,8,2,64,1,4,4,1;ConvOclDirectFwd1x1:1,128,1,1,0,2,8,4,0
324-1-1-3x3-256-1-1-64-1x1-1x1-1x1-0-NCHW-FP32-W=ConvAsmBwdWrW3x3:0,0,8,2,1,1
512-28-28-1x1-128-28-28-1-0x0-1x1-1x1-0-NCHW-FP16-W=ConvAsmBwdWrW1x1:4,4,4,1,4,1,1,4,0,0
24-28-28-1x1-58-28-28-128-0x0-1x1-1x1-0-NCHW-FP32-F=ConvAsm1x1U:1,8,1,32,1,2,1,2;ConvOclDirectFwd1x1:1,128,1,1,0,4,16,8,0
256-27-27-1x1-48-27-27-512-0x0-1x1-1x1-0-NCHW-FP16-B=ConvAsm1x1U:1,16,2,64,1,2,1,1;ConvOclDirectFwd1x1:1,128,1,1,0,1,16,4,0
256-14-14-3x3-256-14-14-64-1x1-1x1-1x1-0-NCHW-FP32-W=ConvAsmBwdWrW3x3:0,1,8,4,4,1
1000-13-13-1x1-512-13-13-128-0x0-1x1-1x1-0-NCHW-FP16-B=ConvAsm1x1U:1,16,2,16,1,2,2,2;ConvOclDirectFwd1x1:1,128,1,1,0,1,32,4,0
116-28-28-1x1-116-28-28-1024-0x0-1x1-1x1-0-NCHW-FP16-B=ConvAsm1x1U:4,4,8,4,1,2,2,2;ConvOclDirectFwd1x1:1,128,1,1,0,4,8,4,0
960-7-7-1x1-240-7-7-32-0x0-1x1-1x1-0-NCHW-FP32-F_g3=ConvOclDirectFwd:8,8,8,8,1,1,8,4,2
512-28-28-1x1-128-28-28-1-0x0-1x1-1x1-0-NCHW-FP32-W=ConvAsmBwdWrW1x1:2,8,4,2,2,1,1,4,0,1
192-28-28-1x1-16-28-28-1-0x0-1x1-1x1-0-NCHW-FP16-F=ConvAsm1x1U:1,8,2,16,1,4,4,1;ConvOclDirectFwd1x1:1,64,1,1,0,1,4,8,0
1024-17-17-1x1-384-17-17-32-0x0-1x1-1x1-0-NCHW-FP16-F=ConvAsm1x1U:1,16,2,32,2,2,4,1;ConvOclDirectFwd1x1:1,64,1,1,0,1,16,4,0
512-28-28-1x1-1024-14-14-512-0x0-2x2-1x1-0-NCHW-FP16-F=ConvAsm1x1U:2,8,4,64,1,4,1,4;ConvOclDirectFwd1x1:1,128,1,1,0,2,32,4,0
32-147-147-3x3-32-149-149-8-0x0-1x1-1x1-0-NCHW-FP16-B=ConvOclDirectFwd:16,16,32,32,2,2,8,2,2
3-230-230-7x7-64-112-112-16-0x0-2x2-1x1-0-NCHW-FP32-F=ConvOclDirectFwd:16,8,16,16,1,2,8,1,2
128-28-28-3x3-128-56-56-8-1x1-2x2-1x1-0-NCHW-FP32-W=ConvAsmBwdWrW3x3:0,0,8,4,3,1
32-14-14-1x1-528-14-14-128-0x0-1x1-1x1-0-NCHW-FP32-B=ConvAsm1x1U:1,16,1,32,2,2,2,2;ConvOclDirectFwd1x1:1,256,1,1,0,2,16,4,0
64-35-35-1x1-256-35-35-1-0x0-1x1-1x1-0-NCHW-FP32-W=ConvAsmBwdWrW1x1:4,4,2,2,2,1,1,4,0,1
1920-877-16-1x1-1024-877-16-6-0x0-1x1-1x1-0-NCHW-FP32-F=ConvOclDirectFwd1x1:1,64,1,1,1,4,16,2048,0
128-28-28-1x1-160-28-28-64-0x0-1x1-1x1-0-NCHW-FP32-B=ConvAsm1x1U:1,16,1,16,1,2,1,1;ConvOclDirectFwd1x1:1,256,1,1,0,1,32,4,0
512-7-7-3x3-512-4-4-512-1x1-2x2-1x1-0-NCHW-FP32-F=ConvOclDirectFwd:8,8,8,8,1,1,8,2,2
768-7-7-1x1-128-7-7-32-0x0-1x1-1x1-0-NCHW-FP16-F=ConvAsm1x1U:1,8,2,32,1,4,4,4;ConvOclDirectFwd1x1:1,64,1,1,0,1,8,8,0
320-271-270-1x1-448-271-270-12-0x0-1x1-1x1-0-NCHW-FP32-B=ConvOclDirectFwd1x1:1,128,1,1,0,1,32,4,0
240-7-7-3x3-240-7-7-1024-1x1-1x1-1x1-0-NCHW-FP16-B=ConvOclDirectFwd:8,8,8,8,1,1,8,2,1
128-14-14-1x1-800-14-14-64-0x0-1x1-1x1-0-NCHW-FP32-F=ConvAsm1x1U:1,16,1,32,4,2,2,2;ConvOclDirectFwd1x1:1,64,1,1,1,0,32,2048,0
512-14-14-1x1-1024-14-14-128-0x0-1x1-1x1-0-NCHW-FP32-F=ConvAsm1x1U:4,8,7,32,1,2,1,4;ConvOclDirectFwd1x1:1,64,1,1,1,1,32,2048,0
48-7-7-1x1-832-7-7-128-0x0-1x1-1x1-0-NCHW-FP32-W=ConvAsmBwdWrW1x1:2,8,4,4,4,2,2,4,0,3
416-77-920-1x1-24-77-920-6-0x0-1x1-1x1-0-NCHW-FP32-F=ConvOclDirectFwd1x1:1,64,1,1,0,4,16,4,0
1024-14-14-1x1-1024-14-14-128-0x0-1x1-1x1-0-NCHW-FP32-B=ConvAsm1x1U:1,32,2,16,1,1,1,1;ConvOclDirectFwd1x1:1,256,1,1,0,4,16,8,0
128-57-57-1x1-64-57-57-16-0x0-1x1-1x1-0-NCHW-FP32-B=ConvAsm1x1U:1,16,1,64,1,2,1,4;ConvOclDirectFwd1x1:1,256,1,1,0,1,32,4,0
928-51-31-1x1-1104-51-31-2-0x0-1x1-1x1-0-NCHW-FP32-W=ConvAsmBwdWrW1x1:2,8,4,4,8,1,1,4,0,1
768-7-7-1x1-128-7-7-256-0x0-1x1-1x1-0-NCHW-FP32-B=ConvAsm1x1U:1,16,1,64,2,2,2,2;ConvOclDirectFwd1x1:1,256,1,1,0,1,16,4,0
2048-7-7-1x1-512-7-7-64-0x0-1x1-1x1-0-NCHW-FP16-B=ConvAsm1x1U:1,16,2,32,1,2,4,1;ConvOclDirectFwd1x1:8,64,8,8,0,1,16,4,1
512-14-14-3x3-512-14-14-32-1x1-1x1-1x1-0-NCHW-FP32-F_g32=ConvOclDirectFwd:16,16,16,16,1,1,4,4,2
192-35-35-3x3-224-35-35-32-1x1-1x1-1x1-0-NCHW-FP16-F=ConvOclDirectFwd:8,8,16,16,2,2,8,2,2;ConvOclDirectFwdFused:8,8,16,16,2,2,8,2,2
544-7-7-1x1-128-7-7-16-0x0-1x1-1x1-0-NCHW-FP16-W=ConvAsmBwdWrW1x1:4,4,2,4,2,1,2,2,0,1
24-800-115-1x1-1-800-115-4-0x0-1x1-1x1-0-NCHW-FP32-W=ConvAsmBwdWrW1x1:4,4,2,1,2,1,4,4,0,2
128-56-56-3x3-128-56-56-256-1x1-1x1-1x1-0-NCHW-FP32-W_g32=ConvOclBwdWrW2<4>:1,7,1,1,3;ConvOclBwdWrW2<16>:1,8,1,1,5;ConvOclBwdWrW2<8>:1,9,3,1,5;ConvOclBwdWrW2<1>:1,7,1,1,3;ConvOclBwdWrW2<2>:1,7,1,1,3;ConvAsmBwdWrW3x3:0,0,16,1,2,1
320-28-28-1x1-128-28-28-64-0x0-1x1-1x1-0-NCHW-FP32-F=ConvAsm1x1U:2,16,2,32,2,2,1,4;ConvOclDirectFwd1x1:1,64,1,1,1,0,32,2048,0;ConvActivAsm1x1U:2,16,3,32,2,1
256-29-29-3x3-256-29-29-256-1x1-1x1-1x1-0-NCHW-FP32-B_g32=ConvOclDirectFwd:16,16,32,32,2,2,8,2,1
384-27-27-1x1-64-27-27-256-0x0-1x1-1x1-0-NCHW-FP16-W=ConvAsmBwdWrW1x1:4,4,8,4,2,2,2,4,0,1
416-88-627-1x1-1280-88-627-1-0x0-1x1-1x1-0-NCHW-FP32-F=ConvOclDirectFwd1x1:1,64,1,1,1,4,16,2048,0
2048-8-8-1x1-320-8-8-32-0x0-1x1-1x1-0-NCHW-FP32-F=ConvAsm1x1U:2,8,2,32,3,4,1,4;ConvOclDirectFwd1x1:1,64,1,1,1,1,16,2048,0;ConvActivAsm1x1U:4,16,4,16,3,4
352-42-174-1x1-1024-42-174-64-0x0-1x1-1x1-0-NCHW-FP32-F=ConvOclDirectFwd1x1:1,64,1,1,1,4,32,2048,0
96-14-14-3x3-208-14-14-256-1x1-1x1-1x1-0-NCHW-FP16-F=ConvOclDirectFwd:8,8,16,16,2,2,8,1,2;ConvOclDirectFwdFused:8,8,16,16,2,2,8,1,2
64-35-35-1x1-384-35-35-8-0x0-1x1-1x1-0-NCHW-FP32-W=ConvAsmBwdWrW1x1:2,8,4,4,4,1,4,4,0,1
128-56-56-1x1-128-56-56-256-0x0-1x1-1x1-0-NCHW-FP16-W=ConvAsmBwdWrW1x1:4,4,8,1,8,2,4,4,0,1
512-128-128-1x1-256-256-256-4-0x0-2x2-1x1-0-NCHW-FP32-B=ConvOclDirectFwd1x1:1,256,1,1,0,2,32,4,0
256-14-14-1x1-128-14-14-16-0x0-1x1-1x1-0-NCHW-FP32-F=ConvAsm1x1U:4,8,4,64,1,4,2,2;ConvOclDirectFwd1x1:1,64,1,1,1,0,16,128,0
1056-7-7-1x1-128-7-7-64-0x0-1x1-1x1-0-NCHW-FP16-F=ConvAsm1x1U:2,8,4,16,1,4,4,2;ConvOclDirectFwd1x1:1,64,1,1,0,1,8,4,0
432-28-28-1x1-192-28-28-16-0x0-1x1-1x1-0-NCHW-FP32-F=ConvAsm1x1U:4,16,5,32,1,2,1,1;ConvOclDirectFwd1x1:1,64,1,1,1,0,16,2048,0;ConvActivAsm1x1U:3,16,5,32,1,1
8-15-704-1x1-1008-15-704-12-0x0-1x1-1x1-0-NCHW-FP32-W=ConvAsmBwdWrW1x1:4,4,4,4,4,1,4,4,0,1
128-14-14-1x1-288-14-14-512-0x0-1x1-1x1-0-NCHW-FP16-B=ConvAsm1x1U:1,16,2,16,1,2,2,2;ConvOclDirectFwd1x1:1,64,1,1,0,2,32,8,0
128-7-7-1x1-896-7-7-16-0x0-1x1-1x1-0-NCHW-FP32-F=ConvAsm1x1U:2,8,2,32,1,4,1,4;ConvOclDirectFwd1x1:1,64,1,1,1,4,16,2048,0
60-14-14-3x3-60-28-28-16-1x1-2x2-1x1-0-NCHW-FP32-B=ConvOclDirectFwd:8,16,32,32,4,2,4,4,2
32-43-435-1x1-816-43-435-32-0x0-1x1-1x1-0-NCHW-FP32-W=ConvAsmBwdWrW1x1:4,4,4,4,2,1,1,4,0,1
48-27-27-1x1-192-27-27-128-0x0-1x1-1x1-0-NCHW-FP16-F=ConvAsm1x1U:2,8,4,64,1,4,1,4;ConvOclDirectFwd1x1:1,64,1,1,0,1,32,4,0
528-14-14-1x1-128-14-14-32-0x0-1x1-1x1-0-NCHW-FP32-F=ConvAsm1x1U:4,16,4,64,1,2,2,1;ConvOclDirectFwd1x1:1,64,1,1,1,0,16,2048,0;ConvActivAsm1x1U:3,16,7,32,1,2
256-29-29-3x3-256-57-57-16-1x1-2x2-1x1-0-NCHW-FP32-B_g32=ConvOclDirectFwd:8,16,32,32,4,2,8,1,1
2048-7-7-1x1-512-7-7-128-0x0-1x1-1x1-0-NCHW-FP16-F=ConvAsm1x1U:2,8,4,16,1,4,4,2;ConvOclDirectFwd1x1:1,256,1,1,0,1,16,4,0
256-28-28-3x3-256-28-28-8-1x1-1x1-1x1-0-NCHW-FP32-B_g32=ConvOclDirectFwd:8,32,32,32,4,1,4,2,1
288-567-858-1x1-144-567-858-2-0x0-1x1-1x1-0-NCHW-FP32-B=ConvOclDirectFwd1x1:1,256,1,1,0,2,16,4,0
896-14-14-1x1-128-14-14-512-0x0-1x1-1x1-0-NCHW-FP16-B=ConvAsm1x1U:1,16,2,16,1,2,2,4;ConvOclDirectFwd1x1:1,64,1,1,0,2,32,8,0
1-161-700-5x20-32-79-341-256-0x0-2x2-1x1-0-NCHW-FP32-F=ConvOclDirectFwd:8,32,16,32,2,1,1,1,2
48-601-13-1x1-116-601-13-8-0x0-1x1-1x1-0-NCHW-FP32-B=ConvAsm1x1U:4,4,4,4,1,2,2,8;ConvOclDirectFwd1x1:1,64,1,1,0,1,8,8,0
4-210-72-1x1-1104-210-72-6-0x0-1x1-1x1-0-NCHW-FP32-W=ConvAsmBwdWrW1x1:4,4,2,4,2,1,2,2,0,2
256-14-14-3x3-128-14-14-1-1x1-1x1-1x1-0-NCHW-FP16-B=ConvOclDirectFwd:16,16,16,16,1,1,1,4,1
416-14-14-1x1-128-14-14-64-0x0-1x1-1x1-0-NCHW-FP32-F=ConvAsm1x1U:4,16,4,64,1,2,1,1;ConvOclDirectFwd1x1:1,64,1,1,1,1,16,2048,0
1024-7-7-1x1-464-7-7-128-0x0-1x1-1x1-0-NCHW-FP32-W=ConvAsmBwdWrW1x1:1,16,4,8,4,1,1,4,0,2
96-35-35-3x3-96-35-35-256-1x1-1x1-1x1-0-NCHW-FP16-B=ConvOclDirectFwd:8,8,16,16,2,2,8,4,2
80-497-615-1x1-80-497-615-6-0x0-1x1-1x1-0-NCHW-FP32-B=ConvOclDirectFwd1x1:1,128,1,1,0,1,16,4,0
768-135-182-1x1-96-135-182-16-0x0-1x1-1x1-0-NCHW-FP32-F=ConvOclDirectFwd1x1:1,64,1,1,1,0,64,2048,0
832-7-7-1x1-128-7-7-16-0x0-1x1-1x1-0-NCHW-FP32-B=ConvAsm1x1U:1,8,1,64,1,2,4,4;ConvOclDirectFwd1x1:1,128,1,1,0,1,4,8,0
2048-7-7-1x1-512-7-7-1-0x0-1x1-1x1-0-NCHW-FP16-F=ConvAsm1x1U:1,8,2,16,1,4,4,1;ConvOclDirectFwd1x1:1,256,1,1,0,1,4,4,0
128-7-7-1x1-544-7-7-32-0x0-1x1-1x1-0-NCHW-FP16-F=ConvAsm1x1U:1,8,2,32,1,4,2,1;ConvOclDirectFwd1x1:1,64,1,1,0,1,8,4,0
232-7-7-1x1-232-7-7-256-0x0-1x1-1x1-0-NCHW-FP16-F=ConvAsm1x1U:2,8,4,16,1,4,2,1;ConvOclDirectFwd1x1:1,256,1,1,0,1,8,4,0
128-7-7-1x1-832-7-7-64-0x0-1x1-1x1-0-NCHW-FP32-B=ConvAsm1x1U:1,8,1,64,2,4,1,4;ConvOclDirectFwd1x1:1,64,1,1,0,1,16,8,0
96-35-35-3x3-64-35-35-128-1x1-1x1-1x1-0-NCHW-FP16-B=ConvOclDirectFwd:8,8,16,16,2,2,8,2,1
256-28-28-1x1-128-28-28-64-0x0-1x1-1x1-0-NCHW-FP16-W=ConvAsmBwdWrW1x1:4,4,4,1,8,2,1,4,0,1
256-14-14-1x1-128-14-14-256-0x0-1x1-1x1-0-NCHW-FP32-B=ConvAsm1x1U:1,16,1,32,2,2,1,4;ConvOclDirectFwd1x1:1,256,1,1,0,1,32,4,0
24-5-5-3x3-256-5-5-64-1x1-1x1-1x1-0-NCHW-FP32-W=ConvAsmBwdWrW3x3:0,0,8,2,5,3
64-54-54-1x1-16-54-54-128-0x0-1x1-1x1-0-NCHW-FP16-F=ConvAsm1x1U:1,16,2,64,1,2,1,1;ConvOclDirectFwd1x1:1,256,1,1,0,4,16,8,0
512-28-28-3x3-256-28-28-16-1x1-1x1-1x1-0-NCHW-FP16-F=ConvOclDirectFwd:16,16,32,32,2,2,8,1,2
32-7-7-5x5-128-7-7-64-2x2-1x1-1x1-0-NCHW-FP16-F=ConvOclDirectFwd:8,8,8,8,1,1,8,4,2;ConvOclDirectFwdFused:8,8,8,8,1,1,8,2,2
64-28-28-1x1-320-28-28-32-0x0-1x1-1x1-0-NCHW-FP16-W=ConvAsmBwdWrW1x1:4,4,4,4,2,1,4,4,0,1
192-14-14-1x1-512-14-14-2-0x0-1x1-1x1-0-NCHW-FP16-B=ConvAsm1x1U:1,8,2,32,1,4,4,1;ConvOclDirectFwd1x1:1,128,1,1,0,4,4,4,0
160-28-28-1x1-128-28-28-16-0x0-1x1-1x1-0-NCHW-FP32-B=ConvAsm1x1U:1,16,1,32,1,2,2,2;ConvOclDirectFwd1x1:16,64,32,32,0,2,16,4,1
320-7-7-3x3-160-7-7-32-1x1-1x1-1x1-0-NCHW-FP16-W=ConvAsmBwdWrW3x3:0,1,8,4,7,2
128-7-7-5x5-32-7-7-128-2x2-1x1-1x1-0-NCHW-FP32-B=ConvOclDirectFwd:8,8,8,8,1,1,4,4,2
128-56-56-1x1-224-56-56-16-0x0-1x1-1x1-0-NCHW-FP16-F=ConvAsm1x1U:1,8,2,64,2,4,1,4;ConvOclDirectFwd1x1:1,128,1,1,0,4,16,4,0
2048-8-8-1x1-320-8-8-32-0x0-1x1-1x1-0-NCHW-FP16-F=ConvAsm1x1U:1,8,2,32,2,4,2,2;ConvOclDirectFwd1x1:1,256,1,1,0,2,4,8,0
512-14-14-1x1-128-28-28-128-0x0-2x2-1x1-0-NCHW-FP32-B=ConvAsm1x1U:1,32,7,32,1,1,1,4;ConvOclDirectFwd1x1:1,256,1,1,0,1,32,4,0
128-14-14-1x1-992-14-14-16-0x0-1x1-1x1-0-NCHW-FP16-F=ConvAsm1x1U:1,8,2,16,2,4,1,4;ConvOclDirectFwd1x1:1,64,1,1,0,4,8,4,0
128-7-7-1x1-544-7-7-16-0x0-1x1-1x1-0-NCHW-FP16-W=ConvAsmBwdWrW1x1:4,4,2,4,2,1,1,2,0,1
256-56-56-1x1-512-28-28-16-0x0-2x2-1x1-0-NCHW-FP32-F=ConvAsm1x1U:2,16,3,16,2,2,2,2;ConvOclDirectFwd1x1:1,64,1,1,1,1,16,2048,0
864-14-14-1x1-128-14-14-128-0x0-1x1-1x1-0-NCHW-FP16-B=ConvAsm1x1U:1,16,2,16,1,2,4,1;ConvOclDirectFwd1x1:1,128,1,1,0,2,32,8,0
2112-209-138-1x1-960-209-138-4-0x0-1x1-1x1-0-NCHW-FP32-F=ConvOclDirectFwd1x1:1,64,1,1,1,4,16,2048,0
192-28-28-1x1-528-28-28-16-0x0-1x1-1x1-0-NCHW-FP16-B=ConvAsm1x1U:1,16,2,16,1,2,2,2;ConvOclDirectFwd1x1:1,64,1,1,0,4,16,4,0
128-14-14-1x1-512-14-14-1-0x0-1x1-1x1-0-NCHW-FP16-W=ConvAsmBwdWrW1x1:2,8,2,2,2,1,1,4,0,0
384-7-7-1x1-832-7-7-32-0x0-1x1-1x1-0-NCHW-FP32-B=ConvAsm1x1U:1,16,1,64,2,2,4,1;ConvOclDirectFwd1x1:1,64,1,1,0,1,16,8,0
192-27-27-5x5-64-27-27-512-2x2-1x1-1x1-0-NCHW-FP16-F=ConvOclDirectFwd:16,16,32,32,2,2,8,1,1
128-56-56-1x1-96-56-56-512-0x0-1x1-1x1-0-NCHW-FP32-B=ConvAsm1x1U:1,32,1,64,1,1,1,1;ConvOclDirectFwd1x1:1,64,1,1,0,1,32,4,0
64-55-55-11x11-3-224-224-2-2x2-4x4-1x1-0-NCHW-FP32-W=ConvOclBwdWrW2<1>:3,7,3,3,11;ConvOclBwdWrW2<2>:8,6,1,3,11
48-538-500-1x1-8-538-500-32-0x0-1x1-1x1-0-NCHW-FP32-W=ConvAsmBwdWrW1x1:4,4,2,1,2,1,4,4,0,1
512-14-14-3x3-512-14-14-2-1x1-1x1-1x1-0-NCHW-FP16-B=ConvOclDirectFwd:16,16,16,16,1,1,4,4,2
64-54-54-3x3-3-108-108-64-1x1-2x2-1x1-0-NCHW-FP32-B=ConvOclDirectFwd:8,8,32,32,4,4,2,2,2
32-27-27-1x1-256-27-27-64-0x0-1x1-1x1-0-NCHW-FP32-F=ConvAsm1x1U:2,16,2,64,2,2,2,1;ConvOclDirectFwd1x1:1,64,1,1,1,1,32,256,0
320-14-14-1x1-128-14-14-32-0x0-1x1-1x1-0-NCHW-FP32-F=ConvAsm1x1U:4,8,4,64,1,2,2,2;ConvOclDirectFwd1x1:1,64,1,1,1,1,16,2048,0
512-29-29-1x1-256-57-57-4-0x0-2x2-1x1-0-NCHW-FP32-W=ConvAsmBwdWrW1x1:1,16,2,8,2,1,1,4,0,2
384-8-8-3x3-448-8-8-1-1x1-1x1-1x1-0-NCHW-FP32-W=ConvAsmBwdWrW3x3:0,1,8,4,3,1
352-776-44-1x1-2112-776-44-1-0x0-1x1-1x1-0-NCHW-FP32-B=ConvOclDirectFwd1x1:1,64,1,1,0,2,32,4,0
96-28-28-1x1-192-28-28-8-0x0-1x1-1x1-0-NCHW-FP16-W=ConvAsmBwdWrW1x1:4,4,2,4,2,1,4,4,0,1
1024-7-7-1x1-464-7-7-32-0x0-1x1-1x1-0-NCHW-FP32-B=ConvAsm1x1U:1,16,1,64,3,2,4,1;ConvOclDirectFwd1x1:1,256,1,1,0,1,8,4,0
54-737-34-1x1-116-737-34-16-0x0-1x1-1x1-0-NCHW-FP32-B=ConvAsm1x1U:1,4,3,4,1,1,1,4;ConvOclDirectFwd1x1:1,256,1,1,0,2,16,4,0
1280-150-38-1x1-2048-150-38-4-0x0-1x1-1x1-0-NCHW-FP32-W=ConvAsmBwdWrW1x1:1,16,2,8,8,1,1,4,0,0
128-28-28-3x3-96-28-28-512-1x1-1x1-1x1-0-NCHW-FP16-W=ConvAsmBwdWrW3x3:0,1,8,2,3,8
512-28-28-1x1-128-28-28-256-0x0-1x1-1x1-0-NCHW-FP16-B=ConvAsm1x1U:1,16,2,16,1,2,1,4;ConvOclDirectFwd1x1:1,256,1,1,0,4,16,4,0
128-7-7-1x1-992-7-7-128-0x0-1x1-1x1-0-NCHW-FP16-B=ConvAsm1x1U:2,8,4,16,1,4,1,4;ConvOclDirectFwd1x1:1,256,1,1,0,1,8,4,0
3-108-108-3x3-64-54-54-128-1x1-2x2-1x1-0-NCHW-FP32-F=ConvOclDirectFwd:16,16,16,16,1,1,8,2,1
1024-14-14-1x1-512-7-7-2-0x0-2x2-1x1-0-NCHW-FP16-F=ConvAsm1x1U:1,8,2,16,1,4,4,1;ConvOclDirectFwd1x1:1,128,1,1,0,1,4,8,0
192-14-14-1x1-576-14-14-16-0x0-1x1-1x1-0-NCHW-FP16-B=ConvAsm1x1U:1,16,2,16,1,2,2,2;ConvOclDirectFwd1x1:1,256,1,1,0,4,16,4,0
320-28-28-1x1-128-28-28-16-0x0-1x1-1x1-0-NCHW-FP16-F=ConvAsm1x1U:1,8,2,32,1,4,1,4;ConvOclDirectFwd1x1:1,64,1,1,0,2,8,4,0
384-17-17-1x1-1024-17-17-256-0x0-1x1-1x1-0-NCHW-FP32-W=ConvAsmBwdWrW1x1:1,16,4,8,4,1,1,2,0,1
192-28-28-5x5-32-28-28-16-2x2-1x1-1x1-0-NCHW-FP32-F=ConvOclDirectFwd:16,16,32,32,2,2,2,1,2
480-479-435-1x1-32-479-435-4-0x0-1x1-1x1-0-NCHW-FP32-F=ConvOclDirectFwd1x1:1,64,1,1,1,4,64,2048,0
528-590-757-1x1-384-590-757-2-0x0-1x1-1x1-0-NCHW-FP32-F=ConvOclDirectFwd1x1:1,64,1,1,1,4,32,2048,0
64-224-224-3x3-64-224-224-8-1x1-1x1-1x1-0-NCHW-FP16-W=ConvAsmBwdWrW3x3:0,0,16,2,1,1
512-4-4-3x3-512-7-7-32-1x1-2x2-1x1-0-NCHW-FP32-B=ConvOclDirectFwd:8,8,8,8,1,1,2,2,1
512-782-595-1x1-54-782-595-1-0x0-1x1-1x1-0-NCHW-FP32-F=ConvOclDirectFwd1x1:1,256,1,1,0,2,16,4,0
288-35-35-1x1-48-35-35-256-0x0-1x1-1x1-0-NCHW-FP16-B=ConvAsm1x1U:1,16,2,64,1,2,1,1;ConvOclDirectFwd1x1:1,128,1,1,0,1,16,4,0
1024-1-1-1x1-1024-1-1-800-0x0-1x1-1x1-0-NCHW-FP32-F=ConvAsm1x1U:1,8,1,16,4,4,4,1;ConvOclDirectFwd1x1:1,64,1,1,1,4,32,2048,0
1024-17-17-1x1-384-17-17-4-0x0-1x1-1x1-0-NCHW-FP32-F=ConvAsm1x1U:4,8,5,64,2,2,2,2;ConvOclDirectFwd1x1:1,64,1,1,1,4,32,256,0;ConvActivAsm1x1U:4,16,5,64,2,4
232-53-136-1x1-2-53-136-4-0x0-1x1-1x1-0-NCHW-FP32-W=ConvAsmBwdWrW1x1:4,4,2,2,2,1,4,4,0,2
120-7-7-3x3-120-14-14-32-1x1-2x2-1x1-0-NCHW-FP16-W=ConvAsmBwdWrW3x3:0,0,8,2,5,4
128-56-56-1x1-256-56-56-512-0x0-1x1-1x1-0-NCHW-FP32-W=ConvAsmBwdWrW1x1:2,8,4,4,4,1,4,4,0,0
192-27-27-5x5-64-27-27-512-2x2-1x1-1x1-0-NCHW-FP16-W=ConvOclBwdWrW2<1>:1,9,3,3,7;ConvOclBwdWrW2<2>:1,7,1,8,7;ConvOclBwdWrW2<4>:1,10,1,8,9;ConvOclBwdWrW2<16>:1,11,1,8,7;ConvOclBwdWrW2<8>:1,7,1,8,7
160-28-28-1x1-128-28-28-256-0x0-1x1-1x1-0-NCHW-FP32-B=ConvAsm1x1U:1,32,1,32,1,1,1,1;ConvOclDirectFwd1x1:1,128,1,1,0,1,32,4,0
384-7-7-1x1-832-7-7-128-0x0-1x1-1x1-0-NCHW-FP32-B=ConvAsm1x1U:1,16,1,64,4,2,2,2;ConvOclDirectFwd1x1:1,128,1,1,0,1,16,4,0
128-14-14-1x1-704-14-14-32-0x0-1x1-1x1-0-NCHW-FP16-B=ConvAsm1x1U:1,16,2,16,1,2,2,2;ConvOclDirectFwd1x1:1,128,1,1,0,4,8,4,0
928-968-25-1x1-736-968-25-4-0x0-1x1-1x1-0-NCHW-FP32-F=ConvOclDirectFwd1x1:1,64,1,1,1,4,64,2048,0
416-14-14-1x1-128-14-14-32-0x0-1x1-1x1-0-NCHW-FP16-W=ConvAsmBwdWrW1x1:2,8,4,4,2,1,2,4,0,1
512-7-7-1x1-2048-7-7-1-0x0-1x1-1x1-0-NCHW-FP32-B=ConvAsm1x1U:1,8,1,64,1,4,2,2;ConvOclDirectFwd1x1:1,64,1,1,0,1,4,8,0
512-28-28-3x3-512-28-28-512-1x1-1x1-1x1-0-NCHW-FP32-W=ConvAsmBwdWrW3x3:0,1,8,8,2,1
192-17-17-3x3-320-8-8-1-0x0-2x2-1x1-0-NCHW-FP32-F=ConvOclDirectFwd:8,8,8,8,1,1,1,4,1
64-27-27-1x1-384-27-27-512-0x0-1x1-1x1-0-NCHW-FP32-W=ConvAsmBwdWrW1x1:2,8,2,8,4,1,4,4,0,1
60-14-14-3x3-60-28-28-128-1x1-2x2-1x1-0-NCHW-FP32-W=ConvAsmBwdWrW3x3:0,0,16,4,5,2
256-7-7-3x3-256-14-14-128-1x1-2x2-1x1-0-NCHW-FP16-W=ConvAsmBwdWrW3x3:0,0,8,4,4,1
256-56-56-3x3-128-56-56-8-1x1-1x1-1x1-0-NCHW-FP16-W=ConvAsmBwdWrW3x3:0,0,8,2,1,4
2048-7-7-1x1-1024-4-4-16-0x0-2x2-1x1-0-NCHW-FP16-F=ConvAsm1x1U:2,4,4,4,1,4,2,2;ConvOclDirectFwd1x1:1,256,1,1,0,2,8,8,0
1536-8-8-1x1-256-8-8-8-0x0-1x1-1x1-0-NCHW-FP32-F=ConvAsm1x1U:2,8,2,32,1,4,4,1;ConvOclDirectFwd1x1:1,64,1,1,1,0,16,256,0;ConvActivAsm1x1U:1,16,1,32,2,4
54-117-167-1x1-672-117-167-12-0x0-1x1-1x1-0-NCHW-FP32-B=ConvOclDirectFwd1x1:1,64,1,1,0,1,32,4,0
1968-180-615-1x1-112-180-615-2-0x0-1x1-1x1-0-NCHW-FP32-F=ConvOclDirectFwd1x1:1,64,1,1,1,0,32,128,0
32-28-28-5x5-96-28-28-256-2x2-1x1-1x1-0-NCHW-FP16-F=ConvOclDirectFwd:16,16,32,32,2,2,8,1,2;ConvOclDirectFwdFused:16,16,32,32,2,2,8,1,2
1024-7-7-3x3-1024-7-7-48-1x1-1x1-1x1-0-NCHW-FP32-W_g32=ConvOclBwdWrW2<4>:1,7,8,1,7;ConvOclBwdWrW2<16>:1,7,8,1,7;ConvOclBwdWrW2<8>:1,7,8,1,7;ConvOclBwdWrW2<1>:1,7,8,1,7;ConvOclBwdWrW2<2>:1,7,8,1,7;ConvAsmBwdWrW3x3:0,1,8,4,6,1
128-14-14-1x1-576-14-14-32-0x0-1x1-1x1-0-NCHW-FP32-F=ConvAsm1x1U:4,8,4,64,1,2,1,4;ConvOclDirectFwd1x1:1,64,1,1,1,1,16,2048,0
128-7-7-1x1-704-7-7-128-0x0-1x1-1x1-0-NCHW-FP16-B=ConvAsm1x1U:1,16,2,16,1,2,2,2;ConvOclDirectFwd1x1:1,128,1,1,0,1,8,4,0
128-14-14-1x1-992-14-14-512-0x0-1x1-1x1-0-NCHW-FP16-W=ConvAsmBwdWrW1x1:2,8,4,8,2,1,2,4,0,1
464-7-7-1x1-1024-7-7-1-0x0-1x1-1x1-0-NCHW-FP32-F=ConvAsm1x1U:1,8,1,64,1,4,2,1;ConvOclDirectFwd1x1:1,64,1,1,1,1,16,64,0
416-457-352-1x1-160-457-352-6-0x0-1x1-1x1-0-NCHW-FP32-F=ConvOclDirectFwd1x1:1,64,1,1,1,4,64,2048,0
864-7-7-1x1-128-7-7-16-0x0-1x1-1x1-0-NCHW-FP16-B=ConvAsm1x1U:1,8,2,32,1,4,4,2;ConvOclDirectFwd1x1:1,64,1,1,0,1,4,8,0
1280-718-9-1x1-224-718-9-12-0x0-1x1-1x1-0-NCHW-FP32-B=ConvOclDirectFwd1x1:1,256,1,1,0,2,32,4,0
16-28-28-1x1-192-28-28-8-0x0-1x1-1x1-0-NCHW-FP32-B=ConvAsm1x1U:1,8,1,16,1,4,1,1;ConvOclDirectFwd1x1:1,128,1,1,0,1,8,4,0
128-14-14-1x1-800-14-14-16-0x0-1x1-1x1-0-NCHW-FP16-W=ConvAsmBwdWrW1x1:4,4,4,4,4,1,1,2,0,1
256-13-13-3x3-256-13-13-128-1x1-1x1-1x1-0-NCHW-FP16-W=ConvAsmBwdWrW3x3:0,1,8,4,3,1
1024-7-7-3x3-1024-7-7-32-1x1-1x1-1x1-0-NCHW-FP32-B_g32=ConvOclDirectFwd:8,8,8,8,1,1,8,4,2
1888-42-219-1x1-58-42-219-1-0x0-1x1-1x1-0-NCHW-FP32-F=ConvOclDirectFwd1x1:1,256,1,1,0,2,8,4,0
256-29-29-1x1-512-29-29-48-0x0-1x1-1x1-0-NCHW-FP32-B=ConvAsm1x1U:3,16,3,64,1,2,2,2;ConvOclDirectFwd1x1:1,256,1,1,0,1,32,4,0
256-56-56-1x1-64-56-56-48-0x0-1x1-1x1-0-NCHW-FP32-B=ConvAsm1x1U:1,32,5,64,1,1,1,2;ConvOclDirectFwd1x1:1,256,1,1,0,1,32,4,0
576-7-7-1x1-128-7-7-16-0x0-1x1-1x1-0-NCHW-FP32-B=ConvAsm1x1U:1,8,1,64,1,4,4,4;ConvOclDirectFwd1x1:1,128,1,1,0,1,4,8,0
64-957-4-1x1-768-957-4-12-0x0-1x1-1x1-0-NCHW-FP32-B=ConvAsm1x1U:1,16,1,64,1,2,2,2;ConvOclDirectFwd1x1:1,128,1,1,0,2,32,4,0
480-14-14-1x1-128-14-14-64-0x0-1x1-1x1-0-NCHW-FP16-F=ConvAsm1x1U:2,8,4,64,1,4,2,4;ConvOclDirectFwd1x1:1,64,1,1,0,4,8,4,0
256-14-14-3x3-256-14-14-8-1x1-1x1-1x1-0-NCHW-FP16-F=ConvOclDirectFwd:16,8,16,16,1,2,4,2,2;ConvOclDirectFwdFused:16,8,16,16,1,2,4,2,2
528-14-14-1x1-256-14-14-512-0x0-1x1-1x1-0-NCHW-FP16-F=ConvAsm1x1U:1,16,2,16,2,2,1,4;ConvOclDirectFwd1x1:1,128,1,1,0,2,16,4,0
256-56-56-3x3-256-28-28-6-1x1-2x2-1x1-0-NCHW-FP32-F_g32=ConvOclDirectFwd:32,8,32,16,1,2,8,1,1
1200-914-188-1x1-320-914-188-2-0x0-1x1-1x1-0-NCHW-FP32-F=ConvOclDirectFwd1x1:1,64,1,1,1,0,32,2048,0
528-14-14-1x1-32-14-14-512-0x0-1x1-1x1-0-NCHW-FP16-F=ConvAsm1x1U:2,8,4,64,1,4,2,2;ConvOclDirectFwd1x1:1,64,1,1,0,4,16,4,0
128-14-14-1x1-832-14-14-64-0x0-1x1-1x1-0-NCHW-FP16-B=ConvAsm1x1U:1,16,2,16,1,2,1,4;ConvOclDirectFwd1x1:1,128,1,1,0,4,16,4,0
832-374-1-1x1-704-374-1-48-0x0-1x1-1x1-0-NCHW-FP32-B=ConvAsm1x1U:3,16,3,64,1,2,2,2;ConvOclDirectFwd1x1:1,256,1,1,0,2,32,4,0
1024-8-8-3x3-1024-15-15-1-1x1-2x2-1x1-0-NCHW-FP32-B_g32=ConvOclDirectFwd:8,16,16,16,2,1,1,4,1
3-906-813-1x1-256-906-813-2-0x0-1x1-1x1-0-NCHW-FP32-B=ConvOclDirectFwd1x1:1,256,1,1,0,2,32,4,0
32-28-28-1x1-192-28-28-16-0x0-1x1-1x1-0-NCHW-FP32-B=ConvAsm1x1U:1,16,1,32,1,2,2,1;ConvOclDirectFwd1x1:1,256,1,1,0,1,8,4,0
256-13-13-1x1-64-13-13-64-0x0-1x1-1x1-0-NCHW-FP32-B=ConvAsm1x1U:3,16,3,64,1,2,2,2;ConvOclDirectFwd1x1:1,256,1,1,0,1,8,4,0
800-495-239-1x1-448-495-239-4-0x0-1x1-1x1-0-NCHW-FP32-B=ConvOclDirectFwd1x1:1,128,1,1,0,1,32,4,0
32-60-71-1x1-2048-60-71-48-0x0-1x1-1x1-0-NCHW-FP32-B=ConvOclDirectFwd1x1:1,256,1,1,0,2,32,4,0
64-13-13-1x1-512-13-13-256-0x0-1x1-1x1-0-NCHW-FP16-B=ConvAsm1x1U:3,8,6,32,1,4,1,2;ConvOclDirectFwd1x1:1,64,1,1,0,1,64,4,0
64-80-349-5x5-1-161-700-2-1x1-2x2-1x1-0-NCHW-FP32-B=ConvOclDirectFwd:8,16,32,32,4,2,1,4,1
128-7-7-1x1-896-7-7-64-0x0-1x1-1x1-0-NCHW-FP32-B=ConvAsm1x1U:1,16,1,64,2,2,2,2;ConvOclDirectFwd1x1:1,256,1,1,0,1,8,4,0
256-7-7-1x1-832-7-7-32-0x0-1x1-1x1-0-NCHW-FP16-W=ConvAsmBwdWrW1x1:1,16,2,8,2,1,2,4,0,0
128-54-54-1x1-16-54-54-32-0x0-1x1-1x1-0-NCHW-FP32-F=ConvAsm1x1U:2,8,2,64,2,1,1,1;ConvOclDirectFwd1x1:1,64,1,1,1,1,32,128,0
160-56-56-1x1-128-56-56-128-0x0-1x1-1x1-0-NCHW-FP32-W=ConvAsmBwdWrW1x1:2,8,4,4,4,1,4,4,0,2
128-7-7-1x1-832-7-7-8-0x0-1x1-1x1-0-NCHW-FP16-B=ConvAsm1x1U:1,8,2,16,1,4,2,2;ConvOclDirectFwd1x1:1,64,1,1,0,1,4,4,0
16-14-14-5x5-48-14-14-32-2x2-1x1-1x1-0-NCHW-FP32-F=ConvOclDirectFwd:8,8,16,16,2,2,2,2,2;ConvOclDirectFwdFused:8,8,16,16,2,2,2,1,2
512-8-8-3x3-512-15-15-256-1x1-2x2-1x1-0-NCHW-FP32-W=ConvAsmBwdWrW3x3:0,0,8,8,2,1
1-793-251-1x1-19-793-251-16-0x0-1x1-1x1-0-NCHW-FP32-F=ConvAsm1x1U:3,16,4,16,1,1,1,1;ConvOclDirectFwd1x1:1,128,1,1,0,1,16,4,0
336-28-28-1x1-192-28-28-16-0x0-1x1-1x1-0-NCHW-FP16-F=ConvAsm1x1U:1,8,2,32,2,4,2,2;ConvOclDirectFwd1x1:16,64,32,32,0,2,16,4,1
128-7-7-3x3-32-7-7-256-1x1-1x1-1x1-0-NCHW-FP32-W=ConvAsmBwdWrW3x3:0,1,8,2,7,4
384-8-8-1x1-2048-8-8-512-0x0-1x1-1x1-0-NCHW-FP16-B=ConvAsm1x1U:1,16,2,16,1,2,1,2;ConvOclDirectFwd1x1:1,128,1,1,0,4,16,8,0
1776-112-260-1x1-960-112-260-2-0x0-1x1-1x1-0-NCHW-FP32-F=ConvOclDirectFwd1x1:1,64,1,1,1,0,16,2048,0
480-14-14-1x1-16-14-14-256-0x0-1x1-1x1-0-NCHW-FP16-W=ConvAsmBwdWrW1x1:4,4,4,2,4,2,4,4,0,2
128-71-191-1x1-96-71-191-1-0x0-1x1-1x1-0-NCHW-FP32-F=ConvAsm1x1U:2,16,2,64,1,2,1,2;ConvOclDirectFwd1x1:1,64,1,1,1,0,16,256,0
96-56-56-1x1-128-56-56-32-0x0-1x1-1x1-0-NCHW-FP16-W=ConvAsmBwdWrW1x1:4,4,8,1,8,1,4,4,0,1
160-14-14-1x1-528-14-14-32-0x0-1x1-1x1-0-NCHW-FP32-W=ConvAsmBwdWrW1x1:1,16,2,4,8,1,2,4,0,1
128-54-54-1x1-32-54-54-512-0x0-1x1-1x1-0-NCHW-FP32-F=ConvAsm1x1U:3,8,3,64,4,2,1,2;ConvOclDirectFwd1x1:1,64,1,1,1,0,32,256,0
192-601-172-1x1-1008-601-172-1-0x0-1x1-1x1-0-NCHW-FP32-B=ConvOclDirectFwd1x1:1,256,1,1,0,4,16,4,0
672-137-327-1x1-24-137-327-4-0x0-1x1-1x1-0-NCHW-FP32-F=ConvOclDirectFwd1x1:1,256,1,1,0,1,16,8,0
256-14-14-1x1-128-14-14-32-0x0-1x1-1x1-0-NCHW-FP32-B=ConvAsm1x1U:2,16,2,64,1,2,2,2;ConvOclDirectFwd1x1:1,256,1,1,0,2,16,4,0
512-14-14-1x1-64-14-14-1-0x0-1x1-1x1-0-NCHW-FP32-F=ConvAsm1x1U:1,8,1,64,1,4,4,1;ConvOclDirectFwd1x1:1,64,1,1,1,4,16,64,0;ConvActivAsm1x1U:1,16,1,16,1,3
512-610-86-1x1-24-610-86-6-0x0-1x1-1x1-0-NCHW-FP32-F=ConvOclDirectFwd1x1:1,256,1,1,0,4,16,8,0
1024-14-14-1x1-512-7-7-1-0x0-2x2-1x1-0-NCHW-FP16-F=ConvAsm1x1U:1,8,2,16,1,4,4,1;ConvOclDirectFwd1x1:1,64,1,1,0,1,4,8,0
192-17-17-1x1-768-17-17-16-0x0-1x1-1x1-0-NCHW-FP16-B=ConvAsm1x1U:1,16,2,16,1,2,2,2;ConvOclDirectFwd1x1:1,256,1,1,0,1,8,4,0
832-7-7-1x1-48-7-7-4-0x0-1x1-1x1-0-NCHW-FP16-F=ConvAsm1x1U:1,8,2,32,1,4,4,1;ConvOclDirectFwd1x1:1,64,1,1,0,1,4,8,0
256-28-28-3x3-512-28-28-16-1x1-1x1-1x1-0-NCHW-FP32-W=ConvAsmBwdWrW3x3:0,1,8,4,3,1
240-14-14-1x1-60-14-14-256-0x0-1x1-1x1-0-NCHW-FP32-B_g3=ConvOclDirectFwd:16,8,16,8,1,1,8,2,1
1-1021-201-1x1-1296-1021-201-1-0x0-1x1-1x1-0-NCHW-FP32-B=ConvOclDirectFwd1x1:1,128,1,1,0,1,4,4,0
96-109-109-7x7-3-224-224-16-0x0-2x2-1x1-0-NCHW-FP32-B=ConvOclDirectFwd:16,16,32,32,2,2,8,2,1
232-14-14-1x1-232-14-14-4-0x0-1x1-1x1-0-NCHW-FP32-W=ConvAsmBwdWrW1x1:1,16,2,4,2,1,2,4,0,1
128-479-535-1x1-48-479-535-16-0x0-1x1-1x1-0-NCHW-FP32-F=ConvOclDirectFwd1x1:16,16,32,32,1,0,32,128,1
608-340-69-1x1-800-340-69-4-0x0-1x1-1x1-0-NCHW-FP32-F=ConvOclDirectFwd1x1:1,64,1,1,1,4,64,2048,0
128-28-28-1x1-384-28-28-256-0x0-1x1-1x1-0-NCHW-FP16-F=ConvAsm1x1U:1,8,2,16,2,4,1,4;ConvOclDirectFwd1x1:1,128,1,1,0,4,16,4,0
256-28-28-3x3-256-28-28-48-1x1-1x1-1x1-0-NCHW-FP32-B_g32=ConvOclDirectFwd:8,16,32,32,4,2,8,1,1
64-317-18-1x1-320-317-18-128-0x0-1x1-1x1-0-NCHW-FP32-B=ConvAsm1x1U:1,16,1,64,1,1,1,1;ConvOclDirectFwd1x1:1,64,1,1,0,2,32,4,0
1008-225-125-1x1-8-225-125-8-0x0-1x1-1x1-0-NCHW-FP32-F=ConvOclDirectFwd1x1:1,256,1,1,0,1,16,4,0
192-56-56-1x1-128-56-56-64-0x0-1x1-1x1-0-NCHW-FP32-W=ConvAsmBwdWrW1x1:2,8,2,4,8,1,4,4,0,2
96-14-14-1x1-480-14-14-256-0x0-1x1-1x1-0-NCHW-FP32-W=ConvAsmBwdWrW1x1:1,16,2,4,8,1,4,4,0,1
2048-32-32-1x1-512-32-32-4-0x0-1x1-1x1-0-NCHW-FP32-B=ConvAsm1x1U:2,16,4,64,1,2,2,2;ConvOclDirectFwd1x1:1,64,1,1,0,4,16,4,0
60-14-14-1x1-240-14-14-64-0x0-1x1-1x1-0-NCHW-FP16-F_g3=ConvOclDirectFwd:16,16,16,16,1,1,8,2,1
192-8-8-1x1-2048-8-8-16-0x0-1x1-1x1-0-NCHW-FP32-W=ConvAsmBwdWrW1x1:2,8,4,4,4,1,1,4,0,0
58-56-56-1x1-24-56-56-256-0x0-1x1-1x1-0-NCHW-FP32-B=ConvAsm1x1U:1,8,3,64,2,1,4,1;ConvOclDirectFwd1x1:1,128,1,1,0,4,16,4,0
48-35-35-1x1-192-35-35-8-0x0-1x1-1x1-0-NCHW-FP32-W=ConvAsmBwdWrW1x1:2,8,2,4,4,1,4,4,0,1
128-7-7-1x1-1056-7-7-64-0x0-1x1-1x1-0-NCHW-FP16-B=ConvAsm1x1U:1,16,2,32,1,2,2,2;ConvOclDirectFwd1x1:1,128,1,1,0,1,8,4,0
19-785-512-1x1-58-785-512-12-0x0-1x1-1x1-0-NCHW-FP32-B=ConvOclDirectFwd1x1:1,128,1,1,0,1,16,4,0
32-7-7-1x1-832-7-7-512-0x0-1x1-1x1-0-NCHW-FP16-B=ConvAsm1x1U:1,16,2,32,1,2,1,2;ConvOclDirectFwd1x1:1,64,1,1,0,1,8,4,0
128-14-14-1x1-864-14-14-256-0x0-1x1-1x1-0-NCHW-FP16-F=ConvAsm1x1U:1,8,2,16,2,4,1,4;ConvOclDirectFwd1x1:1,128,1,1,0,4,16,4,0
384-8-8-1x1-1280-8-8-64-0x0-1x1-1x1-0-NCHW-FP16-B=ConvAsm1x1U:1,16,2,32,1,2,2,4;ConvOclDirectFwd1x1:1,64,1,1,0,4,16,4,0
256-14-14-1x1-528-14-14-512-0x0-1x1-1x1-0-NCHW-FP16-B=ConvAsm1x1U:1,16,2,16,1,2,1,2;ConvOclDirectFwd1x1:8,64,16,16,0,2,16,4,1
1152-713-164-1x1-640-713-164-2-0x0-1x1-1x1-0-NCHW-FP32-F=ConvOclDirectFwd1x1:1,64,1,1,1,1,16,2048,0
1104-75-555-1x1-1376-75-555-4-0x0-1x1-1x1-0-NCHW-FP32-B=ConvOclDirectFwd1x1:1,256,1,1,0,1,32,4,0
320-14-14-3x3-160-14-14-64-1x1-1x1-1x1-0-NCHW-FP16-W=ConvAsmBwdWrW3x3:0,1,8,2,3,4
128-14-14-1x1-416-14-14-16-0x0-1x1-1x1-0-NCHW-FP32-F=ConvAsm1x1U:2,8,2,16,2,4,1,4;ConvOclDirectFwd1x1:1,64,1,1,1,1,16,256,0
256-57-57-1x1-128-57-57-2-0x0-1x1-1x1-0-NCHW-FP32-F=ConvAsm1x1U:2,16,2,64,2,2,2,1;ConvOclDirectFwd1x1:1,64,1,1,1,1,16,256,0
512-7-7-3x3-512-14-14-32-1x1-2x2-1x1-0-NCHW-FP32-B=ConvOclDirectFwd:8,16,8,16,1,1,2,2,2
704-538-109-1x1-1104-538-109-6-0x0-1x1-1x1-0-NCHW-FP32-F=ConvOclDirectFwd1x1:1,64,1,1,1,0,64,2048,0
416-28-28-1x1-128-28-28-256-0x0-1x1-1x1-0-NCHW-FP32-F=ConvAsm1x1U:3,16,5,16,1,2,1,4;ConvOclDirectFwd1x1:1,64,1,1,1,0,32,2048,0
64-73-73-1x1-160-73-73-4-0x0-1x1-1x1-0-NCHW-FP16-B=ConvAsm1x1U:1,16,2,32,1,2,2,2;ConvOclDirectFwd1x1:1,256,1,1,0,1,4,4,0
672-14-14-1x1-128-14-14-32-0x0-1x1-1x1-0-NCHW-FP16-F=ConvAsm1x1U:2,8,4,64,1,4,4,2;ConvOclDirectFwd1x1:1,64,1,1,0,4,8,4,0
128-28-28-1x1-160-28-28-64-0x0-1x1-1x1-0-NCHW-FP16-B=ConvAsm1x1U:1,16,2,16,1,2,2,2;ConvOclDirectFwd1x1:1,64,1,1,0,4,16,4,0
912-370-937-1x1-416-370-937-1-0x0-1x1-1x1-0-NCHW-FP32-F=ConvOclDirectFwd1x1:1,64,1,1,1,1,64,2048,0
128-28-28-1x1-256-56-56-8-0x0-2x2-1x1-0-NCHW-FP32-B=ConvAsm1x1U:1,16,1,32,1,2,1,1;ConvOclDirectFwd1x1:1,64,1,1,0,1,32,4,0
1920-289-45-1x1-544-289-45-4-0x0-1x1-1x1-0-NCHW-FP32-F=ConvOclDirectFwd1x1:1,64,1,1,1,4,64,2048,0
32-35-35-1x1-192-35-35-8-0x0-1x1-1x1-0-NCHW-FP16-B=ConvAsm1x1U:1,16,2,64,1,2,1,2;ConvOclDirectFwd1x1:1,256,1,1,0,1,16,8,0
448-211-146-1x1-240-211-146-2-0x0-1x1-1x1-0-NCHW-FP32-B=ConvOclDirectFwd1x1:1,256,1,1,0,2,16,4,0
96-35-35-1x1-384-35-35-256-0x0-1x1-1x1-0-NCHW-FP32-W=ConvAsmBwdWrW1x1:1,16,2,4,8,1,4,4,0,2
352-14-14-1x1-128-14-14-64-0x0-1x1-1x1-0-NCHW-FP32-F=ConvAsm1x1U:4,8,7,32,2,2,1,4;ConvOclDirectFwd1x1:1,64,1,1,1,1,16,2048,0
128-7-7-1x1-928-7-7-16-0x0-1x1-1x1-0-NCHW-FP32-F=ConvAsm1x1U:1,8,1,64,2,4,1,8;ConvOclDirectFwd1x1:1,64,1,1,1,0,16,256,0
96-28-28-1x1-192-28-28-128-0x0-1x1-1x1-0-NCHW-FP16-B=ConvAsm1x1U:1,16,2,16,1,2,1,4;ConvOclDirectFwd1x1:1,64,1,1,0,4,16,4,0
544-14-14-1x1-128-14-14-64-0x0-1x1-1x1-0-NCHW-FP16-B=ConvAsm1x1U:1,16,2,16,1,2,4,2;ConvOclDirectFwd1x1:1,64,1,1,0,4,8,4,0
384-35-35-1x1-96-35-35-4-0x0-1x1-1x1-0-NCHW-FP16-F=ConvAsm1x1U:2,8,4,64,1,4,4,2;ConvOclDirectFwd1x1:1,64,1,1,0,1,8,8,0
128-56-56-3x3-256-56-56-16-1x1-1x1-1x1-0-NCHW-FP16-B=ConvOclDirectFwd:16,16,32,32,2,2,8,1,2
128-14-14-1x1-640-14-14-16-0x0-1x1-1x1-0-NCHW-FP16-B=ConvAsm1x1U:1,16,2,16,1,2,2,2;ConvOclDirectFwd1x1:1,64,1,1,0,4,8,4,0
64-39-800-1x1-128-39-800-48-0x0-1x1-1x1-0-NCHW-FP32-F=ConvAsm1x1U:1,16,1,64,3,2,1,4;ConvOclDirectFwd1x1:1,64,1,1,1,4,64,2048,0
480-648-13-1x1-336-648-13-8-0x0-1x1-1x1-0-NCHW-FP32-W=ConvAsmBwdWrW1x1:2,8,4,4,8,1,1,4,0,1
480-14-14-1x1-16-14-14-64-0x0-1x1-1x1-0-NCHW-FP16-F=ConvAsm1x1U:1,8,2,64,1,4,4,2;ConvOclDirectFwd1x1:1,256,1,1,0,4,4,4,0
256-8-8-1x1-1536-8-8-1-0x0-1x1-1x1-0-NCHW-FP32-B=ConvAsm1x1U:1,8,1,64,1,4,4,4;ConvOclDirectFwd1x1:1,256,1,1,0,1,4,8,0
128-25-107-1x1-96-25-107-128-0x0-1x1-1x1-0-NCHW-FP32-W=ConvAsmBwdWrW1x1:4,4,4,2,8,1,4,4,0,1
64-14-14-1x1-480-14-14-16-0x0-1x1-1x1-0-NCHW-FP32-B=ConvAsm1x1U:1,16,1,64,2,2,2,2;ConvOclDirectFwd1x1:1,64,1,1,0,4,16,4,0
384-17-17-3x3-384-35-35-16-0x0-2x2-1x1-0-NCHW-FP16-B=ConvOclDirectFwd:8,16,16,16,2,1,4,1,1
384-17-17-3x3-384-35-35-128-0x0-2x2-1x1-0-NCHW-FP32-B=ConvOclDirectFwd:16,16,16,16,1,1,4,1,1
128-28-28-1x1-192-28-28-64-0x0-1x1-1x1-0-NCHW-FP16-B=ConvAsm1x1U:1,16,2,16,1,2,2,2;ConvOclDirectFwd1x1:1,64,1,1,0,4,16,4,0
240-14-14-1x1-60-14-14-1-0x0-1x1-1x1-0-NCHW-FP32-B_g3=ConvOclDirectFwd:8,8,8,8,1,1,2,4,1
128-28-28-1x1-384-28-28-512-0x0-1x1-1x1-0-NCHW-FP32-W=ConvAsmBwdWrW1x1:2,8,4,4,4,2,2,4,0,1
232-14-14-1x1-232-14-14-64-0x0-1x1-1x1-0-NCHW-FP16-F=ConvAsm1x1U:1,8,2,16,2,4,1,4;ConvOclDirectFwd1x1:1,64,1,1,0,4,16,4,0
8-392-465-1x1-8-392-465-8-0x0-1x1-1x1-0-NCHW-FP32-W=ConvAsmBwdWrW1x1:4,4,2,1,2,1,4,4,0,1
320-8-8-1x1-1280-8-8-64-0x0-1x1-1x1-0-NCHW-FP32-W=ConvAsmBwdWrW1x1:1,16,2,8,4,1,1,4,0,1
128-14-14-1x1-704-14-14-512-0x0-1x1-1x1-0-NCHW-FP16-B=ConvAsm1x1U:1,16,2,16,1,2,1,4;ConvOclDirectFwd1x1:1,256,1,1,0,2,16,4,0
128-28-28-3x3-128-14-14-512-1x1-2x2-1x1-0-NCHW-FP32-F=ConvOclDirectFwd:16,8,16,16,1,2,8,1,2
896-14-14-1x1-128-14-14-64-0x0-1x1-1x1-0-NCHW-FP16-B=ConvAsm1x1U:1,16,2,16,1,2,4,1;ConvOclDirectFwd1x1:1,64,1,1,0,2,8,4,0
704-14-14-1x1-128-14-14-512-0x0-1x1-1x1-0-NCHW-FP16-B=ConvAsm1x1U:1,16,2,16,1,2,1,8;ConvOclDirectFwd1x1:1,128,1,1,0,2,32,8,0
832-14-14-1x1-128-14-14-64-0x0-1x1-1x1-0-NCHW-FP16-W=ConvAsmBwdWrW1x1:2,8,4,8,2,2,2,4,0,1
512-256-256-1x1-12-256-256-4-0x0-1x1-1x1-0-NCHW-FP32-F=ConvOclDirectFwd1x1:1,64,1,1,0,4,16,8,0
720-358-31-1x1-48-358-31-6-0x0-1x1-1x1-0-NCHW-FP32-F=ConvOclDirectFwd1x1:1,64,1,1,1,4,32,2048,0
1000-13-13-1x1-512-13-13-64-0x0-1x1-1x1-0-NCHW-FP32-B=ConvAsm1x1U:3,16,3,64,1,2,2,2;ConvOclDirectFwd1x1:1,256,1,1,0,1,32,4,0
32-14-14-5x5-128-14-14-1-2x2-1x1-1x1-0-NCHW-FP16-F=ConvOclDirectFwd:16,16,16,16,1,1,1,4,1;ConvOclDirectFwdFused:16,16,16,16,1,1,1,4,1
704-946-81-1x1-1568-946-81-4-0x0-1x1-1x1-0-NCHW-FP32-B=ConvOclDirectFwd1x1:1,256,1,1,0,2,32,4,0
128-14-14-1x1-512-14-14-8-0x0-1x1-1x1-0-NCHW-FP16-W=ConvAsmBwdWrW1x1:2,8,2,2,4,1,1,4,0,1
3-642-344-1x1-58-642-344-32-0x0-1x1-1x1-0-NCHW-FP32-B=ConvOclDirectFwd1x1:1,256,1,1,0,1,16,4,0
128-14-14-1x1-384-14-14-128-0x0-1x1-1x1-0-NCHW-FP32-F=ConvAsm1x1U:1,16,1,32,4,2,2,2;ConvOclDirectFwd1x1:1,64,1,1,1,1,32,256,0
80-547-6-1x1-128-547-6-4-0x0-1x1-1x1-0-NCHW-FP32-W=ConvAsmBwdWrW1x1:2,8,2,4,4,1,4,4,0,1
384-13-13-3x3-192-13-13-2-1x1-1x1-1x1-0-NCHW-FP32-W=ConvAsmBwdWrW3x3:0,1,16,2,5,1
192-17-17-1x1-1024-17-17-128-0x0-1x1-1x1-0-NCHW-FP16-W=ConvAsmBwdWrW1x1:4,4,8,4,4,2,2,2,0,1
384-797-102-1x1-144-797-102-8-0x0-1x1-1x1-0-NCHW-FP32-F=ConvOclDirectFwd1x1:1,64,1,1,1,0,32,2048,0
960-7-7-1x1-240-7-7-2-0x0-1x1-1x1-0-NCHW-FP32-F_g3=ConvOclDirectFwd:8,8,8,8,1,1,1,4,2
192-14-14-1x1-1536-14-14-16-0x0-1x1-1x1-0-NCHW-FP16-B=ConvAsm1x1U:1,16,2,16,1,2,2,2;ConvOclDirectFwd1x1:1,64,1,1,0,4,16,4,0
464-411-41-1x1-64-411-41-1-0x0-1x1-1x1-0-NCHW-FP32-F=ConvOclDirectFwd1x1:1,64,1,1,1,0,16,2048,0
240-28-28-1x1-60-28-28-4-0x0-1x1-1x1-0-NCHW-FP16-B_g3=ConvOclDirectFwd:16,16,16,16,1,1,4,4,2
144-217-847-1x1-1776-217-847-1-0x0-1x1-1x1-0-NCHW-FP32-B=ConvOclDirectFwd1x1:1,256,1,1,0,1,16,4,0
2048-7-7-1x1-1024-7-7-128-0x0-1x1-1x1-0-NCHW-FP32-F=ConvAsm1x1U:3,16,4,16,3,2,4,1;ConvOclDirectFwd1x1:8,8,8,8,1,0,32,128,1
64-55-55-1x1-256-55-55-32-0x0-1x1-1x1-0-NCHW-FP32-F=ConvAsm1x1U:2,16,2,64,2,2,2,1;ConvOclDirectFwd1x1:1,64,1,1,1,4,32,128,0;ConvActivAsm1x1U:3,16,3,64,4,1
512-28-28-1x1-256-14-14-2-0x0-2x2-1x1-0-NCHW-FP32-F=ConvAsm1x1U:1,8,1,64,1,4,2,1;ConvOclDirectFwd1x1:1,64,1,1,1,4,16,64,0
448-8-8-1x1-1280-8-8-32-0x0-1x1-1x1-0-NCHW-FP32-B=ConvAsm1x1U:1,32,1,64,2,1,2,2;ConvOclDirectFwd1x1:1,64,1,1,0,4,8,4,0
128-14-14-1x1-832-14-14-32-0x0-1x1-1x1-0-NCHW-FP32-F=ConvAsm1x1U:4,16,4,32,1,2,2,2;ConvOclDirectFwd1x1:1,64,1,1,1,1,16,256,0
512-7-7-1x1-128-7-7-32-0x0-1x1-1x1-0-NCHW-FP32-W=ConvAsmBwdWrW1x1:2,8,2,8,2,1,2,4,0,1
384-17-17-1x1-1024-17-17-64-0x0-1x1-1x1-0-NCHW-FP32-W=ConvAsmBwdWrW1x1:2,8,4,4,8,1,2,4,0,1
1024-15-15-3x3-1024-8-8-128-1x1-2x2-1x1-0-NCHW-FP32-F_g32=ConvOclDirectFwd:8,8,8,8,1,1,8,2,2
96-71-71-3x3-64-73-73-32-0x0-1x1-1x1-0-NCHW-FP16-B=ConvOclDirectFwd:16,8,16,16,1,2,8,1,2
896-7-7-1x1-128-7-7-128-0x0-1x1-1x1-0-NCHW-FP16-F=ConvAsm1x1U:2,8,4,16,1,4,2,4;ConvOclDirectFwd1x1:1,64,1,1,0,1,8,4,0
512-14-14-1x1-128-14-14-1-0x0-1x1-1x1-0-NCHW-FP32-F=ConvAsm1x1U:1,8,1,64,1,4,4,1;ConvOclDirectFwd1x1:1,64,1,1,1,0,16,64,0;ConvActivAsm1x1U:2,16,2,16,1,4
992-7-7-1x1-128-7-7-32-0x0-1x1-1x1-0-NCHW-FP16-B=ConvAsm1x1U:1,8,2,32,1,4,4,2;ConvOclDirectFwd1x1:1,64,1,1,0,1,4,8,0
2048-7-7-1x1-1024-7-7-16-0x0-1x1-1x1-0-NCHW-FP32-B=ConvAsm1x1U:2,16,2,32,2,2,2,4;ConvOclDirectFwd1x1:1,64,1,1,0,1,16,8,0
2048-7-7-1x1-1024-14-14-64-0x0-2x2-1x1-0-NCHW-FP16-B=ConvAsm1x1U:1,16,2,32,1,2,2,2;ConvOclDirectFwd1x1:1,64,1,1,0,1,16,4,0
48-27-27-3x3-192-27-27-32-1x1-1x1-1x1-0-NCHW-FP32-W=ConvAsmBwdWrW3x3:0,1,8,4,3,4
128-14-14-1x1-864-14-14-16-0x0-1x1-1x1-0-NCHW-FP16-B=ConvAsm1x1U:1,8,2,16,1,4,1,4;ConvOclDirectFwd1x1:1,64,1,1,0,4,8,4,0
288-28-28-1x1-128-28-28-16-0x0-1x1-1x1-0-NCHW-FP16-F=ConvAsm1x1U:1,8,2,32,2,4,2,2;ConvOclDirectFwd1x1:1,64,1,1,0,4,16,4,0
60-28-28-3x3-60-28-28-128-1x1-1x1-1x1-0-NCHW-FP16-F=ConvOclDirectFwd:16,16,32,32,2,2,8,2,1
120-7-7-1x1-480-7-7-512-0x0-1x1-1x1-0-NCHW-FP32-F_g3=ConvOclDirectFwd:8,8,8,8,1,1,8,4,2
128-14-14-1x1-960-14-14-256-0x0-1x1-1x1-0-NCHW-FP16-F=ConvAsm1x1U:1,8,2,16,2,4,1,8;ConvOclDirectFwd1x1:1,256,1,1,0,4,16,4,0
1024-7-7-1x1-2048-7-7-8-0x0-1x1-1x1-0-NCHW-FP32-W=ConvAsmBwdWrW1x1:1,16,2,4,8,1,1,4,0,3
448-8-8-3x3-384-8-8-16-1x1-1x1-1x1-0-NCHW-FP16-F=ConvOclDirectFwd:8,8,8,8,1,1,8,4,1;ConvOclDirectFwdFused:8,8,8,8,1,1,8,4,1
64-14-14-5x5-24-14-14-256-2x2-1x1-1x1-0-NCHW-FP32-B=ConvOclDirectFwd:8,8,16,16,2,2,4,1,2
96-56-56-1x1-128-56-56-32-0x0-1x1-1x1-0-NCHW-FP32-F=ConvAsm1x1U:2,16,2,64,3,2,1,1;ConvOclDirectFwd1x1:1,64,1,1,1,0,32,256,0
336-35-58-1x1-1104-35-58-64-0x0-1x1-1x1-0-NCHW-FP32-F=ConvAsm1x1U:3,16,8,32,1,2,1,2;ConvOclDirectFwd1x1:1,64,1,1,1,1,64,2048,0
384-69-679-1x1-896-69-679-4-0x0-1x1-1x1-0-NCHW-FP32-B=ConvOclDirectFwd1x1:1,256,1,1,0,1,32,4,0
32-79-341-5x20-1-161-700-128-0x0-2x2-1x1-0-NCHW-FP32-B=ConvOclDirectFwd:16,8,16,32,1,4,1,1,1
192-71-71-3x3-80-73-73-32-0x0-1x1-1x1-0-NCHW-FP32-B=ConvOclDirectFwd:8,8,16,16,2,2,8,1,2
256-56-56-3x3-128-56-56-256-1x1-1x1-1x1-0-NCHW-FP16-F=ConvOclDirectFwd:16,16,32,32,2,2,8,4,1
896-87-557-1x1-1344-87-557-6-0x0-1x1-1x1-0-NCHW-FP32-B=ConvOclDirectFwd1x1:1,256,1,1,0,1,32,4,0
120-14-14-3x3-120-14-14-256-1x1-1x1-1x1-0-NCHW-FP32-W=ConvAsmBwdWrW3x3:0,1,8,4,14,2
128-7-7-1x1-768-7-7-32-0x0-1x1-1x1-0-NCHW-FP16-B=ConvAsm1x1U:1,8,2,32,1,2,2,2;ConvOclDirectFwd1x1:8,64,8,8,0,1,16,4,1
704-156-220-1x1-800-156-220-6-0x0-1x1-1x1-0-NCHW-FP32-F=ConvOclDirectFwd1x1:1,64,1,1,1,4,64,2048,0
1920-680-127-1x1-512-680-127-1-0x0-1x1-1x1-0-NCHW-FP32-F=ConvOclDirectFwd1x1:1,64,1,1,1,1,16,2048,0
256-14-14-3x3-256-14-14-256-1x1-1x1-1x1-0-NCHW-FP16-B=ConvOclDirectFwd:8,8,16,16,2,2,8,2,1
384-13-13-3x3-192-13-13-8-1x1-1x1-1x1-0-NCHW-FP32-W=ConvAsmBwdWrW3x3:0,1,16,4,2,1
128-14-14-1x1-896-14-14-512-0x0-1x1-1x1-0-NCHW-FP16-B=ConvAsm1x1U:1,16,2,16,1,2,1,2;ConvOclDirectFwd1x1:1,256,1,1,0,2,32,4,0
480-14-14-1x1-64-14-14-32-0x0-1x1-1x1-0-NCHW-FP16-F=ConvAsm1x1U:2,8,4,64,1,4,4,2;ConvOclDirectFwd1x1:1,64,1,1,0,4,8,4,0
4-188-601-1x1-320-188-601-2-0x0-1x1-1x1-0-NCHW-FP32-B=ConvOclDirectFwd1x1:1,256,1,1,0,4,16,4,0
128-7-7-1x1-896-7-7-16-0x0-1x1-1x1-0-NCHW-FP16-W=ConvAsmBwdWrW1x1:2,8,2,8,2,1,2,4,0,0
64-14-14-1x1-480-14-14-32-0x0-1x1-1x1-0-NCHW-FP32-B=ConvAsm1x1U:1,16,1,64,2,2,1,2;ConvOclDirectFwd1x1:1,64,1,1,0,4,16,4,0
64-112-112-1x1-64-112-112-32-0x0-1x1-1x1-0-NCHW-FP32-B=ConvAsm1x1U:3,32,7,64,1,1,1,1;ConvOclDirectFwd1x1:1,64,1,1,0,2,32,4,0
256-499-396-1x1-8-499-396-4-0x0-1x1-1x1-0-NCHW-FP32-F=ConvOclDirectFwd1x1:1,256,1,1,0,4,16,4,0
116-28-28-1x1-116-28-28-512-0x0-1x1-1x1-0-NCHW-FP32-F=ConvAsm1x1U:2,16,2,16,1,2,2,1;ConvOclDirectFwd1x1:1,64,1,1,0,2,16,4,0
512-7-7-1x1-512-7-7-1-0x0-1x1-1x1-0-NCHW-FP32-W=ConvAsmBwdWrW1x1:1,16,2,4,2,1,1,4,0,1
64-112-112-7x7-3-224-224-128-3x3-2x2-1x1-0-NCHW-FP32-W=ConvOclBwdWrW2<1>:3,7,3,3,7;ConvOclBwdWrW2<2>:3,7,3,3,7;ConvOclBwdWrW2<4>:3,7,3,3,7;ConvOclBwdWrW2<16>:3,11,3,3,7;ConvOclBwdWrW2<8>:3,8,3,1,7
256-256-256-1x1-256-256-256-4-0x0-1x1-1x1-0-NCHW-FP32-F=ConvOclDirectFwd1x1:1,64,1,1,1,0,32,2048,0
256-14-14-1x1-128-14-14-512-0x0-1x1-1x1-0-NCHW-FP16-B=ConvAsm1x1U:1,16,2,16,1,2,1,4;ConvOclDirectFwd1x1:1,256,1,1,0,4,16,4,0
128-56-56-1x1-128-56-56-128-0x0-1x1-1x1-0-NCHW-FP16-B=ConvAsm1x1U:1,16,2,32,1,2,1,2;ConvOclDirectFwd1x1:1,64,1,1,0,4,16,4,0
544-627-707-1x1-912-627-707-1-0x0-1x1-1x1-0-NCHW-FP32-B=ConvOclDirectFwd1x1:1,256,1,1,0,1,16,8,0
128-28-28-3x3-96-28-28-128-1x1-1x1-1x1-0-NCHW-FP16-W=ConvAsmBwdWrW3x3:0,1,8,2,2,8
64-27-27-5x5-192-27-27-64-2x2-1x1-1x1-0-NCHW-FP32-B=ConvOclDirectFwd:16,16,32,32,2,2,8,2,1
128-14-14-1x1-384-14-14-64-0x0-1x1-1x1-0-NCHW-FP16-W=ConvAsmBwdWrW1x1:2,8,2,8,2,1,4,4,0,1
320-323-636-1x1-1440-323-636-1-0x0-1x1-1x1-0-NCHW-FP32-B=ConvOclDirectFwd1x1:1,256,1,1,0,2,32,4,0
160-482-162-1x1-1280-482-162-4-0x0-1x1-1x1-0-NCHW-FP32-B=ConvOclDirectFwd1x1:1,256,1,1,0,4,16,4,0
60-14-14-1x1-240-14-14-256-0x0-1x1-1x1-0-NCHW-FP32-F_g3=ConvOclDirectFwd:16,16,16,16,1,1,8,4,1
800-501-66-1x1-2160-501-66-6-0x0-1x1-1x1-0-NCHW-FP32-B=ConvOclDirectFwd1x1:1,256,1,1,0,2,16,8,0
1024-8-8-1x1-2048-8-8-48-0x0-1x1-1x1-0-NCHW-FP32-F=ConvAsm1x1U:4,16,4,16,3,2,2,2;ConvOclDirectFwd1x1:1,64,1,1,1,1,64,2048,0
54-28-28-1x1-216-28-28-1024-0x0-1x1-1x1-0-NCHW-FP16-F_g3=ConvOclDirectFwd:16,16,32,32,2,2,8,2,1
1376-754-517-1x1-32-754-517-1-0x0-1x1-1x1-0-NCHW-FP32-F=ConvOclDirectFwd1x1:1,64,1,1,1,0,64,2048,0
1024-8-8-3x3-1024-8-8-8-1x1-1x1-1x1-0-NCHW-FP32-F_g32=ConvOclDirectFwd:8,8,8,8,1,1,4,4,2
128-112-112-3x3-64-112-112-512-1x1-1x1-1x1-0-NCHW-FP16-B=ConvOclDirectFwd:8,16,16,32,2,2,8,2,1
32-658-516-1x1-2-658-516-6-0x0-1x1-1x1-0-NCHW-FP32-B=ConvOclDirectFwd1x1:1,256,1,1,0,4,8,4,0
1920-513-148-1x1-832-513-148-1-0x0-1x1-1x1-0-NCHW-FP32-F=ConvOclDirectFwd1x1:1,64,1,1,1,1,16,2048,0
128-7-7-5x5-48-7-7-512-2x2-1x1-1x1-0-NCHW-FP32-B=ConvOclDirectFwd:8,8,8,8,1,1,8,2,1
128-7-7-1x1-832-7-7-4-0x0-1x1-1x1-0-NCHW-FP32-B=ConvAsm1x1U:1,8,1,64,1,4,2,4;ConvOclDirectFwd1x1:1,128,1,1,0,1,4,8,0
128-14-14-1x1-608-14-14-512-0x0-1x1-1x1-0-NCHW-FP16-B=ConvAsm1x1U:1,16,2,16,1,2,1,2;ConvOclDirectFwd1x1:1,256,1,1,0,2,16,4,0
64-35-35-1x1-288-35-35-512-0x0-1x1-1x1-0-NCHW-FP16-W=ConvAsmBwdWrW1x1:4,4,4,4,2,1,1,4,0,1
58-617-103-1x1-3-617-103-8-0x0-1x1-1x1-0-NCHW-FP32-B=ConvAsm1x1U:2,1,2,4,1,1,2,2;ConvOclDirectFwd1x1:1,256,1,1,0,1,16,4,0
58-56-56-1x1-24-56-56-16-0x0-1x1-1x1-0-NCHW-FP16-W=ConvAsmBwdWrW1x1:4,4,2,2,2,1,4,4,0,1
8-15-38-1x1-32-15-38-12-0x0-1x1-1x1-0-NCHW-FP32-F=ConvAsm1x1U:1,8,1,16,1,1,1,1;ConvOclDirectFwd1x1:1,64,1,1,0,2,4,4,0
3-10-10-3x3-5-10-10-512-1x1-1x1-1x1-0-NCHW-FP32-F=ConvOclDirectFwd:8,8,16,16,2,2,4,1,2
480-14-14-1x1-96-14-14-256-0x0-1x1-1x1-0-NCHW-FP16-W=ConvAsmBwdWrW1x1:2,8,2,8,2,1,4,4,0,2
336-82-783-1x1-232-82-783-12-0x0-1x1-1x1-0-NCHW-FP32-F=ConvOclDirectFwd1x1:1,256,1,1,0,1,16,4,0
128-14-14-1x1-608-14-14-64-0x0-1x1-1x1-0-NCHW-FP16-F=ConvAsm1x1U:1,8,2,16,2,4,1,8;ConvOclDirectFwd1x1:1,128,1,1,0,4,8,4,0
320-8-8-1x1-1280-8-8-16-0x0-1x1-1x1-0-NCHW-FP32-W=ConvAsmBwdWrW1x1:1,16,2,8,4,1,1,4,0,1
512-170-308-1x1-144-170-308-8-0x0-1x1-1x1-0-NCHW-FP32-F=ConvOclDirectFwd1x1:1,64,1,1,1,0,32,2048,0
608-894-96-1x1-1392-894-96-2-0x0-1x1-1x1-0-NCHW-FP32-B=ConvOclDirectFwd1x1:1,256,1,1,0,1,16,8,0
288-49-1017-1x1-528-49-1017-16-0x0-1x1-1x1-0-NCHW-FP32-F=ConvOclDirectFwd1x1:1,64,1,1,1,1,32,2048,0
832-64-128-1x1-384-64-128-1-0x0-1x1-1x1-0-NCHW-FP32-F=ConvOclDirectFwdFused:1,64,1,1,1,1,32,2048,0;ConvOclDirectFwd1x1:1,64,1,1,1,1,16,2048,0
256-14-14-1x1-528-14-14-32-0x0-1x1-1x1-0-NCHW-FP16-W=ConvAsmBwdWrW1x1:2,8,2,8,2,1,4,4,0,1
64-27-27-3x3-256-27-27-128-1x1-1x1-1x1-0-NCHW-FP16-F=ConvOclDirectFwd:32,8,32,32,1,4,8,1,1
48-7-7-1x1-832-7-7-128-0x0-1x1-1x1-0-NCHW-FP32-B=ConvAsm1x1U:1,16,1,64,2,2,1,4;ConvOclDirectFwd1x1:1,128,1,1,0,1,16,8,0
928-47-389-1x1-1680-47-389-4-0x0-1x1-1x1-0-NCHW-FP32-B=ConvOclDirectFwd1x1:1,256,1,1,0,1,16,4,0
512-14-14-1x1-112-14-14-32-0x0-1x1-1x1-0-NCHW-FP32-F=ConvAsm1x1U:4,16,4,64,1,2,2,2;ConvOclDirectFwd1x1:1,64,1,1,1,4,32,2048,0;ConvActivAsm1x1U:4,16,7,32,1,2
2048-7-7-1x1-512-7-7-32-0x0-1x1-1x1-0-NCHW-FP32-B=ConvAsm1x1U:1,16,1,64,2,2,4,2;ConvOclDirectFwd1x1:1,256,1,1,0,1,8,4,0
128-28-28-1x1-224-28-28-16-0x0-1x1-1x1-0-NCHW-FP16-B=ConvAsm1x1U:1,16,2,16,1,2,2,2;ConvOclDirectFwd1x1:1,256,1,1,0,4,16,8,0
144-35-106-1x1-1632-35-106-2-0x0-1x1-1x1-0-NCHW-FP32-W=ConvAsmBwdWrW1x1:2,8,4,4,8,1,1,4,0,1
896-827-197-1x1-32-827-197-2-0x0-1x1-1x1-0-NCHW-FP32-F=ConvOclDirectFwd1x1:1,64,1,1,1,4,64,2048,0
32-35-35-1x1-192-35-35-128-0x0-1x1-1x1-0-NCHW-FP16-B=ConvAsm1x1U:1,16,2,32,1,2,1,2;ConvOclDirectFwd1x1:1,256,1,1,0,1,32,4,0
128-28-28-1x1-480-28-28-32-0x0-1x1-1x1-0-NCHW-FP32-W=ConvAsmBwdWrW1x1:1,16,2,8,4,1,4,4,0,1
320-317-18-1x1-64-317-18-128-0x0-1x1-1x1-0-NCHW-FP32-F=ConvAsm1x1U:1,32,4,16,1,1,1,1;ConvOclDirectFwd1x1:16,16,32,32,1,0,32,128,1
1-1017-655-1x1-8-1017-655-4-0x0-1x1-1x1-0-NCHW-FP32-W=ConvAsmBwdWrW1x1:4,4,2,1,2,1,4,4,0,1
64-35-35-1x1-384-35-35-64-0x0-1x1-1x1-0-NCHW-FP16-W=ConvAsmBwdWrW1x1:4,4,8,4,2,1,2,4,0,1
544-22-658-1x1-1280-22-658-4-0x0-1x1-1x1-0-NCHW-FP32-F=ConvOclDirectFwd1x1:1,64,1,1,1,0,16,2048,0
512-28-28-1x1-256-14-14-512-0x0-2x2-1x1-0-NCHW-FP32-F=ConvAsm1x1U:4,16,4,64,1,2,1,4;ConvOclDirectFwd1x1:1,64,1,1,1,1,32,2048,0
32-149-149-3x3-32-147-147-1-0x0-1x1-1x1-0-NCHW-FP16-F=ConvOclDirectFwd:16,16,16,32,1,2,8,4,1;ConvOclDirectFwdFused:16,16,16,32,1,2,8,2,1
3-108-108-3x3-64-54-54-256-1x1-2x2-1x1-0-NCHW-FP32-F=ConvOclDirectFwd:16,16,16,16,1,1,8,2,2
2048-8-8-1x1-1024-15-15-8-0x0-2x2-1x1-0-NCHW-FP32-W=ConvAsmBwdWrW1x1:1,16,2,4,8,1,1,4,0,0
256-28-28-3x3-512-28-28-8-1x1-1x1-1x1-0-NCHW-FP16-F=ConvOclDirectFwd:16,8,32,32,2,4,8,1,1;ConvOclDirectFwdFused:16,16,32,32,2,2,8,1,2
256-7-7-3x3-256-14-14-512-1x1-2x2-1x1-0-NCHW-FP32-W=ConvAsmBwdWrW3x3:0,0,8,8,6,1
384-13-13-3x3-384-13-13-1024-1x1-1x1-1x1-0-NCHW-FP16-W=ConvAsmBwdWrW3x3:0,1,8,4,3,1
448-902-412-1x1-2-902-412-1-0x0-1x1-1x1-0-NCHW-FP32-F=ConvOclDirectFwd1x1:1,256,1,1,0,4,16,4,0
768-7-7-1x1-128-7-7-256-0x0-1x1-1x1-0-NCHW-FP16-F=ConvAsm1x1U:2,8,4,16,1,4,2,2;ConvOclDirectFwd1x1:8,64,8,8,0,1,16,4,1
240-7-7-1x1-960-7-7-128-0x0-1x1-1x1-0-NCHW-FP32-F_g3=ConvOclDirectFwd:8,8,8,8,1,1,8,4,1
512-7-7-1x1-2048-7-7-8-0x0-1x1-1x1-0-NCHW-FP16-F=ConvAsm1x1U:2,8,4,16,2,4,2,2;ConvOclDirectFwd1x1:1,64,1,1,0,1,16,4,0
512-14-14-1x1-160-14-14-128-0x0-1x1-1x1-0-NCHW-FP16-F=ConvAsm1x1U:2,8,4,64,1,4,2,2;ConvOclDirectFwd1x1:1,256,1,1,0,4,16,4,0
240-28-28-1x1-60-28-28-1024-0x0-1x1-1x1-0-NCHW-FP32-F_g3=ConvOclDirectFwd:16,16,16,16,1,1,8,2,2
928-731-303-1x1-1216-731-303-1-0x0-1x1-1x1-0-NCHW-FP32-B=ConvOclDirectFwd1x1:1,64,1,1,0,1,32,4,0
608-663-371-1x1-1760-663-371-1-0x0-1x1-1x1-0-NCHW-FP32-B=ConvOclDirectFwd1x1:1,256,1,1,0,1,32,4,0
768-17-17-1x1-192-17-17-64-0x0-1x1-1x1-0-NCHW-FP32-F=ConvAsm1x1U:4,16,5,64,1,2,1,1;ConvOclDirectFwd1x1:1,64,1,1,1,4,16,2048,0;ConvActivAsm1x1U:3,16,5,64,1,1
1472-880-5-1x1-416-880-5-12-0x0-1x1-1x1-0-NCHW-FP32-F=ConvOclDirectFwd1x1:1,64,1,1,1,4,64,2048,0
1-977-432-1x1-1000-977-432-1-0x0-1x1-1x1-0-NCHW-FP32-B=ConvOclDirectFwd1x1:1,256,1,1,0,2,16,4,0
128-54-54-1x1-32-54-54-32-0x0-1x1-1x1-0-NCHW-FP32-F=ConvAsm1x1U:2,16,2,64,2,1,1,1;ConvOclDirectFwd1x1:1,64,1,1,1,0,32,256,0
64-75-75-3x3-128-38-38-64-1x1-2x2-1x1-0-NCHW-FP32-F=ConvOclDirectFwd:16,16,16,16,1,1,8,2,1
928-11-946-1x1-1792-11-946-8-0x0-1x1-1x1-0-NCHW-FP32-B=ConvOclDirectFwd1x1:1,128,1,1,0,2,32,4,0
48-35-35-1x1-288-35-35-1-0x0-1x1-1x1-0-NCHW-FP16-B=ConvAsm1x1U:1,8,2,64,1,2,4,1;ConvOclDirectFwd1x1:1,128,1,1,0,1,4,4,0
192-14-14-1x1-1632-14-14-16-0x0-1x1-1x1-0-NCHW-FP32-B=ConvAsm1x1U:1,16,1,64,2,2,1,1;ConvOclDirectFwd1x1:8,64,16,16,0,2,16,4,1
256-64-64-3x3-256-64-64-4-1x1-1x1-1x1-0-NCHW-FP32-W=ConvAsmBwdWrW3x3:0,1,16,2,7,4
96-14-14-1x1-576-14-14-64-0x0-1x1-1x1-0-NCHW-FP16-W=ConvAsmBwdWrW1x1:4,4,4,4,4,1,2,2,0,1
320-14-14-3x3-160-14-14-8-1x1-1x1-1x1-0-NCHW-FP16-B=ConvOclDirectFwd:16,16,16,16,1,1,4,4,2
384-212-21-1x1-1728-212-21-12-0x0-1x1-1x1-0-NCHW-FP32-W=ConvAsmBwdWrW1x1:2,8,8,8,2,1,1,4,0,1
1280-512-374-1x1-54-512-374-1-0x0-1x1-1x1-0-NCHW-FP32-F=ConvOclDirectFwd1x1:1,256,1,1,0,1,8,4,0
912-6-341-1x1-320-6-341-6-0x0-1x1-1x1-0-NCHW-FP32-F=ConvAsm1x1U:4,8,8,64,2,2,1,4;ConvOclDirectFwd1x1:1,64,1,1,1,0,32,2048,0
48-35-35-1x1-256-35-35-512-0x0-1x1-1x1-0-NCHW-FP16-W=ConvAsmBwdWrW1x1:4,4,8,4,2,1,4,2,0,1
256-8-8-1x1-1536-8-8-32-0x0-1x1-1x1-0-NCHW-FP16-W=ConvAsmBwdWrW1x1:2,8,8,4,2,1,1,4,0,0
992-149-241-1x1-576-149-241-1-0x0-1x1-1x1-0-NCHW-FP32-B=ConvOclDirectFwd1x1:1,128,1,1,0,1,32,4,0
512-14-14-3x3-512-14-14-48-1x1-1x1-1x1-0-NCHW-FP32-B_g32=ConvOclDirectFwd:16,16,16,16,1,1,8,2,2
256-8-8-1x1-1536-8-8-4-0x0-1x1-1x1-0-NCHW-FP32-B=ConvAsm1x1U:1,8,1,32,1,4,1,4;ConvOclDirectFwd1x1:1,64,1,1,0,1,4,4,0
1056-71-152-1x1-96-71-152-6-0x0-1x1-1x1-0-NCHW-FP32-W=ConvAsmBwdWrW1x1:4,4,8,2,8,1,1,4,0,0
512-14-14-3x3-512-14-14-48-1x1-1x1-1x1-0-NCHW-FP32-F_g32=ConvOclDirectFwd:16,8,16,16,1,2,8,1,2
192-8-8-1x1-1280-8-8-64-0x0-1x1-1x1-0-NCHW-FP32-W=ConvAsmBwdWrW1x1:2,8,4,4,8,1,1,4,0,1
1280-825-106-1x1-64-825-106-4-0x0-1x1-1x1-0-NCHW-FP32-F=ConvOclDirectFwd1x1:16,16,32,32,1,0,32,128,1
480-14-14-1x1-120-14-14-2-0x0-1x1-1x1-0-NCHW-FP32-B_g3=ConvOclDirectFwd:8,8,8,8,1,1,2,4,2
1024-4-4-1x1-2048-7-7-256-0x0-2x2-1x1-0-NCHW-FP16-B=ConvAsm1x1U:1,16,2,16,1,2,4,1;ConvOclDirectFwd1x1:1,64,1,1,0,1,32,4,0
464-7-7-1x1-1024-7-7-256-0x0-1x1-1x1-0-NCHW-FP16-F=ConvAsm1x1U:2,8,4,16,1,4,1,8;ConvOclDirectFwd1x1:1,128,1,1,0,1,16,4,0
608-146-478-1x1-192-146-478-8-0x0-1x1-1x1-0-NCHW-FP32-B=ConvOclDirectFwd1x1:1,256,1,1,0,4,16,8,0
256-56-56-1x1-256-56-56-2-0x0-1x1-1x1-0-NCHW-FP32-F=ConvAsm1x1U:4,8,7,64,1,2,1,4;ConvOclDirectFwd1x1:1,64,1,1,1,0,16,256,0
240-69-576-1x1-448-69-576-16-0x0-1x1-1x1-0-NCHW-FP32-F=ConvOclDirectFwd1x1:1,64,1,1,1,4,16,2048,0
224-7-7-3x3-224-7-7-32-1x1-1x1-1x1-0-NCHW-FP16-W=ConvAsmBwdWrW3x3:0,1,8,2,2,2
192-28-28-1x1-128-28-28-512-0x0-1x1-1x1-0-NCHW-FP32-F=ConvAsm1x1U:2,16,2,32,3,2,1,2;ConvOclDirectFwd1x1:1,64,1,1,1,4,16,256,0
544-708-105-1x1-512-708-105-6-0x0-1x1-1x1-0-NCHW-FP32-F=ConvOclDirectFwd1x1:1,64,1,1,1,0,32,2048,0
1120-764-93-1x1-896-764-93-6-0x0-1x1-1x1-0-NCHW-FP32-F=ConvOclDirectFwd1x1:1,64,1,1,1,0,16,2048,0
144-639-196-1x1-1008-639-196-1-0x0-1x1-1x1-0-NCHW-FP32-B=ConvOclDirectFwd1x1:1,256,1,1,0,4,16,4,0
1872-293-246-1x1-832-293-246-1-0x0-1x1-1x1-0-NCHW-FP32-F=ConvOclDirectFwd1x1:1,64,1,1,1,1,16,2048,0
128-7-7-1x1-640-7-7-512-0x0-1x1-1x1-0-NCHW-FP16-W=ConvAsmBwdWrW1x1:2,8,2,8,2,2,2,4,0,1
54-940-712-1x1-1-940-712-6-0x0-1x1-1x1-0-NCHW-FP32-B=ConvOclDirectFwd1x1:1,256,1,1,0,4,16,4,0
288-28-28-1x1-128-28-28-16-0x0-1x1-1x1-0-NCHW-FP32-B=ConvAsm1x1U:1,16,1,16,1,2,2,1;ConvOclDirectFwd1x1:16,64,32,32,0,2,16,4,1
16-54-54-1x1-64-54-54-64-0x0-1x1-1x1-0-NCHW-FP16-W=ConvAsmBwdWrW1x1:4,4,2,1,4,1,4,4,0,1
768-17-17-1x1-192-17-17-128-0x0-1x1-1x1-0-NCHW-FP32-F=ConvAsm1x1U:4,16,5,64,1,2,1,2;ConvOclDirectFwd1x1:1,64,1,1,1,1,16,2048,0;ConvActivAsm1x1U:2,16,5,64,1,1
128-14-14-1x1-608-14-14-32-0x0-1x1-1x1-0-NCHW-FP32-B=ConvAsm1x1U:1,16,1,32,2,2,1,2;ConvOclDirectFwd1x1:1,256,1,1,0,4,16,4,0
1008-287-76-1x1-800-287-76-6-0x0-1x1-1x1-0-NCHW-FP32-F=ConvOclDirectFwd1x1:1,64,1,1,1,0,64,2048,0
256-14-14-1x1-256-14-14-16-0x0-1x1-1x1-0-NCHW-FP16-F=ConvAsm1x1U:1,8,2,64,1,4,2,2;ConvOclDirectFwd1x1:1,256,1,1,0,4,4,4,0
512-14-14-1x1-64-14-14-512-0x0-1x1-1x1-0-NCHW-FP16-F=ConvAsm1x1U:1,8,2,64,1,4,1,4;ConvOclDirectFwd1x1:1,64,1,1,0,2,16,4,0
256-35-35-1x1-64-35-35-8-0x0-1x1-1x1-0-NCHW-FP32-F=ConvAsm1x1U:1,8,1,64,1,4,1,4;ConvOclDirectFwd1x1:1,64,1,1,1,0,16,128,0;ConvActivAsm1x1U:4,16,5,32,1,4
96-35-35-1x1-384-35-35-16-0x0-1x1-1x1-0-NCHW-FP16-W=ConvAsmBwdWrW1x1:4,4,4,1,8,1,1,4,0,0
128-17-17-1x1-768-17-17-64-0x0-1x1-1x1-0-NCHW-FP32-W=ConvAsmBwdWrW1x1:2,8,4,8,4,1,2,4,0,1
64-13-13-3x3-256-13-13-16-1x1-1x1-1x1-0-NCHW-FP32-W=ConvAsmBwdWrW3x3:0,0,16,2,3,1
512-14-14-3x3-512-14-14-128-1x1-1x1-1x1-0-NCHW-FP32-W_g32=ConvOclBwdWrW2<4>:1,7,8,1,7;ConvOclBwdWrW2<16>:1,6,8,1,9;ConvOclBwdWrW2<8>:1,9,8,1,7;ConvOclBwdWrW2<1>:1,7,8,1,7;ConvOclBwdWrW2<2>:1,7,8,1,7;ConvAsmBwdWrW3x3:0,1,8,4,7,1
58-28-28-1x1-24-28-28-1024-0x0-1x1-1x1-0-NCHW-FP16-W=ConvAsmBwdWrW1x1:4,4,2,2,2,2,4,4,0,1
480-14-14-1x1-120-14-14-512-0x0-1x1-1x1-0-NCHW-FP16-B_g3=ConvOclDirectFwd:8,8,16,16,2,2,8,2,1
48-27-27-1x1-256-27-27-512-0x0-1x1-1x1-0-NCHW-FP16-W=ConvAsmBwdWrW1x1:4,4,8,4,2,2,4,4,0,2
640-7-7-1x1-128-7-7-256-0x0-1x1-1x1-0-NCHW-FP32-W=ConvAsmBwdWrW1x1:4,4,4,4,2,1,1,4,0,0
128-17-17-1x1-768-17-17-256-0x0-1x1-1x1-0-NCHW-FP16-B=ConvAsm1x1U:1,16,2,32,1,2,1,2;ConvOclDirectFwd1x1:1,256,1,1,0,1,32,4,0
32-14-14-1x1-512-14-14-4-0x0-1x1-1x1-0-NCHW-FP16-B=ConvAsm1x1U:1,8,2,16,1,2,2,1;ConvOclDirectFwd1x1:1,256,1,1,0,4,4,4,0
256-56-56-1x1-256-56-56-16-0x0-1x1-1x1-0-NCHW-FP32-F=ConvAsm1x1U:4,16,5,64,2,2,1,4;ConvOclDirectFwd1x1:1,64,1,1,1,4,16,2048,0
32-28-28-5x5-96-28-28-512-2x2-1x1-1x1-0-NCHW-FP16-F=ConvOclDirectFwd:16,16,32,32,2,2,8,1,1;ConvOclDirectFwdFused:16,16,32,32,2,2,8,1,1
896-363-218-1x1-528-363-218-4-0x0-1x1-1x1-0-NCHW-FP32-B=ConvOclDirectFwd1x1:1,256,1,1,0,2,16,8,0
64-14-14-1x1-512-14-14-128-0x0-1x1-1x1-0-NCHW-FP32-W=ConvAsmBwdWrW1x1:2,8,4,8,2,1,4,4,0,3
224-56-56-1x1-128-56-56-64-0x0-1x1-1x1-0-NCHW-FP16-W=ConvAsmBwdWrW1x1:2,8,8,1,8,1,4,4,0,1
224-28-28-1x1-128-28-28-64-0x0-1x1-1x1-0-NCHW-FP32-F=ConvAsm1x1U:2,16,2,32,3,2,1,2;ConvOclDirectFwd1x1:1,64,1,1,1,4,16,2048,0
480-7-7-1x1-120-7-7-16-0x0-1x1-1x1-0-NCHW-FP16-B_g3=ConvOclDirectFwd:8,8,8,8,1,1,2,4,2
64-112-112-3x3-128-112-112-2-1x1-1x1-1x1-0-NCHW-FP16-F=ConvOclDirectFwd:8,32,16,32,2,1,8,2,2
1056-14-14-1x1-2112-14-14-16-0x0-1x1-1x1-0-NCHW-FP32-W=ConvAsmBwdWrW1x1:1,16,2,8,8,1,2,4,0,1
16-54-54-1x1-128-54-54-16-0x0-1x1-1x1-0-NCHW-FP32-F=ConvAsm1x1U:1,16,1,64,1,2,2,1;ConvOclDirectFwd1x1:1,64,1,1,1,1,16,256,0
192-28-28-1x1-672-28-28-16-0x0-1x1-1x1-0-NCHW-FP16-B=ConvAsm1x1U:1,16,2,16,1,2,2,2;ConvOclDirectFwd1x1:1,64,1,1,0,4,16,4,0
116-5-203-1x1-992-5-203-4-0x0-1x1-1x1-0-NCHW-FP32-F=ConvAsm1x1U:4,8,4,64,1,4,1,8;ConvOclDirectFwd1x1:1,256,1,1,0,1,16,4,0
3-10-10-3x3-5-10-10-32-1x1-1x1-1x1-0-NCHW-FP16-F=ConvOclDirectFwd:16,16,16,16,1,1,1,2,2
832-7-7-1x1-128-7-7-32-0x0-1x1-1x1-0-NCHW-FP32-B=ConvAsm1x1U:1,16,1,64,1,2,4,2;ConvOclDirectFwd1x1:1,64,1,1,0,1,8,8,0
128-28-28-1x1-224-28-28-32-0x0-1x1-1x1-0-NCHW-FP16-B=ConvAsm1x1U:1,16,2,16,1,2,2,2;ConvOclDirectFwd1x1:1,64,1,1,0,4,16,4,0
160-7-7-1x1-832-7-7-32-0x0-1x1-1x1-0-NCHW-FP32-W=ConvAsmBwdWrW1x1:1,16,2,8,4,1,2,4,0,1
160-109-662-1x1-576-109-662-8-0x0-1x1-1x1-0-NCHW-FP32-F=ConvOclDirectFwd1x1:1,64,1,1,1,0,32,2048,0
24-56-56-1x1-58-56-56-1024-0x0-1x1-1x1-0-NCHW-FP16-F=ConvAsm1x1U:1,8,2,16,1,2,1,1;ConvOclDirectFwd1x1:1,256,1,1,0,2,8,4,0
320-28-28-1x1-128-28-28-128-0x0-1x1-1x1-0-NCHW-FP32-B=ConvAsm1x1U:1,16,1,64,2,2,1,4;ConvOclDirectFwd1x1:1,64,1,1,0,1,32,4,0
464-678-91-1x1-672-678-91-4-0x0-1x1-1x1-0-NCHW-FP32-F=ConvOclDirectFwd1x1:1,64,1,1,1,4,64,2048,0
320-8-8-3x3-192-17-17-1-0x0-2x2-1x1-0-NCHW-FP32-B=ConvOclDirectFwd:16,32,32,32,2,1,1,4,1
128-57-57-3x3-128-57-57-4-1x1-1x1-1x1-0-NCHW-FP32-W_g32=ConvOclBwdWrW2<1>:1,9,3,1,5;ConvAsmBwdWrW3x3:0,1,16,1,2,4;ConvOclBwdWrW2<4>:1,7,1,1,7;ConvOclBwdWrW2<2>:1,7,1,1,7
232-7-7-1x1-232-7-7-1-0x0-1x1-1x1-0-NCHW-FP32-F=ConvAsm1x1U:1,8,1,16,1,4,2,1;ConvOclDirectFwd1x1:1,256,1,1,0,1,16,8,0
3-224-224-7x7-64-112-112-1-3x3-2x2-1x1-0-NCHW-FP32-F=ConvOclDirectFwd:16,8,16,16,1,2,8,1,1
256-28-28-3x3-256-56-56-2-1x1-2x2-1x1-0-NCHW-FP32-B_g32=ConvOclDirectFwd:16,32,32,32,2,1,8,1,1
128-14-14-1x1-800-14-14-256-0x0-1x1-1x1-0-NCHW-FP16-W=ConvAsmBwdWrW1x1:2,8,4,8,2,1,2,4,0,1
704-14-14-1x1-128-14-14-16-0x0-1x1-1x1-0-NCHW-FP16-F=ConvAsm1x1U:2,8,4,64,1,4,4,2;ConvOclDirectFwd1x1:1,64,1,1,0,4,4,4,0
1-489-497-1x1-32-489-497-1-0x0-1x1-1x1-0-NCHW-FP32-W=ConvAsmBwdWrW1x1:4,4,2,1,2,1,1,4,0,3
32-28-28-1x1-256-28-28-128-0x0-1x1-1x1-0-NCHW-FP32-F=ConvAsm1x1U:1,8,1,16,3,4,2,2;ConvOclDirectFwd1x1:1,64,1,1,1,1,32,256,0
3-490-286-1x1-116-490-286-4-0x0-1x1-1x1-0-NCHW-FP32-F=ConvOclDirectFwd1x1:1,128,1,1,0,4,16,4,0
512-7-7-3x3-256-7-7-2-1x1-1x1-1x1-0-NCHW-FP32-W=ConvAsmBwdWrW3x3:0,0,8,4,7,1
832-14-14-1x1-128-14-14-256-0x0-1x1-1x1-0-NCHW-FP16-F=ConvAsm1x1U:1,16,2,16,2,2,1,4;ConvOclDirectFwd1x1:1,64,1,1,0,4,16,4,0
192-210-251-1x1-2160-210-251-4-0x0-1x1-1x1-0-NCHW-FP32-B=ConvOclDirectFwd1x1:1,256,1,1,0,2,16,8,0
32-7-7-1x1-832-7-7-64-0x0-1x1-1x1-0-NCHW-FP16-W=ConvAsmBwdWrW1x1:4,4,4,4,2,1,2,2,0,1
512-4-4-3x3-512-7-7-64-1x1-2x2-1x1-0-NCHW-FP32-B=ConvOclDirectFwd:8,8,8,8,1,1,4,1,2
256-52-52-3x3-128-52-52-32-1x1-1x1-1x1-0-NCHW-FP32-W=ConvAsmBwdWrW3x3:0,0,16,4,2,1
1968-304-578-1x1-116-304-578-1-0x0-1x1-1x1-0-NCHW-FP32-F=ConvOclDirectFwd1x1:1,256,1,1,0,4,16,4,0
480-9-936-1x1-832-9-936-32-0x0-1x1-1x1-0-NCHW-FP32-B=ConvOclDirectFwd1x1:1,64,1,1,0,1,32,4,0
1024-8-8-3x3-1024-15-15-2-1x1-2x2-1x1-0-NCHW-FP32-B_g32=ConvOclDirectFwd:8,8,16,16,2,2,2,2,1
832-439-151-1x1-3-439-151-6-0x0-1x1-1x1-0-NCHW-FP32-B=ConvOclDirectFwd1x1:1,256,1,1,0,1,16,8,0
48-216-628-1x1-832-216-628-4-0x0-1x1-1x1-0-NCHW-FP32-F=ConvOclDirectFwd1x1:1,64,1,1,1,4,16,2048,0
48-538-164-1x1-816-538-164-6-0x0-1x1-1x1-0-NCHW-FP32-B=ConvOclDirectFwd1x1:1,256,1,1,0,4,16,4,0
1024-4-4-1x1-2048-7-7-512-0x0-2x2-1x1-0-NCHW-FP32-B=ConvAsm1x1U:1,32,1,16,2,1,1,2;ConvOclDirectFwd1x1:1,128,1,1,0,1,32,4,0
232-7-7-1x1-232-7-7-16-0x0-1x1-1x1-0-NCHW-FP32-F=ConvAsm1x1U:2,8,2,32,1,4,2,1;ConvOclDirectFwd1x1:1,256,1,1,0,1,16,8,0
608-7-7-1x1-128-7-7-16-0x0-1x1-1x1-0-NCHW-FP16-B=ConvAsm1x1U:1,8,2,16,1,4,4,2;ConvOclDirectFwd1x1:1,64,1,1,0,1,4,8,0
128-28-28-1x1-192-28-28-32-0x0-1x1-1x1-0-NCHW-FP32-B=ConvAsm1x1U:1,16,1,16,1,2,1,1;ConvOclDirectFwd1x1:1,128,1,1,0,4,16,4,0
1376-11-231-1x1-672-11-231-6-0x0-1x1-1x1-0-NCHW-FP32-F=ConvAsm1x1U:3,16,5,64,2,2,1,1;ConvOclDirectFwd1x1:1,64,1,1,1,4,64,2048,0
64-56-56-1x1-256-56-56-2-0x0-1x1-1x1-0-NCHW-FP32-W=ConvAsmBwdWrW1x1:4,4,2,4,2,1,1,4,0,1
120-7-7-3x3-120-14-14-512-1x1-2x2-1x1-0-NCHW-FP32-B=ConvOclDirectFwd:8,8,8,16,1,2,2,2,2
800-7-7-1x1-128-7-7-128-0x0-1x1-1x1-0-NCHW-FP32-B=ConvAsm1x1U:1,16,1,64,2,2,4,1;ConvOclDirectFwd1x1:1,64,1,1,0,1,8,4,0
128-6-60-3x3-64-6-60-1-1x1-1x1-1x1-0-NCHW-FP16-B=ConvOclDirectFwd:8,16,8,16,1,1,1,4,1
704-484-3-1x1-672-484-3-128-0x0-1x1-1x1-0-NCHW-FP32-B=ConvAsm1x1U:3,32,3,32,1,1,1,1;ConvOclDirectFwd1x1:1,256,1,1,0,2,32,4,0
32-7-7-1x1-832-7-7-1-0x0-1x1-1x1-0-NCHW-FP16-W=ConvAsmBwdWrW1x1:1,16,2,1,2,1,1,2,0,1
16-410-182-1x1-1280-410-182-2-0x0-1x1-1x1-0-NCHW-FP32-B=ConvOclDirectFwd1x1:1,256,1,1,0,4,16,8,0
512-7-7-1x1-2048-7-7-8-0x0-1x1-1x1-0-NCHW-FP32-B=ConvAsm1x1U:2,16,2,32,1,2,2,1;ConvOclDirectFwd1x1:1,64,1,1,0,1,16,4,0
128-7-7-1x1-608-7-7-512-0x0-1x1-1x1-0-NCHW-FP16-W=ConvAsmBwdWrW1x1:4,4,4,4,2,1,2,2,0,1
1104-37-194-1x1-1088-37-194-12-0x0-1x1-1x1-0-NCHW-FP32-W=ConvAsmBwdWrW1x1:1,16,2,8,8,1,1,4,0,1
64-54-54-3x3-64-54-54-32-1x1-1x1-1x1-0-NCHW-FP32-W=ConvAsmBwdWrW3x3:0,1,8,4,2,4
32-14-14-5x5-64-14-14-4-2x2-1x1-1x1-0-NCHW-FP16-F=ConvOclDirectFwd:16,16,16,16,1,1,2,4,2;ConvOclDirectFwdFused:16,16,16,16,1,1,2,4,2
528-14-14-1x1-32-14-14-256-0x0-1x1-1x1-0-NCHW-FP16-F=ConvAsm1x1U:1,8,2,16,1,4,1,4;ConvOclDirectFwd1x1:8,64,16,16,0,2,16,4,1
128-104-104-3x3-64-104-104-128-1x1-1x1-1x1-0-NCHW-FP32-W=ConvAsmBwdWrW3x3:0,1,16,4,3,1
3-91-539-1x1-32-91-539-6-0x0-1x1-1x1-0-NCHW-FP32-F=ConvAsm1x1U:4,8,4,64,4,1,1,4;ConvOclDirectFwd1x1:1,256,1,1,0,1,32,4,0
58-28-28-1x1-58-28-28-1024-0x0-1x1-1x1-0-NCHW-FP16-F=ConvAsm1x1U:1,16,2,16,1,2,1,1;ConvOclDirectFwd1x1:1,256,1,1,0,4,16,4,0
128-28-28-1x1-224-28-28-512-0x0-1x1-1x1-0-NCHW-FP16-B=ConvAsm1x1U:1,16,2,16,1,2,1,2;ConvOclDirectFwd1x1:1,64,1,1,0,4,16,4,0
240-14-14-1x1-60-14-14-2-0x0-1x1-1x1-0-NCHW-FP16-B_g3=ConvOclDirectFwd:8,8,8,8,1,1,1,2,2
512-14-14-1x1-24-14-14-4-0x0-1x1-1x1-0-NCHW-FP32-F=ConvAsm1x1U:1,8,1,32,1,4,4,1;ConvOclDirectFwd1x1:1,128,1,1,0,4,4,8,0;ConvActivAsm1x1U:1,16,1,32,1,4
32-7-7-1x1-832-7-7-256-0x0-1x1-1x1-0-NCHW-FP16-W=ConvAsmBwdWrW1x1:2,8,4,8,2,2,4,2,0,1
128-14-14-1x1-416-14-14-16-0x0-1x1-1x1-0-NCHW-FP16-B=ConvAsm1x1U:1,16,2,16,1,2,2,2;ConvOclDirectFwd1x1:1,128,1,1,0,4,8,4,0
24-57-276-1x1-48-57-276-256-0x0-1x1-1x1-0-NCHW-FP32-B=ConvAsm1x1U:1,8,1,64,1,1,1,1;ConvOclDirectFwd1x1:1,128,1,1,0,4,16,4,0
352-14-14-1x1-128-14-14-128-0x0-1x1-1x1-0-NCHW-FP16-W=ConvAsmBwdWrW1x1:2,8,2,8,2,1,4,4,0,3
128-7-7-1x1-672-7-7-512-0x0-1x1-1x1-0-NCHW-FP16-B=ConvAsm1x1U:1,16,2,32,1,2,1,2;ConvOclDirectFwd1x1:1,128,1,1,0,1,32,4,0
128-14-14-1x1-528-14-14-4-0x0-1x1-1x1-0-NCHW-FP32-W=ConvAsmBwdWrW1x1:2,8,2,4,4,1,1,2,0,1
928-7-7-1x1-128-7-7-32-0x0-1x1-1x1-0-NCHW-FP16-W=ConvAsmBwdWrW1x1:2,8,2,8,2,1,2,2,0,1
1024-14-14-1x1-512-28-28-48-0x0-2x2-1x1-0-NCHW-FP32-W=ConvAsmBwdWrW1x1:1,16,4,8,4,1,1,4,0,1
54-591-60-1x1-960-591-60-12-0x0-1x1-1x1-0-NCHW-FP32-B=ConvOclDirectFwd1x1:1,64,1,1,0,1,64,4,0
160-28-28-1x1-128-28-28-16-0x0-1x1-1x1-0-NCHW-FP16-F=ConvAsm1x1U:1,8,2,32,1,4,1,4;ConvOclDirectFwd1x1:1,64,1,1,0,4,16,4,0
4-400-19-1x1-1216-400-19-6-0x0-1x1-1x1-0-NCHW-FP32-B=ConvOclDirectFwd1x1:1,256,1,1,0,1,4,4,0
128-28-28-1x1-224-28-28-256-0x0-1x1-1x1-0-NCHW-FP32-F=ConvAsm1x1U:2,16,2,32,2,2,2,2;ConvOclDirectFwd1x1:1,64,1,1,1,1,64,128,0
96-54-54-1x1-16-54-54-128-0x0-1x1-1x1-0-NCHW-FP32-B=ConvAsm1x1U:1,16,3,64,4,1,1,1;ConvOclDirectFwd1x1:1,256,1,1,0,2,16,4,0
32-14-14-1x1-512-14-14-8-0x0-1x1-1x1-0-NCHW-FP16-B=ConvAsm1x1U:1,8,2,32,2,2,1,1;ConvOclDirectFwd1x1:1,64,1,1,0,4,8,4,0
480-14-14-1x1-64-14-14-4-0x0-1x1-1x1-0-NCHW-FP16-F=ConvAsm1x1U:1,8,2,16,1,4,4,1;ConvOclDirectFwd1x1:1,64,1,1,0,4,4,8,0
384-35-35-1x1-96-35-35-256-0x0-1x1-1x1-0-NCHW-FP32-F=ConvAsm1x1U:4,16,5,64,1,2,2,2;ConvOclDirectFwd1x1:1,64,1,1,1,0,32,2048,0;ConvActivAsm1x1U:2,32,3,32,2,1
320-7-7-3x3-160-7-7-512-1x1-1x1-1x1-0-NCHW-FP16-W=ConvAsmBwdWrW3x3:0,1,8,4,7,2
224-56-56-1x1-128-56-56-256-0x0-1x1-1x1-0-NCHW-FP16-F=ConvAsm1x1U:1,8,2,64,2,4,1,4;ConvOclDirectFwd1x1:1,64,1,1,0,4,16,4,0
8-199-269-1x1-240-199-269-6-0x0-1x1-1x1-0-NCHW-FP32-B=ConvOclDirectFwd1x1:1,256,1,1,0,1,16,8,0
800-7-7-1x1-128-7-7-256-0x0-1x1-1x1-0-NCHW-FP32-W=ConvAsmBwdWrW1x1:2,8,4,8,2,1,2,4,0,1
704-7-7-1x1-128-7-7-128-0x0-1x1-1x1-0-NCHW-FP32-B=ConvAsm1x1U:1,16,1,64,2,2,4,1;ConvOclDirectFwd1x1:1,64,1,1,0,1,8,4,0
512-29-29-1x1-256-29-29-4-0x0-1x1-1x1-0-NCHW-FP32-B=ConvAsm1x1U:1,16,1,64,1,2,2,2;ConvOclDirectFwd1x1:1,64,1,1,0,1,8,4,0
256-15-15-3x3-256-29-29-128-1x1-2x2-1x1-0-NCHW-FP32-W=ConvAsmBwdWrW3x3:0,0,8,8,4,1
64-27-27-3x3-256-27-27-512-1x1-1x1-1x1-0-NCHW-FP16-B=ConvOclDirectFwd:16,16,32,32,2,2,8,2,1
160-17-17-1x1-768-17-17-512-0x0-1x1-1x1-0-NCHW-FP16-W=ConvAsmBwdWrW1x1:2,8,8,8,2,1,2,2,0,1
128-57-57-1x1-256-57-57-8-0x0-1x1-1x1-0-NCHW-FP32-B=ConvAsm1x1U:2,16,2,64,1,2,2,2;ConvOclDirectFwd1x1:1,128,1,1,0,1,32,4,0
128-28-28-1x1-256-28-28-8-0x0-1x1-1x1-0-NCHW-FP16-W=ConvAsmBwdWrW1x1:2,8,2,4,2,1,2,4,0,1
128-28-28-1x1-512-28-28-128-0x0-1x1-1x1-0-NCHW-FP16-F=ConvAsm1x1U:1,8,2,16,2,4,1,4;ConvOclDirectFwd1x1:1,64,1,1,0,4,16,4,0
800-14-14-1x1-128-14-14-256-0x0-1x1-1x1-0-NCHW-FP16-W=ConvAsmBwdWrW1x1:2,8,4,8,2,2,2,4,0,1
1632-175-292-1x1-1-175-292-4-0x0-1x1-1x1-0-NCHW-FP32-F=ConvOclDirectFwd1x1:1,64,1,1,0,4,16,4,0
240-28-28-1x1-60-28-28-4-0x0-1x1-1x1-0-NCHW-FP32-F_g3=ConvOclDirectFwd:16,16,16,16,1,1,4,4,2
288-353-872-1x1-128-353-872-1-0x0-1x1-1x1-0-NCHW-FP32-B=ConvOclDirectFwd1x1:1,256,1,1,0,1,32,4,0
384-8-8-1x1-1280-8-8-32-0x0-1x1-1x1-0-NCHW-FP16-B=ConvAsm1x1U:1,16,2,32,1,2,2,4;ConvOclDirectFwd1x1:1,64,1,1,0,2,8,4,0
128-39-174-5x5-64-80-350-1-1x1-2x2-1x1-0-NCHW-FP32-W=ConvOclBwdWrW2<1>:3,6,8,1,5
1152-151-481-1x1-1056-151-481-2-0x0-1x1-1x1-0-NCHW-FP32-F=ConvOclDirectFwd1x1:1,64,1,1,1,4,64,2048,0
1296-44-141-1x1-800-44-141-16-0x0-1x1-1x1-0-NCHW-FP32-F=ConvOclDirectFwd1x1:1,64,1,1,1,0,64,2048,0
224-35-35-3x3-256-17-17-256-0x0-2x2-1x1-0-NCHW-FP32-F=ConvOclDirectFwd:32,8,32,32,1,4,8,1,1
128-54-54-1x1-32-54-54-64-0x0-1x1-1x1-0-NCHW-FP32-W=ConvAsmBwdWrW1x1:4,4,2,4,2,1,2,4,0,2
704-328-621-1x1-192-328-621-1-0x0-1x1-1x1-0-NCHW-FP32-B=ConvOclDirectFwd1x1:1,128,1,1,0,2,32,4,0
608-14-14-1x1-128-14-14-32-0x0-1x1-1x1-0-NCHW-FP16-B=ConvAsm1x1U:1,16,2,64,1,2,4,2;ConvOclDirectFwd1x1:1,64,1,1,0,2,32,8,0
232-7-7-1x1-232-7-7-32-0x0-1x1-1x1-0-NCHW-FP16-F=ConvAsm1x1U:1,8,2,32,1,4,2,1;ConvOclDirectFwd1x1:1,64,1,1,0,1,16,8,0
1024-14-14-1x1-256-14-14-128-0x0-1x1-1x1-0-NCHW-FP16-B=ConvAsm1x1U:1,16,2,16,1,2,2,2;ConvOclDirectFwd1x1:1,64,1,1,0,2,32,8,0
128-28-28-3x3-128-56-56-64-1x1-2x2-1x1-0-NCHW-FP32-W=ConvAsmBwdWrW3x3:0,0,8,8,4,1
736-968-25-1x1-928-968-25-4-0x0-1x1-1x1-0-NCHW-FP32-B=ConvOclDirectFwd1x1:1,256,1,1,0,2,32,4,0
128-14-14-3x3-128-28-28-256-1x1-2x2-1x1-0-NCHW-FP32-B=ConvOclDirectFwd:8,32,32,32,4,1,8,2,1
512-15-15-3x3-512-29-29-128-1x1-2x2-1x1-0-NCHW-FP32-B_g32=ConvOclDirectFwd:32,8,32,32,1,4,4,4,1
128-28-28-1x1-480-28-28-64-0x0-1x1-1x1-0-NCHW-FP16-W=ConvAsmBwdWrW1x1:4,4,4,4,4,1,2,2,0,1
576-902-251-1x1-672-902-251-2-0x0-1x1-1x1-0-NCHW-FP32-B=ConvOclDirectFwd1x1:1,256,1,1,0,2,32,4,0
128-14-14-1x1-576-14-14-128-0x0-1x1-1x1-0-NCHW-FP32-F=ConvAsm1x1U:1,16,1,32,4,2,2,2;ConvOclDirectFwd1x1:8,8,16,16,1,0,32,128,1
16-54-54-3x3-64-54-54-64-1x1-1x1-1x1-0-NCHW-FP32-B=ConvOclDirectFwd:16,8,16,16,1,2,8,2,2;ConvAsm3x3U:6,8,3
1664-333-64-1x1-960-333-64-4-0x0-1x1-1x1-0-NCHW-FP32-F=ConvOclDirectFwd1x1:1,64,1,1,1,4,16,2048,0
512-14-14-1x1-24-14-14-256-0x0-1x1-1x1-0-NCHW-FP32-F=ConvAsm1x1U:4,8,4,64,1,2,1,1;ConvOclDirectFwd1x1:1,256,1,1,0,2,16,4,0;ConvActivAsm1x1U:3,16,4,64,1,4
96-35-35-3x3-64-35-35-64-1x1-1x1-1x1-0-NCHW-FP16-B=ConvOclDirectFwd:16,8,16,16,1,2,8,1,1
128-39-174-5x5-64-80-350-16-1x1-2x2-1x1-0-NCHW-FP32-B=ConvOclDirectFwd:16,32,16,32,1,1,4,2,1
128-14-14-1x1-992-14-14-16-0x0-1x1-1x1-0-NCHW-FP32-F=ConvAsm1x1U:2,8,4,64,1,4,2,2;ConvOclDirectFwd1x1:1,64,1,1,1,1,64,2048,0
128-14-14-1x1-352-14-14-128-0x0-1x1-1x1-0-NCHW-FP16-B=ConvAsm1x1U:1,16,2,16,1,2,2,2;ConvOclDirectFwd1x1:1,128,1,1,0,4,16,4,0
192-28-28-1x1-16-28-28-32-0x0-1x1-1x1-0-NCHW-FP32-F=ConvAsm1x1U:2,8,2,64,1,4,1,1;ConvOclDirectFwd1x1:1,64,1,1,1,4,64,2048,0;ConvActivAsm1x1U:1,16,1,64,2,2
512-7-7-3x3-512-16-16-256-0x0-2x2-1x1-0-NCHW-FP16-B=ConvOclDirectFwd:16,16,16,16,1,1,4,1,2
896-14-14-1x1-128-14-14-256-0x0-1x1-1x1-0-NCHW-FP32-W=ConvAsmBwdWrW1x1:2,8,4,8,4,1,2,4,0,1
384-13-13-3x3-192-13-13-128-1x1-1x1-1x1-0-NCHW-FP16-W=ConvAsmBwdWrW3x3:0,1,8,4,1,1
120-7-7-1x1-480-7-7-1-0x0-1x1-1x1-0-NCHW-FP32-F_g3=ConvOclDirectFwd:8,8,8,8,1,1,1,4,1
2048-7-7-1x1-512-7-7-16-0x0-1x1-1x1-0-NCHW-FP16-W=ConvAsmBwdWrW1x1:1,16,4,8,2,1,1,2,0,2
3-10-10-3x3-5-10-10-256-1x1-1x1-1x1-0-NCHW-FP32-F=ConvOclDirectFwd:8,8,16,16,2,2,2,2,2
48-110-1017-1x1-58-110-1017-4-0x0-1x1-1x1-0-NCHW-FP32-W=ConvAsmBwdWrW1x1:4,4,2,1,8,1,2,4,0,3
240-7-7-1x1-960-7-7-1024-0x0-1x1-1x1-0-NCHW-FP16-F_g3=ConvOclDirectFwd:8,8,8,8,1,1,8,2,1
1488-14-14-1x1-192-14-14-16-0x0-1x1-1x1-0-NCHW-FP32-F=ConvAsm1x1U:3,16,3,16,4,2,4,1;ConvOclDirectFwd1x1:1,64,1,1,1,4,16,256,0;ConvActivAsm1x1U:3,16,3,16,4,4
352-395-595-1x1-608-395-595-1-0x0-1x1-1x1-0-NCHW-FP32-B=ConvOclDirectFwd1x1:1,128,1,1,0,1,32,4,0
192-14-14-1x1-576-14-14-32-0x0-1x1-1x1-0-NCHW-FP32-B=ConvAsm1x1U:1,16,1,32,2,2,1,2;ConvOclDirectFwd1x1:1,64,1,1,0,4,16,4,0
1000-45-19-1x1-2048-45-19-256-0x0-1x1-1x1-0-NCHW-FP32-W=ConvAsmBwdWrW1x1:1,16,2,8,8,1,1,4,0,0
32-489-497-1x1-1-489-497-1-0x0-1x1-1x1-0-NCHW-FP32-F=ConvOclDirectFwd1x1:1,256,1,1,0,1,16,4,0
32-28-28-1x1-192-28-28-8-0x0-1x1-1x1-0-NCHW-FP32-B=ConvAsm1x1U:1,16,1,32,1,2,1,2;ConvOclDirectFwd1x1:1,256,1,1,0,2,8,4,0
736-3-50-1x1-1184-3-50-12-0x0-1x1-1x1-0-NCHW-FP32-B=ConvAsm1x1U:1,16,1,32,3,2,1,4;ConvOclDirectFwd1x1:8,64,8,32,0,2,16,4,1
1408-835-13-1x1-992-835-13-4-0x0-1x1-1x1-0-NCHW-FP32-F=ConvOclDirectFwd1x1:1,64,1,1,1,0,64,2048,0
2048-1001-254-1x1-1376-1001-254-1-0x0-1x1-1x1-0-NCHW-FP32-B=ConvOclDirectFwd1x1:1,128,1,1,0,2,32,4,0
256-14-14-3x3-256-14-14-64-1x1-1x1-1x1-0-NCHW-FP16-W=ConvAsmBwdWrW3x3:0,1,8,4,4,1
704-14-14-1x1-128-14-14-32-0x0-1x1-1x1-0-NCHW-FP16-F=ConvAsm1x1U:2,8,4,64,1,4,4,2;ConvOclDirectFwd1x1:1,64,1,1,0,2,8,4,0
128-7-7-1x1-544-7-7-64-0x0-1x1-1x1-0-NCHW-FP32-W=ConvAsmBwdWrW1x1:1,16,2,8,2,1,2,4,0,2
1968-171-289-1x1-832-171-289-4-0x0-1x1-1x1-0-NCHW-FP32-F=ConvOclDirectFwd1x1:1,64,1,1,1,1,16,2048,0
512-669-770-1x1-32-669-770-1-0x0-1x1-1x1-0-NCHW-FP32-B=ConvOclDirectFwd1x1:1,256,1,1,0,1,32,4,0
1-161-700-5x5-64-80-349-32-1x1-2x2-1x1-0-NCHW-FP32-F=ConvOclDirectFwd:8,32,16,32,2,1,8,1,2
192-28-28-1x1-384-28-28-16-0x0-1x1-1x1-0-NCHW-FP32-B=ConvAsm1x1U:1,16,1,32,1,2,1,4;ConvOclDirectFwd1x1:1,128,1,1,0,4,16,4,0
128-28-28-1x1-512-28-28-16-0x0-1x1-1x1-0-NCHW-FP32-W=ConvAsmBwdWrW1x1:4,4,4,4,4,1,1,4,0,1
96-54-54-1x1-16-54-54-16-0x0-1x1-1x1-0-NCHW-FP16-F=ConvAsm1x1U:1,8,2,64,1,4,2,1;ConvOclDirectFwd1x1:1,256,1,1,0,2,8,4,0
48-965-331-1x1-96-965-331-2-0x0-1x1-1x1-0-NCHW-FP32-B=ConvOclDirectFwd1x1:1,256,1,1,0,1,32,4,0
192-28-28-1x1-32-28-28-256-0x0-1x1-1x1-0-NCHW-FP16-F=ConvAsm1x1U:1,8,2,32,1,4,2,2;ConvOclDirectFwd1x1:1,128,1,1,0,4,16,4,0
80-49-713-1x1-912-49-713-2-0x0-1x1-1x1-0-NCHW-FP32-B=ConvOclDirectFwd1x1:1,256,1,1,0,1,16,4,0
192-7-7-1x1-832-7-7-32-0x0-1x1-1x1-0-NCHW-FP16-B=ConvAsm1x1U:1,16,2,16,1,2,2,2;ConvOclDirectFwd1x1:1,64,1,1,0,1,8,4,0
128-14-14-3x3-128-28-28-16-1x1-2x2-1x1-0-NCHW-FP32-W=ConvAsmBwdWrW3x3:0,0,8,4,7,1
160-14-14-1x1-576-14-14-64-0x0-1x1-1x1-0-NCHW-FP16-B=ConvAsm1x1U:1,16,2,16,1,2,2,2;ConvOclDirectFwd1x1:8,64,16,16,0,2,16,4,1
192-7-7-1x1-1056-7-7-64-0x0-1x1-1x1-0-NCHW-FP32-W=ConvAsmBwdWrW1x1:1,16,4,4,8,1,2,4,0,1
144-21-83-1x1-1104-21-83-128-0x0-1x1-1x1-0-NCHW-FP32-F=ConvAsm1x1U:3,16,5,32,1,1,2,1;ConvOclDirectFwd1x1:1,64,1,1,1,0,32,256,0
336-409-918-1x1-608-409-918-1-0x0-1x1-1x1-0-NCHW-FP32-F=ConvOclDirectFwd1x1:1,64,1,1,1,4,64,2048,0
160-73-73-1x1-64-73-73-16-0x0-1x1-1x1-0-NCHW-FP16-F=ConvAsm1x1U:3,8,6,64,1,4,1,4;ConvOclDirectFwd1x1:1,64,1,1,0,1,32,4,0
256-120-192-3x3-256-120-192-64-1x1-1x1-1x1-0-NCHW-FP16-F=ConvOclDirectFwd:16,16,32,32,2,2,8,2,1
256-8-8-1x1-1536-8-8-128-0x0-1x1-1x1-0-NCHW-FP32-B=ConvAsm1x1U:1,16,1,64,2,2,1,4;ConvOclDirectFwd1x1:1,128,1,1,0,4,16,4,0
144-289-10-1x1-912-289-10-12-0x0-1x1-1x1-0-NCHW-FP32-B=ConvAsm1x1U:2,16,2,64,1,2,2,2;ConvOclDirectFwd1x1:1,128,1,1,0,2,16,4,0
960-14-14-1x1-128-14-14-256-0x0-1x1-1x1-0-NCHW-FP16-W=ConvAsmBwdWrW1x1:2,8,4,8,2,1,2,2,0,2
192-589-676-1x1-608-589-676-1-0x0-1x1-1x1-0-NCHW-FP32-F=ConvOclDirectFwd1x1:1,64,1,1,1,0,64,2048,0
16-14-14-1x1-480-14-14-128-0x0-1x1-1x1-0-NCHW-FP16-W=ConvAsmBwdWrW1x1:4,4,4,4,2,2,4,4,0,1
128-4-4-1x1-576-4-4-32-0x0-1x1-1x1-0-NCHW-FP16-W=ConvAsmBwdWrW1x1:2,8,2,4,2,2,2,2,0,1
928-101-408-1x1-160-101-408-4-0x0-1x1-1x1-0-NCHW-FP32-B=ConvOclDirectFwd1x1:1,256,1,1,0,1,32,4,0
128-28-28-1x1-128-28-28-128-0x0-1x1-1x1-0-NCHW-FP16-B=ConvAsm1x1U:1,8,2,16,1,4,1,4;ConvOclDirectFwd1x1:1,128,1,1,0,2,32,8,0
1024-15-15-1x1-1024-15-15-64-0x0-1x1-1x1-0-NCHW-FP32-W=ConvAsmBwdWrW1x1:1,16,4,4,8,1,1,4,0,1
128-112-112-3x3-64-112-112-128-1x1-1x1-1x1-0-NCHW-FP32-W=ConvAsmBwdWrW3x3:0,1,16,4,2,1
32-193-189-1x1-3-193-189-2-0x0-1x1-1x1-0-NCHW-FP32-W=ConvAsmBwdWrW1x1:4,4,2,1,2,1,2,4,0,3
1280-8-8-1x1-192-8-8-128-0x0-1x1-1x1-0-NCHW-FP16-F=ConvAsm1x1U:1,8,2,32,2,4,2,4;ConvOclDirectFwd1x1:1,64,1,1,0,2,8,4,0
128-57-57-3x3-128-29-29-4-1x1-2x2-1x1-0-NCHW-FP32-F=ConvOclDirectFwd:16,16,16,16,1,1,8,2,2
16-54-54-1x1-128-54-54-512-0x0-1x1-1x1-0-NCHW-FP32-F=ConvAsm1x1U:1,8,1,32,1,2,2,2;ConvOclDirectFwd1x1:1,64,1,1,1,4,16,256,0
64-128-256-1x1-192-128-256-1-0x0-1x1-1x1-0-NCHW-FP16-B=ConvOclDirectFwd1x1:1,128,1,1,0,4,16,4,0
64-35-35-1x1-288-35-35-16-0x0-1x1-1x1-0-NCHW-FP32-W=ConvAsmBwdWrW1x1:2,8,4,8,2,1,4,4,0,1
32-147-147-3x3-32-149-149-64-0x0-1x1-1x1-0-NCHW-FP32-B=ConvOclDirectFwd:16,16,16,32,1,2,8,4,2
1056-7-7-1x1-352-7-7-64-0x0-1x1-1x1-0-NCHW-FP16-F=ConvAsm1x1U:2,8,4,16,1,4,4,1;ConvOclDirectFwd1x1:1,64,1,1,0,1,8,8,0
256-80-128-3x3-256-80-128-16-1x1-1x1-1x1-0-NCHW-FP16-B=ConvOclDirectFwd:8,16,16,32,2,2,8,1,1
128-54-54-3x3-32-54-54-64-1x1-1x1-1x1-0-NCHW-FP32-W=ConvAsmBwdWrW3x3:0,0,8,4,2,4
288-649-172-1x1-1920-649-172-1-0x0-1x1-1x1-0-NCHW-FP32-B=ConvOclDirectFwd1x1:1,256,1,1,0,1,32,4,0
160-7-7-1x1-832-7-7-1-0x0-1x1-1x1-0-NCHW-FP32-W=ConvAsmBwdWrW1x1:1,16,2,2,4,1,1,4,0,2
544-330-222-1x1-1000-330-222-4-0x0-1x1-1x1-0-NCHW-FP32-B=ConvOclDirectFwd1x1:1,256,1,1,0,2,16,4,0
672-14-14-1x1-128-14-14-128-0x0-1x1-1x1-0-NCHW-FP16-F=ConvAsm1x1U:2,8,4,64,1,4,2,2;ConvOclDirectFwd1x1:1,64,1,1,0,2,16,4,0
128-28-28-3x3-128-28-28-4-1x1-1x1-1x1-0-NCHW-FP16-F=ConvOclDirectFwd:8,32,32,32,4,1,4,4,2;ConvOclDirectFwdFused:8,32,32,32,4,1,4,4,2
832-7-7-5x5-128-7-7-32-2x2-1x1-1x1-0-NCHW-FP32-F=ConvOclDirectFwd:8,8,8,8,1,1,4,4,2
256-27-27-3x3-64-27-27-64-1x1-1x1-1x1-0-NCHW-FP16-W=ConvAsmBwdWrW3x3:0,1,8,2,2,4
192-118-899-1x1-2064-118-899-2-0x0-1x1-1x1-0-NCHW-FP32-B=ConvOclDirectFwd1x1:1,256,1,1,0,2,16,4,0
112-639-367-1x1-232-639-367-8-0x0-1x1-1x1-0-NCHW-FP32-B=ConvOclDirectFwd1x1:1,256,1,1,0,1,16,4,0
128-14-14-1x1-704-14-14-64-0x0-1x1-1x1-0-NCHW-FP32-W=ConvAsmBwdWrW1x1:2,8,8,8,2,1,2,4,0,1
192-27-27-5x5-64-27-27-64-2x2-1x1-1x1-0-NCHW-FP32-F=ConvOclDirectFwd:16,16,32,32,2,2,8,1,2
2048-7-7-1x1-1024-4-4-64-0x0-2x2-1x1-0-NCHW-FP32-F=ConvAsm1x1U:1,16,1,16,4,2,2,1;ConvOclDirectFwd1x1:1,64,1,1,1,0,16,2048,0
64-13-13-1x1-512-13-13-512-0x0-1x1-1x1-0-NCHW-FP32-F=ConvAsm1x1U:1,16,1,64,4,2,1,4;ConvOclDirectFwd1x1:8,8,16,16,1,0,32,128,1
54-828-689-1x1-4-828-689-6-0x0-1x1-1x1-0-NCHW-FP32-B=ConvOclDirectFwd1x1:1,128,1,1,0,4,16,4,0
3-32-32-1x1-3-32-32-256-0x0-1x1-1x1-0-NCHW-FP32-B=ConvAsm1x1U:4,1,4,4,3,1,1,1;ConvOclDirectFwd1x1:1,256,1,1,0,4,4,4,0
128-14-14-1x1-928-14-14-64-0x0-1x1-1x1-0-NCHW-FP16-B=ConvAsm1x1U:1,16,2,16,1,2,2,2;ConvOclDirectFwd1x1:1,256,1,1,0,4,16,4,0
128-28-28-1x1-320-28-28-64-0x0-1x1-1x1-0-NCHW-FP32-F=ConvAsm1x1U:1,16,1,32,3,2,2,4;ConvOclDirectFwd1x1:1,64,1,1,1,4,16,256,0
192-17-17-3x3-320-8-8-32-0x0-2x2-1x1-0-NCHW-FP32-F=ConvOclDirectFwd:8,8,8,8,1,1,8,2,2
288-765-375-1x1-800-765-375-1-0x0-1x1-1x1-0-NCHW-FP32-F=ConvOclDirectFwd1x1:1,64,1,1,1,4,64,2048,0
512-28-28-1x1-128-28-28-4-0x0-1x1-1x1-0-NCHW-FP16-W=ConvAsmBwdWrW1x1:4,4,4,4,2,2,1,2,0,1
128-28-28-1x1-256-28-28-64-0x0-1x1-1x1-0-NCHW-FP32-B=ConvAsm1x1U:1,8,1,16,1,4,1,4;ConvOclDirectFwd1x1:1,64,1,1,0,1,32,4,0
58-315-38-1x1-416-315-38-64-0x0-1x1-1x1-0-NCHW-FP32-W=ConvAsmBwdWrW1x1:2,8,2,8,2,1,1,4,0,1
288-114-23-1x1-352-114-23-6-0x0-1x1-1x1-0-NCHW-FP32-W=ConvAsmBwdWrW1x1:2,8,4,4,8,1,2,4,0,1
256-28-28-3x3-256-56-56-1-1x1-2x2-1x1-0-NCHW-FP32-W_g32=ConvOclBwdWrW2<1>:1,7,1,1,3;ConvAsmBwdWrW3x3:0,0,8,1,2,1
128-28-28-1x1-512-28-28-1-0x0-1x1-1x1-0-NCHW-FP16-F=ConvAsm1x1U:1,8,2,64,1,4,2,4;ConvOclDirectFwd1x1:1,64,1,1,0,2,8,4,0
16-54-54-1x1-128-54-54-64-0x0-1x1-1x1-0-NCHW-FP32-W=ConvAsmBwdWrW1x1:4,4,2,2,2,1,2,4,0,3
32-35-35-1x1-192-35-35-1-0x0-1x1-1x1-0-NCHW-FP32-B=ConvAsm1x1U:1,8,2,64,1,4,1,1;ConvOclDirectFwd1x1:1,256,1,1,0,1,4,4,0
120-14-14-1x1-480-14-14-64-0x0-1x1-1x1-0-NCHW-FP32-F_g3=ConvOclDirectFwd:16,16,16,16,1,1,8,4,1
1776-7-7-1x1-192-7-7-16-0x0-1x1-1x1-0-NCHW-FP32-F=ConvAsm1x1U:2,8,2,32,1,4,2,4;ConvOclDirectFwd1x1:1,64,1,1,1,0,16,256,0;ConvActivAsm1x1U:4,16,4,16,1,4
192-28-28-1x1-192-28-28-16-0x0-1x1-1x1-0-NCHW-FP16-F=ConvAsm1x1U:1,8,2,16,1,4,1,4;ConvOclDirectFwd1x1:1,64,1,1,0,2,8,4,0
32-7-7-1x1-832-7-7-32-0x0-1x1-1x1-0-NCHW-FP32-B=ConvAsm1x1U:1,16,1,64,1,2,2,1;ConvOclDirectFwd1x1:1,256,1,1,0,1,8,4,0
16-54-54-1x1-128-54-54-16-0x0-1x1-1x1-0-NCHW-FP16-F=ConvAsm1x1U:1,8,2,64,1,4,1,4;ConvOclDirectFwd1x1:1,256,1,1,0,4,8,4,0
64-13-13-1x1-256-13-13-256-0x0-1x1-1x1-0-NCHW-FP32-F=ConvAsm1x1U:3,16,3,64,1,2,2,2;ConvOclDirectFwd1x1:1,64,1,1,1,1,32,256,0
384-13-13-3x3-256-13-13-64-1x1-1x1-1x1-0-NCHW-FP16-F=ConvOclDirectFwd:8,8,16,16,2,2,8,2,2;ConvOclDirectFwdFused:8,8,16,16,2,2,8,2,1
640-568-38-1x1-2048-568-38-1-0x0-1x1-1x1-0-NCHW-FP32-F=ConvOclDirectFwd1x1:1,64,1,1,1,1,16,2048,0
1728-154-360-1x1-736-154-360-1-0x0-1x1-1x1-0-NCHW-FP32-F=ConvOclDirectFwd1x1:1,64,1,1,1,4,64,2048,0
192-27-27-5x5-64-27-27-64-2x2-1x1-1x1-0-NCHW-FP32-B=ConvOclDirectFwd:16,16,32,32,2,2,4,2,2
256-7-7-1x1-832-7-7-8-0x0-1x1-1x1-0-NCHW-FP32-B=ConvAsm1x1U:1,8,1,64,2,4,2,8;ConvOclDirectFwd1x1:1,128,1,1,0,1,4,8,0
1024-7-7-1x1-464-7-7-256-0x0-1x1-1x1-0-NCHW-FP16-B=ConvAsm1x1U:2,8,4,16,1,4,2,2;ConvOclDirectFwd1x1:1,128,1,1,0,1,16,4,0
58-97-332-1x1-2016-97-332-4-0x0-1x1-1x1-0-NCHW-FP32-B=ConvOclDirectFwd1x1:1,128,1,1,0,2,32,4,0
288-28-28-1x1-128-28-28-512-0x0-1x1-1x1-0-NCHW-FP16-F=ConvAsm1x1U:1,16,2,16,2,2,1,2;ConvOclDirectFwd1x1:1,256,1,1,0,4,16,4,0
512-7-7-3x3-512-16-16-64-0x0-2x2-1x1-0-NCHW-FP32-B=ConvOclDirectFwd:16,16,16,16,1,1,4,1,2
528-14-14-1x1-128-14-14-4-0x0-1x1-1x1-0-NCHW-FP16-F=ConvAsm1x1U:1,8,2,16,1,4,4,1;ConvOclDirectFwd1x1:1,64,1,1,0,4,4,4,0
54-512-374-1x1-1280-512-374-1-0x0-1x1-1x1-0-NCHW-FP32-B=ConvOclDirectFwd1x1:1,256,1,1,0,4,16,4,0
2-5-5-3x3-1-2-2-512-0x0-2x2-1x1-0-NCHW-FP32-F=ConvOclDirectFwd:8,8,8,8,1,1,1,1,2
128-7-7-3x3-32-7-7-128-1x1-1x1-1x1-0-NCHW-FP16-B=ConvOclDirectFwd:8,8,8,8,1,1,4,1,2
512-7-7-3x3-512-7-7-512-1x1-1x1-1x1-0-NCHW-FP32-W=ConvAsmBwdWrW3x3:0,1,8,4,6,1
256-14-14-1x1-512-28-28-256-0x0-2x2-1x1-0-NCHW-FP32-W=ConvAsmBwdWrW1x1:1,16,2,4,8,1,2,4,0,3
480-28-28-1x1-128-28-28-32-0x0-1x1-1x1-0-NCHW-FP16-B=ConvAsm1x1U:1,16,2,16,1,2,4,1;ConvOclDirectFwd1x1:1,64,1,1,0,4,16,4,0
192-54-523-1x1-1104-54-523-4-0x0-1x1-1x1-0-NCHW-FP32-B=ConvOclDirectFwd1x1:1,256,1,1,0,2,16,4,0
192-579-36-1x1-1472-579-36-2-0x0-1x1-1x1-0-NCHW-FP32-B=ConvOclDirectFwd1x1:1,256,1,1,0,2,32,4,0
448-8-8-1x1-2048-8-8-64-0x0-1x1-1x1-0-NCHW-FP16-B=ConvAsm1x1U:1,16,2,32,1,2,2,4;ConvOclDirectFwd1x1:1,64,1,1,0,4,16,4,0
912-25-72-1x1-352-25-72-12-0x0-1x1-1x1-0-NCHW-FP32-F=ConvAsm1x1U:4,16,6,32,1,2,1,8;ConvOclDirectFwd1x1:1,64,1,1,1,4,64,2048,0
128-14-14-1x1-960-14-14-16-0x0-1x1-1x1-0-NCHW-FP16-B=ConvAsm1x1U:1,16,2,16,1,2,2,2;ConvOclDirectFwd1x1:1,128,1,1,0,4,8,4,0
16-28-28-1x1-192-28-28-1-0x0-1x1-1x1-0-NCHW-FP16-W=ConvAsmBwdWrW1x1:4,4,2,1,2,1,2,4,0,2
1024-7-7-1x1-464-7-7-2-0x0-1x1-1x1-0-NCHW-FP16-W=ConvAsmBwdWrW1x1:1,16,4,4,2,1,1,2,0,0
192-14-14-1x1-480-14-14-16-0x0-1x1-1x1-0-NCHW-FP16-W=ConvAsmBwdWrW1x1:2,8,2,4,4,1,2,4,0,0
24-637-122-1x1-58-637-122-2-0x0-1x1-1x1-0-NCHW-FP32-W=ConvAsmBwdWrW1x1:4,4,2,1,4,1,2,4,0,3
288-14-14-3x3-144-14-14-128-1x1-1x1-1x1-0-NCHW-FP16-W=ConvAsmBwdWrW3x3:0,0,8,2,6,4
116-28-28-1x1-116-28-28-2-0x0-1x1-1x1-0-NCHW-FP16-F=ConvAsm1x1U:1,8,2,16,1,2,2,1;ConvOclDirectFwd1x1:1,64,1,1,0,2,16,4,0
544-14-14-1x1-128-14-14-256-0x0-1x1-1x1-0-NCHW-FP16-F=ConvAsm1x1U:1,16,2,16,2,2,1,4;ConvOclDirectFwd1x1:1,64,1,1,0,2,16,4,0
256-1-1-3x3-128-3-3-64-0x0-1x1-1x1-0-NCHW-FP32-B=ConvOclDirectFwd:8,8,8,8,1,1,8,4,1
1152-13-962-1x1-32-13-962-1-0x0-1x1-1x1-0-NCHW-FP32-F=ConvOclDirectFwd1x1:1,64,1,1,1,4,64,256,0
128-7-7-1x1-800-7-7-256-0x0-1x1-1x1-0-NCHW-FP16-B=ConvAsm1x1U:1,16,2,32,1,2,1,2;ConvOclDirectFwd1x1:1,64,1,1,0,1,8,4,0
864-479-875-1x1-960-479-875-1-0x0-1x1-1x1-0-NCHW-FP32-B=ConvOclDirectFwd1x1:1,256,1,1,0,1,32,4,0
5-10-10-3x3-3-10-10-512-1x1-1x1-1x1-0-NCHW-FP32-B=ConvOclDirectFwd:8,8,16,16,2,2,2,1,2
512-7-7-1x1-512-7-7-8-0x0-1x1-1x1-0-NCHW-FP16-W=ConvAsmBwdWrW1x1:1,16,2,8,2,1,2,2,0,1
256-14-14-1x1-256-14-14-16-0x0-1x1-1x1-0-NCHW-FP16-W=ConvAsmBwdWrW1x1:2,8,2,4,2,1,1,4,0,1
416-14-14-1x1-128-14-14-64-0x0-1x1-1x1-0-NCHW-FP32-W=ConvAsmBwdWrW1x1:2,8,4,8,2,1,2,4,0,2
232-60-592-1x1-1584-60-592-8-0x0-1x1-1x1-0-NCHW-FP32-B=ConvOclDirectFwd1x1:1,64,1,1,0,1,16,4,0
736-149-361-1x1-576-149-361-6-0x0-1x1-1x1-0-NCHW-FP32-F=ConvOclDirectFwd1x1:1,64,1,1,1,4,16,2048,0
116-28-28-1x1-116-28-28-256-0x0-1x1-1x1-0-NCHW-FP16-W=ConvAsmBwdWrW1x1:4,4,8,1,8,1,4,4,0,1
1024-7-7-1x1-464-7-7-2-0x0-1x1-1x1-0-NCHW-FP32-B=ConvAsm1x1U:1,8,1,32,1,4,4,1;ConvOclDirectFwd1x1:1,64,1,1,0,1,4,8,0
224-56-56-1x1-128-56-56-32-0x0-1x1-1x1-0-NCHW-FP32-F=ConvAsm1x1U:1,16,1,64,2,2,1,4;ConvOclDirectFwd1x1:1,64,1,1,1,0,16,2048,0
256-14-14-1x1-128-28-28-12-0x0-2x2-1x1-0-NCHW-FP32-B=ConvAsm1x1U:2,16,2,64,1,2,4,1;ConvOclDirectFwd1x1:1,256,1,1,0,1,8,8,0
128-28-28-1x1-416-28-28-16-0x0-1x1-1x1-0-NCHW-FP16-F=ConvAsm1x1U:2,8,4,16,1,4,1,4;ConvOclDirectFwd1x1:1,64,1,1,0,4,16,4,0
128-7-7-1x1-928-7-7-512-0x0-1x1-1x1-0-NCHW-FP32-F=ConvAsm1x1U:1,16,1,64,4,2,1,4;ConvOclDirectFwd1x1:1,64,1,1,1,1,64,128,0
512-15-15-1x1-1024-15-15-4-0x0-1x1-1x1-0-NCHW-FP32-F=ConvAsm1x1U:4,16,4,64,1,2,2,1;ConvOclDirectFwd1x1:1,64,1,1,1,1,16,2048,0
384-8-8-3x3-448-8-8-4-1x1-1x1-1x1-0-NCHW-FP16-W=ConvAsmBwdWrW3x3:0,1,8,4,3,1
96-35-35-3x3-64-35-35-256-1x1-1x1-1x1-0-NCHW-FP32-W=ConvAsmBwdWrW3x3:0,0,8,4,3,4
224-67-853-1x1-1216-67-853-2-0x0-1x1-1x1-0-NCHW-FP32-B=ConvOclDirectFwd1x1:1,128,1,1,0,1,32,4,0
448-590-873-1x1-96-590-873-1-0x0-1x1-1x1-0-NCHW-FP32-F=ConvOclDirectFwd1x1:1,64,1,1,1,4,64,2048,0
96-35-35-1x1-384-35-35-8-0x0-1x1-1x1-0-NCHW-FP32-W=ConvAsmBwdWrW1x1:1,16,2,8,4,1,4,4,0,1
192-7-7-1x1-1488-7-7-16-0x0-1x1-1x1-0-NCHW-FP32-W=ConvAsmBwdWrW1x1:1,16,2,8,4,1,1,4,0,1
192-14-14-1x1-1200-14-14-16-0x0-1x1-1x1-0-NCHW-FP16-B=ConvAsm1x1U:1,16,2,16,1,2,2,2;ConvOclDirectFwd1x1:1,128,1,1,0,4,8,4,0
512-14-14-1x1-192-14-14-8-0x0-1x1-1x1-0-NCHW-FP32-F=ConvAsm1x1U:4,8,4,64,1,4,4,1;ConvOclDirectFwd1x1:1,64,1,1,1,0,16,128,0
128-14-14-1x1-928-14-14-16-0x0-1x1-1x1-0-NCHW-FP32-F=ConvAsm1x1U:2,16,2,16,2,2,2,2;ConvOclDirectFwd1x1:1,64,1,1,1,1,16,2048,0
768-14-14-1x1-128-14-14-32-0x0-1x1-1x1-0-NCHW-FP16-W=ConvAsmBwdWrW1x1:2,8,2,8,2,1,2,4,0,1
64-56-56-1x1-256-56-56-8-0x0-1x1-1x1-0-NCHW-FP16-W=ConvAsmBwdWrW1x1:4,4,4,1,8,1,2,4,0,1
512-14-14-1x1-160-14-14-256-0x0-1x1-1x1-0-NCHW-FP32-F=ConvAsm1x1U:2,16,2,64,3,2,2,1;ConvOclDirectFwd1x1:1,64,1,1,1,1,64,2048,0;ConvActivAsm1x1U:4,16,4,64,3,2
192-28-28-1x1-240-28-28-16-0x0-1x1-1x1-0-NCHW-FP32-B=ConvAsm1x1U:1,16,1,32,1,2,1,1;ConvOclDirectFwd1x1:1,128,1,1,0,2,16,4,0
1312-66-39-1x1-384-66-39-6-0x0-1x1-1x1-0-NCHW-FP32-F=ConvAsm1x1U:4,16,6,64,2,2,1,1;ConvOclDirectFwd1x1:1,64,1,1,1,4,32,2048,0
288-4-225-1x1-1440-4-225-128-0x0-1x1-1x1-0-NCHW-FP32-B=ConvAsm1x1U:1,32,1,32,1,1,1,1;ConvOclDirectFwd1x1:1,256,1,1,0,2,32,4,0
128-28-28-1x1-416-28-28-64-0x0-1x1-1x1-0-NCHW-FP32-F=ConvAsm1x1U:1,16,1,32,3,2,2,2;ConvOclDirectFwd1x1:1,64,1,1,1,0,16,2048,0
192-14-14-1x1-528-14-14-16-0x0-1x1-1x1-0-NCHW-FP32-W=ConvAsmBwdWrW1x1:1,16,2,4,8,1,2,4,0,1
1536-8-8-1x1-256-8-8-32-0x0-1x1-1x1-0-NCHW-FP16-F=ConvAsm1x1U:1,8,2,32,1,4,2,8;ConvOclDirectFwd1x1:1,128,1,1,0,2,4,4,0
160-14-14-3x3-128-14-14-32-1x1-1x1-1x1-0-NCHW-FP16-B=ConvOclDirectFwd:8,16,16,16,2,1,8,1,2
704-1-787-1x1-24-1-787-4-0x0-1x1-1x1-0-NCHW-FP32-W=ConvAsmBwdWrW1x1:4,4,2,2,2,1,1,4,0,0
384-8-8-1x1-2048-8-8-1-0x0-1x1-1x1-0-NCHW-FP16-B=ConvAsm1x1U:1,8,2,32,1,2,4,4;ConvOclDirectFwd1x1:1,256,1,1,0,1,4,4,0
144-14-14-1x1-512-14-14-256-0x0-1x1-1x1-0-NCHW-FP16-B=ConvAsm1x1U:1,16,2,16,1,2,1,8;ConvOclDirectFwd1x1:1,256,1,1,0,4,16,4,0
48-27-27-1x1-256-27-27-64-0x0-1x1-1x1-0-NCHW-FP32-W=ConvAsmBwdWrW1x1:4,4,4,2,8,1,2,4,0,1
256-29-29-3x3-256-57-57-4-1x1-2x2-1x1-0-NCHW-FP32-B_g32=ConvOclDirectFwd:16,8,16,32,1,4,8,1,2
576-7-7-1x1-128-7-7-256-0x0-1x1-1x1-0-NCHW-FP16-W=ConvAsmBwdWrW1x1:4,4,4,4,2,1,2,2,0,2
64-35-35-1x1-256-35-35-4-0x0-1x1-1x1-0-NCHW-FP16-W=ConvAsmBwdWrW1x1:4,4,4,2,2,1,1,4,0,1
24-14-14-1x1-512-14-14-64-0x0-1x1-1x1-0-NCHW-FP16-B=ConvAsm1x1U:1,16,2,32,1,2,1,4;ConvOclDirectFwd1x1:1,256,1,1,0,2,16,4,0
24-109-188-1x1-8-109-188-1024-0x0-1x1-1x1-0-NCHW-FP32-W=ConvAsmBwdWrW1x1:4,4,2,1,2,1,4,4,0,1
128-7-7-1x1-768-7-7-32-0x0-1x1-1x1-0-NCHW-FP16-W=ConvAsmBwdWrW1x1:2,8,2,8,2,1,2,4,0,1
512-29-29-1x1-256-57-57-64-0x0-2x2-1x1-0-NCHW-FP32-B=ConvAsm1x1U:4,32,7,64,1,1,1,1;ConvOclDirectFwd1x1:1,256,1,1,0,1,32,4,0
800-7-7-1x1-128-7-7-512-0x0-1x1-1x1-0-NCHW-FP16-B=ConvAsm1x1U:2,8,4,16,1,4,2,2;ConvOclDirectFwd1x1:1,64,1,1,0,1,32,4,0
352-7-7-1x1-1056-7-7-64-0x0-1x1-1x1-0-NCHW-FP16-B=ConvAsm1x1U:1,16,2,32,1,2,2,2;ConvOclDirectFwd1x1:1,128,1,1,0,1,8,4,0
2064-7-7-1x1-192-7-7-16-0x0-1x1-1x1-0-NCHW-FP16-F=ConvAsm1x1U:1,8,2,16,1,4,4,1;ConvOclDirectFwd1x1:1,64,1,1,0,1,4,8,0
32-56-56-3x3-128-56-56-512-1x1-1x1-1x1-0-NCHW-FP16-F=ConvOclDirectFwd:32,8,32,32,1,4,8,1,1
160-14-14-1x1-512-14-14-32-0x0-1x1-1x1-0-NCHW-FP32-W=ConvAsmBwdWrW1x1:2,8,4,2,8,2,1,4,0,1
1024-14-14-1x1-512-28-28-128-0x0-2x2-1x1-0-NCHW-FP32-B=ConvAsm1x1U:1,32,1,32,2,1,1,1;ConvOclDirectFwd1x1:1,128,1,1,0,2,32,4,0
64-112-112-7x7-3-224-224-128-3x3-2x2-1x1-0-NCHW-FP32-B=ConvOclDirectFwd:16,16,32,32,2,2,8,2,1
512-14-14-1x1-32-14-14-1-0x0-1x1-1x1-0-NCHW-FP16-F=ConvAsm1x1U:1,8,2,16,1,4,4,1;ConvOclDirectFwd1x1:1,64,1,1,0,4,4,8,0
192-56-56-1x1-128-56-56-64-0x0-1x1-1x1-0-NCHW-FP32-B=ConvAsm1x1U:1,16,1,64,1,2,1,4;ConvOclDirectFwd1x1:1,128,1,1,0,1,32,4,0
544-790-19-1x1-144-790-19-12-0x0-1x1-1x1-0-NCHW-FP32-F=ConvOclDirectFwd1x1:1,64,1,1,1,0,64,2048,0
128-17-17-1x1-768-17-17-1-0x0-1x1-1x1-0-NCHW-FP16-B=ConvAsm1x1U:1,8,2,64,1,2,4,1;ConvOclDirectFwd1x1:1,64,1,1,0,1,4,4,0
512-15-15-3x3-512-15-15-2-1x1-1x1-1x1-0-NCHW-FP32-F_g32=ConvOclDirectFwd:16,16,16,16,1,1,4,4,2
128-14-14-1x1-928-14-14-256-0x0-1x1-1x1-0-NCHW-FP16-W=ConvAsmBwdWrW1x1:2,8,4,8,2,1,2,4,0,0
64-14-14-5x5-24-14-14-32-2x2-1x1-1x1-0-NCHW-FP16-B=ConvOclDirectFwd:16,16,16,16,1,1,4,2,2
64-56-56-1x1-64-56-56-8-0x0-1x1-1x1-0-NCHW-FP32-B=ConvAsm1x1U:1,16,1,64,1,2,1,1;ConvOclDirectFwd1x1:1,64,1,1,0,2,16,4,0
64-27-27-1x1-384-27-27-64-0x0-1x1-1x1-0-NCHW-FP32-W=ConvAsmBwdWrW1x1:1,16,2,8,2,1,4,4,0,2
128-28-28-1x1-384-28-28-512-0x0-1x1-1x1-0-NCHW-FP16-W=ConvAsmBwdWrW1x1:4,4,8,4,2,1,4,4,0,1
16-48-480-3x3-1-48-480-8-1x1-1x1-1x1-0-NCHW-FP32-B=ConvOclDirectFwd:16,8,16,16,1,2,1,2,1;ConvAsm3x3U:1,1,2
128-875-179-1x1-80-875-179-1-0x0-1x1-1x1-0-NCHW-FP32-B=ConvOclDirectFwd1x1:1,64,1,1,0,1,16,4,0
48-721-443-1x1-144-721-443-4-0x0-1x1-1x1-0-NCHW-FP32-F=ConvOclDirectFwd1x1:1,64,1,1,1,4,32,256,0
192-13-13-3x3-384-13-13-512-1x1-1x1-1x1-0-NCHW-FP16-B=ConvOclDirectFwd:8,8,16,16,2,2,8,2,1
128-14-14-1x1-640-14-14-16-0x0-1x1-1x1-0-NCHW-FP32-F=ConvAsm1x1U:1,16,1,32,4,2,2,2;ConvOclDirectFwd1x1:1,64,1,1,1,4,32,256,0
128-28-28-3x3-128-28-28-64-1x1-1x1-1x1-0-NCHW-FP32-W=ConvAsmBwdWrW3x3:0,0,8,2,3,1
384-8-8-1x1-1280-8-8-4-0x0-1x1-1x1-0-NCHW-FP16-W=ConvAsmBwdWrW1x1:1,16,2,4,2,1,1,4,0,1
240-287-52-1x1-672-287-52-1-0x0-1x1-1x1-0-NCHW-FP32-F=ConvOclDirectFwd1x1:1,64,1,1,1,4,64,2048,0
1728-202-476-1x1-160-202-476-1-0x0-1x1-1x1-0-NCHW-FP32-F=ConvOclDirectFwd1x1:1,64,1,1,1,0,64,2048,0
216-28-28-1x1-54-28-28-512-0x0-1x1-1x1-0-NCHW-FP16-B_g3=ConvOclDirectFwd:16,16,32,32,2,2,8,2,1
256-14-14-1x1-528-14-14-4-0x0-1x1-1x1-0-NCHW-FP32-B=ConvAsm1x1U:1,8,1,32,1,2,2,4;ConvOclDirectFwd1x1:1,64,1,1,0,4,8,8,0
832-14-14-1x1-128-14-14-64-0x0-1x1-1x1-0-NCHW-FP32-B=ConvAsm1x1U:4,16,4,64,1,2,4,1;ConvOclDirectFwd1x1:8,64,16,16,0,2,16,4,1
544-14-14-1x1-128-14-14-16-0x0-1x1-1x1-0-NCHW-FP16-F=ConvAsm1x1U:2,8,4,64,1,4,4,2;ConvOclDirectFwd1x1:1,64,1,1,0,4,4,4,0
512-28-28-1x1-256-28-28-512-0x0-1x1-1x1-0-NCHW-FP32-B=ConvAsm1x1U:1,32,1,32,2,1,1,1;ConvOclDirectFwd1x1:1,128,1,1,0,2,32,4,0
2048-14-14-1x1-512-14-14-256-0x0-1x1-1x1-0-NCHW-FP32-F=ConvAsm1x1U:4,8,4,64,4,2,2,2;ConvOclDirectFwd1x1:8,8,16,16,1,0,32,128,1
224-35-35-3x3-256-17-17-4-0x0-2x2-1x1-0-NCHW-FP32-F=ConvOclDirectFwd:32,8,32,32,1,4,8,1,2
384-8-8-1x1-1280-8-8-4-0x0-1x1-1x1-0-NCHW-FP32-W=ConvAsmBwdWrW1x1:1,16,4,4,4,1,1,4,0,0
128-28-28-1x1-256-28-28-16-0x0-1x1-1x1-0-NCHW-FP32-B=ConvAsm1x1U:1,16,1,32,1,2,1,1;ConvOclDirectFwd1x1:1,128,1,1,0,2,16,4,0
3-10-10-3x3-5-10-10-64-1x1-1x1-1x1-0-NCHW-FP16-F=ConvOclDirectFwd:8,16,16,16,2,1,1,2,2
928-7-7-1x1-128-7-7-512-0x0-1x1-1x1-0-NCHW-FP16-B=ConvAsm1x1U:1,16,2,32,1,2,4,1;ConvOclDirectFwd1x1:1,256,1,1,0,1,16,4,0
2048-7-7-1x1-512-7-7-16-0x0-1x1-1x1-0-NCHW-FP32-B=ConvAsm1x1U:2,16,2,32,1,2,4,1;ConvOclDirectFwd1x1:1,128,1,1,0,1,8,4,0
320-318-415-1x1-640-318-415-6-0x0-1x1-1x1-0-NCHW-FP32-F=ConvOclDirectFwd1x1:1,64,1,1,1,4,32,2048,0
58-28-28-1x1-58-28-28-2-0x0-1x1-1x1-0-NCHW-FP32-W=ConvAsmBwdWrW1x1:4,4,2,1,2,1,2,4,0,1
256-7-7-1x1-832-7-7-1-0x0-1x1-1x1-0-NCHW-FP32-B=ConvAsm1x1U:1,8,1,64,1,4,4,1;ConvOclDirectFwd1x1:1,128,1,1,0,1,4,8,0
1000-609-396-1x1-32-609-396-2-0x0-1x1-1x1-0-NCHW-FP32-B=ConvOclDirectFwd1x1:1,128,1,1,0,1,32,4,0
64-14-14-1x1-512-14-14-256-0x0-1x1-1x1-0-NCHW-FP32-W=ConvAsmBwdWrW1x1:2,8,4,8,2,1,4,4,0,2
288-28-28-1x1-128-28-28-256-0x0-1x1-1x1-0-NCHW-FP16-B=ConvAsm1x1U:1,16,2,16,1,2,2,2;ConvOclDirectFwd1x1:1,64,1,1,0,4,16,4,0
96-960-184-1x1-2-960-184-8-0x0-1x1-1x1-0-NCHW-FP32-F=ConvOclDirectFwd1x1:1,64,1,1,0,1,16,4,0
960-395-287-1x1-512-395-287-1-0x0-1x1-1x1-0-NCHW-FP32-F=ConvOclDirectFwd1x1:1,64,1,1,1,1,16,2048,0
128-14-14-1x1-928-14-14-32-0x0-1x1-1x1-0-NCHW-FP32-F=ConvAsm1x1U:2,16,2,16,2,2,2,2;ConvOclDirectFwd1x1:1,64,1,1,1,1,16,256,0
512-801-977-1x1-8-801-977-1-0x0-1x1-1x1-0-NCHW-FP32-F=ConvOclDirectFwd1x1:1,256,1,1,0,1,16,8,0
32-14-14-1x1-512-14-14-1-0x0-1x1-1x1-0-NCHW-FP32-W=ConvAsmBwdWrW1x1:4,4,2,2,2,1,1,2,0,1
4-441-380-1x1-8-441-380-1-0x0-1x1-1x1-0-NCHW-FP32-F=ConvAsm1x1U:2,8,2,64,1,1,1,1;ConvOclDirectFwd1x1:1,64,1,1,0,4,8,4,0
64-13-13-3x3-256-13-13-64-1x1-1x1-1x1-0-NCHW-FP16-B=ConvOclDirectFwd:8,8,16,16,2,2,8,2,2
1024-877-16-1x1-1920-877-16-6-0x0-1x1-1x1-0-NCHW-FP32-B=ConvOclDirectFwd1x1:1,128,1,1,0,2,32,4,0
216-28-28-1x1-54-28-28-16-0x0-1x1-1x1-0-NCHW-FP16-B_g3=ConvOclDirectFwd:16,16,16,16,1,1,8,2,2
4-571-994-1x1-384-571-994-1-0x0-1x1-1x1-0-NCHW-FP32-B=ConvOclDirectFwd1x1:1,256,1,1,0,2,32,4,0
256-14-14-1x1-1024-14-14-512-0x0-1x1-1x1-0-NCHW-FP16-F=ConvAsm1x1U:1,16,2,16,2,2,1,4;ConvOclDirectFwd1x1:1,64,1,1,0,2,32,4,0
116-28-28-1x1-116-28-28-256-0x0-1x1-1x1-0-NCHW-FP32-B=ConvAsm1x1U:3,4,4,4,1,1,1,4;ConvOclDirectFwd1x1:1,256,1,1,0,4,16,4,0
192-71-71-3x3-192-35-35-128-0x0-2x2-1x1-0-NCHW-FP32-F=ConvOclDirectFwd:16,16,16,16,1,1,8,2,2
64-330-1-1x1-768-330-1-6-0x0-1x1-1x1-0-NCHW-FP32-F=ConvAsm1x1U:1,8,1,64,2,4,2,2;ConvOclDirectFwd1x1:1,64,1,1,1,1,16,2048,0
224-35-35-3x3-192-35-35-16-1x1-1x1-1x1-0-NCHW-FP16-B=ConvOclDirectFwd:8,16,16,16,2,1,8,1,1
4-575-350-1x1-8-575-350-128-0x0-1x1-1x1-0-NCHW-FP32-W=ConvAsmBwdWrW1x1:4,4,2,1,2,1,4,4,0,1
512-484-227-1x1-32-484-227-6-0x0-1x1-1x1-0-NCHW-FP32-B=ConvOclDirectFwd1x1:1,256,1,1,0,2,32,4,0
384-27-27-1x1-64-27-27-512-0x0-1x1-1x1-0-NCHW-FP32-W=ConvAsmBwdWrW1x1:2,8,2,8,4,1,4,4,0,1
24-14-14-1x1-512-14-14-32-0x0-1x1-1x1-0-NCHW-FP16-W=ConvAsmBwdWrW1x1:4,4,2,4,2,1,4,4,0,1
256-924-16-1x1-2112-924-16-8-0x0-1x1-1x1-0-NCHW-FP32-B=ConvOclDirectFwd1x1:1,128,1,1,0,2,32,4,0
128-14-14-1x1-896-14-14-16-0x0-1x1-1x1-0-NCHW-FP32-F=ConvAsm1x1U:1,16,1,16,4,2,2,2;ConvOclDirectFwd1x1:1,64,1,1,1,1,32,256,0
128-4-4-1x1-608-4-4-32-0x0-1x1-1x1-0-NCHW-FP16-W=ConvAsmBwdWrW1x1:2,8,2,4,2,2,2,4,0,0
144-969-111-1x1-800-969-111-2-0x0-1x1-1x1-0-NCHW-FP32-B=ConvOclDirectFwd1x1:1,128,1,1,0,1,32,4,0
128-112-112-3x3-128-112-112-32-1x1-1x1-1x1-0-NCHW-FP32-W=ConvAsmBwdWrW3x3:0,0,16,4,2,1
384-35-35-1x1-96-35-35-32-0x0-1x1-1x1-0-NCHW-FP32-F=ConvAsm1x1U:3,16,3,32,2,2,2,2;ConvOclDirectFwd1x1:1,64,1,1,1,4,16,2048,0;ConvActivAsm1x1U:4,16,5,32,2,2
256-35-35-1x1-64-35-35-64-0x0-1x1-1x1-0-NCHW-FP32-F=ConvAsm1x1U:3,16,3,64,2,2,2,2;ConvOclDirectFwd1x1:1,64,1,1,1,0,16,2048,0;ConvActivAsm1x1U:3,16,4,64,1,1
512-7-7-3x3-512-14-14-128-1x1-2x2-1x1-0-NCHW-FP32-B=ConvOclDirectFwd:8,8,8,8,1,1,2,2,1
58-28-28-1x1-58-28-28-16-0x0-1x1-1x1-0-NCHW-FP32-F=ConvAsm1x1U:1,8,1,16,2,2,1,4;ConvOclDirectFwd1x1:1,64,1,1,0,4,8,4,0
58-28-28-1x1-24-28-28-1-0x0-1x1-1x1-0-NCHW-FP32-W=ConvAsmBwdWrW1x1:4,4,2,1,2,1,1,2,0,1
512-28-28-1x1-256-28-28-4-0x0-1x1-1x1-0-NCHW-FP32-W=ConvAsmBwdWrW1x1:2,8,4,4,4,2,1,4,0,1
624-28-28-1x1-192-28-28-16-0x0-1x1-1x1-0-NCHW-FP32-F=ConvAsm1x1U:4,16,5,32,1,2,1,1;ConvOclDirectFwd1x1:1,64,1,1,1,4,16,2048,0;ConvActivAsm1x1U:4,16,5,32,1,1
128-28-28-1x1-512-28-28-1-0x0-1x1-1x1-0-NCHW-FP32-F=ConvAsm1x1U:2,8,2,64,1,4,2,4;ConvOclDirectFwd1x1:1,64,1,1,1,0,16,2048,0;ConvActivAsm1x1U:1,16,2,64,1,2
128-28-28-1x1-160-28-28-64-0x0-1x1-1x1-0-NCHW-FP16-F=ConvAsm1x1U:1,8,2,16,2,4,1,4;ConvOclDirectFwd1x1:1,128,1,1,0,4,16,4,0
288-394-1013-1x1-464-394-1013-2-0x0-1x1-1x1-0-NCHW-FP32-B=ConvOclDirectFwd1x1:1,128,1,1,0,2,16,8,0
256-56-56-1x1-128-56-56-32-0x0-1x1-1x1-0-NCHW-FP16-W=ConvAsmBwdWrW1x1:4,4,8,1,8,2,2,4,0,1
192-17-17-1x1-1024-17-17-128-0x0-1x1-1x1-0-NCHW-FP32-B=ConvAsm1x1U:1,32,1,32,2,1,1,4;ConvOclDirectFwd1x1:1,256,1,1,0,1,32,4,0
528-528-291-1x1-896-528-291-2-0x0-1x1-1x1-0-NCHW-FP32-B=ConvOclDirectFwd1x1:1,256,1,1,0,2,32,4,0
64-35-35-1x1-384-35-35-32-0x0-1x1-1x1-0-NCHW-FP32-W=ConvAsmBwdWrW1x1:2,8,4,8,2,1,4,4,0,1
800-306-336-1x1-232-306-336-2-0x0-1x1-1x1-0-NCHW-FP32-F=ConvOclDirectFwd1x1:1,64,1,1,0,2,16,4,0
160-625-320-1x1-1056-625-320-1-0x0-1x1-1x1-0-NCHW-FP32-B=ConvOclDirectFwd1x1:1,64,1,1,0,2,32,4,0
512-7-7-3x3-512-14-14-16-1x1-2x2-1x1-0-NCHW-FP16-B=ConvOclDirectFwd:8,8,8,16,1,2,4,1,1
32-28-28-1x1-192-28-28-128-0x0-1x1-1x1-0-NCHW-FP16-F=ConvAsm1x1U:1,16,2,32,1,2,1,4;ConvOclDirectFwd1x1:1,64,1,1,0,4,16,4,0
256-13-13-3x3-384-13-13-1024-1x1-1x1-1x1-0-NCHW-FP16-B=ConvOclDirectFwd:8,8,16,16,2,2,8,2,1
192-28-28-1x1-32-28-28-4-0x0-1x1-1x1-0-NCHW-FP16-F=ConvAsm1x1U:1,8,2,32,1,2,4,1;ConvOclDirectFwd1x1:1,64,1,1,0,1,8,8,0
256-27-27-1x1-32-27-27-512-0x0-1x1-1x1-0-NCHW-FP32-W=ConvAsmBwdWrW1x1:4,4,4,4,4,1,4,4,0,2
64-54-54-3x3-64-54-54-8-1x1-1x1-1x1-0-NCHW-FP16-B=ConvOclDirectFwd:16,16,32,32,2,2,8,2,1
416-14-14-1x1-128-14-14-512-0x0-1x1-1x1-0-NCHW-FP32-B=ConvAsm1x1U:1,32,1,16,2,1,1,2;ConvOclDirectFwd1x1:1,128,1,1,0,1,32,4,0
384-209-179-1x1-896-209-179-1-0x0-1x1-1x1-0-NCHW-FP32-B=ConvOclDirectFwd1x1:1,256,1,1,0,1,32,4,0
64-224-224-3x3-64-224-224-256-1x1-1x1-1x1-0-NCHW-FP16-F=ConvOclDirectFwd:32,8,32,32,1,4,8,1,2;ConvOclDirectFwdFused:16,16,32,32,2,2,8,2,1
256-27-27-1x1-64-27-27-16-0x0-1x1-1x1-0-NCHW-FP16-W=ConvAsmBwdWrW1x1:4,4,4,4,2,1,4,4,0,0
192-56-56-1x1-384-56-56-16-0x0-1x1-1x1-0-NCHW-FP16-B=ConvAsm1x1U:1,16,2,32,1,2,1,4;ConvOclDirectFwd1x1:1,256,1,1,0,4,16,4,0
576-7-311-1x1-1760-7-311-16-0x0-1x1-1x1-0-NCHW-FP32-B=ConvAsm1x1U:1,32,5,16,1,1,1,1;ConvOclDirectFwd1x1:1,256,1,1,0,1,32,4,0
512-15-15-3x3-512-15-15-32-1x1-1x1-1x1-0-NCHW-FP32-W_g32=ConvOclBwdWrW2<4>:1,6,8,1,5;ConvOclBwdWrW2<16>:1,6,8,1,5;ConvOclBwdWrW2<8>:1,7,3,1,9;ConvOclBwdWrW2<1>:1,6,8,1,9;ConvOclBwdWrW2<2>:1,6,8,1,9;ConvAsmBwdWrW3x3:0,0,16,4,5,1
128-28-28-1x1-192-28-28-32-0x0-1x1-1x1-0-NCHW-FP16-F=ConvAsm1x1U:1,8,2,16,1,4,1,4;ConvOclDirectFwd1x1:1,64,1,1,0,4,16,4,0
128-28-28-1x1-224-28-28-512-0x0-1x1-1x1-0-NCHW-FP16-F=ConvAsm1x1U:1,8,2,16,2,4,1,4;ConvOclDirectFwd1x1:1,64,1,1,0,4,16,4,0
128-14-14-1x1-960-14-14-128-0x0-1x1-1x1-0-NCHW-FP16-B=ConvAsm1x1U:1,16,2,16,1,2,1,4;ConvOclDirectFwd1x1:1,256,1,1,0,2,32,4,0
4-75-614-1x1-896-75-614-1-0x0-1x1-1x1-0-NCHW-FP32-F=ConvOclDirectFwd1x1:1,256,1,1,0,1,4,4,0
384-28-28-1x1-128-28-28-64-0x0-1x1-1x1-0-NCHW-FP32-F=ConvAsm1x1U:3,16,3,32,2,2,2,2;ConvOclDirectFwd1x1:1,64,1,1,1,0,16,2048,0
2048-7-7-1x1-1024-4-4-512-0x0-2x2-1x1-0-NCHW-FP16-F=ConvAsm1x1U:2,4,4,4,1,4,1,4;ConvOclDirectFwd1x1:1,256,1,1,0,1,16,4,0
32-79-341-5x10-32-38-166-64-0x0-2x2-1x1-0-NCHW-FP32-F=ConvOclDirectFwd:8,32,16,32,2,1,8,1,2
2048-8-8-1x1-384-8-8-128-0x0-1x1-1x1-0-NCHW-FP16-F=ConvAsm1x1U:1,8,2,32,4,4,2,2;ConvOclDirectFwd1x1:1,64,1,1,0,4,16,8,0
960-666-5-1x1-1088-666-5-48-0x0-1x1-1x1-0-NCHW-FP32-B=ConvAsm1x1U:2,32,2,16,1,1,1,4;ConvOclDirectFwd1x1:1,64,1,1,0,2,32,4,0
320-8-8-3x3-320-17-17-1-0x0-2x2-1x1-0-NCHW-FP32-B=ConvOclDirectFwd:32,16,32,32,1,2,1,4,1
48-27-27-1x1-384-27-27-16-0x0-1x1-1x1-0-NCHW-FP32-F=ConvAsm1x1U:1,16,1,64,4,2,2,1;ConvOclDirectFwd1x1:1,64,1,1,1,4,16,128,0
432-14-14-1x1-192-14-14-16-0x0-1x1-1x1-0-NCHW-FP16-F=ConvAsm1x1U:1,8,2,64,1,4,2,4;ConvOclDirectFwd1x1:1,64,1,1,0,4,8,4,0
256-29-29-1x1-512-29-29-2-0x0-1x1-1x1-0-NCHW-FP32-F=ConvAsm1x1U:1,8,1,64,2,4,1,8;ConvOclDirectFwd1x1:1,64,1,1,1,4,16,2048,0
1024-14-14-1x1-512-14-14-512-0x0-1x1-1x1-0-NCHW-FP32-W=ConvAsmBwdWrW1x1:1,16,4,8,4,1,1,4,0,1
1216-258-643-1x1-704-258-643-2-0x0-1x1-1x1-0-NCHW-FP32-F=ConvOclDirectFwd1x1:1,64,1,1,1,1,16,2048,0
1024-7-7-1x1-464-7-7-64-0x0-1x1-1x1-0-NCHW-FP16-W=ConvAsmBwdWrW1x1:1,16,4,8,2,1,1,2,0,1
480-14-14-1x1-64-14-14-64-0x0-1x1-1x1-0-NCHW-FP16-F=ConvAsm1x1U:1,8,2,16,2,4,1,8;ConvOclDirectFwd1x1:1,64,1,1,0,4,8,4,0
1024-13-13-3x3-512-27-27-32-0x0-2x2-1x1-0-NCHW-FP32-B=ConvOclDirectFwd:32,32,32,32,1,1,4,4,1
192-13-13-3x3-384-13-13-16-1x1-1x1-1x1-0-NCHW-FP16-B=ConvOclDirectFwd:8,8,16,16,2,2,8,4,2
1392-7-7-1x1-192-7-7-16-0x0-1x1-1x1-0-NCHW-FP16-F=ConvAsm1x1U:1,8,2,32,1,4,4,1;ConvOclDirectFwd1x1:1,64,1,1,0,1,4,4,0
704-14-14-1x1-128-14-14-256-0x0-1x1-1x1-0-NCHW-FP16-B=ConvAsm1x1U:1,16,2,16,1,2,2,2;ConvOclDirectFwd1x1:1,128,1,1,0,2,32,8,0
128-56-56-1x1-96-56-56-128-0x0-1x1-1x1-0-NCHW-FP16-W=ConvAsmBwdWrW1x1:4,4,4,1,8,1,4,4,0,0
1776-49-673-1x1-832-49-673-4-0x0-1x1-1x1-0-NCHW-FP32-F=ConvOclDirectFwd1x1:1,64,1,1,1,0,16,2048,0
1024-13-13-3x3-512-13-13-64-1x1-1x1-1x1-0-NCHW-FP32-W=ConvAsmBwdWrW3x3:0,0,8,8,5,1
16-54-54-1x1-128-54-54-64-0x0-1x1-1x1-0-NCHW-FP16-F=ConvAsm1x1U:1,8,2,64,1,4,1,8;ConvOclDirectFwd1x1:1,256,1,1,0,2,16,4,0
288-14-14-1x1-128-14-14-32-0x0-1x1-1x1-0-NCHW-FP16-B=ConvAsm1x1U:1,8,2,16,1,4,2,2;ConvOclDirectFwd1x1:1,128,1,1,0,2,32,8,0
256-56-56-1x1-64-56-56-16-0x0-1x1-1x1-0-NCHW-FP16-F=ConvAsm1x1U:1,8,2,32,1,4,1,4;ConvOclDirectFwd1x1:1,128,1,1,0,4,16,4,0
1024-14-14-3x3-1024-7-7-2-1x1-2x2-1x1-0-NCHW-FP32-F_g32=ConvOclDirectFwd:8,8,8,8,1,1,4,4,2
2048-7-7-1x1-512-7-7-256-0x0-1x1-1x1-0-NCHW-FP32-W=ConvAsmBwdWrW1x1:1,16,2,8,8,1,1,4,0,1
128-420-995-1x1-112-420-995-2-0x0-1x1-1x1-0-NCHW-FP32-F=ConvOclDirectFwd1x1:1,64,1,1,1,0,64,128,0
1008-15-704-1x1-8-15-704-12-0x0-1x1-1x1-0-NCHW-FP32-F=ConvOclDirectFwd1x1:1,256,1,1,0,4,16,8,0
64-112-112-1x1-64-112-112-256-0x0-1x1-1x1-0-NCHW-FP32-W=ConvAsmBwdWrW1x1:4,4,4,2,2,1,2,4,0,1
832-132-919-1x1-144-132-919-2-0x0-1x1-1x1-0-NCHW-FP32-B=ConvOclDirectFwd1x1:1,256,1,1,0,2,16,4,0
256-14-14-1x1-1024-14-14-1-0x0-1x1-1x1-0-NCHW-FP32-F=ConvAsm1x1U:2,8,2,64,1,4,2,2;ConvOclDirectFwd1x1:1,64,1,1,1,0,16,2048,0;ConvActivAsm1x1U:2,16,4,64,1,4
128-7-7-1x1-864-7-7-16-0x0-1x1-1x1-0-NCHW-FP16-W=ConvAsmBwdWrW1x1:2,8,2,8,2,1,2,4,0,0
19-1001-293-1x1-16-1001-293-1-0x0-1x1-1x1-0-NCHW-FP32-B=ConvOclDirectFwd1x1:1,256,1,1,0,1,16,4,0
192-7-7-3x3-384-7-7-1-1x1-1x1-1x1-0-NCHW-FP16-F=ConvOclDirectFwd:8,8,8,8,1,1,1,4,1;ConvOclDirectFwdFused:8,8,8,8,1,1,1,4,1
96-14-14-1x1-480-14-14-128-0x0-1x1-1x1-0-NCHW-FP16-W=ConvAsmBwdWrW1x1:2,8,2,8,2,1,4,4,0,1
160-14-14-1x1-512-14-14-4-0x0-1x1-1x1-0-NCHW-FP16-B=ConvAsm1x1U:1,8,2,64,1,4,2,4;ConvOclDirectFwd1x1:1,64,1,1,0,4,4,4,0
32-149-149-3x3-32-147-147-4-0x0-1x1-1x1-0-NCHW-FP16-F=ConvOclDirectFwd:16,16,16,32,1,2,8,2,2;ConvOclDirectFwdFused:16,16,16,32,1,2,8,2,2
512-4-4-3x3-512-7-7-256-1x1-2x2-1x1-0-NCHW-FP32-W=ConvAsmBwdWrW3x3:0,0,8,8,7,1
48-27-27-1x1-384-27-27-32-0x0-1x1-1x1-0-NCHW-FP16-F=ConvAsm1x1U:3,8,6,64,1,4,1,4;ConvOclDirectFwd1x1:1,64,1,1,0,1,32,4,0
224-789-6-1x1-1184-789-6-16-0x0-1x1-1x1-0-NCHW-FP32-B=ConvOclDirectFwd1x1:1,64,1,1,0,1,32,4,0
192-35-35-3x3-192-71-71-256-0x0-2x2-1x1-0-NCHW-FP16-B=ConvOclDirectFwd:16,8,16,16,1,2,8,4,1
16-84-173-1x1-8-84-173-2048-0x0-1x1-1x1-0-NCHW-FP32-W=ConvAsmBwdWrW1x1:4,4,2,1,2,1,4,4,0,1
128-56-56-1x1-256-56-56-2-0x0-1x1-1x1-0-NCHW-FP32-W=ConvAsmBwdWrW1x1:4,4,4,4,2,1,1,4,0,1
1104-305-856-1x1-2048-305-856-1-0x0-1x1-1x1-0-NCHW-FP32-B=ConvOclDirectFwd1x1:1,256,1,1,0,2,32,4,0
384-7-7-1x1-832-7-7-256-0x0-1x1-1x1-0-NCHW-FP16-W=ConvAsmBwdWrW1x1:1,16,4,8,2,1,2,2,0,2
232-7-7-1x1-232-7-7-512-0x0-1x1-1x1-0-NCHW-FP16-W=ConvAsmBwdWrW1x1:1,16,4,8,2,2,4,4,0,3
320-8-8-1x1-2048-8-8-4-0x0-1x1-1x1-0-NCHW-FP32-W=ConvAsmBwdWrW1x1:1,16,2,4,4,1,1,4,0,0
512-15-15-1x1-1024-15-15-128-0x0-1x1-1x1-0-NCHW-FP32-F=ConvAsm1x1U:4,16,5,16,1,2,2,1;ConvOclDirectFwd1x1:8,8,16,16,1,0,32,128,1
128-14-14-1x1-992-14-14-64-0x0-1x1-1x1-0-NCHW-FP16-B=ConvAsm1x1U:1,16,2,16,1,2,2,2;ConvOclDirectFwd1x1:1,64,1,1,0,2,16,4,0
2-269-7-1x1-960-269-7-64-0x0-1x1-1x1-0-NCHW-FP32-B=ConvAsm1x1U:1,8,1,16,1,1,1,1;ConvOclDirectFwd1x1:1,256,1,1,0,1,64,4,0
3-33-485-1x1-1488-33-485-4-0x0-1x1-1x1-0-NCHW-FP32-B=ConvOclDirectFwd1x1:1,256,1,1,0,1,4,4,0
960-14-14-1x1-128-14-14-128-0x0-1x1-1x1-0-NCHW-FP32-W=ConvAsmBwdWrW1x1:2,8,4,8,4,1,2,4,0,1
58-28-28-1x1-58-28-28-128-0x0-1x1-1x1-0-NCHW-FP32-F=ConvAsm1x1U:1,32,7,64,1,1,1,1;ConvOclDirectFwd1x1:1,128,1,1,0,4,16,4,0
24-14-14-1x1-512-14-14-8-0x0-1x1-1x1-0-NCHW-FP16-W=ConvAsmBwdWrW1x1:2,8,4,1,2,1,1,4,0,1
128-28-28-1x1-256-28-28-16-0x0-1x1-1x1-0-NCHW-FP32-W=ConvAsmBwdWrW1x1:2,8,4,8,2,2,4,4,0,1
64-80-349-5x5-1-161-700-64-1x1-2x2-1x1-0-NCHW-FP32-W=ConvOclBwdWrW2<1>:8,6,8,1,5;ConvOclBwdWrW2<2>:8,7,3,1,5;ConvOclBwdWrW2<4>:8,7,3,1,5;ConvOclBwdWrW2<16>:8,7,3,1,5;ConvOclBwdWrW2<8>:8,7,3,1,5
416-28-28-1x1-128-28-28-32-0x0-1x1-1x1-0-NCHW-FP32-B=ConvAsm1x1U:2,16,2,32,1,2,4,1;ConvOclDirectFwd1x1:1,128,1,1,0,4,16,4,0
1024-15-15-1x1-512-29-29-128-0x0-2x2-1x1-0-NCHW-FP32-B=ConvAsm1x1U:2,16,4,64,1,2,1,1;ConvOclDirectFwd1x1:1,256,1,1,0,1,32,4,0
1024-17-17-1x1-192-17-17-256-0x0-1x1-1x1-0-NCHW-FP16-F=ConvAsm1x1U:2,16,4,16,1,2,1,4;ConvOclDirectFwd1x1:1,64,1,1,0,1,8,8,0
960-530-76-1x1-1888-530-76-1-0x0-1x1-1x1-0-NCHW-FP32-B=ConvOclDirectFwd1x1:1,64,1,1,0,1,32,4,0
512-14-14-1x1-128-14-14-512-0x0-1x1-1x1-0-NCHW-FP32-F=ConvAsm1x1U:4,16,4,64,1,2,1,4;ConvOclDirectFwd1x1:1,64,1,1,1,0,32,2048,0;ConvActivAsm1x1U:4,32,7,32,1,1
116-14-14-1x1-116-14-14-1-0x0-1x1-1x1-0-NCHW-FP16-W=ConvAsmBwdWrW1x1:2,8,2,1,2,1,1,4,0,1
288-583-736-1x1-240-583-736-1-0x0-1x1-1x1-0-NCHW-FP32-B=ConvOclDirectFwd1x1:1,64,1,1,0,1,16,4,0
128-14-14-1x1-672-14-14-256-0x0-1x1-1x1-0-NCHW-FP32-F=ConvAsm1x1U:2,16,2,64,3,2,1,1;ConvOclDirectFwd1x1:1,64,1,1,1,0,64,128,0
16-54-54-1x1-96-54-54-64-0x0-1x1-1x1-0-NCHW-FP32-F=ConvAsm1x1U:1,8,1,64,1,4,1,1;ConvOclDirectFwd1x1:1,64,1,1,1,0,16,256,0
256-14-14-3x3-128-14-14-64-1x1-1x1-1x1-0-NCHW-FP16-B=ConvOclDirectFwd:8,16,16,16,2,1,8,1,2
192-14-14-1x1-1728-14-14-16-0x0-1x1-1x1-0-NCHW-FP16-W=ConvAsmBwdWrW1x1:2,8,4,8,2,1,1,4,0,1
192-28-28-1x1-16-28-28-4-0x0-1x1-1x1-0-NCHW-FP32-F=ConvAsm1x1U:1,8,1,32,1,4,2,1;ConvOclDirectFwd1x1:1,64,1,1,1,4,64,64,0;ConvActivAsm1x1U:1,16,1,16,1,4
3-224-224-3x3-24-112-112-8-1x1-2x2-1x1-0-NCHW-FP32-F=ConvOclDirectFwd:16,16,16,16,1,1,8,1,1
512-10-10-3x3-256-19-19-64-1x1-2x2-1x1-0-NCHW-FP32-B=ConvOclDirectFwd:8,32,32,32,4,1,8,2,2
48-581-749-1x1-4-581-749-4-0x0-1x1-1x1-0-NCHW-FP32-B=ConvOclDirectFwd1x1:1,256,1,1,0,1,16,4,0
16-54-54-1x1-96-54-54-128-0x0-1x1-1x1-0-NCHW-FP16-F=ConvAsm1x1U:1,8,2,64,1,2,1,4;ConvOclDirectFwd1x1:1,64,1,1,0,2,32,4,0
1440-136-41-1x1-1104-136-41-32-0x0-1x1-1x1-0-NCHW-FP32-F=ConvOclDirectFwd1x1:1,64,1,1,1,0,32,2048,0
1200-626-177-1x1-928-626-177-4-0x0-1x1-1x1-0-NCHW-FP32-F=ConvOclDirectFwd1x1:1,64,1,1,1,0,64,2048,0
128-28-28-1x1-256-28-28-4-0x0-1x1-1x1-0-NCHW-FP16-W=ConvAsmBwdWrW1x1:4,4,4,4,2,1,2,2,0,1
512-28-28-1x1-512-28-28-2-0x0-1x1-1x1-0-NCHW-FP32-F=ConvAsm1x1U:3,8,3,32,1,4,1,4;ConvOclDirectFwd1x1:1,64,1,1,1,0,16,2048,0
96-35-35-1x1-384-35-35-32-0x0-1x1-1x1-0-NCHW-FP16-B=ConvAsm1x1U:1,16,2,16,1,2,1,2;ConvOclDirectFwd1x1:1,256,1,1,0,1,32,4,0
128-14-14-3x3-128-28-28-512-1x1-2x2-1x1-0-NCHW-FP32-W=ConvAsmBwdWrW3x3:0,0,8,8,3,1
48-27-27-1x1-192-27-27-512-0x0-1x1-1x1-0-NCHW-FP16-F=ConvAsm1x1U:3,8,6,64,1,4,1,4;ConvOclDirectFwd1x1:1,64,1,1,0,1,32,4,0
128-112-112-3x3-64-112-112-16-1x1-1x1-1x1-0-NCHW-FP16-W=ConvAsmBwdWrW3x3:0,0,16,2,1,4
64-14-14-5x5-24-14-14-64-2x2-1x1-1x1-0-NCHW-FP16-B=ConvOclDirectFwd:8,8,16,16,2,2,2,2,2
64-28-28-1x1-192-28-28-32-0x0-1x1-1x1-0-NCHW-FP16-B=ConvAsm1x1U:1,16,2,16,1,2,2,2;ConvOclDirectFwd1x1:1,64,1,1,0,4,16,4,0
384-7-7-3x3-192-7-7-32-1x1-1x1-1x1-0-NCHW-FP16-W=ConvAsmBwdWrW3x3:0,0,8,4,3,1
192-7-7-1x1-832-7-7-512-0x0-1x1-1x1-0-NCHW-FP16-W=ConvAsmBwdWrW1x1:2,8,4,8,2,2,2,4,0,0
160-73-73-1x1-64-73-73-8-0x0-1x1-1x1-0-NCHW-FP16-F=ConvAsm1x1U:3,8,6,64,1,4,2,2;ConvOclDirectFwd1x1:16,64,32,32,0,1,16,4,1
352-28-28-1x1-128-28-28-128-0x0-1x1-1x1-0-NCHW-FP16-F=ConvAsm1x1U:1,8,2,32,2,4,1,4;ConvOclDirectFwd1x1:1,256,1,1,0,4,16,4,0
128-54-54-1x1-32-54-54-128-0x0-1x1-1x1-0-NCHW-FP16-W=ConvAsmBwdWrW1x1:4,4,2,1,8,1,4,4,0,2
928-7-7-1x1-128-7-7-512-0x0-1x1-1x1-0-NCHW-FP32-B=ConvAsm1x1U:1,16,1,64,2,2,1,4;ConvOclDirectFwd1x1:1,64,1,1,0,1,32,4,0
240-14-14-1x1-60-14-14-16-0x0-1x1-1x1-0-NCHW-FP16-B_g3=ConvOclDirectFwd:16,8,16,8,1,1,4,4,2
128-7-7-1x1-608-7-7-64-0x0-1x1-1x1-0-NCHW-FP16-F=ConvAsm1x1U:2,8,4,16,1,2,1,4;ConvOclDirectFwd1x1:1,256,1,1,0,1,8,4,0
1024-17-17-1x1-192-17-17-128-0x0-1x1-1x1-0-NCHW-FP16-F=ConvAsm1x1U:1,16,4,16,1,2,2,2;ConvOclDirectFwd1x1:1,128,1,1,0,1,16,4,0
1-161-700-5x5-64-80-349-4-1x1-2x2-1x1-0-NCHW-FP32-F=ConvOclDirectFwd:8,16,16,16,2,1,8,1,2
512-29-29-1x1-512-29-29-256-0x0-1x1-1x1-0-NCHW-FP32-W=ConvAsmBwdWrW1x1:2,8,4,8,4,1,1,4,0,2
64-112-112-7x7-3-230-230-256-0x0-2x2-1x1-0-NCHW-FP32-B=ConvOclDirectFwd:16,16,32,32,2,2,8,2,1
256-27-27-1x1-48-27-27-32-0x0-1x1-1x1-0-NCHW-FP32-B=ConvAsm1x1U:2,16,2,64,1,2,4,1;ConvOclDirectFwd1x1:1,64,1,1,0,1,16,8,0
384-8-8-1x1-1280-8-8-64-0x0-1x1-1x1-0-NCHW-FP16-W=ConvAsmBwdWrW1x1:2,8,8,4,2,1,1,4,0,0
60-14-14-3x3-60-28-28-32-1x1-2x2-1x1-0-NCHW-FP16-W=ConvAsmBwdWrW3x3:0,0,16,2,3,2
16-718-872-1x1-3-718-872-16-0x0-1x1-1x1-0-NCHW-FP32-F=ConvOclDirectFwd1x1:1,256,1,1,0,4,16,4,0
256-14-14-1x1-128-14-14-512-0x0-1x1-1x1-0-NCHW-FP32-B=ConvAsm1x1U:1,32,1,32,2,1,2,2;ConvOclDirectFwd1x1:1,256,1,1,0,1,32,4,0
512-28-28-3x3-256-28-28-128-1x1-1x1-1x1-0-NCHW-FP32-W=ConvAsmBwdWrW3x3:0,0,8,4,2,1
144-86-247-1x1-48-86-247-12-0x0-1x1-1x1-0-NCHW-FP32-W=ConvAsmBwdWrW1x1:4,4,2,4,4,1,2,4,0,2
192-28-28-1x1-720-28-28-16-0x0-1x1-1x1-0-NCHW-FP16-B=ConvAsm1x1U:1,16,2,16,1,2,2,2;ConvOclDirectFwd1x1:1,128,1,1,0,4,16,4,0
128-7-7-1x1-736-7-7-32-0x0-1x1-1x1-0-NCHW-FP16-F=ConvAsm1x1U:1,8,2,16,1,4,1,8;ConvOclDirectFwd1x1:1,128,1,1,0,1,8,4,0
256-13-13-3x3-64-13-13-256-1x1-1x1-1x1-0-NCHW-FP16-W=ConvAsmBwdWrW3x3:0,1,8,4,7,4
58-28-28-1x1-58-28-28-64-0x0-1x1-1x1-0-NCHW-FP32-F=ConvAsm1x1U:1,32,7,16,1,1,1,1;ConvOclDirectFwd1x1:1,128,1,1,0,4,16,4,0
48-14-14-5x5-16-14-14-256-2x2-1x1-1x1-0-NCHW-FP16-B=ConvOclDirectFwd:8,8,16,16,2,2,4,4,1
64-112-112-7x7-3-225-225-4-2x2-2x2-1x1-0-NCHW-FP32-B=ConvOclDirectFwd:16,16,32,32,2,2,8,2,1
58-789-6-1x1-1664-789-6-4-0x0-1x1-1x1-0-NCHW-FP32-B=ConvOclDirectFwd1x1:1,256,1,1,0,1,64,4,0
32-27-27-3x3-128-27-27-32-1x1-1x1-1x1-0-NCHW-FP16-B=ConvOclDirectFwd:8,16,32,32,4,2,8,1,1
32-14-14-1x1-528-14-14-1-0x0-1x1-1x1-0-NCHW-FP16-W=ConvAsmBwdWrW1x1:4,4,2,2,2,1,1,2,0,1
128-28-28-1x1-256-28-28-512-0x0-1x1-1x1-0-NCHW-FP16-W=ConvAsmBwdWrW1x1:4,4,8,4,2,1,2,4,0,3
192-35-35-1x1-32-35-35-64-0x0-1x1-1x1-0-NCHW-FP16-F=ConvAsm1x1U:1,8,2,64,1,4,2,2;ConvOclDirectFwd1x1:1,256,1,1,0,1,16,8,0
512-7-7-1x1-1024-14-14-256-0x0-2x2-1x1-0-NCHW-FP16-B=ConvAsm1x1U:1,16,2,32,1,2,2,2;ConvOclDirectFwd1x1:1,128,1,1,0,1,32,4,0
8-109-438-1x1-64-109-438-12-0x0-1x1-1x1-0-NCHW-FP32-F=ConvAsm1x1U:1,32,4,32,1,1,1,2;ConvOclDirectFwd1x1:1,256,1,1,0,1,32,4,0
96-54-54-1x1-16-54-54-256-0x0-1x1-1x1-0-NCHW-FP32-B=ConvAsm1x1U:3,16,3,64,4,1,1,1;ConvOclDirectFwd1x1:1,128,1,1,0,4,16,4,0
384-17-17-1x1-1024-17-17-32-0x0-1x1-1x1-0-NCHW-FP16-B=ConvAsm1x1U:1,16,2,32,1,2,2,2;ConvOclDirectFwd1x1:16,64,32,32,0,1,16,4,1
116-28-28-1x1-116-28-28-64-0x0-1x1-1x1-0-NCHW-FP16-W=ConvAsmBwdWrW1x1:4,4,4,1,8,1,2,4,0,1
320-7-7-3x3-160-7-7-8-1x1-1x1-1x1-0-NCHW-FP16-W=ConvAsmBwdWrW3x3:0,0,8,2,1,1
800-14-14-1x1-128-14-14-128-0x0-1x1-1x1-0-NCHW-FP16-F=ConvAsm1x1U:2,8,4,64,1,4,2,2;ConvOclDirectFwd1x1:1,128,1,1,0,4,8,8,0
128-40-175-3x3-128-40-175-16-1x1-1x1-1x1-0-NCHW-FP16-W=ConvAsmBwdWrW3x3:0,0,16,2,1,1
128-7-7-3x3-256-14-14-12-1x1-2x2-1x1-0-NCHW-FP32-W=ConvAsmBwdWrW3x3:0,0,8,4,3,1
16-941-37-1x1-48-941-37-8-0x0-1x1-1x1-0-NCHW-FP32-W=ConvAsmBwdWrW1x1:4,4,2,1,2,1,2,4,0,2
96-35-35-1x1-384-35-35-256-0x0-1x1-1x1-0-NCHW-FP32-B=ConvAsm1x1U:2,32,2,64,1,1,1,1;ConvOclDirectFwd1x1:1,256,1,1,0,1,32,4,0
256-14-14-1x1-528-14-14-1-0x0-1x1-1x1-0-NCHW-FP32-W=ConvAsmBwdWrW1x1:1,16,2,8,2,1,1,2,0,1
128-14-14-1x1-256-14-14-64-0x0-1x1-1x1-0-NCHW-FP16-F=ConvAsm1x1U:1,8,2,16,2,4,1,4;ConvOclDirectFwd1x1:1,128,1,1,0,4,8,4,0
192-14-14-1x1-608-14-14-32-0x0-1x1-1x1-0-NCHW-FP32-W=ConvAsmBwdWrW1x1:2,8,4,4,8,1,2,4,0,1
128-28-28-1x1-288-28-28-128-0x0-1x1-1x1-0-NCHW-FP32-B=ConvAsm1x1U:1,32,1,32,1,1,1,1;ConvOclDirectFwd1x1:1,64,1,1,0,1,32,4,0
512-14-14-1x1-128-28-28-64-0x0-2x2-1x1-0-NCHW-FP32-B=ConvAsm1x1U:4,16,4,64,2,2,1,4;ConvOclDirectFwd1x1:1,64,1,1,0,2,16,4,0
8-241-184-1x1-192-241-184-6-0x0-1x1-1x1-0-NCHW-FP32-B=ConvOclDirectFwd1x1:1,256,1,1,0,2,32,4,0
64-224-224-3x3-64-224-224-16-1x1-1x1-1x1-0-NCHW-FP16-F=ConvOclDirectFwd:16,16,32,32,2,2,8,2,1;ConvOclDirectFwdFused:16,16,32,32,2,2,8,4,1
128-14-14-1x1-832-14-14-16-0x0-1x1-1x1-0-NCHW-FP32-W=ConvAsmBwdWrW1x1:2,8,4,8,2,1,1,4,0,1
120-14-14-3x3-120-7-7-128-1x1-2x2-1x1-0-NCHW-FP32-F=ConvOclDirectFwd:8,8,8,8,1,1,8,2,1
32-14-14-1x1-528-14-14-4-0x0-1x1-1x1-0-NCHW-FP16-B=ConvAsm1x1U:1,8,2,64,1,4,2,1;ConvOclDirectFwd1x1:1,64,1,1,0,4,4,4,0
720-162-215-1x1-320-162-215-2-0x0-1x1-1x1-0-NCHW-FP32-F=ConvOclDirectFwd1x1:1,64,1,1,1,1,16,2048,0
16-28-28-1x1-192-28-28-1-0x0-1x1-1x1-0-NCHW-FP16-B=ConvAsm1x1U:1,8,2,64,1,2,2,4;ConvOclDirectFwd1x1:1,256,1,1,0,2,4,4,0
896-14-14-1x1-128-14-14-32-0x0-1x1-1x1-0-NCHW-FP16-F=ConvAsm1x1U:1,8,2,64,2,4,4,2;ConvOclDirectFwd1x1:1,64,1,1,0,4,8,4,0
1024-14-14-1x1-256-14-14-512-0x0-1x1-1x1-0-NCHW-FP32-W=ConvAsmBwdWrW1x1:2,8,4,8,4,1,1,4,0,1
32-770-1023-1x1-384-770-1023-1-0x0-1x1-1x1-0-NCHW-FP32-F=ConvOclDirectFwd1x1:1,64,1,1,1,1,32,2048,0
128-28-28-1x1-512-28-28-1-0x0-1x1-1x1-0-NCHW-FP16-W=ConvAsmBwdWrW1x1:4,4,4,2,2,1,1,4,0,0
672-7-7-1x1-128-7-7-16-0x0-1x1-1x1-0-NCHW-FP32-B=ConvAsm1x1U:1,8,1,64,1,4,4,4;ConvOclDirectFwd1x1:1,256,1,1,0,1,4,8,0
48-35-35-1x1-192-35-35-1-0x0-1x1-1x1-0-NCHW-FP32-W=ConvAsmBwdWrW1x1:4,4,2,2,2,1,1,4,0,1
16-14-14-1x1-480-14-14-4-0x0-1x1-1x1-0-NCHW-FP32-W=ConvAsmBwdWrW1x1:4,4,2,2,2,1,1,4,0,1
128-56-56-1x1-160-56-56-16-0x0-1x1-1x1-0-NCHW-FP16-F=ConvAsm1x1U:1,8,2,64,2,4,1,4;ConvOclDirectFwd1x1:1,64,1,1,0,4,16,4,0
864-6-238-1x1-704-6-238-8-0x0-1x1-1x1-0-NCHW-FP32-F=ConvAsm1x1U:2,16,6,64,1,2,2,2;ConvOclDirectFwd1x1:1,64,1,1,1,0,16,2048,0
192-8-8-1x1-2048-8-8-128-0x0-1x1-1x1-0-NCHW-FP32-B=ConvAsm1x1U:1,16,1,64,4,2,1,4;ConvOclDirectFwd1x1:1,128,1,1,0,4,16,4,0
128-28-28-3x3-96-28-28-512-1x1-1x1-1x1-0-NCHW-FP32-W=ConvAsmBwdWrW3x3:0,1,8,4,9,4
576-142-34-1x1-288-142-34-48-0x0-1x1-1x1-0-NCHW-FP32-F=ConvAsm1x1U:2,32,7,64,1,1,1,1;ConvOclDirectFwd1x1:1,64,1,1,1,0,64,2048,0
1488-33-360-1x1-4-33-360-1-0x0-1x1-1x1-0-NCHW-FP32-F=ConvOclDirectFwd1x1:1,256,1,1,0,4,16,4,0
128-17-17-1x1-1024-17-17-4-0x0-1x1-1x1-0-NCHW-FP16-W=ConvAsmBwdWrW1x1:2,8,4,8,2,1,2,2,0,1
512-29-29-1x1-512-29-29-256-0x0-1x1-1x1-0-NCHW-FP32-B=ConvAsm1x1U:1,32,3,32,1,1,1,1;ConvOclDirectFwd1x1:1,256,1,1,0,1,32,4,0
128-14-14-3x3-160-14-14-32-1x1-1x1-1x1-0-NCHW-FP16-F=ConvOclDirectFwd:8,16,16,16,2,1,8,1,2
1024-14-14-1x1-256-14-14-512-0x0-1x1-1x1-0-NCHW-FP32-F=ConvAsm1x1U:4,8,7,32,1,2,1,8;ConvOclDirectFwd1x1:1,64,1,1,1,1,32,2048,0
1024-14-14-1x1-1024-14-14-8-0x0-1x1-1x1-0-NCHW-FP32-F=ConvAsm1x1U:4,32,7,32,1,1,2,1;ConvOclDirectFwd1x1:1,64,1,1,1,0,32,2048,0
384-8-8-3x3-448-8-8-128-1x1-1x1-1x1-0-NCHW-FP32-W=ConvAsmBwdWrW3x3:0,1,8,4,3,1
256-14-14-1x1-1024-14-14-8-0x0-1x1-1x1-0-NCHW-FP32-B=ConvAsm1x1U:1,16,1,64,2,2,1,1;ConvOclDirectFwd1x1:8,64,16,16,0,2,16,4,1
64-206-62-1x1-48-206-62-16-0x0-1x1-1x1-0-NCHW-FP32-F=ConvAsm1x1U:4,16,6,64,1,1,1,1;ConvOclDirectFwd1x1:1,64,1,1,1,4,32,64,0
64-208-208-3x3-32-208-208-64-1x1-1x1-1x1-0-NCHW-FP32-W=ConvAsmBwdWrW3x3:0,0,16,4,2,8
192-35-35-1x1-384-35-35-16-0x0-1x1-1x1-0-NCHW-FP16-W=ConvAsmBwdWrW1x1:2,8,2,8,2,1,4,4,0,1
1024-14-14-1x1-512-14-14-128-0x0-1x1-1x1-0-NCHW-FP16-W=ConvAsmBwdWrW1x1:2,8,4,8,2,1,1,4,0,1
1024-7-7-1x1-464-7-7-512-0x0-1x1-1x1-0-NCHW-FP32-W=ConvAsmBwdWrW1x1:1,16,4,8,4,1,1,4,0,1
48-7-7-1x1-832-7-7-8-0x0-1x1-1x1-0-NCHW-FP32-W=ConvAsmBwdWrW1x1:4,4,2,4,2,1,1,4,0,1
1024-14-14-1x1-512-28-28-4-0x0-2x2-1x1-0-NCHW-FP16-B=ConvAsm1x1U:2,8,4,64,1,4,4,2;ConvOclDirectFwd1x1:1,64,1,1,0,1,8,8,0
320-28-28-1x1-128-28-28-16-0x0-1x1-1x1-0-NCHW-FP32-F=ConvAsm1x1U:2,16,3,16,1,2,2,2;ConvOclDirectFwd1x1:1,64,1,1,1,1,32,2048,0
2048-7-7-1x1-1024-14-14-64-0x0-2x2-1x1-0-NCHW-FP32-W=ConvAsmBwdWrW1x1:1,16,4,4,8,1,1,4,0,1
16-708-36-1x1-816-708-36-12-0x0-1x1-1x1-0-NCHW-FP32-B=ConvOclDirectFwd1x1:1,128,1,1,0,1,16,8,0
240-14-14-1x1-60-14-14-8-0x0-1x1-1x1-0-NCHW-FP32-B_g3=ConvOclDirectFwd:8,8,8,8,1,1,4,4,2
80-73-73-3x3-192-71-71-128-0x0-1x1-1x1-0-NCHW-FP32-F=ConvOclDirectFwd:16,8,16,16,1,2,8,4,1
256-56-56-1x1-512-28-28-128-0x0-2x2-1x1-0-NCHW-FP16-F=ConvAsm1x1U:1,8,2,32,2,4,1,4;ConvOclDirectFwd1x1:1,256,1,1,0,2,32,4,0
256-56-56-3x3-256-56-56-1-1x1-1x1-1x1-0-NCHW-FP32-W=ConvAsmBwdWrW3x3:0,1,8,2,2,1
384-27-27-1x1-64-27-27-32-0x0-1x1-1x1-0-NCHW-FP16-F=ConvAsm1x1U:3,16,6,64,1,2,2,4;ConvOclDirectFwd1x1:16,64,32,32,0,1,16,4,1
24-813-844-1x1-3-813-844-2-0x0-1x1-1x1-0-NCHW-FP32-W=ConvAsmBwdWrW1x1:4,4,2,1,2,1,2,4,0,3
128-7-7-1x1-960-7-7-32-0x0-1x1-1x1-0-NCHW-FP32-F=ConvAsm1x1U:2,8,2,32,1,4,1,4;ConvOclDirectFwd1x1:1,64,1,1,1,1,16,256,0
192-8-8-1x1-1280-8-8-32-0x0-1x1-1x1-0-NCHW-FP32-B=ConvAsm1x1U:1,16,1,64,2,2,1,4;ConvOclDirectFwd1x1:1,64,1,1,0,2,16,4,0
128-14-14-1x1-800-14-14-256-0x0-1x1-1x1-0-NCHW-FP16-F=ConvAsm1x1U:1,16,2,16,2,2,1,4;ConvOclDirectFwd1x1:1,256,1,1,0,4,16,4,0
192-14-14-1x1-720-14-14-16-0x0-1x1-1x1-0-NCHW-FP32-B=ConvAsm1x1U:1,16,1,64,2,2,2,2;ConvOclDirectFwd1x1:1,128,1,1,0,4,16,4,0
416-376-327-1x1-912-376-327-1-0x0-1x1-1x1-0-NCHW-FP32-B=ConvOclDirectFwd1x1:1,256,1,1,0,4,16,4,0
1024-17-17-1x1-192-17-17-256-0x0-1x1-1x1-0-NCHW-FP32-F=ConvAsm1x1U:3,16,5,64,2,2,2,1;ConvOclDirectFwd1x1:1,64,1,1,1,4,32,2048,0;ConvActivAsm1x1U:2,32,5,64,1,1
128-7-7-1x1-512-7-7-64-0x0-1x1-1x1-0-NCHW-FP32-W=ConvAsmBwdWrW1x1:4,4,4,4,4,1,2,4,0,0
128-7-7-1x1-800-7-7-32-0x0-1x1-1x1-0-NCHW-FP16-B=ConvAsm1x1U:1,8,2,32,1,4,2,2;ConvOclDirectFwd1x1:1,128,1,1,0,1,8,4,0
58-77-632-1x1-960-77-632-8-0x0-1x1-1x1-0-NCHW-FP32-F=ConvOclDirectFwd1x1:1,64,1,1,0,1,64,4,0
116-92-371-1x1-864-92-371-16-0x0-1x1-1x1-0-NCHW-FP32-B=ConvOclDirectFwd1x1:1,64,1,1,0,2,32,4,0
64-80-350-3x3-64-80-350-16-1x1-1x1-1x1-0-NCHW-FP16-B=ConvOclDirectFwd:8,16,16,32,2,2,8,4,2
704-7-7-1x1-128-7-7-16-0x0-1x1-1x1-0-NCHW-FP16-B=ConvAsm1x1U:1,8,2,16,1,4,4,1;ConvOclDirectFwd1x1:1,64,1,1,0,1,4,8,0
512-28-28-1x1-1024-14-14-512-0x0-2x2-1x1-0-NCHW-FP32-F=ConvAsm1x1U:2,16,2,64,3,2,2,2;ConvOclDirectFwd1x1:1,64,1,1,1,4,16,2048,0
58-28-28-1x1-58-28-28-8-0x0-1x1-1x1-0-NCHW-FP16-F=ConvAsm1x1U:1,8,2,16,1,2,1,1;ConvOclDirectFwd1x1:1,256,1,1,0,2,16,4,0
24-28-28-1x1-58-28-28-32-0x0-1x1-1x1-0-NCHW-FP32-F=ConvAsm1x1U:1,8,1,32,4,1,1,2;ConvOclDirectFwd1x1:1,256,1,1,0,1,8,8,0
144-703-60-1x1-384-703-60-1-0x0-1x1-1x1-0-NCHW-FP32-W=ConvAsmBwdWrW1x1:4,4,4,2,8,1,1,4,0,0
544-224-768-1x1-512-224-768-2-0x0-1x1-1x1-0-NCHW-FP32-F=ConvOclDirectFwd1x1:1,64,1,1,1,4,32,2048,0
128-14-14-1x1-544-14-14-64-0x0-1x1-1x1-0-NCHW-FP32-B=ConvAsm1x1U:4,16,4,64,1,2,2,2;ConvOclDirectFwd1x1:1,64,1,1,0,1,32,4,0
224-861-24-1x1-144-861-24-48-0x0-1x1-1x1-0-NCHW-FP32-F=ConvOclDirectFwd1x1:1,64,1,1,1,1,32,2048,0
608-7-7-1x1-128-7-7-64-0x0-1x1-1x1-0-NCHW-FP16-B=ConvAsm1x1U:1,16,2,32,1,2,4,4;ConvOclDirectFwd1x1:1,128,1,1,0,1,8,4,0
16-656-891-1x1-480-656-891-1-0x0-1x1-1x1-0-NCHW-FP32-B=ConvOclDirectFwd1x1:1,256,1,1,0,2,32,4,0
8-712-405-1x1-4-712-405-1-0x0-1x1-1x1-0-NCHW-FP32-F=ConvAsm1x1U:4,4,4,4,1,1,1,1;ConvOclDirectFwd1x1:1,64,1,1,0,2,8,8,0
1632-73-634-1x1-1024-73-634-6-0x0-1x1-1x1-0-NCHW-FP32-F=ConvOclDirectFwd1x1:1,64,1,1,1,1,16,2048,0
128-7-7-1x1-608-7-7-16-0x0-1x1-1x1-0-NCHW-FP32-F=ConvAsm1x1U:2,8,2,32,1,4,2,4;ConvOclDirectFwd1x1:1,64,1,1,1,0,16,256,0
60-28-28-3x3-60-28-28-32-1x1-1x1-1x1-0-NCHW-FP16-F=ConvOclDirectFwd:16,16,32,32,2,2,8,2,1
64-28-28-1x1-192-28-28-512-0x0-1x1-1x1-0-NCHW-FP16-W=ConvAsmBwdWrW1x1:4,4,8,1,8,1,4,4,0,1
576-14-14-1x1-64-14-14-64-0x0-1x1-1x1-0-NCHW-FP32-F=ConvAsm1x1U:4,16,4,64,1,2,2,2;ConvOclDirectFwd1x1:1,64,1,1,1,4,16,2048,0;ConvActivAsm1x1U:3,16,4,64,1,3
116-353-214-1x1-144-353-214-16-0x0-1x1-1x1-0-NCHW-FP32-B=ConvOclDirectFwd1x1:1,64,1,1,0,1,16,4,0
576-14-14-1x1-192-14-14-16-0x0-1x1-1x1-0-NCHW-FP16-F=ConvAsm1x1U:1,8,2,64,1,4,2,4;ConvOclDirectFwd1x1:1,64,1,1,0,4,8,4,0
64-56-56-1x1-256-56-56-8-0x0-1x1-1x1-0-NCHW-FP16-B=ConvAsm1x1U:1,16,2,32,1,2,1,4;ConvOclDirectFwd1x1:1,64,1,1,0,2,8,4,0
256-28-28-3x3-512-28-28-128-1x1-1x1-1x1-0-NCHW-FP16-W=ConvAsmBwdWrW3x3:0,1,8,4,1,1
1024-7-7-1x1-256-14-14-16-0x0-2x2-1x1-0-NCHW-FP16-W=ConvAsmBwdWrW1x1:1,16,2,8,2,1,2,4,0,0
128-28-28-1x1-352-28-28-64-0x0-1x1-1x1-0-NCHW-FP32-W=ConvAsmBwdWrW1x1:2,8,2,8,4,1,2,4,0,2
64-51-412-1x1-640-51-412-32-0x0-1x1-1x1-0-NCHW-FP32-F=ConvOclDirectFwd1x1:16,16,32,32,1,0,32,128,1
928-1004-104-1x1-928-1004-104-2-0x0-1x1-1x1-0-NCHW-FP32-B=ConvOclDirectFwd1x1:1,128,1,1,0,2,32,4,0
128-28-28-3x3-256-14-14-12-1x1-2x2-1x1-0-NCHW-FP32-F=ConvOclDirectFwd:16,8,16,16,1,2,8,1,1
60-28-28-1x1-240-28-28-1024-0x0-1x1-1x1-0-NCHW-FP32-B_g3=ConvOclDirectFwd:16,16,16,16,1,1,8,2,2
32-64-128-5x5-128-64-128-1-2x2-1x1-1x1-0-NCHW-FP16-F=ConvOclDirectFwd:8,32,16,32,2,1,8,1,1
928-57-787-1x1-1344-57-787-4-0x0-1x1-1x1-0-NCHW-FP32-B=ConvOclDirectFwd1x1:1,256,1,1,0,1,32,4,0
320-8-8-1x1-1280-8-8-256-0x0-1x1-1x1-0-NCHW-FP32-B=ConvAsm1x1U:1,16,1,64,4,2,1,4;ConvOclDirectFwd1x1:1,256,1,1,0,4,16,4,0
128-14-14-1x1-608-14-14-16-0x0-1x1-1x1-0-NCHW-FP32-F=ConvAsm1x1U:3,16,4,64,1,2,2,2;ConvOclDirectFwd1x1:1,64,1,1,1,4,64,128,0
320-14-14-3x3-160-14-14-1-1x1-1x1-1x1-0-NCHW-FP32-W=ConvAsmBwdWrW3x3:0,0,8,4,2,1
320-273-479-1x1-704-273-479-1-0x0-1x1-1x1-0-NCHW-FP32-F=ConvOclDirectFwd1x1:1,64,1,1,1,4,32,2048,0
128-28-28-1x1-256-56-56-2-0x0-2x2-1x1-0-NCHW-FP32-B=ConvAsm1x1U:1,16,1,32,1,2,2,2;ConvOclDirectFwd1x1:1,64,1,1,0,1,8,4,0
256-28-28-1x1-512-28-28-512-0x0-1x1-1x1-0-NCHW-FP16-W=ConvAsmBwdWrW1x1:2,8,4,8,2,2,2,4,0,1
32-7-7-1x1-832-7-7-256-0x0-1x1-1x1-0-NCHW-FP32-B=ConvAsm1x1U:1,16,1,64,2,2,1,4;ConvOclDirectFwd1x1:1,128,1,1,0,1,16,8,0
192-35-35-1x1-64-35-35-64-0x0-1x1-1x1-0-NCHW-FP16-F=ConvAsm1x1U:2,8,4,64,1,4,1,4;ConvOclDirectFwd1x1:1,64,1,1,0,1,16,8,0
256-5-5-3x3-128-10-10-32-1x1-2x2-1x1-0-NCHW-FP32-B=ConvOclDirectFwd:8,8,16,16,2,2,4,1,1
192-13-13-3x3-384-13-13-128-1x1-1x1-1x1-0-NCHW-FP32-W=ConvAsmBwdWrW3x3:0,1,16,4,9,1
128-57-57-3x3-128-57-57-128-1x1-1x1-1x1-0-NCHW-FP32-W_g32=ConvOclBwdWrW2<4>:1,10,3,1,3;ConvOclBwdWrW2<16>:1,6,3,1,3;ConvOclBwdWrW2<8>:1,7,1,1,7;ConvOclBwdWrW2<1>:1,7,1,1,3;ConvOclBwdWrW2<2>:1,7,1,1,3;ConvAsmBwdWrW3x3:0,0,16,2,6,3
1024-14-14-1x1-256-14-14-4-0x0-1x1-1x1-0-NCHW-FP32-F=ConvAsm1x1U:4,8,4,64,1,4,2,2;ConvOclDirectFwd1x1:1,64,1,1,1,0,16,256,0;ConvActivAsm1x1U:2,16,2,32,2,3
256-28-28-1x1-64-28-28-16-0x0-1x1-1x1-0-NCHW-FP32-F=ConvAsm1x1U:2,16,2,32,1,2,2,1;ConvOclDirectFwd1x1:1,64,1,1,1,4,16,2048,0;ConvActivAsm1x1U:3,16,3,16,1,3
232-135-275-1x1-1472-135-275-8-0x0-1x1-1x1-0-NCHW-FP32-B=ConvOclDirectFwd1x1:1,64,1,1,0,1,32,4,0
256-57-57-1x1-64-57-57-32-0x0-1x1-1x1-0-NCHW-FP32-W=ConvAsmBwdWrW1x1:4,4,4,2,8,1,2,4,0,1
1024-182-311-1x1-448-182-311-4-0x0-1x1-1x1-0-NCHW-FP32-B=ConvOclDirectFwd1x1:1,256,1,1,0,2,32,4,0
58-28-28-1x1-58-28-28-64-0x0-1x1-1x1-0-NCHW-FP32-B=ConvAsm1x1U:4,1,4,4,1,1,2,8;ConvOclDirectFwd1x1:1,128,1,1,0,4,16,4,0
512-14-14-3x3-512-28-28-6-1x1-2x2-1x1-0-NCHW-FP32-W_g32=ConvOclBwdWrW2<1>:1,7,8,1,7;ConvAsmBwdWrW3x3:0,0,16,4,5,1;ConvOclBwdWrW2<4>:1,7,8,1,7;ConvOclBwdWrW2<2>:1,7,8,1,7
120-7-7-3x3-120-14-14-16-1x1-2x2-1x1-0-NCHW-FP32-W=ConvAsmBwdWrW3x3:0,0,8,4,13,1
1872-35-432-1x1-800-35-432-6-0x0-1x1-1x1-0-NCHW-FP32-F=ConvOclDirectFwd1x1:1,64,1,1,1,4,64,2048,0
128-56-56-3x3-128-28-28-48-1x1-2x2-1x1-0-NCHW-FP32-F=ConvOclDirectFwd:16,16,32,16,2,1,8,2,2
19-28-116-1x1-528-28-116-4-0x0-1x1-1x1-0-NCHW-FP32-B=ConvAsm1x1U:1,8,1,16,1,1,4,1;ConvOclDirectFwd1x1:1,256,1,1,0,1,4,4,0
54-55-55-1x1-24-55-55-8-0x0-1x1-1x1-0-NCHW-FP32-W=ConvAsmBwdWrW1x1:4,4,2,2,2,1,2,4,0,3
384-13-13-3x3-384-13-13-8-1x1-1x1-1x1-0-NCHW-FP16-B=ConvOclDirectFwd:16,8,16,16,1,2,4,2,2
12-16-16-1x1-512-16-16-4-0x0-1x1-1x1-0-NCHW-FP32-B=ConvAsm1x1U:1,8,1,64,1,2,1,2;ConvOclDirectFwd1x1:1,64,1,1,0,2,4,4,0
1024-14-14-1x1-256-14-14-256-0x0-1x1-1x1-0-NCHW-FP32-B=ConvAsm1x1U:1,32,1,32,2,1,2,2;ConvOclDirectFwd1x1:1,64,1,1,0,1,32,4,0
928-216-986-1x1-416-216-986-1-0x0-1x1-1x1-0-NCHW-FP32-B=ConvOclDirectFwd1x1:1,128,1,1,0,2,32,4,0
192-7-7-1x1-2160-7-7-16-0x0-1x1-1x1-0-NCHW-FP16-B=ConvAsm1x1U:1,16,2,16,1,2,2,2;ConvOclDirectFwd1x1:1,64,1,1,0,1,8,4,0
128-112-112-3x3-128-112-112-64-1x1-1x1-1x1-0-NCHW-FP32-W=ConvAsmBwdWrW3x3:0,0,16,4,2,1
64-28-28-3x3-64-56-56-32-1x1-2x2-1x1-0-NCHW-FP32-W=ConvAsmBwdWrW3x3:0,0,8,8,4,4
768-17-17-1x1-160-17-17-4-0x0-1x1-1x1-0-NCHW-FP32-F=ConvAsm1x1U:1,8,1,64,2,4,2,4;ConvOclDirectFwd1x1:1,64,1,1,1,0,16,128,0;ConvActivAsm1x1U:4,16,4,32,1,4
192-7-7-1x1-832-7-7-16-0x0-1x1-1x1-0-NCHW-FP16-B=ConvAsm1x1U:1,8,2,32,1,4,2,2;ConvOclDirectFwd1x1:1,64,1,1,0,1,16,4,0
544-642-814-1x1-960-642-814-1-0x0-1x1-1x1-0-NCHW-FP32-F=ConvOclDirectFwd1x1:1,64,1,1,1,0,32,2048,0
64-14-14-1x1-512-14-14-4-0x0-1x1-1x1-0-NCHW-FP16-W=ConvAsmBwdWrW1x1:2,8,2,2,2,2,2,4,0,0
16-28-28-1x1-192-28-28-32-0x0-1x1-1x1-0-NCHW-FP16-W=ConvAsmBwdWrW1x1:4,4,2,1,8,2,4,4,0,1
512-14-14-1x1-1024-14-14-8-0x0-1x1-1x1-0-NCHW-FP32-W=ConvAsmBwdWrW1x1:1,16,8,4,4,1,1,4,0,1
128-789-88-1x1-992-789-88-6-0x0-1x1-1x1-0-NCHW-FP32-F=ConvOclDirectFwd1x1:1,64,1,1,1,0,64,2048,0
512-14-14-3x3-512-7-7-256-1x1-2x2-1x1-0-NCHW-FP32-F=ConvOclDirectFwd:8,8,8,8,1,1,8,2,2
1536-8-8-1x1-256-8-8-32-0x0-1x1-1x1-0-NCHW-FP32-F=ConvAsm1x1U:2,8,2,32,1,4,1,8;ConvOclDirectFwd1x1:1,64,1,1,1,1,16,256,0;ConvActivAsm1x1U:2,16,2,32,4,4
224-1007-53-1x1-192-1007-53-16-0x0-1x1-1x1-0-NCHW-FP32-W=ConvAsmBwdWrW1x1:4,4,4,4,4,1,1,4,0,1
512-14-14-1x1-64-14-14-8-0x0-1x1-1x1-0-NCHW-FP16-F=ConvAsm1x1U:1,8,2,32,1,2,4,1;ConvOclDirectFwd1x1:1,64,1,1,0,4,4,4,0
2-622-313-1x1-19-622-313-48-0x0-1x1-1x1-0-NCHW-FP32-F=ConvAsm1x1U:1,8,1,16,1,1,1,1;ConvOclDirectFwd1x1:1,128,1,1,0,2,16,4,0
960-269-7-1x1-2-269-7-64-0x0-1x1-1x1-0-NCHW-FP32-F=ConvAsm1x1U:4,1,8,4,1,1,1,1;ConvOclDirectFwd1x1:1,64,1,1,0,1,16,8,0
128-54-54-3x3-32-54-54-16-1x1-1x1-1x1-0-NCHW-FP16-B=ConvOclDirectFwd:16,16,32,32,2,2,8,2,2
96-965-331-1x1-48-965-331-2-0x0-1x1-1x1-0-NCHW-FP32-F=ConvOclDirectFwd1x1:1,64,1,1,1,1,32,2048,0
60-14-14-1x1-240-14-14-512-0x0-1x1-1x1-0-NCHW-FP32-F_g3=ConvOclDirectFwd:16,16,16,16,1,1,8,4,1
64-28-28-1x1-256-28-28-16-0x0-1x1-1x1-0-NCHW-FP16-B=ConvAsm1x1U:1,16,2,16,1,2,2,2;ConvOclDirectFwd1x1:1,64,1,1,0,4,16,4,0
928-271-141-1x1-1472-271-141-4-0x0-1x1-1x1-0-NCHW-FP32-B=ConvOclDirectFwd1x1:1,64,1,1,0,1,32,4,0
384-35-35-1x1-96-35-35-1-0x0-1x1-1x1-0-NCHW-FP32-F=ConvAsm1x1U:2,8,2,64,1,2,4,2;ConvOclDirectFwd1x1:1,64,1,1,1,1,16,64,0;ConvActivAsm1x1U:1,16,1,64,1,4
512-7-7-3x3-512-7-7-2-1x1-1x1-1x1-0-NCHW-FP16-W=ConvAsmBwdWrW3x3:0,0,8,4,4,1
352-706-72-1x1-576-706-72-16-0x0-1x1-1x1-0-NCHW-FP32-F=ConvOclDirectFwd1x1:1,64,1,1,1,0,32,2048,0
384-138-989-1x1-58-138-989-8-0x0-1x1-1x1-0-NCHW-FP32-B=ConvOclDirectFwd1x1:1,256,1,1,0,2,4,4,0
224-14-14-3x3-112-14-14-128-1x1-1x1-1x1-0-NCHW-FP16-B=ConvOclDirectFwd:8,16,16,16,2,1,8,1,1
832-7-7-1x1-32-7-7-64-0x0-1x1-1x1-0-NCHW-FP16-F=ConvAsm1x1U:2,8,4,16,1,4,4,1;ConvOclDirectFwd1x1:1,256,1,1,0,1,4,8,0
3-492-194-1x1-2-492-194-48-0x0-1x1-1x1-0-NCHW-FP32-W=ConvAsmBwdWrW1x1:4,4,2,1,2,1,4,4,0,1
486-19-19-3x3-512-19-19-64-1x1-1x1-1x1-0-NCHW-FP32-W=ConvAsmBwdWrW3x3:0,0,8,2,9,6
1280-124-427-1x1-480-124-427-1-0x0-1x1-1x1-0-NCHW-FP32-F=ConvOclDirectFwd1x1:1,64,1,1,1,0,64,2048,0
480-28-28-1x1-128-28-28-512-0x0-1x1-1x1-0-NCHW-FP32-F=ConvAsm1x1U:3,16,3,16,2,2,1,4;ConvOclDirectFwd1x1:1,64,1,1,1,4,32,2048,0
116-28-28-1x1-116-28-28-256-0x0-1x1-1x1-0-NCHW-FP32-W=ConvAsmBwdWrW1x1:2,8,2,8,2,1,2,4,0,3
2-2-604-1x1-1760-2-604-12-0x0-1x1-1x1-0-NCHW-FP32-W=ConvAsmBwdWrW1x1:4,4,4,1,2,1,2,4,0,1
128-14-14-3x3-128-28-28-32-1x1-2x2-1x1-0-NCHW-FP16-B=ConvOclDirectFwd:16,32,32,32,2,1,4,2,2
64-56-56-3x3-192-56-56-128-1x1-1x1-1x1-0-NCHW-FP16-F=ConvOclDirectFwd:32,8,32,32,1,4,8,1,2;ConvOclDirectFwdFused:32,8,32,32,1,4,8,1,1
1024-7-7-1x1-464-7-7-8-0x0-1x1-1x1-0-NCHW-FP16-B=ConvAsm1x1U:1,8,2,32,1,4,4,4;ConvOclDirectFwd1x1:1,256,1,1,0,1,4,4,0
992-2-950-1x1-544-2-950-1-0x0-1x1-1x1-0-NCHW-FP32-B=ConvAsm1x1U:2,16,2,64,1,2,2,1;ConvOclDirectFwd1x1:1,64,1,1,0,2,16,4,0
128-14-14-1x1-928-14-14-64-0x0-1x1-1x1-0-NCHW-FP32-B=ConvAsm1x1U:4,16,4,64,1,2,2,2;ConvOclDirectFwd1x1:1,256,1,1,0,2,32,4,0
256-29-29-3x3-256-15-15-256-1x1-2x2-1x1-0-NCHW-FP32-F=ConvOclDirectFwd:16,16,16,16,1,1,8,1,2
128-14-14-3x3-256-14-14-256-1x1-1x1-1x1-0-NCHW-FP16-F=ConvOclDirectFwd:8,8,16,16,2,2,8,1,2;ConvOclDirectFwdFused:8,8,16,16,2,2,8,1,2
16-279-269-1x1-48-279-269-8-0x0-1x1-1x1-0-NCHW-FP32-B=ConvAsm1x1U:2,16,3,32,1,2,4,2;ConvOclDirectFwd1x1:1,128,1,1,0,1,16,8,0
1280-150-38-1x1-2048-150-38-4-0x0-1x1-1x1-0-NCHW-FP32-B=ConvOclDirectFwd1x1:1,256,1,1,0,4,16,8,0
512-14-14-3x3-512-7-7-512-1x1-2x2-1x1-0-NCHW-FP32-F=ConvOclDirectFwd:8,8,8,8,1,1,8,2,1
384-14-14-1x1-128-14-14-256-0x0-1x1-1x1-0-NCHW-FP16-F=ConvAsm1x1U:2,8,4,64,1,4,1,8;ConvOclDirectFwd1x1:1,256,1,1,0,4,8,4,0
128-14-14-1x1-672-14-14-16-0x0-1x1-1x1-0-NCHW-FP16-B=ConvAsm1x1U:1,16,2,16,1,2,2,2;ConvOclDirectFwd1x1:1,256,1,1,0,4,8,4,0
320-14-14-3x3-160-14-14-32-1x1-1x1-1x1-0-NCHW-FP16-B=ConvOclDirectFwd:8,16,16,16,2,1,8,1,2
416-851-746-1x1-232-851-746-2-0x0-1x1-1x1-0-NCHW-FP32-B=ConvOclDirectFwd1x1:1,256,1,1,0,2,16,4,0
1000-20-165-1x1-384-20-165-16-0x0-1x1-1x1-0-NCHW-FP32-B=ConvAsm1x1U:1,32,5,16,1,1,1,1;ConvOclDirectFwd1x1:1,256,1,1,0,2,32,4,0
1216-556-48-1x1-800-556-48-6-0x0-1x1-1x1-0-NCHW-FP32-F=ConvOclDirectFwd1x1:1,64,1,1,1,0,64,2048,0
256-14-14-1x1-528-14-14-4-0x0-1x1-1x1-0-NCHW-FP16-W=ConvAsmBwdWrW1x1:2,8,2,8,2,1,2,4,0,0
48-27-27-1x1-384-27-27-32-0x0-1x1-1x1-0-NCHW-FP32-W=ConvAsmBwdWrW1x1:2,8,4,8,2,1,4,4,0,1
160-28-28-1x1-128-28-28-16-0x0-1x1-1x1-0-NCHW-FP32-F=ConvAsm1x1U:2,16,2,32,1,2,1,2;ConvOclDirectFwd1x1:1,64,1,1,1,4,32,2048,0
16-64-128-5x5-48-64-128-1-2x2-1x1-1x1-0-NCHW-FP16-F=ConvOclDirectFwd:8,32,16,32,2,1,4,2,1
64-27-27-5x5-192-27-27-512-2x2-1x1-1x1-0-NCHW-FP32-F=ConvOclDirectFwd:16,16,32,32,2,2,4,1,2
128-14-14-1x1-768-14-14-64-0x0-1x1-1x1-0-NCHW-FP32-F=ConvAsm1x1U:4,8,4,64,1,4,2,2;ConvOclDirectFwd1x1:1,64,1,1,1,0,32,2048,0
2048-7-7-1x1-1024-14-14-48-0x0-2x2-1x1-0-NCHW-FP32-W=ConvAsmBwdWrW1x1:1,16,4,8,4,1,1,4,0,2
32-284-500-1x1-320-284-500-2-0x0-1x1-1x1-0-NCHW-FP32-B=ConvOclDirectFwd1x1:1,256,1,1,0,1,32,4,0
256-56-56-1x1-128-56-56-4-0x0-1x1-1x1-0-NCHW-FP32-F=ConvAsm1x1U:2,16,2,64,2,2,1,1;ConvOclDirectFwd1x1:1,64,1,1,1,1,16,256,0
128-14-14-1x1-480-14-14-256-0x0-1x1-1x1-0-NCHW-FP32-F=ConvAsm1x1U:2,16,2,64,2,2,2,2;ConvOclDirectFwd1x1:1,64,1,1,1,0,32,256,0
1152-620-240-1x1-960-620-240-2-0x0-1x1-1x1-0-NCHW-FP32-F=ConvOclDirectFwd1x1:1,64,1,1,1,4,16,2048,0
128-14-14-1x1-352-14-14-512-0x0-1x1-1x1-0-NCHW-FP32-W=ConvAsmBwdWrW1x1:4,4,4,4,4,1,4,4,0,1
224-151-1003-1x1-96-151-1003-1-0x0-1x1-1x1-0-NCHW-FP32-B=ConvOclDirectFwd1x1:1,256,1,1,0,1,32,4,0
2160-166-252-1x1-8-166-252-1-0x0-1x1-1x1-0-NCHW-FP32-F=ConvOclDirectFwd1x1:1,256,1,1,0,4,16,4,0
64-112-112-7x7-3-225-225-128-2x2-2x2-1x1-0-NCHW-FP32-B=ConvOclDirectFwd:16,16,32,32,2,2,8,2,1
640-301-387-1x1-1120-301-387-2-0x0-1x1-1x1-0-NCHW-FP32-B=ConvOclDirectFwd1x1:1,64,1,1,0,1,32,4,0
384-8-8-1x1-1280-8-8-1-0x0-1x1-1x1-0-NCHW-FP32-B=ConvAsm1x1U:1,8,1,64,1,4,4,1;ConvOclDirectFwd1x1:1,128,1,1,0,1,4,8,0
128-17-17-1x1-1024-17-17-16-0x0-1x1-1x1-0-NCHW-FP16-W=ConvAsmBwdWrW1x1:2,8,4,8,2,1,2,2,0,1
1104-63-15-1x1-432-63-15-16-0x0-1x1-1x1-0-NCHW-FP32-W=ConvAsmBwdWrW1x1:1,16,4,8,4,1,1,4,0,1
64-112-112-1x1-64-112-112-32-0x0-1x1-1x1-0-NCHW-FP32-W=ConvAsmBwdWrW1x1:4,4,2,1,8,1,4,4,0,1
512-28-28-1x1-512-28-28-48-0x0-1x1-1x1-0-NCHW-FP32-F=ConvAsm1x1U:3,16,5,32,2,2,2,1;ConvOclDirectFwd1x1:1,64,1,1,1,1,16,2048,0
128-14-14-1x1-576-14-14-64-0x0-1x1-1x1-0-NCHW-FP32-W=ConvAsmBwdWrW1x1:1,16,2,8,4,1,2,4,0,2
240-28-28-1x1-60-28-28-512-0x0-1x1-1x1-0-NCHW-FP32-B_g3=ConvOclDirectFwd:16,16,16,16,1,1,8,4,2
3-224-224-3x3-64-224-224-16-1x1-1x1-1x1-0-NCHW-FP16-B=ConvOclDirectFwd:16,16,32,32,2,2,8,1,2
2048-8-8-1x1-1024-8-8-4-0x0-1x1-1x1-0-NCHW-FP32-F=ConvAsm1x1U:2,8,2,32,2,2,4,1;ConvOclDirectFwd1x1:1,64,1,1,1,0,32,256,0
608-14-14-1x1-96-14-14-32-0x0-1x1-1x1-0-NCHW-FP32-F=ConvAsm1x1U:3,16,3,16,2,2,2,2;ConvOclDirectFwd1x1:1,64,1,1,1,4,64,256,0;ConvActivAsm1x1U:3,16,3,16,4,4
48-35-35-1x1-192-35-35-32-0x0-1x1-1x1-0-NCHW-FP16-W=ConvAsmBwdWrW1x1:4,4,8,4,2,1,4,2,0,1
128-14-14-1x1-672-14-14-128-0x0-1x1-1x1-0-NCHW-FP16-F=ConvAsm1x1U:1,16,2,16,2,2,1,4;ConvOclDirectFwd1x1:1,256,1,1,0,4,16,4,0
256-56-56-3x3-256-28-28-16-1x1-2x2-1x1-0-NCHW-FP32-F_g32=ConvOclDirectFwd:16,16,32,32,2,2,8,2,1
32-14-14-1x1-528-14-14-256-0x0-1x1-1x1-0-NCHW-FP32-B=ConvAsm1x1U:1,16,1,64,1,2,2,1;ConvOclDirectFwd1x1:1,256,1,1,0,4,16,8,0
1104-197-521-1x1-2048-197-521-2-0x0-1x1-1x1-0-NCHW-FP32-F=ConvOclDirectFwd1x1:1,64,1,1,1,1,16,2048,0
512-14-14-3x3-512-14-14-1-1x1-1x1-1x1-0-NCHW-FP32-B_g32=ConvOclDirectFwd:16,16,16,16,1,1,2,4,1
928-78-104-1x1-1376-78-104-12-0x0-1x1-1x1-0-NCHW-FP32-B=ConvOclDirectFwd1x1:1,256,1,1,0,1,32,4,0
144-14-14-3x3-288-14-14-8-1x1-1x1-1x1-0-NCHW-FP16-F=ConvOclDirectFwd:16,8,16,16,1,2,4,2,1;ConvOclDirectFwdFused:16,8,16,16,1,2,4,2,2
58-28-28-1x1-24-28-28-4-0x0-1x1-1x1-0-NCHW-FP32-B=ConvAsm1x1U:1,8,1,32,1,1,2,1;ConvOclDirectFwd1x1:1,256,1,1,0,1,16,4,0
960-7-7-1x1-128-7-7-128-0x0-1x1-1x1-0-NCHW-FP16-F=ConvAsm1x1U:2,8,4,16,1,4,2,4;ConvOclDirectFwd1x1:1,64,1,1,0,1,8,4,0
256-56-56-1x1-256-56-56-256-0x0-1x1-1x1-0-NCHW-FP32-F=ConvAsm1x1U:2,16,4,64,1,2,1,4;ConvOclDirectFwd1x1:1,64,1,1,1,4,16,2048,0
128-14-14-1x1-544-14-14-32-0x0-1x1-1x1-0-NCHW-FP16-W=ConvAsmBwdWrW1x1:2,8,2,8,2,1,4,4,0,1
64-35-35-1x1-288-35-35-64-0x0-1x1-1x1-0-NCHW-FP32-B=ConvAsm1x1U:1,32,1,64,1,1,1,1;ConvOclDirectFwd1x1:1,256,1,1,0,1,32,4,0
192-35-35-1x1-384-35-35-1-0x0-1x1-1x1-0-NCHW-FP16-W=ConvAsmBwdWrW1x1:4,4,4,4,2,1,1,4,0,0
512-7-7-1x1-512-7-7-1-0x0-1x1-1x1-0-NCHW-FP16-B=ConvAsm1x1U:1,8,2,16,1,4,4,1;ConvOclDirectFwd1x1:1,256,1,1,0,1,8,8,0
384-8-8-1x1-1536-8-8-32-0x0-1x1-1x1-0-NCHW-FP16-W=ConvAsmBwdWrW1x1:2,8,4,4,2,1,1,4,0,0
480-14-14-1x1-120-14-14-4-0x0-1x1-1x1-0-NCHW-FP16-B_g3=ConvOclDirectFwd:8,16,8,16,1,1,2,2,2
128-56-56-3x3-128-56-56-128-1x1-1x1-1x1-0-NCHW-FP32-W_g32=ConvOclBwdWrW2<4>:1,7,3,1,5;ConvOclBwdWrW2<16>:1,6,3,1,3;ConvOclBwdWrW2<8>:1,6,3,1,3;ConvOclBwdWrW2<1>:1,12,3,1,3;ConvOclBwdWrW2<2>:1,7,1,1,3;ConvAsmBwdWrW3x3:0,0,16,1,2,1
512-29-29-1x1-256-57-57-2-0x0-2x2-1x1-0-NCHW-FP32-B=ConvAsm1x1U:1,16,1,64,1,2,4,1;ConvOclDirectFwd1x1:1,256,1,1,0,1,8,4,0
1024-14-14-1x1-512-28-28-4-0x0-2x2-1x1-0-NCHW-FP32-W=ConvAsmBwdWrW1x1:1,16,4,2,8,1,1,4,0,0
32-54-54-3x3-128-54-54-32-1x1-1x1-1x1-0-NCHW-FP16-W=ConvAsmBwdWrW3x3:0,1,8,2,1,8
1024-14-14-1x1-1024-14-14-64-0x0-1x1-1x1-0-NCHW-FP32-B=ConvAsm1x1U:1,32,2,16,1,1,1,1;ConvOclDirectFwd1x1:1,256,1,1,0,4,16,8,0
192-7-7-3x3-384-7-7-256-1x1-1x1-1x1-0-NCHW-FP16-F=ConvOclDirectFwd:8,8,8,8,1,1,8,2,1;ConvOclDirectFwdFused:8,8,8,8,1,1,8,4,2
336-108-138-1x1-704-108-138-8-0x0-1x1-1x1-0-NCHW-FP32-F=ConvOclDirectFwd1x1:1,64,1,1,1,0,16,2048,0
96-92-26-1x1-576-92-26-64-0x0-1x1-1x1-0-NCHW-FP32-W=ConvAsmBwdWrW1x1:1,16,4,2,8,1,4,4,0,1
160-28-28-1x1-128-28-28-32-0x0-1x1-1x1-0-NCHW-FP16-W=ConvAsmBwdWrW1x1:2,8,2,4,2,1,4,4,0,1
48-899-918-1x1-80-899-918-2-0x0-1x1-1x1-0-NCHW-FP32-F=ConvOclDirectFwd1x1:1,64,1,1,1,4,64,256,0
384-27-27-1x1-64-27-27-512-0x0-1x1-1x1-0-NCHW-FP32-F=ConvAsm1x1U:3,16,3,64,2,2,2,2;ConvOclDirectFwd1x1:1,64,1,1,1,1,32,2048,0
64-114-114-7x7-3-227-227-48-3x3-2x2-1x1-0-NCHW-FP32-W=ConvOclBwdWrW2<1>:3,7,3,3,7;ConvOclBwdWrW2<2>:3,6,3,1,7;ConvOclBwdWrW2<4>:3,6,3,1,7;ConvOclBwdWrW2<16>:3,10,1,3,7;ConvOclBwdWrW2<8>:3,6,3,1,7
58-28-28-1x1-58-28-28-2-0x0-1x1-1x1-0-NCHW-FP32-B=ConvAsm1x1U:4,1,4,4,1,1,1,1;ConvOclDirectFwd1x1:1,256,1,1,0,2,16,4,0
128-14-14-1x1-704-14-14-512-0x0-1x1-1x1-0-NCHW-FP16-W=ConvAsmBwdWrW1x1:2,8,4,8,2,2,4,4,0,1
192-71-71-3x3-192-35-35-8-0x0-2x2-1x1-0-NCHW-FP32-F=ConvOclDirectFwd:16,16,16,16,1,1,8,2,1
19-270-333-1x1-320-270-333-4-0x0-1x1-1x1-0-NCHW-FP32-B=ConvOclDirectFwd1x1:1,256,1,1,0,2,32,4,0
128-128-128-1x1-512-128-128-4-0x0-1x1-1x1-0-NCHW-FP32-B=ConvOclDirectFwd1x1:1,128,1,1,0,1,32,4,0
704-629-56-1x1-480-629-56-6-0x0-1x1-1x1-0-NCHW-FP32-B=ConvOclDirectFwd1x1:1,128,1,1,0,1,32,4,0
352-7-7-1x1-1024-7-7-64-0x0-1x1-1x1-0-NCHW-FP16-B=ConvAsm1x1U:1,16,2,32,1,2,2,2;ConvOclDirectFwd1x1:1,256,1,1,0,1,8,4,0
3-2-2-3x3-4-3-3-512-1x1-2x2-1x1-0-NCHW-FP32-B=ConvOclDirectFwd:8,8,8,8,1,1,4,1,2
32-27-27-1x1-256-27-27-32-0x0-1x1-1x1-0-NCHW-FP32-F=ConvAsm1x1U:2,16,2,64,2,2,1,1;ConvOclDirectFwd1x1:1,64,1,1,1,1,32,128,0
24-595-725-1x1-336-595-725-1-0x0-1x1-1x1-0-NCHW-FP32-B=ConvOclDirectFwd1x1:1,256,1,1,0,1,16,8,0
256-415-908-1x1-128-415-908-2-0x0-1x1-1x1-0-NCHW-FP32-F=ConvOclDirectFwd1x1:1,64,1,1,1,0,32,2048,0
60-28-28-1x1-240-28-28-2-0x0-1x1-1x1-0-NCHW-FP32-B_g3=ConvOclDirectFwd:16,16,16,16,1,1,8,4,2
512-7-7-1x1-1024-14-14-16-0x0-2x2-1x1-0-NCHW-FP32-W=ConvAsmBwdWrW1x1:1,16,2,4,8,1,1,4,0,1
256-29-29-3x3-256-57-57-2-1x1-2x2-1x1-0-NCHW-FP32-W_g32=ConvOclBwdWrW2<1>:1,6,3,1,3;ConvOclBwdWrW2<2>:1,7,3,1,5;ConvAsmBwdWrW3x3:0,0,16,2,4,1
32-97-835-1x1-896-97-835-2-0x0-1x1-1x1-0-NCHW-FP32-F=ConvOclDirectFwd1x1:1,64,1,1,1,1,32,2048,0
120-7-7-3x3-120-14-14-16-1x1-2x2-1x1-0-NCHW-FP16-W=ConvAsmBwdWrW3x3:0,0,8,2,5,1
96-35-35-1x1-384-35-35-64-0x0-1x1-1x1-0-NCHW-FP32-B=ConvAsm1x1U:1,32,2,64,1,1,1,1;ConvOclDirectFwd1x1:1,256,1,1,0,1,32,4,0
816-456-211-1x1-8-456-211-6-0x0-1x1-1x1-0-NCHW-FP32-F=ConvOclDirectFwd1x1:1,256,1,1,0,4,16,4,0
160-581-717-1x1-80-581-717-8-0x0-1x1-1x1-0-NCHW-FP32-F=ConvOclDirectFwd1x1:1,64,1,1,1,0,32,256,0
960-7-7-1x1-128-7-7-32-0x0-1x1-1x1-0-NCHW-FP16-B=ConvAsm1x1U:1,8,2,32,1,4,4,4;ConvOclDirectFwd1x1:1,64,1,1,0,1,8,8,0
128-28-28-1x1-384-28-28-256-0x0-1x1-1x1-0-NCHW-FP32-W=ConvAsmBwdWrW1x1:2,8,2,8,4,1,2,4,0,2
480-17-376-1x1-896-17-376-64-0x0-1x1-1x1-0-NCHW-FP32-F=ConvOclDirectFwd1x1:1,64,1,1,1,4,32,2048,0
60-14-14-3x3-60-28-28-256-1x1-2x2-1x1-0-NCHW-FP16-W=ConvAsmBwdWrW3x3:0,0,16,2,9,2
32-28-28-1x1-192-28-28-512-0x0-1x1-1x1-0-NCHW-FP16-B=ConvAsm1x1U:1,16,2,16,1,2,1,4;ConvOclDirectFwd1x1:1,256,1,1,0,2,32,4,0
256-27-27-1x1-48-27-27-512-0x0-1x1-1x1-0-NCHW-FP16-F=ConvAsm1x1U:3,8,6,64,1,4,1,2;ConvOclDirectFwd1x1:1,256,1,1,0,1,16,8,0
128-56-56-1x1-160-56-56-32-0x0-1x1-1x1-0-NCHW-FP32-F=ConvAsm1x1U:2,16,2,64,2,2,1,1;ConvOclDirectFwd1x1:1,64,1,1,1,1,32,2048,0
232-14-14-1x1-232-14-14-4-0x0-1x1-1x1-0-NCHW-FP16-F=ConvAsm1x1U:1,8,2,16,1,4,2,1;ConvOclDirectFwd1x1:1,64,1,1,0,4,4,4,0
512-28-28-3x3-256-28-28-8-1x1-1x1-1x1-0-NCHW-FP16-B=ConvOclDirectFwd:16,16,32,32,2,2,8,2,2
512-15-15-3x3-512-15-15-48-1x1-1x1-1x1-0-NCHW-FP32-B_g32=ConvOclDirectFwd:16,16,16,16,1,1,8,4,2
128-56-56-1x1-64-56-56-16-0x0-1x1-1x1-0-NCHW-FP32-W=ConvAsmBwdWrW1x1:4,4,2,2,8,1,4,4,0,1
608-7-7-1x1-128-7-7-64-0x0-1x1-1x1-0-NCHW-FP32-F=ConvAsm1x1U:4,8,4,16,1,4,2,2;ConvOclDirectFwd1x1:1,64,1,1,1,1,16,256,0
160-14-14-1x1-512-14-14-16-0x0-1x1-1x1-0-NCHW-FP32-W=ConvAsmBwdWrW1x1:1,16,2,8,2,1,2,4,0,1
232-7-7-1x1-232-7-7-1-0x0-1x1-1x1-0-NCHW-FP16-B=ConvAsm1x1U:1,8,2,16,1,2,4,1;ConvOclDirectFwd1x1:1,256,1,1,0,1,16,8,0
32-28-28-5x5-16-28-28-64-2x2-1x1-1x1-0-NCHW-FP32-B=ConvOclDirectFwd:8,32,16,32,2,1,8,1,2
192-56-56-1x1-128-56-56-512-0x0-1x1-1x1-0-NCHW-FP16-W=ConvAsmBwdWrW1x1:4,4,8,1,8,1,2,4,0,1
64-27-27-5x5-192-27-27-256-2x2-1x1-1x1-0-NCHW-FP32-B=ConvOclDirectFwd:16,16,32,32,2,2,8,2,1
64-224-224-3x3-64-224-224-16-1x1-1x1-1x1-0-NCHW-FP16-W=ConvAsmBwdWrW3x3:0,1,16,4,1,8
128-7-7-1x1-800-7-7-16-0x0-1x1-1x1-0-NCHW-FP16-F=ConvAsm1x1U:1,8,2,32,1,4,2,2;ConvOclDirectFwd1x1:8,64,8,8,0,1,16,4,1
128-14-14-1x1-768-14-14-256-0x0-1x1-1x1-0-NCHW-FP16-F=ConvAsm1x1U:1,8,2,16,2,4,1,8;ConvOclDirectFwd1x1:1,256,1,1,0,4,16,4,0
240-28-28-1x1-60-28-28-1024-0x0-1x1-1x1-0-NCHW-FP16-F_g3=ConvOclDirectFwd:16,16,32,32,2,2,8,2,1
128-14-14-1x1-512-14-14-64-0x0-1x1-1x1-0-NCHW-FP32-B=ConvAsm1x1U:1,32,1,32,2,1,2,1;ConvOclDirectFwd1x1:1,128,1,1,0,4,16,4,0
960-7-7-1x1-240-7-7-512-0x0-1x1-1x1-0-NCHW-FP32-F_g3=ConvOclDirectFwd:8,8,8,8,1,1,8,2,1
4-19-1008-1x1-1-19-1008-32-0x0-1x1-1x1-0-NCHW-FP32-F=ConvAsm1x1U:4,1,4,4,1,1,2,1;ConvOclDirectFwd1x1:1,256,1,1,0,4,4,4,0
64-54-54-3x3-16-54-54-16-1x1-1x1-1x1-0-NCHW-FP16-F=ConvOclDirectFwd:8,32,16,32,2,1,8,4,2
120-7-7-3x3-120-14-14-64-1x1-2x2-1x1-0-NCHW-FP32-W=ConvAsmBwdWrW3x3:0,0,8,4,11,1
512-28-28-3x3-512-28-28-256-1x1-1x1-1x1-0-NCHW-FP16-B=ConvOclDirectFwd:16,16,32,32,2,2,8,2,1
336-47-409-1x1-384-47-409-8-0x0-1x1-1x1-0-NCHW-FP32-F=ConvOclDirectFwd1x1:1,64,1,1,1,4,16,2048,0
3-1-1-3x3-4-2-2-16-0x0-2x2-1x1-0-NCHW-FP32-B=ConvOclDirectFwd:8,8,8,8,1,1,1,1,2
256-27-27-3x3-64-27-27-128-1x1-1x1-1x1-0-NCHW-FP16-F=ConvOclDirectFwd:16,16,32,32,2,2,8,1,1
512-14-14-3x3-512-14-14-1-1x1-1x1-1x1-0-NCHW-FP16-F=ConvOclDirectFwd:16,16,16,16,1,1,2,4,1;ConvOclDirectFwdFused:16,16,16,16,1,1,2,4,1
128-7-7-1x1-864-7-7-32-0x0-1x1-1x1-0-NCHW-FP32-F=ConvAsm1x1U:1,8,1,64,3,4,1,4;ConvOclDirectFwd1x1:1,64,1,1,1,4,16,256,0
1024-17-17-1x1-192-17-17-1-0x0-1x1-1x1-0-NCHW-FP16-F=ConvAsm1x1U:1,8,2,32,1,4,4,1;ConvOclDirectFwd1x1:1,64,1,1,0,1,4,8,0
2048-7-7-1x1-512-7-7-8-0x0-1x1-1x1-0-NCHW-FP16-F=ConvAsm1x1U:1,8,4,16,1,2,4,2;ConvOclDirectFwd1x1:1,64,1,1,0,1,8,8,0
704-364-56-1x1-736-364-56-16-0x0-1x1-1x1-0-NCHW-FP32-W=ConvAsmBwdWrW1x1:2,8,4,8,4,1,2,4,0,0
736-14-14-1x1-128-14-14-512-0x0-1x1-1x1-0-NCHW-FP16-F=ConvAsm1x1U:1,16,2,16,2,2,1,4;ConvOclDirectFwd1x1:1,64,1,1,0,2,16,4,0
128-56-56-1x1-224-56-56-32-0x0-1x1-1x1-0-NCHW-FP32-B=ConvAsm1x1U:1,16,1,64,1,2,2,2;ConvOclDirectFwd1x1:1,128,1,1,0,1,32,4,0
1536-8-8-1x1-384-8-8-8-0x0-1x1-1x1-0-NCHW-FP32-F=ConvAsm1x1U:2,8,2,32,1,4,2,2;ConvOclDirectFwd1x1:1,64,1,1,1,0,16,256,0;ConvActivAsm1x1U:2,16,2,16,2,4
512-28-28-1x1-256-56-56-128-0x0-2x2-1x1-0-NCHW-FP32-W=ConvAsmBwdWrW1x1:2,8,4,8,4,1,2,4,0,2
48-35-35-1x1-192-35-35-8-0x0-1x1-1x1-0-NCHW-FP16-W=ConvAsmBwdWrW1x1:4,4,4,2,4,1,4,2,0,0
128-27-27-3x3-128-27-27-64-1x1-1x1-1x1-0-NCHW-FP32-W=ConvAsmBwdWrW3x3:0,1,8,4,3,1
32-28-28-3x3-128-28-28-256-1x1-1x1-1x1-0-NCHW-FP16-B=ConvOclDirectFwd:16,16,32,32,2,2,8,1,2
384-27-27-1x1-48-27-27-16-0x0-1x1-1x1-0-NCHW-FP16-F=ConvAsm1x1U:3,8,6,64,1,4,4,1;ConvOclDirectFwd1x1:1,64,1,1,0,1,8,4,0
64-57-57-1x1-128-57-57-32-0x0-1x1-1x1-0-NCHW-FP32-F=ConvAsm1x1U:1,16,1,64,1,2,1,1;ConvOclDirectFwd1x1:1,64,1,1,1,1,16,64,0
128-7-7-1x1-736-7-7-64-0x0-1x1-1x1-0-NCHW-FP32-W=ConvAsmBwdWrW1x1:1,16,2,4,8,1,2,4,0,3
480-14-14-1x1-16-14-14-8-0x0-1x1-1x1-0-NCHW-FP32-F=ConvAsm1x1U:1,8,1,16,1,4,4,1;ConvOclDirectFwd1x1:1,64,1,1,1,4,64,64,0;ConvActivAsm1x1U:1,16,1,16,1,4
256-56-56-1x1-128-56-56-2-0x0-1x1-1x1-0-NCHW-FP32-F=ConvAsm1x1U:4,8,4,64,1,4,1,4;ConvOclDirectFwd1x1:1,64,1,1,1,1,16,256,0
32-100-345-1x1-112-100-345-2-0x0-1x1-1x1-0-NCHW-FP32-F=ConvAsm1x1U:2,32,7,64,1,1,1,2;ConvOclDirectFwd1x1:1,64,1,1,1,1,64,256,0
232-637-30-1x1-1392-637-30-2-0x0-1x1-1x1-0-NCHW-FP32-B=ConvOclDirectFwd1x1:1,256,1,1,0,2,16,4,0
128-14-14-1x1-864-14-14-256-0x0-1x1-1x1-0-NCHW-FP32-F=ConvAsm1x1U:2,16,2,64,3,2,1,2;ConvOclDirectFwd1x1:1,64,1,1,1,0,64,128,0
128-7-7-1x1-608-7-7-256-0x0-1x1-1x1-0-NCHW-FP32-F=ConvAsm1x1U:1,8,1,64,4,4,1,4;ConvOclDirectFwd1x1:1,64,1,1,1,1,64,2048,0
896-7-7-1x1-128-7-7-32-0x0-1x1-1x1-0-NCHW-FP16-B=ConvAsm1x1U:1,8,2,32,1,4,4,4;ConvOclDirectFwd1x1:1,64,1,1,0,1,8,8,0
128-54-54-1x1-32-54-54-64-0x0-1x1-1x1-0-NCHW-FP16-F=ConvAsm1x1U:1,8,2,64,1,4,2,2;ConvOclDirectFwd1x1:1,256,1,1,0,2,16,8,0
128-14-14-1x1-544-14-14-64-0x0-1x1-1x1-0-NCHW-FP32-W=ConvAsmBwdWrW1x1:1,16,2,8,4,1,2,4,0,2
256-14-14-3x3-256-28-28-2-1x1-2x2-1x1-0-NCHW-FP32-W=ConvAsmBwdWrW3x3:0,0,8,8,3,1
256-32-32-3x3-256-32-32-4-1x1-1x1-1x1-0-NCHW-FP32-W=ConvAsmBwdWrW3x3:0,1,16,4,4,1
128-28-28-1x1-160-28-28-512-0x0-1x1-1x1-0-NCHW-FP32-F=ConvAsm1x1U:1,16,1,64,4,2,2,2;ConvOclDirectFwd1x1:1,64,1,1,1,4,16,128,0
3-2-2-3x3-4-3-3-512-1x1-2x2-1x1-0-NCHW-FP32-W=ConvAsmBwdWrW3x3:0,0,16,1,3,5
1024-15-15-1x1-512-29-29-256-0x0-2x2-1x1-0-NCHW-FP32-W=ConvAsmBwdWrW1x1:1,16,4,8,4,1,1,4,0,1
256-35-35-1x1-64-35-35-16-0x0-1x1-1x1-0-NCHW-FP32-F=ConvAsm1x1U:2,16,2,64,2,2,2,1;ConvOclDirectFwd1x1:1,64,1,1,1,4,16,2048,0;ConvActivAsm1x1U:3,16,5,64,1,2
128-28-28-1x1-384-28-28-32-0x0-1x1-1x1-0-NCHW-FP32-W=ConvAsmBwdWrW1x1:2,8,4,4,4,2,2,4,0,1
320-51-180-1x1-608-51-180-16-0x0-1x1-1x1-0-NCHW-FP32-W=ConvAsmBwdWrW1x1:2,8,4,4,8,1,2,4,0,1
232-7-7-1x1-232-7-7-512-0x0-1x1-1x1-0-NCHW-FP32-W=ConvAsmBwdWrW1x1:1,16,2,8,4,1,4,4,0,2
192-56-56-1x1-288-56-56-16-0x0-1x1-1x1-0-NCHW-FP16-B=ConvAsm1x1U:1,16,2,64,1,2,2,2;ConvOclDirectFwd1x1:1,256,1,1,0,4,16,4,0
96-14-14-3x3-208-14-14-8-1x1-1x1-1x1-0-NCHW-FP16-F=ConvOclDirectFwd:16,8,16,16,1,2,4,2,2;ConvOclDirectFwdFused:16,8,16,16,1,2,4,2,2
384-14-14-1x1-128-14-14-32-0x0-1x1-1x1-0-NCHW-FP32-F=ConvAsm1x1U:4,16,4,64,1,2,2,2;ConvOclDirectFwd1x1:1,64,1,1,1,4,16,2048,0
24-14-14-5x5-64-14-14-64-2x2-1x1-1x1-0-NCHW-FP16-F=ConvOclDirectFwd:8,8,16,16,2,2,4,4,2;ConvOclDirectFwdFused:8,8,16,16,2,2,4,2,2
128-7-7-1x1-992-7-7-16-0x0-1x1-1x1-0-NCHW-FP16-B=ConvAsm1x1U:1,8,2,32,1,2,2,2;ConvOclDirectFwd1x1:1,128,1,1,0,1,8,4,0
384-35-35-1x1-192-35-35-256-0x0-1x1-1x1-0-NCHW-FP32-F=ConvAsm1x1U:2,16,2,64,3,2,1,4;ConvOclDirectFwd1x1:1,64,1,1,1,1,32,2048,0;ConvActivAsm1x1U:4,16,4,64,3,2
160-14-14-1x1-512-14-14-1-0x0-1x1-1x1-0-NCHW-FP16-W=ConvAsmBwdWrW1x1:2,8,2,2,2,1,1,4,0,1
512-14-14-1x1-128-14-14-16-0x0-1x1-1x1-0-NCHW-FP16-B=ConvAsm1x1U:1,8,2,64,1,4,4,2;ConvOclDirectFwd1x1:1,256,1,1,0,4,4,4,0
128-56-56-3x3-256-56-56-512-1x1-1x1-1x1-0-NCHW-FP16-F=ConvOclDirectFwd:32,8,32,32,1,4,8,1,2
480-14-14-1x1-120-14-14-4-0x0-1x1-1x1-0-NCHW-FP16-F_g3=ConvOclDirectFwd:8,8,8,8,1,1,4,2,2
128-28-28-1x1-256-28-28-64-0x0-1x1-1x1-0-NCHW-FP16-B=ConvAsm1x1U:1,16,2,16,1,2,1,4;ConvOclDirectFwd1x1:1,64,1,1,0,4,16,4,0
992-7-7-1x1-128-7-7-16-0x0-1x1-1x1-0-NCHW-FP16-F=ConvAsm1x1U:1,8,2,16,1,4,4,1;ConvOclDirectFwd1x1:1,256,1,1,0,1,4,8,0
48-35-35-1x1-288-35-35-512-0x0-1x1-1x1-0-NCHW-FP16-W=ConvAsmBwdWrW1x1:4,4,8,4,2,1,4,2,0,1
128-7-7-1x1-800-7-7-64-0x0-1x1-1x1-0-NCHW-FP16-B=ConvAsm1x1U:1,16,2,32,1,2,2,2;ConvOclDirectFwd1x1:1,128,1,1,0,1,8,4,0
1392-892-76-1x1-448-892-76-2-0x0-1x1-1x1-0-NCHW-FP32-F=ConvOclDirectFwd1x1:1,64,1,1,1,1,16,2048,0
1280-5-649-1x1-116-5-649-4-0x0-1x1-1x1-0-NCHW-FP32-W=ConvAsmBwdWrW1x1:1,16,2,8,4,1,1,4,0,2
3-1-1-3x3-4-2-2-32-0x0-2x2-1x1-0-NCHW-FP32-B=ConvOclDirectFwd:8,8,8,8,1,1,1,1,2
512-29-29-1x1-256-29-29-8-0x0-1x1-1x1-0-NCHW-FP32-B=ConvAsm1x1U:4,16,7,64,1,2,1,4;ConvOclDirectFwd1x1:1,64,1,1,0,1,32,4,0
120-7-7-3x3-120-14-14-64-1x1-2x2-1x1-0-NCHW-FP16-W=ConvAsmBwdWrW3x3:0,0,8,2,9,4
128-28-28-1x1-320-28-28-64-0x0-1x1-1x1-0-NCHW-FP16-B=ConvAsm1x1U:1,16,2,16,1,2,1,4;ConvOclDirectFwd1x1:1,64,1,1,0,4,16,4,0
60-14-14-3x3-60-28-28-256-1x1-2x2-1x1-0-NCHW-FP16-B=ConvOclDirectFwd:16,32,32,32,2,1,4,4,2
128-112-112-3x3-128-112-112-32-1x1-1x1-1x1-0-NCHW-FP16-W=ConvAsmBwdWrW3x3:0,0,16,4,1,4
16-28-28-5x5-32-28-28-1-2x2-1x1-1x1-0-NCHW-FP32-F=ConvOclDirectFwd:16,16,16,16,1,1,2,4,1;ConvOclDirectFwdFused:16,16,16,16,1,1,1,2,1
448-8-8-1x1-1280-8-8-512-0x0-1x1-1x1-0-NCHW-FP16-W=ConvAsmBwdWrW1x1:1,16,2,8,2,1,1,4,0,1
256-28-28-1x1-128-28-28-128-0x0-1x1-1x1-0-NCHW-FP32-B=ConvAsm1x1U:2,16,2,32,1,2,2,2;ConvOclDirectFwd1x1:1,128,1,1,0,1,32,4,0
128-7-7-1x1-768-7-7-512-0x0-1x1-1x1-0-NCHW-FP16-W=ConvAsmBwdWrW1x1:2,8,2,8,2,1,2,4,0,1
512-7-7-1x1-128-7-7-256-0x0-1x1-1x1-0-NCHW-FP32-B=ConvAsm1x1U:1,16,1,64,2,2,2,2;ConvOclDirectFwd1x1:1,64,1,1,0,1,16,4,0
128-112-112-3x3-64-112-112-256-1x1-1x1-1x1-0-NCHW-FP32-W=ConvAsmBwdWrW3x3:0,0,16,4,2,1
480-172-394-1x1-960-172-394-1-0x0-1x1-1x1-0-NCHW-FP32-F=ConvOclDirectFwd1x1:1,64,1,1,1,4,16,2048,0
720-386-59-1x1-1000-386-59-16-0x0-1x1-1x1-0-NCHW-FP32-F=ConvOclDirectFwd1x1:1,256,1,1,0,1,16,4,0
832-7-7-1x1-192-7-7-1-0x0-1x1-1x1-0-NCHW-FP16-F=ConvAsm1x1U:1,8,2,16,1,4,4,1;ConvOclDirectFwd1x1:1,256,1,1,0,1,4,8,0
704-198-301-1x1-1312-198-301-1-0x0-1x1-1x1-0-NCHW-FP32-B=ConvOclDirectFwd1x1:1,128,1,1,0,2,32,4,0
256-14-14-3x3-128-14-14-512-1x1-1x1-1x1-0-NCHW-FP32-W=ConvAsmBwdWrW3x3:0,1,8,4,4,1
256-56-56-1x1-64-56-56-1-0x0-1x1-1x1-0-NCHW-FP16-F=ConvAsm1x1U:1,8,2,64,1,4,4,1;ConvOclDirectFwd1x1:1,64,1,1,0,2,4,4,0
320-24-202-1x1-128-24-202-48-0x0-1x1-1x1-0-NCHW-FP32-F=ConvAsm1x1U:1,32,5,64,1,1,1,1;ConvOclDirectFwd1x1:1,64,1,1,1,0,16,2048,0
256-14-14-3x3-128-14-14-128-1x1-1x1-1x1-0-NCHW-FP32-W=ConvAsmBwdWrW3x3:0,0,8,4,4,1
96-28-28-1x1-192-28-28-4-0x0-1x1-1x1-0-NCHW-FP32-W=ConvAsmBwdWrW1x1:2,8,2,8,2,1,4,4,0,1
160-39-275-1x1-1504-39-275-1-0x0-1x1-1x1-0-NCHW-FP32-W=ConvAsmBwdWrW1x1:2,8,4,4,8,1,1,4,0,1
96-35-35-1x1-384-35-35-32-0x0-1x1-1x1-0-NCHW-FP32-B=ConvAsm1x1U:1,16,1,64,2,2,2,2;ConvOclDirectFwd1x1:1,256,1,1,0,1,32,4,0
192-28-28-1x1-432-28-28-16-0x0-1x1-1x1-0-NCHW-FP32-B=ConvAsm1x1U:1,16,1,32,2,2,1,2;ConvOclDirectFwd1x1:1,128,1,1,0,4,16,4,0
58-175-741-1x1-544-175-741-2-0x0-1x1-1x1-0-NCHW-FP32-B=ConvOclDirectFwd1x1:1,256,1,1,0,1,32,4,0
3-10-10-3x3-5-10-10-128-1x1-1x1-1x1-0-NCHW-FP32-F=ConvOclDirectFwd:8,16,16,16,2,1,2,1,2
58-56-56-1x1-24-56-56-8-0x0-1x1-1x1-0-NCHW-FP32-B=ConvAsm1x1U:1,8,1,64,1,2,1,2;ConvOclDirectFwd1x1:1,64,1,1,0,2,8,4,0
116-14-14-1x1-116-14-14-128-0x0-1x1-1x1-0-NCHW-FP32-F=ConvAsm1x1U:2,16,2,64,2,2,1,4;ConvOclDirectFwd1x1:1,128,1,1,0,4,8,4,0
512-29-29-1x1-512-29-29-128-0x0-1x1-1x1-0-NCHW-FP32-F=ConvAsm1x1U:2,16,7,32,1,2,1,1;ConvOclDirectFwd1x1:1,64,1,1,1,4,16,2048,0
512-28-28-1x1-256-28-28-512-0x0-1x1-1x1-0-NCHW-FP16-F=ConvAsm1x1U:2,8,4,16,1,4,1,8;ConvOclDirectFwd1x1:1,256,1,1,0,4,16,4,0
192-7-7-1x1-832-7-7-1-0x0-1x1-1x1-0-NCHW-FP16-W=ConvAsmBwdWrW1x1:1,16,2,4,2,1,1,4,0,1
256-56-56-3x3-256-28-28-128-1x1-2x2-1x1-0-NCHW-FP32-F_g32=ConvOclDirectFwd:16,16,16,32,1,2,8,2,2
192-17-17-1x1-768-17-17-512-0x0-1x1-1x1-0-NCHW-FP16-W=ConvAsmBwdWrW1x1:4,4,8,4,2,1,1,4,0,1
192-14-14-1x1-1104-14-14-16-0x0-1x1-1x1-0-NCHW-FP32-W=ConvAsmBwdWrW1x1:2,8,4,8,4,1,1,4,0,1
128-4-4-1x1-576-4-4-64-0x0-1x1-1x1-0-NCHW-FP32-B=ConvAsm1x1U:1,8,1,16,1,4,1,4;ConvOclDirectFwd1x1:1,64,1,1,0,1,8,4,0
192-14-14-1x1-1296-14-14-16-0x0-1x1-1x1-0-NCHW-FP16-W=ConvAsmBwdWrW1x1:1,16,4,8,2,1,2,4,0,1
58-56-56-1x1-24-56-56-2-0x0-1x1-1x1-0-NCHW-FP32-B=ConvAsm1x1U:1,8,1,16,1,1,1,1;ConvOclDirectFwd1x1:1,128,1,1,0,1,16,4,0
256-19-87-5x5-128-40-175-2-1x1-2x2-1x1-0-NCHW-FP32-B=ConvOclDirectFwd:16,8,16,32,1,4,4,1,2
192-56-56-3x3-64-56-56-16-1x1-1x1-1x1-0-NCHW-FP16-W=ConvAsmBwdWrW3x3:0,1,8,2,1,8
128-14-14-1x1-896-14-14-64-0x0-1x1-1x1-0-NCHW-FP16-F=ConvAsm1x1U:1,8,2,16,2,4,1,8;ConvOclDirectFwd1x1:1,128,1,1,0,4,8,4,0
512-29-29-1x1-1024-15-15-16-0x0-2x2-1x1-0-NCHW-FP32-F=ConvAsm1x1U:2,16,2,64,3,2,1,2;ConvOclDirectFwd1x1:1,64,1,1,1,1,32,2048,0
64-14-14-1x1-512-14-14-128-0x0-1x1-1x1-0-NCHW-FP16-W=ConvAsmBwdWrW1x1:4,4,4,1,8,2,1,4,0,1
54-165-38-1x1-800-165-38-1-0x0-1x1-1x1-0-NCHW-FP32-B=ConvOclDirectFwd1x1:1,256,1,1,0,2,16,4,0
48-14-14-5x5-16-14-14-512-2x2-1x1-1x1-0-NCHW-FP32-B=ConvOclDirectFwd:8,8,16,16,2,2,4,1,2
528-876-96-1x1-704-876-96-8-0x0-1x1-1x1-0-NCHW-FP32-B=ConvOclDirectFwd1x1:1,256,1,1,0,1,32,4,0
32-38-166-5x10-32-79-341-128-0x0-2x2-1x1-0-NCHW-FP32-W=ConvOclBwdWrW2<1>:3,10,3,3,5;ConvOclBwdWrW2<2>:8,7,1,3,5;ConvOclBwdWrW2<4>:8,7,1,3,5;ConvOclBwdWrW2<16>:8,7,1,3,5;ConvOclBwdWrW2<8>:8,7,1,3,5
128-7-7-1x1-864-7-7-256-0x0-1x1-1x1-0-NCHW-FP16-F=ConvAsm1x1U:2,8,4,16,1,4,1,4;ConvOclDirectFwd1x1:8,64,8,8,0,1,16,4,1
512-28-28-3x3-512-28-28-1-1x1-1x1-1x1-0-NCHW-FP16-F=ConvOclDirectFwd:16,16,32,32,2,2,2,2,1;ConvOclDirectFwdFused:16,16,32,32,2,2,2,4,1
240-7-7-1x1-960-7-7-16-0x0-1x1-1x1-0-NCHW-FP16-F_g3=ConvOclDirectFwd:8,8,8,8,1,1,8,4,2
512-128-128-1x1-256-256-256-4-0x0-2x2-1x1-0-NCHW-FP32-W=ConvAsmBwdWrW1x1:4,4,8,4,4,1,1,4,0,1
336-54-392-1x1-352-54-392-6-0x0-1x1-1x1-0-NCHW-FP32-F=ConvOclDirectFwd1x1:1,64,1,1,1,4,64,2048,0
1024-14-14-1x1-512-28-28-2-0x0-2x2-1x1-0-NCHW-FP16-W=ConvAsmBwdWrW1x1:1,16,4,8,2,1,1,2,0,1
128-56-56-1x1-160-56-56-512-0x0-1x1-1x1-0-NCHW-FP32-F=ConvAsm1x1U:3,16,3,64,2,2,1,2;ConvOclDirectFwd1x1:1,64,1,1,1,4,16,128,0
128-7-7-1x1-736-7-7-256-0x0-1x1-1x1-0-NCHW-FP16-F=ConvAsm1x1U:2,8,4,16,1,4,1,2;ConvOclDirectFwd1x1:1,128,1,1,0,1,16,4,0
256-13-13-3x3-256-13-13-16-1x1-1x1-1x1-0-NCHW-FP16-F=ConvOclDirectFwd:16,8,16,16,1,2,8,4,2
800-7-7-1x1-128-7-7-64-0x0-1x1-1x1-0-NCHW-FP32-W=ConvAsmBwdWrW1x1:2,8,4,8,2,1,2,4,0,1
192-7-7-1x1-1920-7-7-16-0x0-1x1-1x1-0-NCHW-FP32-W=ConvAsmBwdWrW1x1:1,16,2,8,4,1,2,4,0,2
8-179-629-1x1-224-179-629-1-0x0-1x1-1x1-0-NCHW-FP32-B=ConvOclDirectFwd1x1:1,256,1,1,0,1,32,4,0
232-845-160-1x1-64-845-160-16-0x0-1x1-1x1-0-NCHW-FP32-F=ConvOclDirectFwd1x1:1,64,1,1,0,1,32,4,0
128-28-28-3x3-128-28-28-512-1x1-1x1-1x1-0-NCHW-FP16-B=ConvOclDirectFwd:32,8,32,32,1,4,8,2,1
1056-317-564-1x1-144-317-564-1-0x0-1x1-1x1-0-NCHW-FP32-F=ConvOclDirectFwd1x1:1,64,1,1,1,0,64,2048,0
80-73-73-1x1-64-73-73-4-0x0-1x1-1x1-0-NCHW-FP16-B=ConvAsm1x1U:1,8,2,64,1,4,2,2;ConvOclDirectFwd1x1:1,64,1,1,0,1,8,4,0
48-35-35-1x1-288-35-35-32-0x0-1x1-1x1-0-NCHW-FP32-W=ConvAsmBwdWrW1x1:4,4,4,2,8,1,4,4,0,1
864-7-7-1x1-128-7-7-64-0x0-1x1-1x1-0-NCHW-FP32-B=ConvAsm1x1U:4,8,4,16,1,4,2,4;ConvOclDirectFwd1x1:1,64,1,1,0,1,8,4,0
2048-7-7-1x1-1024-14-14-1-0x0-2x2-1x1-0-NCHW-FP32-W=ConvAsmBwdWrW1x1:1,16,2,2,8,1,1,4,0,1
736-202-421-1x1-1392-202-421-1-0x0-1x1-1x1-0-NCHW-FP32-B=ConvOclDirectFwd1x1:1,256,1,1,0,2,16,8,0
320-8-8-1x1-2048-8-8-128-0x0-1x1-1x1-0-NCHW-FP32-W=ConvAsmBwdWrW1x1:2,8,4,8,4,1,2,4,0,2
128-14-14-1x1-256-14-14-16-0x0-1x1-1x1-0-NCHW-FP16-W=ConvAsmBwdWrW1x1:4,4,4,1,4,2,1,4,0,2
96-28-28-1x1-192-28-28-1-0x0-1x1-1x1-0-NCHW-FP16-W=ConvAsmBwdWrW1x1:4,4,2,2,2,1,1,4,0,1
192-28-28-1x1-288-28-28-16-0x0-1x1-1x1-0-NCHW-FP16-W=ConvAsmBwdWrW1x1:4,4,4,4,4,1,2,2,0,1
832-7-7-1x1-48-7-7-256-0x0-1x1-1x1-0-NCHW-FP16-F=ConvAsm1x1U:2,8,4,16,1,4,4,1;ConvOclDirectFwd1x1:8,64,8,8,0,1,16,4,1
1-7-7-3x3-1-5-5-16-0x0-1x1-1x1-0-NCHW-FP32-F=ConvOclDirectFwd:8,8,8,8,1,1,1,1,2
4-293-66-1x1-864-293-66-2-0x0-1x1-1x1-0-NCHW-FP32-W=ConvAsmBwdWrW1x1:4,4,2,1,4,1,2,4,0,1
288-28-28-1x1-128-28-28-256-0x0-1x1-1x1-0-NCHW-FP32-B=ConvAsm1x1U:1,32,1,16,1,1,1,4;ConvOclDirectFwd1x1:1,64,1,1,0,1,32,4,0
256-28-28-3x3-256-56-56-4-1x1-2x2-1x1-0-NCHW-FP32-B_g32=ConvOclDirectFwd:16,16,32,32,2,2,8,2,1
240-7-7-3x3-240-7-7-16-1x1-1x1-1x1-0-NCHW-FP16-F=ConvOclDirectFwd:8,8,8,8,1,1,4,4,2
2-150-157-1x1-1088-150-157-2-0x0-1x1-1x1-0-NCHW-FP32-B=ConvOclDirectFwd1x1:1,256,1,1,0,1,4,4,0
1-10-417-1x1-352-10-417-2-0x0-1x1-1x1-0-NCHW-FP32-W=ConvAsmBwdWrW1x1:4,4,2,1,2,1,2,4,0,3
128-56-56-3x3-128-28-28-4-1x1-2x2-1x1-0-NCHW-FP32-F=ConvOclDirectFwd:16,16,16,16,1,1,8,2,2
576-14-14-1x1-192-14-14-16-0x0-1x1-1x1-0-NCHW-FP32-F=ConvAsm1x1U:3,16,3,16,1,2,2,1;ConvOclDirectFwd1x1:1,64,1,1,1,4,16,128,0;ConvActivAsm1x1U:3,16,3,16,1,2
64-28-28-1x1-256-28-28-128-0x0-1x1-1x1-0-NCHW-FP32-B=ConvAsm1x1U:1,16,1,32,1,2,1,2;ConvOclDirectFwd1x1:1,128,1,1,0,2,32,4,0
256-14-14-3x3-128-14-14-128-1x1-1x1-1x1-0-NCHW-FP16-W=ConvAsmBwdWrW3x3:0,0,8,2,6,4
512-29-29-1x1-512-29-29-48-0x0-1x1-1x1-0-NCHW-FP32-F=ConvAsm1x1U:3,16,7,32,1,2,1,1;ConvOclDirectFwd1x1:1,64,1,1,1,0,32,2048,0
704-197-3-1x1-144-197-3-32-0x0-1x1-1x1-0-NCHW-FP32-F=ConvAsm1x1U:3,16,6,16,2,2,1,1;ConvOclDirectFwd1x1:1,64,1,1,1,1,64,2048,0
116-169-19-1x1-704-169-19-128-0x0-1x1-1x1-0-NCHW-FP32-W=ConvAsmBwdWrW1x1:1,16,2,8,2,1,1,4,0,1
480-28-28-1x1-128-28-28-16-0x0-1x1-1x1-0-NCHW-FP32-B=ConvAsm1x1U:1,16,1,16,1,2,2,1;ConvOclDirectFwd1x1:16,64,32,32,0,2,16,4,1
128-4-4-1x1-576-4-4-64-0x0-1x1-1x1-0-NCHW-FP16-B=ConvAsm1x1U:2,4,4,4,1,2,2,4;ConvOclDirectFwd1x1:1,64,1,1,0,2,8,4,0
16-54-54-3x3-64-54-54-64-1x1-1x1-1x1-0-NCHW-FP16-F=ConvOclDirectFwd:32,8,32,32,1,4,8,1,2
128-28-28-1x1-128-28-28-64-0x0-1x1-1x1-0-NCHW-FP16-W=ConvAsmBwdWrW1x1:2,8,4,1,8,1,4,4,0,1
112-114-463-1x1-64-114-463-12-0x0-1x1-1x1-0-NCHW-FP32-W=ConvAsmBwdWrW1x1:4,4,2,2,2,1,1,4,0,1
896-14-14-1x1-128-14-14-16-0x0-1x1-1x1-0-NCHW-FP16-W=ConvAsmBwdWrW1x1:2,8,2,8,2,1,2,4,0,0
32-14-14-3x3-128-14-14-32-1x1-1x1-1x1-0-NCHW-FP16-W=ConvAsmBwdWrW3x3:0,0,8,2,3,4
512-28-28-1x1-256-14-14-512-0x0-2x2-1x1-0-NCHW-FP16-F=ConvAsm1x1U:2,8,4,64,1,4,1,4;ConvOclDirectFwd1x1:1,256,1,1,0,2,32,4,0
96-56-56-1x1-128-56-56-512-0x0-1x1-1x1-0-NCHW-FP16-W=ConvAsmBwdWrW1x1:4,4,8,2,4,2,4,4,0,1
256-80-128-3x3-256-80-128-128-1x1-1x1-1x1-0-NCHW-FP16-F=ConvOclDirectFwd:16,8,16,32,1,4,8,1,2
256-56-56-3x3-256-56-56-32-1x1-1x1-1x1-0-NCHW-FP16-F=ConvOclDirectFwd:32,8,32,32,1,4,8,1,2;ConvOclDirectFwdFused:32,8,32,32,1,4,8,1,1
128-14-14-1x1-704-14-14-128-0x0-1x1-1x1-0-NCHW-FP16-B=ConvAsm1x1U:1,16,2,16,1,2,1,4;ConvOclDirectFwd1x1:1,256,1,1,0,2,16,4,0
432-30-270-1x1-288-30-270-6-0x0-1x1-1x1-0-NCHW-FP32-F=ConvAsm1x1U:1,32,7,32,1,1,1,1;ConvOclDirectFwd1x1:1,64,1,1,1,4,64,2048,0
672-44-676-1x1-240-44-676-6-0x0-1x1-1x1-0-NCHW-FP32-B=ConvOclDirectFwd1x1:1,256,1,1,0,4,16,8,0
96-71-71-3x3-64-73-73-32-0x0-1x1-1x1-0-NCHW-FP32-B=ConvOclDirectFwd:8,8,16,16,2,2,8,1,1
48-919-189-1x1-64-919-189-12-0x0-1x1-1x1-0-NCHW-FP32-W=ConvAsmBwdWrW1x1:4,4,2,4,2,1,4,4,0,1
832-7-7-1x1-384-7-7-64-0x0-1x1-1x1-0-NCHW-FP16-F=ConvAsm1x1U:2,16,4,16,1,2,2,1;ConvOclDirectFwd1x1:1,64,1,1,0,1,8,8,0
1536-8-8-1x1-384-8-8-128-0x0-1x1-1x1-0-NCHW-FP32-F=ConvAsm1x1U:4,8,4,16,2,4,1,4;ConvOclDirectFwd1x1:1,64,1,1,1,4,32,2048,0;ConvActivAsm1x1U:2,16,2,32,4,2
192-7-7-1x1-1056-7-7-64-0x0-1x1-1x1-0-NCHW-FP16-W=ConvAsmBwdWrW1x1:1,16,4,8,2,1,2,2,0,2
48-28-28-3x3-192-28-28-16-1x1-1x1-1x1-0-NCHW-FP16-B=ConvOclDirectFwd:16,16,32,32,2,2,8,1,2
128-14-14-1x1-640-14-14-128-0x0-1x1-1x1-0-NCHW-FP16-W=ConvAsmBwdWrW1x1:2,8,2,8,2,1,4,4,0,1
128-7-7-1x1-640-7-7-512-0x0-1x1-1x1-0-NCHW-FP32-F=ConvAsm1x1U:1,8,1,64,4,4,1,4;ConvOclDirectFwd1x1:1,64,1,1,1,0,32,256,0
928-113-178-1x1-1584-113-178-2-0x0-1x1-1x1-0-NCHW-FP32-B=ConvOclDirectFwd1x1:16,64,32,32,0,2,16,4,1
120-14-14-1x1-480-14-14-512-0x0-1x1-1x1-0-NCHW-FP32-F_g3=ConvOclDirectFwd:16,16,16,16,1,1,8,4,2
2-824-871-1x1-48-824-871-12-0x0-1x1-1x1-0-NCHW-FP32-B=ConvOclDirectFwd1x1:1,256,1,1,0,4,16,4,0
128-14-14-1x1-528-14-14-128-0x0-1x1-1x1-0-NCHW-FP32-B=ConvAsm1x1U:1,16,1,64,3,2,1,1;ConvOclDirectFwd1x1:1,256,1,1,0,4,16,4,0
256-28-28-1x1-128-28-28-16-0x0-1x1-1x1-0-NCHW-FP32-W=ConvAsmBwdWrW1x1:1,16,2,8,2,1,4,4,0,1
256-57-57-1x1-64-57-57-64-0x0-1x1-1x1-0-NCHW-FP32-W=ConvAsmBwdWrW1x1:4,4,4,4,2,1,1,4,0,1
128-57-57-1x1-64-57-57-4-0x0-1x1-1x1-0-NCHW-FP32-W=ConvAsmBwdWrW1x1:4,4,2,4,2,1,1,4,0,2
576-4-4-1x1-128-4-4-64-0x0-1x1-1x1-0-NCHW-FP32-F=ConvAsm1x1U:1,8,1,16,1,4,2,2;ConvOclDirectFwd1x1:1,64,1,1,1,1,16,128,0;ConvActivAsm1x1U:1,16,1,16,1,4
32-14-14-5x5-128-14-14-4-2x2-1x1-1x1-0-NCHW-FP16-F=ConvOclDirectFwd:16,16,16,16,1,1,4,4,2;ConvOclDirectFwdFused:8,16,16,16,2,1,2,2,2
64-14-14-5x5-32-14-14-4-2x2-1x1-1x1-0-NCHW-FP16-B=ConvOclDirectFwd:16,16,16,16,1,1,1,4,2
928-80-918-1x1-80-80-918-4-0x0-1x1-1x1-0-NCHW-FP32-F=ConvOclDirectFwd1x1:1,64,1,1,1,0,32,2048,0
512-7-7-1x1-256-14-14-256-0x0-2x2-1x1-0-NCHW-FP32-W=ConvAsmBwdWrW1x1:1,16,2,4,8,1,2,4,0,2
256-20-84-5x5-512-9-41-256-1x1-2x2-1x1-0-NCHW-FP32-F=ConvOclDirectFwd:16,8,16,16,1,2,8,1,2
224-293-428-1x1-736-293-428-4-0x0-1x1-1x1-0-NCHW-FP32-B=ConvOclDirectFwd1x1:1,64,1,1,0,1,32,4,0
128-14-14-1x1-896-14-14-128-0x0-1x1-1x1-0-NCHW-FP32-F=ConvAsm1x1U:2,16,4,32,1,2,1,4;ConvOclDirectFwd1x1:1,64,1,1,1,1,32,256,0
288-498-38-1x1-8-498-38-32-0x0-1x1-1x1-0-NCHW-FP32-W=ConvAsmBwdWrW1x1:4,4,2,1,2,1,1,2,0,1
1872-7-7-1x1-192-7-7-16-0x0-1x1-1x1-0-NCHW-FP16-F=ConvAsm1x1U:1,8,2,32,1,4,4,1;ConvOclDirectFwd1x1:1,64,1,1,0,1,4,8,0
144-14-14-1x1-512-14-14-512-0x0-1x1-1x1-0-NCHW-FP16-B=ConvAsm1x1U:1,16,2,16,1,2,1,8;ConvOclDirectFwd1x1:8,64,16,16,0,2,16,4,1
160-7-7-1x1-832-7-7-256-0x0-1x1-1x1-0-NCHW-FP16-B=ConvAsm1x1U:1,16,2,32,1,2,1,2;ConvOclDirectFwd1x1:1,256,1,1,0,1,32,4,0
128-56-56-1x1-224-56-56-128-0x0-1x1-1x1-0-NCHW-FP16-W=ConvAsmBwdWrW1x1:2,8,4,8,2,1,4,4,0,1
64-56-56-3x3-64-56-56-2-1x1-1x1-1x1-0-NCHW-FP16-W=ConvAsmBwdWrW3x3:0,0,16,1,2,1
128-7-7-1x1-864-7-7-64-0x0-1x1-1x1-0-NCHW-FP32-W=ConvAsmBwdWrW1x1:1,16,2,8,4,1,2,4,0,2
256-29-29-3x3-256-29-29-16-1x1-1x1-1x1-0-NCHW-FP32-W_g32=ConvOclBwdWrW2<4>:1,7,8,1,11;ConvOclBwdWrW2<16>:1,6,3,1,11;ConvOclBwdWrW2<8>:1,6,3,1,11;ConvOclBwdWrW2<1>:1,7,8,1,11;ConvOclBwdWrW2<2>:1,6,3,1,11;ConvAsmBwdWrW3x3:0,1,8,1,8,1
160-14-14-1x1-528-14-14-16-0x0-1x1-1x1-0-NCHW-FP16-B=ConvAsm1x1U:1,16,2,16,1,2,2,2;ConvOclDirectFwd1x1:1,64,1,1,0,4,8,4,0
464-321-572-1x1-896-321-572-2-0x0-1x1-1x1-0-NCHW-FP32-F=ConvOclDirectFwd1x1:1,64,1,1,1,4,32,2048,0
128-14-14-1x1-672-14-14-64-0x0-1x1-1x1-0-NCHW-FP32-F=ConvAsm1x1U:1,16,1,32,4,2,2,2;ConvOclDirectFwd1x1:1,64,1,1,1,1,16,256,0
48-7-7-3x3-192-7-7-16-1x1-1x1-1x1-0-NCHW-FP32-W=ConvAsmBwdWrW3x3:0,1,8,2,6,2
192-14-14-1x1-720-14-14-16-0x0-1x1-1x1-0-NCHW-FP32-W=ConvAsmBwdWrW1x1:1,16,2,8,4,1,2,4,0,1
128-28-28-1x1-512-28-28-8-0x0-1x1-1x1-0-NCHW-FP32-F=ConvAsm1x1U:2,16,2,16,2,2,2,2;ConvOclDirectFwd1x1:1,64,1,1,1,0,32,256,0;ConvActivAsm1x1U:1,16,1,32,4,2
512-28-28-1x1-256-28-28-16-0x0-1x1-1x1-0-NCHW-FP16-B=ConvAsm1x1U:1,16,2,32,1,2,4,1;ConvOclDirectFwd1x1:1,64,1,1,0,4,16,4,0
64-35-35-1x1-384-35-35-256-0x0-1x1-1x1-0-NCHW-FP32-W=ConvAsmBwdWrW1x1:2,8,4,2,8,1,4,4,0,1
512-9-41-5x5-256-20-84-4-1x1-2x2-1x1-0-NCHW-FP32-W=ConvOclBwdWrW2<1>:1,12,3,3,5;ConvOclBwdWrW2<2>:1,6,3,3,5;ConvOclBwdWrW2<4>:3,10,3,3,9
1024-15-15-1x1-512-15-15-256-0x0-1x1-1x1-0-NCHW-FP32-W=ConvAsmBwdWrW1x1:1,16,4,4,8,1,1,4,0,1
128-14-14-1x1-992-14-14-32-0x0-1x1-1x1-0-NCHW-FP16-F=ConvAsm1x1U:1,16,2,16,2,2,1,4;ConvOclDirectFwd1x1:1,128,1,1,0,4,8,4,0
224-28-28-1x1-128-28-28-16-0x0-1x1-1x1-0-NCHW-FP32-B=ConvAsm1x1U:1,16,1,16,1,2,2,2;ConvOclDirectFwd1x1:1,64,1,1,0,2,16,4,0
128-14-14-1x1-256-14-14-128-0x0-1x1-1x1-0-NCHW-FP32-W=ConvAsmBwdWrW1x1:2,8,4,8,2,1,4,4,0,1
352-12-292-1x1-64-12-292-8-0x0-1x1-1x1-0-NCHW-FP32-F=ConvAsm1x1U:3,16,3,64,3,1,1,2;ConvOclDirectFwd1x1:1,64,1,1,1,4,16,2048,0
832-7-7-1x1-192-7-7-8-0x0-1x1-1x1-0-NCHW-FP32-F=ConvAsm1x1U:2,8,2,32,1,4,4,1;ConvOclDirectFwd1x1:1,64,1,1,1,1,16,128,0;ConvActivAsm1x1U:2,16,2,16,1,4
1184-13-645-1x1-528-13-645-32-0x0-1x1-1x1-0-NCHW-FP32-F=ConvOclDirectFwd1x1:1,64,1,1,1,0,64,2048,0
192-7-7-1x1-1152-7-7-16-0x0-1x1-1x1-0-NCHW-FP32-B=ConvAsm1x1U:2,16,2,32,1,2,2,2;ConvOclDirectFwd1x1:8,64,8,8,0,1,16,4,1
128-28-28-1x1-256-28-28-1-0x0-1x1-1x1-0-NCHW-FP32-W=ConvAsmBwdWrW1x1:4,4,4,2,2,1,1,4,0,0
256-56-56-1x1-256-56-56-64-0x0-1x1-1x1-0-NCHW-FP32-B=ConvAsm1x1U:4,32,5,32,1,1,1,1;ConvOclDirectFwd1x1:1,256,1,1,0,2,32,4,0
256-14-14-1x1-256-14-14-128-0x0-1x1-1x1-0-NCHW-FP32-F=ConvAsm1x1U:4,16,4,64,1,2,2,2;ConvOclDirectFwd1x1:1,64,1,1,1,0,16,256,0
256-28-28-3x3-256-28-28-4-1x1-1x1-1x1-0-NCHW-FP32-W_g32=ConvOclBwdWrW2<1>:1,6,3,1,7;ConvAsmBwdWrW3x3:0,1,8,1,4,1;ConvOclBwdWrW2<4>:1,6,3,1,7;ConvOclBwdWrW2<2>:1,6,3,1,7
32-28-28-5x5-192-28-28-16-2x2-1x1-1x1-0-NCHW-FP32-W=ConvOclBwdWrW2<1>:1,11,3,3,7;ConvOclBwdWrW2<2>:1,6,1,3,7;ConvOclBwdWrW2<4>:1,6,1,3,7;ConvOclBwdWrW2<16>:1,10,3,3,5;ConvOclBwdWrW2<8>:1,10,1,3,7
64-13-13-1x1-512-13-13-32-0x0-1x1-1x1-0-NCHW-FP32-B=ConvAsm1x1U:1,16,1,64,2,2,2,2;ConvOclDirectFwd1x1:1,128,1,1,0,1,16,8,0
256-28-28-3x3-256-14-14-1-1x1-2x2-1x1-0-NCHW-FP32-F=ConvOclDirectFwd:16,16,16,16,1,1,2,4,1
384-13-13-3x3-192-13-13-2048-1x1-1x1-1x1-0-NCHW-FP16-W=ConvAsmBwdWrW3x3:0,1,8,4,4,1
112-14-14-1x1-512-14-14-32-0x0-1x1-1x1-0-NCHW-FP16-B=ConvAsm1x1U:1,16,2,16,1,2,2,2;ConvOclDirectFwd1x1:1,64,1,1,0,4,8,4,0
512-7-7-1x1-2048-7-7-32-0x0-1x1-1x1-0-NCHW-FP16-W=ConvAsmBwdWrW1x1:1,16,4,4,4,1,1,2,0,2
128-415-908-1x1-256-415-908-2-0x0-1x1-1x1-0-NCHW-FP32-B=ConvOclDirectFwd1x1:1,256,1,1,0,2,32,4,0
1392-10-642-1x1-1056-10-642-6-0x0-1x1-1x1-0-NCHW-FP32-F=ConvOclDirectFwd1x1:1,64,1,1,1,1,64,2048,0
192-14-14-1x1-512-14-14-1-0x0-1x1-1x1-0-NCHW-FP16-W=ConvAsmBwdWrW1x1:2,8,2,4,2,1,1,2,0,1
128-56-56-1x1-256-56-56-2-0x0-1x1-1x1-0-NCHW-FP32-F=ConvAsm1x1U:1,8,1,64,1,4,1,4;ConvOclDirectFwd1x1:1,64,1,1,1,4,64,2048,0
128-14-14-1x1-320-14-14-32-0x0-1x1-1x1-0-NCHW-FP16-F=ConvAsm1x1U:1,8,2,16,1,4,1,4;ConvOclDirectFwd1x1:1,256,1,1,0,4,8,4,0
120-7-7-3x3-120-14-14-2-1x1-2x2-1x1-0-NCHW-FP16-B=ConvOclDirectFwd:8,16,16,16,2,1,1,2,2
384-7-7-1x1-832-7-7-16-0x0-1x1-1x1-0-NCHW-FP16-B=ConvAsm1x1U:1,8,2,32,1,4,2,2;ConvOclDirectFwd1x1:1,64,1,1,0,1,8,4,0
1024-7-7-1x1-2048-7-7-4-0x0-1x1-1x1-0-NCHW-FP32-B=ConvAsm1x1U:1,8,1,64,2,4,2,2;ConvOclDirectFwd1x1:1,128,1,1,0,1,8,4,0
64-112-112-3x3-128-112-112-64-1x1-1x1-1x1-0-NCHW-FP16-W=ConvAsmBwdWrW3x3:0,1,16,2,1,4
128-14-14-1x1-608-14-14-64-0x0-1x1-1x1-0-NCHW-FP16-W=ConvAsmBwdWrW1x1:4,4,4,4,2,1,1,4,0,0
128-28-28-1x1-160-28-28-256-0x0-1x1-1x1-0-NCHW-FP16-F=ConvAsm1x1U:1,8,2,32,1,4,1,4;ConvOclDirectFwd1x1:1,128,1,1,0,4,16,4,0
256-28-28-3x3-512-28-28-128-1x1-1x1-1x1-0-NCHW-FP16-B=ConvOclDirectFwd:8,16,32,32,4,2,8,1,1
256-19-87-5x5-128-40-175-256-1x1-2x2-1x1-0-NCHW-FP32-W=ConvOclBwdWrW2<1>:3,10,3,3,5;ConvOclBwdWrW2<2>:3,10,1,8,5;ConvOclBwdWrW2<4>:3,9,3,3,7;ConvOclBwdWrW2<16>:3,10,1,8,5;ConvOclBwdWrW2<8>:3,12,1,8,5
64-28-28-1x1-192-28-28-256-0x0-1x1-1x1-0-NCHW-FP32-W=ConvAsmBwdWrW1x1:4,4,8,4,2,1,4,4,0,0
128-7-7-1x1-576-7-7-64-0x0-1x1-1x1-0-NCHW-FP32-W=ConvAsmBwdWrW1x1:1,16,2,8,2,1,2,4,0,2
128-28-28-1x1-256-28-28-32-0x0-1x1-1x1-0-NCHW-FP16-W=ConvAsmBwdWrW1x1:4,4,4,1,8,1,1,4,0,1
2048-718-26-1x1-32-718-26-2-0x0-1x1-1x1-0-NCHW-FP32-F=ConvOclDirectFwd1x1:1,64,1,1,1,4,64,2048,0
128-7-7-1x1-544-7-7-512-0x0-1x1-1x1-0-NCHW-FP16-F=ConvAsm1x1U:2,8,4,16,1,2,1,4;ConvOclDirectFwd1x1:8,64,8,8,0,1,16,4,1
480-7-7-1x1-120-7-7-1-0x0-1x1-1x1-0-NCHW-FP32-B_g3=ConvOclDirectFwd:8,8,8,8,1,1,1,4,1
16-54-54-1x1-96-54-54-64-0x0-1x1-1x1-0-NCHW-FP16-B=ConvAsm1x1U:1,8,2,64,1,2,1,4;ConvOclDirectFwd1x1:1,256,1,1,0,2,16,4,0
128-28-28-1x1-256-28-28-4-0x0-1x1-1x1-0-NCHW-FP16-B=ConvAsm1x1U:1,8,2,16,1,4,2,2;ConvOclDirectFwd1x1:1,64,1,1,0,4,16,4,0
1024-14-14-1x1-512-28-28-64-0x0-2x2-1x1-0-NCHW-FP32-W=ConvAsmBwdWrW1x1:1,16,4,4,8,1,1,4,0,1
352-28-28-1x1-128-28-28-128-0x0-1x1-1x1-0-NCHW-FP32-F=ConvAsm1x1U:4,16,5,16,1,2,1,2;ConvOclDirectFwd1x1:1,64,1,1,1,0,32,2048,0
112-14-14-3x3-224-14-14-32-1x1-1x1-1x1-0-NCHW-FP16-F=ConvOclDirectFwd:8,8,16,16,2,2,8,4,2;ConvOclDirectFwdFused:8,8,16,16,2,2,8,4,2
864-9-270-1x1-112-9-270-16-0x0-1x1-1x1-0-NCHW-FP32-F=ConvAsm1x1U:2,16,5,64,2,2,1,2;ConvOclDirectFwd1x1:1,64,1,1,1,4,64,2048,0
512-14-14-1x1-144-14-14-16-0x0-1x1-1x1-0-NCHW-FP32-F=ConvAsm1x1U:2,16,2,16,1,2,2,1;ConvOclDirectFwd1x1:1,64,1,1,1,4,32,128,0;ConvActivAsm1x1U:1,16,1,32,2,2
448-8-8-1x1-2048-8-8-8-0x0-1x1-1x1-0-NCHW-FP16-B=ConvAsm1x1U:1,16,2,32,1,2,2,4;ConvOclDirectFwd1x1:8,64,8,8,0,2,16,4,1
992-187-295-1x1-2-187-295-8-0x0-1x1-1x1-0-NCHW-FP32-F=ConvOclDirectFwd1x1:1,256,1,1,0,1,16,8,0
24-56-56-1x1-58-56-56-64-0x0-1x1-1x1-0-NCHW-FP32-F=ConvAsm1x1U:1,8,1,32,1,2,4,1;ConvOclDirectFwd1x1:1,256,1,1,0,4,16,8,0
64-114-114-7x7-3-227-227-128-3x3-2x2-1x1-0-NCHW-FP32-W=ConvOclBwdWrW2<1>:3,6,3,1,7;ConvOclBwdWrW2<2>:3,8,3,1,7;ConvOclBwdWrW2<4>:3,11,3,3,7;ConvOclBwdWrW2<16>:3,6,3,1,7;ConvOclBwdWrW2<8>:3,6,3,1,7
672-282-871-1x1-1536-282-871-1-0x0-1x1-1x1-0-NCHW-FP32-B=ConvOclDirectFwd1x1:1,256,1,1,0,2,32,4,0
128-14-14-5x5-32-14-14-32-2x2-1x1-1x1-0-NCHW-FP16-B=ConvOclDirectFwd:8,16,16,16,2,1,2,4,2
512-28-28-1x1-128-28-28-256-0x0-1x1-1x1-0-NCHW-FP32-F=ConvAsm1x1U:2,16,2,32,3,2,1,4;ConvOclDirectFwd1x1:1,64,1,1,1,4,32,2048,0;ConvActivAsm1x1U:4,16,5,32,2,1
192-71-71-3x3-192-35-35-64-0x0-2x2-1x1-0-NCHW-FP32-F=ConvOclDirectFwd:16,16,16,16,1,1,8,2,1
58-28-28-1x1-58-28-28-1024-0x0-1x1-1x1-0-NCHW-FP32-W=ConvAsmBwdWrW1x1:4,4,2,1,8,1,4,4,0,1
16-28-28-1x1-192-28-28-256-0x0-1x1-1x1-0-NCHW-FP16-W=ConvAsmBwdWrW1x1:4,4,2,1,8,1,4,4,0,2
128-14-14-1x1-640-14-14-32-0x0-1x1-1x1-0-NCHW-FP16-F=ConvAsm1x1U:1,8,2,32,2,4,1,8;ConvOclDirectFwd1x1:1,64,1,1,0,4,8,4,0
256-29-29-1x1-512-29-29-4-0x0-1x1-1x1-0-NCHW-FP32-W=ConvAsmBwdWrW1x1:1,16,2,4,4,1,1,4,0,2
128-56-56-3x3-128-56-56-48-1x1-1x1-1x1-0-NCHW-FP32-B_g32=ConvOclDirectFwd:8,32,16,32,2,1,8,4,1
128-112-112-3x3-128-112-112-8-1x1-1x1-1x1-0-NCHW-FP16-B=ConvOclDirectFwd:8,16,16,32,2,2,8,1,2
32-14-14-1x1-528-14-14-4-0x0-1x1-1x1-0-NCHW-FP16-W=ConvAsmBwdWrW1x1:4,4,2,1,8,2,2,4,0,0
1920-649-172-1x1-288-649-172-1-0x0-1x1-1x1-0-NCHW-FP32-F=ConvOclDirectFwd1x1:1,64,1,1,1,0,64,2048,0
576-1-389-1x1-736-1-389-32-0x0-1x1-1x1-0-NCHW-FP32-W=ConvAsmBwdWrW1x1:1,16,2,8,8,1,1,4,0,1
1024-8-8-1x1-2048-8-8-16-0x0-1x1-1x1-0-NCHW-FP32-B=ConvAsm1x1U:1,16,1,64,4,2,2,2;ConvOclDirectFwd1x1:1,128,1,1,0,4,16,4,0
512-10-42-3x3-512-10-42-4-1x1-1x1-1x1-0-NCHW-FP32-W=ConvAsmBwdWrW3x3:0,1,8,4,2,1
416-914-262-1x1-448-914-262-1-0x0-1x1-1x1-0-NCHW-FP32-B=ConvOclDirectFwd1x1:1,256,1,1,0,4,16,8,0
192-28-28-1x1-64-28-28-128-0x0-1x1-1x1-0-NCHW-FP32-F=ConvAsm1x1U:2,16,2,32,2,1,1,4;ConvOclDirectFwd1x1:1,64,1,1,1,0,16,2048,0;ConvActivAsm1x1U:2,32,2,32,1,1
896-78-5-1x1-1200-78-5-8-0x0-1x1-1x1-0-NCHW-FP32-W=ConvAsmBwdWrW1x1:2,8,4,4,8,1,1,4,0,1
384-27-27-1x1-48-27-27-256-0x0-1x1-1x1-0-NCHW-FP32-W=ConvAsmBwdWrW1x1:2,8,2,4,8,1,4,4,0,2
192-7-7-1x1-1392-7-7-16-0x0-1x1-1x1-0-NCHW-FP16-B=ConvAsm1x1U:1,8,2,32,1,2,2,2;ConvOclDirectFwd1x1:1,128,1,1,0,1,8,4,0
64-56-56-1x1-128-56-56-64-0x0-1x1-1x1-0-NCHW-FP32-F=ConvAsm1x1U:2,16,2,64,2,2,1,2;ConvOclDirectFwd1x1:1,64,1,1,1,1,32,128,0
528-14-14-1x1-256-14-14-64-0x0-1x1-1x1-0-NCHW-FP16-F=ConvAsm1x1U:2,8,4,64,1,4,1,8;ConvOclDirectFwd1x1:1,128,1,1,0,4,16,4,0
160-14-14-1x1-528-14-14-32-0x0-1x1-1x1-0-NCHW-FP32-B=ConvAsm1x1U:1,16,1,32,2,1,2,2;ConvOclDirectFwd1x1:8,64,16,16,0,2,16,4,1
832-7-7-1x1-256-7-7-64-0x0-1x1-1x1-0-NCHW-FP32-F=ConvAsm1x1U:4,8,4,16,1,4,1,8;ConvOclDirectFwd1x1:1,64,1,1,1,1,16,2048,0;ConvActivAsm1x1U:2,16,2,32,2,2
128-7-7-1x1-544-7-7-16-0x0-1x1-1x1-0-NCHW-FP32-F=ConvAsm1x1U:1,8,1,64,2,4,2,2;ConvOclDirectFwd1x1:1,64,1,1,1,0,16,256,0
256-14-14-1x1-528-14-14-64-0x0-1x1-1x1-0-NCHW-FP16-B=ConvAsm1x1U:1,16,2,16,2,2,2,2;ConvOclDirectFwd1x1:1,256,1,1,0,4,16,4,0
232-14-14-1x1-232-14-14-1-0x0-1x1-1x1-0-NCHW-FP16-W=ConvAsmBwdWrW1x1:1,16,2,1,2,1,1,4,0,1
160-14-14-1x1-528-14-14-512-0x0-1x1-1x1-0-NCHW-FP32-W=ConvAsmBwdWrW1x1:2,8,4,4,8,2,2,4,0,1
96-14-14-1x1-480-14-14-128-0x0-1x1-1x1-0-NCHW-FP32-W=ConvAsmBwdWrW1x1:1,16,2,8,4,1,4,4,0,2
58-56-56-1x1-24-56-56-2-0x0-1x1-1x1-0-NCHW-FP16-B=ConvAsm1x1U:1,8,2,16,1,2,1,1;ConvOclDirectFwd1x1:1,256,1,1,0,2,16,4,0
128-14-14-1x1-416-14-14-256-0x0-1x1-1x1-0-NCHW-FP16-F=ConvAsm1x1U:1,8,2,32,2,4,1,4;ConvOclDirectFwd1x1:1,256,1,1,0,2,16,4,0
528-295-178-1x1-96-295-178-8-0x0-1x1-1x1-0-NCHW-FP32-B=ConvOclDirectFwd1x1:1,256,1,1,0,1,32,4,0
432-377-551-1x1-576-377-551-2-0x0-1x1-1x1-0-NCHW-FP32-F=ConvOclDirectFwd1x1:1,64,1,1,1,0,32,2048,0
64-57-57-1x1-256-57-57-32-0x0-1x1-1x1-0-NCHW-FP32-F=ConvAsm1x1U:2,16,2,32,1,1,1,1;ConvOclDirectFwd1x1:1,64,1,1,1,0,16,2048,0
64-35-35-1x1-256-35-35-64-0x0-1x1-1x1-0-NCHW-FP32-W=ConvAsmBwdWrW1x1:4,4,4,4,4,1,4,4,0,1
736-45-117-1x1-2160-45-117-6-0x0-1x1-1x1-0-NCHW-FP32-B=ConvOclDirectFwd1x1:1,128,1,1,0,1,16,8,0
1024-498-317-1x1-1056-498-317-2-0x0-1x1-1x1-0-NCHW-FP32-B=ConvOclDirectFwd1x1:1,256,1,1,0,2,32,4,0
60-28-28-3x3-60-28-28-4-1x1-1x1-1x1-0-NCHW-FP32-W=ConvAsmBwdWrW3x3:0,0,16,2,2,1
384-13-13-3x3-192-13-13-512-1x1-1x1-1x1-0-NCHW-FP32-W=ConvAsmBwdWrW3x3:0,0,16,4,7,1
64-56-56-1x1-64-56-56-256-0x0-1x1-1x1-0-NCHW-FP16-W=ConvAsmBwdWrW1x1:4,4,2,1,8,1,4,4,0,1
256-14-14-3x3-256-14-14-128-1x1-1x1-1x1-0-NCHW-FP16-F=ConvOclDirectFwd:8,8,16,16,2,2,8,1,2;ConvOclDirectFwdFused:8,8,16,16,2,2,8,1,1
2048-8-8-1x1-192-8-8-64-0x0-1x1-1x1-0-NCHW-FP16-F=ConvAsm1x1U:1,8,2,32,2,4,2,2;ConvOclDirectFwd1x1:1,256,1,1,0,2,8,4,0
64-512-512-7x7-3-1030-1030-4-0x0-2x2-1x1-0-NCHW-FP32-B=ConvOclDirectFwd:8,16,32,32,4,2,2,2,2
256-256-256-1x1-256-256-256-4-0x0-1x1-1x1-0-NCHW-FP32-B=ConvOclDirectFwd1x1:1,64,1,1,0,2,32,4,0
144-448-635-1x1-192-448-635-8-0x0-1x1-1x1-0-NCHW-FP32-F=ConvOclDirectFwd1x1:1,64,1,1,1,1,16,2048,0
320-8-8-1x1-1280-8-8-32-0x0-1x1-1x1-0-NCHW-FP16-B=ConvAsm1x1U:1,16,2,16,1,2,2,4;ConvOclDirectFwd1x1:1,128,1,1,0,2,8,4,0
1024-4-4-1x1-2048-7-7-512-0x0-2x2-1x1-0-NCHW-FP32-W=ConvAsmBwdWrW1x1:1,16,4,8,4,2,1,4,0,1
528-540-159-1x1-58-540-159-8-0x0-1x1-1x1-0-NCHW-FP32-F=ConvOclDirectFwd1x1:1,256,1,1,0,1,16,4,0
256-56-56-1x1-128-28-28-64-0x0-2x2-1x1-0-NCHW-FP16-F=ConvAsm1x1U:1,8,2,32,2,4,1,4;ConvOclDirectFwd1x1:1,256,1,1,0,2,16,4,0
1696-224-490-1x1-288-224-490-2-0x0-1x1-1x1-0-NCHW-FP32-F=ConvOclDirectFwd1x1:1,64,1,1,1,1,64,2048,0
128-14-14-1x1-576-14-14-128-0x0-1x1-1x1-0-NCHW-FP16-F=ConvAsm1x1U:1,8,2,16,2,4,1,8;ConvOclDirectFwd1x1:1,256,1,1,0,4,16,4,0
672-683-50-1x1-2016-683-50-2-0x0-1x1-1x1-0-NCHW-FP32-B=ConvOclDirectFwd1x1:1,256,1,1,0,2,32,4,0
16-38-38-3x3-256-38-38-64-1x1-1x1-1x1-0-NCHW-FP32-W=ConvAsmBwdWrW3x3:0,0,8,4,3,4
288-35-35-1x1-64-35-35-4-0x0-1x1-1x1-0-NCHW-FP32-F=ConvAsm1x1U:2,8,2,64,1,4,2,2;ConvOclDirectFwd1x1:1,64,1,1,1,1,16,128,0;ConvActivAsm1x1U:2,16,3,32,1,4
480-14-14-1x1-192-14-14-256-0x0-1x1-1x1-0-NCHW-FP32-F=ConvAsm1x1U:4,16,4,64,1,2,1,1;ConvOclDirectFwd1x1:1,64,1,1,1,4,16,2048,0;ConvActivAsm1x1U:4,16,4,64,1,1
24-14-14-5x5-64-14-14-1-2x2-1x1-1x1-0-NCHW-FP32-F=ConvOclDirectFwd:16,16,16,16,1,1,1,4,1;ConvOclDirectFwdFused:16,16,16,16,1,1,1,4,1
448-8-8-1x1-2048-8-8-512-0x0-1x1-1x1-0-NCHW-FP16-W=ConvAsmBwdWrW1x1:1,16,4,8,2,1,1,4,0,1
128-14-14-1x1-576-14-14-32-0x0-1x1-1x1-0-NCHW-FP16-W=ConvAsmBwdWrW1x1:2,8,2,8,2,1,4,4,0,1
192-14-14-1x1-480-14-14-16-0x0-1x1-1x1-0-NCHW-FP16-B=ConvAsm1x1U:1,16,2,16,1,2,4,1;ConvOclDirectFwd1x1:1,64,1,1,0,2,8,4,0
288-498-38-1x1-8-498-38-32-0x0-1x1-1x1-0-NCHW-FP32-B=ConvOclDirectFwd1x1:1,64,1,1,0,4,16,8,0
2048-8-8-1x1-1024-8-8-128-0x0-1x1-1x1-0-NCHW-FP32-B=ConvAsm1x1U:1,16,1,64,4,2,1,2;ConvOclDirectFwd1x1:1,256,1,1,0,4,16,4,0
1216-607-283-1x1-1280-607-283-1-0x0-1x1-1x1-0-NCHW-FP32-F=ConvOclDirectFwd1x1:1,64,1,1,1,4,16,2048,0
1568-251-258-1x1-80-251-258-4-0x0-1x1-1x1-0-NCHW-FP32-F=ConvOclDirectFwd1x1:1,64,1,1,1,4,32,256,0
384-56-56-1x1-192-56-56-16-0x0-1x1-1x1-0-NCHW-FP32-F=ConvAsm1x1U:4,16,5,64,1,2,1,2;ConvOclDirectFwd1x1:1,64,1,1,1,0,16,2048,0;ConvActivAsm1x1U:4,16,5,64,2,1
1024-7-7-3x3-1024-14-14-256-1x1-2x2-1x1-0-NCHW-FP32-W_g32=ConvOclBwdWrW2<4>:1,6,3,1,7;ConvOclBwdWrW2<16>:1,7,8,1,7;ConvOclBwdWrW2<8>:1,6,3,1,7;ConvOclBwdWrW2<1>:1,7,8,1,7;ConvOclBwdWrW2<2>:1,7,8,1,7;ConvAsmBwdWrW3x3:0,0,8,8,3,1
512-28-28-1x1-128-28-28-32-0x0-1x1-1x1-0-NCHW-FP32-B=ConvAsm1x1U:3,16,3,32,1,2,2,2;ConvOclDirectFwd1x1:1,128,1,1,0,4,16,4,0
704-7-7-1x1-128-7-7-512-0x0-1x1-1x1-0-NCHW-FP32-B=ConvAsm1x1U:1,16,1,64,4,2,2,2;ConvOclDirectFwd1x1:1,64,1,1,0,1,32,4,0
512-14-14-1x1-144-14-14-64-0x0-1x1-1x1-0-NCHW-FP16-F=ConvAsm1x1U:2,8,4,64,1,4,2,2;ConvOclDirectFwd1x1:1,128,1,1,0,4,8,4,0
16-975-372-1x1-58-975-372-16-0x0-1x1-1x1-0-NCHW-FP32-F=ConvOclDirectFwd1x1:1,256,1,1,0,4,16,4,0
32-91-539-1x1-3-91-539-6-0x0-1x1-1x1-0-NCHW-FP32-W=ConvAsmBwdWrW1x1:4,4,2,1,2,1,4,4,0,3
512-7-7-1x1-1024-14-14-1-0x0-2x2-1x1-0-NCHW-FP16-B=ConvAsm1x1U:1,8,2,64,1,4,4,1;ConvOclDirectFwd1x1:1,128,1,1,0,1,4,8,0
24-56-56-1x1-58-56-56-8-0x0-1x1-1x1-0-NCHW-FP16-F=ConvAsm1x1U:1,8,2,64,1,4,1,4;ConvOclDirectFwd1x1:1,64,1,1,0,2,16,4,0
192-35-35-1x1-48-35-35-8-0x0-1x1-1x1-0-NCHW-FP32-F=ConvAsm1x1U:2,16,2,32,1,2,4,1;ConvOclDirectFwd1x1:1,64,1,1,1,4,16,2048,0;ConvActivAsm1x1U:2,16,2,32,1,4
256-56-56-3x3-256-56-56-512-1x1-1x1-1x1-0-NCHW-FP16-F=ConvOclDirectFwd:32,8,32,32,1,4,8,1,1
192-14-14-1x1-480-14-14-4-0x0-1x1-1x1-0-NCHW-FP32-B=ConvAsm1x1U:1,16,1,32,1,2,4,1;ConvOclDirectFwd1x1:1,128,1,1,0,4,8,8,0
1-7-7-3x3-1-5-5-64-0x0-1x1-1x1-0-NCHW-FP32-F=ConvOclDirectFwd:8,8,8,8,1,1,1,1,2
800-14-14-1x1-128-14-14-64-0x0-1x1-1x1-0-NCHW-FP16-W=ConvAsmBwdWrW1x1:2,8,4,8,2,1,2,4,0,1
144-721-443-1x1-48-721-443-4-0x0-1x1-1x1-0-NCHW-FP32-B=ConvOclDirectFwd1x1:1,128,1,1,0,1,16,4,0
8-86-114-1x1-1312-86-114-2-0x0-1x1-1x1-0-NCHW-FP32-W=ConvAsmBwdWrW1x1:4,4,2,1,2,1,1,4,0,0
128-28-28-1x1-288-28-28-32-0x0-1x1-1x1-0-NCHW-FP16-B=ConvAsm1x1U:1,16,2,16,1,2,2,2;ConvOclDirectFwd1x1:1,64,1,1,0,4,16,4,0
116-28-28-1x1-116-28-28-1024-0x0-1x1-1x1-0-NCHW-FP32-F=ConvAsm1x1U:1,16,1,32,2,2,2,2;ConvOclDirectFwd1x1:1,256,1,1,0,4,16,4,0
24-55-55-1x1-54-55-55-128-0x0-1x1-1x1-0-NCHW-FP32-F=ConvAsm1x1U:1,8,1,32,1,2,4,4;ConvOclDirectFwd1x1:1,256,1,1,0,1,16,4,0
320-14-14-3x3-160-14-14-4-1x1-1x1-1x1-0-NCHW-FP32-W=ConvAsmBwdWrW3x3:0,0,8,4,2,1
320-8-8-1x1-1280-8-8-32-0x0-1x1-1x1-0-NCHW-FP32-W=ConvAsmBwdWrW1x1:1,16,2,8,4,1,1,4,0,1
288-35-35-3x3-384-17-17-1-0x0-2x2-1x1-0-NCHW-FP32-F=ConvOclDirectFwd:32,8,32,32,1,4,2,1,1
64-28-28-1x1-320-28-28-64-0x0-1x1-1x1-0-NCHW-FP16-W=ConvAsmBwdWrW1x1:4,4,4,1,8,1,4,4,0,1
1024-14-14-1x1-512-28-28-8-0x0-2x2-1x1-0-NCHW-FP16-W=ConvAsmBwdWrW1x1:1,16,4,4,4,1,1,4,0,0
192-14-14-1x1-864-14-14-16-0x0-1x1-1x1-0-NCHW-FP32-W=ConvAsmBwdWrW1x1:1,16,2,8,4,1,1,4,0,1
96-28-28-1x1-192-28-28-128-0x0-1x1-1x1-0-NCHW-FP32-B=ConvAsm1x1U:1,32,1,32,1,1,1,1;ConvOclDirectFwd1x1:1,64,1,1,0,1,32,4,0
2160-36-437-1x1-224-36-437-6-0x0-1x1-1x1-0-NCHW-FP32-F=ConvOclDirectFwd1x1:1,64,1,1,1,4,64,128,0
512-14-14-1x1-24-14-14-32-0x0-1x1-1x1-0-NCHW-FP16-F=ConvAsm1x1U:1,8,2,64,1,4,4,1;ConvOclDirectFwd1x1:1,256,1,1,0,4,4,4,0
608-586-325-1x1-8-586-325-2-0x0-1x1-1x1-0-NCHW-FP32-F=ConvOclDirectFwd1x1:1,64,1,1,0,2,16,8,0
192-248-331-1x1-48-248-331-32-0x0-1x1-1x1-0-NCHW-FP32-B=ConvOclDirectFwd1x1:1,256,1,1,0,4,16,4,0
1280-8-8-1x1-192-8-8-32-0x0-1x1-1x1-0-NCHW-FP16-F=ConvAsm1x1U:1,8,2,16,1,4,2,2;ConvOclDirectFwd1x1:1,64,1,1,0,2,4,4,0
480-14-14-1x1-16-14-14-4-0x0-1x1-1x1-0-NCHW-FP16-F=ConvAsm1x1U:1,8,2,16,1,4,4,1;ConvOclDirectFwd1x1:1,64,1,1,0,4,4,8,0
800-7-7-1x1-128-7-7-512-0x0-1x1-1x1-0-NCHW-FP32-B=ConvAsm1x1U:2,16,2,32,1,2,2,2;ConvOclDirectFwd1x1:1,128,1,1,0,1,32,4,0
128-28-28-1x1-128-28-28-16-0x0-1x1-1x1-0-NCHW-FP32-B=ConvAsm1x1U:1,16,1,32,1,2,1,1;ConvOclDirectFwd1x1:16,64,32,32,0,2,16,4,1
1024-14-14-1x1-512-28-28-512-0x0-2x2-1x1-0-NCHW-FP32-W=ConvAsmBwdWrW1x1:1,16,4,4,8,2,1,4,0,1
192-56-56-1x1-144-56-56-16-0x0-1x1-1x1-0-NCHW-FP32-B=ConvAsm1x1U:1,16,1,64,1,2,2,1;ConvOclDirectFwd1x1:1,128,1,1,0,4,16,4,0
256-7-7-1x1-832-7-7-64-0x0-1x1-1x1-0-NCHW-FP32-B=ConvAsm1x1U:2,16,2,32,1,2,2,2;ConvOclDirectFwd1x1:1,128,1,1,0,1,16,8,0
32-149-149-3x3-32-147-147-256-0x0-1x1-1x1-0-NCHW-FP16-F=ConvOclDirectFwd:16,16,32,32,2,2,8,4,1;ConvOclDirectFwdFused:16,16,32,32,2,2,8,4,1
96-135-182-1x1-768-135-182-16-0x0-1x1-1x1-0-NCHW-FP32-B=ConvOclDirectFwd1x1:1,256,1,1,0,2,32,4,0
928-62-2-1x1-1728-62-2-8-0x0-1x1-1x1-0-NCHW-FP32-B=ConvAsm1x1U:2,16,2,32,1,2,2,2;ConvOclDirectFwd1x1:1,128,1,1,0,2,16,4,0
54-282-841-1x1-32-282-841-4-0x0-1x1-1x1-0-NCHW-FP32-B=ConvOclDirectFwd1x1:1,256,1,1,0,2,8,4,0
32-14-14-5x5-128-14-14-512-2x2-1x1-1x1-0-NCHW-FP16-F=ConvOclDirectFwd:8,8,16,16,2,2,8,1,2;ConvOclDirectFwdFused:8,8,16,16,2,2,8,1,2
96-28-28-1x1-192-28-28-512-0x0-1x1-1x1-0-NCHW-FP32-B=ConvAsm1x1U:1,32,1,16,1,1,1,2;ConvOclDirectFwd1x1:1,64,1,1,0,2,32,4,0
1024-17-17-1x1-192-17-17-16-0x0-1x1-1x1-0-NCHW-FP32-F=ConvAsm1x1U:4,16,4,16,2,2,2,1;ConvOclDirectFwd1x1:1,64,1,1,1,4,16,2048,0;ConvActivAsm1x1U:2,16,2,32,4,2
1024-4-4-1x1-2048-7-7-128-0x0-2x2-1x1-0-NCHW-FP32-B=ConvAsm1x1U:1,16,1,16,2,2,1,8;ConvOclDirectFwd1x1:1,256,1,1,0,1,32,4,0
256-57-57-1x1-128-57-57-64-0x0-1x1-1x1-0-NCHW-FP32-W=ConvAsmBwdWrW1x1:4,4,4,4,2,1,1,4,0,1
384-28-28-1x1-768-28-28-16-0x0-1x1-1x1-0-NCHW-FP16-B=ConvAsm1x1U:1,16,2,16,1,2,2,2;ConvOclDirectFwd1x1:1,64,1,1,0,4,16,4,0
1024-15-15-1x1-512-15-15-4-0x0-1x1-1x1-0-NCHW-FP32-F=ConvAsm1x1U:2,8,4,64,1,4,4,1;ConvOclDirectFwd1x1:1,64,1,1,1,4,16,2048,0
192-146-478-1x1-608-146-478-8-0x0-1x1-1x1-0-NCHW-FP32-F=ConvOclDirectFwd1x1:1,64,1,1,1,0,64,2048,0
144-185-514-1x1-416-185-514-8-0x0-1x1-1x1-0-NCHW-FP32-F=ConvOclDirectFwd1x1:1,64,1,1,1,4,64,256,0
128-56-56-1x1-256-56-56-256-0x0-1x1-1x1-0-NCHW-FP32-W=ConvAsmBwdWrW1x1:2,8,4,2,8,1,4,4,0,1
58-56-56-1x1-24-56-56-8-0x0-1x1-1x1-0-NCHW-FP32-W=ConvAsmBwdWrW1x1:4,4,2,1,4,1,4,4,0,3
192-7-7-1x1-832-7-7-32-0x0-1x1-1x1-0-NCHW-FP32-B=ConvAsm1x1U:1,16,1,64,2,2,4,1;ConvOclDirectFwd1x1:1,64,1,1,0,1,16,8,0
512-28-28-1x1-128-28-28-32-0x0-1x1-1x1-0-NCHW-FP16-F=ConvAsm1x1U:1,8,2,32,1,4,1,4;ConvOclDirectFwd1x1:1,64,1,1,0,4,16,4,0
256-29-29-1x1-512-29-29-32-0x0-1x1-1x1-0-NCHW-FP32-B=ConvAsm1x1U:3,16,3,64,1,2,2,2;ConvOclDirectFwd1x1:1,256,1,1,0,1,32,4,0
320-28-28-1x1-128-28-28-128-0x0-1x1-1x1-0-NCHW-FP16-F=ConvAsm1x1U:1,8,2,32,2,4,1,4;ConvOclDirectFwd1x1:1,64,1,1,0,4,16,4,0
128-17-17-1x1-768-17-17-16-0x0-1x1-1x1-0-NCHW-FP16-B=ConvAsm1x1U:1,16,2,16,1,2,2,2;ConvOclDirectFwd1x1:1,64,1,1,0,1,8,4,0
192-7-7-1x1-832-7-7-512-0x0-1x1-1x1-0-NCHW-FP32-W=ConvAsmBwdWrW1x1:1,16,2,8,4,1,4,4,0,2
128-28-28-1x1-160-28-28-128-0x0-1x1-1x1-0-NCHW-FP32-B=ConvAsm1x1U:1,32,1,16,1,1,1,1;ConvOclDirectFwd1x1:1,256,1,1,0,1,32,4,0
128-54-54-1x1-32-54-54-256-0x0-1x1-1x1-0-NCHW-FP16-F=ConvAsm1x1U:1,8,2,64,1,4,1,4;ConvOclDirectFwd1x1:16,64,32,32,0,2,16,4,1
240-7-7-3x3-240-7-7-64-1x1-1x1-1x1-0-NCHW-FP16-F=ConvOclDirectFwd:8,8,8,8,1,1,8,2,1
240-7-7-1x1-960-7-7-512-0x0-1x1-1x1-0-NCHW-FP16-B_g3=ConvOclDirectFwd:8,8,8,8,1,1,8,2,1
256-57-57-1x1-256-57-57-128-0x0-1x1-1x1-0-NCHW-FP32-W=ConvAsmBwdWrW1x1:4,4,8,4,4,1,2,4,0,0
544-457-876-1x1-32-457-876-1-0x0-1x1-1x1-0-NCHW-FP32-F=ConvOclDirectFwd1x1:1,64,1,1,1,1,64,2048,0
64-56-56-1x1-64-56-56-128-0x0-1x1-1x1-0-NCHW-FP32-F=ConvAsm1x1U:1,16,1,64,2,2,1,4;ConvOclDirectFwd1x1:1,64,1,1,1,1,32,128,0
128-56-56-1x1-192-56-56-256-0x0-1x1-1x1-0-NCHW-FP16-W=ConvAsmBwdWrW1x1:4,4,4,1,8,1,4,4,0,1
64-14-14-1x1-512-14-14-64-0x0-1x1-1x1-0-NCHW-FP32-B=ConvAsm1x1U:1,16,1,64,2,2,1,1;ConvOclDirectFwd1x1:1,256,1,1,0,2,16,4,0
32-28-28-3x3-128-28-28-512-1x1-1x1-1x1-0-NCHW-FP16-B=ConvOclDirectFwd:8,16,32,32,4,2,8,1,1
512-7-7-3x3-512-7-7-16-1x1-1x1-1x1-0-NCHW-FP16-B=ConvOclDirectFwd:8,8,8,8,1,1,4,1,2
128-56-56-1x1-128-56-56-64-0x0-1x1-1x1-0-NCHW-FP32-W=ConvAsmBwdWrW1x1:4,4,4,4,4,1,4,4,0,2
128-221-337-1x1-224-221-337-12-0x0-1x1-1x1-0-NCHW-FP32-W=ConvAsmBwdWrW1x1:4,4,4,2,8,1,1,4,0,1
64-141-680-1x1-128-141-680-1-0x0-1x1-1x1-0-NCHW-FP32-F=ConvOclDirectFwd1x1:1,64,1,1,1,0,16,64,0
120-14-14-1x1-480-14-14-1024-0x0-1x1-1x1-0-NCHW-FP16-F_g3=ConvOclDirectFwd:16,16,16,16,1,1,8,1,2
24-112-112-3x3-3-224-224-32-1x1-2x2-1x1-0-NCHW-FP32-B=ConvOclDirectFwd:8,8,32,32,4,4,2,2,2
128-28-28-3x3-160-14-14-32-1x1-2x2-1x1-0-NCHW-FP32-F=ConvOclDirectFwd:16,16,16,16,1,1,8,2,2
512-28-28-1x1-1024-14-14-64-0x0-2x2-1x1-0-NCHW-FP16-F=ConvAsm1x1U:2,8,4,64,1,4,1,8;ConvOclDirectFwd1x1:1,128,1,1,0,2,32,4,0
16-54-54-1x1-64-54-54-128-0x0-1x1-1x1-0-NCHW-FP16-W=ConvAsmBwdWrW1x1:4,4,2,1,4,1,4,4,0,2
128-14-14-1x1-320-14-14-16-0x0-1x1-1x1-0-NCHW-FP16-F=ConvAsm1x1U:1,8,2,16,1,4,1,4;ConvOclDirectFwd1x1:1,64,1,1,0,4,8,4,0
256-14-14-1x1-528-14-14-16-0x0-1x1-1x1-0-NCHW-FP32-B=ConvAsm1x1U:1,16,1,64,2,2,2,2;ConvOclDirectFwd1x1:1,256,1,1,0,4,16,4,0
1104-27-387-1x1-1152-27-387-2-0x0-1x1-1x1-0-NCHW-FP32-W=ConvAsmBwdWrW1x1:2,8,8,4,4,1,1,4,0,1
232-14-14-1x1-232-14-14-256-0x0-1x1-1x1-0-NCHW-FP32-B=ConvAsm1x1U:1,8,1,32,1,2,1,4;ConvOclDirectFwd1x1:1,256,1,1,0,2,16,8,0
160-14-14-1x1-512-14-14-512-0x0-1x1-1x1-0-NCHW-FP16-B=ConvAsm1x1U:1,16,2,16,1,2,2,2;ConvOclDirectFwd1x1:1,64,1,1,0,2,16,4,0
128-28-28-3x3-128-28-28-32-1x1-1x1-1x1-0-NCHW-FP16-W=ConvAsmBwdWrW3x3:0,0,8,2,2,8
116-14-14-1x1-116-14-14-256-0x0-1x1-1x1-0-NCHW-FP16-B=ConvAsm1x1U:4,4,8,4,1,2,1,8;ConvOclDirectFwd1x1:1,256,1,1,0,1,16,4,0
320-54-235-1x1-48-54-235-16-0x0-1x1-1x1-0-NCHW-FP32-W=ConvAsmBwdWrW1x1:4,4,4,4,2,1,1,4,0,1
96-35-35-3x3-96-35-35-8-1x1-1x1-1x1-0-NCHW-FP16-W=ConvAsmBwdWrW3x3:0,0,8,2,2,4
128-7-7-1x1-736-7-7-64-0x0-1x1-1x1-0-NCHW-FP32-F=ConvAsm1x1U:1,16,1,64,4,2,2,2;ConvOclDirectFwd1x1:1,64,1,1,1,0,16,2048,0
16-28-28-1x1-192-28-28-32-0x0-1x1-1x1-0-NCHW-FP16-B=ConvAsm1x1U:1,8,2,32,1,4,1,2;ConvOclDirectFwd1x1:1,128,1,1,0,2,8,4,0
672-76-38-1x1-1000-76-38-48-0x0-1x1-1x1-0-NCHW-FP32-W=ConvAsmBwdWrW1x1:2,8,4,4,8,1,1,2,0,1
416-28-28-1x1-128-28-28-128-0x0-1x1-1x1-0-NCHW-FP32-F=ConvAsm1x1U:3,16,3,32,2,2,2,2;ConvOclDirectFwd1x1:1,64,1,1,1,0,32,2048,0
1280-8-8-1x1-192-8-8-4-0x0-1x1-1x1-0-NCHW-FP16-F=ConvAsm1x1U:1,8,2,16,1,4,4,1;ConvOclDirectFwd1x1:1,64,1,1,0,1,4,8,0
256-7-7-1x1-832-7-7-128-0x0-1x1-1x1-0-NCHW-FP32-B=ConvAsm1x1U:1,16,1,64,2,2,2,2;ConvOclDirectFwd1x1:8,64,8,8,0,1,16,4,1
64-14-14-1x1-480-14-14-64-0x0-1x1-1x1-0-NCHW-FP16-B=ConvAsm1x1U:1,16,2,64,1,2,1,8;ConvOclDirectFwd1x1:1,128,1,1,0,4,8,4,0
256-17-17-1x1-1024-17-17-8-0x0-1x1-1x1-0-NCHW-FP16-B=ConvAsm1x1U:1,16,2,32,1,2,1,4;ConvOclDirectFwd1x1:1,256,1,1,0,1,8,4,0
58-56-56-1x1-24-56-56-128-0x0-1x1-1x1-0-NCHW-FP16-B=ConvAsm1x1U:1,8,2,64,2,2,1,1;ConvOclDirectFwd1x1:1,64,1,1,0,1,16,4,0
384-13-13-3x3-192-13-13-16-1x1-1x1-1x1-0-NCHW-FP32-W=ConvAsmBwdWrW3x3:0,1,16,4,4,1
48-376-142-1x1-704-376-142-2-0x0-1x1-1x1-0-NCHW-FP32-F=ConvOclDirectFwd1x1:1,64,1,1,1,4,16,2048,0
128-28-28-1x1-416-28-28-256-0x0-1x1-1x1-0-NCHW-FP32-F=ConvAsm1x1U:1,16,1,32,3,2,2,2;ConvOclDirectFwd1x1:1,64,1,1,1,0,16,128,0
352-28-28-1x1-128-28-28-256-0x0-1x1-1x1-0-NCHW-FP32-B=ConvAsm1x1U:2,16,2,32,1,2,1,4;ConvOclDirectFwd1x1:1,256,1,1,0,1,32,4,0
120-14-14-3x3-120-7-7-1024-1x1-2x2-1x1-0-NCHW-FP32-F=ConvOclDirectFwd:8,8,8,8,1,1,8,2,2
128-14-14-1x1-576-14-14-16-0x0-1x1-1x1-0-NCHW-FP16-B=ConvAsm1x1U:1,16,2,16,1,2,2,2;ConvOclDirectFwd1x1:1,256,1,1,0,4,16,4,0
128-14-14-1x1-800-14-14-32-0x0-1x1-1x1-0-NCHW-FP16-F=ConvAsm1x1U:1,8,2,16,2,4,1,4;ConvOclDirectFwd1x1:1,256,1,1,0,4,8,4,0
2048-7-7-1x1-1024-7-7-8-0x0-1x1-1x1-0-NCHW-FP32-B=ConvAsm1x1U:2,16,2,32,2,2,4,2;ConvOclDirectFwd1x1:1,256,1,1,0,1,8,4,0
64-911-206-1x1-8-911-206-12-0x0-1x1-1x1-0-NCHW-FP32-F=ConvOclDirectFwd1x1:1,256,1,1,0,2,16,4,0
16-54-54-1x1-128-54-54-512-0x0-1x1-1x1-0-NCHW-FP16-W=ConvAsmBwdWrW1x1:4,4,2,2,2,1,4,4,0,3
48-409-481-1x1-3-409-481-16-0x0-1x1-1x1-0-NCHW-FP32-F=ConvOclDirectFwd1x1:1,256,1,1,0,1,16,8,0
128-584-47-1x1-1440-584-47-2-0x0-1x1-1x1-0-NCHW-FP32-B=ConvOclDirectFwd1x1:1,256,1,1,0,2,32,4,0
128-7-7-1x1-768-7-7-128-0x0-1x1-1x1-0-NCHW-FP16-B=ConvAsm1x1U:2,8,4,16,1,4,1,8;ConvOclDirectFwd1x1:1,128,1,1,0,1,8,4,0
160-202-476-1x1-1728-202-476-1-0x0-1x1-1x1-0-NCHW-FP32-B=ConvOclDirectFwd1x1:1,256,1,1,0,2,32,4,0
160-869-35-1x1-1312-869-35-6-0x0-1x1-1x1-0-NCHW-FP32-B=ConvOclDirectFwd1x1:1,128,1,1,0,1,32,4,0
64-28-28-1x1-192-28-28-128-0x0-1x1-1x1-0-NCHW-FP32-W=ConvAsmBwdWrW1x1:4,4,2,4,8,1,4,4,0,0
2048-8-8-1x1-320-8-8-64-0x0-1x1-1x1-0-NCHW-FP32-F=ConvAsm1x1U:4,16,4,16,3,2,2,1;ConvOclDirectFwd1x1:1,64,1,1,1,0,16,2048,0;ConvActivAsm1x1U:4,16,4,16,3,2
1024-17-17-1x1-128-17-17-1-0x0-1x1-1x1-0-NCHW-FP16-F=ConvAsm1x1U:1,8,2,32,1,4,4,1;ConvOclDirectFwd1x1:1,128,1,1,0,1,4,8,0
2048-8-8-1x1-1024-8-8-256-0x0-1x1-1x1-0-NCHW-FP32-B=ConvAsm1x1U:1,32,1,32,2,1,1,1;ConvOclDirectFwd1x1:1,256,1,1,0,1,32,4,0
192-17-17-1x1-768-17-17-64-0x0-1x1-1x1-0-NCHW-FP32-B=ConvAsm1x1U:1,32,1,64,2,1,2,2;ConvOclDirectFwd1x1:1,256,1,1,0,1,32,4,0
224-35-35-3x3-192-35-35-1-1x1-1x1-1x1-0-NCHW-FP16-B=ConvOclDirectFwd:16,8,16,16,1,2,4,2,1
256-53-56-1x1-624-53-56-4-0x0-1x1-1x1-0-NCHW-FP32-B=ConvAsm1x1U:3,16,3,64,1,2,1,4;ConvOclDirectFwd1x1:1,64,1,1,0,4,16,4,0
64-56-56-1x1-256-56-56-128-0x0-1x1-1x1-0-NCHW-FP16-F=ConvAsm1x1U:1,8,2,64,2,4,1,4;ConvOclDirectFwd1x1:1,64,1,1,0,2,32,4,0
128-58-58-3x3-128-28-28-256-0x0-2x2-1x1-0-NCHW-FP32-F=ConvOclDirectFwd:16,16,16,32,1,2,8,2,2
128-28-28-1x1-224-28-28-64-0x0-1x1-1x1-0-NCHW-FP16-F=ConvAsm1x1U:1,8,2,16,2,4,1,4;ConvOclDirectFwd1x1:1,256,1,1,0,4,16,4,0
192-56-56-1x1-128-56-56-16-0x0-1x1-1x1-0-NCHW-FP16-B=ConvAsm1x1U:1,16,2,32,1,2,2,2;ConvOclDirectFwd1x1:1,64,1,1,0,4,16,4,0
512-15-15-1x1-1024-15-15-48-0x0-1x1-1x1-0-NCHW-FP32-W=ConvAsmBwdWrW1x1:1,16,4,4,8,1,1,4,0,1
128-27-27-1x1-32-27-27-64-0x0-1x1-1x1-0-NCHW-FP32-W=ConvAsmBwdWrW1x1:4,4,2,4,2,1,2,4,0,2
3-519-579-1x1-16-519-579-64-0x0-1x1-1x1-0-NCHW-FP32-B=ConvOclDirectFwd1x1:1,256,1,1,0,1,16,4,0
512-28-28-3x3-256-28-28-256-1x1-1x1-1x1-0-NCHW-FP32-W=ConvAsmBwdWrW3x3:0,0,8,4,4,1
16-24-240-3x3-32-24-240-1-1x1-1x1-1x1-0-NCHW-FP32-F=ConvOclDirectFwd:16,16,16,16,1,1,4,2,1;ConvAsm3x3U:2,2,1;ConvOclDirectFwdFused:16,16,16,16,1,1,4,4,1
128-14-14-1x1-352-14-14-256-0x0-1x1-1x1-0-NCHW-FP32-F=ConvAsm1x1U:2,16,2,64,3,2,1,2;ConvOclDirectFwd1x1:1,64,1,1,1,4,32,256,0
720-302-442-1x1-48-302-442-4-0x0-1x1-1x1-0-NCHW-FP32-F=ConvOclDirectFwd1x1:1,64,1,1,1,4,32,2048,0
576-14-14-1x1-96-14-14-64-0x0-1x1-1x1-0-NCHW-FP16-F=ConvAsm1x1U:2,8,4,64,1,4,2,4;ConvOclDirectFwd1x1:1,64,1,1,0,4,16,4,0
19-104-802-1x1-1792-104-802-1-0x0-1x1-1x1-0-NCHW-FP32-B=ConvOclDirectFwd1x1:1,256,1,1,0,4,16,4,0
128-7-7-1x1-992-7-7-256-0x0-1x1-1x1-0-NCHW-FP16-F=ConvAsm1x1U:2,8,4,16,1,4,2,1;ConvOclDirectFwd1x1:1,128,1,1,0,1,16,4,0
128-14-14-1x1-480-14-14-16-0x0-1x1-1x1-0-NCHW-FP16-W=ConvAsmBwdWrW1x1:2,8,2,8,2,1,2,4,0,0
64-112-112-7x7-3-224-224-8-3x3-2x2-1x1-0-NCHW-FP32-B=ConvOclDirectFwd:8,8,32,32,4,4,1,2,1
232-14-14-1x1-232-14-14-1024-0x0-1x1-1x1-0-NCHW-FP32-B=ConvAsm1x1U:2,8,2,64,1,1,2,2;ConvOclDirectFwd1x1:1,128,1,1,0,2,16,8,0
128-28-28-1x1-256-56-56-16-0x0-2x2-1x1-0-NCHW-FP16-W=ConvAsmBwdWrW1x1:4,4,4,1,8,1,2,4,0,0
864-14-14-1x1-128-14-14-128-0x0-1x1-1x1-0-NCHW-FP32-B=ConvAsm1x1U:4,32,7,32,1,1,1,1;ConvOclDirectFwd1x1:1,128,1,1,0,2,16,4,0
256-14-14-1x1-256-14-14-2-0x0-1x1-1x1-0-NCHW-FP16-F=ConvAsm1x1U:1,8,2,32,1,4,4,1;ConvOclDirectFwd1x1:1,64,1,1,0,4,4,4,0
192-35-35-1x1-384-35-35-4-0x0-1x1-1x1-0-NCHW-FP32-B=ConvAsm1x1U:2,16,2,64,1,2,2,2;ConvOclDirectFwd1x1:1,64,1,1,0,1,8,4,0
64-54-54-3x3-3-108-108-8-1x1-2x2-1x1-0-NCHW-FP32-B=ConvOclDirectFwd:32,8,32,32,1,4,2,4,1
96-109-109-7x7-3-224-224-128-0x0-2x2-1x1-0-NCHW-FP16-B=ConvOclDirectFwd:32,16,32,32,1,2,1,4,1
960-14-14-1x1-128-14-14-256-0x0-1x1-1x1-0-NCHW-FP16-F=ConvAsm1x1U:1,16,2,16,2,2,2,2;ConvOclDirectFwd1x1:1,64,1,1,0,2,16,4,0
16-82-52-1x1-2-82-52-8-0x0-1x1-1x1-0-NCHW-FP32-B=ConvAsm1x1U:1,1,1,4,1,1,1,1;ConvOclDirectFwd1x1:1,256,1,1,0,1,16,8,0
32-28-28-1x1-192-28-28-4-0x0-1x1-1x1-0-NCHW-FP32-B=ConvAsm1x1U:1,8,1,64,1,2,2,2;ConvOclDirectFwd1x1:1,128,1,1,0,1,8,4,0
512-28-28-3x3-256-28-28-128-1x1-1x1-1x1-0-NCHW-FP16-F=ConvOclDirectFwd:16,16,32,32,2,2,8,1,1
128-14-14-3x3-32-14-14-64-1x1-1x1-1x1-0-NCHW-FP16-W=ConvAsmBwdWrW3x3:0,0,8,2,4,4
1536-421-323-1x1-1000-421-323-2-0x0-1x1-1x1-0-NCHW-FP32-F=ConvOclDirectFwd1x1:1,256,1,1,0,1,16,4,0
864-332-803-1x1-512-332-803-2-0x0-1x1-1x1-0-NCHW-FP32-F=ConvOclDirectFwd1x1:1,64,1,1,1,1,16,2048,0
192-56-56-3x3-64-56-56-64-1x1-1x1-1x1-0-NCHW-FP16-W=ConvAsmBwdWrW3x3:0,1,8,4,1,4
128-7-7-5x5-48-7-7-128-2x2-1x1-1x1-0-NCHW-FP16-B=ConvOclDirectFwd:8,8,8,8,1,1,4,4,2
512-14-14-1x1-1024-14-14-2-0x0-1x1-1x1-0-NCHW-FP32-F=ConvAsm1x1U:2,8,4,64,1,4,4,1;ConvOclDirectFwd1x1:8,8,16,16,1,0,32,128,1
384-8-8-1x1-1280-8-8-8-0x0-1x1-1x1-0-NCHW-FP32-B=ConvAsm1x1U:1,8,1,64,1,4,1,4;ConvOclDirectFwd1x1:1,128,1,1,0,2,8,8,0
768-17-17-1x1-128-17-17-16-0x0-1x1-1x1-0-NCHW-FP16-F=ConvAsm1x1U:1,8,2,32,1,4,2,2;ConvOclDirectFwd1x1:1,128,1,1,0,1,8,8,0
128-14-14-1x1-960-14-14-64-0x0-1x1-1x1-0-NCHW-FP32-F=ConvAsm1x1U:4,8,4,64,1,4,2,2;ConvOclDirectFwd1x1:1,64,1,1,1,4,32,256,0
128-56-56-3x3-128-56-56-16-1x1-1x1-1x1-0-NCHW-FP32-W_g32=ConvOclBwdWrW2<4>:1,7,1,1,7;ConvOclBwdWrW2<16>:1,7,1,1,7;ConvOclBwdWrW2<8>:1,7,1,1,7;ConvOclBwdWrW2<1>:1,8,3,1,7;ConvOclBwdWrW2<2>:1,7,1,1,7;ConvAsmBwdWrW3x3:0,1,16,1,4,2
3-224-224-3x3-64-224-224-8-1x1-1x1-1x1-0-NCHW-FP16-F=ConvOclDirectFwd:16,16,16,32,1,2,8,1,2;ConvOclDirectFwdFused:16,16,16,32,1,2,8,1,2
80-23-159-1x1-768-23-159-6-0x0-1x1-1x1-0-NCHW-FP32-W=ConvAsmBwdWrW1x1:4,4,8,2,8,1,2,4,0,0
2048-7-7-1x1-1024-4-4-128-0x0-2x2-1x1-0-NCHW-FP16-F=ConvAsm1x1U:2,4,4,4,2,4,1,8;ConvOclDirectFwd1x1:1,256,1,1,0,1,16,4,0
240-7-7-1x1-960-7-7-1024-0x0-1x1-1x1-0-NCHW-FP32-F_g3=ConvOclDirectFwd:8,8,8,8,1,1,8,4,2
384-13-13-3x3-384-13-13-16-1x1-1x1-1x1-0-NCHW-FP32-W=ConvAsmBwdWrW3x3:0,1,16,4,8,1
192-7-7-1x1-1632-7-7-16-0x0-1x1-1x1-0-NCHW-FP32-W=ConvAsmBwdWrW1x1:1,16,2,4,4,1,1,4,0,3
800-14-14-1x1-128-14-14-16-0x0-1x1-1x1-0-NCHW-FP16-F=ConvAsm1x1U:2,8,4,64,1,4,4,2;ConvOclDirectFwd1x1:1,64,1,1,0,2,4,4,0
256-8-8-1x1-1536-8-8-128-0x0-1x1-1x1-0-NCHW-FP16-W=ConvAsmBwdWrW1x1:2,8,4,8,2,2,1,4,0,1
1856-192-517-1x1-80-192-517-1-0x0-1x1-1x1-0-NCHW-FP32-F=ConvOclDirectFwd1x1:1,64,1,1,1,1,32,256,0
608-128-171-1x1-1280-128-171-6-0x0-1x1-1x1-0-NCHW-FP32-F=ConvOclDirectFwd1x1:1,64,1,1,1,4,16,2048,0
224-28-28-1x1-128-28-28-16-0x0-1x1-1x1-0-NCHW-FP32-F=ConvAsm1x1U:3,16,3,16,1,2,2,2;ConvOclDirectFwd1x1:1,64,1,1,1,0,32,2048,0
2048-14-14-1x1-512-14-14-256-0x0-1x1-1x1-0-NCHW-FP16-B=ConvAsm1x1U:1,16,2,32,1,2,1,4;ConvOclDirectFwd1x1:1,128,1,1,0,4,16,4,0
320-14-14-1x1-128-14-14-256-0x0-1x1-1x1-0-NCHW-FP32-B=ConvAsm1x1U:1,32,1,16,2,1,2,2;ConvOclDirectFwd1x1:1,256,1,1,0,1,32,4,0
256-56-56-1x1-128-56-56-8-0x0-1x1-1x1-0-NCHW-FP32-B=ConvAsm1x1U:2,32,7,64,1,1,1,1;ConvOclDirectFwd1x1:1,128,1,1,0,4,16,4,0
2048-14-14-1x1-512-14-14-64-0x0-1x1-1x1-0-NCHW-FP16-F=ConvAsm1x1U:2,8,4,64,1,4,4,1;ConvOclDirectFwd1x1:1,64,1,1,0,4,8,4,0
192-28-28-1x1-128-28-28-64-0x0-1x1-1x1-0-NCHW-FP16-B=ConvAsm1x1U:1,16,2,16,1,2,2,2;ConvOclDirectFwd1x1:1,128,1,1,0,4,16,4,0
192-7-7-1x1-1152-7-7-16-0x0-1x1-1x1-0-NCHW-FP16-W=ConvAsmBwdWrW1x1:1,16,2,8,2,1,2,4,0,0
256-56-56-1x1-256-56-56-2-0x0-1x1-1x1-0-NCHW-FP32-W=ConvAsmBwdWrW1x1:4,4,4,4,4,1,1,4,0,1
128-4-4-1x1-608-4-4-32-0x0-1x1-1x1-0-NCHW-FP16-B=ConvAsm1x1U:2,4,4,4,1,4,2,4;ConvOclDirectFwd1x1:1,64,1,1,0,1,4,4,0
512-7-7-3x3-512-14-14-128-1x1-2x2-1x1-0-NCHW-FP16-B=ConvOclDirectFwd:8,8,16,16,2,2,4,1,1
192-27-27-1x1-48-27-27-128-0x0-1x1-1x1-0-NCHW-FP32-F=ConvAsm1x1U:3,16,3,64,2,2,1,1;ConvOclDirectFwd1x1:1,64,1,1,1,0,16,2048,0
64-28-28-1x1-192-28-28-128-0x0-1x1-1x1-0-NCHW-FP16-B=ConvAsm1x1U:1,16,2,16,1,2,1,4;ConvOclDirectFwd1x1:1,64,1,1,0,4,16,4,0
128-4-4-1x1-576-4-4-32-0x0-1x1-1x1-0-NCHW-FP16-B=ConvAsm1x1U:2,4,4,4,1,2,4,1;ConvOclDirectFwd1x1:1,128,1,1,0,1,4,4,0
512-14-14-3x3-512-14-14-128-1x1-1x1-1x1-0-NCHW-FP16-F=ConvOclDirectFwd:8,8,16,16,2,2,8,1,1;ConvOclDirectFwdFused:8,8,16,16,2,2,8,1,1
256-38-38-3x3-256-38-38-32-1x1-1x1-1x1-0-NCHW-FP32-W=ConvAsmBwdWrW3x3:0,1,8,4,3,1
128-7-7-1x1-640-7-7-64-0x0-1x1-1x1-0-NCHW-FP32-B=ConvAsm1x1U:1,16,1,64,2,2,2,2;ConvOclDirectFwd1x1:1,64,1,1,0,1,16,8,0
3-627-619-1x1-8-627-619-8-0x0-1x1-1x1-0-NCHW-FP32-B=ConvAsm1x1U:3,8,7,64,2,1,2,1;ConvOclDirectFwd1x1:1,128,1,1,0,1,16,4,0
128-958-30-1x1-2160-958-30-8-0x0-1x1-1x1-0-NCHW-FP32-B=ConvOclDirectFwd1x1:1,64,1,1,0,4,16,4,0
128-17-17-1x1-1024-17-17-256-0x0-1x1-1x1-0-NCHW-FP16-W=ConvAsmBwdWrW1x1:2,8,8,8,2,2,2,4,0,1
144-790-19-1x1-544-790-19-12-0x0-1x1-1x1-0-NCHW-FP32-B=ConvOclDirectFwd1x1:1,256,1,1,0,2,32,4,0
288-35-35-1x1-64-35-35-32-0x0-1x1-1x1-0-NCHW-FP32-F=ConvAsm1x1U:4,16,5,64,1,2,1,1;ConvOclDirectFwd1x1:1,64,1,1,1,0,16,2048,0;ConvActivAsm1x1U:1,32,1,64,3,1
112-14-14-3x3-224-14-14-64-1x1-1x1-1x1-0-NCHW-FP16-F=ConvOclDirectFwd:8,16,16,16,2,1,8,4,2;ConvOclDirectFwdFused:8,16,16,16,2,1,8,4,1
32-204-53-1x1-1408-204-53-1-0x0-1x1-1x1-0-NCHW-FP32-W=ConvAsmBwdWrW1x1:4,4,8,4,2,1,1,4,0,0
128-14-14-1x1-960-14-14-64-0x0-1x1-1x1-0-NCHW-FP16-B=ConvAsm1x1U:1,16,2,16,1,2,2,2;ConvOclDirectFwd1x1:1,64,1,1,0,4,16,4,0
320-162-287-1x1-1280-162-287-1-0x0-1x1-1x1-0-NCHW-FP32-B=ConvOclDirectFwd1x1:1,256,1,1,0,2,32,4,0
448-66-299-1x1-1056-66-299-8-0x0-1x1-1x1-0-NCHW-FP32-F=ConvOclDirectFwd1x1:1,64,1,1,1,4,64,2048,0
80-497-615-1x1-80-497-615-6-0x0-1x1-1x1-0-NCHW-FP32-F=ConvOclDirectFwd1x1:1,64,1,1,1,4,32,2048,0
1000-384-121-1x1-816-384-121-8-0x0-1x1-1x1-0-NCHW-FP32-B=ConvOclDirectFwd1x1:1,128,1,1,0,2,16,8,0
1-520-732-1x1-512-520-732-1-0x0-1x1-1x1-0-NCHW-FP32-B=ConvOclDirectFwd1x1:1,64,1,1,0,4,16,4,0
1024-7-7-1x1-464-7-7-4-0x0-1x1-1x1-0-NCHW-FP16-W=ConvAsmBwdWrW1x1:1,16,4,4,2,1,1,2,0,1
64-14-14-1x1-512-14-14-128-0x0-1x1-1x1-0-NCHW-FP16-B=ConvAsm1x1U:1,16,2,16,1,2,1,4;ConvOclDirectFwd1x1:1,256,1,1,0,4,8,4,0
6-16-16-1x1-512-16-16-4-0x0-1x1-1x1-0-NCHW-FP32-W=ConvAsmBwdWrW1x1:4,4,2,1,2,1,1,2,0,1
160-7-7-3x3-320-7-7-256-1x1-1x1-1x1-0-NCHW-FP16-F=ConvOclDirectFwd:8,8,8,8,1,1,8,4,2;ConvOclDirectFwdFused:8,8,8,8,1,1,8,4,2
192-28-28-1x1-128-28-28-256-0x0-1x1-1x1-0-NCHW-FP16-B=ConvAsm1x1U:1,16,2,16,1,2,1,4;ConvOclDirectFwd1x1:1,256,1,1,0,4,16,4,0
32-128-256-1x1-192-128-256-1-0x0-1x1-1x1-0-NCHW-FP16-B=ConvOclDirectFwd1x1:1,256,1,1,0,4,16,4,0
256-35-35-1x1-64-35-35-256-0x0-1x1-1x1-0-NCHW-FP16-F=ConvAsm1x1U:2,8,4,64,1,4,1,4;ConvOclDirectFwd1x1:1,128,1,1,0,1,16,8,0
6-16-16-1x1-512-16-16-4-0x0-1x1-1x1-0-NCHW-FP32-B=ConvAsm1x1U:1,8,1,64,2,1,1,4;ConvOclDirectFwd1x1:1,128,1,1,0,2,4,4,0
736-32-146-1x1-528-32-146-6-0x0-1x1-1x1-0-NCHW-FP32-B=ConvAsm1x1U:3,16,5,64,2,2,1,2;ConvOclDirectFwd1x1:1,256,1,1,0,4,16,8,0
232-7-7-1x1-232-7-7-16-0x0-1x1-1x1-0-NCHW-FP16-B=ConvAsm1x1U:1,8,2,16,1,2,4,1;ConvOclDirectFwd1x1:1,64,1,1,0,1,16,4,0
512-7-7-1x1-512-7-7-2-0x0-1x1-1x1-0-NCHW-FP16-F=ConvAsm1x1U:1,8,2,16,1,4,4,1;ConvOclDirectFwd1x1:1,64,1,1,0,1,4,8,0
256-14-14-1x1-1024-14-14-128-0x0-1x1-1x1-0-NCHW-FP32-B=ConvAsm1x1U:1,32,1,32,2,1,1,2;ConvOclDirectFwd1x1:1,64,1,1,0,2,32,4,0
128-7-7-1x1-992-7-7-512-0x0-1x1-1x1-0-NCHW-FP16-W=ConvAsmBwdWrW1x1:2,8,4,8,2,2,2,4,0,1
512-28-28-3x3-512-14-14-1-1x1-2x2-1x1-0-NCHW-FP32-F_g32=ConvOclDirectFwd:16,16,16,16,1,1,2,2,1
320-8-8-1x1-2048-8-8-16-0x0-1x1-1x1-0-NCHW-FP32-W=ConvAsmBwdWrW1x1:2,8,4,2,8,1,1,4,0,0
192-14-14-1x1-1584-14-14-16-0x0-1x1-1x1-0-NCHW-FP32-W=ConvAsmBwdWrW1x1:2,8,4,4,8,1,2,4,0,1
416-28-28-1x1-128-28-28-16-0x0-1x1-1x1-0-NCHW-FP16-F=ConvAsm1x1U:1,8,2,32,2,4,2,2;ConvOclDirectFwd1x1:1,64,1,1,0,4,16,4,0
608-67-8-1x1-992-67-8-2-0x0-1x1-1x1-0-NCHW-FP32-B=ConvAsm1x1U:3,16,3,64,1,2,4,2;ConvOclDirectFwd1x1:16,64,32,8,0,2,16,4,1
288-654-742-1x1-96-654-742-1-0x0-1x1-1x1-0-NCHW-FP32-F=ConvOclDirectFwd1x1:1,64,1,1,1,4,64,2048,0
384-35-35-3x3-384-17-17-8-0x0-2x2-1x1-0-NCHW-FP32-F=ConvOclDirectFwd:32,8,32,32,1,4,8,1,1
32-824-94-1x1-16-824-94-2-0x0-1x1-1x1-0-NCHW-FP32-W=ConvAsmBwdWrW1x1:4,4,2,1,2,1,2,4,0,3
16-28-28-5x5-32-28-28-64-2x2-1x1-1x1-0-NCHW-FP16-F=ConvOclDirectFwd:8,32,32,32,4,1,8,1,2;ConvOclDirectFwdFused:16,16,32,32,2,2,8,1,2
256-56-56-1x1-128-56-56-256-0x0-1x1-1x1-0-NCHW-FP16-F=ConvAsm1x1U:1,8,2,64,1,4,1,2;ConvOclDirectFwd1x1:1,256,1,1,0,2,32,4,0
128-14-14-3x3-192-14-14-32-1x1-1x1-1x1-0-NCHW-FP16-F=ConvOclDirectFwd:8,16,16,16,2,1,8,1,2
58-251-567-1x1-672-251-567-1-0x0-1x1-1x1-0-NCHW-FP32-F=ConvOclDirectFwd1x1:1,128,1,1,0,1,32,4,0
3-230-230-7x7-64-112-112-8-0x0-2x2-1x1-0-NCHW-FP32-F=ConvOclDirectFwd:16,8,16,16,1,2,8,1,2;ConvOclDirectFwdFused:16,8,16,16,1,2,8,1,2
512-710-44-1x1-54-710-44-1-0x0-1x1-1x1-0-NCHW-FP32-F=ConvOclDirectFwd1x1:1,256,1,1,0,4,16,8,0
672-6-501-1x1-384-6-501-128-0x0-1x1-1x1-0-NCHW-FP32-B=ConvAsm1x1U:2,32,3,64,1,1,1,1;ConvOclDirectFwd1x1:1,256,1,1,0,2,32,4,0
96-14-14-1x1-480-14-14-128-0x0-1x1-1x1-0-NCHW-FP32-B=ConvAsm1x1U:1,16,1,64,2,1,1,1;ConvOclDirectFwd1x1:1,64,1,1,0,2,32,4,0
32-64-128-1x1-512-64-128-1-0x0-1x1-1x1-0-NCHW-FP32-B=ConvOclDirectFwd1x1:1,256,1,1,0,2,16,4,0
48-35-35-5x5-64-35-35-4-2x2-1x1-1x1-0-NCHW-FP32-F=ConvOclDirectFwd:16,16,16,32,1,2,8,1,2;ConvOclDirectFwdFused:16,16,16,32,1,2,8,1,2
192-17-17-1x1-768-17-17-32-0x0-1x1-1x1-0-NCHW-FP16-W=ConvAsmBwdWrW1x1:4,4,4,4,4,1,2,2,0,1
640-73-538-1x1-992-73-538-12-0x0-1x1-1x1-0-NCHW-FP32-B=ConvOclDirectFwd1x1:1,64,1,1,0,2,32,4,0
864-154-293-1x1-1872-154-293-4-0x0-1x1-1x1-0-NCHW-FP32-B=ConvOclDirectFwd1x1:1,256,1,1,0,2,16,8,0
192-56-56-1x1-240-56-56-16-0x0-1x1-1x1-0-NCHW-FP16-B=ConvAsm1x1U:1,16,2,32,1,2,1,1;ConvOclDirectFwd1x1:1,256,1,1,0,4,16,4,0
5-10-10-3x3-3-10-10-256-1x1-1x1-1x1-0-NCHW-FP32-B=ConvOclDirectFwd:8,16,16,16,2,1,2,1,2
256-120-192-3x3-256-120-192-16-1x1-1x1-1x1-0-NCHW-FP16-F=ConvOclDirectFwd:16,16,32,32,2,2,8,2,1
128-7-7-1x1-672-7-7-32-0x0-1x1-1x1-0-NCHW-FP32-F=ConvAsm1x1U:1,8,1,64,2,4,2,4;ConvOclDirectFwd1x1:1,64,1,1,1,1,16,256,0
480-39-656-1x1-1408-39-656-12-0x0-1x1-1x1-0-NCHW-FP32-B=ConvOclDirectFwd1x1:1,64,1,1,0,2,32,4,0
1056-75-681-1x1-768-75-681-4-0x0-1x1-1x1-0-NCHW-FP32-B=ConvOclDirectFwd1x1:1,256,1,1,0,1,32,4,0
16-28-28-1x1-192-28-28-128-0x0-1x1-1x1-0-NCHW-FP32-B=ConvAsm1x1U:1,8,1,16,1,2,2,1;ConvOclDirectFwd1x1:1,256,1,1,0,2,32,4,0
128-28-28-3x3-192-28-28-16-1x1-1x1-1x1-0-NCHW-FP16-F=ConvOclDirectFwd:16,16,32,32,2,2,8,1,1;ConvOclDirectFwdFused:16,16,32,32,2,2,8,1,2
544-7-7-1x1-128-7-7-32-0x0-1x1-1x1-0-NCHW-FP16-W=ConvAsmBwdWrW1x1:2,8,2,8,2,2,2,4,0,1
352-28-28-1x1-128-28-28-64-0x0-1x1-1x1-0-NCHW-FP16-W=ConvAsmBwdWrW1x1:2,8,2,8,2,1,4,4,0,2
192-1007-53-1x1-224-1007-53-16-0x0-1x1-1x1-0-NCHW-FP32-F=ConvOclDirectFwd1x1:1,64,1,1,1,0,64,2048,0
58-56-56-1x1-24-56-56-1024-0x0-1x1-1x1-0-NCHW-FP16-W=ConvAsmBwdWrW1x1:4,4,2,2,2,1,4,4,0,1
192-28-28-1x1-288-28-28-16-0x0-1x1-1x1-0-NCHW-FP16-B=ConvAsm1x1U:1,16,2,16,1,2,2,2;ConvOclDirectFwd1x1:1,64,1,1,0,4,16,4,0
768-7-7-1x1-128-7-7-64-0x0-1x1-1x1-0-NCHW-FP16-F=ConvAsm1x1U:2,8,4,16,1,4,4,2;ConvOclDirectFwd1x1:1,64,1,1,0,1,8,4,0
112-14-14-3x3-224-14-14-16-1x1-1x1-1x1-0-NCHW-FP16-F=ConvOclDirectFwd:8,16,16,16,2,1,8,4,2;ConvOclDirectFwdFused:8,16,16,16,2,1,8,4,2
256-57-57-3x3-256-29-29-256-1x1-2x2-1x1-0-NCHW-FP32-F_g32=ConvOclDirectFwd:32,8,32,16,1,2,8,1,2
512-7-7-3x3-512-7-7-32-1x1-1x1-1x1-0-NCHW-FP16-B=ConvOclDirectFwd:8,8,8,8,1,1,4,1,2
544-14-14-1x1-128-14-14-512-0x0-1x1-1x1-0-NCHW-FP16-F=ConvAsm1x1U:2,8,4,64,1,4,1,2;ConvOclDirectFwd1x1:1,64,1,1,0,4,16,4,0
608-999-63-1x1-912-999-63-4-0x0-1x1-1x1-0-NCHW-FP32-B=ConvOclDirectFwd1x1:1,256,1,1,0,1,16,8,0
768-17-17-1x1-192-17-17-4-0x0-1x1-1x1-0-NCHW-FP32-F=ConvAsm1x1U:2,8,2,32,2,4,2,2;ConvOclDirectFwd1x1:1,64,1,1,1,0,16,256,0;ConvActivAsm1x1U:4,16,4,16,1,4
192-7-7-1x1-832-7-7-4-0x0-1x1-1x1-0-NCHW-FP32-B=ConvAsm1x1U:1,8,1,64,1,4,2,8;ConvOclDirectFwd1x1:1,256,1,1,0,1,4,8,0
128-112-112-3x3-128-112-112-128-1x1-1x1-1x1-0-NCHW-FP16-W=ConvAsmBwdWrW3x3:0,0,16,4,1,1
256-13-13-3x3-64-13-13-128-1x1-1x1-1x1-0-NCHW-FP16-B=ConvOclDirectFwd:8,8,16,16,2,2,8,4,1
480-643-32-1x1-416-643-32-6-0x0-1x1-1x1-0-NCHW-FP32-W=ConvAsmBwdWrW1x1:4,4,8,4,4,1,1,4,0,1
128-56-56-1x1-64-56-56-4-0x0-1x1-1x1-0-NCHW-FP32-B=ConvAsm1x1U:1,8,1,64,1,2,1,8;ConvOclDirectFwd1x1:1,64,1,1,0,4,4,4,0
352-174-59-1x1-116-174-59-2-0x0-1x1-1x1-0-NCHW-FP32-B=ConvAsm1x1U:4,4,4,4,1,2,1,8;ConvOclDirectFwd1x1:1,256,1,1,0,2,16,4,0
1824-135-922-1x1-448-135-922-2-0x0-1x1-1x1-0-NCHW-FP32-F=ConvOclDirectFwd1x1:1,64,1,1,1,1,16,2048,0
512-15-15-3x3-512-15-15-32-1x1-1x1-1x1-0-NCHW-FP32-B_g32=ConvOclDirectFwd:16,16,16,16,1,1,8,2,2
224-14-14-1x1-576-14-14-64-0x0-1x1-1x1-0-NCHW-FP32-W=ConvAsmBwdWrW1x1:2,8,4,4,8,1,2,4,0,1
128-14-14-3x3-32-14-14-32-1x1-1x1-1x1-0-NCHW-FP16-W=ConvAsmBwdWrW3x3:0,0,8,2,3,4
384-35-35-1x1-96-35-35-128-0x0-1x1-1x1-0-NCHW-FP16-F=ConvAsm1x1U:2,8,4,64,1,4,2,2;ConvOclDirectFwd1x1:1,256,1,1,0,1,16,4,0
832-7-7-1x1-384-7-7-4-0x0-1x1-1x1-0-NCHW-FP16-W=ConvAsmBwdWrW1x1:1,16,4,4,2,1,1,4,0,0
64-35-35-1x1-384-35-35-32-0x0-1x1-1x1-0-NCHW-FP16-B=ConvAsm1x1U:1,16,2,16,1,2,1,2;ConvOclDirectFwd1x1:1,64,1,1,0,1,32,4,0
16-469-225-1x1-608-469-225-6-0x0-1x1-1x1-0-NCHW-FP32-B=ConvOclDirectFwd1x1:1,256,1,1,0,1,32,4,0
2048-32-32-1x1-256-32-32-4-0x0-1x1-1x1-0-NCHW-FP32-F=ConvAsm1x1U:4,16,4,64,2,2,2,1;ConvOclDirectFwd1x1:1,64,1,1,1,4,16,2048,0
64-147-147-3x3-96-73-73-8-0x0-2x2-1x1-0-NCHW-FP32-F=ConvOclDirectFwd:16,16,16,16,1,1,8,2,1
672-316-568-1x1-240-316-568-1-0x0-1x1-1x1-0-NCHW-FP32-B=ConvOclDirectFwd1x1:1,256,1,1,0,4,16,4,0
192-880-137-1x1-1000-880-137-2-0x0-1x1-1x1-0-NCHW-FP32-F=ConvOclDirectFwd1x1:1,256,1,1,0,4,16,4,0
256-3-3-1x1-128-3-3-32-0x0-1x1-1x1-0-NCHW-FP32-F=ConvAsm1x1U:1,8,1,16,1,4,4,1;ConvOclDirectFwd1x1:1,64,1,1,1,0,16,64,0
2048-8-8-1x1-192-8-8-1-0x0-1x1-1x1-0-NCHW-FP16-F=ConvAsm1x1U:1,8,2,16,1,4,4,1;ConvOclDirectFwd1x1:1,128,1,1,0,2,4,4,0
800-14-14-1x1-128-14-14-16-0x0-1x1-1x1-0-NCHW-FP32-W=ConvAsmBwdWrW1x1:2,8,4,8,2,1,2,4,0,0
24-14-14-1x1-512-14-14-512-0x0-1x1-1x1-0-NCHW-FP32-B=ConvAsm1x1U:1,16,1,64,1,2,2,1;ConvOclDirectFwd1x1:1,64,1,1,0,2,32,4,0
2048-8-8-1x1-1024-15-15-2-0x0-2x2-1x1-0-NCHW-FP32-B=ConvAsm1x1U:1,8,1,64,2,4,4,2;ConvOclDirectFwd1x1:1,128,1,1,0,1,4,8,0
1024-7-7-1x1-256-14-14-4-0x0-2x2-1x1-0-NCHW-FP32-B=ConvAsm1x1U:1,8,1,64,1,4,4,2;ConvOclDirectFwd1x1:1,128,1,1,0,1,4,8,0
128-14-14-1x1-672-14-14-128-0x0-1x1-1x1-0-NCHW-FP16-B=ConvAsm1x1U:1,16,2,16,1,2,1,2;ConvOclDirectFwd1x1:1,128,1,1,0,4,16,4,0
1000-27-354-1x1-1600-27-354-6-0x0-1x1-1x1-0-NCHW-FP32-W=ConvAsmBwdWrW1x1:1,16,2,8,8,1,1,4,0,1
1024-7-7-3x3-1024-14-14-16-1x1-2x2-1x1-0-NCHW-FP32-B_g32=ConvOclDirectFwd:8,8,16,16,2,2,2,2,2
64-14-14-5x5-32-14-14-16-2x2-1x1-1x1-0-NCHW-FP16-B=ConvOclDirectFwd:8,16,16,16,2,1,2,4,2
1088-61-118-1x1-448-61-118-32-0x0-1x1-1x1-0-NCHW-FP32-F=ConvOclDirectFwd1x1:1,64,1,1,1,4,32,2048,0
352-14-14-1x1-128-14-14-256-0x0-1x1-1x1-0-NCHW-FP16-F=ConvAsm1x1U:2,8,4,64,1,4,1,4;ConvOclDirectFwd1x1:1,256,1,1,0,2,8,4,0
32-147-147-3x3-32-149-149-8-0x0-1x1-1x1-0-NCHW-FP32-B=ConvOclDirectFwd:16,16,16,32,1,2,8,4,2
80-73-73-3x3-192-71-71-4-0x0-1x1-1x1-0-NCHW-FP16-F=ConvOclDirectFwd:16,8,16,16,1,2,8,2,2;ConvOclDirectFwdFused:16,8,16,16,1,2,8,4,1
256-17-17-3x3-224-35-35-32-0x0-2x2-1x1-0-NCHW-FP32-B=ConvOclDirectFwd:16,16,16,16,1,1,4,1,2
48-27-27-3x3-192-27-27-256-1x1-1x1-1x1-0-NCHW-FP32-W=ConvAsmBwdWrW3x3:0,0,8,4,6,4
240-7-7-3x3-240-7-7-2-1x1-1x1-1x1-0-NCHW-FP16-B=ConvOclDirectFwd:8,8,8,8,1,1,1,4,2
128-28-28-1x1-448-28-28-16-0x0-1x1-1x1-0-NCHW-FP32-B=ConvAsm1x1U:1,16,1,32,2,2,1,2;ConvOclDirectFwd1x1:1,64,1,1,0,2,16,4,0
128-14-14-1x1-800-14-14-32-0x0-1x1-1x1-0-NCHW-FP32-F=ConvAsm1x1U:2,16,2,64,3,2,2,2;ConvOclDirectFwd1x1:1,64,1,1,1,0,32,256,0
512-15-15-1x1-1024-15-15-8-0x0-1x1-1x1-0-NCHW-FP32-B=ConvAsm1x1U:4,16,4,64,1,2,2,2;ConvOclDirectFwd1x1:1,256,1,1,0,1,8,4,0
3-702-169-1x1-1120-702-169-1-0x0-1x1-1x1-0-NCHW-FP32-B=ConvOclDirectFwd1x1:1,64,1,1,0,2,16,4,0
160-153-248-1x1-320-153-248-2-0x0-1x1-1x1-0-NCHW-FP32-F=ConvOclDirectFwd1x1:1,64,1,1,1,4,16,2048,0
192-7-7-1x1-832-7-7-1-0x0-1x1-1x1-0-NCHW-FP32-B=ConvAsm1x1U:1,8,1,64,1,4,4,1;ConvOclDirectFwd1x1:1,64,1,1,0,1,4,8,0
192-14-14-1x1-1296-14-14-16-0x0-1x1-1x1-0-NCHW-FP32-W=ConvAsmBwdWrW1x1:2,8,4,8,4,1,1,4,0,1
512-28-28-1x1-256-14-14-8-0x0-2x2-1x1-0-NCHW-FP32-F=ConvAsm1x1U:2,8,4,64,1,4,2,2;ConvOclDirectFwd1x1:1,64,1,1,1,1,16,256,0
3-342-333-1x1-116-342-333-1-0x0-1x1-1x1-0-NCHW-FP32-F=ConvOclDirectFwd1x1:1,256,1,1,0,1,4,4,0
800-507-212-1x1-480-507-212-1-0x0-1x1-1x1-0-NCHW-FP32-F=ConvOclDirectFwd1x1:1,64,1,1,1,0,64,2048,0
608-404-119-1x1-640-404-119-8-0x0-1x1-1x1-0-NCHW-FP32-B=ConvOclDirectFwd1x1:1,128,1,1,0,2,32,4,0
384-13-13-3x3-192-13-13-512-1x1-1x1-1x1-0-NCHW-FP16-W=ConvAsmBwdWrW3x3:0,0,8,4,3,1
8-97-162-1x1-704-97-162-2-0x0-1x1-1x1-0-NCHW-FP32-B=ConvOclDirectFwd1x1:1,256,1,1,0,1,4,8,0
2048-7-7-1x1-1024-7-7-16-0x0-1x1-1x1-0-NCHW-FP32-W=ConvAsmBwdWrW1x1:1,16,4,4,8,1,1,4,0,1
128-27-27-1x1-32-27-27-32-0x0-1x1-1x1-0-NCHW-FP16-F=ConvAsm1x1U:1,8,2,32,1,4,2,4;ConvOclDirectFwd1x1:1,64,1,1,0,1,16,8,0
48-14-14-5x5-16-14-14-64-2x2-1x1-1x1-0-NCHW-FP16-B=ConvOclDirectFwd:16,8,16,16,1,2,4,1,2
256-17-17-1x1-1024-17-17-128-0x0-1x1-1x1-0-NCHW-FP32-W=ConvAsmBwdWrW1x1:2,8,4,4,8,1,1,4,0,1
1312-531-89-1x1-1000-531-89-4-0x0-1x1-1x1-0-NCHW-FP32-F=ConvOclDirectFwd1x1:1,256,1,1,0,1,16,4,0
128-14-14-1x1-528-14-14-64-0x0-1x1-1x1-0-NCHW-FP16-B=ConvAsm1x1U:1,16,2,16,1,2,2,2;ConvOclDirectFwd1x1:1,64,1,1,0,4,8,4,0
384-13-13-3x3-256-13-13-64-1x1-1x1-1x1-0-NCHW-FP16-W=ConvAsmBwdWrW3x3:0,0,8,4,4,1
512-14-14-1x1-128-28-28-1-0x0-2x2-1x1-0-NCHW-FP32-B=ConvAsm1x1U:1,8,1,32,1,4,4,1;ConvOclDirectFwd1x1:1,128,1,1,0,1,8,4,0
240-7-7-3x3-240-7-7-1-1x1-1x1-1x1-0-NCHW-FP16-F=ConvOclDirectFwd:8,8,8,8,1,1,1,4,1
240-7-7-1x1-960-7-7-512-0x0-1x1-1x1-0-NCHW-FP16-F_g3=ConvOclDirectFwd:8,8,8,8,1,1,8,2,1
128-7-7-1x1-832-7-7-64-0x0-1x1-1x1-0-NCHW-FP16-W=ConvAsmBwdWrW1x1:1,16,4,4,4,1,2,2,0,3
128-28-28-1x1-416-28-28-64-0x0-1x1-1x1-0-NCHW-FP16-F=ConvAsm1x1U:1,8,2,16,2,4,1,4;ConvOclDirectFwd1x1:1,256,1,1,0,4,16,4,0
288-35-35-1x1-48-35-35-128-0x0-1x1-1x1-0-NCHW-FP32-F=ConvAsm1x1U:3,16,5,64,1,2,1,1;ConvOclDirectFwd1x1:1,64,1,1,1,0,32,2048,0;ConvActivAsm1x1U:3,16,3,32,2,1
